,no,sticky,closed,now,name,sub,com,filename,ext,w,h,tn_w,tn_h,tim,time,md5,fsize,resto,capcode,semantic_url,custom_spoiler,replies,images,last_modified,bumplimit,imagelimit,omitted_posts,omitted_images,last_replies,spoiler
104,9476119,,,12/08/22(Thu)11:57:38,Anonymous,,"Can this be disputed? As much as I love A Link to the Past, I find myself rushing through the dungeons so I can get back to the more interesting overworld. The Lost Woods, Kakariko Village, the Dark World... Everything in that game feels like an adventure until I have to get through a dungeon. Then it just feels like I&#039;m back in a video game.<br><br>Meanwhile, people STILL shit on Ocarina of Time for reasons I can&#039;t understand (too much hype I guess?) but the dungeons in that game feel like extensions to the overworld. When I enter a dungeon in OoT, I still feel like it&#039;s connected to Hyrule.<br><br>I also don&#039;t understand how people can dislike BotW for having samey looking shrines but still praise aLttP for it&#039;s homogenized and sterile dungeons. But that isn&#039;t a /vr/ discussion.<br><br>Thoughts? Does anyone else feel this way or am I just too autistic?",alttp_vs_oot,.png,1369,2207,155,250,1670518658137612,1670518658,kN82UE1Lup8dFSQZPtccIw==,2015389,0,,can-this-be-disputed-as-much-as-i-love-a-link-to,2,51,7,1670732220,0.0,0.0,46.0,5.0,"[{'no': 9481080, 'now': '12/10/22(Sat)13:28:18', 'name': 'Anonymous', 'com': '<a href=""#p9476119"" class=""quotelink"">&gt;&gt;9476119</a><br>I have never played a Zelda game with fun dungeon designs. The first few are always usually fine, but the later the dungeon appears in the game, the more likely it is to just drag on and be totally boring.<br><br>The overworld was always where the real fun happened, for me.', 'time': 1670696898, 'resto': 9476119}, {'no': 9481513, 'now': '12/10/22(Sat)16:42:05', 'name': 'Anonymous', 'com': '<a href=""#p9476178"" class=""quotelink"">&gt;&gt;9476178</a>', 'filename': 'ah i see', 'ext': '.jpg', 'w': 1024, 'h': 576, 'tn_w': 125, 'tn_h': 70, 'tim': 1670708525591023, 'time': 1670708525, 'md5': '//nVuRequtPBvXTcpAuohQ==', 'fsize': 166052, 'resto': 9476119}, {'no': 9481542, 'now': '12/10/22(Sat)16:57:00', 'name': 'Anonymous', 'com': '<a href=""#p9476124"" class=""quotelink"">&gt;&gt;9476124</a><br>Link’s Awakening had pretty diverse dungeon themes.', 'filename': 'A5DA9A5E-E3D6-4447-9319-ACBC8D55C9D8', 'ext': '.jpg', 'w': 1169, 'h': 774, 'tn_w': 125, 'tn_h': 82, 'tim': 1670709420815049, 'time': 1670709420, 'md5': 'i67ZIT4pGakkA0dfeyz5oQ==', 'fsize': 522778, 'resto': 9476119}, {'no': 9481556, 'now': '12/10/22(Sat)17:05:10', 'name': 'Anonymous', 'com': '<a href=""#p9476197"" class=""quotelink"">&gt;&gt;9476197</a><br>Agreed, they need to stay in their own boards.', 'time': 1670709910, 'resto': 9476119}, {'no': 9482339, 'now': '12/10/22(Sat)23:17:00', 'name': 'Anonymous', 'com': '<a href=""#p9479015"" class=""quotelink"">&gt;&gt;9479015</a><br>Hardly. Those are just obstacles, they have nothing to do with the overall visual appeal of the dungeons.', 'time': 1670732220, 'resto': 9476119}]",
105,9480820,,,12/10/22(Sat)11:11:26,Anonymous,,When did you realized all good racing games were created with steering wheel in mind?<br>https://en.wikipedia.org/wiki/List_<wbr>of_Logitech_Racing_Wheels_compatibl<wbr>e_games,MC2_DC,.jpg,780,492,250,157,1670688686004897,1670688686,fpoI37Q1At6/VVJyBrpUDg==,165007,0,,when-did-you-realized-all-good-racing-games-were,2,29,4,1670732206,0.0,0.0,24.0,2.0,"[{'no': 9480962, 'now': '12/10/22(Sat)12:27:09', 'name': 'Anonymous', 'com': '<a href=""#p9480935"" class=""quotelink"">&gt;&gt;9480935</a><br><span class=""quote"">&gt;steering wheel</span><br><span class=""quote"">&gt;what racing games uses a steering wheel</span><br><span class=""quote"">&gt;cars and boats</span><br><span class=""quote"">&gt;post hang on</span><br><span class=""quote"">&gt;other guy post bike controller</span><br><span class=""quote"">&gt;you complain</span><br>Idk you sound retarded to me, also I&#039;m pretty sure a wheel is better for hang on than a shitty dpad', 'time': 1670693229, 'resto': 9480820}, {'no': 9480965, 'now': '12/10/22(Sat)12:27:40', 'name': 'Anonymous', 'com': '<a href=""#p9480820"" class=""quotelink"">&gt;&gt;9480820</a><br>The only good racing games are F Zero and Burnout 3 and they weren&#039;t. You are talking about boring sims for brainlets who are too dumb to make a loicense so they actually believe cars control like in their shitty Gran Turismo game', 'time': 1670693260, 'resto': 9480820}, {'no': 9481101, 'now': '12/10/22(Sat)13:37:59', 'name': 'Anonymous', 'com': '<a href=""#p9480965"" class=""quotelink"">&gt;&gt;9480965</a><br><span class=""quote"">&gt;You are talking about boring sims for brainlets who are too dumb to make a loicense so they actually believe cars control like in their shitty Gran Turismo game</span><br>nice cope', 'filename': 'images(19)', 'ext': '.jpg', 'w': 225, 'h': 225, 'tn_w': 125, 'tn_h': 125, 'tim': 1670697479163915, 'time': 1670697479, 'md5': 'CORVj/el6E1MeMQRrtA0sA==', 'fsize': 10210, 'resto': 9480820, 'spoiler': 1}, {'no': 9481202, 'now': '12/10/22(Sat)14:33:57', 'name': 'Anonymous', 'com': '<a href=""#p9480965"" class=""quotelink"">&gt;&gt;9480965</a><br>does this look like a sim to you?', 'filename': 'ridge racer v', 'ext': '.jpg', 'w': 279, 'h': 318, 'tn_w': 109, 'tn_h': 125, 'tim': 1670700837522670, 'time': 1670700837, 'md5': 'J2bZEJQUgpHSwoKPVdpBEg==', 'fsize': 70070, 'resto': 9480820}, {'no': 9482337, 'now': '12/10/22(Sat)23:16:46', 'name': 'Anonymous', 'com': '<a href=""#p9480820"" class=""quotelink"">&gt;&gt;9480820</a><br>Early 70&#039;s', 'time': 1670732206, 'resto': 9480820}]",
106,9481153,,,12/10/22(Sat)14:08:47,Anonymous,,Picasso himself couldn&#039;t have painted a more beautiful scene.,thing,.jpg,4096,3072,250,187,1670699327651243,1670699327,r6H8xy57pBQ26KWBK0I3uA==,1552280,0,,picasso-himself-couldnt-have-painted-a-more,2,33,2,1670732168,0.0,0.0,28.0,2.0,"[{'no': 9482190, 'now': '12/10/22(Sat)22:29:08', 'name': 'Anonymous', 'com': '<a href=""#p9481153"" class=""quotelink"">&gt;&gt;9481153</a><br>Picasso didn&#039;t paint beautiful scenes you retarded faggot.', 'time': 1670729348, 'resto': 9481153}, {'no': 9482217, 'now': '12/10/22(Sat)22:40:50', 'name': 'Anonymous', 'com': '<a href=""#p9482190"" class=""quotelink"">&gt;&gt;9482190</a><br>I hope the joke flew over your head and you aren&#039;t this painfully autistic all the time.', 'time': 1670730050, 'resto': 9481153}, {'no': 9482268, 'now': '12/10/22(Sat)23:01:16', 'name': 'Anonymous', 'com': '<a href=""#p9482217"" class=""quotelink"">&gt;&gt;9482217</a><br><span class=""quote"">&gt;I hope the joke flew over your head</span><br>If you&#039;re going to make a reference for your &quot;joke&quot; make sure the reference works at all, you fat goon.', 'time': 1670731276, 'resto': 9481153}, {'no': 9482297, 'now': '12/10/22(Sat)23:08:08', 'name': 'Anonymous', 'com': '<a href=""#p9482268"" class=""quotelink"">&gt;&gt;9482268</a><br>bruh the fact that it doesn&#039;t work makes it even funnier, i dont care if it was intentional or not', 'time': 1670731688, 'resto': 9481153}, {'no': 9482331, 'now': '12/10/22(Sat)23:16:08', 'name': 'Anonymous', 'com': '<a href=""#p9481672"" class=""quotelink"">&gt;&gt;9481672</a><br>Yeah, even as somebody who grew up with the original GameBoy and still uses that as his preferred system, DKL is borderline unplayable on it. Honestly I can&#039;t imagine trying to seriously play it on anything but a Super GameBoy, but then what&#039;s the point? A friend of mine had it back in the day and apparently played it on the GB, so I guess when you have limited options, you find a way.', 'time': 1670732168, 'resto': 9481153}]",
107,9472720,,,12/07/22(Wed)01:21:58,Anonymous,,Does any decent shmup have more levels and power-ups than Tyrian?<br><br>I can&#039;t think of any and most of the top ones have a very limited selection of levels.,tyrian,.png,1440,900,250,156,1670394118008387,1670394118,R36DYjzL2DxKbFE843GZwQ==,207689,0,,does-any-decent-shmup-have-more-levels-and,2,21,0,1670731570,0.0,0.0,16.0,0.0,"[{'no': 9478591, 'now': '12/09/22(Fri)12:13:55', 'name': 'Anonymous', 'com': 'Bump', 'time': 1670606035, 'resto': 9472720}, {'no': 9478670, 'now': '12/09/22(Fri)12:51:40', 'name': 'Anonymous', 'com': 'I remember downloading opentyrian on Wii about 11 years ago and not really understanding the appeal. There weren&#039;t many enemies and the game was pretty easy. I remember there being chat logs or something, so I figured since it was easy and had plot that it was for RPG snorefest lovers rather than for arcade gamers.', 'time': 1670608300, 'resto': 9472720}, {'no': 9480014, 'now': '12/09/22(Fri)23:58:32', 'name': 'Anonymous', 'com': '<a href=""#p9478670"" class=""quotelink"">&gt;&gt;9478670</a><br><br>You just masturbate too much. Try toning it down to maybe once every 2-3 days.', 'time': 1670648312, 'resto': 9472720}, {'no': 9480505, 'now': '12/10/22(Sat)07:00:42', 'name': 'Anonymous', 'com': '<a href=""#p9478670"" class=""quotelink"">&gt;&gt;9478670</a><br>Stick to danmakushit.', 'time': 1670673642, 'resto': 9472720}, {'no': 9482286, 'now': '12/10/22(Sat)23:06:10', 'name': 'Anonymous', 'com': '<a href=""#p9478670"" class=""quotelink"">&gt;&gt;9478670</a><br><span class=""quote"">&gt;rather than for arcade gamers.</span><br>Gee maybe you should have played the very clearly labelled Arcade Mode if you were looking for arcade gameplay, you git.', 'time': 1670731570, 'resto': 9472720}]",
108,9481754,,,12/10/22(Sat)19:11:06,Anonymous,,"It&#039;s great, actually.",Earthworm_Jim_3D_N64,.jpg,372,266,249,178,1670717466328847,1670717466,pV7KUXErRH5KkV1UXzIGvw==,40040,0,,its-great-actually,2,14,1,1670729047,0.0,0.0,9.0,1.0,"[{'no': 9482058, 'now': '12/10/22(Sat)21:35:48', 'name': 'Anonymous', 'com': '<a href=""#p9481964"" class=""quotelink"">&gt;&gt;9481964</a><br>The scenario is neat, but it&#039;s just a poorly made product.<br>It doesn&#039;t technically impress in any regard, and it&#039;s notorious for having &quot;pork boarding&quot; in place of proper boss fights.<br><br>On the N64 version, I&#039;m pretty sure the game had a huge oversight with the saving system, where you save manually, the game tells you it&#039;s done, but saving is still taking place.<br>This would lead to people turning off the system mid-save and losing all their progress.', 'time': 1670726148, 'resto': 9481754}, {'no': 9482060, 'now': '12/10/22(Sat)21:36:07', 'name': 'Anonymous', 'com': '<a href=""#p9481964"" class=""quotelink"">&gt;&gt;9481964</a><br>Much like Superman 64, actually playing it for an hour will make you understand perfectly well why it&#039;s so bad without us having to tell you.', 'time': 1670726167, 'resto': 9481754}, {'no': 9482146, 'now': '12/10/22(Sat)22:14:48', 'name': 'Anonymous', 'com': '<a href=""#p9481754"" class=""quotelink"">&gt;&gt;9481754</a><br>this game has been completely memory holed from my life. i thought this was a shitpost. i had no idea this game existed and im not sure how i went thru life without ever seeing or hearing about it until now. for what its worth i only played the first game on the snes', 'time': 1670728488, 'resto': 9481754}, {'no': 9482163, 'now': '12/10/22(Sat)22:19:57', 'name': 'Anonymous', 'com': '<a href=""#p9481754"" class=""quotelink"">&gt;&gt;9481754</a><br>up is down and black is white am i channer yet call me based<br>based for the win', 'time': 1670728797, 'resto': 9481754}, {'no': 9482180, 'now': '12/10/22(Sat)22:24:07', 'name': 'Anonymous', 'com': '<a href=""#p9481754"" class=""quotelink"">&gt;&gt;9481754</a><br>Idk about great I&#039;d call it pretty good. Like a 6.5 out of ten.', 'time': 1670729047, 'resto': 9481754}]",
109,9479821,,,12/09/22(Fri)22:32:29,Anonymous,,How do you interpret World 5 in Super Mario Bros? Is it a snow level?,CD948C0D-67D8-4FBB-A0CC-4A7E1BBB66C0,.png,256,224,250,218,1670643149744640,1670643149,1Sr7Z8uNLEL4amKOYsFTIQ==,51843,0,,how-do-you-interpret-world-5-in-super-mario-bros,2,31,8,1670728022,0.0,0.0,26.0,6.0,"[{'no': 9481713, 'now': '12/10/22(Sat)18:47:17', 'name': 'Anonymous', 'com': '<a href=""#p9479821"" class=""quotelink"">&gt;&gt;9479821</a><br><span class=""quote"">&gt;Is it a snow level?</span><br>no, it&#039;s just white themed', 'time': 1670716037, 'resto': 9479821}, {'no': 9481736, 'now': '12/10/22(Sat)18:59:04', 'name': 'Anonymous', 'com': '<a href=""#p9479884"" class=""quotelink"">&gt;&gt;9479884</a><br>/thread', 'time': 1670716744, 'resto': 9479821}, {'no': 9481748, 'now': '12/10/22(Sat)19:06:25', 'name': 'Anonymous', 'com': 'What about the ground block? How am I supposed to see this?', 'filename': '82f97e33624310f', 'ext': '.png', 'w': 1200, 'h': 1200, 'tn_w': 125, 'tn_h': 125, 'tim': 1670717185207139, 'time': 1670717185, 'md5': 'fOGVv0IN2la8dbVDB8iKdA==', 'fsize': 8846, 'resto': 9479821}, {'no': 9481787, 'now': '12/10/22(Sat)19:22:30', 'name': 'Anonymous', 'com': '<a href=""#p9480342"" class=""quotelink"">&gt;&gt;9480342</a><br><a href=""#p9481512"" class=""quotelink"">&gt;&gt;9481512</a><br>best /vr/ meme by a mile', 'time': 1670718150, 'resto': 9479821}, {'no': 9482132, 'now': '12/10/22(Sat)22:07:02', 'name': 'Anonymous', 'com': '<a href=""#p9481748"" class=""quotelink"">&gt;&gt;9481748</a><br>?', 'filename': 'hadrians-wall', 'ext': '.jpg', 'w': 1440, 'h': 612, 'tn_w': 125, 'tn_h': 53, 'tim': 1670728022621239, 'time': 1670728022, 'md5': 'NOYPva+lJOgThEWcvG/bmQ==', 'fsize': 281779, 'resto': 9479821}]",
110,9479841,,,12/09/22(Fri)22:43:51,Anonymous,,Started playing this on PC recently. I really don&#039;t understand why so many love it. Found it very un-fun.,306_front,.jpg,640,640,250,250,1670643831053512,1670643831,+teg+N34mYNObiHkTcl+Rw==,64890,0,,started-playing-this-on-pc-recently-i-really-dont,2,21,1,1670727870,0.0,0.0,16.0,1.0,"[{'no': 9480834, 'now': '12/10/22(Sat)11:16:49', 'name': 'Anonymous', 'com': '<a href=""#p9480431"" class=""quotelink"">&gt;&gt;9480431</a><br>I think it&#039;s about how the game looks like a platformer on the outside, but the controls are way more complicated for that and it&#039;s more like a 2d action with a lot of puzzle elements that require careful thinking (guiding mudokons to portal can be a pain).<br>So you either get an enjoyment from that kind of gameplay or you don&#039;t.<br><br>It is like olives.', 'time': 1670689009, 'resto': 9479841}, {'no': 9480859, 'now': '12/10/22(Sat)11:30:08', 'name': 'Anonymous', 'com': '<a href=""#p9479841"" class=""quotelink"">&gt;&gt;9479841</a><br>me too, the game looks and plays like shit, I don&#039;t understand', 'time': 1670689808, 'resto': 9479841}, {'no': 9481184, 'now': '12/10/22(Sat)14:27:37', 'name': 'Anonymous', 'com': '<a href=""#p9480557"" class=""quotelink"">&gt;&gt;9480557</a><br><span class=""quote"">&gt;worth looking into</span><br>No. You do play as two different characters, but the game is rushed, janky, of incohesive tone, and full of tedium. There are a few fans on this board that pop up from time to time, but in my opinion the delivery falls so short of what it could have been on paper that it&#039;s genuinely not worth experiencing.<br>I didn&#039;t finish Stranger&#039;s Wrath, but I guess if it really clicks with you then it could be worth it? It was very boring. To me, the first two games are all I need and will ever play.', 'time': 1670700457, 'resto': 9479841}, {'no': 9481247, 'now': '12/10/22(Sat)14:53:25', 'name': 'Anonymous', 'com': 'This is one of my favorite games of all time, but I can definitely see why people could play the game and hate it. It looks like a platformer, but it really isnt (and fuck the term &quot;Cinematic Platformer&quot;).<br>The movement in the game is strict and consistent and the world is a grid, I try to think of Abe as a chess piece and saving mudokons is a puzzle. When you die, since you start right at the puzzle you were at, it doesnt feel like a death or a game over, it feels like you failed the puzzle and you need to try something different.<br><br><a href=""#p9480557"" class=""quotelink"">&gt;&gt;9480557</a><br>I played MO and SW around the same time when they came to PC and MO felt like a bad take of the Abe games in 3D. It&#039;s not really bad though, just clearly not as good as the Abe games. Stranger&#039;s Wrath though was great, clearly a different genre but atmosphere vibe was so faithful.', 'time': 1670702005, 'resto': 9479841}, {'no': 9482126, 'now': '12/10/22(Sat)22:04:30', 'name': 'Anonymous', 'com': '<a href=""#p9480821"" class=""quotelink"">&gt;&gt;9480821</a><br><span class=""quote"">&gt;So you can&#039;t go against it or you&#039;ll be punished</span><br>Rightly so<br><span class=""quote"">&gt;I didn&#039;t like it too by the way</span><br>God damn it', 'time': 1670727870, 'resto': 9479841}]",
111,9481637,,,12/10/22(Sat)18:02:49,Anonymous,,Post retro locations you&#039;d sleep in.,R,.png,256,224,250,218,1670713369703842,1670713369,Ex5inPLFe50j+UB0M13Hcw==,19543,0,,post-retro-locations-youd-sleep-in,2,14,13,1670727462,0.0,0.0,9.0,8.0,"[{'no': 9482008, 'now': '12/10/22(Sat)21:10:02', 'name': 'Anonymous', 'com': '<a href=""#p9481637"" class=""quotelink"">&gt;&gt;9481637</a>', 'filename': 'summer', 'ext': '.jpg', 'w': 637, 'h': 358, 'tn_w': 125, 'tn_h': 70, 'tim': 1670724602574936, 'time': 1670724602, 'md5': 'VkS4r3ILehqRhXVlKD0wIQ==', 'fsize': 47804, 'resto': 9481637}, {'no': 9482009, 'now': '12/10/22(Sat)21:10:42', 'name': 'Anonymous', 'filename': '2LY7npx', 'ext': '.png', 'w': 1552, 'h': 840, 'tn_w': 125, 'tn_h': 67, 'tim': 1670724642919033, 'time': 1670724642, 'md5': '+bVEqKFz3w/uTgkP5INEbQ==', 'fsize': 3668410, 'resto': 9481637}, {'no': 9482086, 'now': '12/10/22(Sat)21:48:31', 'name': 'Anonymous', 'com': '<a href=""#p9481637"" class=""quotelink"">&gt;&gt;9481637</a><br>Based and NCS pilled', 'filename': '1666942475462641', 'ext': '.png', 'w': 480, 'h': 480, 'tn_w': 125, 'tn_h': 125, 'tim': 1670726911633862, 'time': 1670726911, 'md5': 'doiqJ16QmdINfmnxxNah7A==', 'fsize': 104176, 'resto': 9481637}, {'no': 9482093, 'now': '12/10/22(Sat)21:51:11', 'name': 'Anonymous', 'com': 'I would dream of everyone walking past me while saying their one-liners.', 'filename': 'full20040618051250', 'ext': '.jpg', 'w': 640, 'h': 480, 'tn_w': 125, 'tn_h': 93, 'tim': 1670727071605924, 'time': 1670727071, 'md5': '+uE1as5crnw36I4QuE+KOg==', 'fsize': 111121, 'resto': 9481637}, {'no': 9482112, 'now': '12/10/22(Sat)21:57:42', 'name': 'Anonymous', 'com': 'I don&#039;t know why but this cave that you&#039;re only in for like a minute with comparatively aggressive bgm is one of the comfiest places in Earthbound.', 'filename': 'cavetothepast', 'ext': '.png', 'w': 768, 'h': 512, 'tn_w': 125, 'tn_h': 83, 'tim': 1670727462925156, 'time': 1670727462, 'md5': 'qC5yplujMFFssmn9DAcjlg==', 'fsize': 56038, 'resto': 9481637}]",
112,9481770,,,12/10/22(Sat)19:16:34,Anonymous,Spy Fox,"<span class=""quote"">&gt;Mogs all scott-formers</span><br><span class=""quote"">&gt;isn&#039;t even a scott-former</span><br><br>It seems my superiority has caused a bit of controversy.",Agent_Spy_Fox,.png,261,370,176,250,1670717794152825,1670717794,k3w4qhe8GxaAgwqFzWe9YQ==,12434,0,,spy-fox,2,4,0,1670723907,0.0,0.0,,,"[{'no': 9481778, 'now': '12/10/22(Sat)19:19:20', 'name': 'Anonymous', 'com': '<a href=""#p9481770"" class=""quotelink"">&gt;&gt;9481770</a><br>I remember getting this game in my cereal box', 'time': 1670717960, 'resto': 9481770}, {'no': 9481834, 'now': '12/10/22(Sat)19:37:26', 'name': 'Anonymous', 'com': '<a href=""#p9481770"" class=""quotelink"">&gt;&gt;9481770</a><br><span class=""quote"">&gt;scott-formers</span><br>Stopped reading there, zoomer.', 'time': 1670719046, 'resto': 9481770}, {'no': 9481898, 'now': '12/10/22(Sat)20:06:24', 'name': 'Anonymous', 'com': '<a href=""#p9481770"" class=""quotelink"">&gt;&gt;9481770</a><br>Completely forgot about this game series, OP. Also had no idea they were all available on STEAM. Booting Dry Cereal up right now and re-experiencing my forgotten childhood. Thanks.<br><br>Note to self, today OP was not a faggot.', 'time': 1670720784, 'resto': 9481770}, {'no': 9481986, 'now': '12/10/22(Sat)20:58:27', 'name': 'Anonymous', 'com': 'Spy Fox is okay, but both Pajama Sam and Putt-Putt are clearly superior.', 'time': 1670723907, 'resto': 9481770}]",
113,9481984,,,12/10/22(Sat)20:58:01,Anonymous,,"Did anyone else play this? I was really impressed with the size of the maps back in the day, and the variety of baits and stuff. The music when you got a fish on the hook was really good too. It was a really awesome feeling to catch huge catfish. IDK I just thought about this game for the first time in like 20 years.<br><br>I have good memories of it, but somehow I don&#039;t think I&#039;d find it fun to play now. Do you guys think that way about things too?",Championship_Bass_2000_PC_cover,.jpg,288,347,207,250,1670723881439574,1670723881,wzvu5TdIXrOSYQl9RwAKVA==,55787,0,,did-anyone-else-play-this-i-was-really-impressed,2,0,0,1670723881,0.0,0.0,,,,
114,9478565,,,12/09/22(Fri)11:54:43,Anonymous,What are the best Game Boy games?,"One anon recommended Donkey Kong for the Game Boy and I&#039;m shocked that I never played this game. It&#039;s probably the the coolest game I never played before. I mean I didn&#039;t exactly buy my own games as a kid and only had Tetris, Yoshi&#039;s Cookie, Fortress of Doom, and Robocop. So anyway, I was wondering what else I missed out on. Tell me anons, what are the best Game Boy games?",Donkey _Kong,.jpg,1200,1200,250,250,1670604883356919,1670604883,RtVjF5puXLwvjLMqKElVJQ==,310574,0,,what-are-the-best-game-boy-games,2,93,11,1670723428,0.0,0.0,88.0,10.0,"[{'no': 9481957, 'now': '12/10/22(Sat)20:43:29', 'name': 'Anonymous', 'com': '<a href=""#p9481956"" class=""quotelink"">&gt;&gt;9481956</a><br>forgot the pic my bad', 'filename': 'Game_Boy_Spanky&#039;s_Quest_cover_art', 'ext': '.jpg', 'w': 315, 'h': 316, 'tn_w': 124, 'tn_h': 125, 'tim': 1670723009582928, 'time': 1670723009, 'md5': 'DsJMhccFj9AxUQpNebAWTg==', 'fsize': 73352, 'resto': 9478565}, {'no': 9481961, 'now': '12/10/22(Sat)20:47:27', 'name': 'Anonymous', 'com': '<a href=""#p9481957"" class=""quotelink"">&gt;&gt;9481957</a><br>A monkey named Spanky. Hmmmm.', 'time': 1670723247, 'resto': 9478565}, {'no': 9481965, 'now': '12/10/22(Sat)20:49:43', 'name': 'Anonymous', 'com': '<a href=""#p9479556"" class=""quotelink"">&gt;&gt;9479556</a><br>First rewind before', 'time': 1670723383, 'resto': 9478565}, {'no': 9481967, 'now': '12/10/22(Sat)20:49:43', 'name': 'Anonymous', 'com': '<a href=""#p9479651"" class=""quotelink"">&gt;&gt;9479651</a><br>Pokemon Pinball had really shitty physics, others were good however', 'time': 1670723383, 'resto': 9478565}, {'no': 9481970, 'now': '12/10/22(Sat)20:50:28', 'name': 'Anonymous', 'com': '<a href=""#p9479556"" class=""quotelink"">&gt;&gt;9479556</a><br>based', 'time': 1670723428, 'resto': 9478565}]",
115,9476585,,,12/08/22(Thu)15:13:51,Anonymous,,"<span class=""quote"">&gt;Be naturally a better driver, drive well, the game gives you better cars you don&#039;t need</span><br><span class=""quote"">&gt;Be a worse driver, you need better cars, get given shit cars instead</span><br>Is this good difficulty design?",shitty US cover,.jpg,316,316,250,250,1670530431824126,1670530431,EROWSiOsUcbLlYLe9dHJ2A==,22331,0,,be-naturally-a-better-driver-drive-well-the-game,2,34,1,1670723398,0.0,0.0,29.0,1.0,"[{'no': 9479541, 'now': '12/09/22(Fri)20:09:40', 'name': 'Anonymous', 'com': '<a href=""#p9479513"" class=""quotelink"">&gt;&gt;9479513</a><br><span class=""quote"">&gt;not JogCon</span><br>ngmi', 'time': 1670634580, 'resto': 9476585}, {'no': 9479830, 'now': '12/09/22(Fri)22:35:37', 'name': 'Anonymous', 'com': '<a href=""#p9479541"" class=""quotelink"">&gt;&gt;9479541</a><br>More like JobCon', 'time': 1670643337, 'resto': 9476585}, {'no': 9480583, 'now': '12/10/22(Sat)08:15:57', 'name': 'Anonymous', 'com': '<a href=""#p9476585"" class=""quotelink"">&gt;&gt;9476585</a><br><a href=""#p9476815"" class=""quotelink"">&gt;&gt;9476815</a><br>Should be noted that this game encourages sandbagging as replayability.', 'time': 1670678157, 'resto': 9476585}, {'no': 9481645, 'now': '12/10/22(Sat)18:05:31', 'name': 'Anonymous', 'com': 'What is your favourite RR drifting mechanic?<br>I like Rage Racer&#039;s the best, but that might be because the tracks are so curvy so you have to constantly steer precisely and shift gears.', 'time': 1670713531, 'resto': 9476585}, {'no': 9481969, 'now': '12/10/22(Sat)20:49:58', 'name': 'Anonymous', 'com': '<a href=""#p9481645"" class=""quotelink"">&gt;&gt;9481645</a><br>yeah rage racer definitely. although, if I want to turn my brain off and just smoothly scoot around with no effort needed the PSP RRs are pretty darn fun, feels very satisfying, quite a lot like outrun 2006', 'time': 1670723398, 'resto': 9476585}]",
116,9481696,,,12/10/22(Sat)18:35:42,Anonymous,GAME PLAYER&#039;S,anybody else watch these?,20180419_190400 (1)~2,.jpg,1836,3264,140,250,1670715342422918,1670715342,15TpUcZJskILfgHxH2Y1eQ==,980134,0,,game-players,2,3,0,1670721662,0.0,0.0,,,"[{'no': 9481704, 'now': '12/10/22(Sat)18:38:37', 'name': 'Anonymous', 'com': '<a href=""#p9481696"" class=""quotelink"">&gt;&gt;9481696</a><br>I don&#039;t have a working video player anymore', 'time': 1670715517, 'resto': 9481696}, {'no': 9481775, 'now': '12/10/22(Sat)19:19:07', 'name': 'Anonymous', 'com': '<span class=""quote"">&gt;Amagon</span><br>When even the strategy video has to turn on slow-motion for half the game, you know you&#039;re in for a good time', 'time': 1670717947, 'resto': 9481696}, {'no': 9481923, 'now': '12/10/22(Sat)20:21:02', 'name': 'Anonymous', 'com': 'God, I had that same carpet growing up.', 'time': 1670721662, 'resto': 9481696}]",
