,no,sticky,closed,now,name,sub,com,filename,ext,w,h,tn_w,tn_h,tim,time,md5,fsize,resto,capcode,semantic_url,custom_spoiler,replies,images,last_modified,bumplimit,imagelimit,omitted_posts,omitted_images,last_replies,spoiler
0,6775606,1.0,1.0,08/28/20(Fri)17:18:11,Anonymous,↑↑↓↓←→←→ BA START,"This board is for the discussion of classic, or &quot;retro&quot; games, including consoles, computer games, arcade games (including pinball) and any other forms of video games. Retro gaming means platforms launched in 2001 and earlier, and official game titles for those platforms released no later than December 2007 (homebrew console games made after this date will be permitted). The Microsoft Xbox, Nintendo GameCube, Nintendo Game Boy Advance, and Sony PlayStation 2 will now be considered &quot;retro&quot;.<br>
<br>
Helpful links:<br>
<a href=""http://www.gametechwiki.com/w/index.php/Main_Page"">Game Tech Wiki</a><br>
<a href=""http://emulation.gametechwiki.com/index.php/Main_Page"">Emulation General Wiki</a>",triforce,.gif,500,500,250,250,1598649491766,1598649491,oPCCxV7bIDrKq9PIJHgP6Q==,104115,0,mod,ba-start,2,0,0,1598649499,,,,,,
1,9480774,,,12/10/22(Sat)10:48:13,Anonymous,Mega Man,"Be honest /vr/, did it filter you?",MV5BZWMyYzFjYTYtNTRjYi00OGExLWE2YzgtOGRmYjAxZTU3NzBiXkEyXkFqcGdeQXVyMzQ0MzA0NTM@._V1_FMjpg_UX1000_,.jpg,1600,800,250,125,1670687293256473,1670687293,L6TmKjgYDUj+NUsdPRaMhw==,265425,0,,mega-man,2,30,2,1670760830,0.0,0.0,25.0,2.0,"[{'no': 9483035, 'now': '12/11/22(Sun)05:47:16', 'name': 'Anonymous', 'com': '<a href=""#p9481125"" class=""quotelink"">&gt;&gt;9481125</a><br>Impossible with mega man lol, I’ve never even tried playing as Bass. Megaman has to be easier if you are used to playing mega man', 'time': 1670755636, 'resto': 9480774}, {'no': 9483036, 'now': '12/11/22(Sun)05:48:17', 'name': 'Anonymous', 'com': '<a href=""#p9481158"" class=""quotelink"">&gt;&gt;9481158</a><br>Based', 'time': 1670755697, 'resto': 9480774}, {'no': 9483101, 'now': '12/11/22(Sun)06:31:20', 'name': 'Anonymous', 'com': '<a href=""#p9481740"" class=""quotelink"">&gt;&gt;9481740</a><br>Burner Man is completely beatable. I use Buster only. The trick Is timing your jumps.<br><br>Dynamo Man Is even easier. Did you know you can use Ice Wall on the things he uses to heal himself? It actually one shots them.', 'time': 1670758280, 'resto': 9480774}, {'no': 9483119, 'now': '12/11/22(Sun)06:49:02', 'name': 'Anonymous', 'com': '<a href=""#p9480774"" class=""quotelink"">&gt;&gt;9480774</a><br>No. I&#039;ve beaten it tons of time both on the SNES and the GBA versions as both Rock and Forte, but haven&#039;t been able to get all CD&#039;s yet. I&#039;ve had a lot of fun and I think it&#039;s one of the best games in the series. I&#039;ve decided to replay the NES games recently and I don&#039;t find most of them fun anymore, but I&#039;ve played a bit of 7 and &amp;F again and thought they were still great, so I&#039;ll beat them again and try to go for all CD&#039;s in &amp;F.', 'time': 1670759342, 'resto': 9480774}, {'no': 9483141, 'now': '12/11/22(Sun)07:13:50', 'name': 'Anonymous', 'com': '<a href=""#p9482707"" class=""quotelink"">&gt;&gt;9482707</a><br>Very impressive collection! And look at those shiny Mega Man X figures scattered throughout! When I was around 10 years old in the year 2000 I really wanted those figures, but even then they were expensive. That same year I went to Cartoon Camp because I wanted to create a Mega Man X cartoon, but I really didn&#039;t learn much lol. Good times', 'time': 1670760830, 'resto': 9480774}]",
2,9480450,,,12/10/22(Sat)05:47:14,Anonymous,,It seems Xbox emulation through xemu has come a long way since last I checked. Has it surpassed the mess that is pcsx2 yet?,xemu,.png,916,338,250,92,1670669234320119,1670669234,ZLhJ1vUfnaMOlr7/Gcb00A==,44966,0,,it-seems-xbox-emulation-through-xemu-has-come-a,2,60,10,1670760818,0.0,0.0,55.0,10.0,"[{'no': 9482762, 'now': '12/11/22(Sun)02:27:32', 'name': 'Anonymous', 'com': '<a href=""#p9480568"" class=""quotelink"">&gt;&gt;9480568</a><br>based', 'time': 1670743652, 'resto': 9480450}, {'no': 9482835, 'now': '12/11/22(Sun)03:13:53', 'name': 'Anonymous', 'com': '<a href=""#p9481972"" class=""quotelink"">&gt;&gt;9481972</a><br><span class=""quote"">&gt;&quot;You&#039;re thinking of comsoomer terms, I&#039;m referring to DCI standard.&quot;</span><br><br>https://en.wikipedia.org/wiki/2K_re<wbr>solution<br><span class=""quote"">&gt;Another resolution that is often referred to as 2K is 2560×1440 (1440p) however that is a common mistake in marketing[12] and is called QHD by the DCI</span>', 'time': 1670746433, 'resto': 9480450}, {'no': 9482909, 'now': '12/11/22(Sun)04:09:15', 'name': 'Anonymous', 'com': '<a href=""#p9480450"" class=""quotelink"">&gt;&gt;9480450</a><br><span class=""quote"">&gt;It seems Xbox emulation through xemu has come a long way since last I checked.</span><br><span class=""quote"">&gt;Has it surpassed the mess that is pcsx2 yet?</span><br>have you checked out pcsx2 since last time?', 'time': 1670749755, 'resto': 9480450}, {'no': 9483113, 'now': '12/11/22(Sun)06:42:46', 'name': 'Anonymous', 'com': '<a href=""#p9480569"" class=""quotelink"">&gt;&gt;9480569</a><br><span class=""quote"">&gt;that pic</span><br>Pure sour grapes. Anyone who actually had in interest in retro games picked up PVM/BVM&#039;s 10+ years ago for &lt;$50. I&#039;m sorry that you only learned about them after youtubers fucked the market though!', 'time': 1670758966, 'resto': 9480450}, {'no': 9483140, 'now': '12/11/22(Sun)07:13:38', 'name': 'Anonymous', 'com': '<a href=""#p9483113"" class=""quotelink"">&gt;&gt;9483113</a><br>Pure sour grapes. Anyone who actually had an interest in retro games picked up any free CRTs and stashed them. I&#039;m sorry that you only learned about them after youtubers fucked the market though!', 'time': 1670760818, 'resto': 9480450}]",
3,9479505,,,12/09/22(Fri)19:45:23,Anonymous,ANNIVERSARY DOUBLE SERVING,"DOOM THREAD / RETRO FPS THREAD - Last thread: <a href=""/vr/thread/9465158#p9465158"" class=""quotelink"">&gt;&gt;9465158</a><br><br>DOOM/II/ULTIMATE/FINAL/64/CHEX/QUAK<wbr>E/DUKE/HERETIC/HEXEN/ETC<br>Gameplay, WADs/Maps/Mods, Source Ports<br>All other 90s FPS welcome<br>~ Let&#039;s post like gentlemen ~<br><br>FAQ/PASTEBIN<br>http://pastebin.com/hzDnLpct<br><br>SO YOU WANT TO PLAY SOME FUCKING DOOM<br>(or Quake, Duke, Marathon, Thief, Deus Ex)<br>https://imgur.com/a/wWS8zXz<br><br>Same thing, in video format:<br>https://youtu.be/ietb4JwaaXA<br>https://youtu.be/CGj4gXyCzg0<br><br>IWADs and more (&gt;6 GB): https://mediafire.com/file/wuniyrhs<wbr>jjgq4y8<br>PortaDOOM: https://github.com/Kroc/PortaDOOM/r<wbr>eleases<br>Quake Trilogy (2020-11): https://pastebin.com/Ucb11XhU<br>Downloads for various /vr/ shooters. (Includes Doom, Quake, Douk, Blood, and more):<br>https://mega.nz/#F!QXIk1bjB!NHRWGIf<wbr>jcc77PyGgRlga4Q<br>https://mega.nz/#F!GtEQTISJ!CCJGyPE<wbr>EEsZasc1PMXicUA<br>More /vr/ shooters:<br>https://drive.google.com/open?id=1p<wbr>pJLNvQEPfP4FsOCQBak1TMvPUIswCac<br>Doom Shovelware:<br>https://drive.google.com/open?id=1X<wbr>y-YDWytlEa2CS9rit-PUgcieh4MrGzR<br>Fileplanet archives:<br>https://www.quaddicted.com/files/mi<wbr>rrors/ftp.planetquake.com/<br>4CHAN DOSPACK + Win98 games (pre-configured):<br>https://mega.nz/folder/3t8nzSIS#947<wbr>kyMN6Z80f8HS7q2XlqA<br><br>== INFO/LINKS ==<br>OFFICIAL DOOM WIKI<br>http://doomwiki.org/<br><br>WHERE TO FIND WADS<br>Vanilla/Boom: https://www.doomworld.com/forum/4-w<wbr>ads-mods/<br>ZDoom: http://forum.zdoom.org/viewforum.ph<wbr>p?f=19<br>/idgames: https://www.doomworld.com/idgames/<br><br>TUTORIALS/UTILITIES<br>https://pastebin.com/7vKYWYp0<br><br>RESOURCES<br>https://forum.zdoom.org/viewforum.p<wbr>hp?f=37<br><br>== /VR/DOOM COMMUNITY ==<br><br>THREAD ARCHIVES<br>https://desuarchive.org/vr/search/t<wbr>ext/%22doom%20thread%22/type/op/<br><br>MAKING NEW THREADS PROPERLY<br>https://pastebin.com/8mDnrsrB<br><br>IMAGE DATABASE<br>http://vrdoom.booru.org/?page=post&amp;<wbr>s=list<br><br>OUR WADS<br>https://rentry.org/8ca3061522e0",1670607441875927,.jpg,1920,1080,250,140,1670633123262943,1670633123,Ss4WcF6GD114LWqKiN4oWA==,1069429,0,,anniversary-double-serving,2,216,55,1670760793,0.0,0.0,211.0,55.0,"[{'no': 9483135, 'now': '12/11/22(Sun)07:06:43', 'name': 'Anonymous', 'com': '<a href=""#p9483132"" class=""quotelink"">&gt;&gt;9483132</a><br><br>Well, then what famously hard wads do you recommend? Preferably something that could be considered a step above Plutonia in terms of difficulty, but not a huge masochist jump.', 'time': 1670760403, 'resto': 9479505}, {'no': 9483136, 'now': '12/11/22(Sun)07:10:03', 'name': 'Anonymous', 'com': '<a href=""#p9483135"" class=""quotelink"">&gt;&gt;9483135</a><br>BTSX', 'time': 1670760603, 'resto': 9479505}, {'no': 9483137, 'now': '12/11/22(Sun)07:11:31', 'name': 'Anonymous', 'com': '<a href=""#p9483135"" class=""quotelink"">&gt;&gt;9483135</a><br>Skillsaw wads.', 'time': 1670760691, 'resto': 9479505}, {'no': 9483138, 'now': '12/11/22(Sun)07:12:32', 'name': 'Anonymous', 'com': '<a href=""#p9483135"" class=""quotelink"">&gt;&gt;9483135</a><br>Plutonia 2, Scythe 1+2', 'time': 1670760752, 'resto': 9479505}, {'no': 9483139, 'now': '12/11/22(Sun)07:13:13', 'name': 'Anonymous', 'com': '<a href=""#p9483130"" class=""quotelink"">&gt;&gt;9483130</a><br>I’d at least recommend Alien Vendetta over Hell Revealed.', 'time': 1670760793, 'resto': 9479505}]",
4,9457565,,,12/01/22(Thu)06:48:28,Anonymous,Tetris: The Grand Master,"Join this thread to celebrate the much anticipated, first time out of the arcades, port of Tetris: The Grand Master<br><br><span class=""quote"">&gt;Out in US PSN</span><br>https://store.playstation.com/en-us<wbr>/product/UP0571-CUSA30945_00-HAMPRD<wbr>C000000001<br><span class=""quote"">&gt;Out to (apparently) some Asia NS eshop users</span><br><span class=""quote"">&gt;Join the stream</span><br>https://www.twitch.tv/tetristhegran<wbr>dmaster3",tetrisTGM,.png,220,273,201,250,1669895308745438,1669895308,1QM1et1NCLh45v9tZYPuqQ==,82016,0,,tetris-the-grand-master,2,67,13,1670760343,0.0,0.0,62.0,12.0,"[{'no': 9479192, 'now': '12/09/22(Fri)17:11:10', 'name': 'Anonymous', 'com': '<a href=""#p9479162"" class=""quotelink"">&gt;&gt;9479162</a><br><span class=""quote"">&gt;What do you mean by this? It&#039;s not like GB Tetris is still being sold anyway.</span><br>It was sold on the 3DS Virtual Console from 2011-2014. But it seems like it was delisted due to Ubisoft getting exclusive rights to Tetris games for a while, rather than muh guidelines.', 'time': 1670623870, 'resto': 9457565}, {'no': 9480225, 'now': '12/10/22(Sat)02:16:46', 'name': 'Anonymous', 'com': '<a href=""#p9479136"" class=""quotelink"">&gt;&gt;9479136</a><br>Noise anon! Any video of it?', 'time': 1670656606, 'resto': 9457565}, {'no': 9481682, 'now': '12/10/22(Sat)18:24:44', 'name': 'Anonymous', 'com': '<a href=""#p9480225"" class=""quotelink"">&gt;&gt;9480225</a><br>I got the one from Texmaster, don&#039;t have a way to record the Switch version.<br>Give me a while before I can post it.', 'time': 1670714684, 'resto': 9457565}, {'no': 9483117, 'now': '12/11/22(Sun)06:48:09', 'name': 'Anonymous', 'com': '<a href=""#p9480225"" class=""quotelink"">&gt;&gt;9480225</a><br>not that anon but have this recording of a dogshit game i just played at 3 am. every time i think i&#039;m on pace to shave off some time i end up misdropping and wasting valuable seconds playing clean up in the second half :^)<br>https://files.catbox.moe/s9596w.mp4<wbr><br><a href=""#p9479136"" class=""quotelink"">&gt;&gt;9479136</a><br>btw, good shit anon! i&#039;d encourage you to go for a sub-12 time since you&#039;re practically already there anyways, but i&#039;d rather play tgm with a fucking power glove than the switch d-pad', 'time': 1670759289, 'resto': 9457565}, {'no': 9483134, 'now': '12/11/22(Sun)07:05:43', 'name': 'Anonymous', 'com': 'Good shit anon. You must be on ta.p, that&#039;s some solid playing. I&#039;m still yet to pass 11:xx. You make it easy, even on a &quot;dogshit&quot; game.<br>I always choke out once I have a good time going in to 400. Then if I make it to 500 without misdropping, my brain will just disappear at 800-999. I&#039;ve got to get a handle on my nerves.', 'filename': 'cat', 'ext': '.jpg', 'w': 237, 'h': 249, 'tn_w': 118, 'tn_h': 125, 'tim': 1670760343671759, 'time': 1670760343, 'md5': 'DKv0PHddB8y9tyJHuLScoQ==', 'fsize': 5341, 'resto': 9457565}]",
5,9460589,,,12/02/22(Fri)14:24:38,Anonymous,Handheld thread,What are we playing lads? What are we playing on? Thinking about consooming another handheld you don&#039;t need?,anbersisters...,.png,1174,662,250,140,1670009078163138,1670009078,amXyLx+6MT89LT3t0crt0Q==,1453429,0,,handheld-thread,2,320,42,1670760198,0.0,0.0,315.0,42.0,"[{'no': 9483009, 'now': '12/11/22(Sun)05:34:59', 'name': 'Anonymous', 'com': '<a href=""#p9483003"" class=""quotelink"">&gt;&gt;9483003</a><br>Yeah it&#039;s a piece of shit, I played with it with the default card for 2 weeks and it&#039;s way too small to comfortably play. Pretty sure I bricked it, formatting the SD card the slow way to make sure, last time it just booted to a black screen and I had to disconnect the battery to get it to turn off after 10 minutes.', 'time': 1670754899, 'resto': 9460589}, {'no': 9483021, 'now': '12/11/22(Sun)05:41:58', 'name': 'Anonymous', 'com': '<a href=""#p9483009"" class=""quotelink"">&gt;&gt;9483009</a><br>it&#039;s basically just a &quot;load up basic-bitch pokemon game and take photo to post on social media before shelving again&quot; machine.', 'time': 1670755318, 'resto': 9460589}, {'no': 9483080, 'now': '12/11/22(Sun)06:13:59', 'name': 'Anonymous', 'com': '<a href=""#p9483009"" class=""quotelink"">&gt;&gt;9483009</a><br>I could get used to the size if not for the fact the shoulder buttons are borderline unusable.', 'time': 1670757239, 'resto': 9460589}, {'no': 9483084, 'now': '12/11/22(Sun)06:18:25', 'name': 'Anonymous', 'com': '<a href=""#p9483080"" class=""quotelink"">&gt;&gt;9483080</a><br>I refuse to play anything on it that utilizes shoulder buttons, the way you have to contort your hands to get to them momentarily pausing you in-game gets me killed often. There&#039;s 3D printed extenders for the shoulders sold online but I&#039;m not committed enough to this thing to try them.', 'time': 1670757505, 'resto': 9460589}, {'no': 9483131, 'now': '12/11/22(Sun)07:03:18', 'name': 'Anonymous', 'com': '<a href=""#p9482886"" class=""quotelink"">&gt;&gt;9482886</a><br>Well I got it figured out, turns out I was backing out of the install too early and waited 15 minutes instead of 10. Would&#039;ve helped to have had some kind of GUI telling me it was actually doing something instead of just a fucking black screen. My Sandisk is somehow 5 times slower than the card that came with the handheld.', 'time': 1670760198, 'resto': 9460589}]",
6,9481901,,,12/10/22(Sat)20:06:24,Anonymous,WTF is wrong with this game?,"<span class=""quote"">&gt;Install it on my modded Xbox. Game freezes when trying to load the first level.</span><br><span class=""quote"">&gt;Try the GameCube version on my modded Wii. Game freezes when trying to load the first level.</span><br><span class=""quote"">&gt;Actually own the PC version but it is fucking shit and they removed all the driving parts which make up like 60% of the game</span><br><br>Playing this through Dolphin now. Is this the best way to play this and is this the best Bond game?",007_-_Nightfire_Coverart,.png,256,329,194,250,1670720784824294,1670720784,ll1LKA1Bt2nNO9rpnItaLg==,147237,0,,wtf-is-wrong-with-this-game,2,19,1,1670759978,0.0,0.0,14.0,1.0,"[{'no': 9482547, 'now': '12/11/22(Sun)00:15:49', 'name': 'Anonymous', 'com': '<a href=""#p9481909"" class=""quotelink"">&gt;&gt;9481909</a><br>Fun fact: I was playing this when my parents decided to have the talk with my sister and I that they were getting a divorce<br><span class=""quote"">&gt;SOMEBODY KILL HIIIIIIIIIIIM</span>', 'time': 1670735749, 'resto': 9481901}, {'no': 9482673, 'now': '12/11/22(Sun)01:08:26', 'name': 'Anonymous', 'com': '<a href=""#p9482080"" class=""quotelink"">&gt;&gt;9482080</a><br>on pc, a totally different game<br><a href=""#p9481901"" class=""quotelink"">&gt;&gt;9481901</a><br>I have a dolphin build with mouse and keyboard support', 'time': 1670738906, 'resto': 9481901}, {'no': 9482718, 'now': '12/11/22(Sun)01:45:26', 'name': 'Anonymous', 'com': '<a href=""#p9482226"" class=""quotelink"">&gt;&gt;9482226</a><br>PAL or NTSC?', 'time': 1670741126, 'resto': 9481901}, {'no': 9482915, 'now': '12/11/22(Sun)04:15:58', 'name': 'Anonymous', 'com': '<a href=""#p9481901"" class=""quotelink"">&gt;&gt;9481901</a><br>played nightfire, agent under fire and everything or nothing on pcsx2 a few months ago, they all work like a charm<br>the notorious pc version was made by gearbox on the source engine iirc, it&#039;s atrocious like spider man 2, avoid at all cost.<br>The vehicle sections are pretty barebones compared to AUF and EoN&#039;s<br>Try emulating it.', 'time': 1670750158, 'resto': 9481901}, {'no': 9483129, 'now': '12/11/22(Sun)06:59:38', 'name': 'Anonymous', 'com': '<a href=""#p9482915"" class=""quotelink"">&gt;&gt;9482915</a><br>What about FRWL?', 'time': 1670759978, 'resto': 9481901}]",
7,9481518,,,12/10/22(Sat)16:45:35,Anonymous,,ITT: Games that are overhated<br><br>It&#039;s not an underrated masterpiece but it is a better game than what its reputation implies,Daikatanabox,.jpg,278,359,193,250,1670708735384964,1670708735,i+3ujtRKiFE1PKeMmuF9Sw==,18763,0,,itt-games-that-are-overhated,2,45,7,1670759956,0.0,0.0,40.0,7.0,"[{'no': 9482683, 'now': '12/11/22(Sun)01:18:28', 'name': 'Anonymous', 'com': '<a href=""#p9482662"" class=""quotelink"">&gt;&gt;9482662</a><br><span class=""quote"">&gt;Wasn&#039;t most of his complaints that it was really hard?</span><br>Kind of. He complains that you cannot distinguish where you can go through and what insta-kills you. Your bullets stop at an obstacle. He mentions how he hates the pumpkins/jack-o-lanterns jumping from the bottom of the screen, but fails to mention a power up that gives you a double shot in horizontal stages. You can change the direction (front, downwards, backwards) of the second shot by pressing the B button. Another complain he has is that there are screens where a lot of bullets are shot are you at the same time, but the nerd didn&#039;t mention the fact that you have a bomb attack that destroys every enemy on-screen by simply pressing select. When you die, you always respawn with a bomb attack, and those can add up. Also, the double shot stacks up, and gives you a third shot on vertical stages that can also be adjusted (Three spread shots forwards, one shot forward and one on each side, and one forwards shot and two spread backwards shots), which defeats his complaint about enemies in tight corridors.<br>It seems to me that James literally only pressed the A button when playing the game and deemed it a shitty game.', 'time': 1670739508, 'resto': 9481518}, {'no': 9482908, 'now': '12/11/22(Sun)04:07:54', 'name': 'Anonymous', 'com': '<a href=""#p9482642"" class=""quotelink"">&gt;&gt;9482642</a><br><a href=""#p9482525"" class=""quotelink"">&gt;&gt;9482525</a><br><br><br>It doesn&#039;t have the large empty town that brainlets like', 'time': 1670749674, 'resto': 9481518}, {'no': 9483054, 'now': '12/11/22(Sun)05:58:29', 'name': 'Anonymous', 'com': '<a href=""#p9481518"" class=""quotelink"">&gt;&gt;9481518</a><br><br>I just finished Daikatana a while ago. The game has a lot of glaring issues, like the shitty sidekick AI, boring enemies, more than half the weapons having a shitty gimmick, and probably the worst start to a game ever (A swamp AND sewer level back to back? With the worst weapon set of all the time eras? What the fuck were they thinking?)<br><br>But even after all of that, I had fun with it. I don&#039;t know if it&#039;s some kind of Stockholm syndrome but the game actually gets better the further you go. The first era sucks ass, and the Ancient Greek era has some puzzle bullshit going on and a maze-like section toward the end. But the Medieval era has some nice aesthetics and you&#039;re finally getting decent weapons again, and finally, the Modern era has the best weapon set with only two bad weapons (The Ice gun and the Laser mine) and the level design gets better too.<br><br>If the game didn&#039;t had that rocky development I think it would&#039;ve been better. Scaling back the gimmicks of the weapons, making the levels larger and with more enemies, and removing the AI partners would already make the game 10 times better. It&#039;s such a crime that a game with such huge mobility is barely using it for something. Maxing out the Acro skill + lots of weapons having huge knockback that allow you to get even higher is great on paper, but the level design doesn&#039;t support this.', 'time': 1670756309, 'resto': 9481518}, {'no': 9483061, 'now': '12/11/22(Sun)06:02:26', 'name': 'Anonymous', 'com': '<a href=""#p9481990"" class=""quotelink"">&gt;&gt;9481990</a><br>underrated comment', 'time': 1670756546, 'resto': 9481518}, {'no': 9483128, 'now': '12/11/22(Sun)06:59:16', 'name': 'Anonymous', 'com': 'It&#039;s not like Daikatana was hated per se, it&#039;s the hype around it that was hated (especially after the game didn&#039;t prove to be anything special).<br><br>I think Daikatana is a perfect example of something considered meh at its release and two decades later. As opposed to that retarded nonsense when people start hating something acclaimed just because it makes them feel special, aka that recent wave of hatred towards Fallout 2 (&quot;hurr durr it&#039;s so casual as compared to F1&quot;) and HoMM3 (&quot;hurr durr it&#039;s so casual as compared to HoMM2&quot;).', 'time': 1670759956, 'resto': 9481518}]",
8,9477636,,,12/09/22(Fri)00:28:45,Anonymous,,Superman 64,Superman64,.jpg,800,550,250,171,1670563725120145,1670563725,nXcKVDRdxDc9p2uFbpkDAg==,96265,0,,superman-64,2,29,5,1670759917,0.0,0.0,24.0,5.0,"[{'no': 9482776, 'now': '12/11/22(Sun)02:35:06', 'name': 'Anonymous', 'com': '<a href=""#p9481642"" class=""quotelink"">&gt;&gt;9481642</a><br>Holy shit it really has been that long?', 'time': 1670744106, 'resto': 9477636}, {'no': 9483098, 'now': '12/11/22(Sun)06:30:57', 'name': 'Anonymous', 'com': '<a href=""#p9482264"" class=""quotelink"">&gt;&gt;9482264</a><br>thanks for posting retro ads', 'time': 1670758257, 'resto': 9477636}, {'no': 9483106, 'now': '12/11/22(Sun)06:36:43', 'name': 'Anonymous', 'com': '<a href=""#p9482776"" class=""quotelink"">&gt;&gt;9482776</a><br>He did actually go through the entire game in his 15th anniversary stream this year, but he said that doesn&#039;t count and doesn&#039;t mean anything about future episodes.', 'time': 1670758603, 'resto': 9477636}, {'no': 9483126, 'now': '12/11/22(Sun)06:57:33', 'name': 'Anonymous', 'com': '<a href=""#p9482264"" class=""quotelink"">&gt;&gt;9482264</a><br>Whoa I&#039;ve never seen the PlayStation boxset. That&#039;s not the pose I expected Superman to be in from the N64 box. That looks weird.', 'time': 1670759853, 'resto': 9477636}, {'no': 9483127, 'now': '12/11/22(Sun)06:58:37', 'name': 'Anonymous', 'com': '<a href=""#p9483126"" class=""quotelink"">&gt;&gt;9483126</a><br>*Boxart.', 'time': 1670759917, 'resto': 9477636}]",
9,9482152,,,12/10/22(Sat)22:18:25,Anonymous,Nintendo Power Storytime,,Nintendo Power Issue 174 (December 2003) page 001,.jpg,1685,2200,191,250,1670728705356599,1670728705,8pT4oCFmjXQvi+FuZSNRPg==,914977,0,,nintendo-power-storytime,2,181,173,1670759839,0.0,0.0,176.0,170.0,"[{'no': 9482608, 'now': '12/11/22(Sun)00:34:08', 'name': 'Anonymous', 'filename': 'Nintendo Power Issue 174 (December 2003) page 162', 'ext': '.jpg', 'w': 1645, 'h': 2200, 'tn_w': 93, 'tn_h': 125, 'tim': 1670736848519563, 'time': 1670736848, 'md5': '8+IHh6/xS5uvmzdu4+g03A==', 'fsize': 1042872, 'resto': 9482152}, {'no': 9482610, 'now': '12/11/22(Sun)00:34:42', 'name': 'Anonymous', 'filename': 'Nintendo Power Issue 174 (December 2003) page 163', 'ext': '.jpg', 'w': 1649, 'h': 2200, 'tn_w': 93, 'tn_h': 125, 'tim': 1670736882267169, 'time': 1670736882, 'md5': 'zvbxQmUhfNdDPaLycukPMA==', 'fsize': 554735, 'resto': 9482152}, {'no': 9482614, 'now': '12/11/22(Sun)00:35:15', 'name': 'Anonymous', 'com': 'More later.', 'filename': 'Nintendo Power Issue 174 (December 2003) page 164', 'ext': '.jpg', 'w': 1653, 'h': 2200, 'tn_w': 93, 'tn_h': 125, 'tim': 1670736915911682, 'time': 1670736915, 'md5': 'f5CR+an7+2zumV47n2gW2A==', 'fsize': 787659, 'resto': 9482152}, {'no': 9482773, 'now': '12/11/22(Sun)02:33:56', 'name': 'Anonymous', 'com': '<a href=""#p9482538"" class=""quotelink"">&gt;&gt;9482538</a><br>they weirdly made a TV show out of this game, but like 5 years after the fact', 'time': 1670744036, 'resto': 9482152}, {'no': 9483125, 'now': '12/11/22(Sun)06:57:19', 'name': 'Anonymous', 'com': '<a href=""#p9482154"" class=""quotelink"">&gt;&gt;9482154</a><br>poor Doned', 'time': 1670759839, 'resto': 9482152}]",
