,no,sticky,closed,now,name,sub,com,filename,ext,w,h,tn_w,tn_h,tim,time,md5,fsize,resto,capcode,semantic_url,custom_spoiler,replies,images,last_modified,bumplimit,imagelimit,omitted_posts,omitted_images,last_replies,spoiler
60,9482451,,,12/10/22(Sat)23:44:53,Anonymous,,What should I expect,D7F88B14-E392-4637-92A0-4CE91374D4AC,.png,256,255,250,249,1670733893728341,1670733893,KNBlOeUhCFYgFWKJBUTUUw==,92445,0,,what-should-i-expect,2,16,1,1670752355,0.0,0.0,11.0,0.0,"[{'no': 9482902, 'now': '12/11/22(Sun)04:00:31', 'name': 'Anonymous', 'com': '<a href=""#p9482736"" class=""quotelink"">&gt;&gt;9482736</a><br>What a stupid statement', 'time': 1670749231, 'resto': 9482451}, {'no': 9482919, 'now': '12/11/22(Sun)04:18:56', 'name': 'Anonymous', 'com': '<a href=""#p9482451"" class=""quotelink"">&gt;&gt;9482451</a><br>Great atmosphere with mediocre (relative to the games that came after it) gameplay. I recommend checking out the Beelzebub mod which improves the gameplay of D1 and restores cut content. <br><br>The atmosphere in D1 is spot on though and makes the experience worth it.', 'filename': '24', 'ext': '.jpg', 'w': 206, 'h': 286, 'tn_w': 90, 'tn_h': 125, 'tim': 1670750336907067, 'time': 1670750336, 'md5': 'Qgl6qJZS223KKyU6ADNlPQ==', 'fsize': 39674, 'resto': 9482451}, {'no': 9482924, 'now': '12/11/22(Sun)04:21:55', 'name': 'Anonymous', 'com': '<a href=""#p9482919"" class=""quotelink"">&gt;&gt;9482919</a><br>I genuinely think people should try out playing at least unmodded Diablo 1 for a while before trying out mods.', 'time': 1670750515, 'resto': 9482451}, {'no': 9482962, 'now': '12/11/22(Sun)04:51:22', 'name': 'Anonymous', 'com': '<a href=""#p9482451"" class=""quotelink"">&gt;&gt;9482451</a><br>Great ambiance, gratuitous amounts of grinding. Like &quot;stockpile your preferred stimulant&quot; amounts of grinding.', 'time': 1670752282, 'resto': 9482451}, {'no': 9482964, 'now': '12/11/22(Sun)04:52:35', 'name': 'Anonymous', 'com': '<a href=""#p9482451"" class=""quotelink"">&gt;&gt;9482451</a><br>Some proper dungeon crawling instead of spin to win skinnerbox gameplay that came after it.', 'time': 1670752355, 'resto': 9482451}]",
61,9481676,,,12/10/22(Sat)18:21:17,Anonymous,,"<span class=""quote"">&gt;first snow of the year</span><br><span class=""quote"">&gt;always remember playing Xenogears on Christmas</span>",13-shevatcrash22,.jpg,640,480,250,187,1670714477677225,1670714477,vT1p5eOBKIo8imd4Ks+RyQ==,53796,0,,first-snow-of-the-year,2,8,4,1670751679,0.0,0.0,3.0,1.0,"[{'no': 9482486, 'now': '12/10/22(Sat)23:56:24', 'name': 'Anonymous', 'com': '<a href=""#p9481676"" class=""quotelink"">&gt;&gt;9481676</a><br>And you know the best part OP, he’s dead.', 'filename': 'AED7FA06-8D6E-4C4B-AE81-4D1C0CCC14BC', 'ext': '.jpg', 'w': 1280, 'h': 1801, 'tn_w': 88, 'tn_h': 124, 'tim': 1670734584703058, 'time': 1670734584, 'md5': '+KUDYnuasxcmuTDza6fiag==', 'fsize': 517676, 'resto': 9481676}, {'no': 9482912, 'now': '12/11/22(Sun)04:12:16', 'name': 'Anonymous', 'com': '<a href=""#p9481697"" class=""quotelink"">&gt;&gt;9481697</a><br>I got Diddy Kong racing when I got my n64 in Christmas of 99. the best Christmas. <br>n64<br>Diddy Kong racing <br>Mario kart 64 <br>fzero x <br>ocarina of time <br><br>my mom outdid herself that year. so blessed.', 'time': 1670749936, 'resto': 9481676}, {'no': 9482914, 'now': '12/11/22(Sun)04:15:37', 'name': 'Anonymous', 'com': '<a href=""#p9481676"" class=""quotelink"">&gt;&gt;9481676</a>', 'filename': 'IcicleInn.PNG', 'ext': '.png', 'w': 512, 'h': 448, 'tn_w': 125, 'tn_h': 109, 'tim': 1670750137491314, 'time': 1670750137, 'md5': 'mu6R/0FCdURjxoN0Tcg8zw==', 'fsize': 238250, 'resto': 9481676}, {'no': 9482945, 'now': '12/11/22(Sun)04:39:03', 'name': 'Anonymous', 'com': 'There was also ToD, which (after the prologue) starts out in a snow town.<br><br><a href=""#p9482486"" class=""quotelink"">&gt;&gt;9482486</a><br>The nano dog food freed the woof existence, allowing it to return to its own dimension.', 'filename': 'splash', 'ext': '.jpg', 'w': 1117, 'h': 784, 'tn_w': 125, 'tn_h': 87, 'tim': 1670751543682770, 'time': 1670751543, 'md5': 'HxCahpXeuGx9uojo5eQKFQ==', 'fsize': 175625, 'resto': 9481676}, {'no': 9482948, 'now': '12/11/22(Sun)04:41:19', 'name': 'Anonymous', 'com': '<a href=""#p9482423"" class=""quotelink"">&gt;&gt;9482423</a><br>Nah he just sleepy', 'time': 1670751679, 'resto': 9481676}]",
62,9481578,,,12/10/22(Sat)17:18:14,Anonymous,,"Are there arcade perfect emulators, as in putting an office pc connected to a crt inside a cardboard box, with a sanwa arcade stick/buttons instead of shelling out 15k for some original cab demanding repair every 2nd day.<br>Would you go to an arcade filled exclusively with those?",url(6),.jpg,2640,2200,250,208,1670710694892519,1670710694,5rycV4YOeJ/tnie1/37e9w==,675906,0,,are-there-arcade-perfect-emulators-as-in-putting,2,7,0,1670751531,0.0,0.0,2.0,0.0,"[{'no': 9481921, 'now': '12/10/22(Sat)20:20:24', 'name': 'Anonymous', 'com': '<a href=""#p9481578"" class=""quotelink"">&gt;&gt;9481578</a><br><span class=""quote"">&gt;Are there arcade perfect emulators,</span><br><br>MiSTER is probably the closest. Give it some time, and build a MiSTER arcade cab for best accuracy.', 'time': 1670721624, 'resto': 9481578}, {'no': 9481924, 'now': '12/10/22(Sat)20:22:08', 'name': 'Anonymous', 'com': '<a href=""#p9481921"" class=""quotelink"">&gt;&gt;9481921</a><br>too expensive.', 'time': 1670721728, 'resto': 9481578}, {'no': 9481931, 'now': '12/10/22(Sat)20:27:12', 'name': 'Anonymous', 'com': '<a href=""#p9481578"" class=""quotelink"">&gt;&gt;9481578</a><br><span class=""quote"">&gt;Would you go to an arcade filled exclusively with those?</span><br>I would but i fear you would go out of business anyway so i wouldn&#039;t advise it', 'time': 1670722032, 'resto': 9481578}, {'no': 9482248, 'now': '12/10/22(Sat)22:56:16', 'name': 'Anonymous', 'com': '<a href=""#p9481924"" class=""quotelink"">&gt;&gt;9481924</a><br><span class=""quote"">&gt;too poor</span><br>ftfy', 'time': 1670730976, 'resto': 9481578}, {'no': 9482942, 'now': '12/11/22(Sun)04:38:51', 'name': 'Anonymous', 'com': '<a href=""#p9481931"" class=""quotelink"">&gt;&gt;9481931</a><br>I think people might be happy to have such a place to hang out with their friends.<br>In Germany we got multiple E-Sport arcades allowing people to jam on some modern pcs/consoles for free, while making money on selling the displayed stuff. Offering MVS/Streetfighter cabs too, even zoomers playing those.', 'time': 1670751531, 'resto': 9481578}]",
63,9464326,,,12/04/22(Sun)02:10:01,Anonymous,,I like elves. Do you have a favorite retro elf?,elf3,.png,1920,1080,250,140,1670137801314711,1670137801,q2XP09Wd4wFym0PJG/p/hA==,16838,0,,i-like-elves-do-you-have-a-favorite-retro-elf,2,112,41,1670750913,0.0,0.0,107.0,41.0,"[{'no': 9481104, 'now': '12/10/22(Sat)13:38:32', 'name': 'Anonymous', 'com': '<a href=""#p9471118"" class=""quotelink"">&gt;&gt;9471118</a><br>She doesn&#039;t canonically have a horsecock, unlike that elf.<br><s>But she should have one.</s>', 'time': 1670697512, 'resto': 9464326}, {'no': 9481342, 'now': '12/10/22(Sat)15:48:00', 'name': 'Anonymous', 'com': '<a href=""#p9470914"" class=""quotelink"">&gt;&gt;9470914</a><br>Don&#039;t you have a song about gold to sing about somewhere else, beardo?', 'time': 1670705280, 'resto': 9464326}, {'no': 9481647, 'now': '12/10/22(Sat)18:06:17', 'name': 'Anonymous', 'com': '<a href=""#p9478487"" class=""quotelink"">&gt;&gt;9478487</a><br>Bird', 'time': 1670713577, 'resto': 9464326}, {'no': 9482929, 'now': '12/11/22(Sun)04:27:12', 'name': 'Anonymous', 'com': '<a href=""#p9468220"" class=""quotelink"">&gt;&gt;9468220</a><br>Agree re: Berserk but you also gotta realize where fantasy and a genre was in the late 80s. The dnd style party of Parn et al. wasnt unique, but the way it played out especially with Ashram and Pirotesse really laid a lot of groundwork for later shit even outside of Japan', 'time': 1670750832, 'resto': 9464326}, {'no': 9482930, 'now': '12/11/22(Sun)04:28:33', 'name': 'Anonymous', 'com': '<a href=""#p9478570"" class=""quotelink"">&gt;&gt;9478570</a><br>Ashram got a bigger D tho. That&#039;s why Piro walks so funny', 'time': 1670750913, 'resto': 9464326}]",
64,9479878,,,12/09/22(Fri)22:59:48,Anonymous,,You are opening a retro arcade. You can only afford ten cabinets on opening day. Which games do you pick?,D32C9DD2-0B6C-4A23-8118-65E1C5F7F15A,.jpg,1280,720,250,140,1670644788040316,1670644788,qYtSxYFAG1QyrMOkdfiT4A==,125583,0,,you-are-opening-a-retro-arcade-you-can-only,2,59,4,1670748212,0.0,0.0,54.0,3.0,"[{'no': 9482728, 'now': '12/11/22(Sun)01:54:36', 'name': 'Anonymous', 'com': '<a href=""#p9482125"" class=""quotelink"">&gt;&gt;9482125</a><br>How to find pinball and pinball tournaments in your area:<br>US, Canada, Australia, Japan, Finland, UK<br>https://pinballmap.com/<br>Worldwide:<br>https://pinside.com/pinball/map<br>Europe:<br>https://findapinball.com/en/browse/<wbr>', 'filename': 'Elvira and the Party Monsters flyer back', 'ext': '.jpg', 'w': 1221, 'h': 801, 'tn_w': 125, 'tn_h': 82, 'tim': 1670741676608106, 'time': 1670741676, 'md5': 'ShbUxIanbrF5u89aKjFK/Q==', 'fsize': 336799, 'resto': 9479878}, {'no': 9482747, 'now': '12/11/22(Sun)02:14:11', 'name': 'Anonymous', 'com': '<a href=""#p9479878"" class=""quotelink"">&gt;&gt;9479878</a><br><span class=""quote"">&gt;You are opening a retro arcade.</span><br>What as like a tax scam?', 'time': 1670742851, 'resto': 9479878}, {'no': 9482754, 'now': '12/11/22(Sun)02:20:36', 'name': 'Anonymous', 'com': '<a href=""#p9479886"" class=""quotelink"">&gt;&gt;9479886</a><br><span class=""quote"">&gt;A Neo-Geo cab with Windjammers, Last Blade 2, Metal Slug 3, and KoF 98</span><br><br>Why only a 4 slot Neo Geo? Get the 6 slot for 6 games', 'time': 1670743236, 'resto': 9479878}, {'no': 9482834, 'now': '12/11/22(Sun)03:11:43', 'name': 'Anonymous', 'com': 'Donkey Kong<br>Dynamite cop <br>Outrun<br>Berzerk<br>Riot <br>Metal slug 5<br>Sunset riders<br>Super hang on <br>Cruisin’ USA<br>DDR extreme 2', 'time': 1670746303, 'resto': 9479878}, {'no': 9482879, 'now': '12/11/22(Sun)03:43:32', 'name': 'Anonymous', 'com': '<a href=""#p9480296"" class=""quotelink"">&gt;&gt;9480296</a><br>I&#039;d go Time Crisis 2 for the light gun game, purely for the coop so people can play with their mates. Alternatively, one of the Point Blank games.', 'time': 1670748212, 'resto': 9479878}]",
65,9482875,,,12/11/22(Sun)03:42:09,Anonymous,,Screenshot thread!<br>Post games your recent vidya screenshots you&#039;ve played recently,Harry Potter and the Prisoner of Azkaban 1,.png,1920,1344,250,175,1670748129299692,1670748129,94V1X7g9VgdsrZ5IM/Q3HA==,2232759,0,,screenshot-thread,2,12,12,1670756038,0.0,0.0,7.0,7.0,"[{'no': 9482897, 'now': '12/11/22(Sun)03:56:17', 'name': 'Anonymous', 'filename': 'Harry Potter and the Chamber of Secrets_4', 'ext': '.png', 'w': 1920, 'h': 1208, 'tn_w': 125, 'tn_h': 78, 'tim': 1670748977545104, 'time': 1670748977, 'md5': 'vyd4iHVtdIyIjw84CjRfgg==', 'fsize': 2253821, 'resto': 9482875}, {'no': 9482898, 'now': '12/11/22(Sun)03:58:06', 'name': 'Anonymous', 'com': 'must&#039;ve walked down these stairs over 200 times', 'filename': 'Harry Potter and the Chamber of Secrets_5', 'ext': '.png', 'w': 1920, 'h': 1118, 'tn_w': 125, 'tn_h': 72, 'tim': 1670749086782406, 'time': 1670749086, 'md5': '5uGIhqKTF8eFz94RQNfeug==', 'fsize': 2384448, 'resto': 9482875}, {'no': 9482901, 'now': '12/11/22(Sun)04:00:30', 'name': 'Anonymous', 'filename': 'Harry Potter and the Philosopher&#039;s Stone_1', 'ext': '.png', 'w': 1536, 'h': 1404, 'tn_w': 125, 'tn_h': 114, 'tim': 1670749230514718, 'time': 1670749230, 'md5': 'IxYqHnwEytuqjua13ilrPA==', 'fsize': 2483960, 'resto': 9482875}, {'no': 9483008, 'now': '12/11/22(Sun)05:33:40', 'name': 'Anonymous', 'com': 'The neat thing here is it&#039;s not always the same enemies in the same patterns.<br>If you do really well against one type of enemy, the game shifts it&#039;s strategy and throws other shit at you.', 'filename': 'Screenshot from 2022-12-11 04-32-15', 'ext': '.png', 'w': 1020, 'h': 839, 'tn_w': 125, 'tn_h': 102, 'tim': 1670754820950255, 'time': 1670754820, 'md5': 'JveO+bgQ8NVeGdyJYQn8kQ==', 'fsize': 276718, 'resto': 9482875}, {'no': 9483046, 'now': '12/11/22(Sun)05:53:58', 'name': 'Anonymous', 'com': 'For example, if you wreck ass on the the round things, it&#039;ll start throwing the &#039;bats&#039; at you, and if you wreck ass on them, it&#039;ll start throwing the &#039;fast movers&#039; at you.<br>I dunno what any of this shit is called that&#039;s just what I call them.<br>These red and white cross looking things, you can&#039;t tell it, but they&#039;re moving top-right to bottom-left so fast I&#039;m totally boned here, they move in straight lines, but they&#039;re so fast that if you&#039;re in their line when they start, you can&#039;t get out of the way, they just kamikaze your ass.', 'filename': 'FAST-MOVERS', 'ext': '.png', 'w': 1023, 'h': 842, 'tn_w': 125, 'tn_h': 102, 'tim': 1670756038694506, 'time': 1670756038, 'md5': 'F3y06FVUL7ifP1X+FzlejQ==', 'fsize': 191158, 'resto': 9482875}]",
66,9482165,,,12/10/22(Sat)22:20:28,Anonymous,,"Why does Japan not give a shit about Sonic as much as everyone else? He seems borderline obscure there, or at least have way fewer fans",ESS6m5RWoAceQtV,.jpg,713,672,250,235,1670728828516582,1670728828,/3PuqySWr9xDT8R7OH1OXw==,88572,0,,why-does-japan-not-give-a-shit-about-sonic-as,2,35,8,1670748081,0.0,0.0,30.0,6.0,"[{'no': 9482823, 'now': '12/11/22(Sun)03:07:08', 'name': 'Anonymous', 'com': '<a href=""#p9482165"" class=""quotelink"">&gt;&gt;9482165</a><br>WE ARRU RABU SUPA SONIKO', 'filename': 'HTB1iLltXAT2gK0jSZPcq6AKkpXa2', 'ext': '.jpg', 'w': 538, 'h': 800, 'tn_w': 84, 'tn_h': 125, 'tim': 1670746028776447, 'time': 1670746028, 'md5': 'LgbGZh2UgZf7VzatH1mGdw==', 'fsize': 57364, 'resto': 9482165}, {'no': 9482839, 'now': '12/11/22(Sun)03:18:31', 'name': 'Anonymous', 'com': '<a href=""#p9482746"" class=""quotelink"">&gt;&gt;9482746</a><br><a href=""#p9482756"" class=""quotelink"">&gt;&gt;9482756</a><br><br>You could maybe make an argument that he has fewer fans, but the OP never defined what being a fan was. Secondly, the idea that Sonic is &quot;borderline obscure&quot; is just completely false. Everyone knows who he is, he is not obscure at all. The only argument you can make is that he may be more popular in other regions than Japan, but saying he&#039;s not well known or unpopular is objectively false', 'time': 1670746711, 'resto': 9482165}, {'no': 9482849, 'now': '12/11/22(Sun)03:25:17', 'name': 'Anonymous', 'com': '<a href=""#p9482839"" class=""quotelink"">&gt;&gt;9482839</a><br>Yes, I&#039;m not agreeing with OP. Nips know who Sonic IS, the same way your dad knew who is is. &quot;That one blue character&quot;.<br><br>Ask nips to say anything about Sonic beyond what he looks like and whose mascot he is, and they&#039;ll be struggling a lot more, though. He&#039;s really just the face of Sega and not much more', 'time': 1670747117, 'resto': 9482165}, {'no': 9482864, 'now': '12/11/22(Sun)03:34:41', 'name': 'Anonymous', 'com': '<a href=""#p9482849"" class=""quotelink"">&gt;&gt;9482849</a><br><br>I agree with you there, I just wanted to make it clear that he is well-known in Japan, although that knowledge isn&#039;t necessarily very deep like you said. It&#039;s kinda like Hello Kitty in the US, everyone has seen it/knows what it is, but not everyone knows more than just the character itself other than dedicated fans', 'time': 1670747681, 'resto': 9482165}, {'no': 9482874, 'now': '12/11/22(Sun)03:41:21', 'name': 'Anonymous', 'com': '<a href=""#p9482823"" class=""quotelink"">&gt;&gt;9482823</a>', 'filename': 'sample_b6312e7d223d1f141a34523c7abd5d17', 'ext': '.jpg', 'w': 850, 'h': 1652, 'tn_w': 64, 'tn_h': 125, 'tim': 1670748081530882, 'time': 1670748081, 'md5': 'gv/D9owAhHBUYA016ICIjQ==', 'fsize': 358582, 'resto': 9482165}]",
67,9477158,,,12/08/22(Thu)19:20:20,Anonymous,Sheesh this series is DOG shit,There really is no way of skipping enemy turns of which there can be literally up to 50. I read some people do their dishes or tax rerurns in that time<br><br>WHY DO TENDIES NEVER TELL YOU ABOUT THIS KINDA STUFF? I was looking forward to trying this series for years,images.jpeg-4,.jpg,300,134,250,111,1670545220876750,1670545220,U2sVbJvUteUSbDZBTHebLA==,10275,0,,sheesh-this-series-is-dog-shit,2,31,3,1670747936,0.0,0.0,26.0,3.0,"[{'no': 9481189, 'now': '12/10/22(Sat)14:29:14', 'name': 'Anonymous', 'com': '<a href=""#p9477158"" class=""quotelink"">&gt;&gt;9477158</a><br><span class=""quote"">&gt;tendies</span><br>Most core Nintendo fans don&#039;t give a shit about Fire Emblem. Only the super weeby ones rate it highly.', 'time': 1670700554, 'resto': 9477158}, {'no': 9482036, 'now': '12/10/22(Sat)21:26:45', 'name': 'Anonymous', 'com': '<a href=""#p9481181"" class=""quotelink"">&gt;&gt;9481181</a><br><span class=""quote"">&gt;I try to play with permanent death</span><br>It&#039;s the only way. But yeah FE6&#039;s stat growths, or the way it calculates them and hit rates and stuff make the game much more variable. You can end up with good axe users and shitty fliers and front-line worthy mages. In FE7/8, the strong units are pretty consistently strong.<br><span class=""quote"">&gt;I just wish the game design was more cohesive</span><br>The maps are better though IMO. Some of the requirements to get bonus items are very strict and make you really plan ahead', 'time': 1670725605, 'resto': 9477158}, {'no': 9482846, 'now': '12/11/22(Sun)03:24:35', 'name': 'Anonymous', 'com': '<a href=""#p9477773"" class=""quotelink"">&gt;&gt;9477773</a><br>the only time I&#039;ve felt this way in fire emblem is lunatic mode in awakening', 'time': 1670747075, 'resto': 9477158}, {'no': 9482863, 'now': '12/11/22(Sun)03:34:18', 'name': 'Anonymous', 'com': '<a href=""#p9477773"" class=""quotelink"">&gt;&gt;9477773</a><br>I know TO is tactics ogre but what the fuck are those other games?', 'time': 1670747658, 'resto': 9477158}, {'no': 9482872, 'now': '12/11/22(Sun)03:38:56', 'name': 'Anonymous', 'com': '<a href=""#p9482863"" class=""quotelink"">&gt;&gt;9482863</a><br>FM is probably Front Mission. I&#039;ve only played the third one on PS1 but it&#039;s a solid game. Do recommend.', 'time': 1670747936, 'resto': 9477158}]",
68,9482092,,,12/10/22(Sat)21:50:59,Anonymous,,Terry is the best classic fighting game &quot;hero&quot;,terryb,.jpg,340,453,187,250,1670727059479269,1670727059,AgM4N/Jbah5kOj+XTOtKlA==,21194,0,,terry-is-the-best-classic-fighting-game-hero,2,6,2,1670747899,0.0,0.0,1.0,0.0,"[{'no': 9482105, 'now': '12/10/22(Sat)21:56:18', 'name': 'Anonymous', 'com': 'Okay!', 'time': 1670727378, 'resto': 9482092}, {'no': 9482114, 'now': '12/10/22(Sat)21:58:26', 'name': 'Anonymous', 'com': '<a href=""#p9482092"" class=""quotelink"">&gt;&gt;9482092</a><br>No', 'filename': 'Super_Zangief', 'ext': '.png', 'w': 219, 'h': 452, 'tn_w': 60, 'tn_h': 125, 'tim': 1670727506902914, 'time': 1670727506, 'md5': 'hoPsCPdS9iARbgzSMOoELA==', 'fsize': 141379, 'resto': 9482092}, {'no': 9482129, 'now': '12/10/22(Sat)22:06:15', 'name': 'Anonymous', 'com': '<a href=""#p9482092"" class=""quotelink"">&gt;&gt;9482092</a><br>Yeah. He&#039;s pretty cool. I miss the days when a fighting game character could just be a pretty cool normal dude who knows how to fight.', 'filename': 'terry 8', 'ext': '.jpg', 'w': 900, 'h': 1900, 'tn_w': 59, 'tn_h': 125, 'tim': 1670727975631589, 'time': 1670727975, 'md5': 'C9xpX/hl1i2l+LLsP8iNeg==', 'fsize': 591704, 'resto': 9482092}, {'no': 9482739, 'now': '12/11/22(Sun)02:07:37', 'name': 'Anonymous', 'com': '<a href=""#p9482129"" class=""quotelink"">&gt;&gt;9482129</a><br>He&#039;s the ultimate fighting game protag', 'time': 1670742457, 'resto': 9482092}, {'no': 9482871, 'now': '12/11/22(Sun)03:38:19', 'name': 'Anonymous', 'com': '<a href=""#p9482092"" class=""quotelink"">&gt;&gt;9482092</a><br><br>Yep, you don&#039;t get much better than Terry.', 'time': 1670747899, 'resto': 9482092}]",
69,9481895,,,12/10/22(Sat)20:04:33,Anonymous,Donaldland,Everytime I look at this game I get so fucking hungry for burgers,donaldland,.png,600,450,250,187,1670720673249621,1670720673,9/33UH434VqoeAMLjPYLyg==,378813,0,,donaldland,2,17,9,1670747657,0.0,0.0,12.0,9.0,"[{'no': 9482702, 'now': '12/11/22(Sun)01:34:13', 'name': 'Anonymous', 'com': '<a href=""#p9481962"" class=""quotelink"">&gt;&gt;9481962</a><br>What does the M.C. stand for?', 'time': 1670740453, 'resto': 9481895}, {'no': 9482727, 'now': '12/11/22(Sun)01:54:13', 'name': 'Anonymous', 'com': '<a href=""#p9482702"" class=""quotelink"">&gt;&gt;9482702</a><br>Masters of Ceremony', 'time': 1670741653, 'resto': 9481895}, {'no': 9482829, 'now': '12/11/22(Sun)03:09:37', 'name': 'Anonymous', 'com': '<a href=""#p9482702"" class=""quotelink"">&gt;&gt;9482702</a><br>McDonald&#039;s Consumer', 'time': 1670746177, 'resto': 9481895}, {'no': 9482858, 'now': '12/11/22(Sun)03:31:33', 'name': 'Anonymous', 'com': '<a href=""#p9482571"" class=""quotelink"">&gt;&gt;9482571</a><br>When I was young (probably 4 or 5) I used to watch the McDonald&#039;s klasky csupo cartoons over and over on repeat. When I see it I recall but otherwise don&#039;t really remember any of it', 'time': 1670747493, 'resto': 9481895}, {'no': 9482862, 'now': '12/11/22(Sun)03:34:17', 'name': 'Anonymous', 'com': '<a href=""#p9482727"" class=""quotelink"">&gt;&gt;9482727</a><br>&#039;Murrican Consumer Kids', 'time': 1670747657, 'resto': 9481895}]",
70,9469872,,,12/06/22(Tue)00:06:48,Anonymous,,What term do you call these games for short?,EjVgBj-XYAsUU75,.jpg,1200,778,250,162,1670303208226536,1670303208,mEcpqwMGR0WD1Jz92+IZEg==,79285,0,,what-term-do-you-call-these-games-for-short,2,82,11,1670747521,0.0,0.0,77.0,10.0,"[{'no': 9481819, 'now': '12/10/22(Sat)19:30:25', 'name': 'Anonymous', 'com': '<a href=""#p9481793"" class=""quotelink"">&gt;&gt;9481793</a><br><a href=""#p9481805"" class=""quotelink"">&gt;&gt;9481805</a><br>Speaking of which', 'filename': '1601607031313', 'ext': '.jpg', 'w': 1600, 'h': 1163, 'tn_w': 125, 'tn_h': 90, 'tim': 1670718625071456, 'time': 1670718625, 'md5': 'iZWdxSi6vIzRbHEj2IpGag==', 'fsize': 255288, 'resto': 9469872}, {'no': 9481946, 'now': '12/10/22(Sat)20:38:17', 'name': 'Anonymous', 'com': '<a href=""#p9481819"" class=""quotelink"">&gt;&gt;9481819</a><br>That Sly looks like a gremlin in that.', 'time': 1670722697, 'resto': 9469872}, {'no': 9481952, 'now': '12/10/22(Sat)20:40:46', 'name': 'Anonymous', 'com': '<a href=""#p9469889"" class=""quotelink"">&gt;&gt;9469889</a><br>playstation 3d platformers...', 'time': 1670722846, 'resto': 9469872}, {'no': 9482006, 'now': '12/10/22(Sat)21:09:20', 'name': 'Anonymous', 'com': '<a href=""#p9469889"" class=""quotelink"">&gt;&gt;9469889</a><br>I&#039;m sure there&#039;s some gay name for them <br>This weird line of Sony platformers', 'time': 1670724560, 'resto': 9469872}, {'no': 9482859, 'now': '12/11/22(Sun)03:32:01', 'name': 'Anonymous', 'com': '<a href=""#p9481816"" class=""quotelink"">&gt;&gt;9481816</a><br><span class=""quote"">&gt;I don&#039;t get how people hate Sly 3 over 2 when 3 is just 2 that doesn&#039;t overstay its welcome</span><br>Based', 'time': 1670747521, 'resto': 9469872}]",
