,no,sticky,closed,now,name,sub,com,filename,ext,w,h,tn_w,tn_h,tim,time,md5,fsize,resto,capcode,semantic_url,custom_spoiler,replies,images,last_modified,bumplimit,imagelimit,omitted_posts,omitted_images,last_replies,spoiler
30,9474676,,,12/07/22(Wed)20:02:50,Anonymous,,"<span class=""quote"">&gt;that one save game you poured your heart and soul into that got overwritten or disappeared or got wiped somehow</span><br><br>Which game was it, anon?",mickey,.png,580,576,249,248,1670461370008476,1670461370,d2IhzaOXpLFdsNByBc5PYQ==,53762,0,,that-one-save-game-you-poured-your-heart-and-soul,2,42,10,1670756932,0.0,0.0,37.0,10.0,"[{'no': 9481320, 'now': '12/10/22(Sat)15:31:00', 'name': 'Anonymous', 'com': '<a href=""#p9474839"" class=""quotelink"">&gt;&gt;9474839</a><br>But she still lives on in your mind.', 'time': 1670704260, 'resto': 9474676}, {'no': 9481329, 'now': '12/10/22(Sat)15:37:04', 'name': 'Anonymous', 'com': 'Dragon Warrior Monsters. I was obsessed with the game and would leave it on my super gameboy overnight. Eventually I got a 99:99 save file. I was able to play for a while after that, but at some point the save file got corrupted, probably an overflow glitch, the curse music played at the beginning and my file was gone. I had gotten so obsessed over breeding boss monsters which takes hours and hours to do since they level up so slowly, and I never touched the game after I lost that progress.', 'time': 1670704624, 'resto': 9474676}, {'no': 9481516, 'now': '12/10/22(Sat)16:43:24', 'name': 'Anonymous', 'com': '<a href=""#p9474676"" class=""quotelink"">&gt;&gt;9474676</a><br>I have never beaten FF9 because when it came out I repeatedly got to the beginning of the second disc before my save somehow got deleted.<br>Once the whole card corrupted.<br>Once my friend overwrote it.<br>Once I took my memory card to a friends house to play Crash Team Racing and lost it.<br>Once more it corrupted (Mad Catz memory cards are shaky).<br>I kept trying, but every time I play now I get to the Ice Caves and just get pissed off. I need to try it again, I need to beat it some day.', 'time': 1670708604, 'resto': 9474676}, {'no': 9481590, 'now': '12/10/22(Sat)17:27:36', 'name': 'Anonymous', 'com': 'I had several dozen fallout 2 save files each with hundreds of hours and a different main character that were victims of disc rot. Its the only game I ever bothered to do that for.', 'time': 1670711256, 'resto': 9474676}, {'no': 9483073, 'now': '12/11/22(Sun)06:08:52', 'name': 'Anonymous', 'com': 'My mom&#039;s friend invited her son over to play PS2 when I was younger. He wanted to play Sonic Heroes. I said we can play 2P mode and he can use the 2P controller. He had an anger tantrum because he wants the 1P controller because he always plays as 1P in his house. He got so mad that he deleted my save file. RIP trying to get all the emblems.', 'time': 1670756932, 'resto': 9474676}]",
31,9476073,,,12/08/22(Thu)11:24:54,Anonymous,,"This game aged like the finest wine. I din&#039;t even notice the 25 FPS after a few minutes, helps they are constant",1666810324164359s,.jpg,250,173,250,173,1670516694474883,1670516694,dhxSMKsYsU0uB8ql50svOw==,6088,0,,this-game-aged-like-the-finest-wine-i-dint-even,2,148,17,1670756871,0.0,0.0,143.0,17.0,"[{'no': 9483007, 'now': '12/11/22(Sun)05:31:08', 'name': 'Anonymous', 'com': '<a href=""#p9476073"" class=""quotelink"">&gt;&gt;9476073</a><br>played this seriously for the first time this year and loved it even if it frustrated me like 3 times. is this weird or normal? anyone else?', 'time': 1670754668, 'resto': 9476073}, {'no': 9483013, 'now': '12/11/22(Sun)05:37:28', 'name': 'Anonymous', 'com': 'Fuck Bill Trannen for thinking he can speak on the lore. Sheik makes no sense either way (can&#039;t be just Zelda in a generic disguise since face, skin frame, strength, etc. is all different from her) so the best thing is to keep it a mystery what Zelda really did to &#039;transform&#039;. It&#039;s that easy<br>It&#039;s the game&#039;s only objective flaw if this gaijin retard keeps running his mouth as if he wrote the story<br><br>That said, the manga actually nailed the Sheik thing if nothing else', 'time': 1670755048, 'resto': 9476073}, {'no': 9483027, 'now': '12/11/22(Sun)05:43:37', 'name': 'Anonymous', 'com': '<a href=""#p9482414"" class=""quotelink"">&gt;&gt;9482414</a><br>lol<br><a href=""#p9481391"" class=""quotelink"">&gt;&gt;9481391</a><br>stop feeding the mentally ill just laugh at them', 'time': 1670755417, 'resto': 9476073}, {'no': 9483060, 'now': '12/11/22(Sun)06:02:21', 'name': 'Anonymous', 'com': '<a href=""#p9476076"" class=""quotelink"">&gt;&gt;9476076</a><br><a href=""#p9476073"" class=""quotelink"">&gt;&gt;9476073</a><br>OoT&#039;s FPS is actually kind of a weird situation, it only renders graphics at 20fps but the game logic actually runs at 60fps (each visual frame is repeated 3 times) and it accepts inputs at 60fps. It&#039;s weird to wrap your head around, but it makes it play WAY better than it would if it was actually running at 20fps.', 'time': 1670756541, 'resto': 9476073}, {'no': 9483070, 'now': '12/11/22(Sun)06:07:51', 'name': 'Anonymous', 'com': '<a href=""#p9476073"" class=""quotelink"">&gt;&gt;9476073</a><br>You were young at the time and it was marketed by Nintendo, featuring its most popular mascot. Another company trying to replicate the game would not be able to replicate the conditions to make it as enjoyable no matter how good the gameplay could be.', 'time': 1670756871, 'resto': 9476073}]",
32,9481000,,,12/10/22(Sat)12:39:53,Anonymous,Any comfy Christmas licence games?,Played this in December 2016 and it was the comfiest time of my life,HomeAlone1game,.jpg,271,370,183,250,1670693993551766,1670693993,yMuM3UDvyNJkGeSQa5JcKg==,185655,0,,any-comfy-christmas-licence-games,2,8,1,1670756837,0.0,0.0,3.0,1.0,"[{'no': 9481165, 'now': '12/10/22(Sat)14:13:29', 'name': 'Anonymous', 'com': '<a href=""#p9481105"" class=""quotelink"">&gt;&gt;9481105</a><br>the bricks on marv&#039;s face is legit one of the most brutal scenes on tv', 'time': 1670699609, 'resto': 9481000}, {'no': 9481170, 'now': '12/10/22(Sat)14:16:22', 'name': 'Anonymous', 'com': '<a href=""#p9481105"" class=""quotelink"">&gt;&gt;9481105</a><br>I don&#039;t like seeing people stepping on nails or other things that infure the feet. It&#039;s the same reason I don&#039;t like that scene in Die Hard. Aside from that the violence is mostly cartoony', 'time': 1670699782, 'resto': 9481000}, {'no': 9483002, 'now': '12/11/22(Sun)05:26:52', 'name': 'Anonymous', 'com': '<a href=""#p9481000"" class=""quotelink"">&gt;&gt;9481000</a><br>2016 christmas somehow felt particularly comfy', 'time': 1670754412, 'resto': 9481000}, {'no': 9483019, 'now': '12/11/22(Sun)05:40:31', 'name': 'Anonymous', 'com': '<a href=""#p9481170"" class=""quotelink"">&gt;&gt;9481170</a><br><span class=""quote"">&gt;mostly cartoony</span><br>The part where he dips his flaming head in the toilet of gas does seem like a chunk of his head might&#039;ve been blown off if it was real life. There&#039;s no way anyone would actually survive what those two went through.', 'time': 1670755231, 'resto': 9481000}, {'no': 9483068, 'now': '12/11/22(Sun)06:07:17', 'name': 'Anonymous', 'com': '<a href=""#p9481170"" class=""quotelink"">&gt;&gt;9481170</a><br>Die Hard traumatized me as a 5 year old and I have had a lifelong phobia of broken glass. Seeing him pull out that big ol bloody chunk from his feet haunts me 30 years later', 'time': 1670756837, 'resto': 9481000}]",
33,9479898,,,12/09/22(Fri)23:10:20,Anonymous,AV Switch Boxes,"I&#039;ve been meaning to buy a nice AV Switch Box for a while now, but don&#039;t know what brand is a good one. I found the Gamestop one and it looks good, but will the signal be crap going between the console to the tv?",s-l1600 (7),.jpg,1600,1200,250,187,1670645420380735,1670645420,3Dr2qZo0lC5CqTN/fdLjMw==,196424,0,,av-switch-boxes,2,52,7,1670756789,0.0,0.0,47.0,6.0,"[{'no': 9482742, 'now': '12/11/22(Sun)02:09:48', 'name': 'Anonymous', 'com': '<a href=""#p9481073"" class=""quotelink"">&gt;&gt;9481073</a><br>Thank you for taking the time to do this', 'time': 1670742588, 'resto': 9479898}, {'no': 9482759, 'now': '12/11/22(Sun)02:24:56', 'name': 'Anonymous', 'com': '<a href=""#p9480165"" class=""quotelink"">&gt;&gt;9480165</a><br>What is the Grave of the Fireflies tin from?', 'time': 1670743496, 'resto': 9479898}, {'no': 9482764, 'now': '12/11/22(Sun)02:28:03', 'name': 'Anonymous', 'com': '<a href=""#p9480002"" class=""quotelink"">&gt;&gt;9480002</a><br>I use it with my PS1, PS2, N64, SNES, GameCube and Saturn you lil bitch. I only use composite with my PC Engine and Mega Drive since that&#039;s all they have.', 'time': 1670743683, 'resto': 9479898}, {'no': 9482838, 'now': '12/11/22(Sun)03:15:24', 'name': 'Anonymous', 'com': '<a href=""#p9480446"" class=""quotelink"">&gt;&gt;9480446</a><br>Well that one in OP is like $30 on ebay and is Gamestop branded.', 'time': 1670746524, 'resto': 9479898}, {'no': 9483065, 'now': '12/11/22(Sun)06:06:29', 'name': 'Anonymous', 'com': '<a href=""#p9480001"" class=""quotelink"">&gt;&gt;9480001</a><br>I did not know that was a requirement. Then the one you posted looks good. I also see there&#039;s a Radio Shack one that also has that input.<br><br><a href=""#p9480053"" class=""quotelink"">&gt;&gt;9480053</a><br>For what purpose?<br><br><a href=""#p9480360"" class=""quotelink"">&gt;&gt;9480360</a><br>They are made in small batches. SuperG only made a few JP21 editions of the gSCARTsw, and I made the mistake of asking for only one to allow others to get some and not be greedy. Little did I know then that he would never make any more ever again.', 'filename': 'I_gots_the_hookups', 'ext': '.jpg', 'w': 2592, 'h': 1944, 'tn_w': 125, 'tn_h': 93, 'tim': 1670756789539493, 'time': 1670756789, 'md5': 'Rw05li8cH4UU9489HRwFAA==', 'fsize': 627476, 'resto': 9479898}]",
34,9478982,,,12/09/22(Fri)15:42:21,Anonymous,,"Someone posted this image on /ck/ and it reminded me how much I hated pre-rendered backgrounds in 3d games as a kid. Growing up with the SNES and Genesis, I remember the first game we got in 3D was Mario 64, which gives you a very physical, tactile environment where your character interacts with every surface and edge. Then you play something like Zelda or Final Fantasy of the same generation and you get these weird environments where you never feel like your character collides with anything, like your character is running around in a clear box with invisible walls and there is a background superimposed via green screen. As I got older and understood why it was made that way I appreciated the effort and extra detail allowed by it, but as a kid it always bugged me and still does to a degree.<br><br>Did this bother anyone else as a kid or just me?",1670549204748224,.png,640,480,250,187,1670618541265642,1670618541,4cKIq63jswcuK56h/ml9Fg==,348417,0,,someone-posted-this-image-on-ck-and-it-reminded,2,11,2,1670756714,0.0,0.0,6.0,1.0,"[{'no': 9482464, 'now': '12/10/22(Sat)23:48:17', 'name': 'Anonymous', 'com': '<a href=""#p9479508"" class=""quotelink"">&gt;&gt;9479508</a><br>you arent a fucking zoomer if you were playing zelda on gamecube in 2003', 'time': 1670734097, 'resto': 9478982}, {'no': 9482490, 'now': '12/10/22(Sat)23:56:40', 'name': 'Anonymous', 'com': '<a href=""#p9479508"" class=""quotelink"">&gt;&gt;9479508</a><br><span class=""quote"">&gt;but that shit is jarring and actually gets in the way of gameplay sometimes</span><br>Yeah, I agree. I love prerendered backgrounds, especially in FF7, but I can immediately recall tons of times I got confused or lost because of them even with the pop-up help icons FF7 had. That doesn&#039;t happen near as much anymore with most games having full camera control now.', 'time': 1670734600, 'resto': 9478982}, {'no': 9483015, 'now': '12/11/22(Sun)05:39:07', 'name': 'Anonymous', 'com': '<a href=""#p9479005"" class=""quotelink"">&gt;&gt;9479005</a><br>N64 textures are some of the ugliest shit that ever happened. I’m saying this as some one who fully bought into it at the time.', 'time': 1670755147, 'resto': 9478982}, {'no': 9483047, 'now': '12/11/22(Sun)05:54:05', 'name': 'Anonymous', 'com': 'Prerrendered backgrounds is one example of the sacrifices in the transition to 3D, elements such as realism and cinematics being more important than gameplay and interactivity. I prefer the later than the former, but the former is what makes videogames as popular as they are now. Not that I find this popularity a positive trait.', 'time': 1670756045, 'resto': 9478982}, {'no': 9483064, 'now': '12/11/22(Sun)06:05:14', 'name': 'Anonymous', 'com': '<a href=""#p9479341"" class=""quotelink"">&gt;&gt;9479341</a><br>Probably because emulators often use 4 point bilinear filtering rather than three point filtering as used on the console itself.', 'filename': 'IMG_20221211_220451', 'ext': '.jpg', 'w': 1080, 'h': 1996, 'tn_w': 67, 'tn_h': 124, 'tim': 1670756714820425, 'time': 1670756714, 'md5': 'A32bWzN/OlGGcg2Jb0O+Iw==', 'fsize': 580796, 'resto': 9478982}]",
35,9450015,,,11/28/22(Mon)10:00:15,Anonymous,,the best JRPG on gameboy and the level curve contributes to that,png,.png,225,225,225,225,1669647615064956,1669647615,fmBAuPSQETBFknIpPlB6cQ==,139029,0,,the-best-jrpg-on-gameboy-and-the-level-curve,2,295,37,1670756696,0.0,0.0,290.0,37.0,"[{'no': 9482918, 'now': '12/11/22(Sun)04:18:38', 'name': 'Anonymous', 'com': '<a href=""#p9450521"" class=""quotelink"">&gt;&gt;9450521</a><br><span class=""quote"">&gt;More pokeballs, machines, and side content that, in time, helped the game become more people with the kawai crowd than the original kids who wanted to go on adventures</span><br>I think anime is cancer, but this is the gayest take i&#039;ve ever seen. Idk how you could posted that without the realization and deep shame of how much of a boomer you are.', 'time': 1670750318, 'resto': 9450015}, {'no': 9483012, 'now': '12/11/22(Sun)05:36:58', 'name': 'Anonymous', 'com': '<a href=""#p9481649"" class=""quotelink"">&gt;&gt;9481649</a><br>The difference is that Pokemon is so stupidly easy you can never fuck yourself over THAT hard.', 'time': 1670755018, 'resto': 9450015}, {'no': 9483032, 'now': '12/11/22(Sun)05:46:32', 'name': 'Anonymous', 'com': '<a href=""#p9450731"" class=""quotelink"">&gt;&gt;9450731</a><br>rent free', 'time': 1670755592, 'resto': 9450015}, {'no': 9483038, 'now': '12/11/22(Sun)05:49:21', 'name': 'Anonymous', 'com': 'hoenn mogs, mega zoomies cant into a few water routes.', 'time': 1670755761, 'resto': 9450015}, {'no': 9483063, 'now': '12/11/22(Sun)06:04:56', 'name': 'Anonymous', 'com': '<a href=""#p9482918"" class=""quotelink"">&gt;&gt;9482918</a><br>I was 10 at the time, and now I’m 30. I dont need to realize that Pokémon’s target audience has changed for worse.', 'time': 1670756696, 'resto': 9450015}]",
36,9453492,,,11/29/22(Tue)18:13:27,Anonymous,Mystical Ninja 2 Starring Goemon was pure SOVL,"<span class=""quote"">&gt;2.5d platforming at it&#039;s finest</span><br><span class=""quote"">&gt;cool RPG-lite elements</span><br><span class=""quote"">&gt;fun mini-quests</span><br><span class=""quote"">&gt;hilarious story</span><br><span class=""quote"">&gt;4 interesting and different characters to choose from</span><br><span class=""quote"">&gt;same screen co-op</span><br><span class=""quote"">&gt;epic boss-fights in MECHS</span><br><span class=""quote"">&gt;day/night cycle</span>",maxresdefault,.jpg,1280,720,250,140,1669763607272792,1669763607,H1wigSt5YE+y1t+vfe4B9A==,229971,0,,mystical-ninja-2-starring-goemon-was-pure-sovl,2,76,16,1670756689,0.0,0.0,71.0,16.0,"[{'no': 9481879, 'now': '12/10/22(Sat)19:59:19', 'name': 'Anonymous', 'com': '<a href=""#p9481252"" class=""quotelink"">&gt;&gt;9481252</a><br>Cool factor', 'time': 1670720359, 'resto': 9453492}, {'no': 9481886, 'now': '12/10/22(Sat)20:01:18', 'name': 'Anonymous', 'com': '<a href=""#p9481040"" class=""quotelink"">&gt;&gt;9481040</a><br>Its presence is the difference between a poser and someone who actually likes video games', 'time': 1670720478, 'resto': 9453492}, {'no': 9481893, 'now': '12/10/22(Sat)20:03:49', 'name': 'Anonymous', 'com': 'Is there a patch for the latest version of the Goemon 3 translation so that it runs on real hardware without crashing', 'time': 1670720629, 'resto': 9453492}, {'no': 9483059, 'now': '12/11/22(Sun)06:00:40', 'name': 'Anonymous', 'com': 'post<br><br>favorite boss<br><br>favorite island<br><br>favorite village<br><br>favorite 2 characters to play as', 'time': 1670756440, 'resto': 9453492}, {'no': 9483062, 'now': '12/11/22(Sun)06:04:49', 'name': 'Anonymous', 'com': '<a href=""#p9481893"" class=""quotelink"">&gt;&gt;9481893</a><br>I think so, but good luck finding it', 'time': 1670756689, 'resto': 9453492}]",
37,9482917,,,12/11/22(Sun)04:18:31,Anonymous,,"I&#039;ve yet to play this myself, but thinking of gifting it to a sibling for Christmas who had recent brought a PS2.<br><br>She&#039;s not a huge gamer, purchasing the PS2 mostly to play some LotR games as she&#039;s a Tolkien fan.<br><br>I thought I&#039;d gift her some better games for the console, and people say this is brilliant. However, how&#039;s the difficulty for a casual gamer? She&#039;s probably give up if it&#039;s frustratingly difficult.<br><br>Also, any other recommendations? Was otherwise thinking of Kingdom Hearts, but worried that could be a bit too kiddie for a 30 year old.",ps2_shadow_of_the_colossus-110214-2495094880,.jpg,640,905,176,250,1670750311321426,1670750311,pogYd7Qdymf3gfb35oe4UA==,82973,0,,ive-yet-to-play-this-myself-but-thinking-of,2,10,1,1670756344,0.0,0.0,5.0,1.0,"[{'no': 9482994, 'now': '12/11/22(Sun)05:19:03', 'name': 'Anonymous', 'com': '<a href=""#p9482917"" class=""quotelink"">&gt;&gt;9482917</a><br>brutally overrated and repetitive with some of the worst camera, gameplay and framerate i&#039;ve ever seen<br><br>still worth playing for the presentation', 'time': 1670753943, 'resto': 9482917}, {'no': 9483005, 'now': '12/11/22(Sun)05:28:51', 'name': 'Anonymous', 'com': '<a href=""#p9482943"" class=""quotelink"">&gt;&gt;9482943</a><br><span class=""quote"">&gt;it basically is boss rush the gam</span><br>That&#039;s bullshit. Have you even played it? Each next colossus is farther away and harder to discover. Exploring the world is a big part of the game.', 'time': 1670754531, 'resto': 9482917}, {'no': 9483042, 'now': '12/11/22(Sun)05:53:26', 'name': 'Anonymous', 'com': '<a href=""#p9483005"" class=""quotelink"">&gt;&gt;9483005</a><br>I was talking about how the only objective in the game is to defeat the next boss. Yes, I have beat it and bought it on launch day. Exploring is huge and the lore is amazing. I was over simplifying it since OP has never played the game for himself', 'time': 1670756006, 'resto': 9482917}, {'no': 9483050, 'now': '12/11/22(Sun)05:56:19', 'name': 'Anonymous', 'com': '<a href=""#p9482961"" class=""quotelink"">&gt;&gt;9482961</a><br>Thanks. Already picked up FFX since that was cheap and accessible. Feel I need another as it was so cheap.<br><br>Trying SotC now on PCSX2.<br><br><a href=""#p9482963"" class=""quotelink"">&gt;&gt;9482963</a><br>Not really.<br><br><a href=""#p9482943"" class=""quotelink"">&gt;&gt;9482943</a><br>Thanks for this list.<br><br><a href=""#p9482968"" class=""quotelink"">&gt;&gt;9482968</a><br>She certainly likes her horses.<br><span class=""quote"">&gt;It&#039;s less than 10$ on ebay so meh why not.</span><br>Wish that was the case in NZ, where she lives. Only copy I can find is $44 in USD.', 'time': 1670756179, 'resto': 9482917}, {'no': 9483056, 'now': '12/11/22(Sun)05:59:04', 'name': 'Anonymous', 'com': '<a href=""#p9482994"" class=""quotelink"">&gt;&gt;9482994</a><br>You can tell the director made movie games before', 'time': 1670756344, 'resto': 9482917}]",
38,9470779,,,12/06/22(Tue)09:58:45,Anonymous,,Best JRPG? And don&#039;t say Chrono trigger,345screenshot2,.png,256,224,250,218,1670338725375418,1670338725,cQcE4jMAvvHP6Z3hpcYq2Q==,23423,0,,best-jrpg-and-dont-say-chrono-trigger,2,137,27,1670756282,0.0,0.0,132.0,26.0,"[{'no': 9482753, 'now': '12/11/22(Sun)02:20:33', 'name': 'Anonymous', 'com': '<a href=""#p9470891"" class=""quotelink"">&gt;&gt;9470891</a>', 'filename': 'my-nigga', 'ext': '.gif', 'w': 470, 'h': 200, 'tn_w': 125, 'tn_h': 53, 'tim': 1670743233154729, 'time': 1670743233, 'md5': 'a1+G5yZ5LaVwjc8jZbXiBA==', 'fsize': 2547428, 'resto': 9470779}, {'no': 9482781, 'now': '12/11/22(Sun)02:40:54', 'name': 'Anonymous', 'com': '<a href=""#p9482545"" class=""quotelink"">&gt;&gt;9482545</a><br>Spent so much time in the Ancient Cave, I love it. It&#039;s basically an entire other game inside the game. Best sidequest ever, and I love the Ancient Cave romhacks people make for other games.', 'time': 1670744454, 'resto': 9470779}, {'no': 9482791, 'now': '12/11/22(Sun)02:46:14', 'name': 'Anonymous', 'com': '<a href=""#p9470779"" class=""quotelink"">&gt;&gt;9470779</a><br><span class=""quote"">&gt;what&#039;s 2+2 and DON&#039;T say 4</span>', 'time': 1670744774, 'resto': 9470779}, {'no': 9483048, 'now': '12/11/22(Sun)05:55:27', 'name': 'Anonymous', 'com': '<a href=""#p9470779"" class=""quotelink"">&gt;&gt;9470779</a><br>tales of symphonia. no tedium, perfect monster encounter system, fun fast paced dungeons, quick action combat<br>i say this as a christfag too', 'time': 1670756127, 'resto': 9470779}, {'no': 9483053, 'now': '12/11/22(Sun)05:58:02', 'name': 'Anonymous', 'com': '<a href=""#p9477929"" class=""quotelink"">&gt;&gt;9477929</a><br>The Last Story was also amazing and pushes similar buttons. Insane hub atmosphere and character dynamics in such a small package, great combat albeit too easy', 'time': 1670756282, 'resto': 9470779}]",
39,9475653,,,12/08/22(Thu)06:02:07,Anonymous,,why does max have this poster in front of his bed,max&#039;s room,.png,1317,1080,250,205,1670497327186762,1670497327,GfdDzCcf2SUJEca/rbKKzQ==,2007249,0,,why-does-max-have-this-poster-in-front-of-his-bed,2,23,4,1670756251,0.0,0.0,18.0,3.0,"[{'no': 9480362, 'now': '12/10/22(Sat)04:31:10', 'name': 'Anonymous', 'com': '<a href=""#p9475653"" class=""quotelink"">&gt;&gt;9475653</a><br>MAX IS A HOMO', 'time': 1670664670, 'resto': 9475653}, {'no': 9481145, 'now': '12/10/22(Sat)14:06:26', 'name': 'Anonymous', 'com': '<a href=""#p9480362"" class=""quotelink"">&gt;&gt;9480362</a><br>Max Goof is the most likely Disney character to have premarital sex (not counting young Scrooge &quot;Gigachad&quot; McDuck, of course).', 'time': 1670699186, 'resto': 9475653}, {'no': 9481747, 'now': '12/10/22(Sat)19:05:45', 'name': 'Anonymous', 'com': '<a href=""#p9481145"" class=""quotelink"">&gt;&gt;9481145</a><br>he is married in the eyes of the lord', 'filename': 'baby-eats-camera-and-sings-the-w', 'ext': '.jpg', 'w': 1280, 'h': 720, 'tn_w': 125, 'tn_h': 70, 'tim': 1670717145681308, 'time': 1670717145, 'md5': 'AyjAzAU4D24aPEm1jYX11Q==', 'fsize': 55246, 'resto': 9475653}, {'no': 9483043, 'now': '12/11/22(Sun)05:53:34', 'name': 'Anonymous', 'com': '<a href=""#p9475653"" class=""quotelink"">&gt;&gt;9475653</a><br>proof', 'time': 1670756014, 'resto': 9475653}, {'no': 9483052, 'now': '12/11/22(Sun)05:57:31', 'name': 'Anonymous', 'com': 'He&#039;s a lumbersexual', 'time': 1670756251, 'resto': 9475653}]",
40,9465654,,,12/04/22(Sun)15:40:31,Anonymous,collage,,Jubei Quest,.png,768,1440,133,250,1670186431966336,1670186431,okTTVpY2j0fLGgUCqrLHSw==,152104,0,,collage,2,86,62,1670756233,0.0,0.0,81.0,60.0,"[{'no': 9479478, 'now': '12/09/22(Fri)19:28:53', 'name': 'Anonymous', 'com': '<a href=""#p9479475"" class=""quotelink"">&gt;&gt;9479475</a>', 'filename': 'Wonder Trek 7', 'ext': '.jpg', 'w': 3516, 'h': 2880, 'tn_w': 125, 'tn_h': 102, 'tim': 1670632133693005, 'time': 1670632133, 'md5': 'Dm4gVThGJSexjy33jD4fJg==', 'fsize': 3614018, 'resto': 9465654}, {'no': 9479486, 'now': '12/09/22(Fri)19:34:19', 'name': 'Anonymous', 'com': '<a href=""#p9474206"" class=""quotelink"">&gt;&gt;9474206</a><br><a href=""#p9474210"" class=""quotelink"">&gt;&gt;9474210</a><br><a href=""#p9479460"" class=""quotelink"">&gt;&gt;9479460</a><br>What shader are you using? It&#039;s the best I&#039;ve seen at blending sprites with the backgrounds.', 'time': 1670632459, 'resto': 9465654}, {'no': 9481689, 'now': '12/10/22(Sat)18:31:26', 'name': 'Anonymous', 'com': '<a href=""#p9479486"" class=""quotelink"">&gt;&gt;9479486</a><br>bumping because i also want to know', 'filename': 'Screenshot_20221208_121304_Read Chan', 'ext': '.jpg', 'w': 495, 'h': 609, 'tn_w': 101, 'tn_h': 125, 'tim': 1670715086824842, 'time': 1670715086, 'md5': 'jXMgd8sbpGEKiqEbPzoASg==', 'fsize': 230253, 'resto': 9465654}, {'no': 9481708, 'now': '12/10/22(Sat)18:43:18', 'name': 'Anonymous', 'com': '<a href=""#p9479486"" class=""quotelink"">&gt;&gt;9479486</a><br><a href=""#p9481689"" class=""quotelink"">&gt;&gt;9481689</a><br>crt-royale-xm29plus in retroarch', 'time': 1670715798, 'resto': 9465654}, {'no': 9483051, 'now': '12/11/22(Sun)05:57:13', 'name': 'Anonymous', 'com': '<a href=""#p9475541"" class=""quotelink"">&gt;&gt;9475541</a><br><br>she is the only reason why i want to play that videogame again', 'time': 1670756233, 'resto': 9465654}]",
