,no,now,name,com,filename,ext,w,h,tn_w,tn_h,tim,time,md5,fsize,resto,bumplimit,imagelimit,semantic_url,custom_spoiler,replies,images,omitted_posts,omitted_images,last_replies,last_modified,sub
51,177732785,12/10/22(Sat)05:22:01,Anonymous,It&#039;s exactly 60 years old today. How does it make you feel?,1618359939759,.jpg,2160,2880,187,250,1670667721841584,1670667721,h1PowemHlgwlNDtG+8PNvA==,751799,0,0,0,lawrence-of-arabia-was-released-on-10-december,5,51,9,46.0,8.0,"[{'no': 177734217, 'now': '12/10/22(Sat)06:58:12', 'name': 'Anonymous', 'com': '<a href=""#p177733096"" class=""quotelink"">&gt;&gt;177733096</a><br>Artistry.', 'time': 1670673492, 'resto': 177732785}, {'no': 177734236, 'now': '12/10/22(Sat)06:59:13', 'name': 'Anonymous', 'com': '<a href=""#p177732785"" class=""quotelink"">&gt;&gt;177732785</a><br>Not enough KINO in the last 60 years, that&#039;s how I feel.', 'time': 1670673553, 'resto': 177732785}, {'no': 177734267, 'now': '12/10/22(Sat)07:01:10', 'name': 'Anonymous', 'com': 'Makes me sad that epics are gone.', 'time': 1670673670, 'resto': 177732785}, {'no': 177734272, 'now': '12/10/22(Sat)07:01:17', 'name': 'Anonymous', 'com': 'O&#039;Toole was based', 'filename': '1665106488472448', 'ext': '.jpg', 'w': 1080, 'h': 982, 'tn_w': 125, 'tn_h': 113, 'tim': 1670673677103785, 'time': 1670673677, 'md5': 'SbCkWDhpBHYISRNBtcWDlA==', 'fsize': 577799, 'resto': 177732785}, {'no': 177734292, 'now': '12/10/22(Sat)07:02:28', 'name': 'Anonymous', 'com': '<a href=""#p177732807"" class=""quotelink"">&gt;&gt;177732807</a><br>lmao don&#039;t blow up from all the anger, Omar', 'time': 1670673748, 'resto': 177732785}]",1670673748,"Lawrence of Arabia was released on 10 December, 1962."
52,177733283,12/10/22(Sat)05:57:26,Anonymous,A thread for the discussion of the essential kinos for heterosexual men.,barbbrothers,.jpg,1465,2285,160,250,1670669846024750,1670669846,BCs2jII5JXLcHj7e6bvwqA==,1204576,0,0,0,hetro,5,5,1,,,"[{'no': 177733300, 'now': '12/10/22(Sat)05:58:40', 'name': 'Anonymous', 'com': '<a href=""#p177733283"" class=""quotelink"">&gt;&gt;177733283</a><br>Has their scenes in pulp fiction ever been released ?', 'time': 1670669920, 'resto': 177733283}, {'no': 177733961, 'now': '12/10/22(Sat)06:44:06', 'name': 'Anonymous', 'com': '<span class=""quote"">&gt;richard lynch</span><br><span class=""quote"">&gt;ruggero deodato</span><br><span class=""quote"">&gt;some hot italian bitches</span><br>kino', 'time': 1670672646, 'resto': 177733283}, {'no': 177734115, 'now': '12/10/22(Sat)06:51:56', 'name': 'Anonymous', 'com': '<a href=""#p177733283"" class=""quotelink"">&gt;&gt;177733283</a><br>Nightmare Beach', 'filename': 'nightmarebeach1', 'ext': '.jpg', 'w': 395, 'h': 215, 'tn_w': 125, 'tn_h': 68, 'tim': 1670673116220080, 'time': 1670673116, 'md5': 'wpeWJ5S0j6TsB/qTSnjEGQ==', 'fsize': 37229, 'resto': 177733283}, {'no': 177734164, 'now': '12/10/22(Sat)06:54:37', 'name': 'Anonymous', 'com': '<a href=""#p177733283"" class=""quotelink"">&gt;&gt;177733283</a><br>https://www.youtube.com/watch?v=xs4<wbr>v-zexx8M', 'time': 1670673277, 'resto': 177733283}, {'no': 177734279, 'now': '12/10/22(Sat)07:01:37', 'name': 'Anonymous', 'com': '<a href=""#p177733961"" class=""quotelink"">&gt;&gt;177733961</a><br>You KNOW it&#039;s a great film when it was made as a tax write off.', 'time': 1670673697, 'resto': 177733283}]",1670673697,/HETRO/
53,177726469,12/10/22(Sat)00:09:15,Anonymous,"<span class=""quote"">&gt;It&#039;s a &quot;Truman randomly thinks back to a time in high school when he tried to make friends but failed miserably and made a fool of himself and feels deeply ashamed&quot; episode.</span>",the-truman-show-anniversary-lede,.jpg,1024,682,250,166,1670648955986076,1670648955,1yrWcSKQp2pdqNAGZeC/ww==,127747,0,0,0,its-a-truman-randomly-thinks-back-to-a-time-in,5,132,14,127.0,13.0,"[{'no': 177734170, 'now': '12/10/22(Sat)06:55:03', 'name': 'Anonymous', 'com': '<a href=""#p177734111"" class=""quotelink"">&gt;&gt;177734111</a><br>Some people are just close to their siblings, anon. You also have to invest in the future or you end up like our current society.', 'time': 1670673303, 'resto': 177726469}, {'no': 177734182, 'now': '12/10/22(Sat)06:55:55', 'name': 'Anonymous', 'com': '<a href=""#p177734111"" class=""quotelink"">&gt;&gt;177734111</a><br>I taught myself how to play piano when I was about 20<br>My cousin got piano lessons for her daughter who at the time was about 10 or 11<br>I went over to their house once and was just fucking around on the piano and she absolutely SEETHED at the fact that I was better than her daughter - a literal child - at piano.<br>People are fucking insane dude', 'time': 1670673355, 'resto': 177726469}, {'no': 177734200, 'now': '12/10/22(Sat)06:57:21', 'name': 'Anonymous', 'com': '<a href=""#p177734111"" class=""quotelink"">&gt;&gt;177734111</a><br>It wasn&#039;t her parents...she invited Truman because she wanted him to go', 'time': 1670673441, 'resto': 177726469}, {'no': 177734212, 'now': '12/10/22(Sat)06:58:04', 'name': 'Anonymous', 'com': '<span class=""quote"">&gt;It&#039;s another &quot;Truman is 24 years old, unemployed and living with his parents, reminiscing his college years after covid took two of them away, and unable to kickstart a career until his mandatory army service is over</span><br>Seriously bros, when will this arc end?', 'filename': '1670413482385904', 'ext': '.jpg', 'w': 1438, 'h': 1424, 'tn_w': 125, 'tn_h': 123, 'tim': 1670673484807845, 'time': 1670673484, 'md5': 'OWEb6prrsTKLVa/oVOV2Pg==', 'fsize': 1096311, 'resto': 177726469}, {'no': 177734268, 'now': '12/10/22(Sat)07:01:12', 'name': 'Anonymous', 'com': '<a href=""#p177734212"" class=""quotelink"">&gt;&gt;177734212</a><br>When you stop using the word &quot;kickstart&quot; and start behaving like an adult', 'time': 1670673672, 'resto': 177726469}]",1670673672,
54,177733990,12/10/22(Sat)06:45:36,Anonymous,the movie references in Seinfeld aged poorly,1665485078608,.jpg,1200,676,250,140,1670672736486979,1670672736,SUg42GOYRDHR/OyQ/0Rjig==,152047,0,0,0,the-movie-references-in-seinfeld-aged-poorly,5,3,1,,,"[{'no': 177734109, 'now': '12/10/22(Sat)06:51:44', 'name': 'Anonymous', 'com': '<a href=""#p177733990"" class=""quotelink"">&gt;&gt;177733990</a><br>Conspiracy theories are very dangerous to our democracy in this age of disinformation', 'time': 1670673104, 'resto': 177733990}, {'no': 177734188, 'now': '12/10/22(Sat)06:56:17', 'name': 'Anonymous', 'com': '<span class=""quote"">&gt;6 million? i think not</span>', 'filename': 'Untitled', 'ext': '.png', 'w': 257, 'h': 187, 'tn_w': 125, 'tn_h': 90, 'tim': 1670673377460029, 'time': 1670673377, 'md5': '2U4vHtOKamTe/A7RSyskcw==', 'fsize': 5100, 'resto': 177733990}, {'no': 177734249, 'now': '12/10/22(Sat)07:00:13', 'name': 'Anonymous', 'com': '<a href=""#p177733990"" class=""quotelink"">&gt;&gt;177733990</a><br>This entire show aged badly. Literally the big bang theory of the 90s', 'time': 1670673613, 'resto': 177733990}]",1670673613,
55,177734151,12/10/22(Sat)06:53:59,Anonymous,"<span class=""quote"">&gt;this was a 10/10 on Giedi Prime</span>",image_2022-12-10_145255494,.png,297,420,176,250,1670673239966344,1670673239,GlBuPyR/XBKamR7Lg1DR+g==,159890,0,0,0,this-was-a-1010-on-giedi-prime,5,2,0,,,"[{'no': 177734199, 'now': '12/10/22(Sat)06:57:16', 'name': 'Anonymous', 'com': '<a href=""#p177734151"" class=""quotelink"">&gt;&gt;177734151</a><br>how many slave girls do you think he raped?', 'time': 1670673436, 'resto': 177734151}, {'no': 177734246, 'now': '12/10/22(Sat)06:59:41', 'name': 'Anonymous', 'com': 'feyd... lovely feyd', 'time': 1670673581, 'resto': 177734151}]",1670673581,
56,177725898,12/09/22(Fri)23:42:19,Anonymous,Kate Mara said it was awkward sitting beside her dad at the premiere of Shooter because she forgot she wore see through shirt and stripped to bra in movie. It must be awkward for parents of actors to see their children do nudity on screen.,1644192177102,.jpg,1818,1500,250,206,1670647339316210,1670647339,/RdWJeaEy9u/dBcyTYN8jQ==,3130923,0,0,0,kate-mara-said-it-was-awkward-sitting-beside-her,5,60,8,55.0,7.0,"[{'no': 177733541, 'now': '12/10/22(Sat)06:17:13', 'name': 'Anonymous', 'com': '<a href=""#p177728912"" class=""quotelink"">&gt;&gt;177728912</a><br><span class=""quote"">&gt;thread isn&#039;t related to trannies</span><br><span class=""quote"">&gt;nobody has mentioned trannies</span><br><span class=""quote"">&gt;&quot;WHAT ABOUT THEM TRANNIES THOUGH?!&quot;</span>', 'filename': 'schizo meds', 'ext': '.jpg', 'w': 1200, 'h': 630, 'tn_w': 125, 'tn_h': 65, 'tim': 1670671033957684, 'time': 1670671033, 'md5': 'IcMt9qK2xmMKkmCK7FwXOA==', 'fsize': 38328, 'resto': 177725898}, {'no': 177733886, 'now': '12/10/22(Sat)06:39:56', 'name': 'Anonymous', 'com': '<a href=""#p177726175"" class=""quotelink"">&gt;&gt;177726175</a><br>Is that Macron?', 'time': 1670672396, 'resto': 177725898}, {'no': 177733942, 'now': '12/10/22(Sat)06:42:58', 'name': 'Anonymous', 'com': '<a href=""#p177728947"" class=""quotelink"">&gt;&gt;177728947</a><br>Virgin detected', 'time': 1670672578, 'resto': 177725898}, {'no': 177733968, 'now': '12/10/22(Sat)06:44:21', 'name': 'Anonymous', 'com': '<a href=""#p177733886"" class=""quotelink"">&gt;&gt;177733886</a><br>Macron would never let such a young woman touch him.', 'time': 1670672661, 'resto': 177725898}, {'no': 177734239, 'now': '12/10/22(Sat)06:59:16', 'name': 'Anonymous', 'com': '<a href=""#p177728912"" class=""quotelink"">&gt;&gt;177728912</a><br>Lmao, did anyone actually fall for this?', 'time': 1670673556, 'resto': 177725898}]",1670673556,
57,177729059,12/10/22(Sat)02:09:38,Anonymous,tehfuck did I watch,Dune-PosterArt_CR,.jpg,310,413,187,250,1670656178743188,1670656178,prvijocrAqf6c5rizNETFg==,34409,0,0,0,tehfuck-did-i-watch,5,28,5,23.0,5.0,"[{'no': 177733889, 'now': '12/10/22(Sat)06:40:15', 'name': 'Anonymous', 'com': '<a href=""#p177729181"" class=""quotelink"">&gt;&gt;177729181</a><br>wrong<br>super wrong<br>not even close.', 'time': 1670672415, 'resto': 177729059}, {'no': 177733907, 'now': '12/10/22(Sat)06:41:27', 'name': 'Anonymous', 'com': '<a href=""#p177729059"" class=""quotelink"">&gt;&gt;177729059</a><br>Dune.', 'time': 1670672487, 'resto': 177729059}, {'no': 177734087, 'now': '12/10/22(Sat)06:50:38', 'name': 'Anonymous', 'com': '<a href=""#p177729596"" class=""quotelink"">&gt;&gt;177729596</a><br>DO NOT CLICK<br>its nerve gas.', 'time': 1670673038, 'resto': 177729059}, {'no': 177734204, 'now': '12/10/22(Sat)06:57:29', 'name': 'Anonymous', 'com': '<a href=""#p177729059"" class=""quotelink"">&gt;&gt;177729059</a><br>Not the fan edit, that&#039;s actually good.<br>https://youtu.be/vJykw3H4PDw', 'time': 1670673449, 'resto': 177729059}, {'no': 177734234, 'now': '12/10/22(Sat)06:59:07', 'name': 'Anonymous', 'com': '<a href=""#p177732865"" class=""quotelink"">&gt;&gt;177732865</a><br>I&#039;m convinced the only people who prefer DUNC are paid shills and those who haven&#039;t even read the books. Lynch&#039;s adaption nails the ambience and spirit that Herbert was going for while the new one is a heavily sanitized re-imagining with diversity quotas. Even if part 2 sticks the landing in getting all the story beats correct, if still doesn&#039;t and won&#039;t ever feel like it&#039;s actually Dune.', 'time': 1670673547, 'resto': 177729059}]",1670673547,
58,177733427,12/10/22(Sat)06:09:21,Anonymous,scenes that hit too close to home,1670559624616417,.jpg,500,428,250,214,1670670561391458,1670670561,sHcRZG0WEjoOlDfOv9pAQw==,21756,0,0,0,scenes-that-hit-too-close-to-home,5,23,7,18.0,5.0,"[{'no': 177733960, 'now': '12/10/22(Sat)06:44:03', 'name': 'Anonymous', 'com': '<a href=""#p177733798"" class=""quotelink"">&gt;&gt;177733798</a><br>Sex in the city', 'time': 1670672643, 'resto': 177733427}, {'no': 177734011, 'now': '12/10/22(Sat)06:46:32', 'name': 'Anonymous', 'com': '<a href=""#p177733959"" class=""quotelink"">&gt;&gt;177733959</a><br>Yeah I know but I couldnt find that one, so i went with the other one were she just wanted to be friends with him due to his big dingle.', 'time': 1670672792, 'resto': 177733427}, {'no': 177734057, 'now': '12/10/22(Sat)06:48:47', 'name': 'Anonymous', 'com': '<a href=""#p177733960"" class=""quotelink"">&gt;&gt;177733960</a><br>How did she break it to the guy that his dick was too small and that he was a worthless male who was born with a small dick that made any other positive attributes he may have possessed null and void and that, as a result, should immediately commit suicide?', 'filename': 'a9dee42e24ba168f08f981335291cff7', 'ext': '.jpg', 'w': 320, 'h': 400, 'tn_w': 100, 'tn_h': 125, 'tim': 1670672927388510, 'time': 1670672927, 'md5': '+t0feH7tl+Wm06R8G+dpNQ==', 'fsize': 25969, 'resto': 177733427}, {'no': 177734082, 'now': '12/10/22(Sat)06:50:19', 'name': 'Anonymous', 'com': '<a href=""#p177734057"" class=""quotelink"">&gt;&gt;177734057</a><br>She laughed at him and told him that he could be her bitch if he wanted, but he ran away crying.', 'time': 1670673019, 'resto': 177733427}, {'no': 177734211, 'now': '12/10/22(Sat)06:58:02', 'name': 'Anonymous', 'com': '<a href=""#p177734082"" class=""quotelink"">&gt;&gt;177734082</a><br>Women are monsters', 'filename': 'Screenshot_20221031-070006_Samsung Internet', 'ext': '.jpg', 'w': 644, 'h': 614, 'tn_w': 125, 'tn_h': 119, 'tim': 1670673482464703, 'time': 1670673482, 'md5': 'oKtWZtwGjyJ5Fb34pVDIiQ==', 'fsize': 86124, 'resto': 177733427}]",1670673482,
59,177732126,12/10/22(Sat)04:45:02,Anonymous,I&#039;m surprised /tv/ hasn&#039;t memed this flick.,MV5BN2Q2MzczNjItOTAxMS00ZDMzLThiZTktZDFjYzRhYTcyYWU4XkEyXkFqcGdeQXVyMTQxNzMzNDI@._V1_,.jpg,609,951,160,249,1670665502545595,1670665502,AqKztg/yd2niPyOI+OiBaQ==,507431,0,0,0,im-surprised-tv-hasnt-memed-this-flick,5,10,0,5.0,0.0,"[{'no': 177733067, 'now': '12/10/22(Sat)05:42:10', 'name': 'Anonymous', 'com': '<a href=""#p177732473"" class=""quotelink"">&gt;&gt;177732473</a><br>/tv/ is full of people who look down on Redditors but then only ever post about the same capeshit and trending streaming shows that the average Redditor is into.', 'time': 1670668930, 'resto': 177732126}, {'no': 177733145, 'now': '12/10/22(Sat)05:47:47', 'name': 'Anonymous', 'com': '<a href=""#p177733054"" class=""quotelink"">&gt;&gt;177733054</a><br>Yes, and the sex adds nothing to the film except the director&#039;s Jewish lechery.', 'time': 1670669267, 'resto': 177732126}, {'no': 177733157, 'now': '12/10/22(Sat)05:48:50', 'name': 'Anonymous', 'com': '<a href=""#p177733145"" class=""quotelink"">&gt;&gt;177733145</a><br><span class=""quote"">&gt;enjoying sexuality is Jewish</span><br>anon...', 'time': 1670669330, 'resto': 177732126}, {'no': 177734194, 'now': '12/10/22(Sat)06:56:50', 'name': 'Anonymous', 'com': '<a href=""#p177732885"" class=""quotelink"">&gt;&gt;177732885</a><br>dressed to kill is also great and really porny. i&#039;m sure op meant to highlight certain fixations this board has which i won&#039;t mention because it would spoil the tweest', 'time': 1670673410, 'resto': 177732126}, {'no': 177734207, 'now': '12/10/22(Sat)06:57:47', 'name': 'Anonymous', 'com': '<a href=""#p177734194"" class=""quotelink"">&gt;&gt;177734194</a><br><span class=""quote"">&gt;i&#039;m sure op meant to highlight certain fixations this board has which i won&#039;t mention because it would spoil the tweest</span><br>Interesting, that makes me more curious to watch it', 'time': 1670673467, 'resto': 177732126}]",1670673467,
60,177731946,12/10/22(Sat)04:32:34,Anonymous,/tv/ reaction images: WebM edition,1630193039958,.webm,750,720,250,240,1670664754971454,1670664754,YdwtY/Ll7MEGi8YidOeqmA==,445101,0,0,0,tv-reaction-images-webm-edition,5,11,11,6.0,6.0,"[{'no': 177733165, 'now': '12/10/22(Sat)05:49:09', 'name': 'Anonymous', 'filename': '1658790870637', 'ext': '.webm', 'w': 832, 'h': 720, 'tn_w': 125, 'tn_h': 108, 'tim': 1670669349169572, 'time': 1670669349, 'md5': 'dteEiYzpSibUJGjQ5Oto7g==', 'fsize': 539090, 'resto': 177731946}, {'no': 177733732, 'now': '12/10/22(Sat)06:30:31', 'name': 'Anonymous', 'filename': '1612412530508', 'ext': '.gif', 'w': 218, 'h': 218, 'tn_w': 125, 'tn_h': 125, 'tim': 1670671831924874, 'time': 1670671831, 'md5': 'ili6LcrGghBJAP3XCrb+IA==', 'fsize': 1572071, 'resto': 177731946}, {'no': 177733785, 'now': '12/10/22(Sat)06:33:33', 'name': 'Anonymous', 'filename': 'im cooming', 'ext': '.webm', 'w': 1920, 'h': 804, 'tn_w': 125, 'tn_h': 52, 'tim': 1670672013673538, 'time': 1670672013, 'md5': 'fShdgQAdf5UQxDEp5FveRQ==', 'fsize': 177664, 'resto': 177731946}, {'no': 177733947, 'now': '12/10/22(Sat)06:43:13', 'name': 'Anonymous', 'filename': '1598576886501', 'ext': '.webm', 'w': 1918, 'h': 800, 'tn_w': 125, 'tn_h': 52, 'tim': 1670672593880416, 'time': 1670672593, 'md5': 'potzlPGhzqRZEEIU59WoAg==', 'fsize': 766435, 'resto': 177731946}, {'no': 177734205, 'now': '12/10/22(Sat)06:57:40', 'name': 'Anonymous', 'filename': 'marionmusk', 'ext': '.webm', 'w': 960, 'h': 540, 'tn_w': 125, 'tn_h': 70, 'tim': 1670673460790089, 'time': 1670673460, 'md5': 'SNQY6X/BZie0eIyC99ifUg==', 'fsize': 865227, 'resto': 177731946}]",1670673460,
61,177731695,12/10/22(Sat)04:16:21,Anonymous,"<span class=""quote"">&gt;The theme song plays in the penultimate/ultimate episode</span><br>Holy shit this shit is so damn kino",1655376897998,.png,680,478,250,175,1670663781597886,1670663781,eluSKJGY4k/udKz8BOdIig==,304423,0,0,0,the-theme-song-plays-in-the-penultimateultimate,5,13,2,8.0,2.0,"[{'no': 177733373, 'now': '12/10/22(Sat)06:05:14', 'name': 'Anonymous', 'com': '<a href=""#p177733361"" class=""quotelink"">&gt;&gt;177733361</a><br>what else do you want me to fucking call it? besides I guarantee I&#039;m older and was here way before you', 'time': 1670670314, 'resto': 177731695}, {'no': 177733381, 'now': '12/10/22(Sat)06:05:44', 'name': 'Anonymous', 'com': '<a href=""#p177731695"" class=""quotelink"">&gt;&gt;177731695</a><br><span class=""quote"">&gt;this is no LE METH</span><br>we know Walter, that&#039;s whiskey', 'time': 1670670344, 'resto': 177731695}, {'no': 177733394, 'now': '12/10/22(Sat)06:06:54', 'name': 'Anonymous', 'com': '<a href=""#p177731695"" class=""quotelink"">&gt;&gt;177731695</a><br><span class=""quote"">&gt;everyone he loved thinks he is a scumbag asshole and his legacy has been destroyed</span><br><span class=""quote"">&gt;still goes through with selflessly providing for them</span><br>He really became Heisenberg in this scene. What an evil psycho to do such things.', 'time': 1670670414, 'resto': 177731695}, {'no': 177734159, 'now': '12/10/22(Sat)06:54:20', 'name': 'Anonymous', 'com': '<a href=""#p177733031"" class=""quotelink"">&gt;&gt;177733031</a><br>actual imbecile lmao', 'time': 1670673260, 'resto': 177731695}, {'no': 177734184, 'now': '12/10/22(Sat)06:56:10', 'name': 'Anonymous', 'com': '<a href=""#p177733018"" class=""quotelink"">&gt;&gt;177733018</a><br>What if skylar became the meth dealer instead? What would that story be like?', 'time': 1670673370, 'resto': 177731695}]",1670673370,
62,177715776,12/09/22(Fri)17:14:15,Anonymous,"AAAAAAAA Edition<br><br>Previous: <a href=""/tv/thread/177664457#p177664457"" class=""quotelink"">&gt;&gt;177664457</a>",skelle,.jpg,1500,844,250,140,1670624055170675,1670624055,i2wL26b6LzHUqBb9hupq0Q==,119407,0,0,0,hor-horror,5,119,25,114.0,25.0,"[{'no': 177733695, 'now': '12/10/22(Sat)06:28:00', 'name': 'Anonymous', 'com': '<a href=""#p177732712"" class=""quotelink"">&gt;&gt;177732712</a><br>When is the last time anyone has made a horror movie around extinct Australian animals, only thing that comes toind is Howling 3.', 'time': 1670671680, 'resto': 177715776}, {'no': 177734048, 'now': '12/10/22(Sat)06:48:20', 'name': 'Anonymous', 'com': '<a href=""#p177733695"" class=""quotelink"">&gt;&gt;177733695</a><br><br>I think there&#039;s been some/a 00&#039;s film about weird Tasmanian devils.', 'time': 1670672900, 'resto': 177715776}, {'no': 177734107, 'now': '12/10/22(Sat)06:51:41', 'name': 'Anonymous', 'com': '<a href=""#p177733695"" class=""quotelink"">&gt;&gt;177733695</a><br><a href=""#p177734048"" class=""quotelink"">&gt;&gt;177734048</a><br>There was that movie dying breed where they looked for tasmanian tigers but that was more about cannibals.', 'time': 1670673101, 'resto': 177715776}, {'no': 177734132, 'now': '12/10/22(Sat)06:52:42', 'name': 'Anonymous', 'com': 'Watched Black Rainbow and enjoyed it. Any more films about fraudulent/suppressed psychics getting BTFO by real visions? I like that trope.', 'time': 1670673162, 'resto': 177715776}, {'no': 177734181, 'now': '12/10/22(Sat)06:55:42', 'name': 'Anonymous', 'com': '<a href=""#p177734107"" class=""quotelink"">&gt;&gt;177734107</a><br><br>I remember seeing that, but there&#039;s deffo been at least one creature feature out.<br><br>If you&#039;re looking for Outback creatures, regardless of extinction, Razorback is worth a watch. So grotesque and absurd, like a bad dream.', 'time': 1670673342, 'resto': 177715776}]",1670673342,/hor/ - Horror
63,177732899,12/10/22(Sat)05:30:18,Anonymous,One of his best performances and yet no one ever mentions it..,Red Arrow,.jpg,768,768,250,250,1670668218516094,1670668218,gaU0/v98iiXVg4Dlhj71NA==,131134,0,0,0,one-of-his-best-performances-and-yet-no-one-ever,5,4,0,,,"[{'no': 177732911, 'now': '12/10/22(Sat)05:31:06', 'name': 'Anonymous', 'com': '<a href=""#p177732899"" class=""quotelink"">&gt;&gt;177732899</a><br>Literally who? Also what movie?', 'time': 1670668266, 'resto': 177732899}, {'no': 177732917, 'now': '12/10/22(Sat)05:31:23', 'name': 'Anonymous', 'com': '<a href=""#p177732899"" class=""quotelink"">&gt;&gt;177732899</a><br>What Charles Bronson film is this?', 'time': 1670668283, 'resto': 177732899}, {'no': 177734128, 'now': '12/10/22(Sat)06:52:35', 'name': 'Anonymous', 'com': 'What Clint Eastwood kino is this', 'time': 1670673155, 'resto': 177732899}, {'no': 177734158, 'now': '12/10/22(Sat)06:54:17', 'name': 'Anonymous', 'com': '<a href=""#p177732899"" class=""quotelink"">&gt;&gt;177732899</a><br>Is this ai generated or just an oddly restored still?', 'time': 1670673257, 'resto': 177732899}]",1670673257,
64,177704748,12/09/22(Fri)09:46:42,Anonymous,"<span class=""quote"">&gt;mogs Clint</span>",lee-van-cleef-3,.jpg,900,750,250,208,1670597202732498,1670597202,oYQr3jnhy8MbAa+7/XkEoQ==,80598,0,0,0,mogs-clint,5,177,61,172.0,60.0,"[{'no': 177733436, 'now': '12/10/22(Sat)06:10:00', 'name': 'Anonymous', 'com': '<a href=""#p177733432"" class=""quotelink"">&gt;&gt;177733432</a><br>The Good, the Bad, and the Weird', 'time': 1670670600, 'resto': 177704748}, {'no': 177733666, 'now': '12/10/22(Sat)06:25:51', 'name': 'Anonymous', 'com': '<a href=""#p177732949"" class=""quotelink"">&gt;&gt;177732949</a><br><span class=""quote"">&gt;&quot;they were ToooooTALLy widespread in the 1850s&quot;</span><br><span class=""quote"">&gt;brings up double action cartridge revolvers from the 1870s</span><br><span class=""quote"">&gt;still werent as prevalent as webley bulldog or single action revolvers until the new service and k-frame</span><br><br><a href=""#p177732767"" class=""quotelink"">&gt;&gt;177732767</a><br><span class=""quote"">&gt;us company Starr made a double action percussion</span><br><span class=""quote"">&gt;immediately dropped double for single action to fulfill military contract</span><br><span class=""quote"">&gt;1800 beaumont adams bought by the US army</span><br><span class=""quote"">&gt;literally more le matts existed</span><br><span class=""quote"">&gt;europoor thinks his shit gun is even a blip on the radar in the US</span><br><span class=""quote"">&gt; a million plus Colts made before cartridge guns</span><br><span class=""quote"">&gt;250000 remington new army&#039;s</span><br><span class=""quote"">&gt;half a million flip top S&amp;Ws</span>', 'time': 1670671551, 'resto': 177704748}, {'no': 177733767, 'now': '12/10/22(Sat)06:32:39', 'name': 'Anonymous', 'com': '<a href=""#p177706061"" class=""quotelink"">&gt;&gt;177706061</a><br>I do find Harmonica to be a lot more intimidating than The Man with no Name. Maybe in part because Bronson was a real life tough guy loner who was a coal miner when he was young and then fought in WW2. But probably also just because of the different writing.', 'time': 1670671959, 'resto': 177704748}, {'no': 177733797, 'now': '12/10/22(Sat)06:34:18', 'name': 'Anonymous', 'com': '<a href=""#p177733666"" class=""quotelink"">&gt;&gt;177733666</a><br><span class=""quote"">&gt;seething so hard</span><br>Yes, double action revolver technology was WIDELY available since the 1850s, and it took American gun makers 25+ years to catch up, because the US had a tiny and backwards frontier army. Did you also know that high noon duels weren&#039;t actually real? I wonder why everyone who was in the game in the Old West switched to DA as soon it was offered...', 'time': 1670672058, 'resto': 177704748}, {'no': 177734153, 'now': '12/10/22(Sat)06:54:07', 'name': 'Anonymous', 'com': '<a href=""#p177733666"" class=""quotelink"">&gt;&gt;177733666</a><br><span class=""quote"">&gt;bought by US Army</span><br>US army made some retarded choices back in the day, plenty of double actions were on the civilian market, and all the movies discussed tend to be about civilian gunslingers<br>For me it&#039;s the Gasser revolver, there really should have been/should be a protagonist wielding one of these massive handcannons, although that would actually be rather difficult to find in the US in the 1870s.', 'filename': 'gasser', 'ext': '.jpg', 'w': 757, 'h': 419, 'tn_w': 125, 'tn_h': 69, 'tim': 1670673247666722, 'time': 1670673247, 'md5': '6hzoTP5XYQBbwAq57vfnrA==', 'fsize': 174109, 'resto': 177704748}]",1670673247,
