,no,now,name,com,filename,ext,w,h,tn_w,tn_h,tim,time,md5,fsize,resto,bumplimit,imagelimit,semantic_url,custom_spoiler,replies,images,omitted_posts,omitted_images,last_replies,last_modified,sub
0,177724423,12/09/22(Fri)22:39:30,Anonymous,Post the biggest downgrade in the history of television,1670643539310,.jpg,477,630,189,250,1670643570476208,1670643570,/l2E8gJY+W0GUqSWPMslnw==,96223,0,0,0,post-the-biggest-downgrade-in-the-history-of,5,73,27,68.0,26.0,"[{'no': 177734369, 'now': '12/10/22(Sat)07:07:42', 'name': 'Anonymous', 'com': '<a href=""#p177734285"" class=""quotelink"">&gt;&gt;177734285</a><br>based', 'time': 1670674062, 'resto': 177724423}, {'no': 177734399, 'now': '12/10/22(Sat)07:09:59', 'name': 'Anonymous', 'com': '<a href=""#p177727706"" class=""quotelink"">&gt;&gt;177727706</a><br>Next time baby', 'time': 1670674199, 'resto': 177724423}, {'no': 177734408, 'now': '12/10/22(Sat)07:10:33', 'name': 'Anonymous', 'com': '<a href=""#p177734285"" class=""quotelink"">&gt;&gt;177734285</a><br>I have read enough hentai to know where this is going', 'time': 1670674233, 'resto': 177724423}, {'no': 177734445, 'now': '12/10/22(Sat)07:13:33', 'name': 'Anonymous', 'com': '<a href=""#p177725973"" class=""quotelink"">&gt;&gt;177725973</a><br>I love brown women', 'filename': '316120924_846482800029063_1490430772329051001_n', 'ext': '.jpg', 'w': 1080, 'h': 1350, 'tn_w': 100, 'tn_h': 125, 'tim': 1670674413120193, 'time': 1670674413, 'md5': 'Ado9n3vGtp7vcSz2tr8jLQ==', 'fsize': 171389, 'resto': 177724423}, {'no': 177734447, 'now': '12/10/22(Sat)07:13:39', 'name': 'Anonymous', 'com': '<a href=""#p177733760"" class=""quotelink"">&gt;&gt;177733760</a><br>Not only is the first mj more comic accurate in the looks and personality department, she has a life outside of being the love interest. She&#039;s moving along with her life while peter stalls in the first two movies and continues to have her own personal drama in the third. Zendaya&#039;s MJ has nothing going on besides being Peter&#039;s love interest', 'time': 1670674419, 'resto': 177724423}]",1670674419,
1,177724428,12/09/22(Fri)22:39:42,Anonymous,it could have contributed towards why other wizards feared him. the look in the movie makes him look more debilitated than menacing.,voldemort,.jpg,848,462,250,136,1670643582998919,1670643582,UDpwvU5AymsRxEvEUovZ0w==,80914,0,0,0,they-robbed-us-of-this-kino-design,5,174,35,169.0,35.0,"[{'no': 177734196, 'now': '12/10/22(Sat)06:56:55', 'name': 'Anonymous', 'com': '<a href=""#p177725394"" class=""quotelink"">&gt;&gt;177725394</a><br>The snitch is harder to catch than scoring its equivalent points in goals', 'time': 1670673415, 'resto': 177724428}, {'no': 177734213, 'now': '12/10/22(Sat)06:58:07', 'name': 'Anonymous', 'com': '<a href=""#p177734156"" class=""quotelink"">&gt;&gt;177734156</a><br>When he chopped his soul up to put into phylacter-opps sorry I mean, horcruxes, his appearance took on a reptilian appearance because he was an ancestor of Salazar Slithern, get it, slither, a snake slithers. Isn&#039;t Rowling clever.', 'time': 1670673487, 'resto': 177724428}, {'no': 177734305, 'now': '12/10/22(Sat)07:03:40', 'name': 'Anonymous', 'com': '<a href=""#p177725570"" class=""quotelink"">&gt;&gt;177725570</a><br>One is a torture spell, one is a mine control spell, and one is a murder spell, is it not pretty self-explanatory why they’re bad?', 'time': 1670673820, 'resto': 177724428}, {'no': 177734322, 'now': '12/10/22(Sat)07:04:25', 'name': 'Anonymous', 'com': '<a href=""#p177728833"" class=""quotelink"">&gt;&gt;177728833</a><br>I thought that is what Muggle Strudies was. Normie school education but for wizards that intend to live among them and not look like morans.', 'time': 1670673865, 'resto': 177724428}, {'no': 177734446, 'now': '12/10/22(Sat)07:13:33', 'name': 'Anonymous', 'com': '<a href=""#p177734322"" class=""quotelink"">&gt;&gt;177734322</a><br>Muggle Studies has to be a joke. Think about it, Arthur Weasley is the head of the misuse of muggle artefacts office. And he&#039;s obviously passionate about all things muggle, so as a kid he most likely was one of the first in line for that course. He listens to Harry like a riveted child, asking all sorts of questions, he loves the unmagical fuckers.<br>So, then why doesnt he know what a rubber duck is? Why can&#039;t he use muggle money? <br>Its because muggle studies is a secret sex cult, thats my guess.', 'time': 1670674413, 'resto': 177724428}]",1670674413,they robbed us of this kino design
2,177733860,12/10/22(Sat)06:37:53,Anonymous,So who was the definitive /tv/ babe of 2022?,gayish,.png,500,648,192,250,1670672273734996,1670672273,F1wRNd3N0GWEf2gspONzOw==,567985,0,0,0,so-who-was-the-definitive-tv-babe-of-2022,5,32,12,27.0,10.0,"[{'no': 177734427, 'now': '12/10/22(Sat)07:12:03', 'name': 'Anonymous', 'com': '<a href=""#p177734401"" class=""quotelink"">&gt;&gt;177734401</a><br><span class=""quote"">&gt;implying hotd threads weren&#039;t the exact same until monke was aged up</span>', 'filename': '1663483472566696', 'ext': '.png', 'w': 960, 'h': 856, 'tn_w': 125, 'tn_h': 111, 'tim': 1670674323645916, 'time': 1670674323, 'md5': 'oWIu8zCFxFlLcmsCkD2RAQ==', 'fsize': 1621950, 'resto': 177733860}, {'no': 177734428, 'now': '12/10/22(Sat)07:12:08', 'name': 'Anonymous', 'com': '<a href=""#p177734407"" class=""quotelink"">&gt;&gt;177734407</a><br>Holy shit this. Idk what it is about her but she’s so fucking sexual in Wednesday. <br><br>House of the Dragon is an infinitely better show yet people watch Wednesday because of Jenna. Exclusively.', 'time': 1670674328, 'resto': 177733860}, {'no': 177734430, 'now': '12/10/22(Sat)07:12:23', 'name': 'Anonymous', 'com': '<a href=""#p177734003"" class=""quotelink"">&gt;&gt;177734003</a><br>Wednesday is the new big thing like squid game or whatever the zoomies are baseding out on at the moment', 'time': 1670674343, 'resto': 177733860}, {'no': 177734431, 'now': '12/10/22(Sat)07:12:34', 'name': 'Anonymous', 'com': '<a href=""#p177734003"" class=""quotelink"">&gt;&gt;177734003</a><br>Measuring by internet traffic really just tells you how popular somebody is with zoomers/millennials from 2nd and 3rd world countries. That&#039;s who makes up the vast majority of internet users.<br>Anything that is popular with white/old/1st worlders would barely make a ripple against the latest spicmutt goblinoid', 'filename': '262966', 'ext': '.png', 'w': 1000, 'h': 1233, 'tn_w': 101, 'tn_h': 125, 'tim': 1670674354776100, 'time': 1670674354, 'md5': 'bcN9jZ4QEoI8N0MJC7wIrQ==', 'fsize': 147898, 'resto': 177733860}, {'no': 177734444, 'now': '12/10/22(Sat)07:13:24', 'name': 'Anonymous', 'com': '<a href=""#p177734227"" class=""quotelink"">&gt;&gt;177734227</a><br>I will legit kms', 'time': 1670674404, 'resto': 177733860}]",1670674404,
3,177732280,12/10/22(Sat)04:54:16,Anonymous,"The peak look of an actor/actress&#039;s career, when was it?",1344849072717,.jpg,1280,1959,163,249,1670666056188295,1670666056,Ms1+9/WRFY2C2KBdyqkWgA==,562666,0,0,0,the-peak-look-of-an-actoractresss-career-when-was,5,76,38,71.0,34.0,"[{'no': 177734414, 'now': '12/10/22(Sat)07:10:43', 'name': 'Anonymous', 'filename': 'cabafe2b1d91b20a92efe216f806b771', 'ext': '.jpg', 'w': 480, 'h': 640, 'tn_w': 93, 'tn_h': 125, 'tim': 1670674243632313, 'time': 1670674243, 'md5': 'eMKMw0sxH8ZUF+zAheR1Ig==', 'fsize': 78417, 'resto': 177732280}, {'no': 177734419, 'now': '12/10/22(Sat)07:11:08', 'name': 'Anonymous', 'com': '<a href=""#p177732280"" class=""quotelink"">&gt;&gt;177732280</a><br>Dove Cameron in Shameless', 'filename': '1620590054738', 'ext': '.png', 'w': 1000, 'h': 500, 'tn_w': 125, 'tn_h': 62, 'tim': 1670674268944657, 'time': 1670674268, 'md5': 'gMklpi99NmGchmzcrfJ2Qg==', 'fsize': 179743, 'resto': 177732280}, {'no': 177734429, 'now': '12/10/22(Sat)07:12:17', 'name': 'Anonymous', 'filename': '1584328599400', 'ext': '.webm', 'w': 1084, 'h': 1036, 'tn_w': 125, 'tn_h': 119, 'tim': 1670674337326484, 'time': 1670674337, 'md5': 'AnFBptvr6c+pM3foOaOE/w==', 'fsize': 3028020, 'resto': 177732280}, {'no': 177734434, 'now': '12/10/22(Sat)07:12:50', 'name': 'Anonymous', 'com': '<a href=""#p177732280"" class=""quotelink"">&gt;&gt;177732280</a>', 'filename': '7A129FCA-0E6D-4055-9B48-94515EE11B52', 'ext': '.jpg', 'w': 954, 'h': 1200, 'tn_w': 99, 'tn_h': 125, 'tim': 1670674370905089, 'time': 1670674370, 'md5': 'RomAc9o8C3InyyHWMh3eSw==', 'fsize': 81115, 'resto': 177732280}, {'no': 177734443, 'now': '12/10/22(Sat)07:13:16', 'name': 'Anonymous', 'com': '<a href=""#p177733665"" class=""quotelink"">&gt;&gt;177733665</a><br><a href=""#p177734141"" class=""quotelink"">&gt;&gt;177734141</a><br>Ever since Jenna Ortega in Wednesday got popular, we have all these anons posting random brown girls. No one cares about your ugly Instagram crushes.', 'time': 1670674396, 'resto': 177732280}]",1670674396,
4,177731568,12/10/22(Sat)04:10:09,Anonymous,Should I watch this? It looks like it could be so bad it&#039;s good,official-smile-movie-poster-from-paramount-pictures,.jpg,510,755,168,250,1670663409279817,1670663409,vhlmm8dK4v/dUKSPlF4l1A==,151587,0,0,0,should-i-watch-this-it-looks-like-it-could-be-so,5,17,1,12.0,1.0,"[{'no': 177734001, 'now': '12/10/22(Sat)06:46:21', 'name': 'Anonymous', 'com': '<a href=""#p177733195"" class=""quotelink"">&gt;&gt;177733195</a><br>Investigate what exactly? They don’t know anything about where this curse comes from or if there is any way of actually stopping it. All they know is how to pass it onto someone else without dying but she doesn’t want to do that so she tries to end it like a cliche horror movie would usually end but it doesn’t end the way she wants it to because the creature is smarter than her', 'time': 1670672781, 'resto': 177731568}, {'no': 177734378, 'now': '12/10/22(Sat)07:08:37', 'name': 'Anonymous', 'com': '<a href=""#p177731568"" class=""quotelink"">&gt;&gt;177731568</a><br>Is that the Indian twitter chief censor? How did she get another job so quickly?', 'time': 1670674117, 'resto': 177731568}, {'no': 177734415, 'now': '12/10/22(Sat)07:10:45', 'name': 'Anonymous', 'com': 'mole', 'time': 1670674245, 'resto': 177731568}, {'no': 177734435, 'now': '12/10/22(Sat)07:12:51', 'name': 'Anonymous', 'com': '<a href=""#p177732663"" class=""quotelink"">&gt;&gt;177732663</a><br>Market capture', 'time': 1670674371, 'resto': 177731568}, {'no': 177734442, 'now': '12/10/22(Sat)07:13:14', 'name': 'Anonymous', 'com': '<a href=""#p177732236"" class=""quotelink"">&gt;&gt;177732236</a><br>Haha faggot', 'time': 1670674394, 'resto': 177731568}]",1670674394,
5,177733843,12/10/22(Sat)06:36:49,Anonymous,"IN CRANK 3, CHEV CHELIOS MUST ____ TO STAY ALIVE!!!",file,.png,1910,1022,250,133,1670672209560357,1670672209,EaKzWH8m6ffSBdNuUg5ERA==,3545256,0,0,0,in-crank-3-chev-chelios-must-to-stay-alive,5,24,6,19.0,3.0,"[{'no': 177734273, 'now': '12/10/22(Sat)07:01:22', 'name': 'Anonymous', 'com': '<a href=""#p177733843"" class=""quotelink"">&gt;&gt;177733843</a><br>UNVACCINATE', 'filename': 'slaughterhouse', 'ext': '.webm', 'w': 320, 'h': 564, 'tn_w': 70, 'tn_h': 124, 'tim': 1670673682488902, 'time': 1670673682, 'md5': '88eaoU/lV6Ft19VOLgih7w==', 'fsize': 2543943, 'resto': 177733843}, {'no': 177734297, 'now': '12/10/22(Sat)07:02:56', 'name': 'Anonymous', 'com': '<a href=""#p177734273"" class=""quotelink"">&gt;&gt;177734273</a><br>What the fuck is going on in Finland', 'time': 1670673776, 'resto': 177733843}, {'no': 177734347, 'now': '12/10/22(Sat)07:06:05', 'name': 'Anonymous', 'com': '<a href=""#p177734010"" class=""quotelink"">&gt;&gt;177734010</a><br>Best plot in the thread', 'time': 1670673965, 'resto': 177733843}, {'no': 177734392, 'now': '12/10/22(Sat)07:09:41', 'name': 'Anonymous', 'com': '<a href=""#p177733843"" class=""quotelink"">&gt;&gt;177733843</a><br>GET BOOSTED', 'filename': 'vaxxer soyjak', 'ext': '.gif', 'w': 1600, 'h': 1500, 'tn_w': 125, 'tn_h': 117, 'tim': 1670674181794381, 'time': 1670674181, 'md5': 'ZoZDsRcXFklgQx3w0ZXeOg==', 'fsize': 423462, 'resto': 177733843}, {'no': 177734440, 'now': '12/10/22(Sat)07:13:07', 'name': 'Anonymous', 'com': '<a href=""#p177734010"" class=""quotelink"">&gt;&gt;177734010</a><br>Crank 3: Cocked and Loaded<br>Cumming this summa', 'filename': '1670591117479553', 'ext': '.gif', 'w': 234, 'h': 170, 'tn_w': 125, 'tn_h': 90, 'tim': 1670674387693073, 'time': 1670674387, 'md5': 'jr7ujGVbw2Vk6UEs78Z8Sw==', 'fsize': 610856, 'resto': 177733843}]",1670674387,
6,177732271,12/10/22(Sat)04:53:40,Anonymous,Just got a letter saying the police are authorized to visit me for not paying a tv license. Am I fucked?,maxresdefault,.jpg,1280,720,250,140,1670666020690864,1670666020,u4TcXUG/dw6WObYIL+HXAw==,109774,0,0,0,just-got-a-letter-saying-the-police-are,5,66,4,61.0,4.0,"[{'no': 177734226, 'now': '12/10/22(Sat)06:58:38', 'name': 'Anonymous', 'com': '<a href=""#p177733669"" class=""quotelink"">&gt;&gt;177733669</a><br>The coppers hate it tho<br>They&#039;re there either for training or punishment<br>Either way they can&#039;t do shit', 'time': 1670673518, 'resto': 177732271}, {'no': 177734270, 'now': '12/10/22(Sat)07:01:15', 'name': 'Anonymous', 'com': '<a href=""#p177732816"" class=""quotelink"">&gt;&gt;177732816</a><br>If you need another wheelie bin you have to pay a bin licence<br>Usually a bin licence is more expensive than having your own bin<br>But if the council have their own binmen they won&#039;t take a bin that doesn&#039;t have the council&#039;s sigil on it<br>But most councils outsource collection to private companies who don&#039;t give a shit', 'time': 1670673675, 'resto': 177732271}, {'no': 177734282, 'now': '12/10/22(Sat)07:01:52', 'name': 'Anonymous', 'com': '<a href=""#p177732271"" class=""quotelink"">&gt;&gt;177732271</a><br>Bin that telly m8', 'time': 1670673712, 'resto': 177732271}, {'no': 177734287, 'now': '12/10/22(Sat)07:02:23', 'name': 'Anonymous', 'com': '<a href=""#p177734226"" class=""quotelink"">&gt;&gt;177734226</a><br>The same cops that prance around in high heels and arrest people for tweets?', 'time': 1670673743, 'resto': 177732271}, {'no': 177734439, 'now': '12/10/22(Sat)07:13:04', 'name': 'Anonymous', 'com': '<a href=""#p177734287"" class=""quotelink"">&gt;&gt;177734287</a><br>There&#039;s three kinds of cops in the UK<br><span class=""quote"">&gt;the old guard/ex-forces who are blackpilled as fuck, but these are the best coppers cos they know when to look the other way and won&#039;t start any shit. They&#039;re also the only ones that are good at their job. Hates paperwork and will call you a cunt to your face if you&#039;re being a cunt. Believes it&#039;s just a job and has no delusions that they&#039;re basically grown up hall monitors.</span><br><span class=""quote"">&gt;autistic nitties who have zero imagination, they&#039;re kept up at night by the idea that somebody might drive 31 in a 30 (even though that&#039;s legal). They only joined the fuzz because they were bullied at school and have a vendetta against society. Loves paperwork and will gladly arrest you so they can write a 16 page arrest report. Thinks the state is the source of morality.</span><br><span class=""quote"">&gt;feckless kids on the degree scheme who will be good little footsoldiers of the state until they get their free degree and will fuck off to be equally useless somewhere else. Shit at paperwork and will basically let Akbal off for rape because they couldn&#039;t be fucked to send their report to CPS. Thinks the state is fascist yet doesn&#039;t see the irony of working for them.</span><br>The high heel wearing cyberstasi are a medley of the second and third groups. Two different sides of the same problem.', 'time': 1670674384, 'resto': 177732271}]",1670674384,
7,177725645,12/09/22(Fri)23:31:11,Anonymous,"We&#039;ve all done it, there&#039;s no reason to be ashamed",tommy,.jpg,1050,699,250,166,1670646671142162,1670646671,MMw1fs/ac/NTVSJBxmqi/Q==,322706,0,0,0,itt-times-you-acted-like-tom-cruise,5,61,5,56.0,5.0,"[{'no': 177734338, 'now': '12/10/22(Sat)07:05:17', 'name': 'Anonymous', 'com': '<a href=""#p177725645"" class=""quotelink"">&gt;&gt;177725645</a><br>That one time I jacked off a bulldog', 'time': 1670673917, 'resto': 177725645}, {'no': 177734351, 'now': '12/10/22(Sat)07:06:25', 'name': 'Anonymous', 'com': '<a href=""#p177734290"" class=""quotelink"">&gt;&gt;177734290</a><br>an old guy I used to work with, late 50s, played vidya and talked about it fairly often. said I should join him and his pals to play some counter strike one evening, couldn&#039;t think of any reason not to. anyway, I joined their chat and his friends were all teenagers that were still in school and they all called him animal. it was very strange. don&#039;t think I ever played CS with him again.', 'time': 1670673985, 'resto': 177725645}, {'no': 177734385, 'now': '12/10/22(Sat)07:09:14', 'name': 'Anonymous', 'com': '<a href=""#p177734286"" class=""quotelink"">&gt;&gt;177734286</a><br>sounds fun desu<br>did you get aids or herpes or anything?', 'time': 1670674154, 'resto': 177725645}, {'no': 177734424, 'now': '12/10/22(Sat)07:11:50', 'name': 'Anonymous', 'com': '<a href=""#p177732821"" class=""quotelink"">&gt;&gt;177732821</a><br>He deserved to die, Tom was needlessly merciful that day.ytpx8h', 'time': 1670674310, 'resto': 177725645}, {'no': 177734438, 'now': '12/10/22(Sat)07:13:04', 'name': 'Anonymous', 'com': '<a href=""#p177734290"" class=""quotelink"">&gt;&gt;177734290</a><br><span class=""quote"">&gt;new guy tries to play with friend group</span><br><span class=""quote"">&gt;tries some good-natured ribbing to ingratiate himself</span><br><span class=""quote"">&gt;you sperg out</span><br><span class=""quote"">&gt;he doesn&#039;t know you so he just apologises</span><br><span class=""quote"">&gt;you JuSt A pRaNk BrO him</span><br><span class=""quote"">&gt;he feels like shit and stops trying to be friends</span><br><span class=""quote"">&gt;you interpret this interaction as him trying to get one over on you</span><br><span class=""quote"">&gt;you feel proud that you successfully excluded a potential new friend</span><br><span class=""quote"">&gt;you boast about this on 4chan</span><br>you&#039;re a fucking faggot', 'time': 1670674384, 'resto': 177725645}]",1670674384,ITT: times you acted like tom cruise
8,177731694,12/10/22(Sat)04:16:20,Anonymous,"Hey folks, what did I think of “Indiana Jones And The Secret Of Life”?<br>Well, I’ll tell ya:<br><br>“Indiana Jones And The Secret Of Life” is a great new installment in the long-running franchise. Harrison Ford is back as Indy in the late 1960s. He’s hung up the whip after settling down with Marian, however, Indy’s son Mutt Williams, now recast with Jai Courtney as the character (who seems to have a knack for these kinds of films, playing John McClain’s son in last year’s Die Hard sequel and Kyle Reese in next year’s Terminator 5), who is now an adventurer of his own, asks his father to help him investigate a strange occurrence in the North Pole. Indy is initially reluctant but agrees and goes with his son. <br>After going into a cave there they are taken by a couple of radiant beings through some tunnels to a vast underground city, numerous crystalline structures, with floating vehicles. Indy remarks that maybe Admiral Byrd’s encounters weren’t so fanciful after all. They are taken to the ruler of the cities, Sandra Bullock’s character Ulyssia. After some conversations, Indy asks who these people are and where they have been, having been around for thousands upon thousands of years. Ulyssia tell Indy that they are a spiritually advanced race that created humanity, first with Adamuos and Evelyn. The reason for their absence from humanity and their lack of willingness to help is because they have become depressed with what humanity has done and believe they are incapable of being saved.<br><br>1/2",B3571DE6-36F9-436A-BDC6-45102238AD0B,.jpg,578,869,166,250,1670663780185943,1670663780,KLZtyJLfR5leVH8XOUNYAg==,81140,0,0,0,hey-folks-what-did-i-think-of-indiana-jones-and,5,29,3,24.0,3.0,"[{'no': 177733715, 'now': '12/10/22(Sat)06:29:06', 'name': 'Anonymous', 'com': 'AI post unironically', 'time': 1670671746, 'resto': 177731694}, {'no': 177733737, 'now': '12/10/22(Sat)06:30:39', 'name': 'Anonymous', 'com': '<a href=""#p177733715"" class=""quotelink"">&gt;&gt;177733715</a><br>OP here. No it isn’t; the actors’ names chosen and some of the “quirks” of it are just part of the “larp”; it’s supposed to be written from the point of view of a film critic/reviewer from 2014', 'time': 1670671839, 'resto': 177731694}, {'no': 177734008, 'now': '12/10/22(Sat)06:46:31', 'name': 'Anonymous', 'com': 'Bump 7', 'time': 1670672791, 'resto': 177731694}, {'no': 177734368, 'now': '12/10/22(Sat)07:07:37', 'name': 'Anonymous', 'com': 'Bump 8', 'time': 1670674057, 'resto': 177731694}, {'no': 177734437, 'now': '12/10/22(Sat)07:12:57', 'name': 'Anonymous', 'com': '<a href=""#p177731694"" class=""quotelink"">&gt;&gt;177731694</a><br><br>Yet another movie pushing the alien creator God cult bullshit. Hard pass.', 'time': 1670674377, 'resto': 177731694}]",1670674377,
9,177731933,12/10/22(Sat)04:31:57,Anonymous,"Columbo 2023<br><br><span class=""quote"">&gt;Just one more thing, xir, i dont know how you made up your alibi, in fact i dont really care about your alibi, but here we have recordings from outdoor and indoor surveillance cameras with you killing the victim. Here we have GPS tracker from your phone showing that you was there in exact time victim was killed. And we generated your behavioral pattern with AI and it showed that theres no way you wouldnt kill this man.</span><br><span class=""quote"">&gt;but lieutenant, we are just 5 minutes into episode...</span>",Screenshot_21,.jpg,903,1235,182,250,1670664717399222,1670664717,dOJ0QC2DHeIQlpeEG5FnPw==,194034,0,0,0,columbo-2023,5,11,4,6.0,2.0,"[{'no': 177732552, 'now': '12/10/22(Sat)05:08:38', 'name': 'Anonymous', 'com': 'Which is why garbage like CSI sucks', 'time': 1670666918, 'resto': 177731933}, {'no': 177732610, 'now': '12/10/22(Sat)05:11:31', 'name': 'Anonymous', 'com': 'What did he mean by this?', 'filename': 'hill', 'ext': '.gif', 'w': 220, 'h': 151, 'tn_w': 125, 'tn_h': 85, 'tim': 1670667091639430, 'time': 1670667091, 'md5': 'bTXGBHkpTkDPQZeCAG758g==', 'fsize': 1426904, 'resto': 177731933}, {'no': 177732895, 'now': '12/10/22(Sat)05:29:53', 'name': 'Anonymous', 'com': 'GOD TIER<br><br>Leonard Nimoy <br>Robert Culp<br>John Cassavetes <br>Jack Cassidy <br><br>HIGH TIER<br><br>Patrick McGoohan <br>William Shatner<br>Donald Pleasance<br>Johnny Cash<br>Oskar Werner <br><br>GOOD TIER<br><br>Janet Leigh <br>Dick Van Dyke <br>Faye Dunaway<br>Patrick Bauchau<br><br>POOR TIER<br><br>Robert Vaughn<br>George Wendt <br>Matthew Rhys<br>Shera Danese<br><br>DOGSHIT TIER<br><br>Billy Connolly', 'time': 1670668193, 'resto': 177731933}, {'no': 177733983, 'now': '12/10/22(Sat)06:45:00', 'name': 'Anonymous', 'com': '<a href=""#p177732895"" class=""quotelink"">&gt;&gt;177732895</a><br><span class=""quote"">&gt;high tier</span><br><span class=""quote"">&gt;william shatner</span><br>without star trek, this guy is gone from hollywood before 1972 rolls around.<br>in all fairness, though, he knew how to milk a trend.', 'filename': '1637817240717', 'ext': '.jpg', 'w': 540, 'h': 720, 'tn_w': 93, 'tn_h': 125, 'tim': 1670672700276972, 'time': 1670672700, 'md5': '0L/JPU7Opcbn9Zzgz51tzQ==', 'fsize': 33731, 'resto': 177731933}, {'no': 177734436, 'now': '12/10/22(Sat)07:12:51', 'name': 'Anonymous', 'com': '<a href=""#p177732382"" class=""quotelink"">&gt;&gt;177732382</a><br>Well they all confess in the end don&#039;t they?<br>https://www.youtube.com/watch?v=d-7<wbr>o9xYp7eE', 'time': 1670674371, 'resto': 177731933}]",1670674371,
10,177720655,12/09/22(Fri)20:14:57,Anonymous,,252342,.jpg,1200,800,250,166,1670634897074260,1670634897,TgTcRvHXKrol2ZJAQcfpFw==,152471,0,0,0,why-are-tv-men-so-bad-at-sex,5,167,25,162.0,24.0,"[{'no': 177734175, 'now': '12/10/22(Sat)06:55:26', 'name': 'Anonymous', 'filename': 'classic dano', 'ext': '.webm', 'w': 1120, 'h': 720, 'tn_w': 125, 'tn_h': 80, 'tim': 1670673326911905, 'time': 1670673326, 'md5': 'YYRUe349iUWMbR15nZYLLA==', 'fsize': 3121762, 'resto': 177720655}, {'no': 177734323, 'now': '12/10/22(Sat)07:04:30', 'name': 'Anonymous', 'com': '<a href=""#p177722815"" class=""quotelink"">&gt;&gt;177722815</a><br><span class=""quote"">&gt;reddit</span><br>This was written by a man for other men', 'time': 1670673870, 'resto': 177720655}, {'no': 177734384, 'now': '12/10/22(Sat)07:09:12', 'name': 'Anonymous', 'com': 'S1 True Detective had the worst sex scene but it made it seem like the wife enjoyed it. Literally lasts 5 seconds and looks uncomfortable as fuck', 'time': 1670674152, 'resto': 177720655}, {'no': 177734403, 'now': '12/10/22(Sat)07:10:14', 'name': 'Anonymous', 'com': '<a href=""#p177734384"" class=""quotelink"">&gt;&gt;177734384</a><br>Yea, that was the point of it.', 'time': 1670674214, 'resto': 177720655}, {'no': 177734433, 'now': '12/10/22(Sat)07:12:45', 'name': 'Anonymous', 'com': '<a href=""#p177734384"" class=""quotelink"">&gt;&gt;177734384</a><br>uuhhhh proof ????', 'time': 1670674365, 'resto': 177720655}]",1670674365,Why are TV men so bad at sex?
