,no,now,name,com,filename,ext,w,h,tn_w,tn_h,tim,time,md5,fsize,resto,bumplimit,imagelimit,semantic_url,custom_spoiler,replies,images,omitted_posts,omitted_images,last_replies,last_modified,sub
100,177733652,12/10/22(Sat)06:24:58,Anonymous,Which one of you did this?,war,.png,387,448,215,250,1670671498671598,1670671498,riI6Lbk1kGVweDA6FZEpIA==,96528,0,0,0,which-one-of-you-did-this,5,6,3,1.0,0.0,"[{'no': 177733712, 'now': '12/10/22(Sat)06:28:57', 'name': 'Anonymous', 'com': 'searched and it&#039;s true but Willow is best known for Willow', 'time': 1670671737, 'resto': 177733652}, {'no': 177733713, 'now': '12/10/22(Sat)06:28:58', 'name': 'Anonymous', 'com': '<a href=""#p177733652"" class=""quotelink"">&gt;&gt;177733652</a><br>Oh my G_D it&#039;s true!', 'filename': '1666213765475761s', 'ext': '.jpg', 'w': 109, 'h': 125, 'tn_w': 109, 'tn_h': 125, 'tim': 1670671738875396, 'time': 1670671738, 'md5': '2aqOiQvfo9U6/4+6+GDYOw==', 'fsize': 3115, 'resto': 177733652}, {'no': 177733730, 'now': '12/10/22(Sat)06:30:23', 'name': 'Anonymous', 'com': 'the finest toys shatter too easily...', 'time': 1670671823, 'resto': 177733652}, {'no': 177733758, 'now': '12/10/22(Sat)06:32:01', 'name': 'Anonymous', 'com': 'Wild shit. Apparently he was found with kinky handcuffs on him in an oompa loompa costume. Cops said they&#039;re suspecting a dude by the name of &#039;Willy Wanka&#039;', 'filename': 'hqdefault (22)', 'ext': '.jpg', 'w': 480, 'h': 360, 'tn_w': 125, 'tn_h': 93, 'tim': 1670671921924914, 'time': 1670671921, 'md5': 'uIZ3W8xjqbhpWHId48LZmA==', 'fsize': 11415, 'resto': 177733652}, {'no': 177733808, 'now': '12/10/22(Sat)06:34:48', 'name': 'Anonymous', 'com': '<a href=""#p177733758"" class=""quotelink"">&gt;&gt;177733758</a>', 'filename': '1643217956023', 'ext': '.jpg', 'w': 600, 'h': 899, 'tn_w': 83, 'tn_h': 124, 'tim': 1670672088854689, 'time': 1670672088, 'md5': '3wIh1Cxt8b21UN3HGc0uNw==', 'fsize': 50419, 'resto': 177733652}]",1670672088,
101,177733568,12/10/22(Sat)06:19:02,Anonymous,RIIIIIIIIIGGGGGGG IT AIN&#039;T WHAT IT USED TO BE,1670291613748361,.png,595,600,247,250,1670671142337012,1670671142,7qUBABv6NLq3ULVN49qjCQ==,430191,0,0,0,riiiiiiiiiggggggg-it-aint-what-it-used-to-be,5,3,2,,,"[{'no': 177733664, 'now': '12/10/22(Sat)06:25:46', 'name': 'Anonymous', 'com': '<a href=""#p177733568"" class=""quotelink"">&gt;&gt;177733568</a><br>Why did they do it?', 'filename': '1667946068110281', 'ext': '.webm', 'w': 1280, 'h': 720, 'tn_w': 125, 'tn_h': 70, 'tim': 1670671546243222, 'time': 1670671546, 'md5': 'X7rlEKOjJ1pVeWYmlewZIw==', 'fsize': 2134092, 'resto': 177733568}, {'no': 177733789, 'now': '12/10/22(Sat)06:33:55', 'name': 'Anonymous', 'com': '<span class=""quote"">&gt;THAT&#039;S A THREE DAY BAN! WHY&#039;S HE STILL POSTIN?!</span>', 'filename': '1668204625208884', 'ext': '.png', 'w': 607, 'h': 529, 'tn_w': 125, 'tn_h': 108, 'tim': 1670672035238685, 'time': 1670672035, 'md5': 'nFfd4tQa52+kB8R0PGiGuQ==', 'fsize': 297380, 'resto': 177733568}, {'no': 177733803, 'now': '12/10/22(Sat)06:34:40', 'name': 'Anonymous', 'com': 'RAAAAAAAAAAAGGGGGGGGGHHHH!!!!!!!!!!<wbr>!!!!! *runs away*', 'time': 1670672080, 'resto': 177733568}]",1670672080,
102,177730537,12/10/22(Sat)03:19:32,Anonymous,post yfw you will never have a tea threesome with Niles and Frasier,1464672985342,.png,640,430,250,167,1670660372319689,1670660372,rbD3xWivOHL9DDws2CjSow==,448475,0,0,0,post-yfw-you-will-never-have-a-tea-threesome-with,5,8,3,3.0,0.0,"[{'no': 177731003, 'now': '12/10/22(Sat)03:43:13', 'name': 'Anonymous', 'com': 'A teasome, if you will', 'time': 1670661793, 'resto': 177730537}, {'no': 177731783, 'now': '12/10/22(Sat)04:21:31', 'name': 'Anonymous', 'com': '<a href=""#p177730582"" class=""quotelink"">&gt;&gt;177730582</a><br>Maris', 'time': 1670664091, 'resto': 177730537}, {'no': 177732225, 'now': '12/10/22(Sat)04:51:15', 'name': 'Anonymous', 'com': '<a href=""#p177730556"" class=""quotelink"">&gt;&gt;177730556</a><br>Would you say they&#039;re fruity and precocious?', 'filename': 'BF', 'ext': '.jpg', 'w': 1256, 'h': 657, 'tn_w': 125, 'tn_h': 65, 'tim': 1670665875629679, 'time': 1670665875, 'md5': 'YerYFFiM51sk8l663zvL5Q==', 'fsize': 60185, 'resto': 177730537}, {'no': 177732643, 'now': '12/10/22(Sat)05:13:41', 'name': 'Anonymous', 'com': '<span class=""quote"">&gt;have sex, Frasier</span><br><span class=""quote"">&gt;FUCK YOU ROZ</span>', 'filename': '1670534347060198', 'ext': '.jpg', 'w': 720, 'h': 540, 'tn_w': 125, 'tn_h': 93, 'tim': 1670667221924565, 'time': 1670667221, 'md5': 'NJvZ8CV5G5FfUejpPSlwDw==', 'fsize': 98827, 'resto': 177730537}, {'no': 177733802, 'now': '12/10/22(Sat)06:34:32', 'name': 'Anonymous', 'filename': '1643765962615', 'ext': '.jpg', 'w': 720, 'h': 540, 'tn_w': 125, 'tn_h': 93, 'tim': 1670672072643395, 'time': 1670672072, 'md5': 'gDSERf1Os0vvvFywbipiDA==', 'fsize': 88274, 'resto': 177730537}]",1670672072,
103,177733723,12/10/22(Sat)06:29:54,Anonymous,Would you the Raccoon?,fec1e561825c8c4cdddbcff400f6e443,.jpg,800,800,250,250,1670671794833386,1670671794,HI8pnjOWeeb9CN9pWIfXxA==,124286,0,0,0,would-you-the-raccoon,5,2,0,,,"[{'no': 177733779, 'now': '12/10/22(Sat)06:33:09', 'name': 'Anonymous', 'com': '<a href=""#p177733723"" class=""quotelink"">&gt;&gt;177733723</a><br>This is why getting rid of bullying was a wrong decision. OP needed to get his ass beat a few times when he was a kid that way he would know that no one thinks he&#039;s anything but a disgusting pervert and he would be ashamed of his perceived lust for animals, which is really just him wanting to get any response out of people because he is so utterly lonely.', 'time': 1670671989, 'resto': 177733723}, {'no': 177733800, 'now': '12/10/22(Sat)06:34:28', 'name': 'Anonymous', 'com': '<a href=""#p177733779"" class=""quotelink"">&gt;&gt;177733779</a><br>Bullying is never a viable means of resolution.<br>The demoralizers seem to be out in full force right now.', 'time': 1670672068, 'resto': 177733723}]",1670672068,
104,177733793,12/10/22(Sat)06:34:12,Anonymous,"Let me get this straight, Carter one of the most smartest humans alive repeatably dial the same address over and over again without once ever dialing another? such as abydos..<br><br>That&#039;s troubleshooting 101.",Stargate SG1 gate,.jpg,558,322,250,144,1670672052096308,1670672052,+9FkNWlgxsx0wom+82KqPA==,16922,0,0,0,let-me-get-this-straight-carter-one-of-the-most,5,0,0,,,,1670672052,
105,177733766,12/10/22(Sat)06:32:33,Anonymous,I need eyes in the sky gotta get a bird&#039;s eye view of the situation,133128,.jpg,754,777,242,250,1670671953647143,1670671953,T8nrL3m4zqdYKDs8BQXeLg==,58210,0,0,0,i-need-eyes-in-the-sky-gotta-get-a-birds-eye-view,5,0,0,,,,1670671953,
106,177732332,12/10/22(Sat)04:57:00,Anonymous,Steamsisters... I thought Ubisoft was coming home...,Far-Cry-6-Steam-release-date-2,.jpg,640,360,250,140,1670666220181821,1670666220,SvYBXPKl/SAN1jCO2zvNkQ==,72878,0,0,0,steamsisters-i-thought-ubisoft-was-coming-home,5,4,0,,,"[{'no': 177732389, 'now': '12/10/22(Sat)05:00:26', 'name': 'Anonymous', 'com': '<a href=""#p177732332"" class=""quotelink"">&gt;&gt;177732332</a><br>Nigga...', 'time': 1670666426, 'resto': 177732332}, {'no': 177732482, 'now': '12/10/22(Sat)05:04:57', 'name': 'Anonymous', 'com': '<a href=""#p177732332"" class=""quotelink"">&gt;&gt;177732332</a><br>I haven’t bought a new game in 7 years, you should consider doing the same', 'time': 1670666697, 'resto': 177732332}, {'no': 177733739, 'now': '12/10/22(Sat)06:30:51', 'name': 'Anonymous', 'com': '<a href=""#p177732332"" class=""quotelink"">&gt;&gt;177732332</a><br>FarCry is not a Sony game, therefore it doesn&#039;t belong on the film board.', 'time': 1670671851, 'resto': 177732332}, {'no': 177733759, 'now': '12/10/22(Sat)06:32:06', 'name': 'Anonymous', 'com': '<a href=""#p177732332"" class=""quotelink"">&gt;&gt;177732332</a><br><a href=""//boards.4channel.org/v/"" class=""quotelink"">&gt;&gt;&gt;/v/</a> is down the hall and to the left', 'time': 1670671926, 'resto': 177732332}]",1670671926,
107,177733755,12/10/22(Sat)06:31:43,Anonymous,the greatest,Christmas_Carol_-_The_Movie_2001_dvd,.jpg,331,450,183,250,1670671903229445,1670671903,zlyp01RyBMmgAi1PFjDCkg==,88927,0,0,0,the-greatest,5,0,0,,,,1670671903,
108,177731573,12/10/22(Sat)04:10:14,Anonymous,,Everything,.jpg,1000,563,250,140,1670663414298010,1670663414,ub9WbRxgZumnPDWjf4lrig==,226327,0,0,0,reddit-the-movie,5,25,1,20.0,1.0,"[{'no': 177733630, 'now': '12/10/22(Sat)06:22:56', 'name': 'Anonymous', 'com': '<a href=""#p177731573"" class=""quotelink"">&gt;&gt;177731573</a><br>Gotta say, I love that these are daily threads now. The praise this was getting upon release really rubbed me the wrong way.', 'time': 1670671376, 'resto': 177731573}, {'no': 177733683, 'now': '12/10/22(Sat)06:27:13', 'name': 'Anonymous', 'com': '<a href=""#p177732680"" class=""quotelink"">&gt;&gt;177732680</a><br>reddit the tv series: stranger things, sex education, really anything produced by jewflix<br>4chan the tv series: space ghost coast to coast<br>4chan the movie: taxi driver', 'time': 1670671633, 'resto': 177731573}, {'no': 177733707, 'now': '12/10/22(Sat)06:28:21', 'name': 'Anonymous', 'com': '<a href=""#p177733683"" class=""quotelink"">&gt;&gt;177733683</a><br><span class=""quote"">&gt;4chan the tv series: space ghost coast to coast</span><br>gigabased<br><span class=""quote"">&gt;4chan the movie: taxi driver</span><br>no everyone likes that movie', 'time': 1670671701, 'resto': 177731573}, {'no': 177733726, 'now': '12/10/22(Sat)06:30:11', 'name': 'Anonymous', 'com': '<a href=""#p177733707"" class=""quotelink"">&gt;&gt;177733707</a><br><span class=""quote"">&gt;no everyone likes that movie</span><br>stop spreading lies', 'time': 1670671811, 'resto': 177731573}, {'no': 177733744, 'now': '12/10/22(Sat)06:31:18', 'name': 'Anonymous', 'com': '<a href=""#p177733726"" class=""quotelink"">&gt;&gt;177733726</a><br>come on just take the gigabased on space ghost that was an excellent choice', 'time': 1670671878, 'resto': 177731573}]",1670671878,Reddit: the movie
109,177732125,12/10/22(Sat)04:44:49,Anonymous,I want a video game where you can play as a Prohibition agent and raid bootleggers and smash stills and string up boozeheads and torture them and shutdown bars.<br>Anything like this out there?<br><br>Boozeheads are fucking scum. Alcohol is the worst blight ever inflicted upon humanity. <br>I&#039;d ban it tomorrow if I could.,Alcoholocaust,.png,800,618,250,193,1670665489146350,1670665489,5G047ayeArj6flDZaJ3/cg==,74018,0,0,0,1923,5,17,1,12.0,1.0,"[{'no': 177732486, 'now': '12/10/22(Sat)05:05:11', 'name': 'Anonymous', 'com': '<a href=""#p177732461"" class=""quotelink"">&gt;&gt;177732461</a><br>I&#039;d have to be a massive retard to think the studies adjust for usage rates? When the studies themselves repeatedly say they adjust for usage rates amongst the general population?<br><br>When was the last time you had an alcoholic drink?', 'time': 1670666711, 'resto': 177732125}, {'no': 177732498, 'now': '12/10/22(Sat)05:05:38', 'name': 'Anonymous', 'com': '<a href=""#p177732433"" class=""quotelink"">&gt;&gt;177732433</a><br><a href=""#p177732411"" class=""quotelink"">&gt;&gt;177732411</a><br><span class=""quote"">&gt;oh god, Betty is back on her sherry habit! it&#039;s a downward spiral into destitution from here, I wish she&#039;s just stick to the black tar, it&#039;s so much safer</span>', 'time': 1670666738, 'resto': 177732125}, {'no': 177732507, 'now': '12/10/22(Sat)05:06:23', 'name': 'Anonymous', 'com': '<a href=""#p177732498"" class=""quotelink"">&gt;&gt;177732498</a><br><span class=""quote"">&gt;I wish she&#039;s just stick to the black tar, it&#039;s so much safer</span><br>It literally is safer than alcohol according to every major scientific study on drugs and their ill effects.', 'time': 1670666783, 'resto': 177732125}, {'no': 177732577, 'now': '12/10/22(Sat)05:09:53', 'name': 'Anonymous', 'com': '<a href=""#p177732437"" class=""quotelink"">&gt;&gt;177732437</a><br>I&#039;d rather be drowned in a heroin addicts feces than break break with a boozehead subhuman.', 'time': 1670666993, 'resto': 177732125}, {'no': 177733724, 'now': '12/10/22(Sat)06:30:02', 'name': 'Anonymous', 'com': '<a href=""#p177732222"" class=""quotelink"">&gt;&gt;177732222</a><br>you&#039;re a projecting fetal alcohol retard who posted on the wrong board', 'time': 1670671802, 'resto': 177732125}]",1670671802,1923
110,177730932,12/10/22(Sat)03:39:21,Anonymous,"The Disney LucasFilm &quot;Story Group&quot; is entirely female...<br><span class=""quote"">&gt;...a-a-and that&#039;s a g-g-good thing</span>",DisneyLucasFilmStoryGroup,.png,830,768,250,231,1670661561613461,1670661561,YsnHEVt56tTaEdHZ6AXJfA==,901541,0,0,0,the-disney-lucasfilm-story-group-is-entirely,5,36,4,31.0,4.0,"[{'no': 177733525, 'now': '12/10/22(Sat)06:15:58', 'name': 'Anonymous', 'com': '<a href=""#p177731644"" class=""quotelink"">&gt;&gt;177731644</a><br>greetings to kazakhstan SIR', 'time': 1670670958, 'resto': 177730932}, {'no': 177733536, 'now': '12/10/22(Sat)06:16:39', 'name': 'Anonymous', 'com': '<a href=""#p177730932"" class=""quotelink"">&gt;&gt;177730932</a><br>So this is why all they make is shit?', 'time': 1670670999, 'resto': 177730932}, {'no': 177733678, 'now': '12/10/22(Sat)06:26:59', 'name': 'Anonymous', 'com': '<a href=""#p177730932"" class=""quotelink"">&gt;&gt;177730932</a><br>There is no way that is a real job those women are obviously on the payroll for ESG credit', 'time': 1670671619, 'resto': 177730932}, {'no': 177733694, 'now': '12/10/22(Sat)06:28:00', 'name': 'Anonymous', 'com': '<a href=""#p177730932"" class=""quotelink"">&gt;&gt;177730932</a><br>Based. Women should write most things. Good male writers died out about a decade ago. Basically the only once left are like 60.', 'time': 1670671680, 'resto': 177730932}, {'no': 177733718, 'now': '12/10/22(Sat)06:29:13', 'name': 'Anonymous', 'com': '<a href=""#p177730932"" class=""quotelink"">&gt;&gt;177730932</a><br>Is that what hell looks like?', 'time': 1670671753, 'resto': 177730932}]",1670671753,
111,177732774,12/10/22(Sat)05:21:15,Anonymous,"<span class=""quote"">&gt;Chinese theatres reopening at record levels, from almost zero a month ago to 68% today</span><br><span class=""quote"">&gt;Avatar 2 airs in a week and will basically be the only thing on. </span><br><span class=""quote"">&gt;/ourguy/ Jimmy C just ended COVID in china once and for all with his movie about blue people</span><br>3 MOTHERFUCKING BILLION DOLLARS IS BACK ON THE TABLE.",y7tpIE7,.jpg,720,1709,105,250,1670667675304254,1670667675,oSzzzSTOFyYyiQhXsergDQ==,340238,0,0,0,never-doubt-james-fucking-cameron,5,6,1,1.0,0.0,"[{'no': 177732880, 'now': '12/10/22(Sat)05:28:45', 'name': 'Anonymous', 'com': 'i just hope it makes a ridiculously low amount or a ridiculously high amount', 'time': 1670668125, 'resto': 177732774}, {'no': 177732918, 'now': '12/10/22(Sat)05:31:23', 'name': 'Anonymous', 'com': '<a href=""#p177732774"" class=""quotelink"">&gt;&gt;177732774</a><br>Cameron&#039;s entire plan was to spread covid throughout China', 'time': 1670668283, 'resto': 177732774}, {'no': 177732973, 'now': '12/10/22(Sat)05:34:49', 'name': 'Anonymous', 'com': 'who /toxic/ here', 'time': 1670668489, 'resto': 177732774}, {'no': 177733123, 'now': '12/10/22(Sat)05:46:29', 'name': 'Anonymous', 'com': '<a href=""#p177732774"" class=""quotelink"">&gt;&gt;177732774</a><br>I think a lot of them are too busy right now for movies.', 'filename': '2022-11-27T221123Z_1_LYNXMPEIAQ09Y_RTROPTP_4_HEALTH-CORONAVIRUS-CHINA-1200x800', 'ext': '.jpg', 'w': 1200, 'h': 800, 'tn_w': 125, 'tn_h': 83, 'tim': 1670669189445449, 'time': 1670669189, 'md5': 'rOqeZpRjigqXF/eDgNQOUw==', 'fsize': 153730, 'resto': 177732774}, {'no': 177733716, 'now': '12/10/22(Sat)06:29:07', 'name': 'Anonymous', 'com': '<a href=""#p177732774"" class=""quotelink"">&gt;&gt;177732774</a><br><span class=""quote"">&gt;totalitarian regime is locking down its population to prevent prostest</span><br><span class=""quote"">&gt;Jimbo calls Winnie the Pooh and tells him to open the fucking theaters</span><br><span class=""quote"">&gt;he does</span><br>Well then. Guess we know what &quot;cultural impact&quot; means now.', 'time': 1670671747, 'resto': 177732774}]",1670671747,NEVER DOUBT JAMES FUCKING CAMERON
112,177730339,12/10/22(Sat)03:08:39,Anonymous,"<span class=""quote"">&gt;she hulk tries to find a man</span><br><span class=""quote"">&gt;gets hostile when one approaches her</span><br><br>What was her problem?",1669613729258504,.webm,1920,806,250,104,1670659719585001,1670659719,wtlesDWZbcbmPdSyV47qSQ==,3124428,0,0,0,she-hulk-tries-to-find-a-man,5,29,4,24.0,4.0,"[{'no': 177733512, 'now': '12/10/22(Sat)06:15:01', 'name': 'Anonymous', 'com': '<a href=""#p177731567"" class=""quotelink"">&gt;&gt;177731567</a><br>I can tell you&#039;re having a crazy ass saturday evening out with the lads and lasses today.', 'time': 1670670901, 'resto': 177730339}, {'no': 177733534, 'now': '12/10/22(Sat)06:16:26', 'name': 'Anonymous', 'com': '<a href=""#p177733469"" class=""quotelink"">&gt;&gt;177733469</a><br><span class=""quote"">&gt;But he wasn&#039;t unattractive and was quite personable.</span><br>You really must be autistic if you thought he was either of those things.', 'time': 1670670986, 'resto': 177730339}, {'no': 177733555, 'now': '12/10/22(Sat)06:17:51', 'name': 'Anonymous', 'com': '<a href=""#p177730339"" class=""quotelink"">&gt;&gt;177730339</a><br>Why are they &#039;working&#039; at a fucking bar?', 'time': 1670671071, 'resto': 177730339}, {'no': 177733625, 'now': '12/10/22(Sat)06:22:47', 'name': 'Anonymous', 'com': '<a href=""#p177730339"" class=""quotelink"">&gt;&gt;177730339</a><br>He should have mind read if she was interested in being approached at that moment by him. There are no rules, it’s all arbitrary and roughly equivalent to your position on the looks and status totem pole.', 'time': 1670671367, 'resto': 177730339}, {'no': 177733708, 'now': '12/10/22(Sat)06:28:23', 'name': 'Anonymous', 'com': '<a href=""#p177733534"" class=""quotelink"">&gt;&gt;177733534</a><br>What makes him not either of those things?', 'time': 1670671703, 'resto': 177730339}]",1670671703,
113,177709658,12/09/22(Fri)13:12:35,Anonymous,"<span class=""quote"">&gt;Fascism is...LE BAD!</span><br>Bravo Del Taco",Guillermo_del_Toro’s_Pinocchio_with_date_2,.jpg,809,1200,168,250,1670609555479445,1670609555,Ru7SD21FIfmvkbCuDImcDg==,93559,0,0,0,fascism-isle-bad,5,139,17,134.0,16.0,"[{'no': 177733089, 'now': '12/10/22(Sat)05:43:47', 'name': 'Anonymous', 'com': '<a href=""#p177709798"" class=""quotelink"">&gt;&gt;177709798</a><br><a href=""#p177712126"" class=""quotelink"">&gt;&gt;177712126</a><br><a href=""#p177712144"" class=""quotelink"">&gt;&gt;177712144</a><br><a href=""#p177715308"" class=""quotelink"">&gt;&gt;177715308</a><br><span class=""quote"">&gt;Le I hate movies and yet I&#039;m on this board discussing le movies that I le hate so le much</span><br>Go be cool somewhere else', 'time': 1670669027, 'resto': 177709658}, {'no': 177733154, 'now': '12/10/22(Sat)05:48:34', 'name': 'Anonymous', 'com': '<a href=""#p177709658"" class=""quotelink"">&gt;&gt;177709658</a><br>They made the little lying wood a literal faggot', 'filename': '1560269292484s', 'ext': '.jpg', 'w': 250, 'h': 250, 'tn_w': 125, 'tn_h': 125, 'tim': 1670669314812950, 'time': 1670669314, 'md5': 'KOIlqRw4H4/X+UvwY4R8Vg==', 'fsize': 3579, 'resto': 177709658}, {'no': 177733426, 'now': '12/10/22(Sat)06:09:14', 'name': 'Anonymous', 'com': 'fash is le right when its left right now', 'time': 1670670554, 'resto': 177709658}, {'no': 177733560, 'now': '12/10/22(Sat)06:18:32', 'name': 'Anonymous', 'com': '<a href=""#p177709758"" class=""quotelink"">&gt;&gt;177709758</a><br>Best of 2022.', 'time': 1670671112, 'resto': 177709658}, {'no': 177733704, 'now': '12/10/22(Sat)06:28:18', 'name': 'Anonymous', 'com': '<span class=""quote"">&gt;the nazi is the only one with an american accent</span><br>bravo del taco', 'time': 1670671698, 'resto': 177709658}]",1670671698,
114,177726897,12/10/22(Sat)00:27:39,Anonymous,How much do you think rentals of this shot up in the last 24 hours?,lordofwaar,.jpg,1005,1500,167,250,1670650059744315,1670650059,T0PSQRtJhVGSVfOOzbwDBA==,346045,0,0,0,how-much-do-you-think-rentals-of-this-shot-up-in,5,121,14,116.0,13.0,"[{'no': 177733643, 'now': '12/10/22(Sat)06:24:22', 'name': 'Anonymous', 'com': '<a href=""#p177733489"" class=""quotelink"">&gt;&gt;177733489</a><br>biden traded the merchant of death for some basketball nigger who brought weed into russia', 'filename': '1670671440758', 'ext': '.jpg', 'w': 607, 'h': 794, 'tn_w': 95, 'tn_h': 124, 'tim': 1670671462788549, 'time': 1670671462, 'md5': 'Biv7KpLma/4sdmnEFLshNg==', 'fsize': 250936, 'resto': 177726897}, {'no': 177733651, 'now': '12/10/22(Sat)06:24:45', 'name': 'Anonymous', 'com': '<a href=""#p177733178"" class=""quotelink"">&gt;&gt;177733178</a><br>Yo they found Mccafee?', 'time': 1670671485, 'resto': 177726897}, {'no': 177733671, 'now': '12/10/22(Sat)06:26:12', 'name': 'Anonymous', 'com': '<a href=""#p177730542"" class=""quotelink"">&gt;&gt;177730542</a><br><span class=""quote"">&gt; even the extended sentence was a fucking joke for what he did.</span><br>..and therefore it makes sense to let him out early to get a retard dude weed user back to a country where dude weed is illegal. <br>Nah buddy none of that makes any fucking sense.', 'time': 1670671572, 'resto': 177726897}, {'no': 177733684, 'now': '12/10/22(Sat)06:27:14', 'name': 'Anonymous', 'com': '<a href=""#p177733178"" class=""quotelink"">&gt;&gt;177733178</a><br>They released Rippletoe? Is it some plan to get all Russians obese?', 'time': 1670671634, 'resto': 177726897}, {'no': 177733696, 'now': '12/10/22(Sat)06:28:01', 'name': 'Anonymous', 'com': '<a href=""#p177731939"" class=""quotelink"">&gt;&gt;177731939</a><br><span class=""quote"">&gt;this time.</span>', 'time': 1670671681, 'resto': 177726897}]",1670671681,
115,177732257,12/10/22(Sat)04:53:04,Anonymous,how did this YouTube TV star have a game made after him?,maxresdefault (35),.jpg,1280,720,250,140,1670665984013489,1670665984,UuTu0Oaz+4uhyK3wnQwzzg==,165100,0,0,0,how-did-this-youtube-tv-star-have-a-game-made,5,13,1,8.0,0.0,"[{'no': 177733449, 'now': '12/10/22(Sat)06:10:56', 'name': 'Anonymous', 'com': '<a href=""#p177733415"" class=""quotelink"">&gt;&gt;177733415</a><br>then there&#039;s a huge chance that he&#039;s a pedophile', 'time': 1670670656, 'resto': 177732257}, {'no': 177733451, 'now': '12/10/22(Sat)06:11:08', 'name': 'Anonymous', 'com': 'They paid someone to make it', 'time': 1670670668, 'resto': 177732257}, {'no': 177733601, 'now': '12/10/22(Sat)06:21:16', 'name': 'Anonymous', 'com': '<a href=""#p177732257"" class=""quotelink"">&gt;&gt;177732257</a><br>Jenny Nicholson dating sim, when?', 'filename': 'Ramble_ Overpriced Experiences (1080p_60fps_H264-128kbit_AAC).mp4_20221210_051749.586', 'ext': '.jpg', 'w': 1920, 'h': 1080, 'tn_w': 125, 'tn_h': 70, 'tim': 1670671276927893, 'time': 1670671276, 'md5': 'DLPq+JjAf6NUGRVd/g93Nw==', 'fsize': 1332280, 'resto': 177732257}, {'no': 177733641, 'now': '12/10/22(Sat)06:24:12', 'name': 'Anonymous', 'com': 'Be popular enough that every company offers to milk you?', 'time': 1670671452, 'resto': 177732257}, {'no': 177733663, 'now': '12/10/22(Sat)06:25:40', 'name': 'Anonymous', 'com': '<a href=""#p177733601"" class=""quotelink"">&gt;&gt;177733601</a><br>fetal alcohol syndrome', 'time': 1670671540, 'resto': 177732257}]",1670671540,
116,177733387,12/10/22(Sat)06:06:14,Anonymous,Sirs i just watched sicario for 15th time and decided to buy a autographed picture of emily blunt. But how can i be sure of it&#039;s quality? I dont wanna buy picture of her signed by some obese basement dweller.,56239046336aa0.74381665,.jpg,342,514,166,250,1670670374589993,1670670374,Hlz6/FXsqbjMCw4WbC2p4A==,11970,0,0,0,sirs-i-just-watched-sicario-for-15th-time-and,5,4,2,,,"[{'no': 177733523, 'now': '12/10/22(Sat)06:15:48', 'name': 'Anonymous', 'com': 'I think they&#039;re pretty much all fake there guy<br>save your money', 'filename': 'k-death', 'ext': '.jpg', 'w': 1280, 'h': 720, 'tn_w': 125, 'tn_h': 70, 'tim': 1670670948920115, 'time': 1670670948, 'md5': 'iNZJwsvim+3UUklJs9hKxw==', 'fsize': 222004, 'resto': 177733387}, {'no': 177733566, 'now': '12/10/22(Sat)06:19:00', 'name': 'Anonymous', 'com': '<a href=""#p177733523"" class=""quotelink"">&gt;&gt;177733523</a><br><a href=""#p177733387"" class=""quotelink"">&gt;&gt;177733387</a><br>There a fuckton of legitimate autograph sellers out there, even though those sellers themselves are all sleazy vermin who drive around LA with a van full of pictures and hound celebs. They’re notorious for being extremely rude.<br><br>Why do you want an autographed pic anyway?', 'filename': '9A7A156A-6AB6-4D2F-9AA8-7163E6B3A5DA', 'ext': '.jpg', 'w': 1034, 'h': 1645, 'tn_w': 78, 'tn_h': 125, 'tim': 1670671140803046, 'time': 1670671140, 'md5': 'nMQOepgTFobzu2Wh+fgwLg==', 'fsize': 1116501, 'resto': 177733387}, {'no': 177733618, 'now': '12/10/22(Sat)06:22:14', 'name': 'Anonymous', 'com': 'My uncle was talking about selling fake autographs of sports cars. He said he showed some guy some F1 drivers autograph and he said &quot;hmm it&#039;s good but I wish you had -some other F1 driver-&quot;. My uncle said I have one of those in my car actually, went out and faked the autograph and conned the guy out of hundreds. It sounds dumb but he has real autographs along with all his fake ones. He also told me he bought a holiday to Dubai with Kate Mosses stolen credit card.', 'time': 1670671334, 'resto': 177733387}, {'no': 177733653, 'now': '12/10/22(Sat)06:24:59', 'name': 'Anonymous', 'com': 'It should have a Certificate of Authenticity ( COA) certified.Or a a supplemebtal picture where and when it was taken Ebay is your vest bet.', 'time': 1670671499, 'resto': 177733387}]",1670671499,
