,no,now,name,com,filename,ext,w,h,tn_w,tn_h,tim,time,md5,fsize,resto,bumplimit,imagelimit,semantic_url,custom_spoiler,replies,images,omitted_posts,omitted_images,last_replies,last_modified,sub,trip
29,177805183,12/12/22(Mon)05:31:14,Anonymous,Still keep in touch?,jojorabbit,.jpg,602,903,166,250,1670841074544307,1670841074,1HqoZDp0hqSjbLxb423Xug==,76742,0,0,0,do-you-think-they,5,12,1,7.0,0.0,"[{'no': 177806377, 'now': '12/12/22(Mon)06:39:17', 'name': 'Anonymous', 'com': '<a href=""#p177805387"" class=""quotelink"">&gt;&gt;177805387</a><br>Thanks for clearing things up anon', 'time': 1670845157, 'resto': 177805183}, {'no': 177806411, 'now': '12/12/22(Mon)06:41:47', 'name': 'Anonymous', 'com': '<a href=""#p177805387"" class=""quotelink"">&gt;&gt;177805387</a><br>Is her sister single?', 'filename': 'thomasin.mckenzie-20221022-0008', 'ext': '.jpg', 'w': 1170, 'h': 2080, 'tn_w': 70, 'tn_h': 125, 'tim': 1670845307792493, 'time': 1670845307, 'md5': 'Kkv9qT6cSs2e1mbQpx2+2w==', 'fsize': 257579, 'resto': 177805183}, {'no': 177806438, 'now': '12/12/22(Mon)06:43:33', 'name': 'Anonymous', 'com': '<a href=""#p177806114"" class=""quotelink"">&gt;&gt;177806114</a><br>Based and mature pilled', 'time': 1670845413, 'resto': 177805183}, {'no': 177806737, 'now': '12/12/22(Mon)07:01:41', 'name': 'Anonymous', 'com': '<a href=""#p177806411"" class=""quotelink"">&gt;&gt;177806411</a><br>Thomasin &gt; her sister', 'time': 1670846501, 'resto': 177805183}, {'no': 177806900, 'now': '12/12/22(Mon)07:12:17', 'name': 'Anonymous', 'com': 'sad thing is that little boy will be crushing on her for life<br><br>ever girlfriend he has or wife will deep down never be good enough', 'time': 1670847137, 'resto': 177805183}]",1670847137,Do you think they...?,
30,177804323,12/12/22(Mon)04:38:56,Anonymous,LIFE IS PAIN<br><br>I WAKE UP EVERY MORNING AND I&#039;M IN PAIN<br><br>I GO TO WORK IN PAIN<br><br>YOU KNOW HOW MANY TIMES I WANTED TO JUST GIVE UP?<br><br>HOW MANY TIMES I&#039;VE THOUGHT ABOUT ENDING IT?,House M.D.,.png,1757,1080,250,153,1670837936362370,1670837936,Rc3nScb3/5c1fHB1Z0UuVQ==,730833,0,0,0,life-is-pain,5,28,5,23.0,4.0,"[{'no': 177806001, 'now': '12/12/22(Mon)06:14:39', 'name': 'Anonymous', 'com': '<a href=""#p177804649"" class=""quotelink"">&gt;&gt;177804649</a><br>SNEEEEEED', 'time': 1670843679, 'resto': 177804323}, {'no': 177806089, 'now': '12/12/22(Mon)06:19:34', 'name': 'Anonymous', 'com': '<a href=""#p177804649"" class=""quotelink"">&gt;&gt;177804649</a><br>What a time.', 'filename': 'Apple-iPod-Shuffle-1st-Generation-Specs-1', 'ext': '.png', 'w': 1811, 'h': 1300, 'tn_w': 125, 'tn_h': 89, 'tim': 1670843974953534, 'time': 1670843974, 'md5': '8doSXy7RfyUy418fqbeuug==', 'fsize': 27858, 'resto': 177804323}, {'no': 177806178, 'now': '12/12/22(Mon)06:25:41', 'name': 'Anonymous', 'com': '<a href=""#p177806089"" class=""quotelink"">&gt;&gt;177806089</a><br>This is the most vague 9/11 meme I’ve ever seen', 'time': 1670844341, 'resto': 177804323}, {'no': 177806179, 'now': '12/12/22(Mon)06:25:42', 'name': 'Anonymous', 'com': '<a href=""#p177804649"" class=""quotelink"">&gt;&gt;177804649</a><br>kek', 'time': 1670844342, 'resto': 177804323}, {'no': 177806899, 'now': '12/12/22(Mon)07:12:12', 'name': 'Anonymous', 'com': '<a href=""#p177804566"" class=""quotelink"">&gt;&gt;177804566</a><br>i would watch this if it were an anime (japanese)', 'time': 1670847132, 'resto': 177804323}]",1670847132,,
31,177804790,12/12/22(Mon)05:07:24,Anonymous,"Hello /tv/, I am from Marvel and phase 4’s disappointing box office has lead to the decision to reboot the main characters in a separate universe that will eventually merge and become main timeline after phase 5. <br><br>You can play a part by helping us recast the new mainline Avengers.<br><br>11 - Iron Man<br>22 - Captain America<br>33 - Thor <br>44 - Bruce Banner<br>55 - Antman<br>66 - Wasp<br>77 - Vision<br>88 - Scarlet Witch<br>99 - Warbird<br>00 - Nick Fury",3606CAAC-7FF4-48E2-A115-C2E55B8E8D51,.jpg,554,554,249,249,1670839644433020,1670839644,8P6Pwk3dMWumyB4qI6FD5g==,33999,0,0,0,hello-tv-i-am-from-marvel-and-phase-4s,5,20,9,15.0,6.0,"[{'no': 177805847, 'now': '12/12/22(Mon)06:04:56', 'name': 'Anonymous', 'com': '<a href=""#p177804790"" class=""quotelink"">&gt;&gt;177804790</a><br>if you wants GET thread then just post bale you dumb faggot instead larping as disney employee', 'time': 1670843096, 'resto': 177804790}, {'no': 177805902, 'now': '12/12/22(Mon)06:08:12', 'name': 'Anonymous', 'com': '<a href=""#p177805774"" class=""quotelink"">&gt;&gt;177805774</a><br>David Schwimmer as Vision would be garbage.', 'filename': '1666255059458', 'ext': '.jpg', 'w': 977, 'h': 1066, 'tn_w': 114, 'tn_h': 125, 'tim': 1670843292066495, 'time': 1670843292, 'md5': 'cpgG2mzUb08oIeHyQcL+aA==', 'fsize': 128391, 'resto': 177804790}, {'no': 177805934, 'now': '12/12/22(Mon)06:10:12', 'name': 'Anonymous', 'com': '<a href=""#p177805902"" class=""quotelink"">&gt;&gt;177805902</a><br>It was just a reaction image to that other post but I don&#039;t think he&#039;d be awful desu. Not great though.', 'filename': 'kaley', 'ext': '.jpg', 'w': 471, 'h': 720, 'tn_w': 81, 'tn_h': 125, 'tim': 1670843412390035, 'time': 1670843412, 'md5': 'WRRxS8Gtb/Hk6LPNMmooBQ==', 'fsize': 40123, 'resto': 177804790}, {'no': 177805977, 'now': '12/12/22(Mon)06:13:05', 'name': 'Anonymous', 'com': '<a href=""#p177805733"" class=""quotelink"">&gt;&gt;177805733</a><br>That&#039;s quite an abstract suggestion for Thor.', 'time': 1670843585, 'resto': 177804790}, {'no': 177806896, 'now': '12/12/22(Mon)07:11:55', 'name': 'Anonymous', 'com': 'One last shot at Tom before I abandon thread', 'filename': 'cruiselaugh', 'ext': '.png', 'w': 680, 'h': 435, 'tn_w': 125, 'tn_h': 79, 'tim': 1670847115744261, 'time': 1670847115, 'md5': 'kS6ZjwluKX6S6iyikpvspA==', 'fsize': 484909, 'resto': 177804790}]",1670847115,,
32,177806893,12/12/22(Mon)07:11:38,Anonymous,"<a href=""/tv/thread/177799715#p177799715"" class=""quotelink"">&gt;&gt;177799715</a><br>I have a theory about the White Lotus chain of hotels being run by the same elites that the gays and greg were working for. The gay bad guy characters in this season were a pastiche of the &quot;patriarchal&quot; mafia characters in movies and fiction such as the godfather allusion when the italian american family goes on the filming location tour and Albie says all that woke shit.<br>The under stated main theme of this season is actually dominance of power vs. dynamics of society in my opinion. Ethan&#039;s arc is based on his gaining his masculinity and asserting himself in his relationship, Albie and his father and grandfather all represent generational patriarchal tiers of inherited behavior which is why they the father said he learned it from him and the son learned it from the father. Its some woke bs like that however i think they will eventually tie that all in to the series as a whole and we will discover that some kind of tiered crime faction of elites run the hotels as a means to scam, blackmail and hit certain rich and famous people but somehow out of karmic recourse the hotels also hood a power of their own to change the lives of good people for the better.",rs_1024x759-221204123529-1024-the-white-lotus-episode-6,.jpg,1024,759,250,185,1670847098923092,1670847098,dTLjKiOVjoWdCTb05lSJ4g==,234262,0,0,0,177799715,5,0,0,,,,1670847098,,
33,177806513,12/12/22(Mon)06:48:13,Anonymous,Hell mode: no David Lynch,1664915609697,.jpg,1024,640,250,156,1670845693644675,1670845693,2+fD4EtUvcBHziG391nPgQ==,55799,0,0,0,what-are-the-best-absurdist-films,5,5,2,,,"[{'no': 177806581, 'now': '12/12/22(Mon)06:52:16', 'name': 'Anonymous', 'filename': '00', 'ext': '.jpg', 'w': 750, 'h': 1000, 'tn_w': 93, 'tn_h': 125, 'tim': 1670845936495212, 'time': 1670845936, 'md5': '03N6Fk7IukM158aPIjpaMw==', 'fsize': 137739, 'resto': 177806513}, {'no': 177806596, 'now': '12/12/22(Mon)06:53:38', 'name': 'Anonymous', 'com': '<a href=""#p177806513"" class=""quotelink"">&gt;&gt;177806513</a><br>You sick fuck.', 'time': 1670846018, 'resto': 177806513}, {'no': 177806758, 'now': '12/12/22(Mon)07:03:09', 'name': 'Anonymous', 'com': '<a href=""#p177806596"" class=""quotelink"">&gt;&gt;177806596</a><br>Huh? It&#039;s just a bunch of pumpkins', 'time': 1670846589, 'resto': 177806513}, {'no': 177806820, 'now': '12/12/22(Mon)07:06:36', 'name': 'Anonymous', 'com': '<a href=""#p177806513"" class=""quotelink"">&gt;&gt;177806513</a><br>Just watched Zardoz. One of those movies most people hated, but you can tell it influenced a lot of filmmakers. A mess, but worth a watch.', 'filename': 'images.jpeg-1', 'ext': '.jpg', 'w': 199, 'h': 253, 'tn_w': 98, 'tn_h': 125, 'tim': 1670846796584747, 'time': 1670846796, 'md5': 'sze2JM/vynHSAYHAVlqeMw==', 'fsize': 9847, 'resto': 177806513}, {'no': 177806892, 'now': '12/12/22(Mon)07:11:38', 'name': 'Anonymous', 'com': 'Pumpkin party', 'time': 1670847098, 'resto': 177806513}]",1670847098,What are the best absurdist films?,
34,177805965,12/12/22(Mon)06:12:26,Anonymous,"<span class=""quote"">&gt;90lbs female character beats up 4 200lbs men</span><br><span class=""quote"">&gt;*turns to mc* “I grew up with a lot of brothers”</span>",332554E7-AB77-414E-B5B8-6AE87F251335,.jpg,731,707,250,241,1670843546547003,1670843546,sZSsWETvFN8gIMBULbEfEg==,318231,0,0,0,90lbs-female-character-beats-up-4-200lbs-men,5,3,0,,,"[{'no': 177806078, 'now': '12/12/22(Mon)06:18:55', 'name': 'Anonymous', 'com': '<a href=""#p177805965"" class=""quotelink"">&gt;&gt;177805965</a><br>Name 17 movies and 3.5 short films', 'time': 1670843935, 'resto': 177805965}, {'no': 177806140, 'now': '12/12/22(Mon)06:23:23', 'name': 'Anonymous', 'com': '<a href=""#p177805965"" class=""quotelink"">&gt;&gt;177805965</a><br>I’m convinced this trope doesn’t even exist, I can’t think of a single example that comes to mind. Maybe it’s found in some dumb Disney channel movie for kids, I don’t know', 'time': 1670844203, 'resto': 177805965}, {'no': 177806891, 'now': '12/12/22(Mon)07:11:37', 'name': 'Anonymous', 'com': '<a href=""#p177806140"" class=""quotelink"">&gt;&gt;177806140</a><br>the movie SWAT', 'time': 1670847097, 'resto': 177805965}]",1670847097,,
35,177806890,12/12/22(Mon)07:11:23,Anonymous,"<span class=""quote"">&gt;infinite budget</span><br><span class=""quote"">&gt;galactic scale empire</span><br><span class=""quote"">&gt;shit armors</span><br><span class=""quote"">&gt;Sergeant Arch Dornan is going crazy rn</span>",Marines,.png,882,540,250,153,1670847083367525,1670847083,FOCWuhaRF8OpFLXOdHNnUA==,498024,0,0,0,see-george-lucas-see-it-was-not-difficult-to-give,5,0,0,,,,1670847083,"See, George Lucas, see!! It was not difficult to give them proper power armors!!",
36,177805692,12/12/22(Mon)05:57:47,Anonymous,execute order star 67,squart game,.png,1350,1350,250,250,1670842667216167,1670842667,w7Ro702tBR8NtGKXA1DEXg==,2388255,0,0,0,execute-order-star-67,5,17,0,12.0,0.0,"[{'no': 177806548, 'now': '12/12/22(Mon)06:50:27', 'name': 'Anonymous', 'com': '<a href=""#p177805716"" class=""quotelink"">&gt;&gt;177805716</a><br><span class=""quote"">&gt;asian with the fattest ass</span><br>t. Sean O&#039;Donnell', 'time': 1670845827, 'resto': 177805692}, {'no': 177806639, 'now': '12/12/22(Mon)06:56:00', 'name': 'Anonymous', 'com': '<a href=""#p177806527"" class=""quotelink"">&gt;&gt;177806527</a><br>prove it', 'time': 1670846160, 'resto': 177805692}, {'no': 177806688, 'now': '12/12/22(Mon)06:59:15', 'name': 'Anonymous', 'com': '<a href=""#p177806548"" class=""quotelink"">&gt;&gt;177806548</a><br><span class=""quote"">&gt;tfw your name is sean and you like asians</span><br>can I get a quick rundown on the stereotype?', 'time': 1670846355, 'resto': 177805692}, {'no': 177806799, 'now': '12/12/22(Mon)07:05:22', 'name': 'Anonymous', 'com': '<a href=""#p177806688"" class=""quotelink"">&gt;&gt;177806688</a><br>it&#039;s a meme that irishmen don&#039;t like big asses because of an old irish /sp/ post', 'time': 1670846722, 'resto': 177805692}, {'no': 177806883, 'now': '12/12/22(Mon)07:10:53', 'name': 'Anonymous', 'com': 'asian bran stark', 'time': 1670847053, 'resto': 177805692}]",1670847053,,
37,177801949,12/12/22(Mon)02:32:58,Anonymous,How the fuck did DISNEYWARS wind up being the most kino show of the year?,andor kino loy,.jpg,1200,675,250,140,1670830378811616,1670830378,I+yYBdOZCWrr+YK+QnWyzQ==,56902,0,0,0,how-the-fuck-did-disneywars-wind-up-being-the,5,39,3,34.0,2.0,"[{'no': 177806831, 'now': '12/12/22(Mon)07:07:13', 'name': 'Anonymous', 'com': '<a href=""#p177806455"" class=""quotelink"">&gt;&gt;177806455</a><br>Cope harder', 'time': 1670846833, 'resto': 177801949}, {'no': 177806838, 'now': '12/12/22(Mon)07:07:50', 'name': 'Anonymous', 'com': '<a href=""#p177806774"" class=""quotelink"">&gt;&gt;177806774</a><br><span class=""quote"">&gt;almost</span><br>What even comes close?', 'time': 1670846870, 'resto': 177801949}, {'no': 177806861, 'now': '12/12/22(Mon)07:09:39', 'name': 'Anonymous', 'com': '<span class=""quote"">&gt;the harder they shill the worse the show is</span><br>Any kinos about objectively right statements like this bad boy?', 'time': 1670846979, 'resto': 177801949}, {'no': 177806871, 'now': '12/12/22(Mon)07:10:09', 'name': 'Anonymous', 'com': 'Andor is a shit character no one gives a shit about.<br>Speeches were tryhard, forced and cringe.<br>Mon Monthma&#039;s storyline stalled and became boring incredibly fast. No actual politics. The bitch was just sitting at home with a sad face and bickering with her awful family. I felt sadder for her when she said, &quot;Many Bothans died to bring us this information,&quot; than throughout the entirety of Andor.<br>Saw Gerrera was just a cameo and really had no reason to be in the show.<br>Luthen&#039;s action scene with the lightsaber ship was garbage and utterly pointless, did not affect the story in any way, because he goes to Ferrix on the next day for some reason, despite being established as a cautious person. He had no reason to be there, because he had already dispatched two deadly assassins after Andor. He went there, because the writer couldn&#039;t figure out how to get Andor and Luthen together. And the only reason Andor found him was because conveniently Luthen parked at the exact same spot out of all the places on a fucking planet.<br>BE TOO EMO is cringe, forced toybait, much like BB8.<br>Flashbacks were useless shit.<br>Retconned Cassian&#039;s &quot;I was in this fight since I was 6 years old&quot; Separatist background, making the character even less interesting than he was before.<br>Useless filler incel clerk storyline that is absolutely pointless and will not lead to anything substantial.<br>Lots of empty, pointless Emmy bait talking that reads like the writer masturbating.<br>Dogshit pacing and structure, episodes often just end abruptly without achieving anything, no sense of finality or hook to most of them.<br>99% of the show was humans, and 90% of them had London accents. Almost no aliens. So much for rich and diverse Star Wars galaxy.<br>Doesn&#039;t look/feel like SW.<br>Absolutely devoid of fun and adventure, dull and exhausting. Pseuds confuse dark and serious for joyless and tiresome, which is what the hacks like Nolan and Villeneuve do.<br><br>Plebs really were tricked into thinking this shit is any good, it&#039;s hilarious.', 'filename': '1668625409578421', 'ext': '.webm', 'w': 1280, 'h': 536, 'tn_w': 125, 'tn_h': 52, 'tim': 1670847009405294, 'time': 1670847009, 'md5': 'HzhgomhXJfXxKiZj+EMMBQ==', 'fsize': 3140968, 'resto': 177801949}, {'no': 177806882, 'now': '12/12/22(Mon)07:10:42', 'name': 'Anonymous', 'com': '<a href=""#p177803466"" class=""quotelink"">&gt;&gt;177803466</a><br><span class=""quote"">&gt;Because it&#039;s actually political kino.</span><br><span class=""quote"">&gt;the only tv show this website likes revolves around le /pol/ drama horseshit</span><br><br>can we stop obsessing over politics in all forms for 5 fucking seconds please', 'time': 1670847042, 'resto': 177801949}]",1670847042,,
38,177801444,12/12/22(Mon)02:14:42,Anonymous,What&#039;s the best and worst casting of a real person you&#039;ve seen in a film or TV show?,Pistols-Jordan-casting,.jpg,1040,585,250,140,1670829282267100,1670829282,jjCRFHptPbL3BEpQAwPNLw==,88963,0,0,0,whats-the-best-and-worst-casting-of-a-real-person,5,14,2,9.0,1.0,"[{'no': 177804836, 'now': '12/12/22(Mon)05:10:37', 'name': 'Anonymous', 'com': '<a href=""#p177802140"" class=""quotelink"">&gt;&gt;177802140</a><br>Fassbender was even worse', 'time': 1670839837, 'resto': 177801444}, {'no': 177804875, 'now': '12/12/22(Mon)05:12:43', 'name': 'Anonymous', 'com': '<a href=""#p177803649"" class=""quotelink"">&gt;&gt;177803649</a><br>The same thing they thought when they cast Will Smith as Agent J in Men in Black and James West in Wild Wild West<br><br><span class=""quote"">&gt;this guy is popular he should make us a lot of money</span>', 'time': 1670839963, 'resto': 177801444}, {'no': 177804886, 'now': '12/12/22(Mon)05:13:18', 'name': 'Anonymous', 'com': '<a href=""#p177804875"" class=""quotelink"">&gt;&gt;177804875</a><br><span class=""quote"">&gt;Will Smith as Agent J in Men in Black</span><br>That one worked out excellently', 'time': 1670839998, 'resto': 177801444}, {'no': 177806199, 'now': '12/12/22(Mon)06:27:10', 'name': 'Anonymous', 'com': '<a href=""#p177804836"" class=""quotelink"">&gt;&gt;177804836</a><br>that one was good fuck you', 'time': 1670844430, 'resto': 177801444}, {'no': 177806877, 'now': '12/12/22(Mon)07:10:21', 'name': 'Anonymous', 'com': 'Who can dislike this? I can&#039;t imagine that person', 'filename': 'maisie pistol', 'ext': '.jpg', 'w': 1080, 'h': 1872, 'tn_w': 72, 'tn_h': 125, 'tim': 1670847021121775, 'time': 1670847021, 'md5': 'txXkVZK0ip5Uuxj2B91vDw==', 'fsize': 136928, 'resto': 177801444}]",1670847021,,
39,177805057,12/12/22(Mon)05:23:59,Anonymous,"So I started watching 90s sabrina for the first time, because why not, and it got me wondering, was jk rowling a big fan of this show when it aired?<br>Was Sabrina huge in the uk in the 90s? cause from what i&#039;ve seen so far, there&#039;s lot of shit from harry potter in this and it&#039;s only been a few episodes, like even talking paintings and moving newspapers, or book pages. Is this just a thing all shows or books about magic witches do? or did JK Rowling ripped it off? idk, just seems oddly specific.",sabrina and nigger man,.jpg,1200,675,250,140,1670840639686013,1670840639,MmPQxiIETQfJBE+uQOjuMQ==,62053,0,0,0,so-i-started-watching-90s-sabrina-for-the-first,5,7,2,2.0,0.0,"[{'no': 177806670, 'now': '12/12/22(Mon)06:58:13', 'name': 'Anonymous', 'com': '<a href=""#p177805057"" class=""quotelink"">&gt;&gt;177805057</a><br>The first Harry Potter book was already written when Sabrina came out', 'time': 1670846293, 'resto': 177805057}, {'no': 177806750, 'now': '12/12/22(Mon)07:02:41', 'name': 'Anonymous', 'com': '<a href=""#p177805057"" class=""quotelink"">&gt;&gt;177805057</a><br>Sabrina&#039;s first appearance is from before JK Rowling was even born.', 'time': 1670846561, 'resto': 177805057}, {'no': 177806779, 'now': '12/12/22(Mon)07:04:07', 'name': 'Anonymous', 'com': '<a href=""#p177806049"" class=""quotelink"">&gt;&gt;177806049</a><br><a href=""#p177806620"" class=""quotelink"">&gt;&gt;177806620</a><br><a href=""#p177806670"" class=""quotelink"">&gt;&gt;177806670</a><br><a href=""#p177806750"" class=""quotelink"">&gt;&gt;177806750</a><br>stop training your AI', 'time': 1670846647, 'resto': 177805057}, {'no': 177806788, 'now': '12/12/22(Mon)07:04:33', 'name': 'Anonymous', 'com': 'All I know is that my brother will never shut up about how pic related is where JK Rowling got all her material and admitted to being a fan of Gaiman’s.', 'filename': '7D006B15-70AB-4C75-AC94-D33257CBB18F', 'ext': '.jpg', 'w': 345, 'h': 500, 'tn_w': 86, 'tn_h': 125, 'tim': 1670846673912433, 'time': 1670846673, 'md5': 'fsR6nf1wuY7TVrEAlMhIDw==', 'fsize': 36041, 'resto': 177805057}, {'no': 177806868, 'now': '12/12/22(Mon)07:10:04', 'name': 'Anonymous', 'com': '<a href=""#p177805057"" class=""quotelink"">&gt;&gt;177805057</a><br>No, she inspired herself with this but removed all boobies', 'filename': '1550766239-1011637252', 'ext': '.jpg', 'w': 2367, 'h': 3179, 'tn_w': 93, 'tn_h': 125, 'tim': 1670847004437788, 'time': 1670847004, 'md5': 'NvLcOAztjT6tcS7x5OWJmw==', 'fsize': 1055690, 'resto': 177805057}]",1670847004,,
40,177805472,12/12/22(Mon)05:46:21,Anonymous,,twqtqwtwqtwqtwqtwtqw,.jpg,936,403,250,107,1670841981761414,1670841981,LAuhPGyyTljDoFkpfKvl8w==,88990,0,0,0,itt-peak-male-aesthetic-in-movies,5,33,20,28.0,17.0,"[{'no': 177806716, 'now': '12/12/22(Mon)07:00:28', 'name': 'Anonymous', 'filename': 'thelonggoodbye', 'ext': '.jpg', 'w': 1500, 'h': 843, 'tn_w': 125, 'tn_h': 70, 'tim': 1670846428265736, 'time': 1670846428, 'md5': 'Ppdu287xh7ZKYCD0FQ2zkQ==', 'fsize': 227310, 'resto': 177805472}, {'no': 177806770, 'now': '12/12/22(Mon)07:03:48', 'name': 'Anonymous', 'com': '<a href=""#p177805472"" class=""quotelink"">&gt;&gt;177805472</a><br>OPs a fag', 'time': 1670846628, 'resto': 177805472}, {'no': 177806775, 'now': '12/12/22(Mon)07:03:56', 'name': 'Anonymous', 'com': 'out of the fucking way, the god is coming through', 'filename': '2869921', 'ext': '.jpg', 'w': 804, 'h': 730, 'tn_w': 124, 'tn_h': 113, 'tim': 1670846636122052, 'time': 1670846636, 'md5': 'OjUggXHoH/m94USCrLQ6Lw==', 'fsize': 52278, 'resto': 177805472}, {'no': 177806811, 'now': '12/12/22(Mon)07:05:59', 'name': 'Anonymous', 'com': '<a href=""#p177806637"" class=""quotelink"">&gt;&gt;177806637</a><br>why does he have the map of skyrim', 'time': 1670846759, 'resto': 177805472}, {'no': 177806864, 'now': '12/12/22(Mon)07:09:52', 'name': 'Anonymous', 'com': '<a href=""#p177805472"" class=""quotelink"">&gt;&gt;177805472</a><br>Handsome white men in their late 30s and early 40s who are still young enough to be physically attractive but old enough to have come into their own socially and financially? Who could have thought up such an idea', 'filename': 'photo_2022-09-11_15-10-17', 'ext': '.jpg', 'w': 1065, 'h': 1280, 'tn_w': 104, 'tn_h': 125, 'tim': 1670846992280816, 'time': 1670846992, 'md5': 'InWwkZSVcXPOEJOdy3TQQw==', 'fsize': 212784, 'resto': 177805472}]",1670846992,ITT: peak male aesthetic in movies,
41,177790961,12/11/22(Sun)20:16:27,Anonymous,Who&#039;s the hottest tv/movie mom to ever exist?,judy-miller-film-characters-photo-u1,.jpg,750,790,237,250,1670807787654809,1670807787,hfNZECZ7N1FU10OfO3/8Dg==,31439,0,0,0,whos-the-hottest-tvmovie-mom-to-ever-exist,5,236,83,231.0,82.0,"[{'no': 177806265, 'now': '12/12/22(Mon)06:31:50', 'name': 'Anonymous', 'com': '<span class=""quote"">&gt;&quot;Don&#039;t worry kids, you&#039;ll be perfectly safe in your Aunt&#039;s theme park filled with dangerous dinosaurs.&quot;</span>', 'filename': 'Judy Greer', 'ext': '.jpg', 'w': 717, 'h': 479, 'tn_w': 125, 'tn_h': 83, 'tim': 1670844710902703, 'time': 1670844710, 'md5': 'UxL4Dn9XRa5JUh5yYO+7lA==', 'fsize': 30563, 'resto': 177790961}, {'no': 177806699, 'now': '12/12/22(Mon)06:59:38', 'name': 'Anonymous', 'com': '<a href=""#p177806265"" class=""quotelink"">&gt;&gt;177806265</a><br><span class=""quote"">&gt;If you see something scary, come back and fuck me</span><br>what DID she mean by THAT', 'time': 1670846378, 'resto': 177790961}, {'no': 177806763, 'now': '12/12/22(Mon)07:03:23', 'name': 'Anonymous', 'com': '<a href=""#p177806699"" class=""quotelink"">&gt;&gt;177806699</a><br>Every mom and son should be stranded on a desrted island without clothes on where they eventually fuck each other to pass the time.<br>That&#039;s my interpretation of it.', 'time': 1670846603, 'resto': 177790961}, {'no': 177806862, 'now': '12/12/22(Mon)07:09:40', 'name': 'Anonymous', 'com': '<a href=""#p177791783"" class=""quotelink"">&gt;&gt;177791783</a><br>Show me that Dinussy', 'time': 1670846980, 'resto': 177790961}, {'no': 177806863, 'now': '12/12/22(Mon)07:09:45', 'name': 'Anonymous', 'com': '<a href=""#p177797015"" class=""quotelink"">&gt;&gt;177797015</a><br>When you see a woman, always remember something - no matter how beautiful she is, somewhere out there there is a man who is tired of her shit.', 'time': 1670846985, 'resto': 177790961}]",1670846985,,
42,177806248,12/12/22(Mon)06:30:27,Anonymous,Reminder that this is what Iron Man sacrificed himself for,she-hulk-megan-thee-stallion-twerking-explained,.png,622,420,250,168,1670844627013013,1670844627,sv1jl5S+OO3din+68Bu+0Q==,382808,0,0,0,reminder-that-this-is-what-iron-man-sacrificed,5,3,0,,,"[{'no': 177806262, 'now': '12/12/22(Mon)06:31:37', 'name': 'Anonymous', 'com': 'Never would’ve imagined that Iron Man 2008 would lead to this watching it back then', 'time': 1670844697, 'resto': 177806248}, {'no': 177806824, 'now': '12/12/22(Mon)07:06:52', 'name': 'Anonymous', 'com': '<a href=""#p177806262"" class=""quotelink"">&gt;&gt;177806262</a><br>2008 may as well have been a different century', 'time': 1670846812, 'resto': 177806248}, {'no': 177806859, 'now': '12/12/22(Mon)07:09:31', 'name': 'Anonymous', 'com': '<a href=""#p177806248"" class=""quotelink"">&gt;&gt;177806248</a><br><span class=""quote"">&gt;female humor</span>', 'time': 1670846971, 'resto': 177806248}]",1670846971,,
