,no,now,name,com,filename,ext,w,h,tn_w,tn_h,tim,time,md5,fsize,resto,bumplimit,imagelimit,semantic_url,custom_spoiler,replies,images,omitted_posts,omitted_images,last_replies,last_modified,sub,trip
57,177805812,12/12/22(Mon)06:03:21,Anonymous,Why are all their &quot;kino&quot; full of cuckolding or affairs?,20220905000627_0,.jpg,1280,768,250,150,1670843001290515,1670843001,/NaBWgLobfgeiBMktSxYzQ==,156027,0,0,0,why-are-all-their-kino-full-of-cuckolding-or,5,2,0,,,"[{'no': 177806767, 'now': '12/12/22(Mon)07:03:37', 'name': 'Anonymous', 'com': 'I wanna kill myself so badly<br>I&#039;m tired of existing<br>there&#039;s nothing fun<br>there&#039;s only work', 'time': 1670846617, 'resto': 177805812}, {'no': 177806793, 'now': '12/12/22(Mon)07:04:49', 'name': 'Anonymous', 'com': '<a href=""#p177805812"" class=""quotelink"">&gt;&gt;177805812</a><br>They love heartbreak movies', 'time': 1670846689, 'resto': 177805812}]",1670846689,,
58,177806781,12/12/22(Mon)07:04:12,Anonymous,"<span class=""quote"">&gt;Young ladies, young ladies</span><br><span class=""quote"">&gt;I like &#039;em underage see</span><br><span class=""quote"">&gt;Some say that&#039;s statutory</span><br><span class=""quote"">&gt;(Joe C.) But I say it&#039;s MANDATORY!</span><br>How did they get away with this?",kid rock,.jpg,746,476,250,159,1670846652054153,1670846652,+YQiNZWFBb4+HsOr9zupBQ==,37118,0,0,0,young-ladies-young-ladies,5,0,0,,,,1670846652,,
59,177806459,12/12/22(Mon)06:44:41,Anonymous,"<span class=""quote"">&gt;I F-SLUR-ING LOVE V FOR VENDETTA!!!!!!!!</span>",gape 5_tcm25-454761,.jpg,400,600,166,250,1670845481975997,1670845481,+brrQod4Wpt4E3cCLPoG9A==,342614,0,0,0,i-fsluring-love-v-for-vendetta,5,6,0,1.0,0.0,"[{'no': 177806482, 'now': '12/12/22(Mon)06:46:10', 'name': 'Anonymous', 'com': 'Thoughts on Lawnmower Man?', 'time': 1670845570, 'resto': 177806459}, {'no': 177806595, 'now': '12/12/22(Mon)06:53:38', 'name': 'Anonymous', 'com': '<span class=""quote"">&gt;F-SLUR-ING</span><br>Faggoting?', 'time': 1670846018, 'resto': 177806459}, {'no': 177806650, 'now': '12/12/22(Mon)06:56:55', 'name': 'Anonymous', 'com': 'you see, without knowing who said that, words are in a meaningless dark void. They must be someone who enjoy sóygòyslop, but that&#039;s about it. Are they someone of your coworker? A boss of yours? A random social media instigator?', 'time': 1670846215, 'resto': 177806459}, {'no': 177806658, 'now': '12/12/22(Mon)06:57:35', 'name': 'Anonymous', 'com': '<a href=""#p177806650"" class=""quotelink"">&gt;&gt;177806650</a><br>* someone among your coworkers, yes', 'time': 1670846255, 'resto': 177806459}, {'no': 177806776, 'now': '12/12/22(Mon)07:03:59', 'name': 'Anonymous', 'com': '&#039;cob on the log', 'time': 1670846639, 'resto': 177806459}]",1670846639,,
60,177801690,12/12/22(Mon)02:23:46,Anonymous,"So I held off on seeing this movie until the other night because I read the book and knew there would be no real way to satisfactorily adapt such a detailed story into a single 2hr movie. I was right, story is insanely rushed with a lot of plot cut. <br><br>That said, it wasn&#039;t actually bad for what they did include. I&#039;m hoping we&#039;ll eventually get a HBO series remake like they did with His dark materials. Anyway what&#039;d y&#039;all think of this movie? If y&#039;all haven&#039;t read the book I recommend it, I just ordered myself a copy.",p9983313_p_v8_ac,.jpg,960,1440,166,250,1670829826576622,1670829826,n38zuIfSNqukNDurtmp7EA==,312445,0,0,0,enders-game,5,14,0,9.0,0.0,"[{'no': 177804583, 'now': '12/12/22(Mon)04:53:21', 'name': 'Anonymous', 'com': '<span class=""quote"">&gt;Read the book, one of the guys drops a joke in a tense moment, the other kids laugh, main character feels much better. &quot;Let&#039;s do this!&quot;</span><br><br><span class=""quote"">&gt;Watch the movie, he drops the joke, it falls completely flat, the other kids awkwardly stares at eachother. &quot;Yeah... lets&#039;.. let&#039;s do this.. God I&#039;m so depressed&quot;</span>', 'time': 1670838801, 'resto': 177801690}, {'no': 177805752, 'now': '12/12/22(Mon)06:00:15', 'name': 'Anonymous', 'com': '<a href=""#p177803296"" class=""quotelink"">&gt;&gt;177803296</a><br>The main problem with the movie adaptation or basically all potential visual adaptations is that there is a shit ton of inner monolog of Ender which just can&#039;t be properly translated into movie. That&#039;s why they decided for the film to turn his inner monologs to dialogs with Bean. I think that was a great move, but it chipped away from the feeling that Ender is isolated.', 'time': 1670842815, 'resto': 177801690}, {'no': 177806075, 'now': '12/12/22(Mon)06:18:51', 'name': 'Anonymous', 'com': '<span class=""quote"">&gt;ya&#039;ll</span>', 'time': 1670843931, 'resto': 177801690}, {'no': 177806690, 'now': '12/12/22(Mon)06:59:21', 'name': 'Anonymous', 'com': '<a href=""#p177801690"" class=""quotelink"">&gt;&gt;177801690</a><br>I tuned it off after the first 5 minutes. Disgusting cinematic trash. Horrific aesthetics. Unsurprising though. &#039;Ender&#039;s Game&#039; is a book about the moral quagmire that is leadership in war. Calisoys have no leadership competence whatsoever.', 'time': 1670846361, 'resto': 177801690}, {'no': 177806773, 'now': '12/12/22(Mon)07:03:51', 'name': 'Anonymous', 'com': '<a href=""#p177803296"" class=""quotelink"">&gt;&gt;177803296</a><br>Enders shadow is pure garbage and should never be in a movie. If you disagree you are a faggot and possibly a retard', 'time': 1670846631, 'resto': 177801690}]",1670846631,Enders Game,
61,177804631,12/12/22(Mon)04:56:49,Anonymous,"<span class=""quote"">&gt;&quot;Who&#039;s the lucky guy...or girl?&quot;</span><br><br>Was this line necessary? Why do they have to make everything gay?",smh,.jpg,2048,1013,250,123,1670839009516051,1670839009,7NHlqiXuYQtt2fSCHgwIVA==,275957,0,0,0,wednesday-thread,5,64,9,59.0,8.0,"[{'no': 177806504, 'now': '12/12/22(Mon)06:47:42', 'name': 'Anonymous', 'com': '<a href=""#p177806353"" class=""quotelink"">&gt;&gt;177806353</a><br>What would those two characters smell like? Asking for a friend.', 'time': 1670845662, 'resto': 177804631}, {'no': 177806506, 'now': '12/12/22(Mon)06:47:50', 'name': 'Anonymous', 'com': '<a href=""#p177806353"" class=""quotelink"">&gt;&gt;177806353</a><br>its queerbait it doesn&#039;t have to make sense as long as the actors have chemistry the characters have chemistry', 'time': 1670845670, 'resto': 177804631}, {'no': 177806509, 'now': '12/12/22(Mon)06:48:02', 'name': 'Anonymous', 'com': '<a href=""#p177804710"" class=""quotelink"">&gt;&gt;177804710</a><br>Keep projecting, queer', 'time': 1670845682, 'resto': 177804631}, {'no': 177806551, 'now': '12/12/22(Mon)06:50:38', 'name': 'Anonymous', 'com': '<a href=""#p177806353"" class=""quotelink"">&gt;&gt;177806353</a><br>There is romance in it if you consider that they could have sexual attraction to each other, if you do that, it&#039;s not much different than straight romance.', 'time': 1670845838, 'resto': 177804631}, {'no': 177806768, 'now': '12/12/22(Mon)07:03:45', 'name': 'Anonymous', 'com': 'Best scene in the show', 'filename': 'Sexy-Jenna-Ortega-Ass-Pictures-Revealed-2', 'ext': '.png', 'w': 885, 'h': 715, 'tn_w': 125, 'tn_h': 100, 'tim': 1670846625192400, 'time': 1670846625, 'md5': 'hxYfXehJQHCS3RfsfaHh0w==', 'fsize': 604801, 'resto': 177804631}]",1670846625,Wednesday thread,
62,177805351,12/12/22(Mon)05:39:50,Anonymous,well i use POOPH!<br>https://www.youtube.com/watch?v=-Aj<wbr>WPgDfEMs&amp;ab_channel=JohnnyToon<br><br>this is poof the most powerful pet odor<br><br>eliminator in the world no harsh<br><br>cheicals no harsh chemicals no<br>0:07<br>fragrances none seriously<br><br>it&#039;s safe for people pets and the planet<br><br>what&#039;s this<br>0:17<br>oh that&#039;s pure ammonia just got to poof<br><br>it check this out<br><br><br>wow i don&#039;t smell anything<br><br>literally nothing that&#039;s because there&#039;s<br>0:26<br>nothing to smell<br>0:28<br>poof is a commercial grade formula a no<br>0:30<br>nonsense no fragrance odor eliminator a<br>0:34<br>formula used in the country&#039;s largest<br>0:36<br>municipal waste companies to eliminate<br>0:39<br>organic odors and make entire<br>0:41<br>communities more livable yet it meets<br>0:44<br>the most stringent safety standards<br>0:46<br>pet odor poofing odor on the pets<br>0:49<br>urine<br>0:52<br>vomit<br>0:53<br>wet dog litter box smells trash any<br>0:57<br>organic odor even skunk odor<br>1:01<br>one spray and it goes away<br>1:04<br>give it a smell<br>1:05<br>wow<br>1:07<br>generic sprays only cover up and reduce<br>1:09<br>odor i smell like pooping flowers now<br>1:12<br>hoof works instantly it dismantles odor<br>1:15<br>on a molecular level it literally takes<br>1:18<br>thing out of the equation<br>1:19<br>powerful enough to eliminate skunk odor<br>1:22<br>yet safe enough to use on pet toys their<br>1:25<br>beds your bed takes the stink out of car<br>1:27<br>seats pillows and cushions<br>1:30<br>even litter boxes and garbage cans<br>1:33<br>so why waste money on any product that<br>1:35<br>doesn&#039;t totally eliminate the steak call<br>1:38<br>now and get a 32 ounce bottle of food<br>1:40<br>for just 19.99 and get free shipping<br>1:43<br>i guarantee you&#039;ll never use anything<br>1:45<br>else again or your money back plus get a<br>1:48<br>free sample of poof laundry odor<br>1:50<br>eliminator just one wash remove the<br>1:52<br>toughness odors from your laundry and<br>1:54<br>your washer the pet owner is gone<br><br>forever if it&#039;s not poof it stinks,POOPH,.png,2392,1145,250,119,1670841590830593,1670841590,biQEcp00l/f07rnNzWHxMQ==,2486516,0,0,0,what-do-you-use-to-freshen-up-the-room-before,5,1,0,,,"[{'no': 177806765, 'now': '12/12/22(Mon)07:03:24', 'name': 'Anonymous', 'com': 'Ditilation odor got you down, just one spray of POOPH!<br><br>Oder gone!', 'time': 1670846604, 'resto': 177805351}]",1670846604,What do you use to freshen up the room before watching a movie with friends?,
63,177803772,12/12/22(Mon)04:04:06,Anonymous,Holy based,harrybrown,.jpg,950,1407,168,250,1670835846419908,1670835846,EOZZyJXsqylMBBxiJH2Bag==,221860,0,0,0,holy-based,5,24,4,19.0,3.0,"[{'no': 177806683, 'now': '12/12/22(Mon)06:59:02', 'name': 'Anonymous', 'com': '<a href=""#p177803772"" class=""quotelink"">&gt;&gt;177803772</a><br>I like to pretend this is what Alfred gets up to when Batman is off having whacky adventures with Aquaman or Martian Manhunter.', 'time': 1670846342, 'resto': 177803772}, {'no': 177806727, 'now': '12/12/22(Mon)07:01:09', 'name': 'Anonymous', 'com': '<span class=""quote"">&gt;you failed to maintain your thread, son</span>', 'filename': 'harrybrownmaintain', 'ext': '.jpg', 'w': 1280, 'h': 720, 'tn_w': 125, 'tn_h': 70, 'tim': 1670846469010369, 'time': 1670846469, 'md5': 'KFFJxY1VM/cw8tDBUO24Ag==', 'fsize': 103613, 'resto': 177803772}, {'no': 177806731, 'now': '12/12/22(Mon)07:01:21', 'name': 'Anonymous', 'com': '<a href=""#p177806651"" class=""quotelink"">&gt;&gt;177806651</a><br>He&#039;s legit great in everything. I hope he gets a best supporting Oscar nomination for The Stranger. Okay movie but he was once again great. <br>While I understand winning or being nominated for an Oscar often isn&#039;t about merit and it doesn&#039;t have the cachet it used to it&#039;s still good for people to get recognition for good work and it&#039;s still the highest profile meme award.', 'time': 1670846481, 'resto': 177803772}, {'no': 177806752, 'now': '12/12/22(Mon)07:02:47', 'name': 'Anonymous', 'com': '<a href=""#p177803772"" class=""quotelink"">&gt;&gt;177803772</a><br>Why not just make it an official get carter sequel?', 'time': 1670846567, 'resto': 177803772}, {'no': 177806766, 'now': '12/12/22(Mon)07:03:24', 'name': 'Anonymous', 'com': '<a href=""#p177803772"" class=""quotelink"">&gt;&gt;177803772</a><br><span class=""quote"">&gt;Harry Brown</span><br><span class=""quote"">&gt;Harry Hole</span><br>My 2 favorite film protags', 'time': 1670846604, 'resto': 177803772}]",1670846604,,
64,177793093,12/11/22(Sun)21:18:01,Anonymous,"<span class=""quote"">&gt;goes to poor third world country</span><br><span class=""quote"">&gt;shoves big professional camera in poor people&#039;s faces</span><br><span class=""quote"">&gt;eats like a pig in front of malnourished people</span><br><span class=""quote"">&gt;complains about american imperialism </span><br><span class=""quote"">&gt;leaves</span>",1668434884868,.jpg,634,1024,154,250,1670811481614283,1670811481,zQB2pChTFCbaAx1hN6H6fg==,260132,0,0,0,goes-to-poor-third-world-country,5,112,7,107.0,6.0,"[{'no': 177805545, 'now': '12/12/22(Mon)05:50:06', 'name': 'Anonymous', 'com': '<a href=""#p177795602"" class=""quotelink"">&gt;&gt;177795602</a><br>kek nobody has an argument against this', 'time': 1670842206, 'resto': 177793093}, {'no': 177806289, 'now': '12/12/22(Mon)06:33:00', 'name': 'Anonymous', 'com': '<a href=""#p177795553"" class=""quotelink"">&gt;&gt;177795553</a><br>The criticisms aren&#039;t fair or based in reality, though.', 'time': 1670844780, 'resto': 177793093}, {'no': 177806627, 'now': '12/12/22(Mon)06:55:28', 'name': 'Anonymous', 'com': '<a href=""#p177796401"" class=""quotelink"">&gt;&gt;177796401</a><br>They think that they have more life experience than you, even if most of those experiences were things like sucking dick for heroin', 'time': 1670846128, 'resto': 177793093}, {'no': 177806713, 'now': '12/12/22(Mon)07:00:09', 'name': 'Anonymous', 'com': '<a href=""#p177793093"" class=""quotelink"">&gt;&gt;177793093</a><br><span class=""quote"">&gt;threatens to kill Trump</span><br><span class=""quote"">&gt;kills himself</span>', 'time': 1670846409, 'resto': 177793093}, {'no': 177806759, 'now': '12/12/22(Mon)07:03:10', 'name': 'Anonymous', 'com': '<a href=""#p177806713"" class=""quotelink"">&gt;&gt;177806713</a><br>many such cases', 'filename': '1660249473626', 'ext': '.png', 'w': 286, 'h': 353, 'tn_w': 101, 'tn_h': 124, 'tim': 1670846590943997, 'time': 1670846590, 'md5': 'BKwo9ow/qe5lbiDqZz2fJw==', 'fsize': 116601, 'resto': 177793093}]",1670846590,,
65,177806316,12/12/22(Mon)06:34:39,Anonymous,"<span class=""quote"">&gt;I think I could turn and live with animals. They are so placid and self-contained. They do not lie awake in the dark and weep for their sins. They do not make me sick discussing their duty to God. Not one of them kneels to another or to his own kind that lived thousands of years ago. Not one of them is respectable or unhappy, all over the earth.</span>",1667323428146,.jpg,3500,2280,250,162,1670844879531242,1670844879,DIXVYoV6B1aT7Vv1ICWZ6Q==,1177616,0,0,0,i-think-i-could-turn-and-live-with-animals-they,5,1,0,,,"[{'no': 177806757, 'now': '12/12/22(Mon)07:03:02', 'name': 'Anonymous', 'com': '<a href=""#p177806316"" class=""quotelink"">&gt;&gt;177806316</a><br><span class=""quote"">&gt;Not one of them kneels to another</span><br>Is he retarded?', 'time': 1670846582, 'resto': 177806316}]",1670846582,,
66,177803726,12/12/22(Mon)04:01:38,Anonymous,Are you hyped for pic related <br>will it be good,A8BF411C-4295-457A-B4C1-CCE8235FC96F,.jpg,957,1662,143,250,1670835698200545,1670835698,eaphsaimx7GJ4IYyVRpqLw==,1106813,0,0,0,are-you-hyped-for-pic-related,5,28,4,23.0,3.0,"[{'no': 177805889, 'now': '12/12/22(Mon)06:07:10', 'name': 'Anonymous', 'com': '<a href=""#p177804285"" class=""quotelink"">&gt;&gt;177804285</a><br>Jesus fucking christ. This is the modern audience.', 'time': 1670843230, 'resto': 177803726}, {'no': 177806253, 'now': '12/12/22(Mon)06:30:49', 'name': 'Anonymous', 'com': '<a href=""#p177805823"" class=""quotelink"">&gt;&gt;177805823</a><br>We already saw everything, what&#039;s the point. <br><a href=""#p177804513"" class=""quotelink"">&gt;&gt;177804513</a><br>Yeah. Sure.', 'time': 1670844649, 'resto': 177803726}, {'no': 177806672, 'now': '12/12/22(Mon)06:58:19', 'name': 'Anonymous', 'com': '<a href=""#p177806253"" class=""quotelink"">&gt;&gt;177806253</a><br>lol you have Janeway syndrome<br>Talking shit about her all the time but deep down you want to fuck her so bad.', 'time': 1670846299, 'resto': 177803726}, {'no': 177806749, 'now': '12/12/22(Mon)07:02:37', 'name': 'Anonymous', 'com': '<a href=""#p177803971"" class=""quotelink"">&gt;&gt;177803971</a><br>I knew a chinese guy that was absolutely obsessed with her', 'time': 1670846557, 'resto': 177803726}, {'no': 177806756, 'now': '12/12/22(Mon)07:03:01', 'name': 'Anonymous', 'com': 'What the fuck is this?!', 'filename': 'segata images (21)', 'ext': '.jpg', 'w': 259, 'h': 194, 'tn_w': 125, 'tn_h': 93, 'tim': 1670846581848422, 'time': 1670846581, 'md5': '/MRcPt893yeiGFaZnOW6/A==', 'fsize': 6079, 'resto': 177803726}]",1670846581,,
67,177806747,12/12/22(Mon)07:02:34,Anonymous,Raw kino just fucking dropped.,[Anime Time] Bleach Thousand-Year Blood War - 09 [1080p][HEVC 10bit x265][AAC][Multi Sub]2,.webm,1000,562,250,140,1670846554949073,1670846554,3NoRloHLiOxF7RIqsI/hIA==,3072065,0,0,0,raw-kino-just-fucking-dropped,5,0,0,,,,1670846554,,
68,177798920,12/12/22(Mon)00:37:15,Anonymous,Did he have a point?,8b9918280e04188abc17f27efc09391188c6e7b11a74b427f7b765e346264943._RI_,.jpg,1920,1080,250,140,1670823435217916,1670823435,/9RtKrd898Q3d8lrvlDc2A==,952000,0,0,0,if-your-comedy-punches-down-its-not-funny-it-is,5,123,8,118.0,8.0,"[{'no': 177806425, 'now': '12/12/22(Mon)06:42:43', 'name': 'Anonymous', 'com': '<a href=""#p177805913"" class=""quotelink"">&gt;&gt;177805913</a><br>Lol', 'time': 1670845363, 'resto': 177798920}, {'no': 177806515, 'now': '12/12/22(Mon)06:48:15', 'name': 'Anonymous', 'com': '<a href=""#p177803534"" class=""quotelink"">&gt;&gt;177803534</a><br>holy fucking r*ddit how did you get here', 'time': 1670845695, 'resto': 177798920}, {'no': 177806587, 'now': '12/12/22(Mon)06:52:53', 'name': 'Anonymous', 'com': '<a href=""#p177804510"" class=""quotelink"">&gt;&gt;177804510</a><br>Collective self interest to live in areas where “whiteness” is the dominant cultural theme. By “whiteness” I mean being able to leave doors unlocked, not having to worry about being mugged, not being bothered for money on every street corner, and not being pulled over by the police for no reason just so they can balance their Terry stop race scorecard. Every other culture is protected except the one that is objectively the most civilized and conducive to actual forward progress.', 'time': 1670845973, 'resto': 177798920}, {'no': 177806618, 'now': '12/12/22(Mon)06:54:52', 'name': 'Anonymous', 'com': '<a href=""#p177805927"" class=""quotelink"">&gt;&gt;177805927</a><br>Punch implies some kind of hostility, but most jokes directed at certain &#039;groups&#039; are just playfully teasing. The point isn&#039;t to feel bad and viewing everything as an attack is fucking deranged.', 'time': 1670846092, 'resto': 177798920}, {'no': 177806667, 'now': '12/12/22(Mon)06:58:03', 'name': 'Anonymous', 'com': '<a href=""#p177806425"" class=""quotelink"">&gt;&gt;177806425</a><br>Not answering the question.', 'time': 1670846283, 'resto': 177798920}]",1670846725,"&quot;If your comedy punches down, it&#039;s not funny, it is bullying&quot;",
69,177805740,12/12/22(Mon)05:59:44,Anonymous,blessed /tv/ images,actress-jeanne-tripplehorn-autograph_1_ef94a62f3aeb7b143a8d3f47c300dee9,.jpg,1447,1080,250,186,1670842784865073,1670842784,bg3lN3oNJX0IH2T2PZdQYg==,428943,0,0,0,blessed-tv-images,5,31,14,26.0,10.0,"[{'no': 177806621, 'now': '12/12/22(Mon)06:55:06', 'name': 'Anonymous', 'filename': 'The Silence of the Lambs 1991', 'ext': '.webm', 'w': 960, 'h': 544, 'tn_w': 125, 'tn_h': 70, 'tim': 1670846106177840, 'time': 1670846106, 'md5': 'KV68cKaqx555+FO6ogEBzA==', 'fsize': 3073764, 'resto': 177805740}, {'no': 177806668, 'now': '12/12/22(Mon)06:58:04', 'name': 'Anonymous', 'com': '<a href=""#p177806443"" class=""quotelink"">&gt;&gt;177806443</a><br>Doesn&#039;t make sense, her ass is notiecably fatter and better looking in Basic Instinct, while in Waterworld it&#039;s flatter and less attractive. Why would she choose a body double with a less attractive ass?', 'filename': 'mudslime_frog', 'ext': '.jpg', 'w': 369, 'h': 363, 'tn_w': 125, 'tn_h': 122, 'tim': 1670846284047812, 'time': 1670846284, 'md5': 'CHpbHdv+acoPyKT4B4eH7Q==', 'fsize': 21412, 'resto': 177805740}, {'no': 177806691, 'now': '12/12/22(Mon)06:59:22', 'name': 'Anonymous', 'filename': '2bg', 'ext': '.jpg', 'w': 1367, 'h': 1077, 'tn_w': 125, 'tn_h': 98, 'tim': 1670846362676300, 'time': 1670846362, 'md5': 'z8l3OJSxdaia6zTI+vDllA==', 'fsize': 255436, 'resto': 177805740}, {'no': 177806710, 'now': '12/12/22(Mon)07:00:04', 'name': 'Anonymous', 'com': '<a href=""#p177805822"" class=""quotelink"">&gt;&gt;177805822</a><br>What’s up with his hand? Is this even real?', 'time': 1670846404, 'resto': 177805740}, {'no': 177806743, 'now': '12/12/22(Mon)07:02:11', 'name': 'Anonymous', 'com': '<a href=""#p177805740"" class=""quotelink"">&gt;&gt;177805740</a><br>Can you imagine being in 80s America high on cocaine, fucking some blonde bimbo on a beach at sunset while Phil Collins plays in the background', 'filename': 'e', 'ext': '.jpg', 'w': 739, 'h': 415, 'tn_w': 125, 'tn_h': 70, 'tim': 1670846531036812, 'time': 1670846531, 'md5': 't5tylURcu9CuhcAGtQepJg==', 'fsize': 37447, 'resto': 177805740}]",1670846531,,
70,177806344,12/12/22(Mon)06:37:13,Anonymous,"What YIFY movies and GALAXYTV encodes do you load on your iPad for the long trip, /tv/?<br><br><span class=""quote"">&gt;watching cartoons on your iPad in your 20&#039;s or older</span><br>Remember, this is cringe",hi,.jpg,1024,683,250,166,1670845033578203,1670845033,hwSlSxvLmdCswYBt5/iKEg==,88131,0,0,0,youre-stuck-on-a-plane-for-10-hours-with-an-ipad,5,15,4,10.0,1.0,"[{'no': 177806588, 'now': '12/12/22(Mon)06:53:04', 'name': 'Anonymous', 'filename': '1669874642648004', 'ext': '.jpg', 'w': 2143, 'h': 1080, 'tn_w': 125, 'tn_h': 62, 'tim': 1670845984597763, 'time': 1670845984, 'md5': 'bwmcAYNgeFpZOsPnzTQiLQ==', 'fsize': 263443, 'resto': 177806344}, {'no': 177806606, 'now': '12/12/22(Mon)06:54:04', 'name': 'Anonymous', 'com': '<a href=""#p177806344"" class=""quotelink"">&gt;&gt;177806344</a><br>Been there, flew from Milan to Sao Paulo, 11 hours.<br>Way there, I watched French Dispatch, Grand Budapest Hotel and Isle of Dogs and slept for the rest of time<br>Way back I slept', 'time': 1670846044, 'resto': 177806344}, {'no': 177806614, 'now': '12/12/22(Mon)06:54:29', 'name': 'Anonymous', 'filename': 'x264-NoGrip', 'ext': '.png', 'w': 1916, 'h': 992, 'tn_w': 125, 'tn_h': 64, 'tim': 1670846069806420, 'time': 1670846069, 'md5': 'HwmABT0kmflQiha1BPYN1g==', 'fsize': 1567907, 'resto': 177806344}, {'no': 177806656, 'now': '12/12/22(Mon)06:57:30', 'name': 'Anonymous', 'com': 'First 2 seasons have 39 episodes each. Both going for a tenner on Britbong iTunes.', 'filename': 'Good eeeevening', 'ext': '.jpg', 'w': 474, 'h': 640, 'tn_w': 92, 'tn_h': 125, 'tim': 1670846250837949, 'time': 1670846250, 'md5': 'GU1ttOKw5/df8MQHIpMk7g==', 'fsize': 31173, 'resto': 177806344}, {'no': 177806733, 'now': '12/12/22(Mon)07:01:27', 'name': 'Anonymous', 'com': '<a href=""#p177806656"" class=""quotelink"">&gt;&gt;177806656</a><br><span class=""quote"">&gt;Both going for a tenner on Britbong iTunes.</span><br>imagine paying for this shit when I download it for free. fucking stupid britbong cuck. go watch some british girl get fucked by an arab on your porno sites.', 'time': 1670846487, 'resto': 177806344}]",1670846487,YOU&#039;RE STUCK ON A PLANE FOR 10 HOURS WITH AN IPAD AND NO WIFI. WHAT DO YOU PRE-LOAD?,
71,177806695,12/12/22(Mon)06:59:30,Anonymous,Still no bas-ket-ball episode in which cartman get&#039;s really good at it.,28303134240_aeeecf6d30_b,.jpg,1024,683,250,166,1670846370524208,1670846370,PxKuZompkAn5H9JZl7C0cA==,108458,0,0,0,still-no-basketball-episode-in-which-cartman-gets,5,1,0,,,"[{'no': 177806718, 'now': '12/12/22(Mon)07:00:50', 'name': 'Anonymous', 'com': '<a href=""#p177806695"" class=""quotelink"">&gt;&gt;177806695</a><br>I wish South Park got cancelled years ago so Trey would&#039;ve actually worked on creative projects besides 1 thing per decade. Honestly wasted his talent phoning it in on this show for so long', 'time': 1670846450, 'resto': 177806695}]",1670846450,,
72,177806665,12/12/22(Mon)06:58:00,Anonymous,"<span class=""quote"">&gt;Character is a divorced failure dad who fails at everything he does</span><br><span class=""quote"">&gt;Child still loves him anyway</span>",tenor,.png,400,388,250,242,1670846280201686,1670846280,MO0T9hHl/BRykPrjQj7k2A==,139928,0,0,0,character-is-a-divorced-failure-dad-who-fails-at,5,2,1,,,"[{'no': 177806707, 'now': '12/12/22(Mon)06:59:59', 'name': 'Anonymous', 'com': '<span class=""quote"">&gt;Character is a biological man who masquerades as a woman</span><br><span class=""quote"">&gt;All other characters find this disgusting and reprehensible, just like in real life</span>', 'filename': '1539485390018', 'ext': '.jpg', 'w': 300, 'h': 300, 'tn_w': 125, 'tn_h': 125, 'tim': 1670846399487784, 'time': 1670846399, 'md5': 'DsKiffTD0DCmZ5IWgYRr2Q==', 'fsize': 19099, 'resto': 177806665}, {'no': 177806717, 'now': '12/12/22(Mon)07:00:42', 'name': 'Anonymous', 'com': '<a href=""#p177806707"" class=""quotelink"">&gt;&gt;177806707</a><br>name five movies <s>I want to have a good laugh</s>', 'time': 1670846442, 'resto': 177806665}]",1670846442,,
