,no,now,name,com,filename,ext,w,h,tn_w,tn_h,tim,time,md5,fsize,resto,bumplimit,imagelimit,semantic_url,custom_spoiler,replies,images,omitted_posts,omitted_images,last_replies,last_modified,sub
25,177723418,12/09/22(Fri)21:57:57,Anonymous,https://youtu.be/w3xcybdis1k,9C42FFCA-5A45-4FDE-90C9-C44AD3694C49,.jpg,1280,720,250,140,1670641077921048,1670641077,xDCSX9E6MFo0Xl0rB/0DtA==,61003,0,0,0,itt-kino-music-videos,5,147,24,142.0,23.0,"[{'no': 177733817, 'now': '12/10/22(Sat)06:35:09', 'name': 'Anonymous', 'com': '<a href=""#p177724406"" class=""quotelink"">&gt;&gt;177724406</a><br>I got banned for a music video thread.', 'time': 1670672109, 'resto': 177723418}, {'no': 177734042, 'now': '12/10/22(Sat)06:48:10', 'name': 'Anonymous', 'com': 'https://www.youtube.com/watch?v=pt9<wbr>wnawn7xQ<br>https://www.youtube.com/watch?v=6Lv<wbr>FUC-198s<br>https://www.youtube.com/watch?v=3dU<wbr>btrTU-1U<br>https://www.youtube.com/watch?v=m7Y<wbr>SNbq2KcQ<br>https://www.youtube.com/watch?v=7f2<wbr>wg1pqQDs<br>https://www.youtube.com/watch?v=92F<wbr>CRmggNqQ<br>https://www.youtube.com/watch?v=B4p<wbr>x0qQrG5E<br>https://www.youtube.com/watch?v=x05<wbr>HF0b4KPk<br>https://www.youtube.com/watch?v=ntV<wbr>V3dTo-qw<br>https://www.youtube.com/watch?v=Fwi<wbr>1qgSaxZY<br>https://www.youtube.com/watch?v=cLi<wbr>05MF5X7Q<br>https://www.youtube.com/watch?v=n6R<wbr>0t_AVIXs<br>Alright enough kino for now, enjoy, homosexuals', 'time': 1670672890, 'resto': 177723418}, {'no': 177734113, 'now': '12/10/22(Sat)06:51:51', 'name': 'Anonymous', 'com': '<a href=""#p177733710"" class=""quotelink"">&gt;&gt;177733710</a><br>yah yah yah', 'time': 1670673111, 'resto': 177723418}, {'no': 177734334, 'now': '12/10/22(Sat)07:04:58', 'name': 'Anonymous', 'com': 'https://vimeo.com/144850907<br><span class=""quote"">&gt;tfw its too much for jewtube</span>', 'filename': '1540250776091', 'ext': '.jpg', 'w': 400, 'h': 400, 'tn_w': 125, 'tn_h': 125, 'tim': 1670673898474269, 'time': 1670673898, 'md5': 'qr54m7taMSCmqTmj4wKzFg==', 'fsize': 111819, 'resto': 177723418}, {'no': 177734393, 'now': '12/10/22(Sat)07:09:42', 'name': 'Anonymous', 'com': 'https://www.youtube.com/watch?v=87n<wbr>kJquHnAU', 'time': 1670674182, 'resto': 177723418}]",1670674182,ITT kino music videos
26,177733194,12/10/22(Sat)05:51:23,Anonymous,Hud-Steve Carell plays an agent in the &quot;Housing and Urban Development&quot; Department<br><br>this is years before Get Smart and it has a Naked Gun vibe,Captura de pantalla 2022-12-10 a la(s) 07.49.15,.png,1005,711,250,176,1670669483340766,1670669483,P5k2U2SJlEayPj+1rq7flQ==,546613,0,0,0,unaired-tv-pilots,5,31,8,26.0,7.0,"[{'no': 177734124, 'now': '12/10/22(Sat)06:52:19', 'name': 'Anonymous', 'com': '<a href=""#p177733194"" class=""quotelink"">&gt;&gt;177733194</a><br><span class=""quote"">&gt;years before &quot;get smart&quot;</span><br>you realize that &quot;get smart&quot; the movie was based upon the tv show &quot;get smart&quot; which aired in the 1960s, right?<br>right?', 'filename': '1621977261629', 'ext': '.jpg', 'w': 600, 'h': 520, 'tn_w': 125, 'tn_h': 108, 'tim': 1670673139458795, 'time': 1670673139, 'md5': '1l242SVd/TUNqukXVZgrbg==', 'fsize': 172240, 'resto': 177733194}, {'no': 177734145, 'now': '12/10/22(Sat)06:53:37', 'name': 'Anonymous', 'com': '<a href=""#p177734124"" class=""quotelink"">&gt;&gt;177734124</a><br>you got any proof for this outrageous claim?', 'time': 1670673217, 'resto': 177733194}, {'no': 177734202, 'now': '12/10/22(Sat)06:57:24', 'name': 'Anonymous', 'com': '<a href=""#p177734124"" class=""quotelink"">&gt;&gt;177734124</a><br>i was talking about the movie with Steve Carell.<br><br>of course I know about Get Smart.<br><br>why are you so dense, my guy?', 'time': 1670673444, 'resto': 177733194}, {'no': 177734277, 'now': '12/10/22(Sat)07:01:30', 'name': 'Anonymous', 'com': 'https://youtu.be/fR7av02YIAg<br><br>A Space comedy with the &quot;Always Sunny&quot; gang', 'time': 1670673690, 'resto': 177733194}, {'no': 177734390, 'now': '12/10/22(Sat)07:09:28', 'name': 'Anonymous', 'com': '<a href=""#p177733423"" class=""quotelink"">&gt;&gt;177733423</a><br>It was absolute garbage, that’s why.', 'time': 1670674168, 'resto': 177733194}]",1670674168,Unaired TV Pilots
27,177732442,12/10/22(Sat)05:02:56,Anonymous,It&#039;s a piece of cake to bake a pretty cake!,1659755003260,.jpg,635,478,250,188,1670666576856069,1670666576,YaKdUqRmNkGnWKxroYpI2A==,104131,0,0,0,lazytown,5,34,10,29.0,8.0,"[{'no': 177733814, 'now': '12/10/22(Sat)06:35:04', 'name': 'Anonymous', 'com': 'anyone else enjoy using chatgpt to make lazytown episodes<br><br><span class=""quote"">&gt;The episode opens with Sportacus sitting at his desk, counting a large stack of money. He looks up as Pixel enters the room.</span><br><span class=""quote"">&gt;&quot;Hey Sportacus, what&#039;s up?&quot; Pixel asks.</span><br><span class=""quote"">&gt;&quot;Just making a little extra cash on the side,&quot; Sportacus replies, holding up a bag of crack.</span><br><span class=""quote"">&gt;Pixel&#039;s eyes light up. &quot;Is that what I think it is?&quot;</span><br><span class=""quote"">&gt;Sportacus nods. &quot;Yeah, you want some?&quot;</span><br><span class=""quote"">&gt;Pixel hesitates for a moment before nodding eagerly. &quot;Yeah, I&#039;ll take some.&quot;</span><br><span class=""quote"">&gt;Sportacus hands him the bag and watches as Pixel begins to smoke the crack.</span><br><span class=""quote"">&gt;&quot;Be careful, Pixel,&quot; Sportacus warns. &quot;This stuff can be addictive.&quot;</span><br><span class=""quote"">&gt;Pixel waves him off. &quot;I can handle it. I just want to feel good for a little while.&quot;</span><br><span class=""quote"">&gt;Sportacus shakes his head but doesn&#039;t say anything.</span><br><span class=""quote"">&gt;Meanwhile, Stingy and Ziggy are lurking outside Stephanie&#039;s bedroom window. They watch as she changes into her pajamas.</span><br><span class=""quote"">&gt;&quot;Wow, she&#039;s hot,&quot; Ziggy says, snapping a picture with his phone.</span><br><span class=""quote"">&gt;Stingy nods in agreement. &quot;Yeah, we should definitely send these pictures to all our friends.&quot;</span><br><span class=""quote"">&gt;Stephanie hears the clicking of the camera and looks up, catching sight of Stingy and Ziggy. She gasps and pulls the curtains closed, her face turning red with embarrassment.</span><br><span class=""quote"">&gt;Back at town hall, Mayor Meanswell is frantically trying to hide documents and destroy evidence. He looks up as the door bursts open and the police storm in, handcuffing him and reading him his rights.</span><br><span class=""quote"">&gt;&quot;Mayor Meanswell, you are under arrest for fraud and embezzlement,&quot; one of the officers says sternly.</span><br><span class=""quote"">&gt;The mayor looks stunned and scared. &quot;But...but I didn&#039;t do anything wrong!&quot; he protests.</span><br><span class=""quote"">&gt;The officer shakes his head. &quot;We have evidence to the contrary. You will be facing severe prison time if found guilty.&quot;</span><br><span class=""quote"">&gt;The episode ends with the town in shock and chaos, as the citizens grapple with the revelation of the mayor&#039;s corruption and Pixel&#039;s addiction to crack.</span>', 'time': 1670672104, 'resto': 177732442}, {'no': 177734320, 'now': '12/10/22(Sat)07:04:11', 'name': 'Anonymous', 'com': '<a href=""#p177733333"" class=""quotelink"">&gt;&gt;177733333</a><br>Based.', 'time': 1670673851, 'resto': 177732442}, {'no': 177734336, 'now': '12/10/22(Sat)07:05:04', 'name': 'Anonymous', 'com': '<a href=""#p177732467"" class=""quotelink"">&gt;&gt;177732467</a><br>Me', 'time': 1670673904, 'resto': 177732442}, {'no': 177734382, 'now': '12/10/22(Sat)07:09:00', 'name': 'Anonymous', 'com': '<a href=""#p177733333"" class=""quotelink"">&gt;&gt;177733333</a><br>checked', 'filename': '1569437389525', 'ext': '.png', 'w': 1024, 'h': 768, 'tn_w': 125, 'tn_h': 93, 'tim': 1670674140882928, 'time': 1670674140, 'md5': 'TQ7M1+k/UXYeXjRndWfvPQ==', 'fsize': 287085, 'resto': 177732442}, {'no': 177734383, 'now': '12/10/22(Sat)07:09:05', 'name': 'Anonymous', 'com': '<a href=""#p177732578"" class=""quotelink"">&gt;&gt;177732578</a><br><span class=""quote"">&gt;I&#039;m not even a paedophile</span>', 'filename': '1670151777407015', 'ext': '.jpg', 'w': 520, 'h': 520, 'tn_w': 125, 'tn_h': 125, 'tim': 1670674145826676, 'time': 1670674145, 'md5': 'iU1MdJKhiDdzhXdGySgKNw==', 'fsize': 26270, 'resto': 177732442}]",1670674145,LazyTown
28,177729564,12/10/22(Sat)02:30:33,Anonymous,Why did New Mutants fail?,newmutants,.jpg,1920,1023,250,133,1670657433502334,1670657433,f0adFHdKjZawdYZbNpWOiw==,196591,0,0,0,why-did-new-mutants-fail,5,17,2,12.0,2.0,"[{'no': 177732320, 'now': '12/10/22(Sat)04:56:01', 'name': 'Anonymous', 'com': 'she&#039;s so cute bros', 'time': 1670666161, 'resto': 177729564}, {'no': 177732598, 'now': '12/10/22(Sat)05:10:59', 'name': 'Anonymous', 'com': '<a href=""#p177729564"" class=""quotelink"">&gt;&gt;177729564</a><br>who?', 'time': 1670667059, 'resto': 177729564}, {'no': 177733156, 'now': '12/10/22(Sat)05:48:37', 'name': 'Anonymous', 'com': '<a href=""#p177729564"" class=""quotelink"">&gt;&gt;177729564</a><br>Old Mutants', 'time': 1670669317, 'resto': 177729564}, {'no': 177733272, 'now': '12/10/22(Sat)05:56:50', 'name': 'Anonymous', 'com': '<a href=""#p177729564"" class=""quotelink"">&gt;&gt;177729564</a><br>A cast of ridiculous meme actors like Maisie and the Demolitionist.', 'time': 1670669810, 'resto': 177729564}, {'no': 177734380, 'now': '12/10/22(Sat)07:08:52', 'name': 'Anonymous', 'com': '<a href=""#p177730634"" class=""quotelink"">&gt;&gt;177730634</a><br>hnngh', 'time': 1670674132, 'resto': 177729564}]",1670674132,
29,177734372,12/10/22(Sat)07:07:57,Anonymous,This was dissapointing,lambo-movie-1670273580[1],.jpg,1200,675,250,140,1670674077938426,1670674077,j2vJuNsW6Lhpu5lcFYPAxQ==,60377,0,0,0,this-was-dissapointing,5,0,0,,,,1670674077,
30,177729532,12/10/22(Sat)02:28:55,Anonymous,White Lotus thread <br><br>second season is a significant step down from the first honestly,83BD1797-C459-49B1-98CA-B08E52EB5B6A,.png,420,236,250,140,1670657335516812,1670657335,B/l4kgZIExKLYTEQJo0LxQ==,196285,0,0,0,white-lotus,5,56,10,51.0,8.0,"[{'no': 177733484, 'now': '12/10/22(Sat)06:12:47', 'name': 'Anonymous', 'com': '<a href=""#p177733409"" class=""quotelink"">&gt;&gt;177733409</a><br>No they&#039;ll just break up.', 'time': 1670670767, 'resto': 177729532}, {'no': 177733537, 'now': '12/10/22(Sat)06:16:39', 'name': 'Anonymous', 'com': '<span class=""quote"">&gt;waaaah the rich man that lets me buy whatever I want and lets me live in $50 million mansions for free sucks my cock sometimes waaaah </span><br><br>I have absolutely zero respect for the himbo. He unironically deserves a bullet to the head', 'filename': '642799BC-7A62-4304-A438-F408F449CB4D', 'ext': '.png', 'w': 702, 'h': 733, 'tn_w': 119, 'tn_h': 125, 'tim': 1670670999912318, 'time': 1670670999, 'md5': '/xMIHSCmDfufnnzx45U+Cg==', 'fsize': 134582, 'resto': 177729532}, {'no': 177733988, 'now': '12/10/22(Sat)06:45:31', 'name': 'Anonymous', 'com': 'watch out for those deep holes lads', 'filename': 'deep fucking hole', 'ext': '.png', 'w': 1208, 'h': 928, 'tn_w': 125, 'tn_h': 96, 'tim': 1670672731651912, 'time': 1670672731, 'md5': 'ltwlc4UhH6q+mfWjrAP9uA==', 'fsize': 1633863, 'resto': 177729532}, {'no': 177734294, 'now': '12/10/22(Sat)07:02:31', 'name': 'Anonymous', 'com': '<a href=""#p177733255"" class=""quotelink"">&gt;&gt;177733255</a><br>most gays are very rich', 'time': 1670673751, 'resto': 177729532}, {'no': 177734370, 'now': '12/10/22(Sat)07:07:54', 'name': 'Anonymous', 'com': 'almost every character this season has slept with a prostitute', 'time': 1670674074, 'resto': 177729532}]",1670674074,/white lotus/
31,177720972,12/09/22(Fri)20:27:36,Anonymous,Is he right?,not-including-a-movie-in-your-top-10-woke-v0-vnqrstglex4a1,.png,596,1049,142,250,1670635656515708,1670635656,ipGrE4c1GVbRH+0x8RdQ2A==,184755,0,0,0,is-he-right,5,120,19,115.0,19.0,"[{'no': 177733746, 'now': '12/10/22(Sat)06:31:22', 'name': 'Anonymous', 'com': '<a href=""#p177721115"" class=""quotelink"">&gt;&gt;177721115</a><br><span class=""quote"">&gt;Krager </span><br>Haven’t seen this namefag pedo in a while. Thought he finally ended himself.', 'time': 1670671882, 'resto': 177720972}, {'no': 177734112, 'now': '12/10/22(Sat)06:51:49', 'name': 'Anonymous', 'com': '<a href=""#p177721115"" class=""quotelink"">&gt;&gt;177721115</a><br>I agree, it&#039;s a retarded buzzword that trivializes the problem and forces everything and everyone into a &quot;us vs them&quot; mindset', 'time': 1670673109, 'resto': 177720972}, {'no': 177734300, 'now': '12/10/22(Sat)07:03:19', 'name': 'Anonymous', 'com': '<a href=""#p177721370"" class=""quotelink"">&gt;&gt;177721370</a><br><span class=""quote"">&gt;Northman that low</span><br><span class=""quote"">&gt;Batman that high</span><br><span class=""quote"">&gt;Turning Red that high</span><br>What the fuck is this list', 'time': 1670673799, 'resto': 177720972}, {'no': 177734342, 'now': '12/10/22(Sat)07:05:41', 'name': 'Anonymous', 'com': '<a href=""#p177729785"" class=""quotelink"">&gt;&gt;177729785</a><br>that can&#039;t be real, which movie?', 'time': 1670673941, 'resto': 177720972}, {'no': 177734367, 'now': '12/10/22(Sat)07:07:37', 'name': 'Anonymous', 'com': '<span class=""quote"">&gt;rightards when critics actually watch movies</span><br><span class=""quote"">&gt;NO WHERE IS MY GOY SLOP</span><br><span class=""quote"">&gt;this is the woke agenda</span>', 'time': 1670674057, 'resto': 177720972}]",1670674057,
32,177728206,12/10/22(Sat)01:30:19,Anonymous,"<span class=""quote"">&gt;&quot;just be yourself&quot;</span><br>This idea is a Hollywood invention, isn&#039;t it? People are nicer to attractive people.",Lookism-key-art,.jpg,450,630,178,250,1670653819575667,1670653819,RFgKDyNS0XKx51G+GtRfNA==,136927,0,0,0,just-be-yourself,5,84,10,79.0,10.0,"[{'no': 177734229, 'now': '12/10/22(Sat)06:58:50', 'name': 'Anonymous', 'com': '<a href=""#p177728235"" class=""quotelink"">&gt;&gt;177728235</a><br>Half-truth. Groups of men with shared values is far more important.', 'time': 1670673530, 'resto': 177728206}, {'no': 177734248, 'now': '12/10/22(Sat)06:59:57', 'name': 'Anonymous', 'com': '<a href=""#p177729863"" class=""quotelink"">&gt;&gt;177729863</a><br>A girl called me cute once and I don&#039;t remember what happened next. must&#039;ve expunged it from my memory', 'time': 1670673597, 'resto': 177728206}, {'no': 177734252, 'now': '12/10/22(Sat)07:00:27', 'name': 'Anonymous', 'com': '<a href=""#p177733721"" class=""quotelink"">&gt;&gt;177733721</a><br>Right so there&#039;s nothing bad about troons desperately trying to become a different sex or 50 year olds trying to look like 20 year olds? What kind of illiterate do you have to be to understand &quot;fix the things you can and ignore the things you can&#039;t&quot; as &quot;you can do anything if you work hard.&quot; If I wanted to speak to an ESL I would go to /sp/.', 'time': 1670673627, 'resto': 177728206}, {'no': 177734317, 'now': '12/10/22(Sat)07:04:07', 'name': 'Anonymous', 'com': '<a href=""#p177733898"" class=""quotelink"">&gt;&gt;177733898</a><br>The only thing he did is become popular. Being popular is the only cheat code i&#039;ve actually found to getting very good looking women. And popularity fades fast, so even that is just temporary. 99% of the time you need to have a high paying high status job, be fit and be mentally stable which means most of your life is work one way or other. And working is the greatest fear of incels who grew up on video games and porn.', 'time': 1670673847, 'resto': 177728206}, {'no': 177734364, 'now': '12/10/22(Sat)07:07:32', 'name': 'Anonymous', 'com': '<a href=""#p177733780"" class=""quotelink"">&gt;&gt;177733780</a><br><span class=""quote"">&gt;has nothing to offer</span><br>What does this even matter? What does <a href=""#p177733898"" class=""quotelink"">&gt;&gt;177733898</a> have to offer? In fact what does the modern woman have to offer? Can&#039;t cook or clean and only exists to look pretty.', 'time': 1670674052, 'resto': 177728206}]",1670674052,
33,177733181,12/10/22(Sat)05:50:04,Anonymous,"One thing I don&#039;t understand is how so few influencers get put in shows/films. There&#039;s been several waves of attractive popular egirls on instagram, youtube, and tiktok (and even myspace) and Disney etc ignore them. Not that that&#039;s not for the better but it&#039;s surprising.",6658c1dd62104f1a535f8926c5f38ac7-imagejpeg,.jpg,1080,1350,200,250,1670669404966985,1670669404,D/IaP+H3oc1pOIzItH7ofg==,640627,0,0,0,one-thing-i-dont-understand-is-how-so-few,5,63,14,58.0,13.0,"[{'no': 177734105, 'now': '12/10/22(Sat)06:51:35', 'name': 'Anonymous', 'com': '<a href=""#p177734055"" class=""quotelink"">&gt;&gt;177734055</a><br>I said that it&#039;s better that they DON&#039;T cast them. I&#039;m just surprise they haven&#039;t bothered to capitalize on influencers. You&#039;d think they&#039;d want to exploit all those markets with these highly photo/videogenic girls', 'time': 1670673095, 'resto': 177733181}, {'no': 177734130, 'now': '12/10/22(Sat)06:52:38', 'name': 'Anonymous', 'com': '<a href=""#p177734105"" class=""quotelink"">&gt;&gt;177734105</a><br>But yeah the less people are being exploited and the more Hollywood fucks off, the better. They&#039;re just so exploitative and predatory I&#039;m surprised they haven&#039;t gotten their hands all over this yet', 'time': 1670673158, 'resto': 177733181}, {'no': 177734138, 'now': '12/10/22(Sat)06:53:13', 'name': 'Anonymous', 'com': '<a href=""#p177733733"" class=""quotelink"">&gt;&gt;177733733</a><br>Damn, that&#039;s a real waste. She was that really unpleasant fat girl too, mean fat. One minute she&#039;s the stuff of dreams the next she&#039;s the stuff of fat nightmares. Ugly fat nightmares that erase any idea of beauty.', 'time': 1670673193, 'resto': 177733181}, {'no': 177734333, 'now': '12/10/22(Sat)07:04:57', 'name': 'Anonymous', 'com': '<a href=""#p177733181"" class=""quotelink"">&gt;&gt;177733181</a><br>because hollyywood doesn&#039;t care about making the characters look good, or hiring the best faces, this much is clear, moreover is a nepotistic enviorment, your cosplayer is not selected over the 10 kids of director shelberg, and last thing looks doesn&#039;t equal to acting talent either', 'filename': '1639507831650', 'ext': '.jpg', 'w': 1024, 'h': 576, 'tn_w': 125, 'tn_h': 70, 'tim': 1670673897349635, 'time': 1670673897, 'md5': 'L2Jh2jhuKauXIMskVAFXJw==', 'fsize': 136066, 'resto': 177733181}, {'no': 177734363, 'now': '12/10/22(Sat)07:07:23', 'name': 'Anonymous', 'com': 'Probably after the Fred movie bombed Hollywood concluded that all social media influencers are fads', 'time': 1670674043, 'resto': 177733181}]",1670674043,
34,177716849,12/09/22(Fri)17:52:28,Anonymous,"I would like some Christmas movie recommendations but there are some qualifiers:<br>-Not Hallmark or lifetime movies<br>-Preferably live action but not necessary<br>-I&#039;ve already seen the basics most people have seen: Home Alone, Christmas Story, Christmas Vacation, Grinch. I haven&#039;t seen all the major staples but most of them. Scrooged I haven&#039;t seen but it&#039;s on my list. <br>-Not a horror movie or something highly inappropriate for kids. I love Bad Santa but that&#039;s not what I&#039;m looking for now.",CHRISTMASMOVIE,.jpg,273,198,250,181,1670626348451385,1670626348,ZKChjtZW7kz5vrPs5Mx5oQ==,20606,0,0,0,christmas-movie-recommendations,5,122,34,117.0,31.0,"[{'no': 177733198, 'now': '12/10/22(Sat)05:51:31', 'name': 'Anonymous', 'com': '<a href=""#p177716849"" class=""quotelink"">&gt;&gt;177716849</a><br>Jingle All The Way https://www.youtube.com/watch?v=jWy<wbr>eugspkUA', 'filename': 'jingleallthewayposter', 'ext': '.jpg', 'w': 284, 'h': 475, 'tn_w': 74, 'tn_h': 125, 'tim': 1670669491536310, 'time': 1670669491, 'md5': '8r7iM1D5P+xWXQrQ2RJTQA==', 'fsize': 52539, 'resto': 177716849}, {'no': 177733493, 'now': '12/10/22(Sat)06:13:28', 'name': 'Anonymous', 'filename': 'VIOLENT-NIGHT', 'ext': '.jpg', 'w': 1200, 'h': 627, 'tn_w': 125, 'tn_h': 65, 'tim': 1670670808148136, 'time': 1670670808, 'md5': 'JXG0lRfM+MlvBH0qjnLZSQ==', 'fsize': 64479, 'resto': 177716849}, {'no': 177733734, 'now': '12/10/22(Sat)06:30:33', 'name': 'Anonymous', 'filename': '2E83FF5F-B049-4440-B46C-F47E41C998A7', 'ext': '.jpg', 'w': 854, 'h': 1200, 'tn_w': 88, 'tn_h': 125, 'tim': 1670671833599411, 'time': 1670671833, 'md5': 'rzOAXZsROrOiXlNGPetzMQ==', 'fsize': 248367, 'resto': 177716849}, {'no': 177734025, 'now': '12/10/22(Sat)06:47:25', 'name': 'Anonymous', 'com': 'gg/CTFk3hnsXD', 'time': 1670672845, 'resto': 177716849}, {'no': 177734359, 'now': '12/10/22(Sat)07:06:58', 'name': 'Anonymous', 'com': '<a href=""#p177717881"" class=""quotelink"">&gt;&gt;177717881</a><br>Based take<br><a href=""#p177719537"" class=""quotelink"">&gt;&gt;177719537</a><br><span class=""quote"">&gt;bottom pic, and no &quot;It&#039;s a Wonderful Life&quot;</span><br>fuck you', 'time': 1670674018, 'resto': 177716849}]",1670674018,Christmas movie recommendations
35,177723784,12/09/22(Fri)22:11:48,Anonymous,I guess I&#039;ll just go on home and have a beer.,chris-watts1,.jpg,2000,1333,250,166,1670641908542045,1670641908,HJoCsXc8LnG2+gk4fGM6og==,249841,0,0,0,i-guess-ill-just-go-on-home-and-have-a-beer,5,122,21,117.0,21.0,"[{'no': 177734179, 'now': '12/10/22(Sat)06:55:38', 'name': 'Anonymous', 'com': '<a href=""#p177734067"" class=""quotelink"">&gt;&gt;177734067</a><br>This guy killed his pregnant wife and 2 toddlers and you&#039;re worried about the police playing mind games with him?', 'time': 1670673338, 'resto': 177723784}, {'no': 177734183, 'now': '12/10/22(Sat)06:56:09', 'name': 'Anonymous', 'com': '<a href=""#p177733991"" class=""quotelink"">&gt;&gt;177733991</a><br>The two little fellas look how the brother goes away, then look at the mother, then look at each other, consciousness was a mistake.', 'time': 1670673369, 'resto': 177723784}, {'no': 177734197, 'now': '12/10/22(Sat)06:56:56', 'name': 'Anonymous', 'com': '<a href=""#p177734179"" class=""quotelink"">&gt;&gt;177734179</a><br><span class=""quote"">&gt;this guy hecking murdered his family and you&#039;re worried about the police dropping a nuclear bomb on his neighborhood just to kill him?</span><br>retard', 'time': 1670673416, 'resto': 177723784}, {'no': 177734237, 'now': '12/10/22(Sat)06:59:15', 'name': 'Anonymous', 'com': '<a href=""#p177734197"" class=""quotelink"">&gt;&gt;177734197</a><br>What? Schizo', 'time': 1670673555, 'resto': 177723784}, {'no': 177734358, 'now': '12/10/22(Sat)07:06:57', 'name': 'Anonymous', 'com': '<a href=""#p177723784"" class=""quotelink"">&gt;&gt;177723784</a><br>Prison is very hard on people who hurt kids. If you get the opportunity you should kill yourself.', 'time': 1670674017, 'resto': 177723784}]",1670674017,
36,177733285,12/10/22(Sat)05:57:30,Anonymous,,1662857571396343,.webm,1700,1040,250,152,1670669850922156,1670669850,2pvwmMqK53X/WyASzm0CKQ==,3144938,0,0,0,wednesday-addams-shes-just-like-me,5,16,0,11.0,0.0,"[{'no': 177734255, 'now': '12/10/22(Sat)07:00:32', 'name': 'Anonymous', 'com': '<a href=""#p177734172"" class=""quotelink"">&gt;&gt;177734172</a><br>nope', 'time': 1670673632, 'resto': 177733285}, {'no': 177734283, 'now': '12/10/22(Sat)07:01:52', 'name': 'Anonymous', 'com': '<a href=""#p177734255"" class=""quotelink"">&gt;&gt;177734255</a><br>she hates wypipo so it doesn&#039;t even matter', 'time': 1670673712, 'resto': 177733285}, {'no': 177734307, 'now': '12/10/22(Sat)07:03:42', 'name': 'Anonymous', 'com': '<a href=""#p177733285"" class=""quotelink"">&gt;&gt;177733285</a><br>Is that Big Dick Blaque?<br><br>https://www.youtube.com/watch?v=Toj<wbr>8nkaPdtA', 'time': 1670673822, 'resto': 177733285}, {'no': 177734339, 'now': '12/10/22(Sat)07:05:31', 'name': 'Anonymous', 'com': '<a href=""#p177734283"" class=""quotelink"">&gt;&gt;177734283</a><br>Proof?', 'time': 1670673931, 'resto': 177733285}, {'no': 177734355, 'now': '12/10/22(Sat)07:06:46', 'name': 'Anonymous', 'com': '<a href=""#p177733308"" class=""quotelink"">&gt;&gt;177733308</a><br>not OP but I wish I were', 'time': 1670674006, 'resto': 177733285}]",1670674006,"Wednesday Addams, she’s just like me"
37,177730070,12/10/22(Sat)02:54:48,Anonymous,This is Trevor,steven-ogg-1,.jpg,900,750,250,208,1670658888914895,1670658888,ldiFLGJ12Nw5g135tapPLg==,72231,0,0,0,this-is-trevor,5,32,3,27.0,3.0,"[{'no': 177734135, 'now': '12/10/22(Sat)06:52:53', 'name': 'Anonymous', 'com': '<a href=""#p177730070"" class=""quotelink"">&gt;&gt;177730070</a><br><span class=""quote"">&gt;GTA VI&#039;s version of Trevor is a Latina</span><br>fucking hell', 'time': 1670673173, 'resto': 177730070}, {'no': 177734139, 'now': '12/10/22(Sat)06:53:14', 'name': 'Anonymous', 'com': '<a href=""#p177733893"" class=""quotelink"">&gt;&gt;177733893</a><br>The Chad Cazale', 'time': 1670673194, 'resto': 177730070}, {'no': 177734219, 'now': '12/10/22(Sat)06:58:22', 'name': 'Anonymous', 'com': '<a href=""#p177733893"" class=""quotelink"">&gt;&gt;177733893</a><br>the racism', 'time': 1670673502, 'resto': 177730070}, {'no': 177734318, 'now': '12/10/22(Sat)07:04:08', 'name': 'Anonymous', 'com': '<a href=""#p177733928"" class=""quotelink"">&gt;&gt;177733928</a><br>/fit/ isn&#039;t gay! It&#039;s deeply closeted.', 'time': 1670673848, 'resto': 177730070}, {'no': 177734354, 'now': '12/10/22(Sat)07:06:28', 'name': 'Anonymous', 'com': '<a href=""#p177730183"" class=""quotelink"">&gt;&gt;177730183</a><br><span class=""quote"">&gt;Didn&#039;t drift into stand up</span><br><span class=""quote"">&gt;Didn&#039;t shill his ass in social media and podcasts</span><br>Fucking idiots these old school Hollywood types, old school is dead, make your own movies', 'time': 1670673988, 'resto': 177730070}]",1670673988,
