,no,sticky,closed,now,name,com,time,resto,filedeleted,semantic_url,replies,images,last_replies,last_modified,sub,filename,ext,w,h,tn_w,tn_h,tim,md5,fsize,capcode,m_img,bumplimit,imagelimit,omitted_posts,omitted_images,trip
35,7003700,,,11/20/22(Sun)04:29:55,Anonymous,"Anything goes except:<br>-Discussions about IRL cuckolding / Larping. This thread is only intended for 2D netorase.<br>-Straight NTR or NTS --&gt; NTR. NTS with NTR elements is okay as long as it stays NTS.<br><br>NTS works/illustrations:<br>- https://koushoku.org/tags/netorase<br>- https://nana.my.id/?q=%2B%22netoras<wbr>e%22+&amp;sort=desc<br>- https://exhentai.org/?f_search=fema<wbr>le%3Anetorare%24+female%3Aswinging%<wbr>24<br>- https://e-hentai.org/?f_search=fema<wbr>le%3Anetorare%24+female%3Aswinging%<wbr>24<br>- https://www.pixiv.net/en/tags/%E5%A<wbr>F%9D%E5%8F%96%E3%82%89%E3%81%9B<br><br>Popular NTS artists:<br>- Oosawara Sadao (Pure/Vanilla NTS)<br>- NT00 (Pure/Vanilla NTS)<br>- Jigoku no Nyanko (Voyeuristic NTS) <br>- NTR no Tami (has good/bad endings)<br>- NTRobo (borderline NTR sometimes be cautious)<br>- EnaRi (SPH NTS)<br>- Terasu (some great NTS stuff)<br>- Eightman (some NTS with amazing art)<br>- Tsuzura Kuzukago (normal+incest NTS)<br>- Yuuhoku (1 amazing NTS work)<br><br>NTS games:<br>- Marina 1 and 2<br>- Gyaruzuma~ Loving Wife Who Obscenely Serves Another Man<br>- Gal Kano!! ~Selfish Body and Uninhibited Girlfriend~ <br>- Boku ni Dakare Aegu Tsuma wa<br>- Lovey Cuckoldry Play with an Understanding Wife (RJ331787)<br>- The Ruins of Luxoria<br>- Knightess Whore<br>- Girlfriend tapes (only play for Riley, NTS content starts in next update)<br>- Nymphomania Priestess<br>- An Obedient Childhood Friend Is Easily Cucked<br>- Natsuki Minazuki Is On Loan!<br>- Minazuki natsuki - Hot Spring Bus Tour<br>- Lendable Wife - Mayumi&#039;s Cuckolding Report (Contains NTR)<br><br>More NTS games: https://f95zone.to/threads/complete<wbr>-netorase-sharing-games-master-list<wbr>.90458/ (ignore ratings)<br><br><br>Previous Thread <span class=""deadlink"">&gt;&gt;6960053</span><br><br>OP Source: 359819",1668936595,0,,netorase-nts-thread-8,238,83,"[{'no': 7040417, 'now': '12/11/22(Sun)20:28:02', 'name': 'Anonymous', 'com': '<a href=""#p7040085"" class=""quotelink"">&gt;&gt;7040085</a><br>sauce brother?', 'time': 1670808482, 'resto': 7003700}, {'no': 7040462, 'now': '12/11/22(Sun)20:49:40', 'name': 'Anonymous', 'com': '<a href=""#p7040201"" class=""quotelink"">&gt;&gt;7040201</a><br>The comment sections of the three sites paying fans looks like 60 40 pro NTR to me . And one of the updates mentioned post January releases so if he’s influenced at all by his fans especially the loudest ones then it’s not looking good.', 'time': 1670809780, 'resto': 7003700}, {'no': 7040590, 'now': '12/11/22(Sun)21:52:34', 'name': 'Anonymous', 'com': '<a href=""#p7040462"" class=""quotelink"">&gt;&gt;7040462</a><br>Well then let&#039;s hope he sticks to what he&#039;s said before about their relationship not changing. I&#039;ve already accepted the possibility of Yumi having raw sex with Jin (with creampie), but just don&#039;t make it straight up NTR. He already has &quot;delusion&quot; and &quot;if&quot; scenes for fans of NTR, no need to make it canon.', 'time': 1670813554, 'resto': 7003700}, {'no': 7040881, 'now': '12/12/22(Mon)00:42:01', 'name': 'Anonymous', 'com': '<a href=""#p7040462"" class=""quotelink"">&gt;&gt;7040462</a><br>If I was him I would just make both endings, maybe with a choice that determines which one happens', 'time': 1670823721, 'resto': 7003700}, {'no': 7040961, 'now': '12/12/22(Mon)01:39:58', 'name': 'Anonymous', 'com': '<a href=""#p7040881"" class=""quotelink"">&gt;&gt;7040881</a><br>With a choice like that NTRniggers will flood the author begging for NTR.', 'time': 1670827198, 'resto': 7003700}]",1670827198,Netorase / NTS / 寝取らせ - Thread #8,7,.jpg,1280.0,1807.0,177.0,250.0,1668936595994924.0,kaXhOgdADJwXzYC4iR+9Zg==,410208.0,,1.0,0.0,0.0,233.0,83.0,
36,7037378,,,12/10/22(Sat)04:52:41,Anonymous,Anyone pissed that the Midori Rooftop Blowjob scene never made it the US BD?,1670665961,0,,kanojo-x-kanojo-x-kanojo-thread,15,4,"[{'no': 7037890, 'now': '12/10/22(Sat)13:47:18', 'name': 'Anonymous', 'com': '<a href=""#p7037835"" class=""quotelink"">&gt;&gt;7037835</a><br>Akina&#039;s definitely kinda unappreciated desu.', 'time': 1670698038, 'resto': 7037378}, {'no': 7038183, 'now': '12/10/22(Sat)18:08:58', 'name': 'Anonymous', 'com': 'I love Mafuyu', 'filename': '1577206211197', 'ext': '.jpg', 'w': 1920, 'h': 1080, 'tn_w': 125, 'tn_h': 70, 'tim': 1670713738357211, 'time': 1670713738, 'md5': '0DnTzZhLy7j6WzHbCEYoBg==', 'fsize': 2231943, 'resto': 7037378, 'm_img': 1}, {'no': 7038518, 'now': '12/10/22(Sat)21:32:43', 'name': 'Anonymous', 'com': '<a href=""#p7037835"" class=""quotelink"">&gt;&gt;7037835</a><br>Dead link', 'time': 1670725963, 'resto': 7037378}, {'no': 7038524, 'now': '12/10/22(Sat)21:35:57', 'name': 'Anonymous', 'com': '<a href=""#p7038518"" class=""quotelink"">&gt;&gt;7038518</a><br>put a . between ecchi and iwara. Otherwise, Iwara links trip 4chans spam filter', 'time': 1670726157, 'resto': 7037378}, {'no': 7040960, 'now': '12/12/22(Mon)01:38:13', 'name': 'Anonymous', 'com': '<a href=""#p7037378"" class=""quotelink"">&gt;&gt;7037378</a><br><br>How come I have seen an uncensored version of that Midori blowjob scene? It&#039;s in the hour long compiled version I think', 'time': 1670827093, 'resto': 7037378}]",1670827093,Kanojo x Kanojo x Kanojo Thread,ee88be372100325d61f974454a62f14e,.gif,757.0,1024.0,184.0,250.0,1670665961050550.0,nb/7orSLFDlokTyJQ3Poaw==,3769653.0,,,0.0,0.0,10.0,3.0,
37,6864463,,,09/30/22(Fri)01:18:28,Anonymous,"Warning: Thrust level at MAXIMUM<br><br>Previous Thread <span class=""deadlink"">&gt;&gt;6737324</span><br><br>A thread for all Vtubers, Vsingers also welcome.",1664515108,0,,virtual-youtubers-vtubers,298,285,"[{'no': 7037242, 'now': '12/10/22(Sat)02:33:30', 'name': 'Anonymous', 'filename': 'Chloe_Sakamata-Hololive', 'ext': '.png', 'w': 1846, 'h': 2308, 'tn_w': 99, 'tn_h': 125, 'tim': 1670657610094054, 'time': 1670657610, 'md5': 'Qsb3XQLIQ3BeZqA5Tk9OvQ==', 'fsize': 2948533, 'resto': 6864463, 'm_img': 1}, {'no': 7038928, 'now': '12/11/22(Sun)01:43:47', 'name': 'Anonymous', 'filename': 'FjW2cGkaEAAdN74', 'ext': '.jpg', 'w': 2480, 'h': 3508, 'tn_w': 88, 'tn_h': 125, 'tim': 1670741027462895, 'time': 1670741027, 'md5': 'sKvD0dDzq3bO14TOIc6cLg==', 'fsize': 1023195, 'resto': 6864463, 'm_img': 1}, {'no': 7039890, 'now': '12/11/22(Sun)15:05:10', 'name': 'Anonymous', 'filename': 'peterchuu', 'ext': '.png', 'w': 1071, 'h': 1417, 'tn_w': 94, 'tn_h': 125, 'tim': 1670789110252438, 'time': 1670789110, 'md5': 'bU5nspdTBbENQaSq1DRsAA==', 'fsize': 1214032, 'resto': 6864463, 'm_img': 1}, {'no': 7040947, 'now': '12/12/22(Mon)01:22:06', 'name': 'Anonymous', 'filename': 'yukihana_lamy-hololive(ichi-go)', 'ext': '.png', 'w': 1451, 'h': 2048, 'tn_w': 88, 'tn_h': 125, 'tim': 1670826126091681, 'time': 1670826126, 'md5': 'NEcNCV9AkJKsAyA8iT8Lbg==', 'fsize': 3368447, 'resto': 6864463, 'm_img': 1}, {'no': 7040948, 'now': '12/12/22(Mon)01:25:17', 'name': 'Anonymous', 'com': '<a href=""#p6864463"" class=""quotelink"">&gt;&gt;6864463</a>', 'time': 1670826317, 'resto': 6864463}]",1670826317,Virtual Youtubers - Vtubers,kaneko_lumi(hikoukeiro),.jpg,3541.0,2508.0,250.0,177.0,1664515108376066.0,idiq9Z3HPCwUSqSNrPDY3w==,747910.0,,1.0,0.0,0.0,293.0,281.0,
38,6975459,,,11/06/22(Sun)16:24:16,Anonymous,"Nineteenth edition<br><br>Previous Thread: <span class=""deadlink"">&gt;&gt;6865916</span><br><br>2D Hentai games (Hentai RPG, Violated Heroine, H-Action Games) General /hgg2d/ former /vhg/<br><br>UNLESS EXPLICITLY STATED ASSUME THERE&#039;S NO TRANSLATION AND PLEASE READ THE PASTEBINS BEFORE ASKING QUESTIONS<br><br><span class=""quote"">&gt;NEWCOMERS GUIDE: (PLEASE READ BEFORE POSTING)</span><br>https://bafybeie4sdjrv5hw2ujd5c4dd5<wbr>42eduh2ilhbtnn3puyr2efpnvn4utiqe.ip<wbr>fs.dweb.link/NEWCOMERS%20GUIDE.txt<br><br>UPDATE YOUR ARCHIVER BEFORE COMPLAINING ABOUT CORRUPT DOWNLOADS<br><br><span class=""quote"">&gt;/hgg2d/ Game Archive - IPFS Edition</span><br>https://k51qzi5uqu5dk8jpgw2ga3qoit4<wbr>k9ocb328w8mxqlnw36k4m8ebt43ngmonioc<wbr>.ipns.dweb.link/bin.html<br>https://bafybeif3iffn6g2m2clvhr7ywq<wbr>h4o7nvtjife2ry5s3azyvxplkftgnbem.ip<wbr>fs.dweb.link/bin.html<br><br><br>RPGMAKER:<br><span class=""quote"">&gt;IF YOU&#039;RE PLANNING TO PLAY RPGMAKER GAMES, MAKE SURE YOU HAVE THE RIGHT RTP FOR THEM</span><br>https://tkool.jp/products/rtp.html<br><br><span class=""quote"">&gt;HOW TO PLAY THESE GAMES ON LINUX</span><br>https://pastebin.com/21Yi6vnt<br><span class=""quote"">&gt;RGSS DECRYPTER FOR APPLYING PATCHES</span><br>https://www50.zippyshare.com/v/17MC<wbr>S5Bb/file.html<br><span class=""quote"">&gt;If this can&#039;t extract some files then try:</span><br>https://github.com/usagirei/RGSS-De<wbr>cryptor<br>https://bitbucket.org/SilicaAndPina<wbr>/rpgmv-decryptor/src/master/<br><br><br>MACHINE TRANSLATION<br><span class=""quote"">&gt;Nifty translation tool by Anon:</span><br>https://www.mediafire.com/file/ov74<wbr>ltf4cgpji59/japReader-1.2.zip/file<br><br>DLSITE<br><span class=""quote"">&gt;RJ CODE QUICKLINK SCRIPT</span><br>https://hgg2d.github.io<br><br><span class=""quote"">&gt;RJ Gallery SCRIPT</span><br>https://ipfs.io/ipfs/QmX2wWMed1oD5R<wbr>ntcTqBFXCDGX4mGgNKfj1v6pHQtEB62K/DL<wbr>%20Site%20Previewer.html<br><br>VH Specific<br><span class=""quote"">&gt;Japanese download links</span><br>https://arch.b4k.co/vg/thread/36727<wbr>2936/#q367276374<br><br>Installation: https://wiki.anime-sharing.com/hgam<wbr>es/index.php?title=VH<br>FAQ: https://ghostbin.com/paste/jQpDI (Use on archive.org)<br><br><br>Take all discussion of VNs to <a href=""//boards.4channel.org/vg/catalog#s=vn%2F"" class=""quotelink"">&gt;&gt;&gt;/vg/vn/</a> or <a href=""//boards.4channel.org/vg/catalog#s=vng%2F"" class=""quotelink"">&gt;&gt;&gt;/vg/vng/</a><br>Take all discussion of non Japanese games to <a href=""//boards.4chan.org/aco/catalog#s=weg%2F"" class=""quotelink"">&gt;&gt;&gt;/aco/weg/</a> or <a href=""//boards.4chan.org/aco/catalog#s=weg2d%2F"" class=""quotelink"">&gt;&gt;&gt;/aco/weg2d/</a><br>Take all discussion of 3D games to <a href=""//boards.4chan.org/h/catalog#s=hgg%2F"" class=""quotelink"">&gt;&gt;&gt;/h/hgg/</a><br><br>Please wait for page 10 before making a new thread.",1667769856,0,,2d-hentai-games-general-hgg2d,267,43,"[{'no': 7039352, 'now': '12/11/22(Sun)08:27:26', 'name': 'Anonymous', 'com': 'https://voca.ro/12zBT3QWjNXM', 'filename': 'RJ000069', 'ext': '.jpg', 'w': 1280, 'h': 751, 'tn_w': 125, 'tn_h': 73, 'tim': 1670765246138529, 'time': 1670765246, 'md5': 'fReDjGysrT20CRSnD4ziWw==', 'fsize': 131222, 'resto': 6975459, 'm_img': 1}, {'no': 7039406, 'now': '12/11/22(Sun)09:35:32', 'name': 'Anonymous', 'com': '<a href=""#p7039026"" class=""quotelink"">&gt;&gt;7039026</a><br>based homeless man making sure he&#039;s represented', 'time': 1670769332, 'resto': 6975459}, {'no': 7039450, 'now': '12/11/22(Sun)10:19:52', 'name': 'Anonymous', 'com': '<a href=""#p7039352"" class=""quotelink"">&gt;&gt;7039352</a><br>Well, I&#039;m stumped. Actual RJ?', 'time': 1670771992, 'resto': 6975459}, {'no': 7040214, 'now': '12/11/22(Sun)18:49:22', 'name': 'Anonymous', 'com': '<a href=""#p7020497"" class=""quotelink"">&gt;&gt;7020497</a><br>Good game, I binged pretty hard.<br>I was wondering if there was any type of game like Stardew valley where milking would be a commodity. There has to be a decent moster girl farm sim somewhere.', 'time': 1670802562, 'resto': 6975459}, {'no': 7040929, 'now': '12/12/22(Mon)01:13:35', 'name': 'Anonymous', 'com': 'any recommendations similar to That Time I Got Reincarnated as an Orc? I really liked the writing and pacing of porn to gameplay', 'time': 1670825615, 'resto': 6975459}]",1670825615,2D Hentai Games General /hgg2d/,RJ385873,.png,560.0,420.0,250.0,187.0,1667769856925427.0,G0i2HNDo990Rsw9HtmXG9g==,401859.0,,,0.0,0.0,262.0,42.0,
39,7008446,,,11/23/22(Wed)06:31:29,Anonymous,"Previous:<br><br><span class=""deadlink"">&gt;&gt;6996214</span><br><br>Straight, explicit sexual content oriented for a female audience, typically made by women.<br><br><span class=""quote"">&gt;the male must be attractive</span><br><span class=""quote"">&gt;the picture must be focused on the male</span><br><span class=""quote"">&gt;the female must be present in the picture and have sexual contact with the male</span><br><span class=""quote"">&gt;the female may or may not be attractive as well, or a faceless girl self-insert</span><br><span class=""quote"">&gt;she may also be the focus, but preferably not more than the male</span><br><span class=""quote"">&gt;unexaggerated proportions are preferable</span><br><span class=""quote"">&gt;content of Asian origin and anime/manga artstyle, western art goes here: </span><a href=""//boards.4chan.org/aco/catalog#s=femporn"" class=""quotelink"">&gt;&gt;&gt;/aco/femporn</a><br><br>No yuri, no yaoi, no faceless dudes, no shota, no loli, no derailing thread. Thank you.<br>Tip: Before you ask for the source an image use reverse image search sites such as iqdb.org trace.moe or sauceNAO.com to find what you need. Don&#039;t post solo male pictures even if it&#039;s meant to be straight, since those are considered /y/ content in this site and could get easily deleted.<br>Don&#039;t post /c/ or /cm/ content either (anything that&#039;s not porn).<br><br>Femporn Reclist v.2<br><span class=""quote"">&gt;https://controlc.com/412528f0</span><br><br>List of Archived Threads<br><span class=""quote"">&gt;http://controlc.com/4213ee72</span><br><br>Related femporn genres and Japanese terms are:<br><span class=""quote"">&gt;女性漫画, 女性向け(Josei manga, Josei-muke/for women) *might also include BL</span><br><span class=""quote"">&gt;レディースコミックス / レディコミ (Ladies&#039; comics / lady-comi)</span><br><span class=""quote"">&gt;シチュエーションCD (Situation CD)</span><br><span class=""quote"">&gt;乙女向け, 乙女ゲーム (Otome-muke/for maidens, Otome game)</span><br><span class=""quote"">&gt;夢向け (Yume-muke/for yumejoshi) *try adding 夢 to series name on Pixiv for yumejo results</span><br><span class=""quote"">&gt;ティーンズラブ / TL (Teens&#039; Love)</span>",1669203089,0,,fempornyumejoshi-general-43,309,204,"[{'no': 7040945, 'now': '12/12/22(Mon)01:21:30', 'name': 'Anonymous', 'com': '<a href=""#p7040937"" class=""quotelink"">&gt;&gt;7040937</a>', 'filename': '100021960_p0', 'ext': '.jpg', 'w': 1711, 'h': 2294, 'tn_w': 93, 'tn_h': 125, 'tim': 1670826090704187, 'time': 1670826090, 'md5': 'ysmw3vrXeZKCuPlad/AKYA==', 'fsize': 699014, 'resto': 7008446, 'm_img': 1}, {'no': 7040946, 'now': '12/12/22(Mon)01:22:04', 'name': 'Anonymous', 'com': '<a href=""#p7040945"" class=""quotelink"">&gt;&gt;7040945</a>', 'filename': '103269410_p1', 'ext': '.png', 'w': 2181, 'h': 2991, 'tn_w': 91, 'tn_h': 125, 'tim': 1670826124093545, 'time': 1670826124, 'md5': 'YjUKe2EeQSibj74zUe+7Yg==', 'fsize': 831156, 'resto': 7008446, 'm_img': 1}, {'no': 7041065, 'now': '12/12/22(Mon)03:24:11', 'name': 'Anonymous', 'filename': '45', 'ext': '.jpg', 'w': 1280, 'h': 1804, 'tn_w': 88, 'tn_h': 125, 'tim': 1670833451211926, 'time': 1670833451, 'md5': 'm48RlS5VEQZDkLkAJJECNw==', 'fsize': 646693, 'resto': 7008446, 'm_img': 1}, {'no': 7041179, 'now': '12/12/22(Mon)04:52:34', 'name': 'Anonymous', 'filename': '__lumine_and_albedo_genshin_impact_drawn_by_ia_ias1010__sample-8d454619f1f932fcec259ab51219715d', 'ext': '.jpg', 'w': 850, 'h': 1200, 'tn_w': 88, 'tn_h': 125, 'tim': 1670838754593167, 'time': 1670838754, 'md5': 'Q50rb41I1gFEiJiNcTBKZg==', 'fsize': 107060, 'resto': 7008446, 'm_img': 1}, {'no': 7041343, 'now': '12/12/22(Mon)06:15:23', 'name': 'Anonymous', 'com': '<a href=""#p7040717"" class=""quotelink"">&gt;&gt;7040717</a><br><a href=""#p7040711"" class=""quotelink"">&gt;&gt;7040711</a><br><a href=""#p7040702"" class=""quotelink"">&gt;&gt;7040702</a><br><a href=""#p7040709"" class=""quotelink"">&gt;&gt;7040709</a><br>Why is he so good, ugh', 'time': 1670843723, 'resto': 7008446}]",1670843723,Femporn/Yumejoshi general #43,77267300_p0,.png,1100.0,1269.0,216.0,250.0,1669203089214080.0,oUQHN08MQxP/YyhKXRoutg==,1280460.0,,1.0,1.0,0.0,304.0,200.0,
40,7021103,,,11/30/22(Wed)12:58:56,Anonymous,slutty is the new pure,1669831136,0,,gyaru-thread,66,64,"[{'no': 7040917, 'now': '12/12/22(Mon)01:09:15', 'name': 'Anonymous', 'filename': '_p1 - 바바리아나 보련', 'ext': '.jpg', 'w': 1200, 'h': 1555, 'tn_w': 96, 'tn_h': 125, 'tim': 1670825355177506, 'time': 1670825355, 'md5': '+2UL74TSE0wf6Mn9MMCXSw==', 'fsize': 712214, 'resto': 7021103, 'm_img': 1}, {'no': 7040919, 'now': '12/12/22(Mon)01:09:47', 'name': 'Anonymous', 'filename': '_p1 - 박는 바바리아나', 'ext': '.jpg', 'w': 1200, 'h': 916, 'tn_w': 125, 'tn_h': 95, 'tim': 1670825387280136, 'time': 1670825387, 'md5': 'y2d3+gKN8+HjVOl12+/Tww==', 'fsize': 466417, 'resto': 7021103, 'm_img': 1}, {'no': 7040921, 'now': '12/12/22(Mon)01:10:18', 'name': 'Anonymous', 'filename': 'Saki01', 'ext': '.jpg', 'w': 1200, 'h': 1646, 'tn_w': 91, 'tn_h': 125, 'tim': 1670825418202986, 'time': 1670825418, 'md5': 'hnQMaMQRZW8dOPzkbf34sQ==', 'fsize': 350012, 'resto': 7021103, 'm_img': 1}, {'no': 7040922, 'now': '12/12/22(Mon)01:10:49', 'name': 'Anonymous', 'filename': 'Saki02Fuck01', 'ext': '.jpg', 'w': 1200, 'h': 1646, 'tn_w': 91, 'tn_h': 125, 'tim': 1670825449526655, 'time': 1670825449, 'md5': 'C5QNLSGOw4t38VECH571XA==', 'fsize': 474933, 'resto': 7021103, 'm_img': 1}, {'no': 7040923, 'now': '12/12/22(Mon)01:11:22', 'name': 'Anonymous', 'filename': 'Saki02Fuck02', 'ext': '.jpg', 'w': 1200, 'h': 1646, 'tn_w': 91, 'tn_h': 125, 'tim': 1670825482569278, 'time': 1670825482, 'md5': 'mfRYzaCluna6jw7R352ASw==', 'fsize': 486597, 'resto': 7021103, 'm_img': 1}]",1670825482,gyaru thread,ezgif-3-2acc04beff,.jpg,1433.0,2000.0,179.0,250.0,1669831136100003.0,sozOT6p1N6vRDhv1uNgBlw==,508229.0,,1.0,0.0,0.0,61.0,59.0,
41,6995551,,,11/15/22(Tue)19:45:22,Anonymous,"milk factory edition<br><br>Previous thread: <span class=""deadlink"">&gt;&gt;6825843</span><br><br>- [COM3D2] -<br><br>Comprehensive COM3D2 Pastebin: https://pastebin.com/n6Uhi5zQ<br><br>Custom Maid Ultimate - Summer 2020 Edition (CM3D2 + COM3D2 + all DLC up to 20/07/03): https://sukebei.nyaa.si/view/306339<wbr>7<br>Custom Maid Ultimate Master Guide: https://pastebin.com/1SFajwy5<br>Custom Order Maid 3D2 English Vanilla Repack: https://pastebin.com/1nhpdNML<br>COM Modular Installer [CMI]: https://github.com/krypto5863/COM-M<wbr>odular-Installer/releases<br><br>-Official English version-<br><br>KISS: https://dl-en.s-court.me/top.php<br>Nutaku: https://www.nutaku.net/promo/custom<wbr>-order-maid-3d2/<br>Steam: store.steampowered.com/app/1097580/<wbr>CUSTOM_ORDER_MAID_3D2_Its_a_Night_M<wbr>agic/<br><br>- [CM3D2] -<br><br>DO NOT use Hongfire Patch, Reipatcher, or NTleas, they&#039;re old and can break the game. Use LMMT and change to Japanese locale.<br><br>Comprehensive CM3D2 Pastebin: http://pastebin.com/qZQGcmxX<br>Brief Installation Guide for Custom Maid 3D 2 (Updated 7/31/2017)<br>https://pastebin.com/iHesxsJu<br>A recently made installation guide:<br>https://docs.google.com/document/d/<wbr>1MzdxcmEDcsi0SWeNyqG4uOaF5z_l37SR_b<wbr>jrrrqxSXU<br>How to Play/English Wiki<br>http://wiki.anime-sharing.com/hgame<wbr>s/index.php?title=Custom_Maid_3D_2<br>Legacy Meidos Modular Toolbox [LMMT]: https://github.com/krypto5863/Legac<wbr>y-Meido-s-Modular-Toolbox/releases<br><br>Latest mod releases:<br>https://twitter.com/search?f=tweets<wbr>&amp;vertical=default&amp;q=ux.getuploader.<wbr>com%20cm3d2%20OR%20com3d2&amp;src=typd<br>http://motimoti3d.jp/<br>International List of Mods (slow&amp;outdated):<br>https://docs.google.com/spreadsheet<wbr>s/d/1MBhoJCRMZ8cb5j9tTUIKjMXp_PGnnW<wbr>DsMj8E5mVVHIQ/<br><br>English Fansite with CM/COM news, discord and such:<br>http://custommaid3d2.com/",1668559522,0,,custom-maid-general-cmg,85,42,"[{'no': 7040497, 'now': '12/11/22(Sun)21:01:06', 'name': 'Anonymous', 'com': '-- [COM3D2 Shop] [Adult Enhancement Pack] [BLACKED] [Add-on Vol.1]: https://mega.nz/file/UPEl3TQb#sDtRP<wbr>4_Ovqli5bXNw-M2xAp_hk_AOyjTgnSBWcuQ<wbr>2bQ', 'filename': 'img20220626200816', 'ext': '.jpg', 'w': 3840, 'h': 2160, 'tn_w': 125, 'tn_h': 70, 'tim': 1670810466741920, 'time': 1670810466, 'md5': 'pThmtXPvEVe22y7Yx+eoYA==', 'fsize': 808575, 'resto': 6995551, 'm_img': 1}, {'no': 7040838, 'now': '12/12/22(Mon)00:03:06', 'name': 'Anonymous', 'com': '*UNNY! *UNNY! *UNNY! *UNNY! I LOVE *UNNY!<br><a href=""#p7039346"" class=""quotelink"">&gt;&gt;7039346</a><br>2nd from left of course.<br><a href=""#p7040497"" class=""quotelink"">&gt;&gt;7040497</a><br><span class=""quote"">&gt;[BLACKED]</span><br>ONEE CHAN MEIDO SURE TAKES IT DAILY!', 'filename': 'img20221211210342', 'ext': '.png', 'w': 1920, 'h': 1017, 'tn_w': 125, 'tn_h': 66, 'tim': 1670821386416459, 'time': 1670821386, 'md5': 'UnsqoG/rfbEN2DYeNUpy3w==', 'fsize': 2639433, 'resto': 6995551, 'm_img': 1}, {'no': 7040857, 'now': '12/12/22(Mon)00:21:07', 'name': 'Anonymous', 'com': '<a href=""#p7040377"" class=""quotelink"">&gt;&gt;7040377</a><br>someone has in the discord', 'time': 1670822467, 'resto': 6995551}, {'no': 7040863, 'now': '12/12/22(Mon)00:24:25', 'name': 'Anonymous', 'com': '<a href=""#p7039346"" class=""quotelink"">&gt;&gt;7039346</a><br>4 and 6', 'time': 1670822665, 'resto': 6995551}, {'no': 7040916, 'now': '12/12/22(Mon)01:07:53', 'name': 'Anonymous', 'com': '<span class=""quote"">&gt;been trying to get the translated script to work for the past couple of days</span><br><span class=""quote"">&gt;turns out my retarded ass didn&#039;t turn on English dialogue option in the configuration menu</span>', 'filename': 'img20221211225127', 'ext': '.png', 'w': 1920, 'h': 1080, 'tn_w': 125, 'tn_h': 70, 'tim': 1670825273746235, 'time': 1670825273, 'md5': 'jXhXtwGqdg6T9YKcMVoerg==', 'fsize': 3088132, 'resto': 6995551, 'm_img': 1}]",1670825273,Custom Maid General /cmg/,img20221106204352,.png,1920.0,1080.0,250.0,140.0,1668559522887029.0,FqFOeg3zq5/dtVN0NDjSUg==,3269622.0,,1.0,0.0,0.0,80.0,39.0,
