,no,sticky,closed,now,name,com,time,resto,filedeleted,semantic_url,replies,images,last_replies,last_modified,sub,filename,ext,w,h,tn_w,tn_h,tim,md5,fsize,capcode,m_img,bumplimit,imagelimit,omitted_posts,omitted_images,trip
0,3743858,1.0,1.0,06/04/14(Wed)03:26:40,Anonymous,"More of her? <br><br><strong style=""color: red;"">(USER WAS BANNED FOR THIS POST)</strong>",1401866800,0,1.0,more-of-her,1,0,"[{'no': 3744002, 'now': '06/04/14(Wed)13:34:29', 'name': 'Anonymous', 'com': 'Remember: All request threads belong on /r/.', 'time': 1401903269, 'resto': 3743858, 'capcode': 'mod'}]",1401903278,,,,,,,,,,,,,,,,,
1,4551312,1.0,1.0,02/24/17(Fri)11:06:08,Anonymous,"1) When posting something include the artist and character/show name. If it&#039;s part of a doujinshi or manga then give the name of that as well.<br>2) No loli or furry shit.<br>3) Ecchi, Yuri, and Yaoi Belong on their own boards. (/e/, /u/, and /y/)<br>4) All images must be of Japanese/&quot;Eastern&quot; origin and style. Images of &quot;Western&quot; origin and style will be removed.<br>5) If you want to make a request then take it to /r/. This board is for people who wish to contribute. If /r/ does not fill your request it is still not okay to post it here. If you contribute a decent amount of board-related material then feel free to request, but not before. <br>5.1) &quot;itt [ass/bj/whatever] thread&quot; and only posting one image is a request.<br><br>Every global rule applies as well.",1487952368,0,,rules-of-this-board-in-plain-english,0,0,,1487952376,Rules of this board (in plain english),h,.png,600.0,600.0,250.0,250.0,1487952368095.0,jYtK90ubNgitFwA4PXOFNw==,32989.0,mod,,,,,,
2,7041342,,,12/12/22(Mon)06:15:12,Anonymous,"Strange ME Chika Edition<br><br><span class=""quote"">&gt;First time here or old installation?</span><br>Download the latest repack for the game you want and you&#039;re set to play.<br>(Remember to backup your userData folder if you&#039;re transferring)<br><br><span class=""quote"">&gt;Koikatsu Repack RX16 - Latest</span><br>https://sukebei.nyaa.si/view/378253<wbr>2<br><br><span class=""quote"">&gt;Koikatsu Sunshine Repack R7 (New!)</span><br>https://sukebei.nyaa.si/view/378492<wbr>4<br>KKS is a new game that takes place on a resort island where the player can date classmates<br>Cards and mods from the previous game work, but plugins need to be updated for the new game<br>KK cards placed in &quot;\UserData\Chara\female or male&quot; folder of KKS will be converted<br><br><span class=""quote"">&gt;HF Patch</span><br><span class=""quote"">&gt;KK: https://github.com/ManlyMarco/KK-HF<wbr>_Patch/releases</span><br><span class=""quote"">&gt;KKS: https://github.com/ManlyMarco/KKS-H<wbr>F_Patch/releases</span><br><br><span class=""quote"">&gt;Sideloader Mods Pack</span><br>https://sideload.betterrepack.com/<br><br><span class=""quote"">&gt;Secret message: Why am I still here?</span><br><br><span class=""quote"">&gt;KKManager</span><br>https://github.com/IllusionMods/KKM<wbr>anager/releases/<br><br><span class=""quote"">&gt;FAQ</span><br>https://wiki.anime-sharing.com/hgam<wbr>es/index.php?title=Koikatu<br>https://wiki.anime-sharing.com/hgam<wbr>es/index.php?title=Koikatsu_Sunshin<wbr>e<br><br><span class=""quote"">&gt;Cards</span><br>http://illusioncards.booru.org/inde<wbr>x.php?page=post&amp;s=list&amp;tags=koikats<wbr>u<br>https://kenzato.uk/booru/<br>https://db.bepis.moe/<br>https://www.pixiv.net/en/tags/キャラ配布<wbr>(コイカツ)<br>Cards are put in &quot;\UserData\Chara\female or male&quot;<br><br><span class=""quote"">&gt;Where do I upload to share?</span><br>https://catbox.moe/<br>https://pomf.cat/<br><br><span class=""quote"">&gt;Koikatsu Guides Collection</span><br>https://mega.nz/#F!yg1ACQjY!9OIzsy7<wbr>z8qpLCgOL4r-F0w<br><br><span class=""quote"">&gt;Koikatsu Resources Pastebin</span><br>https://pastebin.com/nqy085LE<br><br><span class=""quote"">&gt;BUT I WANT QUALITY CARDS</span><br><span class=""quote"">&gt;/kkg/ Card Creator Pastebin</span><br>https://pastebin.com/fPv5K00H<br><br><span class=""quote"">&gt;Guide for importing items/hair/clothes/etc from other games to KK</span><br>https://github.com/IllusionMods/Koi<wbr>katsuModdingTools/wiki/Item-Porting<wbr>-Guide<br><br><span class=""quote"">&gt;Thread Archive (Thanks to the anon keeping this up to date)</span><br>https://rentry.org/kkgarchive<br><br><span class=""quote"">&gt;Theme Stuff</span><br>https://pastebin.com/EiTPbUeL (embed)<br><br><span class=""quote"">&gt;News</span><br>BetterRepack KK RX16 out now!<br>BetterRepack KKS RX7 out now!",1670843712,0,,kkg-koikatsu-general,10,3,"[{'no': 7041368, 'now': '12/12/22(Mon)06:29:54', 'name': 'Anonymous', 'com': '<a href=""#p7041366"" class=""quotelink"">&gt;&gt;7041366</a>', 'filename': 'CharaStudio-2022-12-04-13-15-08-Render', 'ext': '.png', 'w': 1600, 'h': 900, 'tn_w': 125, 'tn_h': 70, 'tim': 1670844594713130, 'time': 1670844594, 'md5': 'i3Agw2jBVRYHJcXO4+ud2Q==', 'fsize': 1066776, 'resto': 7041342, 'm_img': 1}, {'no': 7041370, 'now': '12/12/22(Mon)06:32:56', 'name': 'Anonymous', 'com': '<a href=""#p7041368"" class=""quotelink"">&gt;&gt;7041368</a><br>needs more TESS', 'time': 1670844776, 'resto': 7041342}, {'no': 7041380, 'now': '12/12/22(Mon)06:44:11', 'name': 'Anonymous', 'com': '<a href=""#p7041366"" class=""quotelink"">&gt;&gt;7041366</a>', 'filename': 'when you sold bags of dentures for 500 percent markup', 'ext': '.png', 'w': 789, 'h': 900, 'tn_w': 109, 'tn_h': 125, 'tim': 1670845451084355, 'time': 1670845451, 'md5': '0zfiuInXJsAEheFw8Sm/ig==', 'fsize': 397565, 'resto': 7041342}, {'no': 7041382, 'now': '12/12/22(Mon)06:45:37', 'name': 'Anonymous', 'com': '<a href=""#p7041380"" class=""quotelink"">&gt;&gt;7041380</a><br><span class=""quote"">&gt;filename</span><br>So THAT&#039;S what she used the teeth for.', 'time': 1670845537, 'resto': 7041342}, {'no': 7041398, 'now': '12/12/22(Mon)07:14:50', 'name': 'Anonymous', 'com': '<a href=""/h/thread/7035836#p7041144"" class=""quotelink"">&gt;&gt;7041144</a><br>I didn&#039;t see the link', 'time': 1670847290, 'resto': 7041342}]",1670847290,/kkg/ - Koikatsu! General,Chikasaysbye,.jpg,1908.0,918.0,250.0,120.0,1670843712168236.0,JA4SRZP9eDLm+sMav0BDLg==,416053.0,,1.0,0.0,0.0,5.0,1.0,
3,7037128,,,12/10/22(Sat)01:09:53,Takarasagashi no Natsuyasumi [Second Part],"After nearly 9 fucking years, part 2 is being released tomorrow. Anons died waiting for this.<br> <br><span class=""quote"">&gt;https://www.dlsite.com/maniax/anno<wbr>unce/=/product_id/RJ01000387.html</span><br><br>Bros...we&#039;re going home.",1670652593,0,,after-nearly-9-fucking-years-part-2-is-being,16,4,"[{'no': 7041021, 'now': '12/12/22(Mon)02:53:30', 'name': 'Anonymous', 'com': '<a href=""#p7037128"" class=""quotelink"">&gt;&gt;7037128</a><br>hopefully, it was worth the weight.', 'time': 1670831610, 'resto': 7037128}, {'no': 7041040, 'now': '12/12/22(Mon)03:08:04', 'name': 'Anonymous', 'com': '<a href=""#p7037131"" class=""quotelink"">&gt;&gt;7037131</a><br>Pleasantly surprised second part won&#039;t just be regular sex.', 'time': 1670832484, 'resto': 7037128}, {'no': 7041061, 'now': '12/12/22(Mon)03:21:32', 'name': 'Anonymous', 'com': 'It was worth the wait', 'time': 1670833292, 'resto': 7037128}, {'no': 7041073, 'now': '12/12/22(Mon)03:32:51', 'name': 'Anonymous', 'com': '<a href=""#p7041061"" class=""quotelink"">&gt;&gt;7041061</a><br><a href=""#p7041021"" class=""quotelink"">&gt;&gt;7041021</a><br>https://www.youtube.com/watch?v=L4W<wbr>s9JSCwh0', 'time': 1670833971, 'resto': 7037128}, {'no': 7041396, 'now': '12/12/22(Mon)07:13:43', 'name': 'Anonymous', 'com': '<a href=""#p7040056"" class=""quotelink"">&gt;&gt;7040056</a><br>nigga never seen 3d animations before', 'time': 1670847223, 'resto': 7037128}]",1670847223,,file,.png,1920.0,960.0,250.0,125.0,1670652593046414.0,F17zEDiZut2vZW82/M7Gyg==,2335127.0,,1.0,0.0,0.0,11.0,4.0,
4,7015651,,,11/27/22(Sun)09:07:29,Anonymous,secret thread<br><br>trannies not invited,1669558049,0,,sdpnd,147,20,"[{'no': 7041119, 'now': '12/12/22(Mon)04:01:56', 'name': 'Anonymous', 'com': '<span class=""deadlink"">&gt;&gt;7039748</span><br><span class=""quote"">&gt;Friendly reminder that Gooks have no culture, LARP as Westoids, worship Whites, &quot;anime&quot; (a Western term) and &quot;manga&quot; wouldn&#039;t exist without Walt Disney, most Gook states are US vassal states, Japan was built up by the British as their proxy against Russia, Gooks are so obsessed with trying to be White that beef was a social taboo and punishable by death and sometimes became law until the Western-LARPing Meijis lifted the ban and encouraged Gooks to eat beef because they thought it&#039;d turn them into Whites.</span><br><span class=""quote"">&gt;nooo you cant boycott shitty peopre who are Japs you just cant do that no one does that in Japan and Japs are sacred peopre prease dont do that!!! you are cancer REEEEEEE!!!!</span><br><span class=""quote"">&gt;No, weeb. The cancer is you.</span><br>Hello based department.', 'time': 1670835716, 'resto': 7015651}, {'no': 7041249, 'now': '12/12/22(Mon)05:28:46', 'name': 'Anonymous', 'com': 'In case anyone didn&#039;t know <br>gook = korean<br>chink = chinese<br>nip = japanese<br>Please be accurate with your racist remarks so as to not devalue the terms.', 'time': 1670840926, 'resto': 7015651}, {'no': 7041282, 'now': '12/12/22(Mon)05:48:18', 'name': 'Anonymous', 'com': 'In case anyone didn&#039;t know<br>Weebs are mentally retarded<br>Gook = Yellow/Mongoloid<br>Yellow/Mongoloid = Jap/Chn/Kor<br>Gook = Jap/Chn/Kor<br>Please be accurate with harmless words to as to not devalue the terms.', 'filename': '1670842008161', 'ext': '.jpg', 'w': 3777, 'h': 1637, 'tn_w': 125, 'tn_h': 54, 'tim': 1670842098596348, 'time': 1670842098, 'md5': 'Wzu1lcQbLlj6kTsRqk+oNQ==', 'fsize': 2883760, 'resto': 7015651, 'm_img': 1}, {'no': 7041386, 'now': '12/12/22(Mon)06:54:08', 'name': 'Anonymous', 'com': '<a href=""#p7041249"" class=""quotelink"">&gt;&gt;7041249</a><br>pretty sure gooks were used in vietnam, was it not? i think it&#039;s just any asian slit eyed person in general', 'time': 1670846048, 'resto': 7015651}, {'no': 7041394, 'now': '12/12/22(Mon)07:12:20', 'name': 'Anonymous', 'com': '<a href=""#p7041386"" class=""quotelink"">&gt;&gt;7041386</a><br>yeah it just means the slanted race. weebs think it&#039;ll make them japanese if they succeed in distorting the word by tricking people to think it means koreans only, what these idiots don&#039;t know is that japanese dictionaries say it&#039;s a synonym of the slanted race', 'time': 1670847140, 'resto': 7015651}]",1670847140,SDPND,sdpnd,.png,260.0,260.0,250.0,250.0,1669558049221242.0,VruL1AA3Cso2eFQX1xhG4w==,85600.0,,,0.0,0.0,142.0,19.0,
5,7021397,,,11/30/22(Wed)16:43:17,Anonymous,"Previous: <a href=""/h/thread/7002251#p7002251"" class=""quotelink"">&gt;&gt;7002251</a>",1669844597,0,,mom-ntr,135,50,"[{'no': 7039341, 'now': '12/11/22(Sun)08:17:25', 'name': 'Anonymous', 'com': '<a href=""#p7032444"" class=""quotelink"">&gt;&gt;7032444</a><br><a href=""#p7035687"" class=""quotelink"">&gt;&gt;7035687</a><br>Nice.', 'time': 1670764645, 'resto': 7021397}, {'no': 7040885, 'now': '12/12/22(Mon)00:43:09', 'name': 'Anonymous', 'filename': 'Ensuring your loser son has friends', 'ext': '.jpg', 'w': 1699, 'h': 2104, 'tn_w': 100, 'tn_h': 125, 'tim': 1670823789738377, 'time': 1670823789, 'md5': 'ATihsHIWp9Tzw6F31Ta/Uw==', 'fsize': 652140, 'resto': 7021397, 'm_img': 1}, {'no': 7040998, 'now': '12/12/22(Mon)02:30:24', 'name': 'Anonymous', 'com': '<a href=""/h/thread/7002251#p7009125"" class=""quotelink"">&gt;&gt;7009125</a><br><span class=""quote"">&gt;I really would love it if there was a mom ntr thing where an exhibitionist mom becomes a fake super hero in the sense she has no actual intention of fighting crime, and just wants to get fucked in public while hiding behind a super hero persona.</span><br><br>Tactical Exhibitionism Action.<br><span class=""quote"">&gt;Stealth-based game about a housewife mother who ends up doing &#039;missions&#039; set up by some mysterious group.</span><br><span class=""quote"">&gt;Doing missions successfully gives her money, which she needs because her husband sucks / is deadend-ing at his job / spends all his paycheck on some pathetic hobby. Probably the last one.</span><br><span class=""quote"">&gt;Most (all) of the missions involve sneaking around in revealing outfits while preforming some kind of task.</span><br><span class=""quote"">&gt;She starts off with base nudity, and possibly one other outfit. Most outfits offer some kind of &#039;skill&#039; Mom can use.</span><br><span class=""quote"">&gt;&gt;A classic trenchcoat so you can flash people to stun them.</span><br><span class=""quote"">&gt;&gt;Heavy latex that completely hides her face but also limits her own vision.</span><br><span class=""quote"">&gt;&gt;A superhero outfit could for sure be one.</span><br><span class=""quote"">&gt;Of course, getting caught is the last thing you want to happen.</span><br><span class=""quote"">&gt;Getting caught by a police officer means the mission is failed.</span><br><span class=""quote"">&gt;Getting caught by anyone else though... Can be more manageable. Assuming you&#039;re willing to play along.</span><br><span class=""quote"">&gt;If a citizen reports you, it will spawn more police on the map, so Mom will have to offer something sexual, specifically something as or more sexual than what the npc wants.</span><br><span class=""quote"">&gt;But even if she gets off with favors, getting caught too often will risk Mom getting recognized. Which most outfits lessen more or less.</span><br><br>I could go on, it&#039;s a funny idea. I&#039;m almost tempted to try making it.', 'filename': '6729829ef79df6820e1fe45bf12de27b', 'ext': '.jpg', 'w': 715, 'h': 1000, 'tn_w': 89, 'tn_h': 125, 'tim': 1670830224117800, 'time': 1670830224, 'md5': 'pAxfIyuWUbrOOCEwh+L+GA==', 'fsize': 515146, 'resto': 7021397}, {'no': 7041157, 'now': '12/12/22(Mon)04:35:46', 'name': 'Anonymous', 'com': '<a href=""#p7040998"" class=""quotelink"">&gt;&gt;7040998</a><br>That&#039;s good too, and I hope you can make something like that. Though I was thinking more along lines like this.<br><span class=""quote"">&gt;Curvy mom down to nothing but a super hero mask getting railed by a studly super villain after having barely pretended to try and fight them</span><br><span class=""quote"">&gt;Since that&#039;s her actual goal instead of stopping him</span><br><span class=""quote"">&gt;In front of a large crowd of the public with more people watching only getting her off that much better</span><br><span class=""quote"">&gt;If her son who knows it&#039;s her was watching either by being in the crowd or even watching it on the news at home</span><br><span class=""quote"">&gt;She&#039;s known as a terrible super hero because every time it&#039;s like this, and best case scenario she fatigues them into getting caught</span><br><span class=""quote"">&gt;If she had a kinky super power that only enhanced the mom ntr, and didn&#039;t help her as a &#039;super hero&#039; at all</span>', 'time': 1670837746, 'resto': 7021397}, {'no': 7041392, 'now': '12/12/22(Mon)07:07:53', 'name': 'Anonymous', 'com': '<span class=""quote"">&gt;no Mom NTR that takes place on a wild/deserted island</span><br>I swear, there is so much untapped potential with this kink and most artists just want to draw the son&#039;s bully fucking the mom.', 'time': 1670846873, 'resto': 7021397}]",1670846873,Mom NTR,1656426375151,.jpg,3000.0,4000.0,187.0,250.0,1669844597853641.0,Iv7XbNtQp1DdhgRKJg92sw==,3378552.0,,1.0,0.0,0.0,130.0,48.0,
6,7037387,,,12/10/22(Sat)05:05:55,Anonymous,"TABA<br><span class=""quote"">&gt;Game: https://www.nutaku.net/games/taiman<wbr>in-asagi-battle-arena/</span><br><span class=""quote"">&gt;Viewer: https://drive.google.com/open?id=19<wbr>Kd2T9gVZtsoEHP9nIeDSIdLOnw4Xgt7</span><br><span class=""quote"">&gt;Viewer Big Patch: https://mega.nz/file/J4gWnAYZ#Qx8lV<wbr>iR4Jl9gTQbm6m3s5KKbgXXTSj2nLsa_IZ6Z<wbr>i30</span><br><span class=""quote"">&gt;Event Patches: https://mega.nz/folder/OuBwSajD#cRA<wbr>yhgZtXTkBouEIREiz7Q</span><br><span class=""quote"">&gt;Videos: https://www.youtube.com/watch?v=snL<wbr>ByV1Jn4Y&amp;list=PLWTepIlReBpnRRQcQMjQ<wbr>GxDo7whb4IxIe</span><br><br>RPGX<br><span class=""quote"">&gt;Game: http://pc-play.games.dmm.co.jp/play<wbr>/taimanin_rpgx/</span><br><span class=""quote"">&gt;Guide: https://docs.google.com/document/d/<wbr>1k22dzpoUyYc3dgqOeiYWf5aKdzcMTM-22P<wbr>PZ15ePyiw/</span><br><span class=""quote"">&gt;Viewer: https://mega.nz/#F!E90EGKja!e7iSrCr<wbr>QYeF_0_72GC4T-g</span><br><span class=""quote"">&gt;Story TL: https://docs.google.com/document/d/<wbr>1koBwcMlYnY5Z5gezuY9tbnBLWxQ9jByLbc<wbr>O2A_ZGDwA/</span><br><span class=""quote"">&gt;Translator Tool: https://mega.nz/file/dYN0WQLS#7nT4m<wbr>6amxQvrasjvhQBxXs-3dPIXmwEnnC8wufL0<wbr>UMY</span><br><span class=""quote"">&gt;Translator Tutorial: https://files.catbox.moe/0toapd.mp4<wbr></span><br><span class=""quote"">&gt;Videos: https://www.youtube.com/watch?v=SkX<wbr>8aSzVqMg&amp;list=PLWTepIlReBplP_mSvQ3_<wbr>if7-A8In-45Nc</span><br><br>Action<br><span class=""quote"">&gt;Game: https://www.actiontaimanin.net/</span><br><span class=""quote"">&gt;Guide: https://docs.google.com/document/d/<wbr>10M3mxaE6FVmAYB-EkBLQ9AtvCJZ-Xmlaqb<wbr>3qrkvjCzo/</span><br><span class=""quote"">&gt;Bond Scenes: https://www.youtube.com/watch?v=aQe<wbr>F7NBX7kc&amp;list=PLWTepIlReBpnAQ-6Q4pt<wbr>iCjCSwPCCxwUM</span><br><span class=""quote"">&gt;OST: https://www.youtube.com/watch?v=uU3<wbr>6_upTNP0&amp;list=PLWTepIlReBpn1CNGkTSi<wbr>YcGeQ_m7Cm-zS</span><br><span class=""quote"">&gt;Other: https://pastebin.com/25kj4wgj</span><br><span class=""quote"">&gt;Videos: https://www.youtube.com/watch?v=TDP<wbr>xJMNdhu8&amp;list=PLWTepIlReBpm7B4YZ_ET<wbr>yKdlgmzCxYe1x</span><br><br>Misc.<br><span class=""quote"">&gt;Drama CDs: https://mega.nz/folder/lKRE3ZJB#gex<wbr>G4fUbKgJNU7Apyel4ZQ &amp; https://mega.nz/folder/jUoj1CTY#VN2<wbr>ZH-QuInXG1jbJ7xMhsA</span><br><span class=""quote"">&gt;Drama CD Spreadsheet: https://docs.google.com/spreadsheet<wbr>s/d/18s-5M3thLSF95tHCbMLuYtLXWreCRU<wbr>I-F6jSgT9CBIY/</span><br><span class=""quote"">&gt;TA3 + TABA Artbooks: https://mega.nz/#F!CNZlEaIT!EXveLzb<wbr>cJoCjpWbchbpe9g</span><br><span class=""quote"">&gt;Wallpapers: https://mega.nz/folder/ZxEB1CgC#wSH<wbr>Jmx6rvuzMAefaCUoX_A</span><br><span class=""quote"">&gt;Lilith Art Collection: https://mega.nz/folder/c0N2WSzJ#hv2<wbr>t5xRVyo2R_OLLUWc0Jw</span><br><span class=""quote"">&gt;Lilith CG Collection: https://mega.nz/folder/HPp0TaDb#9uH<wbr>UdeBUqJz72jBytgXUzg</span><br><span class=""quote"">&gt;Translation Updates: Rattan Man Translations @ Blogspot</span>",1670666755,0,,taimanin-general,16,7,"[{'no': 7039115, 'now': '12/11/22(Sun)04:19:51', 'name': 'Anonymous', 'com': '<a href=""#p7039082"" class=""quotelink"">&gt;&gt;7039082</a><br><span class=""quote"">&gt;Was anyone else wanting to see Oboro get fucked</span><br>yes. why did they make such a hot slut and hardly give her any scenes?', 'time': 1670750391, 'resto': 7037387}, {'no': 7039517, 'now': '12/11/22(Sun)11:06:18', 'name': 'Anonymous', 'com': '<a href=""#p7039115"" class=""quotelink"">&gt;&gt;7039115</a><br><span class=""quote"">&gt;why did they make such a hot slut and hardly give her any scenes?</span><br><br>that&#039;s shizuru&#039;s line', 'filename': 'shizuru00', 'ext': '.jpg', 'w': 1062, 'h': 1400, 'tn_w': 94, 'tn_h': 125, 'tim': 1670774778152311, 'time': 1670774778, 'md5': 'yGmAO0zRDhf686Uuz88HvQ==', 'fsize': 849900, 'resto': 7037387, 'm_img': 1}, {'no': 7040677, 'now': '12/11/22(Sun)22:31:06', 'name': 'Anonymous', 'com': 'You talkin shit, anon?', 'filename': 'Sanada_Homura_Christmas', 'ext': '.png', 'w': 1000, 'h': 1100, 'tn_w': 113, 'tn_h': 125, 'tim': 1670815866318419, 'time': 1670815866, 'md5': '37WF3ZnXzrXeGfElvAGqxA==', 'fsize': 721360, 'resto': 7037387, 'm_img': 1}, {'no': 7040973, 'now': '12/12/22(Mon)01:50:35', 'name': 'Anonymous', 'com': 'I want to fuck this delinquent cow', 'filename': 'maika pillow', 'ext': '.png', 'w': 577, 'h': 880, 'tn_w': 81, 'tn_h': 125, 'tim': 1670827835056380, 'time': 1670827835, 'md5': 'TOATtPyx0yMBMNErWIUcgg==', 'fsize': 998749, 'resto': 7037387}, {'no': 7041385, 'now': '12/12/22(Mon)06:52:02', 'name': 'Anonymous', 'com': 'I want pregnant rinko', 'time': 1670845922, 'resto': 7037387}]",1670845922,Taimanin General / 対魔忍,chr_0491c,.png,960.0,720.0,250.0,187.0,1670666755408193.0,6TRIX5OM9/xr4/6aPuWSNw==,639458.0,,,0.0,0.0,11.0,4.0,
7,7037531,,,12/10/22(Sat)07:32:41,Anonymous,"Prev:<a href=""/h/thread/6837595#p6837595"" class=""quotelink"">&gt;&gt;6837595</a><br><br><span class=""quote"">&gt;Schedule:</span><br>Jan. Nanase Saki<br>Jan. Plum midnight bus<br>Feb. Kaguya climax 3<br>Feb.? Furisode Yura<br>Mar.? Kaguya climax 4<br>Apr.? Hinata foreign student lesbian<br>May.? Plum final<br>May.? Nadja<br>Jun.? Hinata illegal part-time<br><br><span class=""quote"">&gt;Crimson Youmataisen official website:</span><br>https://www.dmm.co.jp/netgame/featu<wbr>re/crimson_youmataisen_x.html<br><br><span class=""quote"">&gt;Crimson Youmataisen official twitter:</span><br>https://twitter.com/crimson_youma<br><br><span class=""quote"">&gt;Crimson Youmataisen guide:</span><br>https://docs.google.com/spreadsheet<wbr>s/d/1_FCgimAor3p6-d2wOXgtm0AOAmJH1L<wbr>HkFkb_M_tH-n4/edit#gid=898272674<br><br><span class=""quote"">&gt;Crimson Youmataisen wiki (JP):</span><br>https://crimson-youmataisen.wikiru.<wbr>jp/<br><br><span class=""quote"">&gt;CG:</span><br>https://drive.google.com/drive/fold<wbr>ers/1iH0XrGCWd7hMk3eu4zXwQnGVG2Sb4A<wbr>OY<br><br><br><span class=""quote"">&gt;Website:</span><br>http://userweb.alles.or.jp/uir/inde<wbr>x1.htm<br><br><span class=""quote"">&gt;Twitter:</span><br>http://twitter.com/crimson_3<br><br><span class=""quote"">&gt;Official pixiv:</span><br>http://www.pixiv.net/member_illust.<wbr>php?id=14614714<br><br><span class=""quote"">&gt;Personal pixiv:</span><br>http://www.pixiv.net/member.php?id=<wbr>772642<br><br><span class=""quote"">&gt;Blog (abandoned):</span><br>http://blog.livedoor.jp/crimson_off<wbr>icial/<br><br><span class=""quote"">&gt;Archives:</span><br>http://archived.moe/_/search/boards<wbr>/h.talk/subject/crimson%20comics/<br>http://archiveofsins.com/h/search/s<wbr>ubject/crimson%20comics/<br>http://4archive.org/board/h/thread/<wbr>4122476#p4122476 (ccg5 complete thread)<br><br>Useful search terms: クリムゾン, クリムゾンコミックス, クリ姉 (nickname by Japanese fans)",1670675561,0,,crimson-comics-general-thread-36-hinata-gakuen,24,9,"[{'no': 7039400, 'now': '12/11/22(Sun)09:21:32', 'name': 'Anonymous', 'com': '<a href=""#p7039392"" class=""quotelink"">&gt;&gt;7039392</a><br>Anytime bro.<br><br>To anyone else having trouble finding the beach episode, the cover looks like this. Yeah it looks like the lesbo train episode but the first page is really like this lol', 'filename': 'cover', 'ext': '.jpg', 'w': 700, 'h': 973, 'tn_w': 89, 'tn_h': 125, 'tim': 1670768492588471, 'time': 1670768492, 'md5': '53vYm/RoRjyIXGVv8XHthg==', 'fsize': 79580, 'resto': 7037531}, {'no': 7041269, 'now': '12/12/22(Mon)05:38:04', 'name': 'Anonymous', 'com': 'Anyone remember who Crimson&#039;s OCs are based on?<br>I remember Yuri Tomoka is from an actual newscaster born in 87 I think?<br>Would be neat to see side by side shots of the inspiration and Crimson&#039;s characters.', 'time': 1670841484, 'resto': 7037531}, {'no': 7041353, 'now': '12/12/22(Mon)06:20:37', 'name': 'Anonymous', 'com': '<a href=""#p7041269"" class=""quotelink"">&gt;&gt;7041269</a><br>Who is this broadcaster if I may ask?', 'time': 1670844037, 'resto': 7037531}, {'no': 7041375, 'now': '12/12/22(Mon)06:40:54', 'name': 'Anonymous', 'com': '<a href=""#p7041353"" class=""quotelink"">&gt;&gt;7041353</a><br>Yurika Mita, if anyone wants to composite her to to Tomoka', 'filename': 'yurikamita', 'ext': '.jpg', 'w': 377, 'h': 535, 'tn_w': 88, 'tn_h': 125, 'tim': 1670845254966263, 'time': 1670845254, 'md5': '1KPerLIe4WHBp7rEL+vyZg==', 'fsize': 26141, 'resto': 7037531}, {'no': 7041383, 'now': '12/12/22(Mon)06:47:48', 'name': 'Anonymous', 'com': 'Tomoka giving the Double V, but a color would probably be better.', 'filename': '24_24', 'ext': '.jpg', 'w': 1060, 'h': 1504, 'tn_w': 88, 'tn_h': 125, 'tim': 1670845668433934, 'time': 1670845668, 'md5': 'YRrHBXg6m5BLOZ8QypSvBw==', 'fsize': 459808, 'resto': 7037531, 'm_img': 1}]",1670845668,Crimson Comics General Thread #36 - Hinata Gakuen Edition,d_252220pr,.jpg,560.0,420.0,250.0,187.0,1670675561508461.0,/XRC5nexl2eE72JiULcJtg==,83323.0,,,0.0,0.0,19.0,6.0,
