,no,sticky,closed,now,name,com,time,resto,filedeleted,semantic_url,replies,images,last_replies,last_modified,sub,filename,ext,w,h,tn_w,tn_h,tim,md5,fsize,capcode,m_img,bumplimit,imagelimit,omitted_posts,omitted_images,trip
71,7009587,,,11/23/22(Wed)18:33:25,Anonymous,You can find it here on his blog https://ci-en.dlsite.com/creator/66<wbr>00/article/745648 <br><br>Title: PIZZA配達淫Ⅱ<br>Pizza Takeout Obscenity II,1669246405,0,,umemaros-latest-work-has-been-released,41,3,"[{'no': 7039442, 'now': '12/11/22(Sun)10:11:07', 'name': 'Anonymous', 'com': '<a href=""#p7028045"" class=""quotelink"">&gt;&gt;7028045</a><br><br><span class=""quote"">&gt;he did nothing of merit for quite a long time after Lewd consultation</span><br><br>Twin Succubus, Lecherous Treatment, Pizza Take Out 1 and Sexy Trainer were all pretty good. Don&#039;t know what you&#039;re talking about. (the others like Work in Progress, Cheeky Girl, Horny Girl and Semen Analysis were pretty lacking to me)<br><br>The hottest thing he recently did was the whispering and licking audio with Mari in the protagonist&#039;s ears in the last vid he made before Pizza2.<br><br>This Pizza2 release honestly just feels really lazy in comparison to most of his other works. Can clearly tell there wasn&#039;t much inspiration in this one other than the mobile phone gacha gambling gimmick to set up the events.', 'time': 1670771467, 'resto': 7009587}, {'no': 7039819, 'now': '12/11/22(Sun)14:04:38', 'name': 'Demon dogs put down', 'com': '<a href=""#p7009587"" class=""quotelink"">&gt;&gt;7009587</a><br><span class=""quote"">&gt;Umemaro&#039;s latest work has been released!!</span><br><br>Please, let there be a lesbian scene!', 'time': 1670785478, 'resto': 7009587}, {'no': 7039821, 'now': '12/11/22(Sun)14:06:44', 'name': 'Demon dogs put down', 'com': '<a href=""#p7025824"" class=""quotelink"">&gt;&gt;7025824</a><br><span class=""quote"">&gt;Still the best.</span><br><br>I&#039;m not making a list about which Umemaro was the best, for me, all were the best.<br><br>But I thought it was a waste not to have the doctor and the nurse do a little dyke scene together to set the mood...and not just shake their tits.', 'time': 1670785604, 'resto': 7009587}, {'no': 7039886, 'now': '12/11/22(Sun)15:02:51', 'name': 'Anonymous', 'com': '<a href=""#p7039220"" class=""quotelink"">&gt;&gt;7039220</a><br>That is what makes it my favorite.', 'time': 1670788971, 'resto': 7009587}, {'no': 7040415, 'now': '12/11/22(Sun)20:27:32', 'name': 'Anonymous', 'com': '<a href=""#p7039819"" class=""quotelink"">&gt;&gt;7039819</a><br>There is. It&#039;s a 20 seconds long animation of the sub eating out the dom.', 'time': 1670808452, 'resto': 7009587}]",1670808452,Umemaro&#039;s latest work has been released!!,image-web,.jpg,800.0,600.0,250.0,187.0,1669246405953833.0,r1vo2VJm1GPB4QpJ8FEFRw==,150206.0,,,0.0,0.0,36.0,3.0,
72,7031584,,,12/06/22(Tue)18:03:08,Anonymous,"Will the king of huge shiny plump fat asses make a return to the h market? <br><br>Does anyone else come close? <br><br>Big badunkadunks, dump trucks, butts, booty etc.<br><br>muscular is a bonus. <br><br>I know enjoying tall large strong beautiful woman with massive asses often stems from mommy issues but no shota please.",1670367788,0,,methonium-synecdoche-big-ass-general,15,11,"[{'no': 7033776, 'now': '12/08/22(Thu)01:17:47', 'name': 'Anonymous', 'filename': '1599500076169', 'ext': '.jpg', 'w': 1242, 'h': 975, 'tn_w': 125, 'tn_h': 98, 'tim': 1670480267914914, 'time': 1670480267, 'md5': '9tKFT5ale/63zfjko+eyNA==', 'fsize': 281141, 'resto': 7031584, 'm_img': 1}, {'no': 7033780, 'now': '12/08/22(Thu)01:18:19', 'name': 'Anonymous', 'filename': 'b5e8597d778f9521c90caea1bf5035d6', 'ext': '.jpg', 'w': 3000, 'h': 2153, 'tn_w': 125, 'tn_h': 89, 'tim': 1670480299923308, 'time': 1670480299, 'md5': 'mb8u8sm7rBsvdcA29jkRDg==', 'fsize': 1072309, 'resto': 7031584, 'm_img': 1}, {'no': 7033783, 'now': '12/08/22(Thu)01:18:52', 'name': 'Anonymous', 'filename': 'b41f3aaca7c5626e31cc7b6764cf5069', 'ext': '.jpg', 'w': 1300, 'h': 1463, 'tn_w': 111, 'tn_h': 125, 'tim': 1670480332373150, 'time': 1670480332, 'md5': 'MUs3FTB3J+KhwpQ1Lkb3DQ==', 'fsize': 587903, 'resto': 7031584, 'm_img': 1}, {'no': 7036975, 'now': '12/09/22(Fri)22:39:51', 'name': 'Anonymous', 'com': '<a href=""#p7031588"" class=""quotelink"">&gt;&gt;7031588</a><br>Name please', 'time': 1670643591, 'resto': 7031584}, {'no': 7040399, 'now': '12/11/22(Sun)20:20:07', 'name': 'Anonymous', 'com': '<a href=""#p7036975"" class=""quotelink"">&gt;&gt;7036975</a><br>Filename. Also the artist&#039;s name is in the OP.', 'filename': 'not this one', 'ext': '.jpg', 'w': 1764, 'h': 1764, 'tn_w': 125, 'tn_h': 125, 'tim': 1670808007281197, 'time': 1670808007, 'md5': '+sH1t3mKV8wUIEQGK7hRrA==', 'fsize': 362182, 'resto': 7031584, 'm_img': 1}]",1670808007,Methonium / synecdoche / Big Ass general,Healthyx1000,.png,1568.0,1168.0,250.0,186.0,1670367788354533.0,nqSv57l/reZfmzDWMSXxNQ==,2379880.0,,1.0,0.0,0.0,10.0,7.0,
73,7038954,,,12/11/22(Sun)02:08:16,Anonymous,,1670742496,0,,fire-emblem,27,27,"[{'no': 7039981, 'now': '12/11/22(Sun)16:14:54', 'name': 'Anonymous', 'filename': '1D4574A0-DAC1-449B-95C5-040244E9E87E', 'ext': '.jpg', 'w': 3543, 'h': 2426, 'tn_w': 125, 'tn_h': 85, 'tim': 1670793294014077, 'time': 1670793294, 'md5': 'nl7qn5GH9mdIpc31g4Hamw==', 'fsize': 1553004, 'resto': 7038954, 'm_img': 1}, {'no': 7039982, 'now': '12/11/22(Sun)16:15:34', 'name': 'Anonymous', 'filename': '55F2120F-59F9-4F19-9FFB-96969DA17A43', 'ext': '.png', 'w': 1200, 'h': 1600, 'tn_w': 93, 'tn_h': 125, 'tim': 1670793334275826, 'time': 1670793334, 'md5': 'K326b4ZhjA4ad+d4Xr+URg==', 'fsize': 1691937, 'resto': 7038954, 'm_img': 1}, {'no': 7039983, 'now': '12/11/22(Sun)16:16:22', 'name': 'Anonymous', 'filename': '1484C23A-4791-4E58-9B46-83500B46349F', 'ext': '.png', 'w': 1200, 'h': 1600, 'tn_w': 93, 'tn_h': 125, 'tim': 1670793382157959, 'time': 1670793382, 'md5': '+i7Amw4Oxzr6WzAa3Pk8+g==', 'fsize': 1480678, 'resto': 7038954, 'm_img': 1}, {'no': 7040023, 'now': '12/11/22(Sun)16:51:53', 'name': 'Anonymous', 'filename': 'FA9B6EE5-E358-4C4E-B862-224613180A8C', 'ext': '.png', 'w': 1600, 'h': 1200, 'tn_w': 125, 'tn_h': 93, 'tim': 1670795513910579, 'time': 1670795513, 'md5': 'dBxPJZoFDCsOiruZBgl+9w==', 'fsize': 1737498, 'resto': 7038954, 'm_img': 1}, {'no': 7040384, 'now': '12/11/22(Sun)20:15:18', 'name': 'Anonymous', 'filename': '1FcpdoX', 'ext': '.jpg', 'w': 848, 'h': 1200, 'tn_w': 88, 'tn_h': 125, 'tim': 1670807718188651, 'time': 1670807718, 'md5': 'iCTZUrgez0VzGNv2Kmfzdg==', 'fsize': 990609, 'resto': 7038954, 'm_img': 1}]",1670807718,Fire Emblem,87A2FD00-510A-4416-AFB0-50CD24FC7066,.jpg,6400.0,4000.0,250.0,156.0,1670742496562635.0,EybB9UjIfF+oq5ei8QsGCg==,3733569.0,,1.0,0.0,0.0,22.0,22.0,
74,7005330,,,11/21/22(Mon)03:31:48,Anonymous,"Previous thread:<br><span class=""deadlink"">&gt;&gt;6880534</span><br><br>Older threads:<br>https://pastebin.com/H3KxPAsN<br><br>Welcome to the gangbang thread! Post and discuss gangbang related content here.",1669019508,0,,gangbang-thread-v33,114,110,"[{'no': 7039683, 'now': '12/11/22(Sun)12:40:06', 'name': 'Anonymous', 'com': '<a href=""#p7039289"" class=""quotelink"">&gt;&gt;7039289</a><br><br>It&#039;s been observed by scientists that situations of sperm competition tend to arouse men, presumably to make them ejaculate earlier and get an upper hand in the competition so to speak.', 'filename': '1596254337319', 'ext': '.jpg', 'w': 1639, 'h': 1514, 'tn_w': 125, 'tn_h': 115, 'tim': 1670780406251050, 'time': 1670780406, 'md5': 'aKs5qgsxXVv1BBUbs4+0vQ==', 'fsize': 333418, 'resto': 7005330, 'm_img': 1}, {'no': 7039955, 'now': '12/11/22(Sun)15:49:02', 'name': 'Anonymous', 'com': '<a href=""#p7039289"" class=""quotelink"">&gt;&gt;7039289</a><br>Is Horta the best gangbang slut?<br><a href=""#p7039683"" class=""quotelink"">&gt;&gt;7039683</a><br>Yeah. Sperm competition is a thing.', 'filename': '1670791676161', 'ext': '.png', 'w': 2880, 'h': 2395, 'tn_w': 125, 'tn_h': 103, 'tim': 1670791742443809, 'time': 1670791742, 'md5': 'tBN0b97QUjF9Y0VzAzFLoQ==', 'fsize': 1030465, 'resto': 7005330, 'm_img': 1}, {'no': 7040010, 'now': '12/11/22(Sun)16:39:56', 'name': 'Anonymous', 'com': 'https://exhentai.org/g/2400100/819c<wbr>bedb18/<br><br>This Motomushi book got a new (updated?) translation', 'filename': '57', 'ext': '.jpg', 'w': 1600, 'h': 2227, 'tn_w': 89, 'tn_h': 125, 'tim': 1670794796751178, 'time': 1670794796, 'md5': '8auSsMIM2tMTLg/0r4+gYg==', 'fsize': 1091703, 'resto': 7005330, 'm_img': 1}, {'no': 7040370, 'now': '12/11/22(Sun)20:06:07', 'name': 'Anonymous', 'com': '<a href=""#p7038935"" class=""quotelink"">&gt;&gt;7038935</a><br>Wish I could help more, there&#039;s just so much idolmaster gangbang hentai out there', 'filename': 'kilesha', 'ext': '.jpg', 'w': 850, 'h': 526, 'tn_w': 125, 'tn_h': 77, 'tim': 1670807167668974, 'time': 1670807167, 'md5': 'Yo7Yw/TR8pxTwUb7u1fATg==', 'fsize': 163429, 'resto': 7005330}, {'no': 7040373, 'now': '12/11/22(Sun)20:06:38', 'name': 'Anonymous', 'com': '<a href=""#p7040370"" class=""quotelink"">&gt;&gt;7040370</a>', 'filename': 'testame', 'ext': '.jpg', 'w': 850, 'h': 659, 'tn_w': 125, 'tn_h': 96, 'tim': 1670807198573212, 'time': 1670807198, 'md5': 'tHIt44NhRiM0+bHmmUUFSQ==', 'fsize': 232333, 'resto': 7005330}]",1670807198,Gangbang Thread v33,hisakabe oto ,.png,2047.0,1447.0,250.0,176.0,1669019508317286.0,aTw5kFqxiBh477WPFaoayw==,1667798.0,,1.0,0.0,0.0,109.0,105.0,
75,7039810,,,12/11/22(Sun)13:59:07,Anonymous,Post depressing doujin endings,1670785147,0,,post-depressing-doujin-endings,1,0,"[{'no': 7040358, 'now': '12/11/22(Sun)20:00:30', 'name': 'Anonymous', 'com': '<a href=""#p7039810"" class=""quotelink"">&gt;&gt;7039810</a><br>becoming an hero means more monster girls for the rest of us', 'time': 1670806830, 'resto': 7039810}]",1670806830,,why live,.png,1063.0,1500.0,177.0,250.0,1670785147666053.0,Smg8V+YxtTn32KjIhqmPVw==,595309.0,,1.0,0.0,0.0,,,
76,6814229,,,08/26/22(Fri)22:16:42,Anonymous,Doesn&#039;t Asuna remind you of that whore from that zombie high school show?,1661566602,0,,sword-art-online,211,193,"[{'no': 7038440, 'now': '12/10/22(Sat)20:44:29', 'name': 'Anonymous', 'com': '<a href=""#p7037313"" class=""quotelink"">&gt;&gt;7037313</a><br>What the fuck?', 'time': 1670723069, 'resto': 6814229}, {'no': 7038733, 'now': '12/10/22(Sat)23:39:49', 'name': 'Anonymous', 'com': 'Just what this slut deserves', 'filename': 'WOhSdJjUrfgTyhGnZhGeSegc', 'ext': '.jpg', 'w': 1200, 'h': 1246, 'tn_w': 120, 'tn_h': 125, 'tim': 1670733589747433, 'time': 1670733589, 'md5': 'rluuv+Qe2svsyf49dUf6eA==', 'fsize': 611638, 'resto': 6814229, 'm_img': 1}, {'no': 7038747, 'now': '12/10/22(Sat)23:48:12', 'name': 'Anonymous', 'com': 'Sisters fantasy anyone?', 'filename': 'tKSxp2JYO7ko5BtBu1zUEKY8', 'ext': '.jpg', 'w': 1200, 'h': 1697, 'tn_w': 88, 'tn_h': 124, 'tim': 1670734092868352, 'time': 1670734092, 'md5': 'OyGC7+b/X3KAs2ZTy+m8+w==', 'fsize': 452645, 'resto': 6814229, 'm_img': 1}, {'no': 7039936, 'now': '12/11/22(Sun)15:37:46', 'name': 'Anonymous', 'com': '<a href=""#p7038440"" class=""quotelink"">&gt;&gt;7038440</a><br>?', 'time': 1670791066, 'resto': 6814229}, {'no': 7040347, 'now': '12/11/22(Sun)19:55:27', 'name': 'Anonymous', 'com': '<a href=""#p7039936"" class=""quotelink"">&gt;&gt;7039936</a><br>Why are there welts on her breasts? That&#039;s awful.', 'time': 1670806527, 'resto': 6814229}]",1670806527,Sword Art Online,1661566322334,.jpg,1000.0,1414.0,176.0,250.0,1661566602124608.0,MmA20OJuylZ4dKOssuXuTw==,865717.0,,1.0,0.0,0.0,206.0,191.0,
77,6999427,,,11/17/22(Thu)19:24:43,Anonymous,"Think about it. Female MCs are better in every way. The malecuck retorts, &quot;but you&#039;re watching the girl you want to fuck get fucked by other guys, you&#039;re the cuck or you&#039;re a tranny in denial.&quot; Not so much. You see, female MCs in H games are complete and thorough sluts. They fuck anything. This is different from real w*myn, who only fuck chads. When you control a female MC and she fucks anything that moves, you are equalizing the playing field and democratically distributing sex. Still don&#039;t get it? Let me put it in plain English.<br><br>I AM the fat ugly bastard. I AM the bald old perv. I am the goblin, I am the orc; I am the virgin NEET, I am the lonely salaryman, I AM the lvl 1 slime. WE are all those things. Female MC games are anti cuckoldry precisely because we CAN&#039;T self insert in the girl, we insert in EVERYTHING ELSE. <br><br>By playing male MC games where you play as satoshi mcchadington, you are only perpetuating roastie-dom. And you are not chad irl. You enjoy watching chadtoshi fuck. YOU, are the cuck.",1668731083,0,,male-mc-h-games-are-cuckoldry,30,0,"[{'no': 7035822, 'now': '12/09/22(Fri)08:07:06', 'name': 'Anonymous', 'com': '<a href=""#p6999427"" class=""quotelink"">&gt;&gt;6999427</a><br>True, but games with blank faced male mc&#039;s who fuck/rape all the girls are still superior.', 'time': 1670591226, 'resto': 6999427}, {'no': 7035893, 'now': '12/09/22(Fri)09:07:48', 'name': 'Anonymous', 'com': '<a href=""#p6999427"" class=""quotelink"">&gt;&gt;6999427</a><br>Yeah, I&#039;m thinkin BASED on this one', 'time': 1670594868, 'resto': 6999427}, {'no': 7040299, 'now': '12/11/22(Sun)19:27:16', 'name': 'Anonymous', 'com': '<a href=""#p6999427"" class=""quotelink"">&gt;&gt;6999427</a><br>male mc games = variety of women<br>female mc games = variety of men<br><br>Only homos like the latter.', 'time': 1670804836, 'resto': 6999427}, {'no': 7040339, 'now': '12/11/22(Sun)19:48:00', 'name': 'Anonymous', 'com': '<a href=""#p6999427"" class=""quotelink"">&gt;&gt;6999427</a><br>Fren, it&#039;s just a game. You are not the MC or anyone the MC fucks. You can self insert in the females, the males, the tentacle monsters or no one. A female or male MC means nothing.<br><br>Also, not only Chads fuck. Unless you think 90% of the male population are Chads.', 'time': 1670806080, 'resto': 6999427}, {'no': 7040344, 'now': '12/11/22(Sun)19:52:04', 'name': 'Anonymous', 'com': '<a href=""#p6999427"" class=""quotelink"">&gt;&gt;6999427</a><br>Irrefutably based. Keep on preaching, King.', 'time': 1670806324, 'resto': 6999427}]",1670806324,Male MC H games are cuckoldry,RJ362199_img_smp7,.jpg,539.0,306.0,250.0,141.0,1668731083806592.0,SGCEWbuqQ3CxrTWr6547+w==,58076.0,,,0.0,0.0,25.0,0.0,
78,7036450,,,12/09/22(Fri)15:44:31,Anonymous,"<span class=""quote"">&gt;ntr is actually awsome dude</span><br><span class=""quote"">&gt;you just gotta self insert as the chad fucking the girl</span><br>Then why does every ntr story focus like 99% on the happy couple then a retard walks in and ruins a relationship",1670618671,0,,ntr-is-actually-awsome-dude,60,27,"[{'no': 7040128, 'now': '12/11/22(Sun)18:10:47', 'name': 'Anonymous', 'com': '<a href=""#p7036450"" class=""quotelink"">&gt;&gt;7036450</a><br>Retards just don&#039;t know the difference between netori and netorare. Netori is the kind of a shit where the protagonist (AKA the guy you&#039;re usually supposed to self insert as) cucks some other dude. Netorare is the shit where the protagonist gets cucked. If you&#039;re in to netorare shit, you&#039;re just a cuck. If you&#039;re in to netori shit, you&#039;re alright.', 'time': 1670800247, 'resto': 7036450}, {'no': 7040134, 'now': '12/11/22(Sun)18:15:01', 'name': 'Anonymous', 'com': '<a href=""#p7036682"" class=""quotelink"">&gt;&gt;7036682</a><br>sauce on this img?', 'time': 1670800501, 'resto': 7036450}, {'no': 7040138, 'now': '12/11/22(Sun)18:16:25', 'name': 'Anonymous', 'com': '<a href=""#p7039932"" class=""quotelink"">&gt;&gt;7039932</a><br><span class=""quote"">&gt;a closet Nazi</span><br>GUTEN TAG ANON COME FUCK MEIN DARLING EVA<br>SIEG HEIL!', 'filename': 'url(48)', 'ext': '.jpg', 'w': 800, 'h': 711, 'tn_w': 125, 'tn_h': 111, 'tim': 1670800585609180, 'time': 1670800585, 'md5': 'QPkGqmJv++ETpTUOil9LaQ==', 'fsize': 86333, 'resto': 7036450}, {'no': 7040248, 'now': '12/11/22(Sun)19:05:32', 'name': 'Anonymous', 'com': '<a href=""#p7036682"" class=""quotelink"">&gt;&gt;7036682</a><br>NTRfags are closeted if you&#039;re so preoccupied with other men and need them in your erotic fiction.', 'time': 1670803532, 'resto': 7036450}, {'no': 7040323, 'now': '12/11/22(Sun)19:42:35', 'name': 'Anonymous', 'com': '<span class=""quote"">&gt;self insert</span><br>JK Rowling wrote the length of the Bible several times over about a teenage boy growing up and going through puberty. Millions of straight girls and women read every last word, not because they self-inserted as a teemage boy, but because they could relate to his emotions written out on the page.<br><br>Cuckwriters write and portray the cuck&#039;s perspective and emotions in a deliberate attempt to get the audience to relate to cuckold emotions. ntrcucks are in full denial of writing 101.', 'filename': '1649919933055', 'ext': '.png', 'w': 500, 'h': 500, 'tn_w': 125, 'tn_h': 125, 'tim': 1670805755100317, 'time': 1670805755, 'md5': 'J77pRDUEwSIj/3V77/3v8g==', 'fsize': 76491, 'resto': 7036450}]",1670805755,,aR7ARG2_460s,.jpg,460.0,482.0,238.0,250.0,1670618671542279.0,tscWPBIZd+hNpyNbSEONhQ==,31923.0,,,0.0,0.0,55.0,25.0,
79,6996127,,,11/16/22(Wed)02:36:33,Anonymous,"Not sure if it&#039;s on-topic, so delete it if it&#039;s not.<br><br>I&#039;ve heard that that Pixiv is going to shit, effective next month.<br>Does anyone have a backup? Does anyone doing one right now?<br>I didn&#039;t find anything on nya after a quick search.",1668584193,0,,pixiv-backup,88,7,"[{'no': 7033798, 'now': '12/08/22(Thu)01:24:03', 'name': 'Anonymous', 'com': '<a href=""#p6996127"" class=""quotelink"">&gt;&gt;6996127</a><br>Reports of original images getting shrunk, anyone else seeing it?<br><br>https://www.reddit.com/r/Pixiv/comm<wbr>ents/zcz059/fanbox_heavily_compress<wbr>ing_jpg_uploads/', 'time': 1670480643, 'resto': 6996127}, {'no': 7033810, 'now': '12/08/22(Thu)01:29:04', 'name': 'Anonymous', 'com': '<a href=""#p7033798"" class=""quotelink"">&gt;&gt;7033798</a><br>that&#039;s really stupid of them for two reasons. first of all if they are going to reencode images they might as well use webm or even avif to get much better quality for less file size. but mainly this will just make artists upload png instead of jpg, if png remains untouched.<br>so they will lose space/bandwidth on this move, since artists were &quot;kind enough&quot; to upload jpg before but are now forced to switch to png.', 'time': 1670480944, 'resto': 6996127}, {'no': 7037396, 'now': '12/10/22(Sat)05:13:12', 'name': 'Anonymous', 'com': 'nothing new to report on this?<br>new info or how many people that have switched platform, something like that', 'time': 1670667192, 'resto': 6996127}, {'no': 7037547, 'now': '12/10/22(Sat)07:59:25', 'name': 'Anonymous', 'com': '<a href=""#p7037396"" class=""quotelink"">&gt;&gt;7037396</a><br>https://fanbox.pixiv.help/hc/en-us/<wbr>articles/13004632640921', 'time': 1670677165, 'resto': 6996127}, {'no': 7040240, 'now': '12/11/22(Sun)19:02:16', 'name': 'Anonymous', 'com': '<a href=""#p7037547"" class=""quotelink"">&gt;&gt;7037547</a><br>so nothing new to report?', 'time': 1670803336, 'resto': 6996127}]",1670803336,Pixiv backup,picrandom,.png,1800.0,2000.0,225.0,250.0,1668584193443379.0,qmoSt+XC6GstMBMZOsFRcQ==,814293.0,,1.0,0.0,0.0,83.0,7.0,
80,7024479,,,12/02/22(Fri)12:56:14,GIFTEDASF,"I really liked the last thread so I&#039;m making another, murakami fans rejoice but most importantly mashou no nie 3 is a masterpiece!!!!",1670003774,0,,mashou-no-nie-3-2,58,43,"[{'no': 7039142, 'now': '12/11/22(Sun)04:34:51', 'name': 'Anonymous', 'com': '<a href=""#p7039130"" class=""quotelink"">&gt;&gt;7039130</a><br>The art is actually good desu<br>I just felt like he came here to advertise his self and then trashed on murakami&#039;s new work while adding nothing to the conversation.', 'filename': '671b04ecfd63c8ff1d60c328326a39bc5d023a91', 'ext': '.gif', 'w': 704, 'h': 596, 'tn_w': 125, 'tn_h': 105, 'tim': 1670751291333578, 'time': 1670751291, 'md5': 'ZdwT3lwAv2Bzf5Ei0bZ7qA==', 'fsize': 2821704, 'resto': 7024479}, {'no': 7039156, 'now': '12/11/22(Sun)04:46:51', 'name': 'Anonymous', 'com': '<a href=""#p7039142"" class=""quotelink"">&gt;&gt;7039142</a><br>Strange thing is I can&#039;t find his images anywhere on Google...', 'time': 1670752011, 'resto': 7024479}, {'no': 7039709, 'now': '12/11/22(Sun)12:53:46', 'name': 'Anonymous', 'com': '<a href=""#p7039156"" class=""quotelink"">&gt;&gt;7039156</a> that&#039;s because you have to go to rule34, gelbooru and type murakami_teruaki and I make most of these gifs myself', 'filename': 'Screenshot (811)', 'ext': '.png', 'w': 1366, 'h': 768, 'tn_w': 125, 'tn_h': 70, 'tim': 1670781226069664, 'time': 1670781226, 'md5': 'Y4snqrene6J+tSv/fTYZ7g==', 'fsize': 1026093, 'resto': 7024479, 'm_img': 1}, {'no': 7040040, 'now': '12/11/22(Sun)17:00:55', 'name': 'Anonymous', 'com': 'I was bored', 'filename': 'Mashou no nie Iris 2', 'ext': '.jpg', 'w': 3200, 'h': 5040, 'tn_w': 79, 'tn_h': 125, 'tim': 1670796055692358, 'time': 1670796055, 'md5': 'zWSERCoEV3jS7NMY0LDjMQ==', 'fsize': 3372785, 'resto': 7024479, 'm_img': 1}, {'no': 7040221, 'now': '12/11/22(Sun)18:52:37', 'name': 'Anonymous', 'com': '<a href=""#p7040040"" class=""quotelink"">&gt;&gt;7040040</a><br>Amazing work on the collage<br>Gotta love iris', 'filename': 'Screenshot_20221211-185040~2', 'ext': '.png', 'w': 1080, 'h': 1097, 'tn_w': 123, 'tn_h': 125, 'tim': 1670802757971419, 'time': 1670802757, 'md5': 'b3JHYfXG4xzud5M7e0t74w==', 'fsize': 1371476, 'resto': 7024479, 'm_img': 1}]",1670802757,Mashou no nie 3 #2,20221202_125602_578,.jpg,720.0,1024.0,175.0,250.0,1670003774859417.0,qdvg1d2nD0JsXK5jf6rpLA==,561640.0,,,0.0,0.0,53.0,39.0,
81,7034822,,,12/08/22(Thu)17:14:17,Anonymous,"ITT post couples getting each other nice and ready with kisses, licks, nibbles, massages, or anything pleasurable that doesn&#039;t involve penetration.",1670537657,0,,foreplay-thread,36,33,"[{'no': 7040175, 'now': '12/11/22(Sun)18:30:50', 'name': 'Anonymous', 'filename': '1670502437907166', 'ext': '.jpg', 'w': 744, 'h': 1052, 'tn_w': 88, 'tn_h': 125, 'tim': 1670801450255982, 'time': 1670801450, 'md5': 'Nu18MHfSZ5mr6s8Sq0/fbA==', 'fsize': 297081, 'resto': 7034822, 'm_img': 1}, {'no': 7040179, 'now': '12/11/22(Sun)18:33:06', 'name': 'Anonymous', 'filename': '1670665961050550', 'ext': '.gif', 'w': 757, 'h': 1024, 'tn_w': 92, 'tn_h': 125, 'tim': 1670801586139329, 'time': 1670801586, 'md5': 'nb/7orSLFDlokTyJQ3Poaw==', 'fsize': 3769653, 'resto': 7034822}, {'no': 7040182, 'now': '12/11/22(Sun)18:35:13', 'name': 'Anonymous', 'com': 'glory holes probably shouldn&#039;t count, but...', 'filename': 'foEMLm6', 'ext': '.jpg', 'w': 1000, 'h': 842, 'tn_w': 125, 'tn_h': 105, 'tim': 1670801713257723, 'time': 1670801713, 'md5': 'yNjQYP/9Lulz54eP3WPTHA==', 'fsize': 196735, 'resto': 7034822}, {'no': 7040193, 'now': '12/11/22(Sun)18:40:14', 'name': 'Anonymous', 'com': '<a href=""#p7040182"" class=""quotelink"">&gt;&gt;7040182</a><br>...I was going to make up for it with a nice webm, but apparently my chad filesize is too big for either the website or my non-user status<br><br>have an something I forgot about earlier instead', 'filename': '1657000871559', 'ext': '.png', 'w': 1500, 'h': 1589, 'tn_w': 117, 'tn_h': 125, 'tim': 1670802014409465, 'time': 1670802014, 'md5': 'xmhZG0xr+x3IrYxLsfxUOA==', 'fsize': 1575733, 'resto': 7034822, 'm_img': 1}, {'no': 7040204, 'now': '12/11/22(Sun)18:43:11', 'name': 'Anonymous', 'com': '<a href=""#p7040193"" class=""quotelink"">&gt;&gt;7040193</a><br><span class=""quote"">&gt;have an something</span><br>guys I swear I&#039;m normal this doesn&#039;t usually happen to me', 'filename': '1659318546247923', 'ext': '.png', 'w': 1700, 'h': 1900, 'tn_w': 111, 'tn_h': 125, 'tim': 1670802191801404, 'time': 1670802191, 'md5': '3EhBZMOQvc9KkxP6jvW+lw==', 'fsize': 3024206, 'resto': 7034822, 'm_img': 1}]",1670802191,Foreplay thread,mlem,.gif,560.0,420.0,250.0,187.0,1670537657257327.0,mjkLdrzUj71fQ9mwTq+D0w==,2063406.0,,,0.0,0.0,31.0,28.0,
82,6929976,,,10/19/22(Wed)00:57:46,Anonymous,booooba<br><br>Morrigan simp checking in,1666155466,0,,fighting-game-girls,95,92,"[{'no': 7037018, 'now': '12/09/22(Fri)23:32:09', 'name': 'Anonymous', 'filename': 'FYrNqtsaAAAUIzL', 'ext': '.jpg', 'w': 881, 'h': 945, 'tn_w': 116, 'tn_h': 125, 'tim': 1670646729727506, 'time': 1670646729, 'md5': 'zKQ59RIfEcpe2FztDOXKRw==', 'fsize': 247003, 'resto': 6929976}, {'no': 7037376, 'now': '12/10/22(Sat)04:48:23', 'name': 'Anonymous', 'com': 'Capcom-certified Chun-li nudity from Street Fighter 2 The Animated Movie.', 'filename': 'Chun-liShower', 'ext': '.gif', 'w': 656, 'h': 368, 'tn_w': 125, 'tn_h': 70, 'tim': 1670665703474254, 'time': 1670665703, 'md5': '45Yz+qh/FiLBbQBbiv1NWQ==', 'fsize': 3413304, 'resto': 6929976}, {'no': 7040166, 'now': '12/11/22(Sun)18:28:41', 'name': 'Anonymous', 'com': 'BUMP<br><br>Fighting games do have the best girls fr', 'filename': 'ram anal', 'ext': '.jpg', 'w': 700, 'h': 989, 'tn_w': 88, 'tn_h': 125, 'tim': 1670801321089370, 'time': 1670801321, 'md5': 'OuVKMYJSy7r/QdLPTj2S7A==', 'fsize': 331904, 'resto': 6929976}, {'no': 7040170, 'now': '12/11/22(Sun)18:29:50', 'name': 'Anonymous', 'filename': 'nine anal 2', 'ext': '.png', 'w': 1374, 'h': 1800, 'tn_w': 95, 'tn_h': 125, 'tim': 1670801390383859, 'time': 1670801390, 'md5': 'AzF2znwVpWMXddpiG4viCg==', 'fsize': 1133116, 'resto': 6929976, 'm_img': 1}, {'no': 7040174, 'now': '12/11/22(Sun)18:30:23', 'name': 'Anonymous', 'filename': 'Nine anal', 'ext': '.png', 'w': 1577, 'h': 1690, 'tn_w': 116, 'tn_h': 125, 'tim': 1670801423217408, 'time': 1670801423, 'md5': 'J6Zov+10lPwhRdwPcRKYwg==', 'fsize': 1526871, 'resto': 6929976, 'm_img': 1}]",1670801423,Fighting Game Girls,52718583c0aab6848e9b7330758e9ed0,.jpg,3950.0,4373.0,225.0,250.0,1666155466308370.0,UnGFg8CqtoSOm3MwdY6e0A==,2407199.0,,1.0,0.0,0.0,90.0,87.0,
