,no,sticky,closed,now,name,com,time,resto,capcode,semantic_url,replies,images,last_replies,last_modified,sub,filename,ext,w,h,tn_w,tn_h,tim,md5,fsize,bumplimit,imagelimit,omitted_posts,omitted_images
0,886269,1.0,1.0,05/14/14(Wed)09:36:39,Anonymous,"<font size='4'>/hm/ is for sharing porn.</font><br><br>People posting new threads should post several images (6+) to get the thread started. Don&#039;t just post one image and expect other people to do the work of making a successful thread.<br><br>Hookup, camwhore, and &#039;rate me&#039; threads should go on <a href=""https://boards.4chan.org/soc/"">/soc/</a>.<br>Advice threads should go on <a href=""https://boards.4chan.org/adv/"">/adv/</a>. (work-safe).<br>Discussion of LGBT topics should go on <a href=""https://boards.4chan.org/lgbt/"">/lgbt/</a>. (work-safe).<br>Requests for sources, or more images should go on <a href=""https://boards.4chan.org/r/"">/r/</a>.",1400074599,0,mod,hm-is-for-sharing-porn,1,0,"[{'no': 1299359, 'now': '01/20/16(Wed)10:21:11', 'name': 'Anonymous', 'com': '<p style=""font-size:16px;"">Do not post any &#039;rate me&#039; or any other self shots here. If you want to post pictures of <b>yourself</b>, please use <a href=""https://boards.4chan.org/soc/"">/soc/ - Cams &amp; Meetups</a>.</p>', 'time': 1453303271, 'resto': 886269, 'capcode': 'mod'}]",1453303287,,,,,,,,,,,,,,
1,2482410,,,12/11/22(Sun)02:30:08,Anonymous,Did you know Sergeant Miles went to jail over the January 6th insurrection? I didn&#039;t know he was an evil nazi chud that didn&#039;t support our overlord pedo Biden. I for one know that i will no longer masturbate to him. Gay men should honestly not be allowed to have any ideology that isn&#039;t being a democrat purse chihuahua. How dare a gay men reject BLM? don&#039;t gays love getting beaten to death by blacks? How dare gays not like feminists wishing all men dead and claiming gay men want to rape women? <br><br>Nothing more despicable and disgusting than a gay right leaning man.,1670743808,0,,i-am-literally-shaking-and-crying-right-now,18,6,"[{'no': 2482494, 'now': '12/11/22(Sun)05:49:28', 'name': 'Anonymous', 'com': '<a href=""#p2482410"" class=""quotelink"">&gt;&gt;2482410</a><br>I bet you even deleted your twitter account, didn&#039;t you?', 'time': 1670755768, 'resto': 2482410}, {'no': 2482498, 'now': '12/11/22(Sun)06:02:07', 'name': 'Anonymous', 'com': '<a href=""#p2482494"" class=""quotelink"">&gt;&gt;2482494</a><br><br>Yes Elon Musk is an evil chud.', 'time': 1670756527, 'resto': 2482410}, {'no': 2482502, 'now': '12/11/22(Sun)06:29:08', 'name': 'Anonymous', 'com': '<a href=""#p2482498"" class=""quotelink"">&gt;&gt;2482498</a><br>He cute', 'filename': 'Air Force is looking into how to handle Elon Musk&#039;s pot smoking', 'ext': '.jpg', 'w': 1910, 'h': 1000, 'tn_w': 125, 'tn_h': 65, 'tim': 1670758148063934, 'time': 1670758148, 'md5': 'FNsE0HrBzJ9+k3cB7VQSFQ==', 'fsize': 74558, 'resto': 2482410}, {'no': 2482513, 'now': '12/11/22(Sun)07:03:29', 'name': 'Anonymous', 'com': '<a href=""#p2482502"" class=""quotelink"">&gt;&gt;2482502</a><br>Lmao fuck not, he&#039;s the type of a man only a greasy str*ight w*man would find attractive', 'time': 1670760209, 'resto': 2482410}, {'no': 2482514, 'now': '12/11/22(Sun)07:12:27', 'name': 'Anonymous', 'com': '<a href=""#p2482513"" class=""quotelink"">&gt;&gt;2482513</a><br><br>This. He&#039;s pretty ugly. Only hot thing about him is that he probably fucks his sons. Shame he didn&#039;t fuck the tranny son enough to stop him from hating being a man and choping his cock.-', 'time': 1670760747, 'resto': 2482410}]",1670760747,I am literally shaking and crying right now,Sergeant_Miles-cvr,.jpg,745.0,470.0,250.0,157.0,1670743808035948.0,jN6haZfFT/GXn/+3+p0+Hg==,229105.0,0.0,0.0,13.0,5.0
2,2479968,,,12/04/22(Sun)14:07:27,Anonymous,Post your stories and experiences fucking and getting fucked.,1670180847,0,,stories-experiences-thread,41,5,"[{'no': 2482215, 'now': '12/10/22(Sat)17:05:17', 'name': 'Anonymous', 'com': 'does anyone have experience getting topped by a femboy', 'time': 1670709917, 'resto': 2479968}, {'no': 2482323, 'now': '12/10/22(Sat)20:28:41', 'name': 'Anonymous', 'com': '<a href=""#p2482215"" class=""quotelink"">&gt;&gt;2482215</a><br>god I fucking wish', 'time': 1670722121, 'resto': 2479968}, {'no': 2482505, 'now': '12/11/22(Sun)06:37:58', 'name': 'Anonymous', 'com': '<span class=""quote"">&gt;Be me 22 year old closeted bi been to sauna 2 times before </span><br><span class=""quote"">&gt;Quite fit by standards there get a lot of attention</span><br><span class=""quote"">&gt;Enjoy pretty much anon orgy like sex </span><br><span class=""quote"">&gt; First 2 times only oral but this time cleaned and shaved ass </span><br><span class=""quote"">&gt;Go into darkroom and start playing with this latino guys cock and hes touching mine</span><br><span class=""quote"">&gt;Start sucking his cock to turn away from this older guy trying to join in</span><br><span class=""quote"">&gt;Older guy tries to join in quite forcefully just stars playing with my ass kissing while I have him down my throat </span><br><span class=""quote"">&gt;Latino guy not as turned on anymore so leaves and then I think I made a quick escape from older guy by exploring deeper where the room are</span><br><span class=""quote"">&gt; By the time I get to the deepest bit of the sauna theres TVs on loads of walls playing porn with massive cocks and I have a few guys including the older one who followed me to next to this bench</span><br><span class=""quote"">&gt;Start off having my cock sucked by this fit shaved head bear and some other slightly arab guy starts to share it </span><br><span class=""quote"">&gt;The older guy made his way behind me and started finger fucking my ass at the same time and it was amazing thought I was going to cum a few times was almost out of body it felt like how sex would feel if life was actually porn</span><br><span class=""quote"">&gt;They then swap and Im bent over on this bench sucking their cocks while this older guy is trying to fuck me but hes tiny why I wasnt interested </span><br><span class=""quote"">&gt;The guys sucking my cock then lead me to a room with a swing and close the door behind the older guy </span><br><span class=""quote"">&gt;They ask what position I am so I say I dont mind and they push me to the floor so am on my knees with this thick 4 and a half and a slighly slimmer 6-7 inch cock </span><br><span class=""quote"">&gt;I suck them both deepthroating and teasing the tip running my tongue round it stroking the other as I switch while they are kissing</span><br><span class=""quote"">&gt;One if them tells me to get on the swing and the thicker one goes behind me first and I got on the wrong way which didnt help</span><br><span class=""quote"">&gt;He pushes it in and its the first thing Ive taken much bigger than a finger that day so it hurt but I just tried to take it</span>', 'time': 1670758678, 'resto': 2479968}, {'no': 2482511, 'now': '12/11/22(Sun)06:53:12', 'name': 'Anonymous', 'com': '<span class=""quote"">&gt;He starts fucking me a bit too hard but the other guy has come round so Im trying not to choke on his cock or throw up as he fucks my throat</span><br><span class=""quote"">&gt;Then what I was looking forward to they switch</span><br><span class=""quote"">&gt;The guy with the longer cock starts to fuck me and it going so deep but its more manageable to take</span><br><span class=""quote"">&gt; Im leaking precum all over the swing and myself while hes fucking me balls deep </span><br><span class=""quote"">&gt;He has me moaning like a slut for his cock and eventually builds up speed and his cock is diamonds at this point</span><br><span class=""quote"">&gt;I was that horny nearly came without touching my cock but it starts pulsing inside me and he just thursts hard and cums in my ass</span><br><span class=""quote"">&gt;Then they both kiss and say how they liked watching each other fuck and the longer guy leaves</span><br><span class=""quote"">&gt;The bald guy with the thick cock stays though and were kissing and I start to suck him again</span><br><span class=""quote"">&gt;He gets a lot more rough chocking me and fucking my ass hard as Im calling him daddy </span><br><span class=""quote"">&gt;One of the best fucks Ive ever had he just used me </span><br><span class=""quote"">&gt;Walked around a bit mor and ended up fucking this guy but he made me use a condom</span><br><span class=""quote"">&gt;Hadn’t been fucked for like a year or two before then and now I have two meets with hung dom daddies both around 50 who want to breed me </span><br><span class=""quote"">&gt;Can post update meeting one today</span>', 'time': 1670759592, 'resto': 2479968}, {'no': 2482512, 'now': '12/11/22(Sun)06:59:22', 'name': 'Anonymous', 'com': '<a href=""#p2479971"" class=""quotelink"">&gt;&gt;2479971</a><br>biscum are not a real sexuality.', 'time': 1670759962, 'resto': 2479968}]",1670759962,"Stories, experiences thread.",user12220342_69402619133f,.jpg,700.0,994.0,176.0,249.0,1670180847989909.0,7z+E2N5R3GMAGVr5mMkLlQ==,146702.0,0.0,0.0,36.0,5.0
3,2481784,,,12/09/22(Fri)09:29:30,Anonymous,"Straight men of /hm/, why do you visit here? Not asking confrontationally at all, just wondering what brings you to stop by sometimes.",1670596170,0,,straight-men-of-hm-why-do-you-visit-here-not,39,2,"[{'no': 2482441, 'now': '12/11/22(Sun)03:39:13', 'name': 'Anonymous', 'com': '<a href=""#p2482201"" class=""quotelink"">&gt;&gt;2482201</a><br>Why does the M2M sex gross you out as a female? Is it displaced envy or anger that the hot muscular attractive males are finding sexual pleasure among themselves (without serving female needs or desires), so selfish and wasteful of the true purpose of men? Is it the visuals or the idea or??? <br><br>Women are excluded here, but do you find the idea of 2 hot nubile women having sweaty pussy sex equally revolting?', 'time': 1670747953, 'resto': 2481784}, {'no': 2482447, 'now': '12/11/22(Sun)03:47:52', 'name': 'Anonymous', 'com': '<a href=""#p2482110"" class=""quotelink"">&gt;&gt;2482110</a><br><a href=""#p2482117"" class=""quotelink"">&gt;&gt;2482117</a><br><span class=""quote"">&gt;dissociate from women</span><br><span class=""quote"">&gt;abused by women</span><br>psychological or physical or sexual abuse ?', 'time': 1670748472, 'resto': 2481784}, {'no': 2482449, 'now': '12/11/22(Sun)03:49:34', 'name': 'Anonymous', 'com': '<a href=""#p2482423"" class=""quotelink"">&gt;&gt;2482423</a><br>mid af, twitter is more up your alley', 'time': 1670748574, 'resto': 2481784}, {'no': 2482509, 'now': '12/11/22(Sun)06:45:44', 'name': 'Anonymous', 'com': 'cock hot, girl hot, guy not', 'time': 1670759144, 'resto': 2481784}, {'no': 2482510, 'now': '12/11/22(Sun)06:51:17', 'name': 'Anonymous', 'com': '<a href=""#p2482423"" class=""quotelink"">&gt;&gt;2482423</a><br>Hairy daddy arms made for strong solacing hugs.', 'time': 1670759477, 'resto': 2481784}]",1670759477,,staringoutthewindowjpg,.jpg,624.0,960.0,162.0,250.0,1670596170834223.0,HE6uinbxKx67D8pjWSnxGw==,70537.0,0.0,0.0,34.0,2.0
4,2482507,,,12/11/22(Sun)06:40:22,Anonymous,The hottest takes of the war thread,1670758822,0,,the-hottest-takes-of-the-war-thread,1,1,"[{'no': 2482508, 'now': '12/11/22(Sun)06:44:33', 'name': 'Anonymous', 'filename': 'twd', 'ext': '.jpg', 'w': 978, 'h': 1280, 'tn_w': 95, 'tn_h': 125, 'tim': 1670759073657087, 'time': 1670759073, 'md5': 'YUpejCVGwv2oT/ijuHStFQ==', 'fsize': 186911, 'resto': 2482507}]",1670759073,,jke6787860flkkp35a1,.jpg,1604.0,1971.0,203.0,250.0,1670758822244457.0,lBst/f8fE0wQrkBrR5dgfQ==,646651.0,0.0,0.0,,
5,2476379,,,11/22/22(Tue)16:56:35,Anonymous,Twinks with huge donkey dicks,1669154195,0,,hung-twinks,72,51,"[{'no': 2481514, 'now': '12/08/22(Thu)17:44:16', 'name': 'Anonymous', 'filename': 'Yu1UwusG', 'ext': '.jpg', 'w': 1280, 'h': 960, 'tn_w': 125, 'tn_h': 93, 'tim': 1670539456571465, 'time': 1670539456, 'md5': 'H/Qf6uZd1PDl4zPuUy0sPw==', 'fsize': 232692, 'resto': 2476379}, {'no': 2481515, 'now': '12/08/22(Thu)17:46:00', 'name': 'Anonymous', 'com': '<a href=""#p2481494"" class=""quotelink"">&gt;&gt;2481494</a><br>perfect cock &lt;3 <br><br><a href=""#p2481505"" class=""quotelink"">&gt;&gt;2481505</a><br>hung and wears briefs, so sexy &lt;3', 'filename': 'FF1nSixXsAQ9eUM', 'ext': '.jpg', 'w': 1152, 'h': 2048, 'tn_w': 70, 'tn_h': 125, 'tim': 1670539560370929, 'time': 1670539560, 'md5': 'CRbFXXBY71/lkKw/PfT7jw==', 'fsize': 267503, 'resto': 2476379}, {'no': 2481872, 'now': '12/09/22(Fri)16:49:25', 'name': 'Anonymous', 'com': '<a href=""#p2476663"" class=""quotelink"">&gt;&gt;2476663</a> <br>No <br>Higher exposure to androgens inside the womb during pregnancy correlates with a bigger penis in males, as well as a more symmetrical and masculine face.', 'time': 1670622565, 'resto': 2476379}, {'no': 2482198, 'now': '12/10/22(Sat)15:51:38', 'name': 'Anonymous', 'com': '<a href=""#p2481872"" class=""quotelink"">&gt;&gt;2481872</a><br>post source', 'time': 1670705498, 'resto': 2476379}, {'no': 2482506, 'now': '12/11/22(Sun)06:38:01', 'name': 'Anonymous', 'com': '<a href=""#p2482198"" class=""quotelink"">&gt;&gt;2482198</a> <br>wikipedia, google &quot;index finger ratio&quot;.', 'time': 1670758681, 'resto': 2476379}]",1670758681,Hung twinks,1,.jpg,3024.0,4032.0,187.0,250.0,1669154195668094.0,YF9K1t/H+hVVGY1ar8c2JA==,1418069.0,0.0,0.0,67.0,49.0
6,2479569,,,12/03/22(Sat)02:46:41,Anonymous,"To stop all the source threads deleting good content, a general source thread is required. /r/ doesn&#039;t do gay shit and mods ban/delete individual source threads.<br><br>How to obtain your source:<br>1) Post your picture or description<br>2) Post what you want (name, company, etc)<br>3) Post any information you have (where/when the picture is from, etc)<br>4) Wait for a mars/hm/allow to help you and then say thanks.<br><br>Together we can stop the 404ing of good porn.<br><br>Please use image search (and common sense) before posting in this thread.<br><br>There is also a gay porn encyclopedia which can be found here: 95.31.3.127/pbc/Main_Page<br>It has a huge library of many different actors, studios, films and other information which you may find helpful.<br><br>Finally, please do not reply to users who ask for a source by creating their own thread. This removes porn from /hm/ and they should not be rewarded for their actions.<br><br>Previous thread:<br><a href=""/hm/thread/2469314#p2469314"" class=""quotelink"">&gt;&gt;2469314</a>",1670053601,0,,sauce-thread-dccxxiv-image-limit-reached-edition,133,63,"[{'no': 2482362, 'now': '12/10/22(Sat)22:25:11', 'name': 'Anonymous', 'com': 'Who are these guys? anyone have more of them?<br><br>https://milkyvideo.com/videos/2287/<wbr>loving-couple.html', 'filename': 'Sin título', 'ext': '.png', 'w': 600, 'h': 397, 'tn_w': 125, 'tn_h': 82, 'tim': 1670729111524528, 'time': 1670729111, 'md5': 'pmnj2VKUndbGw59jBdczWA==', 'fsize': 369694, 'resto': 2479569}, {'no': 2482363, 'now': '12/10/22(Sat)22:28:55', 'name': 'Anonymous', 'com': '<a href=""#p2482362"" class=""quotelink"">&gt;&gt;2482362</a><br>aznsub7', 'time': 1670729335, 'resto': 2479569}, {'no': 2482393, 'now': '12/11/22(Sun)00:56:12', 'name': 'Anonymous', 'com': 'Looking for a BDSM/scat vid that was on one of the tube sites a long time ago. Name of the video was Tough Shit and involved one guy laying on a bed or table and another farting and then shitting on his face. The sub was complaining like &#039;please dont shit on my face&#039; and the top said &#039;tough shit&#039;. I think one of the guys had a tattoo in Greek or another language.', 'time': 1670738172, 'resto': 2479569}, {'no': 2482501, 'now': '12/11/22(Sun)06:24:01', 'name': 'Anonymous', 'com': 'Looking for the full movie for this https://thegay.com/videos/791753/wa<wbr>lter-soares/', 'filename': '4CF58EEC-39E2-4E83-BF4B-6D3893D97E93', 'ext': '.jpg', 'w': 828, 'h': 605, 'tn_w': 125, 'tn_h': 91, 'tim': 1670757841382018, 'time': 1670757841, 'md5': 'HVLnhPoVpr5fg01TjJ7ZvQ==', 'fsize': 245352, 'resto': 2479569}, {'no': 2482504, 'now': '12/11/22(Sun)06:33:24', 'name': 'Anonymous', 'com': '<a href=""#p2482086"" class=""quotelink"">&gt;&gt;2482086</a><br>Ok so I’m not looking to torrent I’m looking to see if they made anything new what happen to the Jimmy Z site lol', 'time': 1670758404, 'resto': 2479569}]",1670758404,Sauce Thread DCCXXIV : image limit reached edition,1670049264307795,.jpg,3024.0,4032.0,187.0,250.0,1670053601505796.0,xbT+7ay6Uh21oMBUg/uuqQ==,1138922.0,0.0,0.0,128.0,61.0
7,2480592,,,12/06/22(Tue)00:17:54,Anonymous,"Previous thread, which on Page 3 less than 12 hours ago:<br><br>Ukrainian Chads - Presidential Posturing edition Anonymous 08/25/22(Thu)02:27:38 No.2444753<br><a href=""/hm/thread/2444753#p2444753"" class=""quotelink"">&gt;&gt;2444753</a><br><br>Gym Bunny Zelensky in his 30s:<br>Ze Kubiki<br>https://www.youtube.com/channel/UCt<wbr>caCsiReQbyUKsgnZ9p2NQ/videos",1670303874,0,,zelensky-thirst-ukrainian-chads-thread-leer,27,16,"[{'no': 2481750, 'now': '12/09/22(Fri)06:34:12', 'name': 'Anonymous', 'com': '<a href=""#p2481729"" class=""quotelink"">&gt;&gt;2481729</a><br>Wow. Are there more videos like this?', 'time': 1670585652, 'resto': 2480592}, {'no': 2481900, 'now': '12/09/22(Fri)18:12:41', 'name': 'Anonymous', 'com': '<a href=""#p2481665"" class=""quotelink"">&gt;&gt;2481665</a>', 'filename': 'Members of the band Antytila, singer and bandleader Taras Topolia (centre), keyboardist Serhii Vusyk (left), and guitarist Dmytro Zholud (right) pose on the frontlines in Kyiv', 'ext': '.jpg', 'w': 962, 'h': 641, 'tn_w': 125, 'tn_h': 83, 'tim': 1670627561319543, 'time': 1670627561, 'md5': 'S1B36WR9fNIxJY48pzI8VQ==', 'fsize': 249268, 'resto': 2480592}, {'no': 2481906, 'now': '12/09/22(Fri)18:34:49', 'name': 'Anonymous', 'com': '<a href=""#p2481750"" class=""quotelink"">&gt;&gt;2481750</a><br>Yes they&#039;re on markipliers OF page.<br><br>Oh wait, it got deleted. Nevermind.', 'time': 1670628889, 'resto': 2480592}, {'no': 2482196, 'now': '12/10/22(Sat)15:44:03', 'name': 'Anonymous', 'com': '<a href=""#p2480592"" class=""quotelink"">&gt;&gt;2480592</a><br>As much as I appreciate a handsome man in uniform even if it&#039;s costume, there is something about the REAL thing even if the guy is a wreck, a real swat team member in real gear with a real gun, a real firefigher with soot his uniform straigt out of a fiery building, and a soldier in the aftermath of a battle, that heavy metal stuff gets me in my lizard brain.', 'filename': 'Major Vadym Voroshylov was awarded the medal &#039;Hero of Ukraine&#039; after ejecting from his MiG fighter jet following a tense battle with Russian drone', 'ext': '.jpg', 'w': 634, 'h': 793, 'tn_w': 99, 'tn_h': 125, 'tim': 1670705043468106, 'time': 1670705043, 'md5': '605RDLohJUM2UxHWynMoUw==', 'fsize': 197563, 'resto': 2480592}, {'no': 2482503, 'now': '12/11/22(Sun)06:33:09', 'name': 'Anonymous', 'com': '<a href=""#p2480592"" class=""quotelink"">&gt;&gt;2480592</a>', 'filename': 'Alex cultivating potatoes', 'ext': '.jpg', 'w': 3456, 'h': 2592, 'tn_w': 125, 'tn_h': 93, 'tim': 1670758389768099, 'time': 1670758389, 'md5': 'lj+npwD0+WCGw1+4N+sTkg==', 'fsize': 1884358, 'resto': 2480592}]",1670758389,Zelensky thirst / Ukrainian Chads thread - Leer Edition,zelenskyand someukrainianchads,.jpg,1043.0,695.0,250.0,166.0,1670303874156181.0,JyzsbBdI0kHstdv5FYmT0w==,147599.0,0.0,0.0,22.0,13.0
8,2453109,,,09/23/22(Fri)11:58:21,Anonymous,New chastity thread. Post locked guys. Talk about cages. Etc.,1663948701,0,,chastity-thread,263,123,"[{'no': 2481782, 'now': '12/09/22(Fri)09:15:00', 'name': 'Anonymous', 'com': 'Here to please', 'filename': '3A40CC07-68DC-4E44-BC25-F12D962241B2', 'ext': '.gif', 'w': 260, 'h': 319, 'tn_w': 101, 'tn_h': 125, 'tim': 1670595300690737, 'time': 1670595300, 'md5': 'CczKatpjzqL7U6OzkvBXlQ==', 'fsize': 4875734, 'resto': 2453109}, {'no': 2482122, 'now': '12/10/22(Sat)09:00:23', 'name': 'Anonymous', 'filename': '59 (2)', 'ext': '.jpg', 'w': 2344, 'h': 3670, 'tn_w': 79, 'tn_h': 125, 'tim': 1670680823012686, 'time': 1670680823, 'md5': '+6JVooMX97yVxEiX1d2Prg==', 'fsize': 899047, 'resto': 2453109}, {'no': 2482168, 'now': '12/10/22(Sat)14:13:24', 'name': 'Anonymous', 'filename': 'wj14hgxenl4a1', 'ext': '.jpg', 'w': 2316, 'h': 3088, 'tn_w': 93, 'tn_h': 125, 'tim': 1670699604962875, 'time': 1670699604, 'md5': 'camkrsmu8RieKzCySZOPiQ==', 'fsize': 805577, 'resto': 2453109}, {'no': 2482469, 'now': '12/11/22(Sun)04:53:35', 'name': 'Anonymous', 'filename': '1583777893622', 'ext': '.jpg', 'w': 500, 'h': 667, 'tn_w': 93, 'tn_h': 124, 'tim': 1670752415730963, 'time': 1670752415, 'md5': 'XPpWIhJ7vcA1UjXXNk8dNQ==', 'fsize': 84618, 'resto': 2453109}, {'no': 2482500, 'now': '12/11/22(Sun)06:17:01', 'name': 'Anonymous', 'com': 'OC. 1 week locked and plugged. Many more to go', 'filename': 'photo_2022-12-11_12-15-26', 'ext': '.jpg', 'w': 1280, 'h': 720, 'tn_w': 125, 'tn_h': 70, 'tim': 1670757421311651, 'time': 1670757421, 'md5': 'rkkh1trQ9jWQj7on0PAtiQ==', 'fsize': 99673, 'resto': 2453109}]",1670757421,Chastity thread,bdsmlr-34238-WDCmzWYxUS,.jpg,1153.0,2048.0,140.0,250.0,1663948701178037.0,8oOWa9o3xyLuvGMcKBIh2A==,484549.0,0.0,0.0,258.0,118.0
9,2456849,,,10/04/22(Tue)18:37:36,Anonymous,,1664923056,0,,moar-christian-boys,136,98,"[{'no': 2482359, 'now': '12/10/22(Sat)22:19:47', 'name': 'Anonymous', 'com': '<span class=""quote"">&gt;&quot;memento mori&quot; gigachad</span><br><br>cemetery meditation time', 'filename': 'muscle alpha jock bro hung bwc Christian 7290020', 'ext': '.jpg', 'w': 495, 'h': 750, 'tn_w': 82, 'tn_h': 125, 'tim': 1670728787334816, 'time': 1670728787, 'md5': '582Rk5T8k+os77BTmJIFzg==', 'fsize': 177978, 'resto': 2456849}, {'no': 2482478, 'now': '12/11/22(Sun)05:21:56', 'name': 'Anonymous', 'com': 'I had a high-school buddy who was a laid-back surfer type. He said he wanted to be a priest. After the beach once I was recovering from sunburn, laying on the sofa in the &quot;rumpus / sport&quot; room at his girlfriend&#039;s house. There was a shower in the room with a weirdly-short (half-way) shower curtain. He showered and made no attempt to hide his thick cut cock and bushy pubes facing me the whole time, below the short shower curtain.', 'filename': 'th-3656612146', 'ext': '.jpg', 'w': 474, 'h': 286, 'tn_w': 125, 'tn_h': 75, 'tim': 1670754116320830, 'time': 1670754116, 'md5': 'YqBMn2lOTOn6yFog1xZMqw==', 'fsize': 16591, 'resto': 2456849}, {'no': 2482482, 'now': '12/11/22(Sun)05:29:09', 'name': 'Anonymous', 'com': 'At high-school I was in Christian youth group. A senior from youth group was a champion swimmer. At the swimming carnival he wore his Speedo with his dick in the &quot;pointing up&quot; position.', 'filename': 'th-2777123176', 'ext': '.jpg', 'w': 474, 'h': 470, 'tn_w': 125, 'tn_h': 123, 'tim': 1670754549164839, 'time': 1670754549, 'md5': 'BqVgrin+zIyTvI9Ah2KVNg==', 'fsize': 43235, 'resto': 2456849}, {'no': 2482484, 'now': '12/11/22(Sun)05:30:30', 'name': 'Anonymous', 'com': 'As a high-schooler I had a church buddy a few years older than me. He told me he felt as if the devil was tempting him whenever he got a hard-on. When we hung out he would wear short shorts that showed a fat bulge and often sat slouched in the lounge chair, legs spread. I was in love with him.', 'filename': 'th-758180382', 'ext': '.jpg', 'w': 474, 'h': 606, 'tn_w': 97, 'tn_h': 125, 'tim': 1670754630384424, 'time': 1670754630, 'md5': '6RlHqw2xzs+Rou7COJQoUA==', 'fsize': 31627, 'resto': 2456849}, {'no': 2482499, 'now': '12/11/22(Sun)06:07:06', 'name': 'Anonymous', 'com': 'I was in love with Michael J Fox', 'filename': 'th-1290259774', 'ext': '.jpg', 'w': 474, 'h': 697, 'tn_w': 85, 'tn_h': 125, 'tim': 1670756826488877, 'time': 1670756826, 'md5': 'mM5XQaASm2l2ABUJ3JC2qA==', 'fsize': 34376, 'resto': 2456849}]",1670756826,Moar Christian Boys,nn,.png,720.0,1177.0,152.0,250.0,1664923056444229.0,gULPIlQ2g5eQb6y0Zwy/RA==,1119658.0,0.0,0.0,131.0,93.0
10,2477392,,,11/26/22(Sat)00:00:45,Anonymous,The best type of cock,1669438845,0,,bwc,112,71,"[{'no': 2480140, 'now': '12/05/22(Mon)03:38:31', 'name': 'Anonymous', 'com': '<a href=""#p2477449"" class=""quotelink"">&gt;&gt;2477449</a><br>Beautiful...I would never stop worshipping that...', 'time': 1670229511, 'resto': 2477392}, {'no': 2480648, 'now': '12/06/22(Tue)04:04:20', 'name': 'Anonymous', 'com': '<a href=""#p2477449"" class=""quotelink"">&gt;&gt;2477449</a><br>Thick asf dick/head and beautiful ridge along underside of shaft hnnnggg', 'time': 1670317460, 'resto': 2477392}, {'no': 2480895, 'now': '12/06/22(Tue)23:01:11', 'name': 'Anonymous', 'com': '<a href=""#p2479116"" class=""quotelink"">&gt;&gt;2479116</a><br>source', 'time': 1670385671, 'resto': 2477392}, {'no': 2481702, 'now': '12/09/22(Fri)02:15:42', 'name': 'Anonymous', 'com': '<a href=""#p2479847"" class=""quotelink"">&gt;&gt;2479847</a><br>that&#039;s metric', 'time': 1670570142, 'resto': 2477392}, {'no': 2482497, 'now': '12/11/22(Sun)06:00:43', 'name': 'Anonymous', 'filename': 'ZhPkQE', 'ext': '.jpg', 'w': 1808, 'h': 3216, 'tn_w': 70, 'tn_h': 124, 'tim': 1670756443847912, 'time': 1670756443, 'md5': '/0pwdYghCHylBIJVcKMfxQ==', 'fsize': 654240, 'resto': 2477392}]",1670756443,BWC,244B2254-B61F-43E1-A1F1-03A92A960005,.png,1524.0,1837.0,207.0,250.0,1669438845643930.0,uQRyMqNJlGv1YcjNy+Zmyw==,4057882.0,0.0,0.0,107.0,70.0
