,no,sticky,closed,now,name,com,time,resto,capcode,semantic_url,replies,images,last_replies,last_modified,sub,filename,ext,w,h,tn_w,tn_h,tim,md5,fsize,bumplimit,imagelimit,omitted_posts,omitted_images
102,2478212,,,11/28/22(Mon)06:08:35,Anonymous,,1669633715,0,,little-cock,28,16,"[{'no': 2480404, 'now': '12/05/22(Mon)18:04:34', 'name': 'Anonymous', 'com': '<a href=""#p2478452"" class=""quotelink"">&gt;&gt;2478452</a><br>Maybe it’s about geography but I feel like I encounter far more “oversized” cocks (7.5+) than small cocks (under 6”)', 'time': 1670281474, 'resto': 2478212}, {'no': 2481090, 'now': '12/07/22(Wed)14:53:44', 'name': 'Anonymous', 'filename': 'Snapchat-486427887', 'ext': '.jpg', 'w': 720, 'h': 1516, 'tn_w': 59, 'tn_h': 125, 'tim': 1670442824403379, 'time': 1670442824, 'md5': 'j23i8n7gHXyQA09bS+tt6g==', 'fsize': 348598, 'resto': 2478212}, {'no': 2482552, 'now': '12/11/22(Sun)10:12:51', 'name': 'Anonymous', 'filename': 'cock', 'ext': '.jpg', 'w': 2047, 'h': 2087, 'tn_w': 122, 'tn_h': 125, 'tim': 1670771571326909, 'time': 1670771571, 'md5': 'fBvRJbwa8eprkksaqruYnQ==', 'fsize': 567177, 'resto': 2478212}, {'no': 2482553, 'now': '12/11/22(Sun)10:13:36', 'name': 'Anonymous', 'filename': 'soft', 'ext': '.jpg', 'w': 1918, 'h': 2228, 'tn_w': 107, 'tn_h': 125, 'tim': 1670771616080759, 'time': 1670771616, 'md5': 'dfrN9FLGLjm12/1wZV8pEA==', 'fsize': 628321, 'resto': 2478212}, {'no': 2482606, 'now': '12/11/22(Sun)14:19:18', 'name': 'Anonymous', 'com': '<a href=""#p2478212"" class=""quotelink"">&gt;&gt;2478212</a><br>I don&#039;t care what you want me to call it, I want it down my throat and in my ass right now! Great cock!', 'time': 1670786358, 'resto': 2478212}]",1670786358,Little cock,20221128_120033,.jpg,4032.0,2268.0,250.0,140.0,1669633715815342.0,uVGtNsKSgG0K2vDEViIrQg==,1148316.0,0.0,0.0,23.0,13.0
103,2478009,,,11/27/22(Sun)17:50:50,Anonymous,"<a href=""/hm/thread/2437794#p2437794"" class=""quotelink"">&gt;&gt;2437794</a><br>Last thread continued here",1669589450,0,,muscle-men-2,60,36,"[{'no': 2481195, 'now': '12/07/22(Wed)19:06:24', 'name': 'Anonymous', 'com': '<a href=""#p2481193"" class=""quotelink"">&gt;&gt;2481193</a>', 'filename': 'kingwank2', 'ext': '.jpg', 'w': 800, 'h': 600, 'tn_w': 125, 'tn_h': 93, 'tim': 1670457984886265, 'time': 1670457984, 'md5': '2HVMoQ+Pk1GOttEUvIGvmg==', 'fsize': 249864, 'resto': 2478009}, {'no': 2481331, 'now': '12/08/22(Thu)03:34:22', 'name': 'Anonymous', 'filename': 'B7297C55-2A86-4BBD-90B7-E2877D2C43BA', 'ext': '.png', 'w': 1080, 'h': 1350, 'tn_w': 100, 'tn_h': 125, 'tim': 1670488462084345, 'time': 1670488462, 'md5': 'ub5YlHWa8Sntmeg7VD1fvQ==', 'fsize': 1916116, 'resto': 2478009}, {'no': 2481628, 'now': '12/08/22(Thu)23:50:54', 'name': 'Anonymous', 'com': '<a href=""#p2478170"" class=""quotelink"">&gt;&gt;2478170</a><br>so hot', 'time': 1670561454, 'resto': 2478009}, {'no': 2481631, 'now': '12/08/22(Thu)23:54:29', 'name': 'Anonymous', 'filename': 'tumblr_2f74cedaa3c958aa3b35eb62c66e7c7d_3e1171a2_1280', 'ext': '.jpg', 'w': 1280, 'h': 717, 'tn_w': 125, 'tn_h': 70, 'tim': 1670561669730809, 'time': 1670561669, 'md5': '6C0MgR++5wncSDZNA9ehQg==', 'fsize': 77678, 'resto': 2478009}, {'no': 2482598, 'now': '12/11/22(Sun)13:51:13', 'name': 'Anonymous', 'com': '<a href=""#p2481331"" class=""quotelink"">&gt;&gt;2481331</a><br><a href=""#p2481631"" class=""quotelink"">&gt;&gt;2481631</a><br>FFFFFFuuuuck me', 'time': 1670784673, 'resto': 2478009}]",1670784673,Muscle Men 2,1659563272871907,.jpg,460.0,633.0,181.0,250.0,1669589450334300.0,NFyZ5TfQF9KuKxGYb7R+YQ==,32357.0,0.0,0.0,55.0,33.0
104,2461389,,,10/17/22(Mon)13:58:13,Anonymous,Looking for reference to use for art practice and /ic/ hates anything that doesn&#039;t have big tits or look like it&#039;s 11.<br><br>Honestly even erotic male paintings would be great to study.,1666029493,0,,artsyartistic-erotic-nudes-thread,118,106,"[{'no': 2480359, 'now': '12/05/22(Mon)17:15:20', 'name': 'Anonymous', 'com': 'Nick Sandell has good stuff', 'filename': 'FC767003-D234-4040-B0B8-DA5261319F8E', 'ext': '.jpg', 'w': 948, 'h': 691, 'tn_w': 125, 'tn_h': 91, 'tim': 1670278520501030, 'time': 1670278520, 'md5': 'DbFUB3KJyu+FIvzsZw3ckg==', 'fsize': 414022, 'resto': 2461389}, {'no': 2481289, 'now': '12/08/22(Thu)00:52:02', 'name': 'Anonymous', 'filename': 'Marcel-Gassion', 'ext': '.jpg', 'w': 507, 'h': 427, 'tn_w': 125, 'tn_h': 105, 'tim': 1670478722374398, 'time': 1670478722, 'md5': 'Mmi9pXLKQkHVwkkcOTBzoQ==', 'fsize': 92817, 'resto': 2461389}, {'no': 2481399, 'now': '12/08/22(Thu)10:34:55', 'name': 'Anonymous', 'com': '<a href=""#p2480359"" class=""quotelink"">&gt;&gt;2480359</a><br>he looked better before the roids', 'time': 1670513695, 'resto': 2461389}, {'no': 2481400, 'now': '12/08/22(Thu)10:40:25', 'name': 'Anonymous', 'filename': 'd4626f748fe4d5c52163a513feb854cf', 'ext': '.jpg', 'w': 640, 'h': 640, 'tn_w': 125, 'tn_h': 125, 'tim': 1670514025309510, 'time': 1670514025, 'md5': '4desYhZMh+a2vwGbT0ehMg==', 'fsize': 57033, 'resto': 2461389}, {'no': 2482596, 'now': '12/11/22(Sun)13:40:04', 'name': 'Anonymous', 'filename': '1644755219367', 'ext': '.jpg', 'w': 2045, 'h': 1536, 'tn_w': 125, 'tn_h': 93, 'tim': 1670784004482552, 'time': 1670784004, 'md5': 'EnHvO17+1If8CeBW0K8c+Q==', 'fsize': 1777839, 'resto': 2461389}]",1670784004,Artsy/Artistic erotic nudes thread?,1651660543457,.jpg,736.0,1081.0,170.0,250.0,1666029493207104.0,oLTic01JPkzgU6yqrXjqMw==,108925.0,0.0,0.0,113.0,102.0
105,2479181,,,12/01/22(Thu)17:46:00,Anonymous,Dicks with everyday objects for size comparison,1669934760,0,,size-comparison,20,15,"[{'no': 2481857, 'now': '12/09/22(Fri)15:41:46', 'name': 'Anonymous', 'filename': 'nvxcnvn1pmy91', 'ext': '.jpg', 'w': 2976, 'h': 3272, 'tn_w': 113, 'tn_h': 125, 'tim': 1670618506575637, 'time': 1670618506, 'md5': 'AJgu0o7gRqK0nyg/XQJzKA==', 'fsize': 1219931, 'resto': 2479181}, {'no': 2482477, 'now': '12/11/22(Sun)05:19:50', 'name': 'Anonymous', 'com': '/fit/ rando thread<br><br>twunk dick', 'filename': '1670752303114815', 'ext': '.jpg', 'w': 1796, 'h': 1968, 'tn_w': 114, 'tn_h': 125, 'tim': 1670753990435400, 'time': 1670753990, 'md5': 'ambgYk+VdMSVZFFNWJ1/Kg==', 'fsize': 969517, 'resto': 2479181}, {'no': 2482542, 'now': '12/11/22(Sun)09:44:06', 'name': 'Anonymous', 'filename': '38y5sowrrhz21', 'ext': '.jpg', 'w': 3492, 'h': 4656, 'tn_w': 93, 'tn_h': 124, 'tim': 1670769846446145, 'time': 1670769846, 'md5': 'Ug550eUj6Wilcnr/vYvbxA==', 'fsize': 762780, 'resto': 2479181}, {'no': 2482558, 'now': '12/11/22(Sun)10:32:06', 'name': 'Anonymous', 'com': '<a href=""#p2482542"" class=""quotelink"">&gt;&gt;2482542</a><br>This is my weapon, this is my gun. One is for fighting, one is for fun.', 'time': 1670772726, 'resto': 2479181}, {'no': 2482564, 'now': '12/11/22(Sun)10:56:04', 'name': 'Anonymous', 'filename': 'beercan', 'ext': '.jpg', 'w': 3351, 'h': 4608, 'tn_w': 90, 'tn_h': 125, 'tim': 1670774164270865, 'time': 1670774164, 'md5': 'en3B+hoyMcGYv60DdsENvQ==', 'fsize': 903427, 'resto': 2479181}]",1670774164,Size comparison,566_1000,.jpg,1000.0,1500.0,166.0,250.0,1669934760105179.0,6hyV/gI3S9BDmzVZyCK6Tg==,265120.0,0.0,0.0,15.0,11.0
106,2482545,,,12/11/22(Sun)09:44:46,Anonymous,"Fuck it, my curiosity is peaking and i&#039;m pretty open to sucking cock at this point. I&#039;m undeniably bicurious otherwise i wouldn&#039;t be here, but i&#039;m asking whats the best way to find a cock to suck, no string attached kind of deal?<br><br>Just want something anonymous and quick, i don&#039;t want to be making out or fucking or anything, i just want to show up and start sucking to get an experience and see if its for me.",1670769886,0,,where-to-find-cock-to-suck-first-time,2,0,"[{'no': 2482551, 'now': '12/11/22(Sun)09:59:22', 'name': 'Anonymous', 'com': 'First cock I ever sucked was a dude I met outside an adult bookstore in Tucson. He came home with me. He was actually hot, and a nice guy. I was 25. Nowadays of course you have the internet. If you&#039;re someplace warm there&#039;s probably a nude beach type hangout area. Be picky. There&#039;s a lot of &#039;straight&#039; dick out there but also a lot of std&#039;s. It&#039;s better to have a regular that you can trust.', 'time': 1670770762, 'resto': 2482545}, {'no': 2482556, 'now': '12/11/22(Sun)10:30:11', 'name': 'Anonymous', 'com': '<a href=""#p2482545"" class=""quotelink"">&gt;&gt;2482545</a><br>I&#039;d say Doublelist. I&#039;ve met a few guys there but there&#039;s still a lot of flakes and fakes. I just hooked up with a guy after a few years of COVID quarantining. First time I met him I sucked his cock in his car in a shopping mall parking lot. Lost track of him. Answered a Doublelist add of a guy looking to get his cock sucked and it turned out to be him. Met him a few days later and took him load in my mouth.', 'time': 1670772611, 'resto': 2482545}]",1670772611,Where to find cock to suck first time,big_dick_gloryhole-7339,.jpg,500.0,394.0,250.0,197.0,1670769886966060.0,gcP28pLo5T9hUQBfEoDbiA==,36667.0,0.0,0.0,,
107,2470939,,,11/07/22(Mon)23:01:14,Anonymous,"Big juicy cocks up close that are so HD, you can practically feel your tongue tracing every single vein.",1667880074,0,,hd-close-up-cock-shots,62,43,"[{'no': 2480650, 'now': '12/06/22(Tue)04:11:19', 'name': 'Anonymous', 'com': '<a href=""#p2470939"" class=""quotelink"">&gt;&gt;2470939</a>', 'time': 1670317879, 'resto': 2470939}, {'no': 2481038, 'now': '12/07/22(Wed)11:43:08', 'name': 'Anonymous', 'com': '<a href=""#p2471892"" class=""quotelink"">&gt;&gt;2471892</a><br><a href=""#p2470939"" class=""quotelink"">&gt;&gt;2470939</a><br><a href=""#p2473232"" class=""quotelink"">&gt;&gt;2473232</a><br><a href=""#p2472138"" class=""quotelink"">&gt;&gt;2472138</a><br>turn your monitor to portrait mode to show these<br>glorious', 'time': 1670431388, 'resto': 2470939}, {'no': 2481630, 'now': '12/08/22(Thu)23:54:26', 'name': 'Anonymous', 'filename': '1670385361218456', 'ext': '.jpg', 'w': 4309, 'h': 5148, 'tn_w': 104, 'tn_h': 125, 'tim': 1670561666699038, 'time': 1670561666, 'md5': 'bD4H97HVNmK+UmHVzNXyPg==', 'fsize': 1750052, 'resto': 2470939}, {'no': 2481658, 'now': '12/09/22(Fri)01:08:54', 'name': 'Anonymous', 'com': 'Kik me Mike_4574 to see mine', 'time': 1670566134, 'resto': 2470939}, {'no': 2482555, 'now': '12/11/22(Sun)10:21:50', 'name': 'Anonymous', 'filename': 'from-below', 'ext': '.jpg', 'w': 2448, 'h': 3264, 'tn_w': 93, 'tn_h': 125, 'tim': 1670772110904873, 'time': 1670772110, 'md5': '8dSwGXQR3jIQZTsuD2dpYQ==', 'fsize': 932952, 'resto': 2470939}]",1670772110,HD close up cock shots,cuGK1sb,.jpg,2689.0,4781.0,140.0,250.0,1667880074927417.0,GZdrJvWMDMTT4gvyN9hm3Q==,1095831.0,0.0,0.0,57.0,41.0
108,2475065,,,11/18/22(Fri)23:39:12,Anonymous,"<span class=""quote"">&gt;ITT Post male world leaders in their prime</span><br><br>This is Justin Trudeau and Joe Biden both as younger and fitter men.",1668832752,0,,itt-post-male-world-leaders-in-their-prime,80,41,"[{'no': 2481381, 'now': '12/08/22(Thu)09:10:20', 'name': 'Anonymous', 'com': '<a href=""#p2479796"" class=""quotelink"">&gt;&gt;2479796</a><br>Gays for Trump.<br>MAGA', 'time': 1670508620, 'resto': 2475065}, {'no': 2481390, 'now': '12/08/22(Thu)10:15:03', 'name': 'Anonymous', 'com': '<a href=""#p2481381"" class=""quotelink"">&gt;&gt;2481381</a><br>MAGA and Trump did what the Nazi&#039;s couldn&#039;t even do, they basically got the people they want to exterminate to support them.', 'time': 1670512503, 'resto': 2475065}, {'no': 2481393, 'now': '12/08/22(Thu)10:23:06', 'name': 'Anonymous', 'com': '<a href=""#p2481381"" class=""quotelink"">&gt;&gt;2481381</a><br>Anon, what&#039;s stopping you from shooting up drag queen story time at your local library or blowing up a children&#039;s hospital?', 'time': 1670512986, 'resto': 2475065}, {'no': 2481405, 'now': '12/08/22(Thu)11:03:08', 'name': 'Anonymous', 'com': '<a href=""#p2481393"" class=""quotelink"">&gt;&gt;2481393</a><br>Why don&#039;t you go post your nudes in this tread:<br><a href=""/hm/thread/2470420#p2470420"" class=""quotelink"">&gt;&gt;2470420</a>', 'time': 1670515388, 'resto': 2475065}, {'no': 2482550, 'now': '12/11/22(Sun)09:54:28', 'name': 'Anonymous', 'com': 'I can&#039;t explain how cute the president of the European council looks', 'filename': 'charles-michel', 'ext': '.jpg', 'w': 400, 'h': 426, 'tn_w': 117, 'tn_h': 125, 'tim': 1670770468411588, 'time': 1670770468, 'md5': '6Gwesn1b+qcV1A+S1XHUqA==', 'fsize': 31895, 'resto': 2475065}]",1670770468,,Trudeau Biden,.jpg,1024.0,536.0,250.0,130.0,1668832752044572.0,PkNIHLR0esZ9pqodOUSv9Q==,96960.0,0.0,0.0,75.0,40.0
109,2455728,,,10/01/22(Sat)16:16:00,Anonymous,Men pissing on Men,1664655360,0,,piss-thread,174,129,"[{'no': 2480430, 'now': '12/05/22(Mon)18:27:35', 'name': 'Anonymous', 'com': '<a href=""#p2456094"" class=""quotelink"">&gt;&gt;2456094</a><br>Does it burn?', 'time': 1670282855, 'resto': 2455728}, {'no': 2480498, 'now': '12/05/22(Mon)20:23:38', 'name': 'Anonymous', 'filename': 'tumblr_p0vi7evh7N1wjh659o1_1280', 'ext': '.jpg', 'w': 800, 'h': 1211, 'tn_w': 82, 'tn_h': 124, 'tim': 1670289818436757, 'time': 1670289818, 'md5': 'OiHMwXgsoW59gHE0orEhNw==', 'fsize': 286634, 'resto': 2455728}, {'no': 2480799, 'now': '12/06/22(Tue)17:20:33', 'name': 'Anonymous', 'com': '<span class=""quote"">&gt;be white blond twink</span><br><span class=""quote"">&gt;find doublelist ad</span><br><span class=""quote"">&gt;from straight married black early 40s dude</span><br><span class=""quote"">&gt;wants to unload piss into a willing mouth</span><br><span class=""quote"">&gt;no talking</span><br><span class=""quote"">&gt;no touching his dick</span><br><span class=""quote"">&gt;will wear a mask, sunglasses, baseball cap</span><br><span class=""quote"">&gt;completely anon</span><br><span class=""quote"">&gt;i get extremely turned on</span><br><span class=""quote"">&gt;never done this before</span><br><span class=""quote"">&gt;never thought i would be into this</span><br><span class=""quote"">&gt;could not stop thinking about it</span><br><span class=""quote"">&gt;got drunk and finally replied</span><br><span class=""quote"">&gt;decide to meet at park gazebo next to parking lot of an office building</span><br><span class=""quote"">&gt;9 pm</span><br><span class=""quote"">&gt;sit in the gazebo anxious</span><br><span class=""quote"">&gt;he pulls up in a big work truck</span><br><span class=""quote"">&gt;unzips</span><br><span class=""quote"">&gt;whips out a black meaty cut musty manhood</span><br><span class=""quote"">&gt;big even when soft </span><br><span class=""quote"">&gt;both completely silent</span><br><span class=""quote"">&gt;i get as close as i can without touching his dick</span><br><span class=""quote"">&gt;immediately starts pissing</span><br><span class=""quote"">&gt;no bladder shyness at all</span><br><span class=""quote"">&gt;i panic and start immediately just swallowing</span><br><span class=""quote"">&gt;occasionally i taste it</span><br><span class=""quote"">&gt;kinda tastes like V8 with a bitter bite</span><br><span class=""quote"">&gt;not bad but not for the faint of heart</span><br><span class=""quote"">&gt;brain was going crazy with this new foreign liquid flooding my taste buds</span><br><span class=""quote"">&gt;was shivering from the adrenaline</span><br><span class=""quote"">&gt;he seemed completely unphased</span><br><span class=""quote"">&gt;not even looking at me</span><br><span class=""quote"">&gt;just emptying his bladder</span><br><span class=""quote"">&gt;zips back up without a word and drives away</span><br><span class=""quote"">&gt;30 minute walk back home at night on side of highway</span><br><span class=""quote"">&gt;stomach hurts from being drunk with his acidic piss</span><br><span class=""quote"">&gt;have panic attack that work might conduct drug test</span><br><span class=""quote"">&gt;no idea who this man was or if he abuses drugs</span><br><span class=""quote"">&gt;see on email profile pic that he has a blurry cropped pic of him with family (wife, 2 kids)</span><br><span class=""quote"">&gt;can only see that he has a salt and pepper goatee</span><br><span class=""quote"">&gt;safe for him to not touch a fag&#039;s mouth while married</span><br><span class=""quote"">&gt;but not safe for me as i have to rely on this complete stranger</span><br><span class=""quote"">&gt;did this 3 more times</span><br><span class=""quote"">&gt;had to block because he would ghost me sometimes</span><br><span class=""quote"">&gt;doesn&#039;t respect my time because i&#039;m just a fag who drinks his piss</span>', 'time': 1670365233, 'resto': 2455728}, {'no': 2481935, 'now': '12/09/22(Fri)19:08:01', 'name': 'Anonymous', 'filename': '1C75833C-EF54-48A4-BA82-746FB0B67880', 'ext': '.gif', 'w': 300, 'h': 430, 'tn_w': 87, 'tn_h': 125, 'tim': 1670630881441436, 'time': 1670630881, 'md5': 'aGOCkdVGVj+KgnJT9rnEbQ==', 'fsize': 2562446, 'resto': 2455728}, {'no': 2482536, 'now': '12/11/22(Sun)09:35:51', 'name': 'Anonymous', 'filename': 'tumblr_ohnzmgLPYj1uxzruco1_1280', 'ext': '.png', 'w': 918, 'h': 1224, 'tn_w': 93, 'tn_h': 125, 'tim': 1670769351940421, 'time': 1670769351, 'md5': 'AjCsPhW3n03mOvwCItjdKA==', 'fsize': 1777508, 'resto': 2455728}]",1670769351,PISS THREAD,1,.jpg,480.0,640.0,187.0,250.0,1664655360673508.0,5sv+3AxPc9RxaAGPm3EtMw==,56570.0,0.0,0.0,169.0,126.0
110,2475382,,,11/19/22(Sat)22:47:26,Anonymous,"Long hair, tattoos, piercings, unconventional style. SFW or NSFW all welcome here. Post &#039;em.",1668916046,0,,alternative-guys,21,15,"[{'no': 2479941, 'now': '12/04/22(Sun)12:24:40', 'name': 'Anonymous', 'filename': 'wqbj359ahmk61', 'ext': '.jpg', 'w': 2050, 'h': 2957, 'tn_w': 86, 'tn_h': 125, 'tim': 1670174680694039, 'time': 1670174680, 'md5': 'g1pI65+46cNPhsHWYDhbkQ==', 'fsize': 349573, 'resto': 2475382}, {'no': 2480580, 'now': '12/05/22(Mon)23:41:43', 'name': 'Anonymous', 'com': '<a href=""#p2479941"" class=""quotelink"">&gt;&gt;2479941</a><br>Too much tattoo, thats insane', 'time': 1670301703, 'resto': 2475382}, {'no': 2480585, 'now': '12/05/22(Mon)23:59:57', 'name': 'Anonymous', 'com': '<a href=""#p2480580"" class=""quotelink"">&gt;&gt;2480580</a><br>What a turn off. It looks like a bad body suit.', 'time': 1670302797, 'resto': 2475382}, {'no': 2481432, 'now': '12/08/22(Thu)12:57:40', 'name': 'Anonymous', 'filename': '48C644F6-176B-4327-80C6-DDB75D25D5CA', 'ext': '.jpg', 'w': 3088, 'h': 2316, 'tn_w': 125, 'tn_h': 93, 'tim': 1670522260221365, 'time': 1670522260, 'md5': 'w8Pj8i9TqT1XiIN3asEIOQ==', 'fsize': 2099051, 'resto': 2475382}, {'no': 2482531, 'now': '12/11/22(Sun)09:10:18', 'name': 'Anonymous', 'com': '<a href=""#p2479067"" class=""quotelink"">&gt;&gt;2479067</a><br>who is he?', 'time': 1670767818, 'resto': 2475382}]",1670767818,Alternative guys,cAw5Ryn,.jpg,2175.0,3313.0,164.0,250.0,1668916046446943.0,25qzLK3jdekhwIqlgRcT0Q==,1318486.0,0.0,0.0,16.0,13.0
111,2477392,,,11/26/22(Sat)00:00:45,Anonymous,The best type of cock,1669438845,0,,bwc,112,71,"[{'no': 2480140, 'now': '12/05/22(Mon)03:38:31', 'name': 'Anonymous', 'com': '<a href=""#p2477449"" class=""quotelink"">&gt;&gt;2477449</a><br>Beautiful...I would never stop worshipping that...', 'time': 1670229511, 'resto': 2477392}, {'no': 2480648, 'now': '12/06/22(Tue)04:04:20', 'name': 'Anonymous', 'com': '<a href=""#p2477449"" class=""quotelink"">&gt;&gt;2477449</a><br>Thick asf dick/head and beautiful ridge along underside of shaft hnnnggg', 'time': 1670317460, 'resto': 2477392}, {'no': 2480895, 'now': '12/06/22(Tue)23:01:11', 'name': 'Anonymous', 'com': '<a href=""#p2479116"" class=""quotelink"">&gt;&gt;2479116</a><br>source', 'time': 1670385671, 'resto': 2477392}, {'no': 2481702, 'now': '12/09/22(Fri)02:15:42', 'name': 'Anonymous', 'com': '<a href=""#p2479847"" class=""quotelink"">&gt;&gt;2479847</a><br>that&#039;s metric', 'time': 1670570142, 'resto': 2477392}, {'no': 2482497, 'now': '12/11/22(Sun)06:00:43', 'name': 'Anonymous', 'filename': 'ZhPkQE', 'ext': '.jpg', 'w': 1808, 'h': 3216, 'tn_w': 70, 'tn_h': 124, 'tim': 1670756443847912, 'time': 1670756443, 'md5': '/0pwdYghCHylBIJVcKMfxQ==', 'fsize': 654240, 'resto': 2477392}]",1670756443,BWC,244B2254-B61F-43E1-A1F1-03A92A960005,.png,1524.0,1837.0,207.0,250.0,1669438845643930.0,uQRyMqNJlGv1YcjNy+Zmyw==,4057882.0,0.0,0.0,107.0,70.0
112,2480507,,,12/05/22(Mon)20:54:34,Anonymous,photos involving alcoholic drinks,1670291674,0,,lets-have-a-drink,23,17,"[{'no': 2481878, 'now': '12/09/22(Fri)17:12:59', 'name': 'Anonymous', 'filename': 'nT_ue66ps42padavby67hhf8x3f', 'ext': '.jpg', 'w': 960, 'h': 544, 'tn_w': 125, 'tn_h': 70, 'tim': 1670623979112936, 'time': 1670623979, 'md5': 'Ra6/XBjAB8IeJX0dpECaiQ==', 'fsize': 98806, 'resto': 2480507}, {'no': 2481901, 'now': '12/09/22(Fri)18:14:48', 'name': 'Anonymous', 'com': 'this is what college is all about', 'filename': '164EF56D-8E77-470F-8CF4-E265E2F5236D', 'ext': '.jpg', 'w': 540, 'h': 720, 'tn_w': 93, 'tn_h': 125, 'tim': 1670627688582026, 'time': 1670627688, 'md5': 'qMy+etJfZryG24Yontu2Dw==', 'fsize': 49316, 'resto': 2480507}, {'no': 2482163, 'now': '12/10/22(Sat)13:35:35', 'name': 'Anonymous', 'filename': 'nT_c2sc7cf6g4uyz6phyu2pasdv', 'ext': '.jpg', 'w': 500, 'h': 375, 'tn_w': 125, 'tn_h': 93, 'tim': 1670697335563903, 'time': 1670697335, 'md5': 'ExQpH9eQRME8hGfvfMK3xQ==', 'fsize': 48645, 'resto': 2480507}, {'no': 2482364, 'now': '12/10/22(Sat)22:30:43', 'name': 'Anonymous', 'filename': 'tumblr_lynd2u6VHU1ro206po1_1280', 'ext': '.png', 'w': 800, 'h': 754, 'tn_w': 125, 'tn_h': 117, 'tim': 1670729443779257, 'time': 1670729443, 'md5': '1WRTX2PPhALnJaYSuNETUA==', 'fsize': 1157979, 'resto': 2480507}, {'no': 2482487, 'now': '12/11/22(Sun)05:42:01', 'name': 'Anonymous', 'com': '<span class=""quote"">&gt;sticking glass up your ass</span><br>what could possibly go wrong', 'time': 1670755321, 'resto': 2480507}]",1670755321,Let&#039;s Have a Drink!,nT_rqrizxh532pi0aacx25didif,.jpg,604.0,669.0,225.0,250.0,1670291674608420.0,ZlMLjTOgcMYRrsXxZiHnqA==,68558.0,0.0,0.0,18.0,13.0
113,2457889,,,10/07/22(Fri)16:19:39,Anonymous,Lets show some love to this often overlooked part of a male&#039;s physique,1665173979,0,,sexy-backs,124,73,"[{'no': 2481579, 'now': '12/08/22(Thu)21:53:41', 'name': 'Anonymous', 'com': '<a href=""#p2481561"" class=""quotelink"">&gt;&gt;2481561</a><br><a href=""#p2479745"" class=""quotelink"">&gt;&gt;2479745</a><br><span class=""quote"">&gt;leaf boarshead cbt chad</span><br>he&#039;s always beyond sexy asf', 'time': 1670554421, 'resto': 2457889}, {'no': 2481633, 'now': '12/09/22(Fri)00:02:26', 'name': 'Anonymous', 'filename': '0126796e35', 'ext': '.gif', 'w': 540, 'h': 424, 'tn_w': 125, 'tn_h': 98, 'tim': 1670562146459969, 'time': 1670562146, 'md5': 'RRLsgJj998hL7gj+DNIyxg==', 'fsize': 5217215, 'resto': 2457889}, {'no': 2481738, 'now': '12/09/22(Fri)04:50:12', 'name': 'Anonymous', 'com': '<a href=""#p2480864"" class=""quotelink"">&gt;&gt;2480864</a><br>Eddie chipp/ eddieboiii_x on twitter. Image was posted back in 2020 I think.', 'time': 1670579412, 'resto': 2457889}, {'no': 2481745, 'now': '12/09/22(Fri)05:07:59', 'name': 'Anonymous', 'filename': 'tumblr_01caf369119e2022fde32f9eb59d1d04_9cc32b57_1280', 'ext': '.jpg', 'w': 750, 'h': 1293, 'tn_w': 72, 'tn_h': 125, 'tim': 1670580479396486, 'time': 1670580479, 'md5': 'AZezWBxkh2jvOfYCSMBkHw==', 'fsize': 211528, 'resto': 2457889}, {'no': 2482485, 'now': '12/11/22(Sun)05:36:11', 'name': 'Anonymous', 'com': '/fit/ cbt', 'filename': 'fit cbt muscle bro back 16661547', 'ext': '.jpg', 'w': 1028, 'h': 1280, 'tn_w': 100, 'tn_h': 125, 'tim': 1670754971961996, 'time': 1670754971, 'md5': 'AfFXoaEjzhhKfqsGoq+dSw==', 'fsize': 537711, 'resto': 2457889}]",1670754971,Sexy backs,1664915768982057,.jpg,1394.0,1479.0,235.0,250.0,1665173979503830.0,QYACtdAOHkQkLyhx8HKcrA==,375449.0,0.0,0.0,119.0,70.0
