,no,sticky,closed,now,name,com,time,resto,capcode,semantic_url,replies,images,last_replies,last_modified,sub,filename,ext,w,h,tn_w,tn_h,tim,md5,fsize,bumplimit,imagelimit,omitted_posts,omitted_images
0,886269,1.0,1.0,05/14/14(Wed)09:36:39,Anonymous,"<font size='4'>/hm/ is for sharing porn.</font><br><br>People posting new threads should post several images (6+) to get the thread started. Don&#039;t just post one image and expect other people to do the work of making a successful thread.<br><br>Hookup, camwhore, and &#039;rate me&#039; threads should go on <a href=""https://boards.4chan.org/soc/"">/soc/</a>.<br>Advice threads should go on <a href=""https://boards.4chan.org/adv/"">/adv/</a>. (work-safe).<br>Discussion of LGBT topics should go on <a href=""https://boards.4chan.org/lgbt/"">/lgbt/</a>. (work-safe).<br>Requests for sources, or more images should go on <a href=""https://boards.4chan.org/r/"">/r/</a>.",1400074599,0,mod,hm-is-for-sharing-porn,1,0,"[{'no': 1299359, 'now': '01/20/16(Wed)10:21:11', 'name': 'Anonymous', 'com': '<p style=""font-size:16px;"">Do not post any &#039;rate me&#039; or any other self shots here. If you want to post pictures of <b>yourself</b>, please use <a href=""https://boards.4chan.org/soc/"">/soc/ - Cams &amp; Meetups</a>.</p>', 'time': 1453303271, 'resto': 886269, 'capcode': 'mod'}]",1453303287,,,,,,,,,,,,,,
1,2459378,,,10/11/22(Tue)12:16:58,Anonymous,Thread dedicated to the guys who can’t stop exposing themselves. Post them!,1665505018,0,,guys-who-expose-themselves,153,70,"[{'no': 2482815, 'now': '12/12/22(Mon)04:02:49', 'name': 'Anonymous', 'com': 'Anyone ever download photos of gay cheating slut Simon from London who calls himself fitness faggot?', 'time': 1670835769, 'resto': 2459378}, {'no': 2482904, 'now': '12/12/22(Mon)10:49:43', 'name': 'Anonymous', 'filename': 'images (6)', 'ext': '.jpg', 'w': 500, 'h': 455, 'tn_w': 125, 'tn_h': 113, 'tim': 1670860183446124, 'time': 1670860183, 'md5': 'NYunIiS8Oz6F0aD9IGcXHg==', 'fsize': 71622, 'resto': 2459378}, {'no': 2483165, 'now': '12/13/22(Tue)02:48:20', 'name': 'Cubby', 'com': 'Pervert bear', 'filename': 'IMG_20221211_084254564_BURST001', 'ext': '.jpg', 'w': 2304, 'h': 1728, 'tn_w': 125, 'tn_h': 93, 'tim': 1670917700754681, 'time': 1670917700, 'md5': 'lu9fKB87EnqJBScCf8cdPg==', 'fsize': 1949648, 'resto': 2459378}, {'no': 2483207, 'now': '12/13/22(Tue)06:36:54', 'name': 'The guy in the first post', 'com': 'Just found this two months later and saw I was the first post happy to be exposed', 'time': 1670931414, 'resto': 2459378}, {'no': 2483208, 'now': '12/13/22(Tue)06:49:27', 'name': 'Anonymous', 'com': 'https://www.exposedrealfun.com/post<wbr>/374889', 'time': 1670932167, 'resto': 2459378}]",1670932167,Guys who expose themselves,AD476551-3893-497B-A32C-62A1B2C3EF49,.jpg,721.0,960.0,187.0,250.0,1665505018764756.0,n5TJfkhudCL/29mY1iWpUw==,67371.0,0.0,0.0,148.0,68.0
2,2480502,,,12/05/22(Mon)20:50:33,Anonymous,"Your favorite male chests. Any size, any shape, any fullness.",1670291433,0,,pecs,194,143,"[{'no': 2483041, 'now': '12/12/22(Mon)20:07:09', 'name': 'Anonymous', 'filename': '20221212_190245', 'ext': '.jpg', 'w': 1080, 'h': 1327, 'tn_w': 101, 'tn_h': 125, 'tim': 1670893629906677, 'time': 1670893629, 'md5': 'GVrwIVaKUCtXq+E75WZiZQ==', 'fsize': 420851, 'resto': 2480502}, {'no': 2483042, 'now': '12/12/22(Mon)20:07:56', 'name': 'Anonymous', 'filename': '20221212_190303', 'ext': '.jpg', 'w': 1080, 'h': 1319, 'tn_w': 102, 'tn_h': 125, 'tim': 1670893676626490, 'time': 1670893676, 'md5': 'N4DyJJNmv6y29PLAroxHKQ==', 'fsize': 425405, 'resto': 2480502}, {'no': 2483108, 'now': '12/12/22(Mon)22:37:51', 'name': 'Anonymous', 'com': '<a href=""#p2480898"" class=""quotelink"">&gt;&gt;2480898</a><br><a href=""#p2480857"" class=""quotelink"">&gt;&gt;2480857</a><br><a href=""#p2481171"" class=""quotelink"">&gt;&gt;2481171</a><br>moarrr hot cbt ginger muscle cub for your unabashed viewing pleasure....', 'filename': '1652_fitizen_fit_cbt_tatts_ginger_muscle_cub_9892', 'ext': '.jpg', 'w': 666, 'h': 887, 'tn_w': 93, 'tn_h': 124, 'tim': 1670902671272968, 'time': 1670902671, 'md5': '08fhzFKGpIb2UKLDcfhr6A==', 'fsize': 222387, 'resto': 2480502}, {'no': 2483201, 'now': '12/13/22(Tue)05:14:39', 'name': 'Anonymous', 'filename': '1650480801817', 'ext': '.webm', 'w': 640, 'h': 800, 'tn_w': 100, 'tn_h': 125, 'tim': 1670926479238823, 'time': 1670926479, 'md5': 'Jv2Uom29YnoUaiYSKdP6yA==', 'fsize': 1218097, 'resto': 2480502}, {'no': 2483206, 'now': '12/13/22(Tue)06:30:05', 'name': 'Anonymous', 'com': '<a href=""#p2482972"" class=""quotelink"">&gt;&gt;2482972</a><br>No', 'time': 1670931005, 'resto': 2480502}]",1670931005,Pecs,EJ57G9kWsAMSDfg,.jpg,937.0,1171.0,200.0,249.0,1670291433902564.0,ThcMZ+W/pW0X20qDnwIaCg==,230361.0,0.0,0.0,189.0,139.0
3,2480415,,,12/05/22(Mon)18:18:52,Anonymous,Guys with their pants/shorts/underwear pulled down but not fully off + asses out,1670282332,0,,guys-with-their-pantsshortsunderwear-pulled-down,30,25,"[{'no': 2481775, 'now': '12/09/22(Fri)08:43:16', 'name': 'Anonymous', 'filename': 'tumblr_9b847e316e8c2eda39079ad975867364_d5870a8f_2048', 'ext': '.jpg', 'w': 1535, 'h': 2048, 'tn_w': 93, 'tn_h': 125, 'tim': 1670593396257296, 'time': 1670593396, 'md5': 'bbWCa9d++j4bAGmHNk/t7g==', 'fsize': 652634, 'resto': 2480415}, {'no': 2481806, 'now': '12/09/22(Fri)12:34:08', 'name': 'Anonymous', 'com': '<a href=""#p2481775"" class=""quotelink"">&gt;&gt;2481775</a><br>not only hot, but the subtle jar of &#039;Nut&#039;n Better&#039; next to his ass really brings it together', 'time': 1670607248, 'resto': 2480415}, {'no': 2481889, 'now': '12/09/22(Fri)17:35:18', 'name': 'Anonymous', 'filename': '1492563971895', 'ext': '.jpg', 'w': 594, 'h': 782, 'tn_w': 94, 'tn_h': 125, 'tim': 1670625318552135, 'time': 1670625318, 'md5': 'oOqbe+7toq63X1QAMHXsow==', 'fsize': 202009, 'resto': 2480415}, {'no': 2483187, 'now': '12/13/22(Tue)03:57:29', 'name': 'Anonymous', 'filename': '1572032735945', 'ext': '.jpg', 'w': 500, 'h': 717, 'tn_w': 87, 'tn_h': 125, 'tim': 1670921849471552, 'time': 1670921849, 'md5': 'gj1WrZlS/f1aZDPw83M1+g==', 'fsize': 107763, 'resto': 2480415}, {'no': 2483205, 'now': '12/13/22(Tue)06:25:25', 'name': 'Anonymous', 'com': '<a href=""#p2480415"" class=""quotelink"">&gt;&gt;2480415</a><br>Damn! That shitter is huge!', 'time': 1670930725, 'resto': 2480415}]",1670930725,,1644917382630,.jpg,729.0,1024.0,177.0,250.0,1670282332098007.0,Kk2f/RRW2kbyDUw6kBRj/Q==,92415.0,0.0,0.0,25.0,22.0
4,2479968,,,12/04/22(Sun)14:07:27,Anonymous,Post your stories and experiences fucking and getting fucked.,1670180847,0,,stories-experiences-thread,46,5,"[{'no': 2482975, 'now': '12/12/22(Mon)16:38:16', 'name': 'Anonymous', 'com': '<a href=""#p2482150"" class=""quotelink"">&gt;&gt;2482150</a><br>Thanks! We’re sort of vanilla so I’m not sure there’s anything too out of the box to tell. We went on vacation recently and had sex on the hotel balcony? I could tell that one lol.', 'time': 1670881096, 'resto': 2479968}, {'no': 2483061, 'now': '12/12/22(Mon)20:34:47', 'name': 'Anonymous', 'com': '<span class=""quote"">&gt;Be me, 14 at the time</span><br><span class=""quote"">&gt;With my best friend that night, he&#039;s sleeping over</span><br><span class=""quote"">&gt;We spend the night in my sisters room because she&#039;s away and she had the only other TV with a satellite receiver</span><br><span class=""quote"">&gt;We play video games for a while then decide to get some beers from downstairs</span><br><span class=""quote"">&gt;Drink my fathers beers while playing video games then watching Hellboy (the first one)</span><br><span class=""quote"">&gt;Friend had brough some weed and we smoked together on my sisters bed</span><br><span class=""quote"">&gt;Was kinda getting drunk and the pot didn&#039;t help</span><br><span class=""quote"">&gt;Friend proposes we watch some porn and masturbate, we did that before, always hiding our junk</span><br><span class=""quote"">&gt;While watching porn, well, not porn, we didn&#039;t find any porn, it was more like a porn documentary, friend challenged me to a truth and dare game</span><br><span class=""quote"">&gt;We play, my first dare was to put on one of my sisters thongs</span><br><span class=""quote"">&gt;As we play, I noticed every time I went for dare, he would tell me to put on more of my sisters clothes</span><br><span class=""quote"">&gt;Ended up looking at myself in the mirror, dressed as a girl (had long hair at the time) thinking I didn&#039;t look so bad</span><br><span class=""quote"">&gt;Friend kept on daring me to try different clothes and noticed my erection when I tried a skirt</span><br><span class=""quote"">&gt;It&#039;s my turn and he choses truth again, I ask him why he&#039;s making me dress like my sister</span><br><span class=""quote"">&gt;He says because it won&#039;t be gay when I suck his cock</span><br><span class=""quote"">&gt;I though he was kidding, so I went for dare again, he dared me to suck his cock</span><br><span class=""quote"">&gt;Friend dropped his pj pants to expose his cock</span><br><span class=""quote"">&gt;That was the day I learned my dick was small</span>', 'time': 1670895287, 'resto': 2479968}, {'no': 2483100, 'now': '12/12/22(Mon)22:18:08', 'name': 'Anonymous', 'com': '<a href=""#p2483061"" class=""quotelink"">&gt;&gt;2483061</a><br>Love it. More please.', 'time': 1670901488, 'resto': 2479968}, {'no': 2483149, 'now': '12/13/22(Tue)00:37:01', 'name': 'Anonymous', 'com': 'Have any of you guys tried having sex with a woman? how&#039;d that go?', 'time': 1670909821, 'resto': 2479968}, {'no': 2483204, 'now': '12/13/22(Tue)06:20:43', 'name': 'Anonymous', 'com': '<a href=""#p2483149"" class=""quotelink"">&gt;&gt;2483149</a><br>I&#039;m bi, married to a woman. She gave up on sex a long time ago so I decided to explore sex with men. I just like sex with either men or women, but men are much more available. If I found a woman interested in jumping into bed with me, I&#039;d do it.', 'time': 1670930443, 'resto': 2479968}]",1670930443,"Stories, experiences thread.",user12220342_69402619133f,.jpg,700.0,994.0,176.0,249.0,1670180847989909.0,7z+E2N5R3GMAGVr5mMkLlQ==,146702.0,0.0,0.0,41.0,5.0
5,2458039,,,10/08/22(Sat)00:25:17,Anonymous,"I&#039;d want Justin Trudeau, Ron DeSantis and Gavin Newsom for a whole lotta nasty stuff",1665203117,0,,which-three-politicians-would-you-like-to-have-a,115,62,"[{'no': 2483094, 'now': '12/12/22(Mon)21:56:45', 'name': 'Anonymous', 'com': 'Kind of sold on this guy, ngl', 'filename': '1670899147833983', 'ext': '.jpg', 'w': 750, 'h': 1596, 'tn_w': 58, 'tn_h': 125, 'tim': 1670900205007870, 'time': 1670900205, 'md5': 'GjFPL2dp71UgVIUQVkr1Gg==', 'fsize': 164968, 'resto': 2458039}, {'no': 2483103, 'now': '12/12/22(Mon)22:33:49', 'name': 'Anonymous', 'com': '<a href=""#p2481268"" class=""quotelink"">&gt;&gt;2481268</a><br><a href=""#p2482126"" class=""quotelink"">&gt;&gt;2482126</a><br>Still cannot help myself but gaze at 90% of his pics as he&#039;s hot blonde and very clean cut preppy and athletic but dam his California dem politics.', 'time': 1670902429, 'resto': 2458039}, {'no': 2483180, 'now': '12/13/22(Tue)03:39:34', 'name': 'Anonymous', 'com': '<a href=""#p2483094"" class=""quotelink"">&gt;&gt;2483094</a><br><span class=""quote"">&gt;Pro-Trump candidate</span><br><span class=""quote"">&gt;making that an actual campaign point </span><br>The games already over for him', 'time': 1670920774, 'resto': 2458039}, {'no': 2483200, 'now': '12/13/22(Tue)05:07:32', 'name': 'Anonymous', 'com': 'It&#039;s Hunter Biden, Emmanuel Macron, and Herschel Walker for me.<br><br><a href=""#p2464544"" class=""quotelink"">&gt;&gt;2464544</a><br><a href=""#p2464588"" class=""quotelink"">&gt;&gt;2464588</a><br><a href=""#p2470059"" class=""quotelink"">&gt;&gt;2470059</a><br>Don&#039;t know how you find him attractive. There&#039;s far better looking Indians out there. Saying this as a jeet myself.', 'time': 1670926052, 'resto': 2458039}, {'no': 2483203, 'now': '12/13/22(Tue)05:50:25', 'name': 'Anonymous', 'com': '<a href=""#p2483200"" class=""quotelink"">&gt;&gt;2483200</a><br>Yes! I always feel a twinge of guilt when I think about Hunty. He’s such a dirty looking creep but my god would I do anything for that huge dick.<br><br>I’m still disappointed I never managed to save or find his leaked vids. I have one or two only', 'filename': 'FCA4CFF3-AD9D-4998-BF2D-4ED491D89043', 'ext': '.jpg', 'w': 582, 'h': 1368, 'tn_w': 53, 'tn_h': 125, 'tim': 1670928625996575, 'time': 1670928625, 'md5': 'Yk6fzi+4Xf245Ug/mA2JMw==', 'fsize': 192861, 'resto': 2458039}]",1670928625,Which three politicians would you like to have a foursome with?,Zombodroid_07102022112108,.jpg,2000.0,4193.0,119.0,250.0,1665203117465592.0,XUCbnPpjieKC7ey7Qg5FEA==,998328.0,0.0,0.0,110.0,60.0
6,2479569,,,12/03/22(Sat)02:46:41,Anonymous,"To stop all the source threads deleting good content, a general source thread is required. /r/ doesn&#039;t do gay shit and mods ban/delete individual source threads.<br><br>How to obtain your source:<br>1) Post your picture or description<br>2) Post what you want (name, company, etc)<br>3) Post any information you have (where/when the picture is from, etc)<br>4) Wait for a mars/hm/allow to help you and then say thanks.<br><br>Together we can stop the 404ing of good porn.<br><br>Please use image search (and common sense) before posting in this thread.<br><br>There is also a gay porn encyclopedia which can be found here: 95.31.3.127/pbc/Main_Page<br>It has a huge library of many different actors, studios, films and other information which you may find helpful.<br><br>Finally, please do not reply to users who ask for a source by creating their own thread. This removes porn from /hm/ and they should not be rewarded for their actions.<br><br>Previous thread:<br><a href=""/hm/thread/2469314#p2469314"" class=""quotelink"">&gt;&gt;2469314</a>",1670053601,0,,sauce-thread-dccxxiv-image-limit-reached-edition,163,77,"[{'no': 2483151, 'now': '12/13/22(Tue)00:41:06', 'name': 'Anonymous', 'com': 'Name?', 'filename': 'twerk', 'ext': '.gif', 'w': 381, 'h': 498, 'tn_w': 95, 'tn_h': 125, 'tim': 1670910066759138, 'time': 1670910066, 'md5': 'ttm6YOuQ9SFZVnvjUvdCDg==', 'fsize': 3970011, 'resto': 2479569}, {'no': 2483195, 'now': '12/13/22(Tue)04:37:23', 'name': 'Anonymous', 'com': '<a href=""#p2483151"" class=""quotelink"">&gt;&gt;2483151</a><br>Kainen Nelms', 'time': 1670924243, 'resto': 2479569}, {'no': 2483197, 'now': '12/13/22(Tue)04:43:11', 'name': 'Anonymous', 'com': 'I came here cuz i really don&#039;t know anywhere else to ask lol.<br>So, I&#039;m searching for two videos.<br><br>1: this was on pornhub before they nuked shit. It looked like a mid 2000s - early 2010s video, and had this setting of &quot;two straight guys fucking&quot;, that kinda look amateur but it&#039;s not lol. the top was white, skinny and i remember him having short hair/buzzcut and a tattoo or piercing, something &quot;punkish&quot;. The bottom was taller, his skin had this red-ish color, like sunburned, kinda muscular and thick, and having blonde spiky hair. they fucked on a bed.<br><br>2: this is like a mid 2010s video i think. Began with two guys, one dark haired with beard and the other one caucasian, both jogging, they went to a house and fucked hahaha i remember that happening on a sofa. One thing a remember pretty well about this one is the caucasian guy wearing some kind of red/wine colored leggins, and getting fucked wearing those, like getting ripped on the asshole area. <br><br>Sorry if it&#039;s too much text, but i really don&#039;t have any images, so i&#039;m trying to being specific af lol. Thanks in advance!!!', 'time': 1670924591, 'resto': 2479569}, {'no': 2483198, 'now': '12/13/22(Tue)04:47:22', 'name': 'Anonymous', 'com': 'name pls', 'filename': '1660539279287586', 'ext': '.png', 'w': 720, 'h': 857, 'tn_w': 105, 'tn_h': 125, 'tim': 1670924842273054, 'time': 1670924842, 'md5': 'Bif1eVjSPZp6XxZIDvkiJQ==', 'fsize': 778127, 'resto': 2479569}, {'no': 2483202, 'now': '12/13/22(Tue)05:49:14', 'name': 'Anonymous', 'com': '<a href=""#p2483147"" class=""quotelink"">&gt;&gt;2483147</a><br>Landon Vega, Tyler Hill<br>Dirty Wrestling - helixstudios.com 2018<br><br><a href=""#p2483148"" class=""quotelink"">&gt;&gt;2483148</a><br>Noah Matous, Ruben Bart<br>Tour Guide sc. 2 - SauVage 2015', 'time': 1670928554, 'resto': 2479569}]",1670928554,Sauce Thread DCCXXIV : image limit reached edition,1670049264307795,.jpg,3024.0,4032.0,187.0,250.0,1670053601505796.0,xbT+7ay6Uh21oMBUg/uuqQ==,1138922.0,0.0,0.0,158.0,75.0
7,2481336,,,12/08/22(Thu)04:26:12,Anonymous,Let’s post the best face down ass up pics you’ve gathered over the years,1670491572,0,,face-down-ass-up,15,14,"[{'no': 2482102, 'now': '12/10/22(Sat)06:25:58', 'name': 'Anonymous', 'filename': 'E819F9CE-6A4D-4217-80D9-D8737DD10219', 'ext': '.png', 'w': 750, 'h': 1334, 'tn_w': 70, 'tn_h': 124, 'tim': 1670671558469824, 'time': 1670671558, 'md5': '00YZ3ikZbOs7ZRE7szvnPg==', 'fsize': 1559054, 'resto': 2481336}, {'no': 2482103, 'now': '12/10/22(Sat)06:28:11', 'name': 'Anonymous', 'filename': '4CB67849-1CB7-4F09-B39E-99E1949AA86D', 'ext': '.png', 'w': 750, 'h': 1334, 'tn_w': 70, 'tn_h': 124, 'tim': 1670671691600955, 'time': 1670671691, 'md5': '3DUC/zbqOYYXmbMaQBj7rQ==', 'fsize': 1692350, 'resto': 2481336}, {'no': 2482204, 'now': '12/10/22(Sat)16:13:23', 'name': 'Anonymous', 'com': '<a href=""#p2481624"" class=""quotelink"">&gt;&gt;2481624</a><br>Fawwwwk', 'time': 1670706803, 'resto': 2481336}, {'no': 2482897, 'now': '12/12/22(Mon)09:23:34', 'name': 'Anonymous', 'filename': '8939E9E2-8876-4303-BC5C-BD752A50CDAB', 'ext': '.jpg', 'w': 750, 'h': 957, 'tn_w': 97, 'tn_h': 125, 'tim': 1670855014304678, 'time': 1670855014, 'md5': '0m8Ue3RwcHnq0OBlNFJqpA==', 'fsize': 119426, 'resto': 2481336}, {'no': 2483199, 'now': '12/13/22(Tue)04:50:45', 'name': 'Anonymous', 'filename': '6', 'ext': '.jpg', 'w': 6016, 'h': 4016, 'tn_w': 125, 'tn_h': 83, 'tim': 1670925045144045, 'time': 1670925045, 'md5': 'cMkLj1NC/btK1FuBZk2EXw==', 'fsize': 7260188, 'resto': 2481336}]",1670925045,Face Down Ass Up,FF7C7203-93CC-4FEE-85B2-A633F586C06C,.jpg,910.0,1266.0,179.0,250.0,1670491572346337.0,tjAO85RQWyQOW2Le7220MA==,166886.0,0.0,0.0,10.0,10.0
8,2455502,,,09/30/22(Fri)21:45:08,Anonymous,I want to say at least 30% of the time but I could be wrong,1664588708,0,,serious-question-how-common-is-gay-sex-in-the,167,38,"[{'no': 2479391, 'now': '12/02/22(Fri)08:33:17', 'name': 'Anonymous', 'com': 'I tell people that the Navy and the Marines aren&#039;t branches of the military, they&#039;re gay dating services.<br>I banged more dudes during my 6 years of enlistment than I have in the 20 years since getting out.<br>When you&#039;re on deployment for months on end, a warm body is a warm body.', 'time': 1669987997, 'resto': 2455502}, {'no': 2480409, 'now': '12/05/22(Mon)18:11:31', 'name': 'Anonymous', 'com': 'I have fucked a lot of military guys and the explanation I get a lot is that they don’t find men attractive, they’re just really horny', 'time': 1670281891, 'resto': 2455502}, {'no': 2481598, 'now': '12/08/22(Thu)22:13:46', 'name': 'Anonymous', 'com': '<a href=""#p2478633"" class=""quotelink"">&gt;&gt;2478633</a><br><a href=""#p2479391"" class=""quotelink"">&gt;&gt;2479391</a><br><a href=""#p2480409"" class=""quotelink"">&gt;&gt;2480409</a><br><a href=""#p2476470"" class=""quotelink"">&gt;&gt;2476470</a><br>so true and so hot as fuck', 'time': 1670555626, 'resto': 2455502}, {'no': 2481611, 'now': '12/08/22(Thu)23:05:03', 'name': 'Anonymous', 'com': '<a href=""#p2455502"" class=""quotelink"">&gt;&gt;2455502</a><br>Out of 140 people i know at my command, im gay, and i know a trans mtf who likes dudes, that&#039;s it. Also like 3 sus guys who could be bi', 'time': 1670558703, 'resto': 2455502}, {'no': 2483196, 'now': '12/13/22(Tue)04:41:22', 'name': 'Anonymous', 'com': 'this is thread is making me want a military bf', 'time': 1670924482, 'resto': 2455502}]",1670924482,Serious question: How common is gay sex in the military?,631738_3,.jpg,480.0,320.0,250.0,166.0,1664588708514281.0,v1Jrv9iKI877WlTVi4C9Bw==,23255.0,0.0,0.0,162.0,38.0
9,2481183,,,12/07/22(Wed)18:34:58,Anonymous,Asian Chinese Gay Enjoyed Being Naked (The Art Of Asian Guy In Nude),1670456098,0,,asian-chinese-gay-enjoyed-being-naked,23,20,"[{'no': 2482889, 'now': '12/12/22(Mon)08:25:38', 'name': 'Anonymous', 'com': 'https://pl.eporner.com/video-8VGEIT<wbr>xFOak/arrested-to-perform-self-orga<wbr>sm-torture-and-masturbating/', 'filename': 'image102659412', 'ext': '.jpg', 'w': 1600, 'h': 1600, 'tn_w': 125, 'tn_h': 125, 'tim': 1670851538089360, 'time': 1670851538, 'md5': 'Y10YdB/ixqLVYRrDdPp6tQ==', 'fsize': 181921, 'resto': 2481183}, {'no': 2483080, 'now': '12/12/22(Mon)21:29:56', 'name': 'Anonymous', 'com': 'This thread is psychotic. <br>Does this happen to gays when they get old and unfuckable? Is this my fate?', 'time': 1670898596, 'resto': 2481183}, {'no': 2483190, 'now': '12/13/22(Tue)04:08:19', 'name': 'Anonymous', 'com': '<a href=""#p2483080"" class=""quotelink"">&gt;&gt;2483080</a>', 'filename': 'Screenshot_2022-12-13-17-01-08-76_680d03679600f7af0b4c700c6b270fe7', 'ext': '.jpg', 'w': 720, 'h': 315, 'tn_w': 125, 'tn_h': 54, 'tim': 1670922499626930, 'time': 1670922499, 'md5': 'Y0sQNsfGVqUBsGCoy06V1Q==', 'fsize': 100030, 'resto': 2481183}, {'no': 2483191, 'now': '12/13/22(Tue)04:14:46', 'name': 'Anonymous', 'com': '<a href=""#p2482889"" class=""quotelink"">&gt;&gt;2482889</a>', 'filename': '1642758345581', 'ext': '.jpg', 'w': 394, 'h': 700, 'tn_w': 70, 'tn_h': 125, 'tim': 1670922886674351, 'time': 1670922886, 'md5': 'uUOf+SfkSgEcsuDrYiJo8Q==', 'fsize': 42252, 'resto': 2481183}, {'no': 2483194, 'now': '12/13/22(Tue)04:25:54', 'name': 'Anonymous', 'com': '<a href=""#p2481226"" class=""quotelink"">&gt;&gt;2481226</a>', 'filename': '4488650941-bppimage', 'ext': '.gif', 'w': 264, 'h': 176, 'tn_w': 125, 'tn_h': 83, 'tim': 1670923554061272, 'time': 1670923554, 'md5': 'k3mLNVVDfmoai1zXfmSlXw==', 'fsize': 2330050, 'resto': 2481183}]",1670923554,Asian Chinese Gay Enjoyed Being Naked,gay_stripped_naked_by_sggay118_dfdi5xt-pre,.jpg,685.0,1166.0,146.0,250.0,1670456098078970.0,AoY6NsG7eey2LIvEbuMMSA==,73065.0,0.0,0.0,18.0,16.0
10,2482373,,,12/10/22(Sat)23:46:45,Anonymous,,1670734005,0,,homoerotic-borderline-sfw,28,15,"[{'no': 2482981, 'now': '12/12/22(Mon)17:03:17', 'name': 'Anonymous', 'filename': 'Screenshot 2022-12-13 at 9.00.42 am', 'ext': '.png', 'w': 530, 'h': 465, 'tn_w': 125, 'tn_h': 109, 'tim': 1670882597258063, 'time': 1670882597, 'md5': '/Y9yPW2RhFJ+chX6MmT2Cw==', 'fsize': 468706, 'resto': 2482373}, {'no': 2482982, 'now': '12/12/22(Mon)17:03:54', 'name': 'Anonymous', 'time': 1670882634, 'resto': 2482373, 'filedeleted': 1}, {'no': 2482983, 'now': '12/12/22(Mon)17:06:06', 'name': 'Anonymous', 'filename': 'Screenshot 2022-12-13 at 9.00.19 am', 'ext': '.png', 'w': 588, 'h': 596, 'tn_w': 123, 'tn_h': 125, 'tim': 1670882766832795, 'time': 1670882766, 'md5': 'sS29GMf9AEIbmkxeKEz4HA==', 'fsize': 651307, 'resto': 2482373}, {'no': 2483111, 'now': '12/12/22(Mon)22:41:49', 'name': 'Anonymous', 'com': 'Fuck David Pocock is so fuckin hot especially this', 'filename': '1589_rugby_wallabies_pocock_bro_beach_5139', 'ext': '.jpg', 'w': 600, 'h': 857, 'tn_w': 87, 'tn_h': 125, 'tim': 1670902909581953, 'time': 1670902909, 'md5': 'hkIFQUaOhKRvJwhjYsACug==', 'fsize': 77864, 'resto': 2482373}, {'no': 2483193, 'now': '12/13/22(Tue)04:19:40', 'name': 'Anonymous', 'com': '<a href=""#p2482378"" class=""quotelink"">&gt;&gt;2482378</a><br>What a slut', 'time': 1670923180, 'resto': 2482373}]",1670923180,Homoerotic / borderline SFW,ezgif-3-3308cc5d14,.gif,540.0,960.0,140.0,250.0,1670734005905118.0,ua12owIboXqC3dEtqlWMKA==,7744264.0,0.0,0.0,23.0,12.0
11,2478077,,,11/27/22(Sun)20:25:58,Anonymous,"Recently made a FWB thing with a guy who is uncut. First uncut one I ever encounted IRL. <br><br>I absolutely love playing with &#039;hood&#039; and never realized uncircumcised guys can choose<br><br>to wear their foreskin over their head or tucked under the head. <br>Anyway... show me your uncut cocks,<br><br>I&#039;d love to see more of the glorious foreskin that I am sadly missing!",1669598758,0,,uncut-cocks,120,92,"[{'no': 2483092, 'now': '12/12/22(Mon)21:53:07', 'name': 'Anonymous', 'filename': 'Screenshot_20221212_214932_Gallery', 'ext': '.jpg', 'w': 1079, 'h': 819, 'tn_w': 125, 'tn_h': 94, 'tim': 1670899987626044, 'time': 1670899987, 'md5': '4LT31Cf4nbOmICRhmidmIQ==', 'fsize': 453672, 'resto': 2478077}, {'no': 2483093, 'now': '12/12/22(Mon)21:56:41', 'name': 'Anonymous', 'filename': 'Screenshot_20221212_215026_Gallery', 'ext': '.jpg', 'w': 1079, 'h': 1436, 'tn_w': 93, 'tn_h': 125, 'tim': 1670900201453665, 'time': 1670900201, 'md5': '4KTm4gm38ABz4otPjYCoBg==', 'fsize': 979781, 'resto': 2478077}, {'no': 2483096, 'now': '12/12/22(Mon)21:58:37', 'name': 'Anonymous', 'filename': 'Screenshot_20221212_215439_Gallery', 'ext': '.jpg', 'w': 1080, 'h': 1590, 'tn_w': 84, 'tn_h': 125, 'tim': 1670900317377750, 'time': 1670900317, 'md5': 'Dy4m993H7MKrcMHtKtofVg==', 'fsize': 712620, 'resto': 2478077}, {'no': 2483097, 'now': '12/12/22(Mon)21:59:07', 'name': 'Anonymous', 'filename': 'Screenshot_20221212_215549_Gallery', 'ext': '.jpg', 'w': 1079, 'h': 1436, 'tn_w': 93, 'tn_h': 125, 'tim': 1670900347350401, 'time': 1670900347, 'md5': '/n1pNgAFd0nyCL3E83BY/A==', 'fsize': 1046775, 'resto': 2478077}, {'no': 2483192, 'now': '12/13/22(Tue)04:17:03', 'name': 'Anonymous', 'filename': '1647533012813', 'ext': '.jpg', 'w': 3456, 'h': 2592, 'tn_w': 125, 'tn_h': 93, 'tim': 1670923023260476, 'time': 1670923023, 'md5': 'GAsSn3S+pul0NaBY0p8igw==', 'fsize': 471987, 'resto': 2478077}]",1670923023,Uncut cocks,Lovely-uncut-cock,.jpg,1029.0,1293.0,198.0,250.0,1669598758641330.0,1I/4TjZFLUkKmeoIE/dTwQ==,209055.0,0.0,0.0,115.0,87.0
