,no,sticky,closed,now,name,com,time,resto,capcode,semantic_url,replies,images,last_replies,last_modified,sub,filename,ext,w,h,tn_w,tn_h,tim,md5,fsize,bumplimit,imagelimit,omitted_posts,omitted_images
77,2458039,,,10/08/22(Sat)00:25:17,Anonymous,"I&#039;d want Justin Trudeau, Ron DeSantis and Gavin Newsom for a whole lotta nasty stuff",1665203117,0,,which-three-politicians-would-you-like-to-have-a,110,60,"[{'no': 2481347, 'now': '12/08/22(Thu)05:16:46', 'name': 'Anonymous', 'com': '<a href=""#p2460494"" class=""quotelink"">&gt;&gt;2460494</a><br><span class=""quote"">&gt;not available in the US</span><br>Fuck', 'time': 1670494606, 'resto': 2458039}, {'no': 2481348, 'now': '12/08/22(Thu)05:16:53', 'name': 'Anonymous', 'com': '<a href=""#p2458039"" class=""quotelink"">&gt;&gt;2458039</a><br><br>Vladimir Putin, Kim Jong Un, Sanna Marin, and Justin Trudeau <br><br>I want them to dominate me, especially Putin~', 'time': 1670494613, 'resto': 2458039}, {'no': 2481353, 'now': '12/08/22(Thu)05:23:47', 'name': 'Anonymous', 'com': '<a href=""#p2477916"" class=""quotelink"">&gt;&gt;2477916</a><br>Jr’s pretty hot but he needs to keep his beard. Both him and Eric look tragic without it', 'filename': '5A3CC969-23C3-43A6-8CB0-B4FB65048651', 'ext': '.jpg', 'w': 800, 'h': 533, 'tn_w': 125, 'tn_h': 83, 'tim': 1670495027402211, 'time': 1670495027, 'md5': 'e6xB6FZ3v+smlER73XJfOw==', 'fsize': 52194, 'resto': 2458039}, {'no': 2482126, 'now': '12/10/22(Sat)09:29:07', 'name': 'Anonymous', 'com': '<a href=""#p2481268"" class=""quotelink"">&gt;&gt;2481268</a><br>I shook hands with Gavin a couple years ago and he seems smaller than I expected. He’s tall and much more attractive than photos but definitely more twink-ish than daddy if it makes sense', 'time': 1670682547, 'resto': 2458039}, {'no': 2482133, 'now': '12/10/22(Sat)10:39:03', 'name': 'Anonymous', 'com': '<a href=""#p2458039"" class=""quotelink"">&gt;&gt;2458039</a><br>Arestovych is growing on me, in a shameful fuck with an absolute weirdo I could NEVER tell anyone about kinda way. Rumours has it he was actually at a gay bar even though he ranted against homosexuality as being unnatural? At Ze&#039;s administration he&#039;s that Friend That Nobody Likes.', 'filename': 'shirtless Arestovych', 'ext': '.png', 'w': 455, 'h': 609, 'tn_w': 93, 'tn_h': 125, 'tim': 1670686743165933, 'time': 1670686743, 'md5': 'VlFLOfxzpSq7GJsUzXUC1A==', 'fsize': 490065, 'resto': 2458039}]",1670686743,Which three politicians would you like to have a foursome with?,Zombodroid_07102022112108,.jpg,2000.0,4193.0,119.0,250.0,1665203117465592.0,XUCbnPpjieKC7ey7Qg5FEA==,998328.0,0.0,0.0,105.0,58.0
78,2476982,,,11/24/22(Thu)19:02:46,Anonymous,i love seeing their asses through their boxers,1669334566,0,,sexy-saggers,24,20,"[{'no': 2480367, 'now': '12/05/22(Mon)17:23:56', 'name': 'Anonymous', 'filename': 'A4D3DB5D-552A-465E-8445-BFD0C5946032', 'ext': '.jpg', 'w': 958, 'h': 801, 'tn_w': 125, 'tn_h': 104, 'tim': 1670279036633314, 'time': 1670279036, 'md5': 'aa7UMiXE1nmXD4YGLYSKrA==', 'fsize': 776245, 'resto': 2476982}, {'no': 2481095, 'now': '12/07/22(Wed)15:04:53', 'name': 'Anonymous', 'com': '<a href=""#p2477811"" class=""quotelink"">&gt;&gt;2477811</a><br>This is a myth.<br>The trend does imitate the look of prison inmates, but has nothing to do wither or not someone is a bitch. It&#039;s literally just because inmates get issued clothes that are baggy on them.', 'time': 1670443493, 'resto': 2476982}, {'no': 2481207, 'now': '12/07/22(Wed)19:45:33', 'name': 'Anonymous', 'com': '<a href=""#p2480367"" class=""quotelink"">&gt;&gt;2480367</a><br>imagine the smell', 'time': 1670460333, 'resto': 2476982}, {'no': 2481282, 'now': '12/08/22(Thu)00:41:51', 'name': 'Anonymous', 'com': '<a href=""#p2481207"" class=""quotelink"">&gt;&gt;2481207</a><br>Shit<br><br>I don&#039;t have to imagine the smell, I know shit comes out of there, so it smells like shit.', 'time': 1670478111, 'resto': 2476982}, {'no': 2482130, 'now': '12/10/22(Sat)10:21:19', 'name': 'Anonymous', 'com': 'This cute little twink', 'filename': '65ADEB05-2D92-45DB-98E6-3A1AF915F28C', 'ext': '.jpg', 'w': 998, 'h': 1920, 'tn_w': 64, 'tn_h': 125, 'tim': 1670685679831495, 'time': 1670685679, 'md5': 'zHyq6G8rTTyG1lA/9/5zEw==', 'fsize': 249961, 'resto': 2476982}]",1670685679,sexy saggers,20180316_113235.jpg.3f8e1cd9cce8753f61ba989b81a43972,.jpg,2988.0,5312.0,140.0,250.0,1669334566845464.0,97zGDO4SeQT9PqhdSjQwcw==,2648922.0,0.0,0.0,19.0,18.0
79,2482115,,,12/10/22(Sat)08:24:51,Anonymous,"Afropeans, mutts etc. whatever you call them.<br><br>No, i&#039;m not that autist spamming threads for every ethnic group. Just need some sexy lightskin guys to fap to..",1670678691,0,,bbc-lightskins-mulattos-creoles-etc,0,0,,1670678691,"Bbc Lightskins, mulattos, creoles, etc.",1650837413103,.jpg,604.0,1063.0,142.0,250.0,1670678691006108.0,QYpSyGw8H0wVdXK5R94w5g==,123407.0,0.0,0.0,,
80,2456798,,,10/04/22(Tue)16:57:43,Anonymous,,1664917063,0,,mens-room-gloryhole,168,60,"[{'no': 2481893, 'now': '12/09/22(Fri)17:49:30', 'name': 'Anonymous', 'com': '<a href=""#p2481891"" class=""quotelink"">&gt;&gt;2481891</a><br><span class=""quote"">&gt;I open it and a dick comes through</span><br><span class=""quote"">&gt;while I&#039;m jerking it, there&#039;s a knock on the door next to it</span><br><span class=""quote"">&gt;I open that as well and another dick comes through</span><br><span class=""quote"">&gt;two other doors weren&#039;t closed properly and dicks come through them as well</span><br><span class=""quote"">&gt;get completely overwhelmed both sexually and also panic a little bit</span><br><span class=""quote"">&gt;reach into my pants and barely touch my dick, explode immediately</span><br><span class=""quote"">&gt;knees weak, takes all my strength not to fall down on the floor</span><br><span class=""quote"">&gt;open the door and leave kind of quickly, no comment from anyone but I think they were disappointed</span><br><span class=""quote"">&gt;walk out and past the lady at the register, can&#039;t even look her in the face from embarrassment but I can see in the corner of my eye that she&#039;s smirking at me</span><br><span class=""quote"">&gt;go home, process the whole thing, jerk off again to more gloryhole porn</span><br><span class=""quote"">&gt;take a small break from cruising</span>', 'time': 1670626170, 'resto': 2456798}, {'no': 2481896, 'now': '12/09/22(Fri)17:55:54', 'name': 'Anonymous', 'com': '<a href=""#p2481893"" class=""quotelink"">&gt;&gt;2481893</a><br><span class=""quote"">&gt;ffwd another year</span><br><span class=""quote"">&gt;have discovered crossdressing and chastity</span><br><span class=""quote"">&gt;turn 18, get driving license</span><br><span class=""quote"">&gt;so many more cruising grounds accessible that I had wanted to visit before but it was too far away</span><br><span class=""quote"">&gt;rekindle my interest for cruising and visit a few by car</span><br><span class=""quote"">&gt;much nicer experience than going there on bike or public transport since you can just leave whenever and &quot;hide&quot; in a way in your car if things get too hectic</span><br><span class=""quote"">&gt;move cities and states to a place with far less public cruising grounds out in nature but more sex shops</span><br><span class=""quote"">&gt;decide to give the cruising cinema thing another go</span><br><span class=""quote"">&gt;go to cinema at daytime on a Sunday</span><br><span class=""quote"">&gt;much fewer people and a much more chilled out experience</span><br><span class=""quote"">&gt;go into dark room, get changed into my sluttiest cd outfit and have my cage on</span><br><span class=""quote"">&gt;blow a few dicks, get fucked by one and then go home</span><br><span class=""quote"">&gt;great experience and I want to do it again</span><br><br>FFWD to today, I try to go there once or twice a month. I usually suck 3-4 dicks and get fucked by one or two.<br>I&#039;ve tried being &quot;public&quot; a few times i.e. in the big screen rooms with sofas and so on and while it&#039;s hot dealing with more than one dick at a time I still like the gloryholes more. It&#039;s a more chilled out time and I can take things in my own pace which I like.<br><br>Last week I tried going during daytime on a Friday and it was just me and two more guys. One of the guys was just jerking it to a video, the other one joined me in the booth next to the dark room but couldn&#039;t get hard. He came soft which I&#039;ve never seen anyone do before so that was a first.', 'time': 1670626554, 'resto': 2456798}, {'no': 2481936, 'now': '12/09/22(Fri)19:08:59', 'name': 'Anonymous', 'com': '<a href=""#p2478700"" class=""quotelink"">&gt;&gt;2478700</a><br>fuck i wish he unloaded inside me', 'time': 1670630939, 'resto': 2456798}, {'no': 2482092, 'now': '12/10/22(Sat)05:13:45', 'name': 'Anonymous', 'com': '<a href=""#p2481888"" class=""quotelink"">&gt;&gt;2481888</a><br>im the oppisite i love older guys sucking and draining my cock, it makes me feel in power and the idea of them submitting sexually, worshipping my young cock always makes me cum buckets.<br><br>would love to share a gloryhole with a friend where we&#039;re both donating our cum to a needing daddy or having 2 daddies drain me', 'filename': 'Fjd6GnGWYAEzZqu', 'ext': '.jpg', 'w': 415, 'h': 900, 'tn_w': 57, 'tn_h': 125, 'tim': 1670667225872507, 'time': 1670667225, 'md5': 'dJLY9HBimQfP6Jzvy2Ce9g==', 'fsize': 33553, 'resto': 2456798}, {'no': 2482111, 'now': '12/10/22(Sat)07:20:13', 'name': 'Anonymous', 'com': 'this hottie did a gloryhole porno when he was like 19, he is now a rugby star. Name is Kurt Campbell<br><br>https://xhamster.desi/videos/jock-s<wbr>ucked-at-gay-gloryhole-3177020<br><br><span class=""quote"">&gt;Tfw you will never be that old fug guy sucking on that big cock, swallowing sweet rugby cum</span>', 'filename': 'r0_0_800_600_w800_h600_fmax', 'ext': '.jpg', 'w': 800, 'h': 600, 'tn_w': 125, 'tn_h': 93, 'tim': 1670674813062196, 'time': 1670674813, 'md5': '5dBzHUxJhPSIxSh/53oFVw==', 'fsize': 48587, 'resto': 2456798}]",1670674813,Men&#039;s room gloryhole,oo,.png,720.0,524.0,250.0,181.0,1664917063678952.0,5T7zWRFJpaMpI5NnP13aTA==,377627.0,0.0,0.0,163.0,58.0
81,2481205,,,12/07/22(Wed)19:41:01,Anonymous,"Not too picky, I&#039;ll even take art. These guys are hard to find.",1670460061,0,,native-american-guys,23,13,"[{'no': 2481415, 'now': '12/08/22(Thu)12:00:48', 'name': 'Anonymous', 'filename': 'Kayo2', 'ext': '.png', 'w': 347, 'h': 555, 'tn_w': 78, 'tn_h': 125, 'tim': 1670518848301769, 'time': 1670518848, 'md5': 'AoqdpDolcB83kvsWgkzA1A==', 'fsize': 312930, 'resto': 2481205}, {'no': 2481416, 'now': '12/08/22(Thu)12:01:24', 'name': 'Anonymous', 'filename': 'Kayo3', 'ext': '.png', 'w': 446, 'h': 555, 'tn_w': 100, 'tn_h': 125, 'tim': 1670518884688469, 'time': 1670518884, 'md5': 'yKDUJVQ5ng47yYS/micKYw==', 'fsize': 395369, 'resto': 2481205}, {'no': 2481418, 'now': '12/08/22(Thu)12:03:34', 'name': 'Anonymous', 'filename': 'Kayo4', 'ext': '.png', 'w': 488, 'h': 555, 'tn_w': 109, 'tn_h': 125, 'tim': 1670519014231416, 'time': 1670519014, 'md5': 'a1/BOF/FwkyQNnoC4kuyXQ==', 'fsize': 456809, 'resto': 2481205}, {'no': 2481420, 'now': '12/08/22(Thu)12:10:42', 'name': 'Anonymous', 'filename': 'Kayo5', 'ext': '.png', 'w': 456, 'h': 555, 'tn_w': 102, 'tn_h': 125, 'tim': 1670519442762579, 'time': 1670519442, 'md5': 'uY2Nz+zqghKARLF0D6Xz1Q==', 'fsize': 452028, 'resto': 2481205}, {'no': 2482109, 'now': '12/10/22(Sat)07:03:01', 'name': 'Anonymous', 'com': '<a href=""#p2481266"" class=""quotelink"">&gt;&gt;2481266</a><br>Long-haired men look better, you don&#039;t know what you are talking about.', 'time': 1670673781, 'resto': 2481205}]",1670673781,Native American Guys,tumblr_pdxzcbso811um5n55_540,.jpg,485.0,679.0,178.0,250.0,1670460061163665.0,2Cagf0q6IZkR7Q+0EiT04w==,71070.0,0.0,0.0,18.0,9.0
82,2472011,,,11/11/22(Fri)10:08:18,Anonymous,is silicone injections a good way to make your dick bigger?<br>how difficult is it not to go overboard?,1668179298,0,,is-silicone-injections-a-good-way-to-make-your,151,31,"[{'no': 2481524, 'now': '12/08/22(Thu)18:39:04', 'name': 'Anonymous', 'com': '<a href=""#p2481239"" class=""quotelink"">&gt;&gt;2481239</a><br>It wouldn&#039;t be easier in a meaningful way, you&#039;d still have every other insecurity just not that one. Guys with monster dongs are so rare most people would go their lives without seeing one if not for porn, almost everyone with a boyfriend has one with an average cock by definition.', 'time': 1670542744, 'resto': 2472011}, {'no': 2481544, 'now': '12/08/22(Thu)19:22:45', 'name': 'Anonymous', 'com': '<a href=""#p2481524"" class=""quotelink"">&gt;&gt;2481524</a><br>My definition of bigger dick is not monster dong. And even monster dongs aren&#039;t so rare. I&#039;ve come across a couple and I don&#039;t think I&#039;ve hooked up with a crazy number of guys.<br><br>re: insecurities, most you can change, but height and dick size are the two you can&#039;t change.', 'time': 1670545365, 'resto': 2472011}, {'no': 2481884, 'now': '12/09/22(Fri)17:28:09', 'name': 'Anonymous', 'com': '<a href=""#p2477911"" class=""quotelink"">&gt;&gt;2477911</a><br>Salmacian in tumblr gender.', 'time': 1670624889, 'resto': 2472011}, {'no': 2481969, 'now': '12/09/22(Fri)21:08:25', 'name': 'Anonymous', 'com': '<a href=""#p2481544"" class=""quotelink"">&gt;&gt;2481544</a><br><span class=""quote"">&gt;And even monster dongs aren&#039;t so rare</span><br>monster dongs are pretty rare.<br>even on the large penis support group forum only a handful have 8+ inch measurement pics.<br>there’s a $10k reward for legit 10+ inch that’s still unclaimed after being offered for years.', 'time': 1670638105, 'resto': 2472011}, {'no': 2482099, 'now': '12/10/22(Sat)06:00:40', 'name': 'Anonymous', 'com': '<a href=""#p2481544"" class=""quotelink"">&gt;&gt;2481544</a><br>By the definitions of size used online definition even large cocks are incredibly rare. 7 inchers are less than 1.5% of the world population. At 8 inches it&#039;s below 0.01%.<br><br>The standard deviation for penis size is incredibly tight, just half an inch. Almost every man on earth matures into an adult body with an erect penis measuring between 4.5 and 6.5 inches, if you were to stand in a room with a 1000 men you&#039;d be able to find 11 of them with 7 inches or above.<br><br>Your focus on large sizes as a physical standard has been cultivated by watching porn, it does not reflect reality. It&#039;s akin to the body dysmorphia that women experience looking at models who uniformly starve themselves into unrealistic body shapes, you have seen large penises on screen in enough proportion that you think they&#039;re more prominent and normal than they are.', 'time': 1670670040, 'resto': 2472011}]",1670670040,,A82FF8AD-AD6C-4A58-BAD6-DEF651C42E69,.jpg,2682.0,1792.0,250.0,167.0,1668179298812094.0,CJAxHE1tpf8r3DQpslHrfg==,905690.0,0.0,0.0,146.0,31.0
83,2436053,,,07/29/22(Fri)22:42:10,Anonymous,something about it is nostalgic and hot,1659148930,0,,pics-that-were-clearly-taken-in-the-early-2000s,194,118,"[{'no': 2481068, 'now': '12/07/22(Wed)13:27:35', 'name': 'Anonymous', 'com': 'Gay', 'filename': 'kfjg7gu', 'ext': '.jpg', 'w': 1120, 'h': 636, 'tn_w': 125, 'tn_h': 70, 'tim': 1670437655907387, 'time': 1670437655, 'md5': 'K0ghX7FuF2PM41OUTQag4Q==', 'fsize': 103680, 'resto': 2436053}, {'no': 2481311, 'now': '12/08/22(Thu)02:24:43', 'name': 'Anonymous', 'filename': 'kevin', 'ext': '.jpg', 'w': 1080, 'h': 810, 'tn_w': 125, 'tn_h': 93, 'tim': 1670484283102463, 'time': 1670484283, 'md5': 'ojmTLIVa4kWMPF7vuCeuYQ==', 'fsize': 65081, 'resto': 2436053}, {'no': 2481314, 'now': '12/08/22(Thu)02:34:16', 'name': 'Anonymous', 'filename': 'Canon-Canon EOS DIGITAL REBEL XT-1752x1944-017251', 'ext': '.jpg', 'w': 1752, 'h': 1944, 'tn_w': 112, 'tn_h': 125, 'tim': 1670484856899714, 'time': 1670484856, 'md5': 'k7S7uI3NpVEW7yeZnJa+kQ==', 'fsize': 308225, 'resto': 2436053}, {'no': 2481671, 'now': '12/09/22(Fri)01:16:03', 'name': 'Anonymous', 'com': '<a href=""#p2436053"" class=""quotelink"">&gt;&gt;2436053</a>', 'filename': '1670449658832961', 'ext': '.jpg', 'w': 768, 'h': 1024, 'tn_w': 93, 'tn_h': 125, 'tim': 1670566563676357, 'time': 1670566563, 'md5': 'ldpnzxQqQrv2zCl7kf2lsA==', 'fsize': 226451, 'resto': 2436053}, {'no': 2482077, 'now': '12/10/22(Sat)04:00:06', 'name': 'Anonymous', 'com': '<a href=""#p2436053"" class=""quotelink"">&gt;&gt;2436053</a>', 'filename': '1670627688582026', 'ext': '.jpg', 'w': 540, 'h': 720, 'tn_w': 93, 'tn_h': 125, 'tim': 1670662806672085, 'time': 1670662806, 'md5': 'qMy+etJfZryG24Yontu2Dw==', 'fsize': 49316, 'resto': 2436053}]",1670662806,Pics that were clearly taken in the early 2000s,1650591518963 copy,.jpg,1493.0,1800.0,207.0,250.0,1659148930892045.0,edrgXUcMtb1r16dbD9/J/g==,528111.0,0.0,0.0,189.0,113.0
84,2456493,,,10/03/22(Mon)22:59:16,Anonymous,Left or Right?,1664852356,0,,left-or-right,131,11,"[{'no': 2481463, 'now': '12/08/22(Thu)15:54:08', 'name': 'Anonymous', 'com': '<a href=""#p2481349"" class=""quotelink"">&gt;&gt;2481349</a><br>right is kevin baines aka grabbabeer', 'filename': 'gb_of_posted_on-032118', 'ext': '.jpg', 'w': 640, 'h': 414, 'tn_w': 125, 'tn_h': 80, 'tim': 1670532848492329, 'time': 1670532848, 'md5': '31NbBL07pO4SV1kkR1PwIw==', 'fsize': 117967, 'resto': 2456493}, {'no': 2481517, 'now': '12/08/22(Thu)17:52:03', 'name': 'Anonymous', 'com': '<a href=""#p2481392"" class=""quotelink"">&gt;&gt;2481392</a><br>sorry honey, blondes are disgusting. imagine getting this triggered from some literal random anon liking darker boys. cope more you emotionally arrested goblin', 'time': 1670539923, 'resto': 2456493}, {'no': 2481601, 'now': '12/08/22(Thu)22:20:30', 'name': 'Anonymous', 'com': '<a href=""#p2481362"" class=""quotelink"">&gt;&gt;2481362</a><br>It&#039;s not fat though. At worst it&#039;s overweight, but you must be African tier thin if you think that&#039;s fat. We get you&#039;re a third world loser, but &quot;fat&quot; isn&#039;t the right word for the dude', 'time': 1670556030, 'resto': 2456493}, {'no': 2481610, 'now': '12/08/22(Thu)23:01:59', 'name': 'Anonymous', 'com': 'Not only right, but there&#039;s a weirdly high amount of everyone here who is choosing left is also being a bitch about it, like they are personally offended that anyone disagrees with their taste.<br><br>But yeah right is hot af, left is ok but not my type', 'time': 1670558519, 'resto': 2456493}, {'no': 2482068, 'now': '12/10/22(Sat)03:27:23', 'name': 'Anonymous', 'com': 'Right', 'time': 1670660843, 'resto': 2456493}]",1670660843,,335A0776-A9F4-494A-A490-4C147F8EBE5C,.jpg,1125.0,1125.0,250.0,250.0,1664852356467077.0,d6CgQ5jIcZMUPKSjSfW9Jw==,249540.0,0.0,0.0,126.0,10.0
85,2476323,,,11/22/22(Tue)13:50:06,Anonymous,There is any real comparative dick size chart?,1669143006,0,,there-is-any-real-comparative-dick-size-chart,34,9,"[{'no': 2479935, 'now': '12/04/22(Sun)11:57:33', 'name': 'Anonymous', 'com': '<a href=""#p2477506"" class=""quotelink"">&gt;&gt;2477506</a><br>You have a wider pool to choose from on the internet and it’s typically people with bigger than average ducks that feel comfortable/confident enough to post dick pics. The global average is like 5.5” or something but you won’t be getting millions of average sized guys posting theirs just to offset the thousands of above average guys.', 'time': 1670173053, 'resto': 2476323}, {'no': 2480071, 'now': '12/04/22(Sun)22:20:52', 'name': 'Anonymous', 'com': '<a href=""#p2479935"" class=""quotelink"">&gt;&gt;2479935</a><br>yeah not enough people seem to understand this. if you&#039;re basing your ideas about dick size on the internet in any way, whether it&#039;s professional porn or amateur pics or even dating apps, you are misinforming yourself. selection bias<br><br>IRL most dicks are kinda ugly and smallish (actually average, but feels small compared to porn). the ones that are pretty or large get all the attention and traction online for reasons that should be obvious<br><br>personally, i don&#039;t care about size much, but the &quot;most dicks are kinda ugly&quot; thing really disappointed me for a while until i realized what was going on. it makes the really nice ones that much nicer when you get with one', 'time': 1670210452, 'resto': 2476323}, {'no': 2480092, 'now': '12/05/22(Mon)01:05:12', 'name': 'Anonymous', 'com': '<a href=""#p2477037"" class=""quotelink"">&gt;&gt;2477037</a><br>Your cock looks good. More?', 'time': 1670220312, 'resto': 2476323}, {'no': 2480929, 'now': '12/07/22(Wed)01:13:56', 'name': 'Anonymous', 'com': '5 size ranges. Url in picrel. <br>&quot;These are the low average ones or the kind of small, men in here probably wonder if they’re small or not but the truth is that one of every 4 of their friends is just that big or smaller.&quot;', 'filename': 'Screenshot_20221207-170913-684', 'ext': '.png', 'w': 720, 'h': 1537, 'tn_w': 58, 'tn_h': 125, 'tim': 1670393636610805, 'time': 1670393636, 'md5': 'FPBtRdKy3IrZGMyc2aCB6A==', 'fsize': 147506, 'resto': 2476323}, {'no': 2482048, 'now': '12/10/22(Sat)02:44:59', 'name': 'Anonymous', 'com': '<a href=""#p2479421"" class=""quotelink"">&gt;&gt;2479421</a><br>Yeah, also giving the Asian guy comically small dick while ignoring the fact that Native Americans are closely related to them and thus don&#039;t have BIC.', 'time': 1670658299, 'resto': 2476323}]",1670658299,,sizes,.png,1654.0,1654.0,250.0,250.0,1669143006575644.0,f3Mk8okv74kPoct2eJnXvQ==,1012568.0,0.0,0.0,29.0,8.0
86,2481122,,,12/07/22(Wed)16:05:39,Anonymous,Old thread maxed out. Let&#039;s get some more,1670447139,0,,geeknerdgamerotaku,25,18,"[{'no': 2481717, 'now': '12/09/22(Fri)02:57:34', 'name': 'Anonymous', 'com': 'bump', 'filename': 'tumblr_r2rimibaam1zqvx0i', 'ext': '.webm', 'w': 360, 'h': 640, 'tn_w': 70, 'tn_h': 125, 'tim': 1670572654474835, 'time': 1670572654, 'md5': 'o1AOu3NPIRWYWJpc0CYh+w==', 'fsize': 336947, 'resto': 2481122}, {'no': 2481752, 'now': '12/09/22(Fri)06:48:25', 'name': 'Anonymous', 'com': '<a href=""#p2481717"" class=""quotelink"">&gt;&gt;2481717</a><br>Damn, I’d do anything to have my face on that nice crotch', 'time': 1670586505, 'resto': 2481122}, {'no': 2481763, 'now': '12/09/22(Fri)08:01:16', 'name': 'Anonymous', 'com': '<a href=""#p2481717"" class=""quotelink"">&gt;&gt;2481717</a><br><span class=""quote"">&gt;hot creepshot webM </span><br><br>hot asf<br><br>Kinda reminds us that /hm/ needs **new candid pic-webm thread for OC creep shots**', 'time': 1670590876, 'resto': 2481122}, {'no': 2481805, 'now': '12/09/22(Fri)12:30:49', 'name': 'Anonymous', 'com': '<a href=""#p2481717"" class=""quotelink"">&gt;&gt;2481717</a><br>damn that&#039;s hot<br><br>can&#039;t help but imagine that he&#039;s holding his arm like this because he knows he wouldn&#039;t resist touching his crotch otherwise', 'time': 1670607049, 'resto': 2481122}, {'no': 2482046, 'now': '12/10/22(Sat)02:36:37', 'name': 'Anonymous', 'filename': 'tumblr_14f949411ada23f95e5e8ad97685ede4_f3814e04_1280', 'ext': '.jpg', 'w': 750, 'h': 767, 'tn_w': 122, 'tn_h': 125, 'tim': 1670657797341971, 'time': 1670657797, 'md5': 'vITVTS7wRRsDjJyUEgfU7g==', 'fsize': 100322, 'resto': 2481122}]",1670657797,Geek/nerd/Gamer/Otaku,s-l1600,.jpg,661.0,990.0,166.0,250.0,1670447139764908.0,5N6/bbk/b3HlR+JMitBD2Q==,91695.0,0.0,0.0,20.0,16.0
87,2468115,,,11/02/22(Wed)10:49:19,Anonymous,Most bdsms threads dont really scratch this itch so i thought id make one for the more sadistic of us out there. Any form of man to man violence or torture you find arousing but obviously no gore.,1667400559,0,,violence-sadism-abuse-thread,153,62,"[{'no': 2480783, 'now': '12/06/22(Tue)15:58:38', 'name': 'Anonymous', 'com': '<a href=""#p2479974"" class=""quotelink"">&gt;&gt;2479974</a><br><a href=""#p2480582"" class=""quotelink"">&gt;&gt;2480582</a><br>There&#039;s a small ongoing thread here if you&#039;re interested. Not too much content so far, but at least it won&#039;t get deleted like 4chan threads do<br>lpsg.com/threads/superhero-dominati<wbr>on-fetish.5462931', 'time': 1670360318, 'resto': 2468115}, {'no': 2480955, 'now': '12/07/22(Wed)03:21:51', 'name': 'Anonymous', 'com': '<a href=""#p2468115"" class=""quotelink"">&gt;&gt;2468115</a><br>bump', 'time': 1670401311, 'resto': 2468115}, {'no': 2481281, 'now': '12/08/22(Thu)00:41:19', 'name': 'Anonymous', 'com': '<a href=""#p2480589"" class=""quotelink"">&gt;&gt;2480589</a><br><br>What about the scene in &quot;The Ten Commandments&quot; where Vincent Price&#039;s character ties up the hunky &quot;Joshua&quot; and whips him? I was never the same after I first saw that (4th grade)', 'time': 1670478079, 'resto': 2468115}, {'no': 2481293, 'now': '12/08/22(Thu)01:04:14', 'name': 'Anonymous', 'com': 'Tickle torture. <br>It&#039;s good clean fun. Everyone&#039;s smiling, laughing, and having a good time.', 'filename': 'frankie', 'ext': '.webm', 'w': 812, 'h': 480, 'tn_w': 125, 'tn_h': 73, 'tim': 1670479454676609, 'time': 1670479454, 'md5': 'X7ok6mmKI5ngSYTsZsAaCg==', 'fsize': 878245, 'resto': 2468115}, {'no': 2482035, 'now': '12/10/22(Sat)02:09:19', 'name': 'Anonymous', 'com': '<a href=""#p2481281"" class=""quotelink"">&gt;&gt;2481281</a><br><span class=""quote"">&gt;&quot;The Ten Commandments&quot; </span><br><span class=""quote"">&gt;&quot;Joshua&quot; gets seriously whipped n flogged</span><br><br>yeahh definitely subliminally hot as fuck for alota people no cap', 'time': 1670656159, 'resto': 2468115}]",1670656159,Violence / Sadism / Abuse thread,Tumblr_l_385813024172687,.gif,320.0,213.0,250.0,166.0,1667400559361928.0,Ach7XeVe0Ow0hqH945oz6Q==,2241044.0,0.0,0.0,148.0,61.0
