,no,now,name,com,filename,ext,w,h,tn_w,tn_h,tim,time,md5,fsize,resto,bumplimit,imagelimit,semantic_url,replies,images,omitted_posts,omitted_images,last_replies,last_modified,sub
33,8228492,12/12/22(Mon)12:57:20,Anonymous,MMMMMMMMMMMMMMMMMMM,1649194010597,.jpg,470,518,226,250,1670867840443875,1670867840,VmjjDSEV+hwuYS4C4xlJzQ==,34541,0,0,0,mmmmmmmmmmmmmmmmmmm,30,19,25.0,16.0,"[{'no': 8237218, 'now': '12/13/22(Tue)04:54:09', 'name': 'Anonymous', 'com': '<a href=""#p8237214"" class=""quotelink"">&gt;&gt;8237214</a><br><span class=""quote"">&gt;60% of his face is forehead </span><br><br>MMMMMM wouldn&#039;t wanna mess with those proportions', 'filename': '189334', 'ext': '.gif', 'w': 200, 'h': 200, 'tn_w': 125, 'tn_h': 125, 'tim': 1670925249724196, 'time': 1670925249, 'md5': 'qZrlhWS0PAb1YR05tDLwdA==', 'fsize': 214737, 'resto': 8228492}, {'no': 8237224, 'now': '12/13/22(Tue)04:56:02', 'name': 'Anonymous', 'com': '<span class=""quote"">&gt;tfw you&#039;ve been wrestling for 40 years and you&#039;re still living paycheck to paycheck to make alimony payments to your 2 ex wives</span>', 'filename': '32945', 'ext': '.jpg', 'w': 1050, 'h': 1400, 'tn_w': 93, 'tn_h': 125, 'tim': 1670925362175062, 'time': 1670925362, 'md5': 'Ed4Kp4RfNp9M5Ldz+YoAfA==', 'fsize': 594359, 'resto': 8228492}, {'no': 8237227, 'now': '12/13/22(Tue)04:57:36', 'name': 'Anonymous', 'com': '<a href=""#p8237224"" class=""quotelink"">&gt;&gt;8237224</a><br>Society will collapse soon fren. You won&#039;t have to worry about that anymore.', 'time': 1670925456, 'resto': 8228492}, {'no': 8237418, 'now': '12/13/22(Tue)06:33:23', 'name': 'Anonymous', 'com': '<a href=""#p8228568"" class=""quotelink"">&gt;&gt;8228568</a><br>sup carder', 'time': 1670931203, 'resto': 8228492}, {'no': 8237438, 'now': '12/13/22(Tue)06:41:52', 'name': 'Anonymous', 'com': 'UNDERCARDER BTFO<br><br>Undercarder<br><br><span class=""quote"">&gt;Never the guy</span><br><span class=""quote"">&gt;Never drew a dime</span><br><span class=""quote"">&gt;Never had a good match before 2006 and even then was carried by vastly superior workers</span><br><span class=""quote"">&gt;Never cut a memorable promo</span><br><span class=""quote"">&gt;Never put anyone over</span><br><span class=""quote"">&gt;Never had the balls to step out his WWF comfort even when Ted Turner threw millions at him</span><br><span class=""quote"">&gt;Main evented the lowest drawing Wrestlemania of the &#039;90s</span><br><span class=""quote"">&gt;Main evented the lowest drawing Wrestlemania of the &#039;10s</span><br><span class=""quote"">&gt;Tanked the buyrate of King Of The Ring in 2002 so hard the PPV got cancelled</span><br><span class=""quote"">&gt;Was barely ever in the main title picture because he was never a big enough deal</span><br><span class=""quote"">&gt;Only the 2nd best member of The Brothers of Destruction</span><br><span class=""quote"">&gt;Only the 4th best member of The Ministry</span><br><span class=""quote"">&gt;Only the 8th best member of The Corporate Ministry</span><br><span class=""quote"">&gt;His backstage clique &quot;The Bone Street Krew&quot; was utterly BTFO by The Kliq and achieved nothing notable except inflicting Savio Vega on us</span><br><span class=""quote"">&gt;His biker cosplay was cringeworthy</span><br><span class=""quote"">&gt;His MMA cosplay was cringeworthy</span><br><span class=""quote"">&gt;Unironically calls himself &quot;&quot;&quot;&quot;&quot;&quot;&quot;&quot;DA BEST PURE STRIKER IN DA WWE&quot;&quot;&quot;&quot;&quot;&quot;&quot;&quot;</span><br><span class=""quote"">&gt;Shit taste in whiskey</span><br><span class=""quote"">&gt;Shit hairline</span><br><span class=""quote"">&gt;Has his ex wife&#039;s tattooed on his neck</span><br><span class=""quote"">&gt;Failed at his first marriage so badly that he resorted to marrying an anorexic bimbo</span><br><span class=""quote"">&gt;Only significant achievement was accidently being booked to have a Wrestlemania streak</span><br><span class=""quote"">&gt;Is the wrestling equivalent of that one insufferably mediocre middle manager whose sole professional &quot;&quot;&quot;&quot;&quot;&quot;&quot;achievement&quot;&quot;&quot;&quot;&quot;&quot; is staying in the same shitty job for 25 years</span><br><span class=""quote"">&gt;Drew so poorly in his 1997 title run that Bret Hart of all people had to take the belt off him</span><br><span class=""quote"">&gt;spent the latter part of his career burying superior young talent</span><br><span class=""quote"">&gt;The biggest impact he had on the business was sitting around in the back and telling one of his no-draw buddies to job to someone who could actually draw dime.</span><br><span class=""quote"">&gt;Voted for Hillary Clinton like the cuck he is </span><br><span class=""quote"">&gt;Despite changing into all his gimmick gear, couldn&#039;t draw LeBron James out of his dressing room despite standing around for an hour</span>', 'filename': '1650241723935', 'ext': '.jpg', 'w': 852, 'h': 477, 'tn_w': 125, 'tn_h': 69, 'tim': 1670931712466960, 'time': 1670931712, 'md5': 'fsXsvdXqnP9FwcdVnbtr8g==', 'fsize': 129555, 'resto': 8228492}]",1670931712,
34,8237428,12/13/22(Tue)06:37:03,Anonymous,"What do you think? Just another name on the list, or someone that could help correct the ship that is AEW&#039;s visual presentation? Do you expect more WWE-style shaky cam and rapid camera cuts?<br><span class=""quote"">&gt;According to Mike Johnson at PWInsider, AEW has hired Mike Mansury, who was previously the Vice President of Global Television Production for WWE. He will reportedly start with AEW at Wednesday&#039;s AEW Dynamite.</span><br><span class=""quote"">&gt;Mansury&#039;s official title is Senior Vice President &amp; Co-Executive Producer for AEW.</span><br><span class=""quote"">&gt;After leaving WWE, Mansury worked as an Executive Producer for Pat McAfee before working as Senior Vice President &amp; Executive Producer - Global Production for ONE MMA.</span><br><span class=""quote"">&gt;Starting in 2009, Mansury was with WWE for 11 years and left on his own accord in May 2020.</span>",img_0550,.jpg,989,1024,241,250,1670931423200693,1670931423,kIK2jJqqIJT3piXv7+RYtg==,141174,0,0,0,what-do-you-think-just-another-name-on-the-list,0,0,,,,1670931423,
35,8237400,12/13/22(Tue)06:21:30,Anonymous,i had jushin liger and vader hold the tag titles for over 3 years and it was based<br><br>also had chris kanyon as mortis be a double IC and World champion for a long ass time and feud with Hakushi which was dimes,FBRFYRTWQAc5OMb,.png,300,300,250,250,1670930490856763,1670930490,Kaz0FtXJ3uSxglhSgGFYfg==,88235,0,0,0,most-kino-thing-youve-booked-in-any-booking,1,0,,,"[{'no': 8237427, 'now': '12/13/22(Tue)06:37:00', 'name': 'Anonymous', 'com': '<span class=""quote"">&gt;most kino thing you&#039;ve booked</span><br>A 6&#039;4 Russian chiropractor. She heemed the shit out of me. Fixed my fucking back.', 'time': 1670931420, 'resto': 8237400}]",1670931420,most kino thing you&#039;ve booked in any booking simulator
36,8233704,12/12/22(Mon)21:12:49,Anonymous,She is too beautiful for wrestling,20221212_201133,.jpg,1080,1616,167,250,1670897569399377,1670897569,96frsabyAlhs+OXcCrwl4Q==,291558,0,0,0,she-is-too-beautiful-for-wrestling,47,11,42.0,10.0,"[{'no': 8236988, 'now': '12/13/22(Tue)03:01:06', 'name': 'Anonymous', 'com': 'Finn dumped her for Mexican Brie Larson.', 'time': 1670918466, 'resto': 8233704}, {'no': 8236993, 'now': '12/13/22(Tue)03:01:57', 'name': 'Anonymous', 'com': '<a href=""#p8233739"" class=""quotelink"">&gt;&gt;8233739</a><br><span class=""quote"">&gt;she has had sex!!!</span>', 'filename': '219565', 'ext': '.jpg', 'w': 645, 'h': 770, 'tn_w': 104, 'tn_h': 125, 'tim': 1670918517968119, 'time': 1670918517, 'md5': '8edwPKvrzo2qCkt0yOtOQg==', 'fsize': 142734, 'resto': 8233704}, {'no': 8236994, 'now': '12/13/22(Tue)03:02:02', 'name': 'Anonymous', 'com': '<a href=""#p8233870"" class=""quotelink"">&gt;&gt;8233870</a><br>So did she, or not?', 'time': 1670918522, 'resto': 8233704}, {'no': 8237322, 'now': '12/13/22(Tue)05:43:31', 'name': 'Anonymous', 'com': 'Those glossy legs work me into a shoot.', 'time': 1670928211, 'resto': 8233704}, {'no': 8237421, 'now': '12/13/22(Tue)06:34:09', 'name': 'Anonymous', 'com': '<a href=""#p8233704"" class=""quotelink"">&gt;&gt;8233704</a><br><a href=""#p8233785"" class=""quotelink"">&gt;&gt;8233785</a><br><a href=""#p8235884"" class=""quotelink"">&gt;&gt;8235884</a><br><a href=""#p8236421"" class=""quotelink"">&gt;&gt;8236421</a><br><a href=""#p8236642"" class=""quotelink"">&gt;&gt;8236642</a><br><a href=""#p8236774"" class=""quotelink"">&gt;&gt;8236774</a><br><a href=""#p8236854"" class=""quotelink"">&gt;&gt;8236854</a><br><a href=""#p8236871"" class=""quotelink"">&gt;&gt;8236871</a><br>Would bust multiple times in her', 'time': 1670931249, 'resto': 8233704}]",1670931249,
37,8237275,12/13/22(Tue)05:19:39,Anonymous,What was the Hulkster writing here?,946,.jpg,320,303,250,236,1670926779734133,1670926779,KKUysjLrCA5nWeHp/J+6Jw==,25039,0,0,0,what-was-the-hulkster-writing-here,8,0,3.0,0.0,"[{'no': 8237295, 'now': '12/13/22(Tue)05:30:34', 'name': 'Anonymous', 'com': '<a href=""#p8237275"" class=""quotelink"">&gt;&gt;8237275</a><br>NWO<br>He was the leader at the time.', 'time': 1670927434, 'resto': 8237275}, {'no': 8237353, 'now': '12/13/22(Tue)06:00:02', 'name': 'Anonymous', 'com': '<a href=""#p8237275"" class=""quotelink"">&gt;&gt;8237275</a><br>&quot;New Day Rocks&quot;', 'time': 1670929202, 'resto': 8237275}, {'no': 8237368, 'now': '12/13/22(Tue)06:06:03', 'name': 'Anonymous', 'com': '<a href=""#p8237275"" class=""quotelink"">&gt;&gt;8237275</a><br>No, that&#039;s not gonna work for me brother', 'time': 1670929563, 'resto': 8237275}, {'no': 8237373, 'now': '12/13/22(Tue)06:06:59', 'name': 'Anonymous', 'com': '<a href=""#p8237275"" class=""quotelink"">&gt;&gt;8237275</a><br>never give up on your dreams<br>thank you hulkster', 'time': 1670929619, 'resto': 8237275}, {'no': 8237417, 'now': '12/13/22(Tue)06:32:22', 'name': 'Anonymous', 'com': '<a href=""#p8237275"" class=""quotelink"">&gt;&gt;8237275</a><br>Night of Champions, where the Hulkster&#039;s going to win the match and take that strap home!', 'time': 1670931142, 'resto': 8237275}]",1670931142,
38,8236942,12/13/22(Tue)02:41:24,Anonymous,This is wrestling,WrestleMania 19 Victoria vs. Trish Stratus vs. Jazz,.jpg,512,386,250,188,1670917284582663,1670917284,9WYasMcepx6CadHhQMVc6A==,47306,0,0,0,this-is-wrestling,3,0,,,"[{'no': 8236953, 'now': '12/13/22(Tue)02:45:48', 'name': 'Anonymous', 'com': '<a href=""#p8236942"" class=""quotelink"">&gt;&gt;8236942</a><br>Is that Big Stevie Cool?<br>leader of the bWo, RTC, and master of the stevie kick?<br>how did he get 3 women?', 'time': 1670917548, 'resto': 8236942}, {'no': 8237240, 'now': '12/13/22(Tue)05:05:05', 'name': 'Anonymous', 'com': '<a href=""#p8236942"" class=""quotelink"">&gt;&gt;8236942</a><br>One of the greatest all time women&#039;s matches and maybe Trish&#039;s best. Shame about the botch when Jazz fell outside', 'time': 1670925905, 'resto': 8236942}, {'no': 8237415, 'now': '12/13/22(Tue)06:32:03', 'name': 'Anonymous', 'com': '<a href=""#p8236942"" class=""quotelink"">&gt;&gt;8236942</a><br>I miss those old match card graphics. Even during B shows they made the show feel bigger than it actually was.', 'time': 1670931123, 'resto': 8236942}]",1670931123,
39,8237249,12/13/22(Tue)05:08:53,Anonymous,I miss this drip,rol,.png,987,556,250,140,1670926133328757,1670926133,SxpWKMiB8CBo+znzLgvn8Q==,896900,0,0,0,i-miss-this-drip,1,0,,,"[{'no': 8237414, 'now': '12/13/22(Tue)06:31:59', 'name': 'Anonymous', 'com': '<a href=""#p8237249"" class=""quotelink"">&gt;&gt;8237249</a><br>Shoot one of the biggest missed shots of Vince booking. The matches were effortlessly cool, deadpan comedy of Owens and maniacal Rollins gelled perfectly in promos.', 'time': 1670931119, 'resto': 8237249}]",1670931119,
40,8237409,12/13/22(Tue)06:29:06,Anonymous,"Honestly, I don’t know who the fuck or what the fuck Mussolini is either.",43504D0E-3A83-427B-B648-2801B4D9FB6D,.jpg,750,993,188,250,1670930946585867,1670930946,0Gzk39xHrtZGoY2JZBRFwA==,613682,0,0,0,honestly-i-dont-know-who-the-fuck-or-what-the,2,1,,,"[{'no': 8237413, 'now': '12/13/22(Tue)06:31:21', 'name': 'Anonymous', 'com': '<a href=""#p8237409"" class=""quotelink"">&gt;&gt;8237409</a><br>butt', 'time': 1670931081, 'resto': 8237409}, {'no': 8237416, 'now': '12/13/22(Tue)06:32:06', 'name': 'Anonymous', 'com': 'More like Britt Caker', 'filename': 'B19C290C-0ACD-4582-B4FA-215AB70A7D79', 'ext': '.jpg', 'w': 1080, 'h': 1350, 'tn_w': 100, 'tn_h': 125, 'tim': 1670931126935527, 'time': 1670931126, 'md5': '9RcyGDf7doyg7TnmgYP6gg==', 'fsize': 126978, 'resto': 8237409}]",1670931126,
41,8237142,12/13/22(Tue)04:21:19,Anonymous,"<span class=""quote"">&gt;his accent filters out the normies</span><br>HOLY FUCKING BASED",channels4_profile,.jpg,900,900,250,250,1670923279725846,1670923279,C5/O7G7ksFQXdbZcsepzew==,153787,0,0,0,his-accent-filters-out-the-normies,9,0,4.0,0.0,"[{'no': 8237189, 'now': '12/13/22(Tue)04:43:03', 'name': 'Anonymous', 'com': '<a href=""#p8237187"" class=""quotelink"">&gt;&gt;8237187</a><br>here comes the zoomer contrarian', 'time': 1670924583, 'resto': 8237142}, {'no': 8237201, 'now': '12/13/22(Tue)04:47:20', 'name': 'Anonymous', 'com': '<a href=""#p8237189"" class=""quotelink"">&gt;&gt;8237189</a><br>Watching faggots on YouTube is THE zoomer thing to do', 'time': 1670924840, 'resto': 8237142}, {'no': 8237211, 'now': '12/13/22(Tue)04:51:31', 'name': 'Anonymous', 'com': '<a href=""#p8237201"" class=""quotelink"">&gt;&gt;8237201</a><br>Keep hating everything and pretending that&#039;s a personality.', 'time': 1670925091, 'resto': 8237142}, {'no': 8237242, 'now': '12/13/22(Tue)05:06:00', 'name': 'Anonymous', 'com': '<a href=""#p8237201"" class=""quotelink"">&gt;&gt;8237201</a><br>youre literally a phoneposter <br>shut the fuck up', 'time': 1670925960, 'resto': 8237142}, {'no': 8237412, 'now': '12/13/22(Tue)06:31:09', 'name': 'Anonymous', 'com': '<a href=""#p8237160"" class=""quotelink"">&gt;&gt;8237160</a><br>its actually a decent meme', 'time': 1670931069, 'resto': 8237142}]",1670931069,
42,8231265,12/12/22(Mon)17:56:51,Anonymous,#30,mib,.png,961,709,249,184,1670885811939953,1670885811,8BN+EJ1h/OrhH7s28g7d7A==,743158,0,0,0,30,12,5,7.0,4.0,"[{'no': 8232913, 'now': '12/12/22(Mon)20:26:25', 'name': 'Anonymous', 'com': '<a href=""#p8232036"" class=""quotelink"">&gt;&gt;8232036</a><br><a href=""#p8232094"" class=""quotelink"">&gt;&gt;8232094</a><br><span class=""quote"">&gt;you think you&#039;re special</span>', 'time': 1670894785, 'resto': 8231265}, {'no': 8234946, 'now': '12/12/22(Mon)22:24:07', 'name': 'Anonymous', 'com': '<a href=""#p8231265"" class=""quotelink"">&gt;&gt;8231265</a><br>Not a dime in sight', 'time': 1670901847, 'resto': 8231265}, {'no': 8236278, 'now': '12/13/22(Tue)00:15:32', 'name': 'Anonymous', 'com': '<a href=""#p8232036"" class=""quotelink"">&gt;&gt;8232036</a><br>Can&#039;t wait to see him return in Fight Forever', 'time': 1670908532, 'resto': 8231265}, {'no': 8236788, 'now': '12/13/22(Tue)01:56:31', 'name': 'Anonymous', 'com': '<a href=""#p8232704"" class=""quotelink"">&gt;&gt;8232704</a><br>I used to switch his outfit to pink and re-name him Frankenberry.', 'time': 1670914591, 'resto': 8231265}, {'no': 8237411, 'now': '12/13/22(Tue)06:29:54', 'name': 'Anonymous', 'com': '<a href=""#p8231265"" class=""quotelink"">&gt;&gt;8231265</a>', 'filename': '20221213_192916', 'ext': '.jpg', 'w': 1064, 'h': 952, 'tn_w': 125, 'tn_h': 111, 'tim': 1670930994029132, 'time': 1670930994, 'md5': 'hOsd5C3WR0B80Xm+JsODVw==', 'fsize': 93915, 'resto': 8231265}]",1670930994,
43,8236747,12/13/22(Tue)01:48:58,Anonymous,Turns out that screenshot of a text some anon&#039;s dad sent him about being on vacation and spotting Riddle fucking a pornstar iñ a public spa pool wasn&#039;t a LARP,FB_IMG_1670914007980,.jpg,720,1055,170,250,1670914138434883,1670914138,kcSFG3szBAYNWXzd1uFssg==,65368,0,0,0,turns-out-that-screenshot-of-a-text-some-anons,25,5,20.0,5.0,"[{'no': 8237378, 'now': '12/13/22(Tue)06:11:10', 'name': 'Anonymous', 'com': 'I fucking love porn. Never watched her videos but ill definitely give it a watch. Congrats to riddle. Pornstars are based and probably really good at sex', 'time': 1670929870, 'resto': 8236747}, {'no': 8237390, 'now': '12/13/22(Tue)06:17:29', 'name': 'Anonymous', 'com': '<a href=""#p8236950"" class=""quotelink"">&gt;&gt;8236950</a><br>Anon, your old folks have a Cornette relationship.', 'time': 1670930249, 'resto': 8236747}, {'no': 8237392, 'now': '12/13/22(Tue)06:18:25', 'name': 'Anonymous', 'com': '<a href=""#p8236747"" class=""quotelink"">&gt;&gt;8236747</a><br><a href=""#p8236765"" class=""quotelink"">&gt;&gt;8236765</a><br>do zoomers really think this is attractive? no wonder they are confused about their own gender', 'time': 1670930305, 'resto': 8236747}, {'no': 8237398, 'now': '12/13/22(Tue)06:20:35', 'name': 'Anonymous', 'com': 'Pornstars don&#039;t always like sex<br>My friend dated one and they only had sex twice in a 4 month relationship', 'time': 1670930435, 'resto': 8236747}, {'no': 8237406, 'now': '12/13/22(Tue)06:26:07', 'name': 'Anonymous', 'com': '<a href=""#p8236805"" class=""quotelink"">&gt;&gt;8236805</a><br>Why didnt he record the sound atleast?', 'time': 1670930767, 'resto': 8236747}]",1670930767,
44,8231256,12/12/22(Mon)17:55:35,Anonymous,how do i achieve this body?,1670644076808299,.png,577,957,150,250,1670885735098528,1670885735,go6vu1eWicoySyZBK/S3sQ==,879607,0,0,0,how-do-i-achieve-this-body,32,3,27.0,3.0,"[{'no': 8234608, 'now': '12/12/22(Mon)22:04:15', 'name': 'Anonymous', 'com': '<a href=""#p8231441"" class=""quotelink"">&gt;&gt;8231441</a><br>wtf? damn bongs really are subhuman', 'time': 1670900655, 'resto': 8231256}, {'no': 8236175, 'now': '12/12/22(Mon)23:55:57', 'name': 'Anonymous', 'com': '<a href=""#p8231256"" class=""quotelink"">&gt;&gt;8231256</a><br>eat', 'time': 1670907357, 'resto': 8231256}, {'no': 8236194, 'now': '12/12/22(Mon)23:58:13', 'name': 'Anonymous', 'com': '<a href=""#p8231256"" class=""quotelink"">&gt;&gt;8231256</a><br>Beans and toast + a pint', 'time': 1670907493, 'resto': 8231256}, {'no': 8237397, 'now': '12/13/22(Tue)06:20:33', 'name': 'Anonymous', 'com': '<a href=""#p8231256"" class=""quotelink"">&gt;&gt;8231256</a><br>Has he been signed to a 300k a year deal yet? It&#039;s worth it for being in one of the 9 matches on a youtube show that does 100k views in a week.', 'time': 1670930433, 'resto': 8231256}, {'no': 8237405, 'now': '12/13/22(Tue)06:25:23', 'name': 'Anonymous', 'com': '<a href=""#p8231256"" class=""quotelink"">&gt;&gt;8231256</a><br>Body By Greggs', 'time': 1670930723, 'resto': 8231256}]",1670930723,
45,8227950,12/12/22(Mon)12:03:42,Anonymous,IT&#039;S UP!<br>https://www.youtube.com/watch?v=YoZ<wbr>9xd97uxE,maxresdefault,.jpg,1280,720,250,140,1670864622662499,1670864622,ew/MyDf/o6Cff6IU/ol/Hw==,80824,0,0,0,innout-or-whataburger-being-the-elite-ep-326,58,12,53.0,11.0,"[{'no': 8237318, 'now': '12/13/22(Tue)05:40:44', 'name': 'Anonymous', 'com': '<a href=""#p8237244"" class=""quotelink"">&gt;&gt;8237244</a><br>Preston Vance was a Cody guy<br>It&#039;s funny that the Chucklefucks and Twinkle toes said they had no problem with Cody, but won&#039;t actually book any of Cody&#039;s guys into serious programs until MJF pushed for Starks', 'time': 1670928044, 'resto': 8227950}, {'no': 8237357, 'now': '12/13/22(Tue)06:02:33', 'name': 'Anonymous', 'com': '<a href=""#p8227950"" class=""quotelink"">&gt;&gt;8227950</a><br><span class=""quote"">&gt;In-N-Out or Whataburger?</span><br>I&#039;ve never tried either of them in my whole life. :)', 'filename': '65536', 'ext': '.png', 'w': 1200, 'h': 1200, 'tn_w': 125, 'tn_h': 125, 'tim': 1670929353942990, 'time': 1670929353, 'md5': 'Hrf/fAJQ3uJPDl24Blo5mw==', 'fsize': 2631028, 'resto': 8227950}, {'no': 8237380, 'now': '12/13/22(Tue)06:11:26', 'name': 'Anonymous', 'com': '<a href=""#p8237318"" class=""quotelink"">&gt;&gt;8237318</a><br>stop embarrassing yourself you retard.<br>(1) tony kahn is the booker and decides who to push and who not to<br>(2) preston vance is a shitter. the worst member of dark order. he doesn&#039;t seem to have improved much since he was signed. he has no charisma. he can&#039;t promo. he&#039;s shit in ring. all he&#039;s got is his roid physique, and the&#039;d just push brian cage if that&#039;s what they wanted.', 'time': 1670929886, 'resto': 8227950}, {'no': 8237384, 'now': '12/13/22(Tue)06:14:52', 'name': 'Anonymous', 'com': '<a href=""#p8237380"" class=""quotelink"">&gt;&gt;8237380</a><br>Kys Chucklefucks apologist, since Tony is desperate for friends he lets them in his ear all the time, to say they don&#039;t have any sway when it comes to booking is willfully ignorance from a smooth brained faggot like yourself', 'time': 1670930092, 'resto': 8227950}, {'no': 8237393, 'now': '12/13/22(Tue)06:18:40', 'name': 'Anonymous', 'com': '<a href=""#p8229083"" class=""quotelink"">&gt;&gt;8229083</a><br>mark henry&#039;s the goat powerlifter', 'time': 1670930320, 'resto': 8227950}]",1670930320,“In-N-Out or Whataburger?” - Being The Elite Ep. 326
46,8236768,12/13/22(Tue)01:53:12,Anonymous,Naked Mideon thread,naked mideon,.jpg,378,470,201,250,1670914392376896,1670914392,AH7tQ64nLZsLsT+ZyFVjhQ==,19981,0,0,0,naked-mideon-thread,4,0,,,"[{'no': 8236819, 'now': '12/13/22(Tue)02:05:25', 'name': 'Anonymous', 'com': '<a href=""#p8236768"" class=""quotelink"">&gt;&gt;8236768</a><br>What’s with the Stalin tattoo?', 'time': 1670915125, 'resto': 8236768}, {'no': 8237166, 'now': '12/13/22(Tue)04:33:37', 'name': 'Anonymous', 'com': '<a href=""#p8236768"" class=""quotelink"">&gt;&gt;8236768</a><br>Based', 'time': 1670924017, 'resto': 8236768}, {'no': 8237383, 'now': '12/13/22(Tue)06:14:39', 'name': 'Anonymous', 'com': 'Legit nice guy who loves the fans.', 'time': 1670930079, 'resto': 8236768}, {'no': 8237385, 'now': '12/13/22(Tue)06:15:59', 'name': 'Anonymous', 'com': '<a href=""#p8236768"" class=""quotelink"">&gt;&gt;8236768</a><br>obviously a guy comfortable in his own skin', 'time': 1670930159, 'resto': 8236768}]",1670930159,
47,8237271,12/13/22(Tue)05:17:28,Anonymous,"All women are ugly and unattractive, once you see it you can&#039;t unsee it.",740full-brandi-lauren,.jpg,740,925,200,250,1670926648475262,1670926648,Mxke781+dZrEG/3y7yNN9w==,103375,0,0,0,all-women-are-ugly-and-unattractive-once-you-see,3,0,,,"[{'no': 8237272, 'now': '12/13/22(Tue)05:18:38', 'name': 'Anonymous', 'com': 'maybe you&#039;re just gay', 'time': 1670926718, 'resto': 8237271}, {'no': 8237273, 'now': '12/13/22(Tue)05:18:45', 'name': 'Anonymous', 'com': '<a href=""#p8237271"" class=""quotelink"">&gt;&gt;8237271</a><br>Omg i see it. Wtf Im gay now. Fuck you op', 'time': 1670926725, 'resto': 8237271}, {'no': 8237367, 'now': '12/13/22(Tue)06:05:42', 'name': 'Anonymous', 'com': '<a href=""#p8237271"" class=""quotelink"">&gt;&gt;8237271</a><br>Brandi had a Fake ass', 'time': 1670929542, 'resto': 8237271}]",1670929542,
