,no,now,name,com,filename,ext,w,h,tn_w,tn_h,tim,time,md5,fsize,resto,bumplimit,imagelimit,semantic_url,replies,images,omitted_posts,omitted_images,last_replies,last_modified,sub
62,8236438,12/13/22(Tue)00:40:51,Anonymous,It&#039;s a size matters business and I&#039;m below average so no women SHOOT want me brother. My storyline is to be a catering jobber forever,1670802448984884,.png,794,624,249,196,1670910051180014,1670910051,wDLimHOKOP3ng5JXUeQnZw==,11326,0,0,0,its-a-size-matters-business-and-im-below-average,27,6,22.0,5.0,"[{'no': 8237095, 'now': '12/13/22(Tue)03:55:24', 'name': 'Anonymous', 'com': '<a href=""#p8236438"" class=""quotelink"">&gt;&gt;8236438</a><br>You need to move to a smaller division<br>look up the average male height and dick length in Japan', 'filename': '1641415235698', 'ext': '.jpg', 'w': 1283, 'h': 2071, 'tn_w': 77, 'tn_h': 125, 'tim': 1670921724755939, 'time': 1670921724, 'md5': 'NnCI0MyWtOkxwZqC6AkWog==', 'fsize': 380994, 'resto': 8236438}, {'no': 8237097, 'now': '12/13/22(Tue)03:56:07', 'name': 'Anonymous', 'com': '<a href=""#p8236812"" class=""quotelink"">&gt;&gt;8236812</a><br>Sumomaxx and find some women who are into the whole fat ugly bastard thing', 'time': 1670921767, 'resto': 8236438}, {'no': 8237177, 'now': '12/13/22(Tue)04:38:04', 'name': 'Anonymous', 'com': 'i got a shoot HOG but let me tell you brother that i cant work a match to get a spot like sex if i tried. the truth is that i couldnt draw a dime if you gave me a pen and some paper. i couldnt put asses in seats if you gave me a donkey and a chair. i am a janetty. thats a shoot brother. no use complaining about it because even if i cant make it in the big leagues i can just hop onto the indies and my name will carry me far enough i tell you for real. never forget its all about money and miles baby.', 'time': 1670924284, 'resto': 8236438}, {'no': 8237225, 'now': '12/13/22(Tue)04:56:18', 'name': 'Anonymous', 'com': '<a href=""#p8236479"" class=""quotelink"">&gt;&gt;8236479</a><br>mmm badd ass', 'time': 1670925378, 'resto': 8236438}, {'no': 8237236, 'now': '12/13/22(Tue)05:02:47', 'name': 'Anonymous', 'com': '8 inches here, average thickness, got the “hit spots no one has ever hit before” promo a couple of times.<br><br>Life is cruel. I’m 6’2, former college athlete. Got some spinal surgery from old injury. Dick only works about 40% of the time. Had to get some of those blue chew gimmicks, and they seem to do the trick.', 'time': 1670925767, 'resto': 8236438}]",1670925767,
63,8237232,12/13/22(Tue)05:00:37,Anonymous,Name a better theme song<br>protip: you can&#039;t<br>https://www.youtube.com/watch?v=jx1<wbr>6bJGqbP0,kMK0dPS,.jpg,600,600,250,250,1670925637167059,1670925637,0O3Jg8fZsFO7jZhT13SRFA==,152133,0,0,0,name-a-better-theme-song,0,0,,,,1670925637,
64,8236750,12/13/22(Tue)01:49:34,Anonymous,I miss it,A_Jingle_with_Jillian,.jpg,300,300,250,250,1670914174505032,1670914174,+JQ4M/+CUDYF0jB0X+rdow==,50342,0,0,0,i-miss-it,4,0,,,"[{'no': 8236773, 'now': '12/13/22(Tue)01:54:00', 'name': 'Anonymous', 'com': '<a href=""#p8236750"" class=""quotelink"">&gt;&gt;8236750</a><br>amazing bimbo', 'time': 1670914440, 'resto': 8236750}, {'no': 8236890, 'now': '12/13/22(Tue)02:22:49', 'name': 'Anonymous', 'com': 'What, that stupid shit that would screech in your fucking ear every Christmas on fucking /wooo/? I hope Kirt sucks a shotgun for letting that place go to shit the way he did.', 'time': 1670916169, 'resto': 8236750}, {'no': 8236902, 'now': '12/13/22(Tue)02:27:10', 'name': 'Anonymous', 'com': '<a href=""#p8236890"" class=""quotelink"">&gt;&gt;8236890</a><br>It&#039;s the only reason I ever visited the site since /asp/ was created. Makes me feel nostalgic for winter 2010.', 'time': 1670916430, 'resto': 8236750}, {'no': 8237230, 'now': '12/13/22(Tue)04:59:25', 'name': 'Anonymous', 'com': '<a href=""#p8236750"" class=""quotelink"">&gt;&gt;8236750</a><br>have yourself... a vary mary CHRISTmas...', 'time': 1670925565, 'resto': 8236750}]",1670925565,
65,8221404,12/11/22(Sun)16:04:45,Anonymous,Socials:<br>https://twitter.com/LaceyEvansWWE<br>https://www.instagram.com/laceyevan<wbr>swwe/<br><br>Promos:<br>https://www.youtube.com/watch?v=To9<wbr>2R01TYi4<br>https://www.youtube.com/watch?v=sIj<wbr>qKNuOjqE<br>https://www.youtube.com/watch?v=sA3<wbr>27sy1Qn4,Lacey Evans white,.webm,640,1136,140,250,1670792685276708,1670792685,ikTdoUIdU168tvYhiXRnXA==,3140794,0,0,0,le-lacey-evans-32,62,22,57.0,22.0,"[{'no': 8236316, 'now': '12/13/22(Tue)00:22:15', 'name': 'Anonymous', 'com': '<a href=""#p8236232"" class=""quotelink"">&gt;&gt;8236232</a><br>You have a Mandy containment thread. Stay there.', 'time': 1670908935, 'resto': 8221404}, {'no': 8236463, 'now': '12/13/22(Tue)00:45:16', 'name': 'Anonymous', 'com': '<a href=""#p8221426"" class=""quotelink"">&gt;&gt;8221426</a><br>I&#039;m coming if you know what I mean', 'time': 1670910316, 'resto': 8221404}, {'no': 8236490, 'now': '12/13/22(Tue)00:52:35', 'name': 'Anonymous', 'com': '<a href=""#p8221426"" class=""quotelink"">&gt;&gt;8221426</a><br>so where is this from?', 'time': 1670910755, 'resto': 8221404}, {'no': 8237196, 'now': '12/13/22(Tue)04:45:05', 'name': 'Anonymous', 'com': 'Me- Mommy mommy My peepee is paining<br>Lacey- Come here dear let mommy massage it<br>Me - Yes mommy<br>Lacey- Oh honey you getting hard in mommy&#039;s hand. Oh sweetie I didn&#039;t know you such a big boy.', 'time': 1670924705, 'resto': 8221404}, {'no': 8237203, 'now': '12/13/22(Tue)04:47:34', 'name': 'Anonymous', 'com': '<a href=""#p8237196"" class=""quotelink"">&gt;&gt;8237196</a><br>Where&#039;s the part where you wake up alone on an air mattress unloved?', 'time': 1670924854, 'resto': 8221404}]",1670924854,//LE// Lacey Evans (32)
66,8208480,12/10/22(Sat)10:20:53,Anonymous,"- Michinoku Pro Wrestling The Great Space War 2022 will be airing on Samurai TV<br><br>- Shinnichichan Christmas episode will be airing next week on TV Asahi with Miki and Pieter<br><br><br>Previous <a href=""/pw/thread/8128233#p8128233"" class=""quotelink"">&gt;&gt;8128233</a>",FjiuACEaAAEpkkX,.jpg,2048,1536,250,187,1670685653860795,1670685653,MQ8YPxaHoXji0jeb4xm9BA==,672550,0,0,0,miki-friends,100,46,95.0,46.0,"[{'no': 8236503, 'now': '12/13/22(Tue)00:53:43', 'name': 'Anonymous', 'com': '<a href=""#p8236029"" class=""quotelink"">&gt;&gt;8236029</a><br>cute', 'time': 1670910823, 'resto': 8208480}, {'no': 8236666, 'now': '12/13/22(Tue)01:29:05', 'name': 'Anonymous', 'com': 'Remember Chris Brookes? He&#039;s become completely owacon.', 'time': 1670912945, 'resto': 8208480}, {'no': 8236692, 'now': '12/13/22(Tue)01:36:32', 'name': 'Anonymous', 'com': 'https://www.youtube.com/watch?v=Up_<wbr>yVVG6Foo', 'time': 1670913392, 'resto': 8208480}, {'no': 8237186, 'now': '12/13/22(Tue)04:41:18', 'name': 'Anonymous', 'com': '<a href=""#p8236029"" class=""quotelink"">&gt;&gt;8236029</a><br>cutie', 'time': 1670924478, 'resto': 8208480}, {'no': 8237199, 'now': '12/13/22(Tue)04:46:08', 'name': 'Anonymous', 'com': '<a href=""#p8236666"" class=""quotelink"">&gt;&gt;8236666</a><br>He would be remembered if he was the one banging Suruga.', 'time': 1670924768, 'resto': 8208480}]",1670924768,/Miki/ &amp; Friends
67,8210834,12/10/22(Sat)15:59:28,Anonymous,"Goodbye Edition:<br><br>Asuka&#039;s been acting peculiar lately.<br><br>KAIRI is your IWGP Women&#039;s Champion<br>-vs Utami Hayashishita at Stardom Dream Queendom 12/29<br>-vs Tam Nakano at Wrestle Kingdom 1/4<br><br>https://twitter.com/WWEAsuka<br>https://twitter.com/KAIRI_official<br>https://twitter.com/SarrayWWE<br>https://twitter.com/satomurameiko<br>https://twitter.com/Iyo_SkyWWE<br>https://twitter.com/XiaWWE<br><br>https://www.instagram.com/wwe_asuka<wbr>/<br>https://www.instagram.com/official_<wbr>kairi/<br>https://www.instagram.com/sarray_ww<wbr>e/<br>https://www.instagram.com/meiko_sat<wbr>omura/<br>https://www.instagram.com/iyo_sky<br>https://www.instagram.com/xialiwwe/<wbr><br><br>Asuka Shoutout<br>https://youtu.be/x74xvn2T18E<br><br>KanaChan Plays Arcade Games in her Room<br>https://youtu.be/9XbMgZs7Ou4<br><br>Previous: <a href=""/pw/thread/8174959#p8174959"" class=""quotelink"">&gt;&gt;8174959</a>",FjWO7wZVsAAm6XL,.jpg,1750,2453,178,250,1670705968590298,1670705968,LFnnBS3xMc9PU0+gntIu7A==,1022200,0,1,0,kabuki-klub,313,148,308.0,148.0,"[{'no': 8237180, 'now': '12/13/22(Tue)04:38:28', 'name': 'Anonymous', 'com': '<a href=""#p8237174"" class=""quotelink"">&gt;&gt;8237174</a><br>Yes, I have an Asuka fetish :p', 'time': 1670924308, 'resto': 8210834}, {'no': 8237285, 'now': '12/13/22(Tue)05:24:55', 'name': 'Anonymous', 'com': 'Asuka is taking time off I think <br>https://twitter.com/wweasuka/status<wbr>/1602604000603508738?s=61&amp;t=heWX4yH<wbr>FCI6x4k6Ycmjwxg', 'time': 1670927095, 'resto': 8210834}, {'no': 8237293, 'now': '12/13/22(Tue)05:29:21', 'name': 'Anonymous', 'com': 'Haven&#039;t watched RAW in ages, but watched the Asuka match on youtube because people were saying she was moving back to her old ways. Crowd looked utterly dead and the arena noise sounded weird and muffled - more like a hairdryer than an audience. Is that typical for all RAWs? This RAW? Just the Asuka match?', 'time': 1670927361, 'resto': 8210834}, {'no': 8237310, 'now': '12/13/22(Tue)05:38:41', 'name': 'Anonymous', 'com': '<a href=""#p8237293"" class=""quotelink"">&gt;&gt;8237293</a><br>Raw crowds usually suck ass. They&#039;ll get into a match if it&#039;s good but they&#039;re always dead at the start.', 'time': 1670927921, 'resto': 8210834}, {'no': 8237401, 'now': '12/13/22(Tue)06:22:32', 'name': 'Anonymous', 'com': '<a href=""#p8237285"" class=""quotelink"">&gt;&gt;8237285</a><br>But she just came back though. Relatively speaking of course.', 'time': 1670930552, 'resto': 8210834}]",1670930552,/Kabuki/ Klub
68,8235185,12/12/22(Mon)22:36:09,Anonymous,Bray bros I&#039;m getting scared for /ourguy/&#039;s gimmick.,bliss bianca,.webm,1080,1080,250,250,1670902569842886,1670902569,1wa/85bN3PXVYAP6U1TEdg==,2060644,0,0,0,bray-bros-im-getting-scared-for-ourguys-gimmick,59,11,54.0,11.0,"[{'no': 8237077, 'now': '12/13/22(Tue)03:45:03', 'name': 'Anonymous', 'com': '<a href=""#p8235185"" class=""quotelink"">&gt;&gt;8235185</a><br>you mean Bray WARPED her MIND.', 'time': 1670921103, 'resto': 8235185}, {'no': 8237100, 'now': '12/13/22(Tue)03:56:26', 'name': 'Anonymous', 'com': '<a href=""#p8235185"" class=""quotelink"">&gt;&gt;8235185</a><br>The pinnacle of a true gimmick. Bray is the Pagan Shaman the inquisitors fear more than hell.', 'time': 1670921786, 'resto': 8235185}, {'no': 8237107, 'now': '12/13/22(Tue)04:02:06', 'name': 'Anonymous', 'com': '<a href=""#p8235206"" class=""quotelink"">&gt;&gt;8235206</a><br>What the literal fuck are you talking about lmao<br>She did bray&#039;s finisher setup and his logo flashed on the screen<br>Do you need to be beaten over the head with it?', 'time': 1670922126, 'resto': 8235185}, {'no': 8237110, 'now': '12/13/22(Tue)04:04:49', 'name': 'Anonymous', 'com': '<a href=""#p8236668"" class=""quotelink"">&gt;&gt;8236668</a><br>(u) look sooooo good<br>good 2 me', 'time': 1670922289, 'resto': 8235185}, {'no': 8237172, 'now': '12/13/22(Tue)04:35:34', 'name': 'Anonymous', 'com': '<a href=""#p8236922"" class=""quotelink"">&gt;&gt;8236922</a><br>*sniff sniff sniff* <br>You mean', 'time': 1670924134, 'resto': 8235185}]",1670924134,
69,8237007,12/13/22(Tue)03:08:05,Anonymous,"<span class=""quote"">&gt; be me earlier this year</span><br><span class=""quote"">&gt; have surgery</span><br><span class=""quote"">&gt; first day of recovery happens to be the day that summerslam is taking place</span><br><span class=""quote"">&gt; hospital staff puts me on diuretic painkillers </span><br><span class=""quote"">&gt; they kick in at the exact moment this happens</span><br><span class=""quote"">&gt; get jumpscared</span><br><span class=""quote"">&gt; start questioning reality, wondering if the joker is a hallucination</span><br><span class=""quote"">&gt; pass out, wake up to brock lesnar riding a tractor</span><br><span class=""quote"">&gt; mfw</span>",FY9la14WYAclGn0,.jpg,306,496,154,250,1670918885814420,1670918885,lh3M08rvxVHw/K3JiLyuNA==,28355,0,0,0,be-me-earlier-this-year,2,1,,,"[{'no': 8237169, 'now': '12/13/22(Tue)04:34:43', 'name': 'Anonymous', 'com': '<a href=""#p8237007"" class=""quotelink"">&gt;&gt;8237007</a>', 'filename': 'jajajajajajaja', 'ext': '.gif', 'w': 360, 'h': 346, 'tn_w': 125, 'tn_h': 120, 'tim': 1670924083117492, 'time': 1670924083, 'md5': 'og3dle0zxpNyRsHzcjLlGQ==', 'fsize': 174223, 'resto': 8237007}, {'no': 8237290, 'now': '12/13/22(Tue)05:27:00', 'name': 'Anonymous', 'com': '<a href=""#p8237007"" class=""quotelink"">&gt;&gt;8237007</a><br>James Bond Gets Confirms', 'time': 1670927220, 'resto': 8237007}]",1670927220,
70,8237129,12/13/22(Tue)04:16:00,Anonymous,Who&#039;d be in his stable.,zorgbot,.jpg,926,830,249,224,1670922960287376,1670922960,wYqCVnTYiSNRD3brHOFWHw==,370212,0,0,0,would-he-get-over,3,1,,,"[{'no': 8237139, 'now': '12/13/22(Tue)04:18:47', 'name': 'Anonymous', 'com': '<a href=""#p8237129"" class=""quotelink"">&gt;&gt;8237129</a>', 'filename': '025_sMISC_00000000_0466-417846545', 'ext': '.jpg', 'w': 1284, 'h': 722, 'tn_w': 125, 'tn_h': 70, 'tim': 1670923127544846, 'time': 1670923127, 'md5': '2j7eEtg/U0XNhT4a6RVeGQ==', 'fsize': 124080, 'resto': 8237129}, {'no': 8237150, 'now': '12/13/22(Tue)04:24:08', 'name': 'Anonymous', 'com': '<a href=""#p8237139"" class=""quotelink"">&gt;&gt;8237139</a><br>I see it', 'time': 1670923448, 'resto': 8237129}, {'no': 8237157, 'now': '12/13/22(Tue)04:27:32', 'name': 'Anonymous', 'com': 'Jimmy Havoc', 'time': 1670923652, 'resto': 8237129}]",1670923652,Would he get over?
71,8237141,12/13/22(Tue)04:20:39,Anonymous,admit it. image the dimes.,df9w5pc-7f51ea0d-dc62-4fd5-b053-418f5349d3b8,.png,1210,1360,222,250,1670923239179265,1670923239,gTsu9lvzHSrkH1Bgd5e4Zg==,2417412,0,0,0,admit-it-image-the-dimes,3,0,,,"[{'no': 8237145, 'now': '12/13/22(Tue)04:22:02', 'name': 'Anonymous', 'com': '<a href=""#p8237141"" class=""quotelink"">&gt;&gt;8237141</a><br>everyone is just a jobber at this point. Roman is going to have his empire crumble to some really hype shit. clash at castle was the only way this could have worked.', 'time': 1670923322, 'resto': 8237141}, {'no': 8237151, 'now': '12/13/22(Tue)04:25:29', 'name': 'Anonymous', 'com': '<a href=""#p8237145"" class=""quotelink"">&gt;&gt;8237145</a><br>who even left in the roster can have any hope of defeating roman legit for the titles or even one title? literally becoming annoying at this point. he doesn&#039;t even show up to weekly shows sometimes.', 'time': 1670923529, 'resto': 8237141}, {'no': 8237154, 'now': '12/13/22(Tue)04:26:55', 'name': 'Anonymous', 'com': '<a href=""#p8237141"" class=""quotelink"">&gt;&gt;8237141</a><br>Dirty hun bastard', 'time': 1670923615, 'resto': 8237141}]",1670923615,
72,8233087,12/12/22(Mon)20:36:17,Anonymous,iwatani mayu,Fjs-qJzUUAAdJ_w,.jpg,1500,1500,250,250,1670895377589269,1670895377,2X0dW2v58ZOgFsFtcatBow==,559430,0,0,0,iwatani-mayu,20,10,15.0,8.0,"[{'no': 8237009, 'now': '12/13/22(Tue)03:08:34', 'name': 'Anonymous', 'com': 'I was recently riding the subway when I ran into Mayu Iwatani. I didn&#039;t want to be a mark so I ignored her. That is until she sexually assaulted me. I&#039;m going to file a complaint with Rossy Ogawa over this. If necessary I will take this complaint to Bushiroad directly', 'filename': '1669523334229', 'ext': '.webm', 'w': 1280, 'h': 720, 'tn_w': 125, 'tn_h': 70, 'tim': 1670918914270810, 'time': 1670918914, 'md5': 'F5Sawg6dW35JnmB6n1Axww==', 'fsize': 2474377, 'resto': 8233087}, {'no': 8237014, 'now': '12/13/22(Tue)03:09:57', 'name': 'Anonymous', 'com': '<a href=""#p8237009"" class=""quotelink"">&gt;&gt;8237009</a><br>code', 'time': 1670918997, 'resto': 8233087}, {'no': 8237032, 'now': '12/13/22(Tue)03:18:54', 'name': 'Anonymous', 'com': '<a href=""#p8237014"" class=""quotelink"">&gt;&gt;8237014</a><br>Stardom World', 'time': 1670919534, 'resto': 8233087}, {'no': 8237060, 'now': '12/13/22(Tue)03:35:30', 'name': 'Anonymous', 'com': '<a href=""#p8237014"" class=""quotelink"">&gt;&gt;8237014</a><br>kanade kanon but idk the code', 'time': 1670920530, 'resto': 8233087}, {'no': 8237140, 'now': '12/13/22(Tue)04:19:08', 'name': 'Anonymous', 'com': '<a href=""#p8233087"" class=""quotelink"">&gt;&gt;8233087</a><br>i want a mayu hat', 'filename': 'Fjx65t1UYAA-Koi', 'ext': '.jpg', 'w': 1365, 'h': 2048, 'tn_w': 83, 'tn_h': 125, 'tim': 1670923148990644, 'time': 1670923148, 'md5': 'admiFrzo+iBLNBu8YwmHQg==', 'fsize': 360773, 'resto': 8233087}]",1670923148,
73,8236345,12/13/22(Tue)00:26:52,Anonymous,how would you finish?,IMG_20221212_032124,.jpg,2048,1821,250,222,1670909212351900,1670909212,GQDwa4rY2Gw0dlOUVO88dg==,249498,0,0,0,how-would-you-finish,9,4,4.0,2.0,"[{'no': 8236564, 'now': '12/13/22(Tue)01:06:43', 'name': 'Anonymous', 'com': 'she&#039;s not like that', 'filename': '1659737507981', 'ext': '.webm', 'w': 1280, 'h': 720, 'tn_w': 125, 'tn_h': 70, 'tim': 1670911603278878, 'time': 1670911603, 'md5': '3O6AZ11JptUfs38vJOQJmA==', 'fsize': 2521231, 'resto': 8236345}, {'no': 8236688, 'now': '12/13/22(Tue)01:35:29', 'name': 'Anonymous', 'filename': 'CHOKE poi', 'ext': '.webm', 'w': 1280, 'h': 720, 'tn_w': 125, 'tn_h': 70, 'tim': 1670913329502903, 'time': 1670913329, 'md5': '0enbcWKyR0RpJWjooyqDBQ==', 'fsize': 2561745, 'resto': 8236345}, {'no': 8236730, 'now': '12/13/22(Tue)01:46:28', 'name': 'Anonymous', 'com': '<a href=""#p8236415"" class=""quotelink"">&gt;&gt;8236415</a><br><a href=""#p8236688"" class=""quotelink"">&gt;&gt;8236688</a><br>based bushiroad', 'time': 1670913988, 'resto': 8236345}, {'no': 8237003, 'now': '12/13/22(Tue)03:06:47', 'name': 'Anonymous', 'com': '<a href=""#p8236345"" class=""quotelink"">&gt;&gt;8236345</a><br>Probably on her face. Maybe in her mouth. I don&#039;t think I&#039;d want to finish inside, not the type of girl I&#039;d want to knock up.', 'time': 1670918807, 'resto': 8236345}, {'no': 8237136, 'now': '12/13/22(Tue)04:18:05', 'name': 'Anonymous', 'com': 'Nakadashi', 'time': 1670923085, 'resto': 8236345}]",1670923085,
74,8198847,12/09/22(Fri)09:40:10,Anonymous,"THREE WEEKS Edition<br><br>Previous: <a href=""/pw/thread/8147305#p8147305"" class=""quotelink"">&gt;&gt;8147305</a><br><br>LLLGMHTM<br>LLLDDM",1669903832219257,.jpg,1108,1478,187,250,1670596810152412,1670596810,5qDyn7FYTd/1bOW8wuKorA==,254467,0,0,0,ddm-donna-del-mondo-general,166,77,161.0,74.0,"[{'no': 8235056, 'now': '12/12/22(Mon)22:30:26', 'name': 'Anonymous', 'com': '<a href=""#p8234934"" class=""quotelink"">&gt;&gt;8234934</a><br>She is also spicy', 'filename': '20220901_005717', 'ext': '.jpg', 'w': 1170, 'h': 1446, 'tn_w': 101, 'tn_h': 125, 'tim': 1670902226984279, 'time': 1670902226, 'md5': 'QJbP6Ctfd5+fuIdMOxbxKA==', 'fsize': 292423, 'resto': 8198847}, {'no': 8235507, 'now': '12/12/22(Mon)22:56:40', 'name': 'Anonymous', 'com': '<a href=""#p8232907"" class=""quotelink"">&gt;&gt;8232907</a><br>I knew I was Giulia fan when I found her attractive with short hair', 'time': 1670903800, 'resto': 8198847}, {'no': 8236084, 'now': '12/12/22(Mon)23:43:49', 'name': 'Anonymous', 'com': '<a href=""#p8235056"" class=""quotelink"">&gt;&gt;8235056</a><br>SEX with Sexy Mai', 'time': 1670906629, 'resto': 8198847}, {'no': 8236524, 'now': '12/13/22(Tue)00:57:16', 'name': 'Anonymous', 'filename': '1652624935598', 'ext': '.jpg', 'w': 1200, 'h': 802, 'tn_w': 125, 'tn_h': 83, 'tim': 1670911036381535, 'time': 1670911036, 'md5': '7tdPHAIU896mH7VXiDULrA==', 'fsize': 115373, 'resto': 8198847}, {'no': 8237135, 'now': '12/13/22(Tue)04:17:47', 'name': 'Anonymous', 'filename': '263445174_467201128154516_8773854365400601128_n', 'ext': '.jpg', 'w': 1425, 'h': 1376, 'tn_w': 125, 'tn_h': 120, 'tim': 1670923067791734, 'time': 1670923067, 'md5': '0pp4CZUbww7NSIx1qBsARA==', 'fsize': 275971, 'resto': 8198847}]",1670923067,/ddm/ - Donna Del Mondo General
75,8230481,12/12/22(Mon)16:34:18,Anonymous,"WWE Smackdown:<br>2,306,000 viewers<br>P18-49 rating: 0.57<br><br>AEW Rampage:<br>457,000 viewers<br>P18-49 rating: 0.11",file,.png,1800,2400,187,250,1670880858756536,1670880858,rqi/27Q/btIkLWKD8Bq3IA==,2063198,0,0,0,smackdown-and-rampage-fucking-skyrocket,61,22,56.0,19.0,"[{'no': 8236936, 'now': '12/13/22(Tue)02:39:09', 'name': 'Anonymous', 'com': '<a href=""#p8230481"" class=""quotelink"">&gt;&gt;8230481</a><br><span class=""quote"">&gt;457</span><br>Yeahhh skyrocket tranny sis, I&#039;m so happy', 'filename': '1670878734846792', 'ext': '.jpg', 'w': 612, 'h': 1024, 'tn_w': 74, 'tn_h': 125, 'tim': 1670917149404752, 'time': 1670917149, 'md5': 'a5mfH6+CPhFXi/qvI22zqw==', 'fsize': 54644, 'resto': 8230481}, {'no': 8236938, 'now': '12/13/22(Tue)02:39:57', 'name': 'Anonymous', 'com': '<a href=""#p8230481"" class=""quotelink"">&gt;&gt;8230481</a><br><span class=""quote"">&gt;AEW Rampage:</span><br><span class=""quote"">&gt;457,000 viewers</span><br><span class=""quote"">&gt;P18-49 rating: 0.11</span><br><span class=""quote"">&gt;0.11</span><br>WHAT A FUCKING PISSANT COMPANY!!', 'filename': '1596023968408', 'ext': '.jpg', 'w': 1419, 'h': 1235, 'tn_w': 124, 'tn_h': 108, 'tim': 1670917197453005, 'time': 1670917197, 'md5': 'JHQRMI4Y4Rr4Kk58CelchQ==', 'fsize': 67486, 'resto': 8230481}, {'no': 8236941, 'now': '12/13/22(Tue)02:41:07', 'name': 'Anonymous', 'com': '<a href=""#p8230841"" class=""quotelink"">&gt;&gt;8230841</a><br>Lovely stuff anon. A cope a day keeps the rope away.', 'time': 1670917267, 'resto': 8230481}, {'no': 8237119, 'now': '12/13/22(Tue)04:10:51', 'name': 'Anonymous', 'com': '<a href=""#p8230481"" class=""quotelink"">&gt;&gt;8230481</a><br><span class=""quote"">&gt;2.3. FUCKING. MILLY.</span><br>E-GOOOOOOODDDDDS!!<br>BOW DOWN TO THE!<br>BOW DOWN TO THE KING!', 'filename': 'd7dgwsx-51b3caca-c41d-4a97-ba86-61174ac18812', 'ext': '.png', 'w': 250, 'h': 250, 'tn_w': 125, 'tn_h': 125, 'tim': 1670922651261228, 'time': 1670922651, 'md5': 'LvpT8TLj5FkG15gXzzSakg==', 'fsize': 159582, 'resto': 8230481}, {'no': 8237125, 'now': '12/13/22(Tue)04:14:03', 'name': 'Anonymous', 'com': '<a href=""#p8236938"" class=""quotelink"">&gt;&gt;8236938</a><br><a href=""#p8230500"" class=""quotelink"">&gt;&gt;8230500</a><br>double michaels', 'time': 1670922843, 'resto': 8230481}]",1670922843,Smackdown and Rampage FUCKING SKYROCKET
76,8235481,12/12/22(Mon)22:54:36,Anonymous,#30,Necropantser,.png,1257,1077,250,214,1670903676316570,1670903676,AsjQg8a6cQ0amcSL+c34Og==,860450,0,0,0,30,4,0,,,"[{'no': 8236317, 'now': '12/13/22(Tue)00:22:18', 'name': 'Anonymous', 'com': 'no respect for the deadliest man in all of sports entertainment...', 'time': 1670908938, 'resto': 8235481}, {'no': 8236323, 'now': '12/13/22(Tue)00:23:36', 'name': 'Anonymous', 'com': '<a href=""#p8235481"" class=""quotelink"">&gt;&gt;8235481</a><br>Jobber', 'time': 1670909016, 'resto': 8235481}, {'no': 8236602, 'now': '12/13/22(Tue)01:15:58', 'name': 'Anonymous', 'com': '<a href=""#p8236323"" class=""quotelink"">&gt;&gt;8236323</a><br>You must be a clawbster fan...', 'time': 1670912158, 'resto': 8235481}, {'no': 8237116, 'now': '12/13/22(Tue)04:09:21', 'name': 'Anonymous', 'com': 'MDickie the goat', 'time': 1670922561, 'resto': 8235481}]",1670922561,
77,8236436,12/13/22(Tue)00:40:23,Anonymous,"I would in a fucking heartbeat, bros.",wafl37yija5a1,.jpg,1080,1349,200,250,1670910023302650,1670910023,GCp81gYaesaY/I+Uh+2BWA==,188026,0,0,0,i-would-in-a-fucking-heartbeat-bros,11,4,6.0,3.0,"[{'no': 8236888, 'now': '12/13/22(Tue)02:22:34', 'name': 'Anonymous', 'com': '<a href=""#p8236436"" class=""quotelink"">&gt;&gt;8236436</a><br>That&#039;s a man', 'time': 1670916154, 'resto': 8236436}, {'no': 8237004, 'now': '12/13/22(Tue)03:07:16', 'name': 'Anonymous', 'com': 'Sorry but she’s a dyke she’s a lesbian she only loves trannies', 'time': 1670918836, 'resto': 8236436}, {'no': 8237018, 'now': '12/13/22(Tue)03:12:15', 'name': 'Anonymous', 'com': '<a href=""#p8236458"" class=""quotelink"">&gt;&gt;8236458</a><br>Enjoy Omega vs ospreay snoozefest', 'time': 1670919135, 'resto': 8236436}, {'no': 8237022, 'now': '12/13/22(Tue)03:13:37', 'name': 'Anonymous', 'filename': 'da435gadf546', 'ext': '.webm', 'w': 640, 'h': 640, 'tn_w': 125, 'tn_h': 125, 'tim': 1670919217729646, 'time': 1670919217, 'md5': 'e8iCIKWKuFTmciohzVYCzw==', 'fsize': 2553422, 'resto': 8236436}, {'no': 8237113, 'now': '12/13/22(Tue)04:08:07', 'name': 'Anonymous', 'com': '<a href=""#p8236436"" class=""quotelink"">&gt;&gt;8236436</a><br>if this were 20 years ago, Dom would Actually be POUNDING that into Mochi.', 'time': 1670922487, 'resto': 8236436}]",1670922487,
78,8236801,12/13/22(Tue)01:59:54,Anonymous,kek based,1661664744009,.jpg,1014,566,250,139,1670914794039000,1670914794,xXySRMNqp2QOpq9Ze5jXUg==,105189,0,0,0,kek-based,5,0,,,"[{'no': 8236843, 'now': '12/13/22(Tue)02:11:31', 'name': 'Anonymous', 'com': '<a href=""#p8236801"" class=""quotelink"">&gt;&gt;8236801</a><br>kek', 'time': 1670915491, 'resto': 8236801}, {'no': 8236959, 'now': '12/13/22(Tue)02:48:54', 'name': 'Anonymous', 'com': 'Bump', 'time': 1670917734, 'resto': 8236801}, {'no': 8236969, 'now': '12/13/22(Tue)02:54:43', 'name': 'Anonymous', 'com': '<a href=""#p8236801"" class=""quotelink"">&gt;&gt;8236801</a><br>only thing ice cold is this shit necrobumped thread', 'time': 1670918083, 'resto': 8236801}, {'no': 8236989, 'now': '12/13/22(Tue)03:01:06', 'name': 'Anonymous', 'com': '<a href=""#p8236969"" class=""quotelink"">&gt;&gt;8236969</a><br>go to bed ojama', 'time': 1670918466, 'resto': 8236801}, {'no': 8237102, 'now': '12/13/22(Tue)03:57:25', 'name': 'Anonymous', 'com': '<a href=""#p8236801"" class=""quotelink"">&gt;&gt;8236801</a>', 'time': 1670921845, 'resto': 8236801}]",1670921845,
