,no,now,name,com,filename,ext,w,h,tn_w,tn_h,tim,time,md5,fsize,resto,bumplimit,imagelimit,semantic_url,replies,images,omitted_posts,omitted_images,last_replies,last_modified,sub
0,8237508,12/13/22(Tue)07:08:32,Anonymous,is smoking weed based or cringe,dude,.png,853,480,250,140,1670933312974856,1670933312,RjylQ/CUDUAPvPbvAOUrOQ==,341528,0,0,0,is-smoking-weed-based-or-cringe,7,0,2.0,0.0,"[{'no': 8237516, 'now': '12/13/22(Tue)07:11:35', 'name': 'Anonymous', 'com': '<a href=""#p8237511"" class=""quotelink"">&gt;&gt;8237511</a><br>good morning sir', 'time': 1670933495, 'resto': 8237508}, {'no': 8237519, 'now': '12/13/22(Tue)07:12:46', 'name': 'Anonymous', 'com': '<a href=""#p8237508"" class=""quotelink"">&gt;&gt;8237508</a><br>Flexing about it is cringe', 'time': 1670933566, 'resto': 8237508}, {'no': 8237526, 'now': '12/13/22(Tue)07:13:56', 'name': 'Anonymous', 'com': '<a href=""#p8237508"" class=""quotelink"">&gt;&gt;8237508</a><br>Smoking weed is out of fashion currently.', 'time': 1670933636, 'resto': 8237508}, {'no': 8237527, 'now': '12/13/22(Tue)07:14:19', 'name': 'Anonymous', 'com': 'It&#039;s based and only 40+ year old election tourists lose their minds over it', 'time': 1670933659, 'resto': 8237508}, {'no': 8237531, 'now': '12/13/22(Tue)07:15:38', 'name': 'Anonymous', 'com': '<a href=""#p8237508"" class=""quotelink"">&gt;&gt;8237508</a><br>I’ve never done weed in my life because I’m too autistic to know where to buy it.', 'time': 1670933738, 'resto': 8237508}]",1670933738,
1,8178086,12/07/22(Wed)09:52:49,Anonymous,"Discuss Gatoh Move, ChocoPro, OniPro, former Gatoh Move wrestlers, and Darejyo graduates here!<br>(Marvelous, Diana, and other small joshi promotions are fine too. AEW is absolutely forbidden.)<br><br><span class=""quote"">&gt;Links</span><br>https://www.fite.tv/vl/p/gatoh-move<wbr>/<br>https://www.youtube.com/channel/UC2<wbr>HtPsU4U7TNSv2mSbPkj0w<br><br>Last thread: <a href=""/pw/thread/8075039#p8075039"" class=""quotelink"">&gt;&gt;8075039</a><br><br>News:<br>12/13 Chris Brookes 15th anniversary show live on gtmv&#039;s youtube channel<br>Emi will be back on the 12/24 ChocoPro <br>12/28 Gatoh Move Arena Shin-kiba<br><span class=""quote"">&gt;Main event</span><br>Mei Suruga and Kaho Kobayashi vs Tae Honma and Hikari Shimizu",FOYDR6JUcAA6RcV,.jpg,1365,2048,166,250,1670424769782554,1670424769,fXc/r7mLtE+CZGJtKpN0WQ==,202071,0,0,0,gtmv-gatoh-move-general,254,73,249.0,72.0,"[{'no': 8237503, 'now': '12/13/22(Tue)07:06:14', 'name': 'Anonymous', 'com': 'Cosy kino.', 'time': 1670933174, 'resto': 8178086}, {'no': 8237505, 'now': '12/13/22(Tue)07:07:16', 'name': 'Anonymous', 'com': 'Wild show', 'time': 1670933236, 'resto': 8178086}, {'no': 8237517, 'now': '12/13/22(Tue)07:11:58', 'name': 'Anonymous', 'com': '<a href=""#p8233063"" class=""quotelink"">&gt;&gt;8233063</a><br>Best Chie looks I&#039;ve seen. She should keep it when she makes it big, actually looks cool.', 'time': 1670933518, 'resto': 8178086}, {'no': 8237520, 'now': '12/13/22(Tue)07:12:58', 'name': 'Anonymous', 'com': '<a href=""#p8233063"" class=""quotelink"">&gt;&gt;8233063</a><br>BAKA', 'time': 1670933578, 'resto': 8178086}, {'no': 8237530, 'now': '12/13/22(Tue)07:15:24', 'name': 'Anonymous', 'com': 'Kek Miya nonchalantly threw up the two finger salute when they were taking photos.', 'filename': 'two_finger_salute', 'ext': '.jpg', 'w': 281, 'h': 475, 'tn_w': 73, 'tn_h': 125, 'tim': 1670933724663171, 'time': 1670933724, 'md5': 'lLQYkXKERxnL71ECZyFgKA==', 'fsize': 36874, 'resto': 8178086}]",1670933724,/gtmv/ - Gatoh Move General
2,8231516,12/12/22(Mon)18:21:47,Anonymous,"Next shows:<br>December 16th, &quot;NEW BLOOD 6&quot;, Shinjuku Sumitomo Hall, Tokyo, 6:30PM JST<br><span class=""quote"">&gt;Future of Stardom Championship Match: Ami Sourei (God&#039;s Eye) vs Ruaka (Oedo Tai)</span><br><span class=""quote"">&gt;Starlight Kid (Oedo Tai) &amp; KARMA vs Mai Sakurai &amp; Thekla (Donna del Mondo)</span><br><span class=""quote"">&gt;Tam Nakano &amp; Waka Tsukiyama (COSMIC ANGELS) vs Ram Kaichow (Dark Pro Wrestling Organization 666) &amp; Maika Ozaki</span><br><span class=""quote"">&gt;Sanae Takebayashi (Best Body Japan Pro Wrestling) vs Rina (Oedo Tai)</span><br><span class=""quote"">&gt;Miran (Diana) vs Miyu Amasaki (Queen&#039;s Quest)</span><br><span class=""quote"">&gt;Lady C (Queen&#039;s Quest) vs Nanae Takahashi</span><br><span class=""quote"">&gt;MIRAI &amp; Tomoka Inaba (God&#039;s Eye) &amp; Nanami vs Hanan &amp; Saya Iida &amp; Momo Kohgo (STARS)</span><br><br>December 17th, &quot;YEAREND TOUR 2022&quot;, G Messe Gunma, Takasaki City, 5:00PM JST<br><span class=""quote"">&gt;Utami Hayashishita &amp; Saya Kamitani &amp; AZM &amp; Lady C (Queen&#039;s Quest) vs Natsuko Tora &amp; Momo Watanabe &amp; Starlight Kid &amp; Ruaka (Oedo Tai)</span><br><span class=""quote"">&gt;Syuri &amp; MIRAI &amp; Ami Sourei &amp; Tomoka Inaba (God&#039;s Eye) vs Giulia &amp; Maika &amp; Himeka &amp; Thekla (Donna del Mondo)</span><br><span class=""quote"">&gt;Mayu Iwatani &amp; Hazuki &amp; Saya Iida (STARS) vs Saki Kashima &amp; Fukigen Death &amp; Rina (Oedo Tai)</span><br><span class=""quote"">&gt;Tam Nakano &amp; Natsupoi &amp; Waka Tsukiyama (COSMIC ANGELS) vs Koguma &amp; Hanan &amp; Momo Kohgo (STARS)</span><br><span class=""quote"">&gt;Mai Sakurai (Donna del Mondo) vs Miyu Amasaki (Queen&#039;s Quest) vs Hina (Queen&#039;s Quest)</span><br><br>Previous <a href=""/pw/thread/8227683#p8227683"" class=""quotelink"">&gt;&gt;8227683</a>",20221212_080644,.jpg,1080,1620,166,250,1670887307329615,1670887307,xgKBls6s94lcUge1m/VKZA==,327984,0,0,0,stardom-general,309,86,304.0,85.0,"[{'no': 8237492, 'now': '12/13/22(Tue)07:01:10', 'name': 'Anonymous', 'com': '<a href=""#p8237486"" class=""quotelink"">&gt;&gt;8237486</a><br>It&#039;s too bad his samefagging ruins the thread<br><a href=""#p8233407"" class=""quotelink"">&gt;&gt;8233407</a>', 'time': 1670932870, 'resto': 8231516}, {'no': 8237509, 'now': '12/13/22(Tue)07:09:09', 'name': 'Anonymous', 'com': '<a href=""#p8237343"" class=""quotelink"">&gt;&gt;8237343</a><br><a href=""#p8237479"" class=""quotelink"">&gt;&gt;8237479</a><br>You remember the Lords Mobile competitions that have happened some months ago? Now there is one regarding Civilization: Reign of Power (a NEXON game and part of the wider Civilization series by Firaxis/2K) and Kashima is fighting against an idol group, a pair of tarento and Tsukka.', 'time': 1670933349, 'resto': 8231516}, {'no': 8237515, 'now': '12/13/22(Tue)07:10:53', 'name': 'Anonymous', 'com': 'treats with friends', 'filename': 'FjskR3tVIAESMI2', 'ext': '.jpg', 'w': 1504, 'h': 1128, 'tn_w': 125, 'tn_h': 93, 'tim': 1670933453972148, 'time': 1670933453, 'md5': 'daxQg0R2yHOqSXacPCkMxw==', 'fsize': 261001, 'resto': 8231516}, {'no': 8237523, 'now': '12/13/22(Tue)07:13:35', 'name': 'Anonymous', 'com': 'Koguma samefagger ruining the thread again', 'time': 1670933615, 'resto': 8231516}, {'no': 8237529, 'now': '12/13/22(Tue)07:14:59', 'name': 'Anonymous', 'com': '<a href=""#p8237523"" class=""quotelink"">&gt;&gt;8237523</a><br><span class=""quote"">&gt;everyone who posts about a wrestler i don&#039;t like is a samefagger wahhhhh!</span><br>shut the fuck up you whiny bitch', 'time': 1670933699, 'resto': 8231516}]",1670933699,/Stardom/ General
3,8225069,12/12/22(Mon)00:09:38,Anonymous,protagonist player,FjwHE4DacAA5BHK,.jpg,1536,2048,187,250,1670821778485840,1670821778,7cqCTQwVcieewY/tSt22ZQ==,391665,0,0,0,protagonist-player,67,12,62.0,11.0,"[{'no': 8234338, 'now': '12/12/22(Mon)21:48:18', 'name': 'Anonymous', 'com': '<a href=""#p8233100"" class=""quotelink"">&gt;&gt;8233100</a><br>I&#039;m gonna cum in her 1 day', 'time': 1670899698, 'resto': 8225069}, {'no': 8234358, 'now': '12/12/22(Mon)21:49:35', 'name': 'Anonymous', 'com': '<a href=""#p8230119"" class=""quotelink"">&gt;&gt;8230119</a><br>but enough about mayu', 'time': 1670899775, 'resto': 8225069}, {'no': 8235473, 'now': '12/12/22(Mon)22:54:17', 'name': 'Anonymous', 'filename': '1628232144988', 'ext': '.jpg', 'w': 1440, 'h': 2560, 'tn_w': 70, 'tn_h': 125, 'tim': 1670903657817452, 'time': 1670903657, 'md5': 't3s+hzFIK0iOKRJxQp1K8Q==', 'fsize': 475965, 'resto': 8225069}, {'no': 8236207, 'now': '12/13/22(Tue)00:00:03', 'name': 'Anonymous', 'com': '<a href=""#p8235473"" class=""quotelink"">&gt;&gt;8235473</a><br>GIWTWM', 'time': 1670907603, 'resto': 8225069}, {'no': 8237528, 'now': '12/13/22(Tue)07:14:51', 'name': 'Anonymous', 'com': '<a href=""#p8236207"" class=""quotelink"">&gt;&gt;8236207</a><br>no me', 'time': 1670933691, 'resto': 8225069}]",1670933691,
4,8231682,12/12/22(Mon)18:36:24,Anonymous,Presented without comment.,8AE4E656-F07C-4525-ACE5-3B8ED9E6FDAC,.jpg,620,349,249,140,1670888184257377,1670888184,j994mhUrxQogHSJuj8+PLA==,25990,0,0,0,presented-without-comment,116,31,111.0,31.0,"[{'no': 8237481, 'now': '12/13/22(Tue)06:58:10', 'name': 'Anonymous', 'com': 'Here&#039;s the deal. Men who decide to be women are too weak to be men but too ugly to be women. Many, MANY people of various cultures are repulsed at troons to the point where you could say that mentally healthy people don&#039;t like them. It is funny because why would someone go through an expensive treatment to accept themselves when it will lead to less people accepting you? No wonder that 40% grew to 41%. It&#039;ll keep growing too because people think Twitter is real and the niggers on the street won&#039;t call you a fucking faggot or attack you for repulsing them. It&#039;s not okay to be gay, it&#039;s not okay to be trans, it&#039;s not okay to be not okay and no echo chamber will ever change that. Just admit you&#039;re weak, kill yourself and enjoy an eternity in Hell.', 'time': 1670932690, 'resto': 8231682}, {'no': 8237500, 'now': '12/13/22(Tue)07:04:41', 'name': 'Anonymous', 'com': '<a href=""#p8237342"" class=""quotelink"">&gt;&gt;8237342</a><br><span class=""quote"">&gt;sex is an accomplishment </span><br>Retard.', 'time': 1670933081, 'resto': 8231682}, {'no': 8237507, 'now': '12/13/22(Tue)07:08:04', 'name': 'Anonymous', 'com': '<a href=""#p8237342"" class=""quotelink"">&gt;&gt;8237342</a><br><span class=""quote"">&gt;simply not having sex means your bottom of the barrel</span><br>kek what a sex-obsessed weirdo', 'time': 1670933284, 'resto': 8231682}, {'no': 8237513, 'now': '12/13/22(Tue)07:10:06', 'name': 'Anonymous', 'com': '<a href=""#p8237481"" class=""quotelink"">&gt;&gt;8237481</a><br>Based. Troons BTFO forever.', 'time': 1670933406, 'resto': 8231682}, {'no': 8237525, 'now': '12/13/22(Tue)07:13:46', 'name': 'Anonymous', 'com': '<span class=""quote"">&gt;troons entire identity is just based around sex</span><br><span class=""quote"">&gt;the seething troon itt has most likely done porn at some point</span><br>KWABOTY is not Vince, punk, Tony, Elgin, gresham, or any other wrestler. KWABOTY is the entire transgender community.', 'time': 1670933626, 'resto': 8231682}]",1670933626,
5,8235184,12/12/22(Mon)22:36:09,Anonymous,,blueblazer,.jpg,980,980,250,250,1670902569663288,1670902569,5j/THGWBFKfVQ7LYyYltYg==,72436,0,0,0,post-high-flyers,4,1,,,"[{'no': 8235264, 'now': '12/12/22(Mon)22:40:38', 'name': 'Anonymous', 'com': '<a href=""#p8235184"" class=""quotelink"">&gt;&gt;8235184</a><br>Not funny', 'time': 1670902838, 'resto': 8235184}, {'no': 8235295, 'now': '12/12/22(Mon)22:42:34', 'name': 'Anonymous', 'com': '<a href=""#p8235264"" class=""quotelink"">&gt;&gt;8235264</a><br>But enough about you', 'time': 1670902954, 'resto': 8235184}, {'no': 8236599, 'now': '12/13/22(Tue)01:15:01', 'name': 'Anonymous', 'com': '<a href=""#p8235184"" class=""quotelink"">&gt;&gt;8235184</a><br>kek this makes woodditards seethe', 'time': 1670912101, 'resto': 8235184}, {'no': 8237524, 'now': '12/13/22(Tue)07:13:37', 'name': 'Anonymous', 'com': 'he didn&#039;t fly so good', 'filename': 'blowen hart', 'ext': '.png', 'w': 1280, 'h': 720, 'tn_w': 125, 'tn_h': 70, 'tim': 1670933617939692, 'time': 1670933617, 'md5': 'qc20DY/Z6N+Dd2CDE59xbg==', 'fsize': 1692238, 'resto': 8235184}]",1670933617,Post high flyers
6,8235624,12/12/22(Mon)23:01:21,Anonymous,"Watch on Wrestle Universe - 900 yen per month<br>https://www.wrestle-universe.com/en<wbr><br><br>Next shows:<br>12.15 Angel and Rabbit @ Shinjuku FACE, Tokyo (LIVE)[19:00 JST]<br>12.24 Seno, Merry Christmas! 2022 @ Ryogoku KFC Hall, Tokyo (LIVE)[12:30 JST]<br>1.4 Tokyo Joshi Pro-Wrestling &#039;23 @ Korakuen Hall, Tokyo (LIVE)[11:30 JST]<br>1.7 TJPW CITY CIRCUIT WINTER ~Kobe Performance~ @ Kobe Art Center (VOD)[12:00 JST]<br>1.8 TJPW CITY CIRCUIT WINTER ~Okayama Performance~ @ Okayama Convention Center (VOD)[12:30 JST]<br>1.15 The 3rd “Futari wa Princess” Max Heart Tournament @ Otemachi Mitsui Hall, Tokyo (LIVE)[14:00 JST]<br>1.19 The 3rd “Futari wa Princess” Max Heart Tournament @ Shinjuku FACE, Tokyo (LIVE)[19:00 JST]<br>1.29 The 3rd “Futari wa Princess” Max Heart Tournament @ Fureai Cube, Kasukabe (LIVE)[17:00 JST] <br><br>Previous <a href=""/pw/thread/8219341#p8219341"" class=""quotelink"">&gt;&gt;8219341</a>",1670901664397260,.jpg,1365,2048,166,250,1670904081547321,1670904081,qB2NgeRq2iGMs+hpzB7gLQ==,494608,0,0,0,tjpw-tokyo-joshi-pro-general,79,40,74.0,38.0,"[{'no': 8237282, 'now': '12/13/22(Tue)05:23:44', 'name': 'Anonymous', 'com': 'I look forward to seeing the confidence inspiring games of Shino.', 'filename': 'Savetik_1670882885 (video-converter.com)', 'ext': '.webm', 'w': 720, 'h': 1280, 'tn_w': 70, 'tn_h': 125, 'tim': 1670927024920184, 'time': 1670927024, 'md5': 'DkIb2zSrbzSehX0vvFvqJA==', 'fsize': 2111179, 'resto': 8235624}, {'no': 8237289, 'now': '12/13/22(Tue)05:26:46', 'name': 'Anonymous', 'com': '<a href=""#p8237209"" class=""quotelink"">&gt;&gt;8237209</a><br>me too we should fuck her', 'time': 1670927206, 'resto': 8235624}, {'no': 8237429, 'now': '12/13/22(Tue)06:38:05', 'name': 'Anonymous', 'com': '<a href=""#p8236102"" class=""quotelink"">&gt;&gt;8236102</a><br><span class=""quote"">&gt;calvins</span><br>HOLY FUCKING AWOOGA<br>I NEED TO SEE HER GET DICKED DOWN NOWWWWWWWWWWWW', 'time': 1670931485, 'resto': 8235624}, {'no': 8237480, 'now': '12/13/22(Tue)06:57:21', 'name': 'Anonymous', 'filename': '319136915_1309975436240943_5624660617442199780_n', 'ext': '.jpg', 'w': 1080, 'h': 1080, 'tn_w': 125, 'tn_h': 125, 'tim': 1670932641151562, 'time': 1670932641, 'md5': 'FWDmj8ns4cyJDL4ycxgCdw==', 'fsize': 233721, 'resto': 8235624}, {'no': 8237522, 'now': '12/13/22(Tue)07:13:10', 'name': 'Anonymous', 'com': '<a href=""#p8237480"" class=""quotelink"">&gt;&gt;8237480</a><br>I love her', 'time': 1670933590, 'resto': 8235624}]",1670933590,/tjpw/ Tokyo Joshi Pro General
7,8237497,12/13/22(Tue)07:03:40,Anonymous,*jobs to Dana Brooke in her first WWE match* KWABOTY,kylie-rae-impact-wrestling-retires,.jpg,1600,1600,250,250,1670933020128026,1670933020,as/NS+OR63reGuOM2a8Sgw==,254146,0,0,0,jobs-to-dana-brooke-in-her-first-wwe-match,1,0,,,"[{'no': 8237521, 'now': '12/13/22(Tue)07:13:01', 'name': 'Anonymous', 'com': '<a href=""#p8237497"" class=""quotelink"">&gt;&gt;8237497</a><br>she&#039;s paying her dues retard', 'time': 1670933581, 'resto': 8237497}]",1670933581,
8,8231302,12/12/22(Mon)18:01:16,Anonymous,"shoot with me here brothers, how long do they have left realistically?",aew,.png,224,225,224,225,1670886076607700,1670886076,BTs19oI2Z4nDMhEpMClEIA==,5147,0,0,0,shoot-with-me-here-brothers-how-long-do-they-have,37,1,32.0,1.0,"[{'no': 8237389, 'now': '12/13/22(Tue)06:17:10', 'name': 'Anonymous', 'com': '<a href=""#p8237270"" class=""quotelink"">&gt;&gt;8237270</a><br>And AEW is losing more.', 'time': 1670930230, 'resto': 8231302}, {'no': 8237391, 'now': '12/13/22(Tue)06:18:21', 'name': 'Anonymous', 'com': 'TICK TOCK CULTISTS', 'time': 1670930301, 'resto': 8231302}, {'no': 8237394, 'now': '12/13/22(Tue)06:20:10', 'name': 'Anonymous', 'com': 'When his father is no longer capable of running the day-to-day operations of the Jacksonville Jaguars, Tony Khan will abandon AEW faster than you can say &#039;Nyla Rose is not a woman&#039;.', 'time': 1670930410, 'resto': 8231302}, {'no': 8237484, 'now': '12/13/22(Tue)06:58:29', 'name': 'Anonymous', 'com': '<a href=""#p8231302"" class=""quotelink"">&gt;&gt;8231302</a><br>According to e-drones, they should have already gone bankrupt in 2020', 'time': 1670932709, 'resto': 8231302}, {'no': 8237518, 'now': '12/13/22(Tue)07:12:31', 'name': 'Anonymous', 'com': '<a href=""#p8234628"" class=""quotelink"">&gt;&gt;8234628</a><br><span class=""quote"">&gt;The revival</span><br>the most likely to leave<br><span class=""quote"">&gt;Daniel Bryan</span><br>he&#039;ll be there until his contract ends<br><span class=""quote"">&gt;Adam Cole, Kyle O’Reilly</span><br>recovering from injury<br><span class=""quote"">&gt;CM Punk</span><br>will still be injured within the next 6 months<br><span class=""quote"">&gt;Aleister Black</span><br><span class=""quote"">&gt;Blake Murphy</span><br>HoB is getting pushed starting wednesday, i think they teased buddy murphy turning though so he may end up leaving', 'time': 1670933551, 'resto': 8231302}]",1670933551,
9,8237514,12/13/22(Tue)07:10:48,Anonymous,https://youtu.be/PqGze9ZIwzw,1E6EB04D-BD68-4F6A-98C0-506C9DE2D5FD,.jpg,473,1334,88,249,1670933448963498,1670933448,+JjvRv5EeyMqHlv9R2/NIQ==,552818,0,0,0,,0,0,,,,1670933448,
10,8234599,12/12/22(Mon)22:03:49,Anonymous,ITT: GOAT tag teams,26C5E355-F5DE-4EAE-8022-26E746830137,.jpg,1080,924,250,213,1670900629811308,1670900629,cAG2tg3rQTtIFOsyZ4knLA==,129459,0,0,0,itt-goat-tag-teams,69,29,64.0,26.0,"[{'no': 8237470, 'now': '12/13/22(Tue)06:54:29', 'name': 'Anonymous', 'com': '<a href=""#p8234599"" class=""quotelink"">&gt;&gt;8234599</a><br>GOAT black tag team', 'filename': 'Amos &#039;n Andy', 'ext': '.png', 'w': 616, 'h': 780, 'tn_w': 98, 'tn_h': 125, 'tim': 1670932469230444, 'time': 1670932469, 'md5': 'HNvxWTSC93cii8mqUlOhfg==', 'fsize': 715656, 'resto': 8234599}, {'no': 8237474, 'now': '12/13/22(Tue)06:55:31', 'name': 'Anonymous', 'filename': 'Screenshot_20221213-195502_Gallery', 'ext': '.jpg', 'w': 1080, 'h': 1787, 'tn_w': 75, 'tn_h': 125, 'tim': 1670932531788335, 'time': 1670932531, 'md5': 'qiDhYa0pxLZMyrOQuFnPfw==', 'fsize': 911703, 'resto': 8234599}, {'no': 8237478, 'now': '12/13/22(Tue)06:57:16', 'name': 'Anonymous', 'filename': '1649411339243', 'ext': '.jpg', 'w': 1280, 'h': 720, 'tn_w': 125, 'tn_h': 70, 'tim': 1670932636835119, 'time': 1670932636, 'md5': 'C7EJKaqQ1pLyQ/rtz5LCVQ==', 'fsize': 864710, 'resto': 8234599}, {'no': 8237504, 'now': '12/13/22(Tue)07:06:53', 'name': 'Anonymous', 'com': '<a href=""#p8234599"" class=""quotelink"">&gt;&gt;8234599</a><br>Abandoned Christ for a life of &quot;fame&quot;. Literally the weakest people.', 'time': 1670933213, 'resto': 8234599}, {'no': 8237512, 'now': '12/13/22(Tue)07:10:05', 'name': 'Anonymous', 'com': '<a href=""#p8237047"" class=""quotelink"">&gt;&gt;8237047</a><br>It&#039;s bad when the atheist is less trash than the black face faggot.', 'time': 1670933405, 'resto': 8234599}]",1670933405,
11,8234722,12/12/22(Mon)22:10:42,Anonymous,Kenny Omega made the cover of this week&#039;s Weekly Puroresu!,00015769_S,.jpg,960,1283,187,250,1670901042916634,1670901042,YKRhmiM6xHuvDo6kExGQdQ==,129083,0,0,0,kenny-omega-made-the-cover-of-this-weeks-weekly,25,4,20.0,4.0,"[{'no': 8236388, 'now': '12/13/22(Tue)00:32:01', 'name': 'Anonymous', 'com': '<a href=""#p8234722"" class=""quotelink"">&gt;&gt;8234722</a><br>Is this Japan&#039;s version of &quot;Out!&quot;', 'time': 1670909521, 'resto': 8234722}, {'no': 8236419, 'now': '12/13/22(Tue)00:37:33', 'name': 'Anonymous', 'com': 'I keep forgetting he is booked for Wrestle Kingdom.', 'time': 1670909853, 'resto': 8234722}, {'no': 8237471, 'now': '12/13/22(Tue)06:54:36', 'name': 'Anonymous', 'com': 'Must have been an ice cold week', 'time': 1670932476, 'resto': 8234722}, {'no': 8237473, 'now': '12/13/22(Tue)06:55:30', 'name': 'Anonymous', 'com': 'look at the top of his head', 'time': 1670932530, 'resto': 8234722}, {'no': 8237506, 'now': '12/13/22(Tue)07:07:46', 'name': 'Anonymous', 'com': 'So this is a gay magazine?', 'time': 1670933266, 'resto': 8234722}]",1670933266,
12,8237434,12/13/22(Tue)06:39:26,Anonymous,"Tall freaks like Braun Strowman or W Morrissey don&#039;t draw<br>Muscle freaks like Brian Cage don&#039;t draw<br>None of the top guys are Undertaker-tier or Scott Steiner-tier freakazoids, what happened?",Capture,.jpg,765,951,201,249,1670931566838567,1670931566,+c6fMqALrAdy/jnJkaIfVg==,80278,0,0,0,why-dont-freaks-draw-anymore,12,0,7.0,0.0,"[{'no': 8237460, 'now': '12/13/22(Tue)06:49:35', 'name': 'Anonymous', 'com': '<a href=""#p8237442"" class=""quotelink"">&gt;&gt;8237442</a><br>No, that&#039;s just what MMA marks like you tell yourselves as you try to discount anyone with a physique as &#039;beach muscles&#039; and think you&#039;ll win with your superior agility or something, meanwhile the carnival hug fighters go into boxing and get beat by Youtubers.', 'time': 1670932175, 'resto': 8237434}, {'no': 8237475, 'now': '12/13/22(Tue)06:55:45', 'name': 'Anonymous', 'com': '<a href=""#p8237434"" class=""quotelink"">&gt;&gt;8237434</a><br><span class=""quote"">&gt;Braun</span><br><span class=""quote"">&gt;Morrisey</span><br><span class=""quote"">&gt;Brian Cage</span><br>Because they&#039;re shitters<br>They think they can step on the ring because they&#039;re big<br>Undertaker and Scott had mic skills and could actually wrestle', 'time': 1670932545, 'resto': 8237434}, {'no': 8237485, 'now': '12/13/22(Tue)06:58:38', 'name': 'Anonymous', 'com': '<a href=""#p8237460"" class=""quotelink"">&gt;&gt;8237460</a><br>what this guy said<br><span class=""quote"">&gt;zomg he can beat him up in teh octagon</span><br>bitches care about beach muscles you incel mouthbreathing fuck', 'time': 1670932718, 'resto': 8237434}, {'no': 8237489, 'now': '12/13/22(Tue)07:00:28', 'name': 'Anonymous', 'com': '<a href=""#p8237434"" class=""quotelink"">&gt;&gt;8237434</a><br>Because it’s not the circus?', 'time': 1670932828, 'resto': 8237434}, {'no': 8237502, 'now': '12/13/22(Tue)07:04:59', 'name': 'Anonymous', 'com': '<a href=""#p8237434"" class=""quotelink"">&gt;&gt;8237434</a><br>There are examples of giants and muscle freaks who flopped hard going back decades. Giant Gonzales for one. Big Show has never really drawn a dime despite years of trying. Lex Luger was a massive failure when they tried to push him to the moon. Ultimately it all comes down to if you&#039;re entertaining to watch. Ultimate Warrior was a freak who acted like a freak. Being huge gives you an advantage but lottery winners go bankrupt all the time.', 'time': 1670933099, 'resto': 8237434}]",1670933099,Why don&#039;t freaks draw anymore?
13,8235427,12/12/22(Mon)22:50:42,Anonymous,Reminder that /pw/ is loves the Hulkster!!!,hogan2,.jpg,1600,1600,250,250,1670903442210542,1670903442,Yu6kv8IkYr3X3YNkMJh22A==,214603,0,0,0,reminder-that-pw-is-loves-the-hulkster,23,10,18.0,7.0,"[{'no': 8236965, 'now': '12/13/22(Tue)02:52:23', 'name': 'Anonymous', 'com': 'the posters in hulk threads always seem like high school kids who have never seen hulk on tv but they love that he said the reddit word.', 'time': 1670917943, 'resto': 8235427}, {'no': 8237448, 'now': '12/13/22(Tue)06:45:53', 'name': 'Anonymous', 'com': '<a href=""#p8236963"" class=""quotelink"">&gt;&gt;8236963</a><br>YWNBAW<br>W<br>N<br>B<br>A<br>W', 'filename': '1642391705079', 'ext': '.jpg', 'w': 255, 'h': 255, 'tn_w': 125, 'tn_h': 125, 'tim': 1670931953383552, 'time': 1670931953, 'md5': 'wJPLTMqnGSX+nfYafaXTYg==', 'fsize': 18627, 'resto': 8235427}, {'no': 8237452, 'now': '12/13/22(Tue)06:47:11', 'name': 'Anonymous', 'com': '<a href=""#p8236963"" class=""quotelink"">&gt;&gt;8236963</a><br>This is a Hulk Hogan board. The biggest draw in the history of wrestling and the best pro wrestler to ever lace up the boots. That&#039;s a shoot BROTHER.', 'time': 1670932031, 'resto': 8235427}, {'no': 8237453, 'now': '12/13/22(Tue)06:47:32', 'name': 'Anonymous', 'com': '<a href=""#p8236965"" class=""quotelink"">&gt;&gt;8236965</a><br><span class=""quote"">&gt;the reddit word.</span><br><br>nigger u gay as fuck, straight bitch, I bet u wear panties', 'filename': '401424', 'ext': '.jpg', 'w': 428, 'h': 277, 'tn_w': 125, 'tn_h': 80, 'tim': 1670932052616386, 'time': 1670932052, 'md5': 'ZOoWtZv9JcyhV4cYkcHbLQ==', 'fsize': 37169, 'resto': 8235427}, {'no': 8237501, 'now': '12/13/22(Tue)07:04:49', 'name': 'Anonymous', 'com': '<a href=""#p8237453"" class=""quotelink"">&gt;&gt;8237453</a>', 'filename': 'word_scramble', 'ext': '.webm', 'w': 720, 'h': 720, 'tn_w': 125, 'tn_h': 125, 'tim': 1670933089943962, 'time': 1670933089, 'md5': 'SkSQeaRGBOGTL34zW3QyiQ==', 'fsize': 500966, 'resto': 8235427}]",1670933089,
