,no,now,name,com,filename,ext,w,h,tn_w,tn_h,tim,time,md5,fsize,resto,bumplimit,imagelimit,semantic_url,custom_spoiler,replies,images,omitted_posts,omitted_images,last_replies,last_modified,m_img,sub,trip
0,621025414,12/13/22(Tue)05:20:27,Anonymous,RimWorld,image,.png,923,824,250,223,1670926827814848,1670926827,0bheh3tD6aYU0pBlBC3hGA==,98251,0,0,0,rimworld,1,28,2,23.0,1.0,"[{'no': 621030138, 'now': '12/13/22(Tue)06:51:56', 'name': 'Anonymous', 'com': '<a href=""#p621025414"" class=""quotelink"">&gt;&gt;621025414</a><br>Tинaн, пoжaлyйcтa, я нeбoльшoй ютyбep, дaй кoпию cyкa!<br>Fucking russians, holy shit, rutracker and cs.rin is free', 'time': 1670932316, 'resto': 621025414}, {'no': 621030572, 'now': '12/13/22(Tue)06:59:50', 'name': 'Anonymous', 'com': '<a href=""#p621025414"" class=""quotelink"">&gt;&gt;621025414</a><br><span class=""quote"">&gt;doing it for free</span><br><span class=""quote"">&gt;on reddit</span>', 'filename': 'janny_the_grafted', 'ext': '.png', 'w': 664, 'h': 642, 'tn_w': 125, 'tn_h': 120, 'tim': 1670932790369097, 'time': 1670932790, 'md5': '5vsh4uWgRty6LZ0FOXMzfA==', 'fsize': 182687, 'resto': 621025414}, {'no': 621030896, 'now': '12/13/22(Tue)07:06:47', 'name': 'Anonymous', 'com': 'subscriber count doesnt matter anymore', 'time': 1670933207, 'resto': 621025414}, {'no': 621031178, 'now': '12/13/22(Tue)07:12:24', 'name': 'Anonymous', 'com': 'I don&#039;t think I&#039;ve seen the game go for more than just a 20% discount and that doesn&#039;t seem like it&#039;ll ever change no matter how many years pass.', 'time': 1670933544, 'resto': 621025414}, {'no': 621031369, 'now': '12/13/22(Tue)07:15:45', 'name': 'Anonymous', 'com': '<a href=""#p621026280"" class=""quotelink"">&gt;&gt;621026280</a><br>smartest anime pfp user', 'time': 1670933745, 'resto': 621025414}]",1670933745,,,
1,620976217,12/12/22(Mon)18:13:14,Anonymous,Edelgard.,teatimedel,.png,753,840,224,250,1670886794175180,1670886794,sEW8JXJtTgDoda4bW709Wg==,1188228,0,0,0,edelgard,1,287,106,282.0,106.0,"[{'no': 621030320, 'now': '12/13/22(Tue)06:55:36', 'name': 'Anonymous', 'com': '<a href=""#p621019758"" class=""quotelink"">&gt;&gt;621019758</a><br>This. Edelgard is called a hypocrite not just because she cries foul at Rhea for her past actions while actively doing the same thing. But also because she and my extension Claude ignore human nature and instead seek to blame Rhea for everything wrong with Fodlan rather than you know actually gathering information and thinking critically about the situation. She instead blames not because Rhea is actually at fault but rather because it&#039;s easier to blame Rhea than it is to actually deal with the problem.', 'time': 1670932536, 'resto': 620976217}, {'no': 621030520, 'now': '12/13/22(Tue)06:59:00', 'name': 'Anonymous', 'com': '<a href=""#p621020709"" class=""quotelink"">&gt;&gt;621020709</a><br>I felt so bad for them in GW after Rhea gave that speech and during the final mission. Fodlan can get fucked (and it will in that timeline)', 'time': 1670932740, 'resto': 620976217}, {'no': 621031002, 'now': '12/13/22(Tue)07:08:42', 'name': 'Anonymous', 'com': '<a href=""#p621019023"" class=""quotelink"">&gt;&gt;621019023</a><br>That&#039;s literally everyone in the clan once you are related to someone with a crest you can pass it on even if you don&#039;t have one.', 'time': 1670933322, 'resto': 620976217}, {'no': 621031351, 'now': '12/13/22(Tue)07:15:27', 'name': 'Anonymous', 'com': '<a href=""#p621018421"" class=""quotelink"">&gt;&gt;621018421</a><br>I find it hilarious that in Lissa of all people had to point out to her that power is just power, it&#039;s up to the individual to decide on how they&#039;ll use it.', 'time': 1670933727, 'resto': 620976217}, {'no': 621031368, 'now': '12/13/22(Tue)07:15:44', 'name': 'Anonymous', 'com': 'Macuil was right.', 'time': 1670933744, 'resto': 620976217}]",1670933744,,,
2,620999680,12/12/22(Mon)22:31:44,Anonymous,why rts dead,kirov,.jpg,1920,1080,250,140,1670902304172241,1670902304,Rpu8MELscZz2vMdYcrJdhw==,150475,0,0,0,why-rts-dead,1,241,31,236.0,30.0,"[{'no': 621031052, 'now': '12/13/22(Tue)07:09:51', 'name': 'Anonymous', 'com': '<a href=""#p621030930"" class=""quotelink"">&gt;&gt;621030930</a><br><span class=""quote"">&gt;its not true because i said so</span><br>Frost giant collected the data<br>Less then half players play multiplayer', 'time': 1670933391, 'resto': 620999680}, {'no': 621031282, 'now': '12/13/22(Tue)07:14:15', 'name': 'Anonymous', 'com': '<a href=""#p620999680"" class=""quotelink"">&gt;&gt;620999680</a><br>Consoles and all kids these days have ADHD', 'time': 1670933655, 'resto': 620999680}, {'no': 621031310, 'now': '12/13/22(Tue)07:14:48', 'name': 'Anonymous', 'com': '<a href=""#p621030930"" class=""quotelink"">&gt;&gt;621030930</a><br>Again, genre is dead at the moment<br>And devs listened to multiplayer faggots', 'time': 1670933688, 'resto': 620999680}, {'no': 621031325, 'now': '12/13/22(Tue)07:15:04', 'name': 'Anonymous', 'com': '<a href=""#p621000586"" class=""quotelink"">&gt;&gt;621000586</a><br>just like FPS and arcade racing games.', 'time': 1670933704, 'resto': 620999680}, {'no': 621031367, 'now': '12/13/22(Tue)07:15:42', 'name': 'Anonymous', 'com': '<a href=""#p620999680"" class=""quotelink"">&gt;&gt;620999680</a><br>zoomer brains too small, too entitled, too goldfish-like attention spans<br>too much responsibility on you as a singular player, 100% of responsibility when you fail', 'filename': '1585783297336', 'ext': '.jpg', 'w': 389, 'h': 527, 'tn_w': 92, 'tn_h': 125, 'tim': 1670933742716017, 'time': 1670933742, 'md5': 'v7efjphntVWxsPILdi71+Q==', 'fsize': 24173, 'resto': 620999680}]",1670933742,1.0,,
3,621009693,12/13/22(Tue)00:49:23,Anonymous,"this fat fuck was supposed to save the industry, instead he became an internet racist and got cancelled",Screen Shot 2022-12-13 at 12.48.06 AM,.png,2334,2006,250,214,1670910563128313,1670910563,tdOKHuIxmKTN0X6+o0kacA==,1952172,0,0,0,this-fat-fuck-was-supposed-to-save-the-industry,1,59,4,54.0,4.0,"[{'no': 621027986, 'now': '12/13/22(Tue)06:10:30', 'name': 'Anonymous', 'com': 'Notch please go full racist supervillain', 'time': 1670929830, 'resto': 621009693}, {'no': 621030802, 'now': '12/13/22(Tue)07:04:42', 'name': 'Anonymous', 'com': 'minecraft is a shitty souless ripoff.', 'time': 1670933082, 'resto': 621009693}, {'no': 621031180, 'now': '12/13/22(Tue)07:12:27', 'name': 'Anonymous', 'com': '<a href=""#p621009693"" class=""quotelink"">&gt;&gt;621009693</a><br>What if he bought 4chan', 'time': 1670933547, 'resto': 621009693}, {'no': 621031253, 'now': '12/13/22(Tue)07:13:43', 'name': 'Anonymous', 'com': '<a href=""#p621022741"" class=""quotelink"">&gt;&gt;621022741</a><br>Yeah this is why all western AAA games sucks', 'time': 1670933623, 'resto': 621009693}, {'no': 621031365, 'now': '12/13/22(Tue)07:15:39', 'name': 'Anonymous', 'com': '<a href=""#p621009693"" class=""quotelink"">&gt;&gt;621009693</a><br>Not hating white people is racist... I really hate you leftist scum and i hope one day we will execute you all or muslims do it when we are gone.', 'time': 1670933739, 'resto': 621009693}]",1670933739,1.0,,
4,621031270,12/13/22(Tue)07:14:07,Anonymous,"<span class=""quote"">&gt;people still defend gacha shit because it has cute anime girls</span><br><br>Just imagine how much money these games make.",1658280494256,.jpg,3840,2160,250,140,1670933647562090,1670933647,H8RqGl1fPH4ziuWa43bJ9A==,583402,0,0,0,people-still-defend-gacha-shit-because-it-has,1,2,0,,,"[{'no': 621031360, 'now': '12/13/22(Tue)07:15:35', 'name': 'Anonymous', 'com': '<a href=""#p621031270"" class=""quotelink"">&gt;&gt;621031270</a><br>damn this nigga making bank fr fr', 'time': 1670933735, 'resto': 621031270}, {'no': 621031364, 'now': '12/13/22(Tue)07:15:38', 'name': 'Anonymous', 'com': '<a href=""#p621031270"" class=""quotelink"">&gt;&gt;621031270</a><br>I like to believe part of the problem comes from the population imbalance in china and India:<br>https://www.washingtonpost.com/grap<wbr>hics/2018/world/too-many-men/', 'time': 1670933738, 'resto': 621031270}]",1670933738,1.0,,
5,621025546,12/13/22(Tue)05:23:10,Anonymous,Masterpiece,Return_to_castle_wolfenstein_box,.png,415,500,207,250,1670926990536968,1670926990,LGVfTGZ76UoIpJpVCiOWlA==,287864,0,0,0,masterpiece,1,22,3,17.0,2.0,"[{'no': 621029194, 'now': '12/13/22(Tue)06:32:45', 'name': 'Anonymous', 'com': '<a href=""#p621028969"" class=""quotelink"">&gt;&gt;621028969</a><br>Oh I like it gameplay wise.<br>It&#039;s just that they spook me hard.', 'time': 1670931165, 'resto': 621025546}, {'no': 621029238, 'now': '12/13/22(Tue)06:33:33', 'name': 'Anonymous', 'com': '<a href=""#p621025546"" class=""quotelink"">&gt;&gt;621025546</a><br>never really cared much for it. et on the other hand.', 'filename': '7c885e5732c57b4749d34c844c2a44fc', 'ext': '.gif', 'w': 400, 'h': 216, 'tn_w': 125, 'tn_h': 67, 'tim': 1670931213174575, 'time': 1670931213, 'md5': 'cZ+oSvdx9pNBp+o8npDUbg==', 'fsize': 464923, 'resto': 621025546}, {'no': 621029274, 'now': '12/13/22(Tue)06:34:18', 'name': 'Anonymous', 'com': '<a href=""#p621029065"" class=""quotelink"">&gt;&gt;621029065</a><br>Misri Halek is amazing map. I hated it at first for being confusing and forcing cyberdemons on you in enclosed spaces but now that im bit better in the game i love it. Lake poison still favourite of Alien Vendetta tho', 'time': 1670931258, 'resto': 621025546}, {'no': 621029463, 'now': '12/13/22(Tue)06:38:11', 'name': 'Anonymous', 'com': '<a href=""#p621029156"" class=""quotelink"">&gt;&gt;621029156</a><br>You must return to whence you came.', 'time': 1670931491, 'resto': 621025546}, {'no': 621031363, 'now': '12/13/22(Tue)07:15:37', 'name': 'Anonymous', 'com': '<a href=""#p621025546"" class=""quotelink"">&gt;&gt;621025546</a><br>This was back when Wolfenstein was good. Before the shitty grindhouse movie style new games and the devs unsubtly saying that they see the nazis you&#039;re killing as half of America.', 'time': 1670933737, 'resto': 621025546}]",1670933737,,,
6,621030807,12/13/22(Tue)07:04:50,Anonymous,What went wrong?,1670700583541047,.png,1134,1234,229,250,1670933090472450,1670933090,rSH1q5Rc77zXYo+sOIRFZA==,611640,0,0,0,animaniacs-reboot-cancelled,1,7,2,2.0,0.0,"[{'no': 621031098, 'now': '12/13/22(Tue)07:10:46', 'name': 'Anonymous', 'com': '<a href=""#p621030807"" class=""quotelink"">&gt;&gt;621030807</a><br>Service exclusivity, 0 advertising', 'time': 1670933446, 'resto': 621030807}, {'no': 621031112, 'now': '12/13/22(Tue)07:11:01', 'name': 'Anonymous', 'com': 'video games?', 'time': 1670933461, 'resto': 621030807}, {'no': 621031226, 'now': '12/13/22(Tue)07:13:12', 'name': 'Anonymous', 'com': '<span class=""quote"">&gt;Go from wacky dumb kid adventures that the middle class could afford to watch to forced political shit</span><br><span class=""quote"">&gt;&quot;wtf, why does nobody watch this???&quot;</span>', 'filename': 'hero-image.fill.size_1248x702.v1623391515', 'ext': '.jpg', 'w': 1248, 'h': 702, 'tn_w': 125, 'tn_h': 70, 'tim': 1670933592552668, 'time': 1670933592, 'md5': 'guub5Km94QKfhy18DrRcZw==', 'fsize': 117787, 'resto': 621030807, 'm_img': 1}, {'no': 621031275, 'now': '12/13/22(Tue)07:14:10', 'name': 'Anonymous', 'com': '<a href=""#p621030807"" class=""quotelink"">&gt;&gt;621030807</a><br>Three seasons is long for a currently airing kids cartoon that isn&#039;t a legacy show like Spongebob.', 'time': 1670933650, 'resto': 621030807}, {'no': 621031362, 'now': '12/13/22(Tue)07:15:36', 'name': 'Anonymous', 'com': '<a href=""#p621031112"" class=""quotelink"">&gt;&gt;621031112</a><br>Animaniacs for Super Nintendo', 'filename': '007080', 'ext': '.png', 'w': 256, 'h': 224, 'tn_w': 125, 'tn_h': 109, 'tim': 1670933736684269, 'time': 1670933736, 'md5': 'osDiJYvp3FkZj69TPMQUmw==', 'fsize': 16663, 'resto': 621030807}]",1670933736,1.0,Animaniacs reboot cancelled,
7,621025601,12/13/22(Tue)05:24:08,Anonymous,"<span class=""quote"">&gt;meanwhile in the /v/ hyperbolic time chamber</span>",Hyperbolic-Time-Chamber-Calculator,.png,1920,1080,250,140,1670927048672831,1670927048,hBO4hi0BHkp/PDS07u0M/g==,1389455,0,0,0,meanwhile-in-the-v-hyperbolic-time-chamber,1,21,3,16.0,2.0,"[{'no': 621027935, 'now': '12/13/22(Tue)06:09:32', 'name': 'Anonymous', 'com': 'It&#039;s the room of spirit and time', 'time': 1670929772, 'resto': 621025601}, {'no': 621029220, 'now': '12/13/22(Tue)06:33:09', 'name': 'Anonymous', 'com': '<a href=""#p621027935"" class=""quotelink"">&gt;&gt;621027935</a><br>yup, that&#039;s the one', 'time': 1670931189, 'resto': 621025601}, {'no': 621029687, 'now': '12/13/22(Tue)06:42:29', 'name': 'Anonymous', 'com': '<a href=""#p621027395"" class=""quotelink"">&gt;&gt;621027395</a><br>Bro they were always training of course its gonna be warm.', 'time': 1670931749, 'resto': 621025601}, {'no': 621031234, 'now': '12/13/22(Tue)07:13:21', 'name': 'Anonymous', 'com': 'Finally! a place where I can beat Persona 5 in peace', 'time': 1670933601, 'resto': 621025601}, {'no': 621031361, 'now': '12/13/22(Tue)07:15:36', 'name': 'Anonymous', 'com': '<a href=""#p621025601"" class=""quotelink"">&gt;&gt;621025601</a><br>Wow, sure is white in here... sure would be a shame if anything were to change that...', 'filename': 'pp', 'ext': '.jpg', 'w': 504, 'h': 577, 'tn_w': 109, 'tn_h': 125, 'tim': 1670933736571378, 'time': 1670933736, 'md5': 'cFmbFfCE9dXFBeGlLeRJkw==', 'fsize': 90720, 'resto': 621025601, 'spoiler': 1}]",1670933736,1.0,,
8,621016631,12/13/22(Tue)02:44:03,Anonymous,This cat is Nia<br>She can dance very well,nia,.jpg,721,720,250,249,1670917443565258,1670917443,F0fp36dxetwH8N6GfjhqIw==,117807,0,0,0,this-cat-is-nia,1,102,29,97.0,27.0,"[{'no': 621031237, 'now': '12/13/22(Tue)07:13:24', 'name': 'Anonymous', 'com': 'Alright fine I&#039;ll tell you, these are my posts.', 'filename': 'me', 'ext': '.png', 'w': 1881, 'h': 878, 'tn_w': 125, 'tn_h': 58, 'tim': 1670933604039948, 'time': 1670933604, 'md5': 'eBz8weJIUTfIzP55KTgvlg==', 'fsize': 64302, 'resto': 621016631}, {'no': 621031296, 'now': '12/13/22(Tue)07:14:33', 'name': 'Anonymous', 'com': '<a href=""#p621031206"" class=""quotelink"">&gt;&gt;621031206</a><br><span class=""quote"">&gt;Xtranny still projecting</span><br>kek, you only post in that thread is SEETHING about this one.<br>How is that acceptable to you?<br>Why do you post in threads if you only like it for seething about XC2, Xtranny?', 'time': 1670933673, 'resto': 621016631}, {'no': 621031317, 'now': '12/13/22(Tue)07:14:55', 'name': 'Anonymous', 'com': '<a href=""#p621031237"" class=""quotelink"">&gt;&gt;621031237</a><br><span class=""quote"">&gt;Schizo arguing with his alternate personality</span><br>Many such cases', 'time': 1670933695, 'resto': 621016631}, {'no': 621031331, 'now': '12/13/22(Tue)07:15:09', 'name': 'Anonymous', 'filename': '101339833_p0', 'ext': '.jpg', 'w': 1852, 'h': 2575, 'tn_w': 89, 'tn_h': 125, 'tim': 1670933709678487, 'time': 1670933709, 'md5': 'QZTC7LOcsA32kiXjIAHI5g==', 'fsize': 716109, 'resto': 621016631, 'm_img': 1}, {'no': 621031358, 'now': '12/13/22(Tue)07:15:34', 'name': 'Anonymous', 'com': '<a href=""#p621031317"" class=""quotelink"">&gt;&gt;621031317</a><br>Xtranny is the most mentally ill creature to ever exist.', 'time': 1670933734, 'resto': 621016631}]",1670933734,,,
9,621006713,12/13/22(Tue)00:06:32,Anonymous,"You call those muscles, Capcom?",SF6 T8 muscles,.jpg,2432,1076,249,110,1670907992241182,1670907992,2fsodwChPfAHm9ZrnKh1AA==,1031840,0,0,0,you-call-those-muscles-capcom,1,67,17,62.0,17.0,"[{'no': 621030397, 'now': '12/13/22(Tue)06:57:05', 'name': 'Anonymous', 'com': '<a href=""#p621006713"" class=""quotelink"">&gt;&gt;621006713</a><br>Why did they turn everyone into fahkumram?', 'time': 1670932625, 'resto': 621006713}, {'no': 621030502, 'now': '12/13/22(Tue)06:58:47', 'name': 'Anonymous', 'com': '<a href=""#p621014763"" class=""quotelink"">&gt;&gt;621014763</a><br>You are underage if you think this guy isn&#039;t on all sorts of juice', 'time': 1670932727, 'resto': 621006713}, {'no': 621030602, 'now': '12/13/22(Tue)07:00:37', 'name': 'Anonymous', 'com': '<a href=""#p621006713"" class=""quotelink"">&gt;&gt;621006713</a><br>Fuckin weird we live in a time where street fighter has more realistic design', 'time': 1670932837, 'resto': 621006713}, {'no': 621030751, 'now': '12/13/22(Tue)07:03:42', 'name': 'Anonymous', 'com': '<a href=""#p621006713"" class=""quotelink"">&gt;&gt;621006713</a><br>mainman talked shit about street fighter characters looking like gorillas for years but now he&#039;s eating up this law UP lmao', 'time': 1670933022, 'resto': 621006713}, {'no': 621031359, 'now': '12/13/22(Tue)07:15:34', 'name': 'Anonymous', 'com': '<a href=""#p621030751"" class=""quotelink"">&gt;&gt;621030751</a><br>It&#039;s good when Tekken does it™', 'time': 1670933734, 'resto': 621006713}]",1670933734,1.0,,
10,621020574,12/13/22(Tue)03:47:54,Anonymous,"Holy shit, what happened?",addtext_com_MDM0NzA4NTEyOQ,.jpg,594,768,193,250,1670921274307549,1670921274,JXA56PIiRXXT/yHZeVF15A==,52160,0,0,0,holy-shit-what-happened,1,62,12,57.0,11.0,"[{'no': 621030940, 'now': '12/13/22(Tue)07:07:34', 'name': 'Anonymous', 'com': '<a href=""#p621028074"" class=""quotelink"">&gt;&gt;621028074</a><br>Disingenuous faggot', 'time': 1670933254, 'resto': 621020574}, {'no': 621030996, 'now': '12/13/22(Tue)07:08:36', 'name': 'Anonymous', 'com': '<a href=""#p621030889"" class=""quotelink"">&gt;&gt;621030889</a><br>Yes!', 'filename': '1670827296064012', 'ext': '.gif', 'w': 512, 'h': 640, 'tn_w': 100, 'tn_h': 125, 'tim': 1670933316539700, 'time': 1670933316, 'md5': 'g5a8rB3qRS0HKckuvO1R3g==', 'fsize': 2061902, 'resto': 621020574}, {'no': 621031107, 'now': '12/13/22(Tue)07:10:54', 'name': 'Anonymous', 'com': '<a href=""#p621021051"" class=""quotelink"">&gt;&gt;621021051</a><br><span class=""quote"">&gt;straight male protagonist </span><br><span class=""quote"">&gt;no gay shit</span><br><span class=""quote"">&gt;no niggers</span><br><span class=""quote"">&gt;no girlboss message</span><br>This is all it takes to make me buy your game.', 'time': 1670933454, 'resto': 621020574}, {'no': 621031147, 'now': '12/13/22(Tue)07:11:50', 'name': 'Anonymous', 'com': '<a href=""#p621030996"" class=""quotelink"">&gt;&gt;621030996</a><br>Oh shiiiit a rraaat', 'time': 1670933510, 'resto': 621020574}, {'no': 621031356, 'now': '12/13/22(Tue)07:15:33', 'name': 'Anonymous', 'com': '<a href=""#p621030996"" class=""quotelink"">&gt;&gt;621030996</a><br><span class=""quote"">&gt;vtuber GOOD now</span><br>As expected of /v/intendo', 'time': 1670933733, 'resto': 621020574}]",1670933733,,,
11,621022820,12/13/22(Tue)04:28:18,Anonymous,Subtle vidya clothing,1647001188247,.jpg,960,642,250,167,1670923698337601,1670923698,Bqf9ZI9+oWKayNjwnugM6w==,51892,0,0,0,subtle-vidya-clothing,1,113,11,108.0,11.0,"[{'no': 621030932, 'now': '12/13/22(Tue)07:07:19', 'name': 'Anonymous', 'com': '<a href=""#p621030721"" class=""quotelink"">&gt;&gt;621030721</a><br><span class=""quote"">&gt;I think it’s primarily because women shy away from any sort of edge due to social pressure. </span><br>This anon be living in 1890 <br>Women will openly talk about doing coke and fucking guys and discuss which kinda cum tastes the best or they will talk about their boyfriend having erectile dysfunction or what parasite their doctor found in their ass', 'time': 1670933239, 'resto': 621022820}, {'no': 621030985, 'now': '12/13/22(Tue)07:08:22', 'name': 'Anonymous', 'com': '<a href=""#p621023028"" class=""quotelink"">&gt;&gt;621023028</a><br>no because humor is a coping mechanism<br><s>wich is ok</s><br><br>I think it&#039;s more because women are more inclined to want to be liked or seen as valuable, wich works not as well for selfdeprecating or truly subversive humor. Especially mainstream comedians or socialmedia stuff is used to get yourself out there instead of to truly be funny.<br><br>Funniest females i&#039;ve seen were all just friends of friends after having a few drinks with good friends in academic circles of my older brother. Savage.<br><br>Especially one&#039;s incistence of singing in a groovy way &quot;do you remember&quot; from september whenever 911 came up with perfect comedic timing cracks me up from time to time when watching the news.', 'time': 1670933302, 'resto': 621022820}, {'no': 621030992, 'now': '12/13/22(Tue)07:08:30', 'name': 'Anonymous', 'com': '<a href=""#p621030484"" class=""quotelink"">&gt;&gt;621030484</a><br>Thats because she feels guilty for cheating lol. You’re so naive its kind of adorable.', 'time': 1670933310, 'resto': 621022820}, {'no': 621031053, 'now': '12/13/22(Tue)07:09:51', 'name': 'Anonymous', 'com': '<a href=""#p621023028"" class=""quotelink"">&gt;&gt;621023028</a><br>they hated him for he spoke the truth', 'time': 1670933391, 'resto': 621022820}, {'no': 621031357, 'now': '12/13/22(Tue)07:15:33', 'name': 'Anonymous', 'com': '<a href=""#p621030932"" class=""quotelink"">&gt;&gt;621030932</a><br>None of that is edgy, some of it may be gross, but it’s not edgy. Women will embrace gross humor. But joking about mass shootings, trans people, and tragic world events is something they very much avoid. Naturally those are extreme examples but I think it works for more mild topics as well.', 'time': 1670933733, 'resto': 621022820}]",1670933733,,,
12,621018164,12/13/22(Tue)03:10:58,Anonymous,Is Umineko really the greatest work of fiction ever created like everyone says?,97a55d755ff3f2f736c0f3a4563881709c5e7ebd_00,.jpg,364,512,177,250,1670919058853677,1670919058,NgdZCgKhvkHq9211Rj64WA==,39526,0,0,0,is-umineko-really-the-greatest-work-of-fiction,1,125,26,120.0,25.0,"[{'no': 621031048, 'now': '12/13/22(Tue)07:09:40', 'name': 'Anonymous', 'com': '<a href=""#p621030918"" class=""quotelink"">&gt;&gt;621030918</a><br>It&#039;s been awhile since I&#039;ve read seacats but wasn&#039;t it a bank code and also birth dates', 'time': 1670933380, 'resto': 621018164}, {'no': 621031094, 'now': '12/13/22(Tue)07:10:41', 'name': 'Anonymous', 'com': '<a href=""#p621031034"" class=""quotelink"">&gt;&gt;621031034</a><br>I&#039;m not arguing with you I don&#039;t care if you enjoyed it or not.', 'time': 1670933441, 'resto': 621018164}, {'no': 621031312, 'now': '12/13/22(Tue)07:14:50', 'name': 'Anonymous', 'com': '<a href=""#p621030918"" class=""quotelink"">&gt;&gt;621030918</a><br>it was a clue to the riddle and also the deposit box code', 'time': 1670933690, 'resto': 621018164}, {'no': 621031342, 'now': '12/13/22(Tue)07:15:22', 'name': 'Anonymous', 'com': '<a href=""#p621030918"" class=""quotelink"">&gt;&gt;621030918</a><br><a href=""#p621031045"" class=""quotelink"">&gt;&gt;621031045</a><br>0+7+1+5+1+1+2+9=26<br><br>54-26=28 ni paaa~<br>the key is verified', 'filename': 'FAeyJhpX0AcGS58', 'ext': '.jpg', 'w': 969, 'h': 1059, 'tn_w': 114, 'tn_h': 125, 'tim': 1670933722214877, 'time': 1670933722, 'md5': 'LVXcShc8q0OeYdFdwzZvdw==', 'fsize': 566185, 'resto': 621018164, 'm_img': 1}, {'no': 621031354, 'now': '12/13/22(Tue)07:15:32', 'name': 'Anonymous', 'com': '<a href=""#p621030994"" class=""quotelink"">&gt;&gt;621030994</a><br>Average /v/ poster is filtered by VNs, let alone stuff like Umineko, in addition it&#039;s easier to shit up threads that don&#039;t have people who would potentially ignore their shitposts', 'time': 1670933732, 'resto': 621018164}]",1670933732,,,
13,621021751,12/13/22(Tue)04:08:07,Anonymous,,MV5BMmJjZjRhN2QtYjM3YS00NzkyLTllNmQtNjZkYjJhMTdjYTE5XkEyXkFqcGdeQXVyMTI0MzA4NTgw._V1_FMjpg_UX1000_,.jpg,1000,1333,187,250,1670922487450114,1670922487,v5oAt1SrXDMX2MJaVFW3Jw==,270485,0,0,0,im-tried-of-pretending-ffxiii-was-a-bad-game,1,33,2,28.0,1.0,"[{'no': 621030253, 'now': '12/13/22(Tue)06:54:14', 'name': 'Anonymous', 'com': 'Lightning&#039;s sister is the real game stacy.', 'time': 1670932454, 'resto': 621021751}, {'no': 621030603, 'now': '12/13/22(Tue)07:00:37', 'name': 'Anonymous', 'com': '<a href=""#p621021751"" class=""quotelink"">&gt;&gt;621021751</a><br>It would be no exaggeration to say that it permanently shattered my faith in Final Fantasy, Squeenix, and high-budget JRPGs in general. It was that bad, and I&#039;m definitely not pretending.', 'filename': '[CHM] 09', 'ext': '.jpg', 'w': 736, 'h': 1310, 'tn_w': 70, 'tn_h': 125, 'tim': 1670932837979459, 'time': 1670932837, 'md5': 'CLtjxZIqbgx84/n0B9fRSw==', 'fsize': 157648, 'resto': 621021751, 'm_img': 1}, {'no': 621030885, 'now': '12/13/22(Tue)07:06:32', 'name': 'Anonymous', 'com': '<a href=""#p621030603"" class=""quotelink"">&gt;&gt;621030603</a><br>This<br>Also Yuffie is best FFVII girl<br>Quistis is best VIII girl<br>Freya is best IX girl <br>Lulu is best X girl<br>Fran is best XII girl', 'time': 1670933192, 'resto': 621021751}, {'no': 621031086, 'now': '12/13/22(Tue)07:10:36', 'name': 'Anonymous', 'com': '<a href=""#p621030243"" class=""quotelink"">&gt;&gt;621030243</a><br>If you refer to tlou2 revenge is only the start of the game, the real story / motive is coping with loss and finding a new purpose in life', 'time': 1670933436, 'resto': 621021751}, {'no': 621031353, 'now': '12/13/22(Tue)07:15:27', 'name': 'Anonymous', 'com': 'Why is there a XIII thread every single day and why are they all made by some autist who can&#039;t accept that others dislike it?<br><br>Is this what&#039;s going to happen to 7 Remake fanboys? 20 years from now they&#039;ll be making daily threads about how everyone who called it shit was wrong.<br>Why isn&#039;t it enough for you to like it, why do you NEED nothing short of 100% support for your shit taste?', 'time': 1670933727, 'resto': 621021751}]",1670933727,1.0,I&#039;m tried of pretending FFXIII was a bad game,
