,no,now,name,com,filename,ext,w,h,tn_w,tn_h,tim,time,md5,fsize,resto,m_img,bumplimit,imagelimit,semantic_url,custom_spoiler,replies,images,omitted_posts,omitted_images,last_replies,last_modified,sub,trip,filedeleted
99,620672547,12/10/22(Sat)00:24:03,Anonymous,Street Fighter 6 is making all the right moves. <br><br>It&#039;s a shame it&#039;s still so far away.,1670649530327495,.webm,1280.0,720.0,250.0,140.0,1670649843680581.0,1670649843,ZoWovxahtqDqWg1y7q28/w==,3090626.0,0,,0,0,street-fighter-6-is-making-all-the-right-moves,1,101,28,96.0,26.0,"[{'no': 620694974, 'now': '12/10/22(Sat)06:59:54', 'name': 'Anonymous', 'com': '<a href=""#p620683983"" class=""quotelink"">&gt;&gt;620683983</a><br><span class=""quote"">&gt;Alright anon, explain to me why a Japanese fighting game needs a cutscene with an american announcer</span><br>ftfy', 'time': 1670673594, 'resto': 620672547}, {'no': 620695068, 'now': '12/10/22(Sat)07:01:26', 'name': 'Anonymous', 'com': '<a href=""#p620672547"" class=""quotelink"">&gt;&gt;620672547</a><br>Marisa is an ugly tranny and should&#039;ve been a dude, but her animations are sick as fuck. They look very impactful and brutal as hell.', 'time': 1670673686, 'resto': 620672547}, {'no': 620695076, 'now': '12/10/22(Sat)07:01:34', 'name': 'Anonymous', 'com': '<a href=""#p620684545"" class=""quotelink"">&gt;&gt;620684545</a><br>Those fucking calves, my lord', 'time': 1670673694, 'resto': 620672547}, {'no': 620695157, 'now': '12/10/22(Sat)07:03:07', 'name': 'Anonymous', 'com': '<a href=""#p620684545"" class=""quotelink"">&gt;&gt;620684545</a><br>That stance... !', 'filename': 'main-qimg-8926745281585bd446e5b1f43c1a8e79-lq', 'ext': '.jpg', 'w': 602, 'h': 366, 'tn_w': 125, 'tn_h': 75, 'tim': 1670673787652595, 'time': 1670673787, 'md5': 'u3rY4ajrRsaNCBwql9UFCQ==', 'fsize': 44811, 'resto': 620672547}, {'no': 620695357, 'now': '12/10/22(Sat)07:06:51', 'name': 'Anonymous', 'com': 'No Cammy No Care.', 'filename': '84bb50cff2be2ef59475cd5cbdce7ecf', 'ext': '.jpg', 'w': 1203, 'h': 820, 'tn_w': 125, 'tn_h': 85, 'tim': 1670674011306282, 'time': 1670674011, 'md5': 'PuyD/7DhkCznagDCEOx9Uw==', 'fsize': 823741, 'resto': 620672547, 'm_img': 1}]",1670674011,,,
100,620689503,12/10/22(Sat)05:21:45,Anonymous,"<span class=""quote"">&gt;fantasy game</span><br><span class=""quote"">&gt;characters talk like modern humans</span>",46,.jpg,1024.0,576.0,250.0,140.0,1670667705310642.0,1670667705,GeWvhCmVEsj36wwujPQSbg==,62184.0,0,,0,0,fantasy-game,1,42,7,37.0,7.0,"[{'no': 620693707, 'now': '12/10/22(Sat)06:36:28', 'name': 'Anonymous', 'com': '<a href=""#p620693521"" class=""quotelink"">&gt;&gt;620693521</a><br>Comparing tits to genitals.<br>Are you a misandrist?<br>Womens breasts aren&#039;t equal to a mans genitals.<br>Womens breasts shall be compared to mens breasts.<br>A girls vagina, vulva, cervix, womb, ovaries, clitoris labia shall be compared to a mans dick balls testicles.<br>Equality shouldn&#039;t be at the expense of men.', 'time': 1670672188, 'resto': 620689503}, {'no': 620693764, 'now': '12/10/22(Sat)06:37:12', 'name': 'Anonymous', 'com': '<a href=""#p620693707"" class=""quotelink"">&gt;&gt;620693707</a><br>uhhhhhhhhhhhhhhhhhhhhhhhhhhhhhhhh', 'time': 1670672232, 'resto': 620689503}, {'no': 620693797, 'now': '12/10/22(Sat)06:38:06', 'name': 'Anonymous', 'com': '<a href=""#p620689503"" class=""quotelink"">&gt;&gt;620689503</a><br><span class=""quote"">&gt;fantasy game replaces normal explicit words with their in-lore equivalent</span><br><span class=""quote"">&gt;instead of &quot;Holy shit&quot; they say &quot;By the land&#039;s asscrack&quot;</span>', 'time': 1670672286, 'resto': 620689503}, {'no': 620693890, 'now': '12/10/22(Sat)06:39:54', 'name': 'Anonymous', 'com': 'OH ARCEUS', 'time': 1670672394, 'resto': 620689503}, {'no': 620695346, 'now': '12/10/22(Sat)07:06:44', 'name': 'Anonymous', 'com': '<a href=""#p620693219"" class=""quotelink"">&gt;&gt;620693219</a><br>Jesus Christ', 'time': 1670674004, 'resto': 620689503}]",1670674004,,,
101,620671073,12/10/22(Sat)00:03:04,Anonymous,Why don&#039;t pokemons attack human?,1617107928,.jpg,596.0,812.0,183.0,250.0,1670648584120430.0,1670648584,Zw+KFhRaOZrMq1Siz5nTxg==,48285.0,0,,0,0,why-dont-pokemons-attack-human,1,178,42,173.0,41.0,"[{'no': 620693634, 'now': '12/10/22(Sat)06:35:23', 'name': 'Anonymous', 'com': '<a href=""#p620671602"" class=""quotelink"">&gt;&gt;620671602</a><br>thread should&#039;ve ended here', 'time': 1670672123, 'resto': 620671073}, {'no': 620694020, 'now': '12/10/22(Sat)06:42:17', 'name': 'Anonymous', 'com': '<a href=""#p620692046"" class=""quotelink"">&gt;&gt;620692046</a><br>It&#039;s implied wild Pokemon attack you as a sort of play fighting to test you. The games imply wild Pokemon are jealous of domesticated Pokemon.', 'filename': '42442', 'ext': '.png', 'w': 1112, 'h': 414, 'tn_w': 125, 'tn_h': 46, 'tim': 1670672537064622, 'time': 1670672537, 'md5': 'kquL+Z8zajDEknbdKVozNg==', 'fsize': 70731, 'resto': 620671073}, {'no': 620694338, 'now': '12/10/22(Sat)06:49:05', 'name': 'Anonymous', 'com': '<a href=""#p620686675"" class=""quotelink"">&gt;&gt;620686675</a><br>Well considering there&#039;s no fucking postgame in XY, it sure as hell does something better.', 'time': 1670672945, 'resto': 620671073}, {'no': 620694547, 'now': '12/10/22(Sat)06:52:40', 'name': 'Anonymous', 'com': '<a href=""#p620694338"" class=""quotelink"">&gt;&gt;620694338</a><br>The Battle Maison has more modes than the Subway does and XY&#039;s online is better.', 'time': 1670673160, 'resto': 620671073}, {'no': 620695345, 'now': '12/10/22(Sat)07:06:43', 'name': 'Anonymous', 'com': '<a href=""#p620671357"" class=""quotelink"">&gt;&gt;620671357</a><br>There was an episode where Jessie from Team Rocket gets hit by the beam of a Pokeball and screams in pain. I guess it hurts?? Also, doesn&#039;t Legends Arceus have Pokemon attacking humans if you get in the way during battles? Plus all the old Pokemon games mention it being dangerous to go into tall grass without a partner.', 'time': 1670674003, 'resto': 620671073}]",1670674003,,,
102,620694964,12/10/22(Sat)06:59:40,Anonymous,Why is FFXVI already a failure?,ffgoblin,.jpg,1380.0,1611.0,214.0,250.0,1670673580466432.0,1670673580,TXGL4HHiBfmk23HbOD0QuQ==,335292.0,0,1.0,0,0,why-is-ffxvi-already-a-failure,1,6,1,1.0,0.0,"[{'no': 620695119, 'now': '12/10/22(Sat)07:02:15', 'name': 'Anonymous', 'com': '<a href=""#p620694964"" class=""quotelink"">&gt;&gt;620694964</a><br><br>the only failure is your brain barry.<br><br>this is from an 2 year old apha build.<br><br>but hey nice try.<br>keep seething.', 'time': 1670673735, 'resto': 620694964}, {'no': 620695126, 'now': '12/10/22(Sat)07:02:26', 'name': 'Anonymous', 'com': '<a href=""#p620694964"" class=""quotelink"">&gt;&gt;620694964</a><br>Devs went full goblin mode fr fr', 'time': 1670673746, 'resto': 620694964}, {'no': 620695181, 'now': '12/10/22(Sat)07:03:36', 'name': 'Anonymous', 'com': 'They want the game of thrones audience not the FF audience', 'filename': 'ff16 inspired by game of thrones', 'ext': '.jpg', 'w': 971, 'h': 1609, 'tn_w': 75, 'tn_h': 125, 'tim': 1670673816333643, 'time': 1670673816, 'md5': 'Y3XgO90XhPUNqJbSx0I6hA==', 'fsize': 765309, 'resto': 620694964, 'm_img': 1}, {'no': 620695323, 'now': '12/10/22(Sat)07:06:14', 'name': 'Anonymous', 'com': '<a href=""#p620695119"" class=""quotelink"">&gt;&gt;620695119</a><br>Figures a FF16 troon would cope about a post talking about the goblin design in 16 being a downgrade and somehow deflect to graphics which the comparisons isn&#039;t eveb trying to point out graphics, and even besides that since you brought up graphics FFXV literally is from 6 years ago and looks better than FF16 so that&#039;s not an excuse anyway.', 'time': 1670673974, 'resto': 620694964}, {'no': 620695332, 'now': '12/10/22(Sat)07:06:19', 'name': 'Anonymous', 'com': '<a href=""#p620694964"" class=""quotelink"">&gt;&gt;620694964</a><br>We are japanese goblin', 'time': 1670673979, 'resto': 620694964}]",1670673979,,,
103,620691231,12/10/22(Sat)05:53:14,Anonymous,,1666435269718685,.webm,1280.0,720.0,250.0,140.0,1670669594482341.0,1670669594,s4YaWtfJO4bOt2PucKyyxA==,3116173.0,0,,0,0,juri-han-thread,1,19,5,14.0,4.0,"[{'no': 620694029, 'now': '12/10/22(Sat)06:42:23', 'name': 'Anonymous', 'com': '<a href=""#p620693953"" class=""quotelink"">&gt;&gt;620693953</a><br>hä wieso hesh si den gmocht', 'time': 1670672543, 'resto': 620691231}, {'no': 620694073, 'now': '12/10/22(Sat)06:43:31', 'name': 'Anonymous', 'com': '<a href=""#p620691339"" class=""quotelink"">&gt;&gt;620691339</a><br>When did Ishtar get so ripped', 'time': 1670672611, 'resto': 620691231}, {'no': 620694119, 'now': '12/10/22(Sat)06:44:33', 'name': 'Anonymous', 'com': 'How does it feel fucking a woman way muscular than you', 'time': 1670672673, 'resto': 620691231}, {'no': 620694124, 'now': '12/10/22(Sat)06:44:39', 'name': 'saucy', 'com': '<a href=""#p620691339"" class=""quotelink"">&gt;&gt;620691339</a><br>RTX... ON', 'time': 1670672679, 'resto': 620691231, 'since4pass': 2020}, {'no': 620695309, 'now': '12/10/22(Sat)07:06:01', 'name': 'Anonymous', 'com': 'for me, it&#039;s Kaogum&#039;s Juri', 'filename': '1643860563096', 'ext': '.jpg', 'w': 225, 'h': 225, 'tn_w': 125, 'tn_h': 125, 'tim': 1670673961993016, 'time': 1670673961, 'md5': 'x4VygCUxt2GkOBGdwTDYtw==', 'fsize': 8572, 'resto': 620691231}]",1670673961,Juri Han thread,,
104,620657810,12/09/22(Fri)21:26:03,Anonymous,"Previous Thread: <a href=""/v/thread/620569373#p620569373"" class=""quotelink"">&gt;&gt;620569373</a><br><br><span class=""quote"">&gt;All originally made vidya art is welcome</span><br><span class=""quote"">&gt;When requesting, post references and names in one post</span><br><span class=""quote"">&gt;Keep it vidya origin</span><br><span class=""quote"">&gt;Have fun!</span><br><br>NSFW Deliveries:<a href=""//boards.4chan.org/i/thread/706274#p706274"" class=""quotelink"">&gt;&gt;&gt;/i/706274</a> <br>https://catbox.moe/ or alternatively https://litterbox.catbox.moe/",1670612501819309,.png,934.0,1200.0,194.0,250.0,1670639163552547.0,1670639163,Otidpqo6vEuGmpzprmvEtA==,184029.0,0,,0,0,vidya-drawthread,1,191,140,186.0,135.0,"[{'no': 620694173, 'now': '12/10/22(Sat)06:45:38', 'name': 'Anonymous', 'com': 'Requesting Yukari Takeba in naked ribbon as a Christmas present for Persona 3 Protagonist', 'filename': 'yukari takeba ribbon', 'ext': '.jpg', 'w': 1778, 'h': 1365, 'tn_w': 125, 'tn_h': 95, 'tim': 1670672738515826, 'time': 1670672738, 'md5': '9c4Ag61HCu0/p59aFEdNZA==', 'fsize': 843983, 'resto': 620657810, 'm_img': 1}, {'no': 620694401, 'now': '12/10/22(Sat)06:50:11', 'name': 'Anonymous', 'com': 'Requesting Candace (Genshin Impact) doing a topless belly dance.', 'filename': 'Candace', 'ext': '.png', 'w': 2329, 'h': 2050, 'tn_w': 125, 'tn_h': 110, 'tim': 1670673011860963, 'time': 1670673011, 'md5': 'Hbhv4KNoqpdbYEVNmXRRDQ==', 'fsize': 2327128, 'resto': 620657810, 'm_img': 1}, {'no': 620694702, 'now': '12/10/22(Sat)06:55:06', 'name': 'Anonymous', 'com': '<a href=""#p620685997"" class=""quotelink"">&gt;&gt;620685997</a><br>Here you go you piece of shit.', 'filename': 'CLAIRE_ToCS_BIKINI', 'ext': '.jpg', 'w': 960, 'h': 1600, 'tn_w': 75, 'tn_h': 125, 'tim': 1670673306846968, 'time': 1670673306, 'md5': 'd4CXJDoIm78nQvCdilfljw==', 'fsize': 748112, 'resto': 620657810, 'm_img': 1}, {'no': 620694867, 'now': '12/10/22(Sat)06:57:52', 'name': 'Anonymous', 'com': 'Requesting the Yujiro post rape panel with it being Demi-Fiend on the floor crying and Matador in the background walking away, alternately have it being Serph on the floor crying while Demi-Fiend is walking away based on the secret boss fight in Digital Devil Saga.', 'filename': '7568563867385', 'ext': '.jpg', 'w': 1940, 'h': 1100, 'tn_w': 124, 'tn_h': 70, 'tim': 1670673472276921, 'time': 1670673472, 'md5': 'a9tGEhbXUR6kDEOX5T2NZA==', 'fsize': 275953, 'resto': 620657810, 'm_img': 1}, {'no': 620695298, 'now': '12/10/22(Sat)07:05:48', 'name': 'Anonymous', 'com': 'Requesting a wholesome pic of Annie from Summertime saga receiving a love letter. Her face being red from embarrassment and anger.', 'filename': 'Annie', 'ext': '.png', 'w': 768, 'h': 768, 'tn_w': 125, 'tn_h': 125, 'tim': 1670673948981447, 'time': 1670673948, 'md5': 'X71O/PJF79Sveo4qZ0FhNw==', 'fsize': 637425, 'resto': 620657810}]",1670673948,/v/idya Drawthread,,
105,620690503,12/10/22(Sat)05:39:35,Anonymous,"<span class=""quote"">&gt;Adachi becomes useless at the end game</span><br><span class=""quote"">&gt;Eri gets outclassed by Joon-gi Han and Zhao</span><br>Even with Idol Saeko around, at least Nanba still stays relevant as an offense mage.",1DB5EB63-3271-4FF9-A0DD-A2B6BD3EC01F,.jpg,400.0,400.0,250.0,250.0,1670668775884421.0,1670668775,gIh8biBDT2u2qTxs56HHeA==,22117.0,0,,0,0,yakuza-7,1,13,2,8.0,2.0,"[{'no': 620693139, 'now': '12/10/22(Sat)06:26:19', 'name': 'Anonymous', 'com': '<a href=""#p620691769"" class=""quotelink"">&gt;&gt;620691769</a><br>Y8 is turn based. However yakuza 6.5 (the kiryu game) will be regular beat em up', 'time': 1670671579, 'resto': 620690503}, {'no': 620693885, 'now': '12/10/22(Sat)06:39:51', 'name': 'Anonymous', 'com': '<a href=""#p620690503"" class=""quotelink"">&gt;&gt;620690503</a><br><span class=""quote"">&gt;not sleepwalking through the game because combat besides a few random enemies is braindead easy</span><br><br>Team comp irrelevant just go monke and identify the 2-3 annoying cunts and ignore them til the end of the fight and wail on them for a half hour even when you&#039;re overleveled and exploiting weaknesses.', 'time': 1670672391, 'resto': 620690503}, {'no': 620694463, 'now': '12/10/22(Sat)06:51:19', 'name': 'Anonymous', 'com': '<a href=""#p620692114"" class=""quotelink"">&gt;&gt;620692114</a><br>I’m not smoking anything, all of my party members are currently the same level and have EX weapons, and Eri + Adachi + Han + Zhao having the same equipment. While Eri has very few points of attack higher than Han, he’s better than her with everything else, and I gave neither of them stat boosters.<br>Zhao, on the other hand, has much higher attack and MP, and while this is subjective, I think Gangster moves are much more potent than Clerk moves, asides from maybe Photoblink.', 'time': 1670673079, 'resto': 620690503}, {'no': 620695137, 'now': '12/10/22(Sat)07:02:41', 'name': 'Moose', 'com': '<a href=""#p620694463"" class=""quotelink"">&gt;&gt;620694463</a><br><span class=""quote"">&gt;and I gave neither of them stat boosters.</span><br>Neither have I, that screenshot is just every job at 99. All you really need to make Eri broken is Night Queen to 99 because it&#039;s +ATK when you level it up. Zhao has nothing on her at that point and even if her attack is low agility is what determines if a character is worth using or not. Han and Eri will be getting two turns to every one turn of everyone else, they&#039;re the only ones who can.<br><span class=""quote"">&gt;I think Gangster moves are much more potent than Clerk moves</span><br>Are you on Normal or Legend? Because on Normal none of the team comp matters at all. You can clear the FMT with absolute trash, underleveled, and with no good gear.<br>On Legend you start seeing why a lot of stuff is bad. Clerk falls off very quickly in Legend and is only useful for Shadow Stitch and Essence of Telephone Nunchaku. For a female attacker you are far better off being in Matriarch for Noblesse Oblige (But it&#039;s risky and not guaranteed damage) or Dealer for Darts Airstrike.<br>With Zhao specifically Gangster is pretty awful outside of the ladder Essence and even that is weaker than Han or Eri doing anything. You will be dealing like 800-1400 damage with the spicy knife Essence to a single enemy which is a joke when you can have Han slamming down Shield Ruptures in Enforcer for 1800-2400 and usually twice within just one or two other party member&#039;s attacks, and even with the ladder it&#039;s like 1200ish to 1600ish. In Breaker you will fare far better because of the fire buff paired with the Essence hitting all enemies and also buffing your agility and attack if I remember right but some enemies don&#039;t take as much from fire damage compared to Han&#039;s electric, and when it comes to 1v1 Breaker doesn&#039;t really have anything.', 'time': 1670673761, 'resto': 620690503, 'trip': '!!UzgADXuLlVV'}, {'no': 620695291, 'now': '12/10/22(Sat)07:05:35', 'name': 'Moose', 'com': '<a href=""#p620695137"" class=""quotelink"">&gt;&gt;620695137</a><br><span class=""quote"">&gt;that screenshot is just every job at 99</span><br>Whoops, slight correction, every job at 99 and in jobs that balance their stats so you get a good idea of who is good in what. Night Queen was the only good middleground I could find for the females, Devil Rocker is the most balanced stat-wise for males.', 'time': 1670673935, 'resto': 620690503, 'trip': '!!UzgADXuLlVV'}]",1670673935,Yakuza 7,,
106,620689451,12/10/22(Sat)05:20:51,Anonymous,"<span class=""quote"">&gt;Still no translation for The Guts! -Maximum Maternity!-</span><br>Life is painful,",The Guts! -Maximum Maternity!-,.jpg,1280.0,960.0,250.0,187.0,1670667651506456.0,1670667651,iQotsVJ9jATzM8gHKR1RLg==,1058327.0,0,1.0,0,0,still-no-translation-for-the-guts-maximum,1,19,3,14.0,1.0,"[{'no': 620693059, 'now': '12/10/22(Sat)06:24:47', 'name': 'Anonymous', 'com': 'https://exhentai.org/g/692164/a669c<wbr>21901/', 'time': 1670671487, 'resto': 620689451}, {'no': 620694487, 'now': '12/10/22(Sat)06:51:35', 'name': 'Anonymous', 'com': '<a href=""#p620691386"" class=""quotelink"">&gt;&gt;620691386</a>', 'filename': 'shota phoenix wright', 'ext': '.webm', 'w': 640, 'h': 426, 'tn_w': 125, 'tn_h': 83, 'tim': 1670673095625920, 'time': 1670673095, 'md5': 'HhoPJLcLILDQpmKziHN+0w==', 'fsize': 1684658, 'resto': 620689451}, {'no': 620694757, 'now': '12/10/22(Sat)06:56:04', 'name': 'Anonymous', 'com': '<a href=""#p620689451"" class=""quotelink"">&gt;&gt;620689451</a><br>Every time I think shitafags can&#039;t sink any deeper, they find an even deeper hole.', 'filename': '1490418111179', 'ext': '.gif', 'w': 206, 'h': 204, 'tn_w': 124, 'tn_h': 123, 'tim': 1670673364554182, 'time': 1670673364, 'md5': '5Bml4ShkTHYldsPDCODYCw==', 'fsize': 731097, 'resto': 620689451}, {'no': 620695057, 'now': '12/10/22(Sat)07:01:16', 'name': 'Anonymous', 'com': '<a href=""#p620694487"" class=""quotelink"">&gt;&gt;620694487</a><br>Posting that same webm over and over again won&#039;t change the fact that you shotaniggers are both pedos and trannies, with a tinge of manlet sprinkled in.', 'time': 1670673676, 'resto': 620689451}, {'no': 620695285, 'now': '12/10/22(Sat)07:05:31', 'name': 'Anonymous', 'com': '<a href=""#p620689451"" class=""quotelink"">&gt;&gt;620689451</a><br>Homo faggot.', 'time': 1670673931, 'resto': 620689451}]",1670673931,,,
107,620678327,12/10/22(Sat)01:55:07,Anonymous,Who can possibly unseat them at this point?,from-software-768x432[1],.jpg,768.0,432.0,250.0,140.0,1670655307075192.0,1670655307,xxrv/dz6/HZO5V4U11EEcg==,65102.0,0,,0,0,who-can-possibly-unseat-them-at-this-point,1,176,20,171.0,20.0,"[{'no': 620694059, 'now': '12/10/22(Sat)06:43:03', 'name': 'Anonymous', 'com': '<a href=""#p620679775"" class=""quotelink"">&gt;&gt;620679775</a><br>Best post in the thread. I&#039;ve been playing From games since the start with AC1. It&#039;s really great to see them grow without losing touch with their roots.', 'time': 1670672583, 'resto': 620678327}, {'no': 620694276, 'now': '12/10/22(Sat)06:47:49', 'name': 'Anonymous', 'com': '<a href=""#p620693586"" class=""quotelink"">&gt;&gt;620693586</a><br>Then again, it&#039;s really only Fromsoft making consistent content.<br>Capcom for example lately is very hit and miss, especially with how the new RE&#039;s are shaping to be, and SF and MH are very divisive. Itsuno is the ony carrying the company.<br>Also, Bamco&#039;s other offerings are just fucking garbage. Same with Square Enix that isn&#039;t a remaster of an old fan favorite.', 'time': 1670672869, 'resto': 620678327}, {'no': 620694524, 'now': '12/10/22(Sat)06:52:18', 'name': 'Anonymous', 'com': '<a href=""#p620694276"" class=""quotelink"">&gt;&gt;620694276</a><br>Square Enix could have just made near 1:1 remake of FF7 in 2 installments. Party data transfers to PT 2 remake. Data transfers to Crisis Core Remake. <br><br>Crisis Core should have been modernized and FF7R was retconned too much and turned into corridor walker too much. And FF14 profits could have subsidized this project into mega project.<br><br>But SE management are fools.', 'time': 1670673138, 'resto': 620678327}, {'no': 620694986, 'now': '12/10/22(Sat)07:00:07', 'name': 'Anonymous', 'com': '<a href=""#p620678327"" class=""quotelink"">&gt;&gt;620678327</a><br><span class=""quote"">&gt;made 2 good games</span><br><span class=""quote"">&gt;&quot;unseat them&quot;</span><br>My brother in Christ stop fellating a multi billion dollar company', 'time': 1670673607, 'resto': 620678327}, {'no': 620695283, 'now': '12/10/22(Sat)07:05:30', 'name': 'Anonymous', 'com': '<a href=""#p620678327"" class=""quotelink"">&gt;&gt;620678327</a><br>Rockstar will reset the gen so hard with GTA 6/Online that these fags and everyone else will be forced to move their game releases year+ away.', 'time': 1670673930, 'resto': 620678327}]",1670673930,,,
108,620691634,12/10/22(Sat)06:00:22,Anonymous,"<span class=""quote"">&gt;Game releases unfinished with a huge chunk of content missing</span>",83B86509-2D3A-4468-93CE-F7F53B7DDA96,.jpg,1504.0,654.0,250.0,108.0,1670670022350395.0,1670670022,SPUUp3pcgzBPt9t7gd4e3Q==,65070.0,0,1.0,0,0,game-releases-unfinished-with-a-huge-chunk-of,1,11,2,6.0,1.0,"[{'no': 620694845, 'now': '12/10/22(Sat)06:57:25', 'name': 'Anonymous', 'com': '<a href=""#p620694421"" class=""quotelink"">&gt;&gt;620694421</a><br>Harbingee my new friend', 'time': 1670673445, 'resto': 620691634}, {'no': 620694945, 'now': '12/10/22(Sat)06:59:11', 'name': 'Anonymous', 'com': '<a href=""#p620694421"" class=""quotelink"">&gt;&gt;620694421</a><br>Gemini?', 'time': 1670673551, 'resto': 620691634}, {'no': 620695069, 'now': '12/10/22(Sat)07:01:28', 'name': 'Anonymous', 'com': '<a href=""#p620694720"" class=""quotelink"">&gt;&gt;620694720</a><br>gemini home entertainemnt meme<br>its like slederman meets local58, injected with even more faggotry', 'time': 1670673688, 'resto': 620691634}, {'no': 620695201, 'now': '12/10/22(Sat)07:03:51', 'name': 'Anonymous', 'com': '<a href=""#p620691634"" class=""quotelink"">&gt;&gt;620691634</a><br><span class=""quote"">&gt;that one DLC that has been hinted at for years but still hasn&#039;t released</span>', 'filename': '1280px-Planet_nine_artistic_plain', 'ext': '.png', 'w': 1280, 'h': 853, 'tn_w': 125, 'tn_h': 83, 'tim': 1670673831676170, 'time': 1670673831, 'md5': 'WoCPnol7jbhJysEID1fdEg==', 'fsize': 1750739, 'resto': 620691634, 'm_img': 1}, {'no': 620695282, 'now': '12/10/22(Sat)07:05:27', 'name': 'Anonymous', 'com': '<a href=""#p620694438"" class=""quotelink"">&gt;&gt;620694438</a><br>People say /pol/ got spread everywhere on this site, but it was actually /x/ instead.', 'time': 1670673927, 'resto': 620691634}]",1670673927,,,
109,620695275,12/10/22(Sat)07:05:20,Anonymous,,8c5,.jpg,337.0,339.0,248.0,250.0,1670673920350907.0,1670673920,J2c7pOdSvYRBAbnVSfxFnQ==,27580.0,0,,0,0,wanna-play-dwarf-fortress-is-any-beginner-tips-i,1,0,0,,,,1670673920,Wanna play dwarf fortress is any beginner tips I should know sbout?,,
110,620691687,12/10/22(Sat)06:01:10,Anonymous,what do they eat?,1200px-SMS_Screenshot_Delfino_Plaza,.jpg,1200.0,671.0,250.0,139.0,1670670070146289.0,1670670070,aGHzAAVvhDjoLJAP524smA==,222971.0,0,1.0,0,0,what-do-they-eat,1,4,0,,,"[{'no': 620692335, 'now': '12/10/22(Sat)06:11:43', 'name': 'Anonymous', 'com': '<a href=""#p620691687"" class=""quotelink"">&gt;&gt;620691687</a><br>probably fruit from the vendors that are right in front of you when you first enter the area', 'time': 1670670703, 'resto': 620691687}, {'no': 620693327, 'now': '12/10/22(Sat)06:29:40', 'name': 'Anonymous', 'com': '<a href=""#p620691687"" class=""quotelink"">&gt;&gt;620691687</a><br>Probably fruit and woomys.', 'time': 1670671780, 'resto': 620691687}, {'no': 620693395, 'now': '12/10/22(Sat)06:30:47', 'name': 'Anonymous', 'com': '<a href=""#p620691687"" class=""quotelink"">&gt;&gt;620691687</a><br>fruit and fish', 'time': 1670671847, 'resto': 620691687}, {'no': 620695269, 'now': '12/10/22(Sat)07:05:13', 'name': 'Anonymous', 'com': '<a href=""#p620691687"" class=""quotelink"">&gt;&gt;620691687</a><br>they have a port, anon. they can eat whatever the fuck they want as long as they pay ships to import it.', 'time': 1670673913, 'resto': 620691687}]",1670673913,,,
