,no,now,name,com,filename,ext,w,h,tn_w,tn_h,tim,time,md5,fsize,resto,m_img,bumplimit,imagelimit,semantic_url,custom_spoiler,replies,images,omitted_posts,omitted_images,last_replies,last_modified,sub,trip,filedeleted
0,620694382,12/10/22(Sat)06:49:54,Anonymous,Flop of the years,ARMORED_CORE_VI_FIRES_OF_RUBICON___Reveal_Trailer_1_25_screenshot,.jpg,2400.0,2400.0,250.0,250.0,1670672994501471.0,1670672994,q6vn+wfJIXd9vycvwp/pJQ==,519948.0,0,1.0,0,0,flop-of-the-years,1,25,3,20.0,3.0,"[{'no': 620695649, 'now': '12/10/22(Sat)07:11:59', 'name': 'Anonymous', 'com': '<a href=""#p620695548"" class=""quotelink"">&gt;&gt;620695548</a><br>lel this faggot is assblasted that fromchads keep winning', 'time': 1670674319, 'resto': 620694382}, {'no': 620695662, 'now': '12/10/22(Sat)07:12:16', 'name': 'Anonymous', 'com': '<a href=""#p620694382"" class=""quotelink"">&gt;&gt;620694382</a><br>wtf are those crates, I thought it&#039;s a death stranding 2 screenshot', 'time': 1670674336, 'resto': 620694382}, {'no': 620695679, 'now': '12/10/22(Sat)07:12:31', 'name': 'Anonymous', 'com': '<a href=""#p620695196"" class=""quotelink"">&gt;&gt;620695196</a><br>AC fans have always been discreet. We got hyped and now we&#039;ll just go back to quietly waiting.', 'time': 1670674351, 'resto': 620694382}, {'no': 620695712, 'now': '12/10/22(Sat)07:13:05', 'name': 'Anonymous', 'com': 'The only mecha game i ever played is slave zero', 'time': 1670674385, 'resto': 620694382}, {'no': 620695732, 'now': '12/10/22(Sat)07:13:27', 'name': 'Anonymous', 'com': '<a href=""#p620695578"" class=""quotelink"">&gt;&gt;620695578</a><br><span class=""quote"">&gt;duuhhh what even IS armored core</span><br>Go the fuck back to r*ddit you embarrassing faggot', 'time': 1670674407, 'resto': 620694382}]",1670674407,,,
1,620670323,12/09/22(Fri)23:53:16,Anonymous,"<span class=""quote"">&gt;How do Japanese developers make games so fa-</span><br>Absurd amounts of asset reuse. That&#039;s also why they all play very similarly.",curious,.jpg,700.0,421.0,250.0,150.0,1670647996358399.0,1670647996,HjiGy7JSDu2QbgQ/f2WD8Q==,168195.0,0,,0,0,how-do-japanese-developers-make-games-so-fa,1,97,18,92.0,17.0,"[{'no': 620695398, 'now': '12/10/22(Sat)07:07:41', 'name': 'Anonymous', 'com': 'This is why Nioh is the superior series, they don&#039;t reuse assets or put two bosses together and call it a new boss fight.', 'time': 1670674061, 'resto': 620670323}, {'no': 620695423, 'now': '12/10/22(Sat)07:07:57', 'name': 'Anonymous', 'com': '<a href=""#p620695238"" class=""quotelink"">&gt;&gt;620695238</a><br>Sure, you can play like that if you&#039;re low skill, it just takes far longer.<br><br>Someone who knows what they&#039;re doing can get hits in during individual swings of a multi hit combo, even with a colossal weapon.', 'filename': '1652382499408', 'ext': '.webm', 'w': 1280, 'h': 720, 'tn_w': 125, 'tn_h': 70, 'tim': 1670674077394779, 'time': 1670674077, 'md5': 'tfHmGhZdDJmChHpvLamI9g==', 'fsize': 2917079, 'resto': 620670323}, {'no': 620695515, 'now': '12/10/22(Sat)07:09:50', 'name': 'Anonymous', 'com': '<a href=""#p620695238"" class=""quotelink"">&gt;&gt;620695238</a><br>You can also play sekiro without using deflect and take 30 mins to kill Isshin then complain that the boss have too much health.', 'time': 1670674190, 'resto': 620670323}, {'no': 620695593, 'now': '12/10/22(Sat)07:11:10', 'name': 'Anonymous', 'com': '<a href=""#p620695423"" class=""quotelink"">&gt;&gt;620695423</a><br><span class=""quote"">&gt;Moonveils everyone into posture break in 3 or less L2s without issue in half the time</span>', 'time': 1670674270, 'resto': 620670323}, {'no': 620695731, 'now': '12/10/22(Sat)07:13:23', 'name': 'Anonymous', 'com': '<a href=""#p620695515"" class=""quotelink"">&gt;&gt;620695515</a><br>You can body shot all day in CoD, but it doesn&#039;t matter because we&#039;re talking about what a joke ER&#039;s combat is.', 'time': 1670674403, 'resto': 620670323}]",1670674403,,,
2,620684640,12/10/22(Sat)03:50:19,Anonymous,The actual GOTY of 2022. Only people who didn&#039;t play it hate it. Its gameplay and visuals are phenomenal.,xreKEb65CYM6LKfzgiNLFKlV,.jpg,2880.0,2160.0,250.0,187.0,1670662219297234.0,1670662219,fl3CEXpH9w3a/1FBmLJLIA==,683066.0,0,1.0,0,0,the-actual-goty-of-2022-only-people-who-didnt,1,23,2,18.0,2.0,"[{'no': 620691625, 'now': '12/10/22(Sat)06:00:16', 'name': 'Anonymous', 'com': '<a href=""#p620684640"" class=""quotelink"">&gt;&gt;620684640</a><br>Race sim faggot', 'time': 1670670016, 'resto': 620684640}, {'no': 620691728, 'now': '12/10/22(Sat)06:01:44', 'name': 'Anonymous', 'com': '<a href=""#p620691189"" class=""quotelink"">&gt;&gt;620691189</a><br>nta. I had one before getting a meme ass fanatec setup. G29 is great, but yeah it&#039;s loud. Easy recommend.', 'time': 1670670104, 'resto': 620684640}, {'no': 620691804, 'now': '12/10/22(Sat)06:03:06', 'name': 'Anonymous', 'com': '<a href=""#p620691728"" class=""quotelink"">&gt;&gt;620691728</a><br>Can you adjust the force feedback to make the sound more bearable? I really don&#039;t like loud noises when playing games.', 'time': 1670670186, 'resto': 620684640}, {'no': 620692358, 'now': '12/10/22(Sat)06:12:00', 'name': 'Anonymous', 'com': '<a href=""#p620691804"" class=""quotelink"">&gt;&gt;620691804</a><br>Not on the unit, so it&#039;d be on a game by game basis.', 'time': 1670670720, 'resto': 620684640}, {'no': 620695729, 'now': '12/10/22(Sat)07:13:21', 'name': 'Anonymous', 'com': '<a href=""#p620684640"" class=""quotelink"">&gt;&gt;620684640</a><br>It ended up being my goty. Just wish it&#039;d get new tracks more regularly.', 'time': 1670674401, 'resto': 620684640}]",1670674401,,,
3,620690734,12/10/22(Sat)05:43:38,Anonymous,For the past 5 years GTX 1060 has been the most popular GPU. However about a week ago it dropped to second place being overtaken by the even weaker GTX 1650.<br>What are the implications of this?,1060 lost,.jpg,617.0,670.0,230.0,250.0,1670669018959160.0,1670669018,EZgLR4SRAmjy+2napSgSoA==,90667.0,0,,0,0,gtx-1060-lost-the-crown,1,60,5,55.0,3.0,"[{'no': 620695589, 'now': '12/10/22(Sat)07:11:08', 'name': 'Anonymous', 'com': 'For people with a gpu worse than a gtx 1080 are you all using 1080p screens or 1440p as well?<br>how the latter is going for you in that case', 'filename': '1592791350384', 'ext': '.png', 'w': 661, 'h': 623, 'tn_w': 124, 'tn_h': 117, 'tim': 1670674268822475, 'time': 1670674268, 'md5': 'AWI+ksuve+6pVQx9BfcdNQ==', 'fsize': 398116, 'resto': 620690734}, {'no': 620695621, 'now': '12/10/22(Sat)07:11:35', 'name': 'Anonymous', 'com': 'https://www.systemrequirementslab.c<wbr>om/rank-my-computer/graphics<br>reveal your powerlevel', 'filename': 'file', 'ext': '.png', 'w': 656, 'h': 1569, 'tn_w': 52, 'tn_h': 125, 'tim': 1670674295560092, 'time': 1670674295, 'md5': 'WFH58ZhErO8HrgqLDNPJ7A==', 'fsize': 86831, 'resto': 620690734}, {'no': 620695668, 'now': '12/10/22(Sat)07:12:20', 'name': 'Anonymous', 'com': '&quot;cosoles are holding gaming&quot; LOL', 'time': 1670674340, 'resto': 620690734}, {'no': 620695725, 'now': '12/10/22(Sat)07:13:19', 'name': 'Anonymous', 'com': '<a href=""#p620695589"" class=""quotelink"">&gt;&gt;620695589</a><br>actually downgraded from a 4k screen to a 1080p screen because of dpi scaling being a fucking shitshow.', 'time': 1670674399, 'resto': 620690734}, {'no': 620695730, 'now': '12/10/22(Sat)07:13:21', 'name': 'Anonymous', 'com': '<a href=""#p620693593"" class=""quotelink"">&gt;&gt;620693593</a><br>Yeah, i can.<br><span class=""quote"">&gt;inb4 4k faggots start REEEing at me</span>', 'time': 1670674401, 'resto': 620690734}]",1670674401,GTX 1060 lost the crown,,
4,620692319,12/10/22(Sat)06:11:29,Anonymous,My conclusion: This game is boring and I wasted my time,bored,.png,1174.0,636.0,250.0,135.0,1670670689981841.0,1670670689,1wcGh30zk3TT3WxQG7Thqw==,1914510.0,0,1.0,0,0,i-learned-how-to-play-dwarf-fortress,1,87,19,82.0,18.0,"[{'no': 620695620, 'now': '12/10/22(Sat)07:11:33', 'name': 'Anonymous', 'com': '<a href=""#p620692817"" class=""quotelink"">&gt;&gt;620692817</a><br><span class=""quote"">&gt;the game plays out everything in 1 second and all I can do is read the logs</span><br>Yeah, fucking great &quot;game.&quot;', 'filename': 'qiwxrt7xfa1a1', 'ext': '.png', 'w': 2024, 'h': 2448, 'tn_w': 103, 'tn_h': 125, 'tim': 1670674293980472, 'time': 1670674293, 'md5': 'wZmmYAldj8TSMAgbmatciQ==', 'fsize': 2541637, 'resto': 620692319, 'm_img': 1}, {'no': 620695675, 'now': '12/10/22(Sat)07:12:30', 'name': 'Anonymous', 'com': '<a href=""#p620695527"" class=""quotelink"">&gt;&gt;620695527</a><br>No.', 'time': 1670674350, 'resto': 620692319}, {'no': 620695708, 'now': '12/10/22(Sat)07:13:00', 'name': 'Anonymous', 'com': 'I am smart and therefore I love Dwarf Fortress.', 'time': 1670674380, 'resto': 620692319}, {'no': 620695721, 'now': '12/10/22(Sat)07:13:14', 'name': 'Anonymous', 'com': '<a href=""#p620695584"" class=""quotelink"">&gt;&gt;620695584</a><br>Correct.', 'time': 1670674394, 'resto': 620692319}, {'no': 620695728, 'now': '12/10/22(Sat)07:13:20', 'name': 'Anonymous', 'com': '<a href=""#p620695485"" class=""quotelink"">&gt;&gt;620695485</a><br>what an absolute lad<br>was blue cap a faggot?', 'time': 1670674400, 'resto': 620692319}]",1670674400,I learned how to play Dwarf Fortress,,
5,620692914,12/10/22(Sat)06:22:29,Anonymous,They’re both a year apart but which one is the better game?,New Vegas Skyrim,.jpg,4078.0,3036.0,250.0,186.0,1670671349686907.0,1670671349,7qyIIPqRhMPNicn/8ojaoQ==,2077717.0,0,1.0,0,0,theyre-both-a-year-apart-but-which-one-is-the,1,42,6,37.0,5.0,"[{'no': 620695638, 'now': '12/10/22(Sat)07:11:47', 'name': 'Anonymous', 'com': '<a href=""#p620695086"" class=""quotelink"">&gt;&gt;620695086</a><br><span class=""quote"">&gt;New Vegas isn&#039;t an RPG. Skyrim actually lets you chose to be what you want.</span>', 'filename': 'chris-evans-laughing-out-loud', 'ext': '.gif', 'w': 220, 'h': 231, 'tn_w': 119, 'tn_h': 125, 'tim': 1670674307595384, 'time': 1670674307, 'md5': 'SNekEoqOUGLz5u8a1Y9Hcw==', 'fsize': 218052, 'resto': 620692914}, {'no': 620695647, 'now': '12/10/22(Sat)07:11:57', 'name': 'Anonymous', 'com': '<a href=""#p620693006"" class=""quotelink"">&gt;&gt;620693006</a><br>Other way round maybe', 'time': 1670674317, 'resto': 620692914}, {'no': 620695651, 'now': '12/10/22(Sat)07:11:59', 'name': 'Anonymous', 'com': '<a href=""#p620695158"" class=""quotelink"">&gt;&gt;620695158</a><br>Somewhat related since Settlements were part of the problem but I just never felt like exploring was ever worth it in Fallout 4, you either usually found a shitty raider/ghoul/super mutant/gunner camp with random loot that&#039;s always worse than what you have or you find some shitty red bench telling you that there&#039;s zero redeeming qualities to that location since it&#039;s meant to be a &quot;blank canvas&quot; for you to play wannabe minecraft in. Seriously those benches were just a giant red flag for me, they always killed any interest I had in a place.', 'time': 1670674319, 'resto': 620692914}, {'no': 620695695, 'now': '12/10/22(Sat)07:12:48', 'name': 'Anonymous', 'com': '<a href=""#p620695647"" class=""quotelink"">&gt;&gt;620695647</a><br><span class=""quote"">&gt;story </span><br><span class=""quote"">&gt;Skyrim</span>', 'time': 1670674368, 'resto': 620692914}, {'no': 620695727, 'now': '12/10/22(Sat)07:13:20', 'name': 'Anonymous', 'com': 'https://www.youtube.com/watch?v=BNp<wbr>eeW3EJmU', 'time': 1670674400, 'resto': 620692914}]",1670674400,,,
6,620680454,12/10/22(Sat)02:33:27,Anonymous,"What’s harder to do when making a game, art or programming?",60237296-65A6-4F25-B6F1-AF10308EF294,.jpg,772.0,495.0,250.0,160.0,1670657607177513.0,1670657607,yaXt4qekd2FG7396VH2Seg==,124897.0,0,,0,0,whats-harder-to-do-when-making-a-game-art-or,1,65,27,60.0,23.0,"[{'no': 620694339, 'now': '12/10/22(Sat)06:49:09', 'name': 'Anonymous', 'com': '<a href=""#p620683646"" class=""quotelink"">&gt;&gt;620683646</a><br>Dora from Hades 2<br>https://files.catbox.moe/ydylln.png<wbr><br>I want to draw her more and practice doodling in general', 'filename': '20221209_235938', 'ext': '.png', 'w': 2091, 'h': 2122, 'tn_w': 123, 'tn_h': 125, 'tim': 1670672949672289, 'time': 1670672949, 'md5': 'CiLYFVE1bqNqf7knsn9WCw==', 'fsize': 441981, 'resto': 620680454}, {'no': 620694591, 'now': '12/10/22(Sat)06:53:19', 'name': 'Anonymous', 'com': '<a href=""#p620690764"" class=""quotelink"">&gt;&gt;620690764</a><br>Yeah, retard.', 'time': 1670673199, 'resto': 620680454}, {'no': 620695205, 'now': '12/10/22(Sat)07:03:57', 'name': 'Anonymous', 'com': '<a href=""#p620683646"" class=""quotelink"">&gt;&gt;620683646</a><br>Coomershit but hey', 'filename': '243405FD-CF31-47DB-ADF0-4EB3C8C4D164', 'ext': '.jpg', 'w': 707, 'h': 898, 'tn_w': 98, 'tn_h': 125, 'tim': 1670673837427684, 'time': 1670673837, 'md5': 'nhh0pPIE7oWc89wSwZ5cEQ==', 'fsize': 56441, 'resto': 620680454}, {'no': 620695526, 'now': '12/10/22(Sat)07:09:59', 'name': 'Anonymous', 'com': '<a href=""#p620683646"" class=""quotelink"">&gt;&gt;620683646</a><br>Did this yesterday', 'filename': 'IMG_20221210_130737_876', 'ext': '.jpg', 'w': 1280, 'h': 1139, 'tn_w': 125, 'tn_h': 111, 'tim': 1670674199939165, 'time': 1670674199, 'md5': 'EKBKAgng8FEOOKYnh5zjNw==', 'fsize': 123478, 'resto': 620680454, 'm_img': 1}, {'no': 620695726, 'now': '12/10/22(Sat)07:13:19', 'name': 'Anonymous', 'com': 'I started drawing a few months ago and i&#039;m too lazy to draw hands.', 'filename': 'file', 'ext': '.png', 'w': 395, 'h': 806, 'tn_w': 61, 'tn_h': 125, 'tim': 1670674399823210, 'time': 1670674399, 'md5': 'cyWrbcLklN0pKy/mY9whGg==', 'fsize': 133975, 'resto': 620680454}]",1670674399,,,
7,620678681,12/10/22(Sat)02:01:13,Anonymous,"Just got to this shit thanks to /v/, played a bit of 1 but got filtered hard<br>Who did you choose as your starting character? For me, it was the Yellow Mage<br><s>I can&#039;t believe this mother fucker went to the dungeons of fear and Hunger<br>And CROW NIG IS STILL ALIVE DOWN THERE</s>",1670609115680062,.png,556.0,486.0,250.0,218.0,1670655673132069.0,1670655673,ya7jn2q7pbAPZ6BwVOZ6vw==,352247.0,0,,0,0,fear-and-hunger-2,1,374,46,369.0,44.0,"[{'no': 620695623, 'now': '12/10/22(Sat)07:11:35', 'name': 'Anonymous', 'com': '<a href=""#p620695563"" class=""quotelink"">&gt;&gt;620695563</a><br>good morning sir', 'time': 1670674295, 'resto': 620678681}, {'no': 620695657, 'now': '12/10/22(Sat)07:12:08', 'name': 'Anonymous', 'com': '<a href=""#p620695427"" class=""quotelink"">&gt;&gt;620695427</a><br><span class=""quote"">&gt;get called out for cheating</span><br><span class=""quote"">&gt;instead of saying &quot;okay nigger&quot; you blame the soulsfags</span><br>MIND BROKEN<br><a href=""#p620695563"" class=""quotelink"">&gt;&gt;620695563</a><br>good morning sirs', 'time': 1670674328, 'resto': 620678681}, {'no': 620695683, 'now': '12/10/22(Sat)07:12:35', 'name': 'Anonymous', 'com': '<a href=""#p620695562"" class=""quotelink"">&gt;&gt;620695562</a><br><s>Every other Golden Gate in Rher&#039;s otherworld. You can even access the Workshop from the intro and meet an old friend.</s>', 'filename': 'Average Janny (cockless)', 'ext': '.png', 'w': 955, 'h': 482, 'tn_w': 125, 'tn_h': 63, 'tim': 1670674355678651, 'time': 1670674355, 'md5': 'QjwcZ+Hk9N3CthVH+zqhKA==', 'fsize': 475861, 'resto': 620678681, 'spoiler': 1}, {'no': 620695713, 'now': '12/10/22(Sat)07:13:08', 'name': 'Anonymous', 'com': 'yay i made it to the bunker and got killed by needles after doing like 500 damage to each arm and then he pulls out a gun.<br>fuck this game.', 'time': 1670674388, 'resto': 620678681}, {'no': 620695724, 'now': '12/10/22(Sat)07:13:17', 'name': 'Anonymous', 'com': '<a href=""#p620695468"" class=""quotelink"">&gt;&gt;620695468</a><br><span class=""quote"">&gt;knocking up my nympho neighbors</span><br><span class=""quote"">&gt;hentai pussy 5</span><br><span class=""quote"">&gt;cow girl 2</span><br><span class=""quote"">&gt;games cost less than a euro</span><br>goddamn', 'filename': 'doug', 'ext': '.jpg', 'w': 400, 'h': 400, 'tn_w': 125, 'tn_h': 125, 'tim': 1670674397080855, 'time': 1670674397, 'md5': 'cFX+ZaLVdnaGFGGltqQfkw==', 'fsize': 21239, 'resto': 620678681}]",1670674397,Fear and Hunger 2,,
8,620654485,12/09/22(Fri)20:54:27,Anonymous,"<span class=""quote"">&gt;origins: we want our fantasy setting to stand out somewhat, our elves aren&#039;t the chosen of the gods or the most ancient and powerful race, they&#039;re nomads of a fallen kingdom who don&#039;t even remember their own culture and are treated as inferiors by humanity</span><br><br><span class=""quote"">&gt;inquisition: elves made the world, made souls, formed emotions, and invented the concept of dreaming</span><br><br>What the fuck happened?",dragon-age-dreadwolf-button-01-1654193071576,.jpg,1080.0,1080.0,250.0,250.0,1670637267939894.0,1670637267,7fk60t1jNoXnsp4k7rMEfQ==,93212.0,0,1.0,0,0,dragon-age-deadname,1,254,19,249.0,19.0,"[{'no': 620695143, 'now': '12/10/22(Sat)07:02:51', 'name': 'Anonymous', 'com': '<a href=""#p620694739"" class=""quotelink"">&gt;&gt;620694739</a><br><span class=""quote"">&gt;some people would be goody two shoes at one moment and fuck things up in the other.</span><br>That&#039;s called being an idiot.', 'time': 1670673771, 'resto': 620654485}, {'no': 620695212, 'now': '12/10/22(Sat)07:04:06', 'name': 'Anonymous', 'com': '<a href=""#p620694824"" class=""quotelink"">&gt;&gt;620694824</a><br>He can.', 'time': 1670673846, 'resto': 620654485}, {'no': 620695279, 'now': '12/10/22(Sat)07:05:26', 'name': 'Anonymous', 'com': '<a href=""#p620694617"" class=""quotelink"">&gt;&gt;620694617</a><br>You can scare her into having sex with you and leaving Connor without getting anything in return. It&#039;s really rapeish', 'time': 1670673926, 'resto': 620654485}, {'no': 620695385, 'now': '12/10/22(Sat)07:07:20', 'name': 'Anonymous', 'com': '<a href=""#p620695143"" class=""quotelink"">&gt;&gt;620695143</a><br>Thats how people are irl. They are erratic and not always driven by reason.<br>Characters in modern bioware games are 1 trick ponys. They have one very defined personality and they NEVER deviate from it.', 'time': 1670674040, 'resto': 620654485}, {'no': 620695720, 'now': '12/10/22(Sat)07:13:13', 'name': 'Anonymous', 'com': '<a href=""#p620695385"" class=""quotelink"">&gt;&gt;620695385</a><br>I mean, Merrill doing stupid shit that she is told to be stupid doesn&#039;t really make her complex. I find Cullen&#039;s addiction struggles to be more compelling and that was basically baby&#039;s first drug addiction story and has no real consequences.', 'time': 1670674393, 'resto': 620654485}]",1670674393,Dragon Age: Deadname,,
9,620666408,12/09/22(Fri)23:06:16,Anonymous,NO NO NO NONONONONONO… <br><br>BWAHAHAHAHAHAHAHAHAHA,91739540-55B8-4943-AFF0-C5B74DCF63D7,.png,1827.0,1361.0,250.0,186.0,1670645176185573.0,1670645176,ViyjySHhL2ag3zBwMJVgGA==,534161.0,0,1.0,0,0,oh-no-no-no,1,253,40,248.0,38.0,"[{'no': 620693185, 'now': '12/10/22(Sat)06:27:08', 'name': 'Anonymous', 'com': '<a href=""#p620666408"" class=""quotelink"">&gt;&gt;620666408</a><br>If i could id personally strangle every faggot that buys this trash.', 'time': 1670671628, 'resto': 620666408}, {'no': 620693196, 'now': '12/10/22(Sat)06:27:20', 'name': 'Anonymous', 'com': '<a href=""#p620666408"" class=""quotelink"">&gt;&gt;620666408</a><br><span class=""quote"">&gt;even considering giving money to actiblizz</span><br>lol lmao', 'time': 1670671640, 'resto': 620666408}, {'no': 620694673, 'now': '12/10/22(Sat)06:54:44', 'name': 'Anonymous', 'com': '<a href=""#p620683262"" class=""quotelink"">&gt;&gt;620683262</a><br><span class=""quote"">&gt;hey this is a good deal for 30 dollars</span><br><span class=""quote"">&gt;realize there is no game included</span><br>Really now?', 'filename': '1378710465996', 'ext': '.gif', 'w': 285, 'h': 212, 'tn_w': 125, 'tn_h': 92, 'tim': 1670673284859146, 'time': 1670673284, 'md5': 'UZSKxQE91497XB75hXDhdQ==', 'fsize': 1292199, 'resto': 620666408}, {'no': 620694828, 'now': '12/10/22(Sat)06:57:07', 'name': 'Anonymous', 'com': '<a href=""#p620670128"" class=""quotelink"">&gt;&gt;620670128</a><br><span class=""quote"">&gt;imagine giving this copy pasted 2018 reddit post (you)&#039;s</span>', 'filename': '5ca', 'ext': '.png', 'w': 680, 'h': 662, 'tn_w': 125, 'tn_h': 121, 'tim': 1670673427721068, 'time': 1670673427, 'md5': '8ji4pIiBEZgaf+gwJ4bVvg==', 'fsize': 430945, 'resto': 620666408}, {'no': 620695719, 'now': '12/10/22(Sat)07:13:12', 'name': 'Anonymous', 'com': '<a href=""#p620690748"" class=""quotelink"">&gt;&gt;620690748</a><br>They&#039;ll &quot;accidentally&quot; introduce a &quot;bug&quot; that prevents D2R from connecting to their servers to prevent you from playing it and take 6+ months to &quot;fix&quot; it.', 'time': 1670674392, 'resto': 620666408}]",1670674392,Oh no no no…,,
10,620689764,12/10/22(Sat)05:26:12,Anonymous,"<span class=""quote"">&gt;Total War set in Ancient Greece</span><br><span class=""quote"">&gt;Flops</span><br>How the fuck? How did a game set during these times fail?",TWS_Troy_KeyArt_WithLogo,.jpg,1920.0,1081.0,250.0,140.0,1670667972082603.0,1670667972,4SsIMdpW2yrSwFHqg2M4VQ==,241000.0,0,1.0,0,0,total-war-set-in-ancient-greece,1,64,17,59.0,16.0,"[{'no': 620694202, 'now': '12/10/22(Sat)06:46:05', 'name': 'Anonymous', 'com': '<a href=""#p620693849"" class=""quotelink"">&gt;&gt;620693849</a><br>Just change your account to turkish.', 'time': 1670672765, 'resto': 620689764}, {'no': 620695007, 'now': '12/10/22(Sat)07:00:24', 'name': 'Anonymous', 'com': '<a href=""#p620693849"" class=""quotelink"">&gt;&gt;620693849</a><br>Wait, Russians can&#039;t use Steam or buy specific games because Ukraine?', 'time': 1670673624, 'resto': 620689764}, {'no': 620695107, 'now': '12/10/22(Sat)07:02:01', 'name': 'Anonymous', 'com': '<a href=""#p620695007"" class=""quotelink"">&gt;&gt;620695007</a><br>Yes, every big publisher made their games unavailable for purchase there after feb events.', 'time': 1670673721, 'resto': 620689764}, {'no': 620695206, 'now': '12/10/22(Sat)07:03:59', 'name': 'Anonymous', 'com': '<a href=""#p620689764"" class=""quotelink"">&gt;&gt;620689764</a><br>If this game is at least somewhat historically accurate how did they make it work? According to historians even the Illiads account of the battle is pretty murky because supposedly it was written several hundreds years later at the end of the Greek Dark Ages, long after collapse of the Minoan/Micenean civilization.<br><br><span class=""quote"">&gt; no hoplite tactics</span><br><span class=""quote"">&gt; only primitive bronze age armaments</span><br><span class=""quote"">&gt; no rideable horses for greeks</span><br><span class=""quote"">&gt; no large scale army tactics, instead soldiers fought with their gens and it&#039;s closest allies</span>', 'filename': 'proxy-image', 'ext': '.jpg', 'w': 1800, 'h': 1511, 'tn_w': 125, 'tn_h': 104, 'tim': 1670673839252045, 'time': 1670673839, 'md5': 'pJCx1Yv/3UStM5JL8+mp2w==', 'fsize': 1088569, 'resto': 620689764, 'm_img': 1}, {'no': 620695718, 'now': '12/10/22(Sat)07:13:11', 'name': 'Anonymous', 'com': '<a href=""#p620695206"" class=""quotelink"">&gt;&gt;620695206</a><br><span class=""quote"">&gt;rideable horses for greeks</span><br>But there are?', 'time': 1670674391, 'resto': 620689764}]",1670674391,,,
11,620694707,12/10/22(Sat)06:55:10,Anonymous,https://twitter.com/pcgamer/status/<wbr>1601356749218291717,15151314656,.png,597.0,672.0,222.0,250.0,1670673310615234.0,1670673310,DDSC0uC5OR0bRrwgzerq+g==,390114.0,0,,0,0,geoff-lied-a-report-was-taken-but-no-arrest,1,30,2,25.0,2.0,"[{'no': 620695614, 'now': '12/10/22(Sat)07:11:28', 'name': 'Anonymous', 'com': '<a href=""#p620694707"" class=""quotelink"">&gt;&gt;620694707</a><br>Invoking the Clinton makes you immune to arrest.', 'time': 1670674288, 'resto': 620694707}, {'no': 620695627, 'now': '12/10/22(Sat)07:11:38', 'name': 'Anonymous', 'com': '<a href=""#p620695536"" class=""quotelink"">&gt;&gt;620695536</a><br>It literally isn&#039;t, you aren&#039;t arrested unless they are planning on charging you with something. You are detained while the cop is running your ID or whatever but not arrested unless they&#039;re taking you back to the station', 'time': 1670674298, 'resto': 620694707}, {'no': 620695672, 'now': '12/10/22(Sat)07:12:28', 'name': 'Anonymous', 'com': '<a href=""#p620695473"" class=""quotelink"">&gt;&gt;620695473</a><br><span class=""quote"">&gt;only jews are allowed to be pranksters</span><br>lol', 'time': 1670674348, 'resto': 620694707}, {'no': 620695701, 'now': '12/10/22(Sat)07:12:50', 'name': 'Anonymous', 'com': '<a href=""#p620694707"" class=""quotelink"">&gt;&gt;620694707</a><br>He confused arrested with detained', 'time': 1670674370, 'resto': 620694707}, {'no': 620695717, 'now': '12/10/22(Sat)07:13:10', 'name': 'Anonymous', 'com': '<a href=""#p620695613"" class=""quotelink"">&gt;&gt;620695613</a><br><span class=""quote"">&gt;/pol/tard wants the child to be a nazi to prove a point</span><br>kys', 'time': 1670674390, 'resto': 620694707}]",1670674390,"Geoff lied, A report was taken, but no arrest:",,
