,no,now,name,com,filename,ext,w,h,tn_w,tn_h,tim,time,md5,fsize,resto,m_img,bumplimit,imagelimit,semantic_url,custom_spoiler,replies,images,omitted_posts,omitted_images,last_replies,last_modified,sub,trip,filedeleted
47,620693232,12/10/22(Sat)06:27:46,Anonymous,Elden ring open world is a huge regression compared to DS open world design.,dcc93ea71983e4010d04ab408004cc7d,.jpg,2009.0,2000.0,250.0,248.0,1670671666407947.0,1670671666,F4f5kXIpmprdF31kFuYVcg==,558010.0,0,1.0,0,0,elden-ring-open-world-is-a-huge-regression,1,15,2,10.0,2.0,"[{'no': 620694185, 'now': '12/10/22(Sat)06:45:47', 'name': 'Anonymous', 'com': '<a href=""#p620693232"" class=""quotelink"">&gt;&gt;620693232</a><br>it;s nothing but an evolution of their previous level design, with every hand crafted area being connected', 'time': 1670672747, 'resto': 620693232}, {'no': 620694462, 'now': '12/10/22(Sat)06:51:18', 'name': 'Anonymous', 'com': '<a href=""#p620693363"" class=""quotelink"">&gt;&gt;620693363</a><br>DS2 has the best world of them all. You got duped by youtube ecelebs jerking off to interconnectivity.', 'time': 1670673078, 'resto': 620693232}, {'no': 620694495, 'now': '12/10/22(Sat)06:51:41', 'name': 'Anonymous', 'com': '<a href=""#p620693363"" class=""quotelink"">&gt;&gt;620693363</a><br>this', 'time': 1670673101, 'resto': 620693232}, {'no': 620695387, 'now': '12/10/22(Sat)07:07:29', 'name': 'Anonymous', 'com': '<a href=""#p620693363"" class=""quotelink"">&gt;&gt;620693363</a><br>you are absolutely mindbroken by DS2', 'time': 1670674049, 'resto': 620693232}, {'no': 620695652, 'now': '12/10/22(Sat)07:12:00', 'name': 'Anonymous', 'com': '<a href=""#p620693232"" class=""quotelink"">&gt;&gt;620693232</a><br>Elden Ring was only made for the sole purpose of trying to squeeze into the &quot;open world rpg with crafting&quot; fad. GoW did it, Tomb Raider did it and now FS have done it amongst many others. There&#039;s nothing intersting about the Elden Ring world, its lifeless, boring and uninspired. All at the sole purpose of trying to reach a larger audience while giving up everything that made the soul series great.', 'time': 1670674320, 'resto': 620693232}]",1670674320,,,
48,620688643,12/10/22(Sat)05:05:26,Anonymous,"post game from last 5 years you would give 5/5 and describe it in 1 sentance. <br><span class=""quote"">&gt;picrel RDR2</span><br><span class=""quote"">&gt;be a fucking cowboy and do whatever the fuck you want</span>",file,.png,1195.0,667.0,250.0,139.0,1670666726685934.0,1670666726,v/3WAGxdhmpvjIx2TFvGNA==,1096237.0,0,1.0,0,0,games-that-we-actually-like,1,45,10,40.0,9.0,"[{'no': 620692882, 'now': '12/10/22(Sat)06:22:00', 'name': 'Anonymous', 'com': '<a href=""#p620692741"" class=""quotelink"">&gt;&gt;620692741</a><br>The biggest achievement of this game is the frankly stunning world. I&#039;ve never seen a better realized and more fleshed out world than in RDR2. Too bad Rockstar couldn&#039;t fill it with good gameplay and missions if their lives depended on it.', 'time': 1670671320, 'resto': 620688643}, {'no': 620692981, 'now': '12/10/22(Sat)06:23:32', 'name': 'Anonymous', 'com': '<a href=""#p620692882"" class=""quotelink"">&gt;&gt;620692882</a><br><span class=""quote"">&gt;The biggest achievement of this game is the frankly stunning world. I&#039;ve never seen a better realized and more fleshed out world than in RDR2. Too bad Rockstar couldn&#039;t fill it with good gameplay and missions if their lives depended on it.</span><br>Yeah I can&#039;t knock the story, or the fully realized world but god is it mostly boring to actually play.', 'time': 1670671412, 'resto': 620688643}, {'no': 620693225, 'now': '12/10/22(Sat)06:27:42', 'name': 'Anonymous', 'com': '<a href=""#p620692981"" class=""quotelink"">&gt;&gt;620692981</a><br>To be honest the story and writing get praised to high heavens but I didn&#039;t find them that amazing either. More than serviceable, but hardly a masterpiece. The whole story is basically<br><span class=""quote"">&gt;we just gotta do this one last job!</span><br>over and over again, with a predictable twist. The amount of detail in the world is second to none, though. I sometimes play it just to ride around and appreciate the scenery and detail in the wildlife, the NPC cycles and random events. But I never feel like replaying it because the missions are so fucking soul-suckingly scripted and devoid of freedom.', 'time': 1670671662, 'resto': 620688643}, {'no': 620693354, 'now': '12/10/22(Sat)06:30:07', 'name': 'Anonymous', 'com': '<a href=""#p620693225"" class=""quotelink"">&gt;&gt;620693225</a><br>I meant I can&#039;t really find fault with the story, not that it&#039;s high art or anything, it does it&#039;s job. I can understand people who rate the game highly for the work put into the world but for me if a game doesn&#039;t have good gameplay with some kind of hook a game will always be rated low.', 'time': 1670671807, 'resto': 620688643}, {'no': 620695645, 'now': '12/10/22(Sat)07:11:56', 'name': 'Anonymous', 'com': 'This one', 'filename': 'NTR_Legend', 'ext': '.png', 'w': 1280, 'h': 720, 'tn_w': 125, 'tn_h': 70, 'tim': 1670674316806080, 'time': 1670674316, 'md5': 'YTOb/BhsbVYoZS79y/5nJQ==', 'fsize': 355001, 'resto': 620688643}]",1670674316,games that we actually like,,
49,620690867,12/10/22(Sat)05:46:09,Anonymous,"steam OS is a cool OS, and it has much better support for touch screens than windows.<br>But I really don&#039;t want to try Linux, and Microsoft Windows is enough of a headache for me. I often have to look up fixes for game compatibility online and fix bugs manually.<br>Fixing Linux compatibility issues would annoy me to no end.",0184145,.jpg,1612.0,905.0,250.0,140.0,1670669169086672.0,1670669169,n0GrqGHevlZxEF98uxRxBw==,111501.0,0,1.0,0,0,i-want-to-buy-steam-deck-but-i-dont-want-to-try,1,23,4,18.0,4.0,"[{'no': 620694146, 'now': '12/10/22(Sat)06:45:02', 'name': 'Anonymous', 'com': '<a href=""#p620690867"" class=""quotelink"">&gt;&gt;620690867</a><br><span class=""quote"">&gt;I don&#039;t want to use Linux because I would have to do the kind of troubleshooting I already do with Windows</span><br>Then stick to games that are verified to work out-of-the-box.<br>Or just don&#039;t buy one. Who cares? Maybe buy one, install Windows, and cry about Deck not supporting Windows well enough.', 'time': 1670672702, 'resto': 620690867}, {'no': 620694708, 'now': '12/10/22(Sat)06:55:11', 'name': 'Anonymous', 'com': '<a href=""#p620690867"" class=""quotelink"">&gt;&gt;620690867</a><br>Retard here, will I make my deck kill if I swap the ssd? People keep saying that the deck won&#039;t last more than a few years if you take it apart, something about the screws being loose and causing flexing.', 'time': 1670673311, 'resto': 620690867}, {'no': 620695386, 'now': '12/10/22(Sat)07:07:22', 'name': 'Anonymous', 'com': '<a href=""#p620694708"" class=""quotelink"">&gt;&gt;620694708</a><br>First I’ve heard of it', 'time': 1670674042, 'resto': 620690867}, {'no': 620695463, 'now': '12/10/22(Sat)07:08:55', 'name': 'Anonymous', 'com': '<a href=""#p620695386"" class=""quotelink"">&gt;&gt;620695386</a><br>It was on some forum, but it didn&#039;t make sense to me. I can&#039;t imagine the plastic would strip threads from one disassembly.', 'time': 1670674135, 'resto': 620690867}, {'no': 620695642, 'now': '12/10/22(Sat)07:11:52', 'name': 'Anonymous', 'com': '<a href=""#p620695463"" class=""quotelink"">&gt;&gt;620695463</a><br>Do you have a link?', 'time': 1670674312, 'resto': 620690867}]",1670674312,"I want to buy steam deck, but I don&#039;t want to try Linux.",,
50,620692915,12/10/22(Sat)06:22:31,Anonymous,What am I in for?,images (1) (18),.jpg,639.0,361.0,250.0,141.0,1670671351901928.0,1670671351,6fKkEU6N4T6RGXzNMPxeqQ==,21949.0,0,,0,0,what-am-i-in-for,1,56,9,51.0,9.0,"[{'no': 620695556, 'now': '12/10/22(Sat)07:10:28', 'name': 'Anonymous', 'com': '<a href=""#p620695374"" class=""quotelink"">&gt;&gt;620695374</a><br><span class=""quote"">&gt;&gt;What does this game have to do with the 2006 Prey apart form the name?</span><br>absolutely nothing', 'time': 1670674228, 'resto': 620692915}, {'no': 620695560, 'now': '12/10/22(Sat)07:10:32', 'name': 'Anonymous', 'com': '<a href=""#p620695413"" class=""quotelink"">&gt;&gt;620695413</a><br><a href=""#p620695529"" class=""quotelink"">&gt;&gt;620695529</a><br>Seek professional help.<br>I&#039;m serious.', 'time': 1670674232, 'resto': 620692915}, {'no': 620695585, 'now': '12/10/22(Sat)07:11:04', 'name': 'Anonymous', 'com': '<a href=""#p620692915"" class=""quotelink"">&gt;&gt;620692915</a><br>A great game', 'time': 1670674264, 'resto': 620692915}, {'no': 620695605, 'now': '12/10/22(Sat)07:11:19', 'name': 'Anonymous', 'com': '<a href=""#p620695560"" class=""quotelink"">&gt;&gt;620695560</a><br>Me getting help won&#039;t help you being apparently either very ignorant or a poor troll.', 'time': 1670674279, 'resto': 620692915}, {'no': 620695636, 'now': '12/10/22(Sat)07:11:46', 'name': 'Anonymous', 'com': '<a href=""#p620695560"" class=""quotelink"">&gt;&gt;620695560</a><br><span class=""quote"">&gt;still going</span><br>cringe', 'time': 1670674306, 'resto': 620692915}]",1670674306,,,
51,620690457,12/10/22(Sat)05:38:50,Anonymous,"Trying again because I want some comfy Outer Wilds discussion.<br><br>Share stories, ask for hints, brag about cool shit you&#039;ve pulled off, use spoiler tags, have <s>fun</s>",capsule_616x353,.jpg,616.0,353.0,250.0,143.0,1670668730949549.0,1670668730,pbSWHE+NuWyvpi/Iz2BWKQ==,51127.0,0,,0,0,trying-again-because-i-want-some-comfy-outer,1,11,1,6.0,1.0,"[{'no': 620694895, 'now': '12/10/22(Sat)06:58:25', 'name': 'Anonymous', 'com': 'What&#039;s the best astral body and why is it Ember Twin? There was so much you had to do there and the city is so haunting.', 'time': 1670673505, 'resto': 620690457}, {'no': 620695365, 'now': '12/10/22(Sat)07:06:58', 'name': 'Anonymous', 'com': 'In what order did you guys explore the solar system? I did Brittlle Hollow &gt; Ember Twin &gt; Ash Twin (found *the thing* and had zero idea what was going on) &gt; Sun Station <s>(had not enough idea of what was going on for the reveal to have the intended impact)</s> &gt; Timber Hearth (had actually forgot to check out the sights) &gt; The Interloper &gt; Giant&#039;s Deep (didn&#039;t know how to get to <s>the core</s>) &gt; Dark Bramble (this is where things started to click) &gt; Giant&#039;s Deep again (got to <s>the core</s> and finally figured it all out) &gt; <s>Quantum Moon</s> &gt; Endgame<br><br>Kinda bummed that I stumbled into the ATP and got to the Sun Station so early. I think I lost some of the woah factor because I hadn&#039;t had time to set the expectations they are designed to break, but oh well.', 'time': 1670674018, 'resto': 620690457}, {'no': 620695424, 'now': '12/10/22(Sat)07:08:00', 'name': 'Anonymous', 'com': 'The DLC was actually really fucking good. Can&#039;t wait to see what these guys are making next.', 'time': 1670674080, 'resto': 620690457}, {'no': 620695521, 'now': '12/10/22(Sat)07:09:53', 'name': 'Anonymous', 'com': '<a href=""#p620694895"" class=""quotelink"">&gt;&gt;620694895</a><br>I really is the most dense with stuff to do, but I&#039;m partial to Brittle Hollow because nothing can top the feeling of discovering the <s>White Hole Station</s>, although the reveal in the <s>lakebed cave</s> and the stuff in the <s>high energy lab</s> come pretty close.', 'time': 1670674193, 'resto': 620690457}, {'no': 620695635, 'now': '12/10/22(Sat)07:11:45', 'name': 'Anonymous', 'com': '<a href=""#p620695521"" class=""quotelink"">&gt;&gt;620695521</a><br>Nobody discovers <s>White Hole Station</s>, everyone just appears there and wonders what the hell just happened', 'time': 1670674305, 'resto': 620690457}]",1670674305,,,
52,620693567,12/10/22(Sat)06:33:53,Anonymous,"If one hasn&#039;t been released yet, what do you think the official statement from The Game Awards/Geoff Keighley will be? How are they going to officially address this?<br><span class=""quote"">&gt;Yeah our security and stage handling is fuck, our bad...</span><br><span class=""quote"">&gt;We were caught unawares, we were under the impression he was part of Miyazaki&#039;s cadre and...</span><br><span class=""quote"">&gt;Whoopsie poopsie doodles...</span><br>Do you think he&#039;s gonna try and double down on it next year, or during any event he holds next? Like hire someone to get on stage dressed the same and make some skit about it?<br>No matter what he&#039;ll say about this, he&#039;ll be in the wrong.",567456865,.jpg,3840.0,2160.0,250.0,140.0,1670672033013271.0,1670672033,9wa2cqPDofNK8Q7ZVqf6SQ==,750170.0,0,1.0,0,0,geoff-keighley-official-statement,1,57,7,52.0,7.0,"[{'no': 620695496, 'now': '12/10/22(Sat)07:09:31', 'name': 'Anonymous', 'com': '<a href=""#p620695327"" class=""quotelink"">&gt;&gt;620695327</a><br>I wish they would do it at p*litical events in minecraft haha lol', 'time': 1670674171, 'resto': 620693567}, {'no': 620695561, 'now': '12/10/22(Sat)07:10:33', 'name': 'Anonymous', 'com': 'Myazaki could have been a modern John Lennon, he is lucky to still be alive', 'time': 1670674233, 'resto': 620693567}, {'no': 620695573, 'now': '12/10/22(Sat)07:10:46', 'name': 'Anonymous', 'com': '<a href=""#p620695443"" class=""quotelink"">&gt;&gt;620695443</a><br>meds', 'time': 1670674246, 'resto': 620693567}, {'no': 620695628, 'now': '12/10/22(Sat)07:11:39', 'name': 'Anonymous', 'com': '<a href=""#p620694802"" class=""quotelink"">&gt;&gt;620694802</a><br><span class=""quote"">&gt;people are actually offended because someone mildly interrupted an industry awards show/corporate ad event</span><br>Funniest shit', 'time': 1670674299, 'resto': 620693567}, {'no': 620695632, 'now': '12/10/22(Sat)07:11:43', 'name': 'Anonymous', 'com': '<a href=""#p620693567"" class=""quotelink"">&gt;&gt;620693567</a><br>ORTHODOX<br>RABBI<br>BILL<br>CLINTON', 'time': 1670674303, 'resto': 620693567}]",1670674303,Geoff Keighley Official Statement?,,
53,620671934,12/10/22(Sat)00:15:13,Anonymous,they linked up,file,.png,2048.0,1536.0,250.0,187.0,1670649313676674.0,1670649313,AjZdACcnni8tsjp1NtR5BQ==,3198618.0,0,1.0,0,0,they-linked-up,1,136,13,131.0,12.0,"[{'no': 620693319, 'now': '12/10/22(Sat)06:29:30', 'name': 'Anonymous', 'com': '<a href=""#p620671934"" class=""quotelink"">&gt;&gt;620671934</a><br><span class=""quote"">&gt;Al Pacino thinks he just met Jackie Chan</span>', 'time': 1670671770, 'resto': 620671934}, {'no': 620693419, 'now': '12/10/22(Sat)06:31:06', 'name': 'Anonymous', 'com': 'What&#039;s gonna be Al&#039;s character in DS2?', 'time': 1670671866, 'resto': 620671934}, {'no': 620694819, 'now': '12/10/22(Sat)06:57:01', 'name': 'Anonymous', 'com': '<a href=""#p620691730"" class=""quotelink"">&gt;&gt;620691730</a><br>DS is a mediocre at best game, but since its <br>A-Made in Japan, and <br>B-Made by La Creatividad<br>&quot;people&quot; here will bend themselves backwards to defend it.', 'time': 1670673421, 'resto': 620671934}, {'no': 620695031, 'now': '12/10/22(Sat)07:00:52', 'name': 'Anonymous', 'com': '<a href=""#p620675468"" class=""quotelink"">&gt;&gt;620675468</a><br>Kojima is an honorary Hollywood director, so yeah, I&#039;m pretty sure. I mean, even my rural redneck friend&#039;s dad is familiar with Kojima, in the same way he&#039;s familiar with Spielberg or Ridley Scott.', 'time': 1670673652, 'resto': 620671934}, {'no': 620695630, 'now': '12/10/22(Sat)07:11:40', 'name': 'Anonymous', 'com': '<a href=""#p620683895"" class=""quotelink"">&gt;&gt;620683895</a><br>i hate /tv/ but i tune in occasionally, is robert going to stream home alone this year again?', 'filename': '35%', 'ext': '.jpg', 'w': 419, 'h': 512, 'tn_w': 102, 'tn_h': 125, 'tim': 1670674300509445, 'time': 1670674300, 'md5': 'UKNKxB5T7IysOOARj4wL2Q==', 'fsize': 42777, 'resto': 620671934}]",1670674300,,,
54,620687938,12/10/22(Sat)04:49:52,Anonymous,"<span class=""quote"">&gt;smelly poorfag bullies that beat the shit out of everyone for no reason and they are passive aggressive cunts to anyone that actually likes them</span><br><br>What awful protagonists",river city ransom,.jpg,1280.0,720.0,250.0,140.0,1670665792190179.0,1670665792,57YPwIFZD90VtIiYvN5S8Q==,284267.0,0,1.0,0,0,smelly-poorfag-bullies-that-beat-the-shit-out-of,1,73,27,68.0,26.0,"[{'no': 620695260, 'now': '12/10/22(Sat)07:05:05', 'name': 'Anonymous', 'com': '<a href=""#p620695207"" class=""quotelink"">&gt;&gt;620695207</a><br><span class=""quote"">&gt;chiptunes are bad</span><br>Wow, an actual 12 year old on /v/.', 'filename': '1530236005951', 'ext': '.png', 'w': 251, 'h': 393, 'tn_w': 79, 'tn_h': 125, 'tim': 1670673905767347, 'time': 1670673905, 'md5': 'KfNbQEvOqHhG9ZmezF4Bjg==', 'fsize': 63859, 'resto': 620687938}, {'no': 620695312, 'now': '12/10/22(Sat)07:06:03', 'name': 'Anonymous', 'com': '<a href=""#p620695260"" class=""quotelink"">&gt;&gt;620695260</a><br>He said the chiptunes were bad, not that they were bad because they were chiptunes<br>Learn2read', 'time': 1670673963, 'resto': 620687938}, {'no': 620695324, 'now': '12/10/22(Sat)07:06:15', 'name': 'Anonymous', 'com': '<a href=""#p620695160"" class=""quotelink"">&gt;&gt;620695160</a><br>Abobo&#039;s and the secret boss were the only ones I really enjoyed personally<br>Sabuko&#039;s all right too<br>Best theme in the game is Unseen', 'time': 1670673975, 'resto': 620687938}, {'no': 620695457, 'now': '12/10/22(Sat)07:08:43', 'name': 'Anonymous', 'com': '<a href=""#p620695260"" class=""quotelink"">&gt;&gt;620695260</a><br>They are when it sounds like someone gave a monkey a timesheet and pen and told it to write music.', 'time': 1670674123, 'resto': 620687938}, {'no': 620695626, 'now': '12/10/22(Sat)07:11:37', 'name': 'Anonymous', 'com': 'I&#039;m playing the first one and it&#039;s really weird how 95% of the enemies are &quot;diverse&quot; shitskinned amerimongrels while literally 100% of all the bystanders in the game are Asian. Isn&#039;t River Supposed to be in Japan? Where the fuck did all the niggers come from?', 'time': 1670674297, 'resto': 620687938}]",1670674297,,,
55,620640409,12/09/22(Fri)18:33:49,Anonymous,"Buy Dragonflight, chud",1670371336474488,.webm,492.0,612.0,200.0,250.0,1670628829916597.0,1670628829,/rJLUuovDMfXncb/y+mbgw==,3035329.0,0,,0,0,buy-dragonflight-chud,1,333,62,328.0,62.0,"[{'no': 620694215, 'now': '12/10/22(Sat)06:46:13', 'name': 'Anonymous', 'com': '<a href=""#p620693539"" class=""quotelink"">&gt;&gt;620693539</a><br>Yeah the old world is simply not designed for flying period, it was supposed to be traversed on foot and maybe a ground mount, dragonflying is just too fun, especially in vertical zones<br><br><a href=""#p620693545"" class=""quotelink"">&gt;&gt;620693545</a><br>I think they did it because every other time they threw a character like this at you at the start of an expac they were a key plot character so it was sort of a twist if you were a seasoned player<br>But yeah emotional impact null and void, more like &quot;huh, guess I don&#039;t have to deal with this lesbian fetish fuel anymore&quot;<br><br>The only time I got fucked up by a character death was Ysera in legion, that expansion actually felt like the final curtain call for wows story and everything after it is filler to keep pumping money<br><br>The real big issue now is how predictable wows story has become because you know exactly what content the people writing it consume and its all capeshit and Harry Potter knockoffs', 'time': 1670672773, 'resto': 620640409}, {'no': 620694825, 'now': '12/10/22(Sat)06:57:04', 'name': 'Anonymous', 'com': '<a href=""#p620694215"" class=""quotelink"">&gt;&gt;620694215</a><br>XIV&#039;s story is also predictable as fuck. But it at least gives the story and characters breathing room to just exist.<br>In WoW, everything just happens way to fast because they fear that the cunts that skip through all of this get bored. And I will never take anyone who complains about XIV&#039;s quest seriously ever again. i&#039;d rather read a visual novel instead of having to go off and kill 5 guys and collect 10 weapons every 5 minutes.', 'time': 1670673424, 'resto': 620640409}, {'no': 620694951, 'now': '12/10/22(Sat)06:59:17', 'name': 'Anonymous', 'com': '<a href=""#p620694215"" class=""quotelink"">&gt;&gt;620694215</a><br>The one massive issue with releasing a WoW2 is how do you convince long-time players to move from WoW to the new game? Granted, WoW itself is has been around for nearly two decades at this point using technology even older than what was fresh in 2004 (Far Cry 1 comes to mind), and all of its cracks in the foundation are showing, but you do you convince millions of people to move on from worshiping the golden calf?', 'time': 1670673557, 'resto': 620640409}, {'no': 620695182, 'now': '12/10/22(Sat)07:03:38', 'name': 'Anonymous', 'com': '<a href=""#p620694951"" class=""quotelink"">&gt;&gt;620694951</a><br>they probably could do that similar to PoE2, with cosmetics and achievments or even characters carrying over... but that means that many thing that could be changed for better will stay same', 'time': 1670673818, 'resto': 620640409}, {'no': 620695619, 'now': '12/10/22(Sat)07:11:33', 'name': 'Anonymous', 'com': '<a href=""#p620694825"" class=""quotelink"">&gt;&gt;620694825</a><br>I&#039;m happy to read a vn if it&#039;s well written but man that&#039;s just not possible with this current WoW team, killing 10 dudes is a mercy compared to the writing, all my attachment to these dragons is because I&#039;ve already known them longer than I&#039;ve known a lot of irl people, I still remember needing to go kill malygos in the eye of eternity because of his insane war against the red dragons or tarecgosas sacrifice or killing nozdormus future self in cata to close the timeloop<br>It fucking sucks watching them turn kalec from the chad-king of the kirin tor into a mommas boy to a blackfaced elf AI and the only blue dragons showing up being the ones from legion<br><br><a href=""#p620694951"" class=""quotelink"">&gt;&gt;620694951</a><br>You can&#039;t, that&#039;s why they realized overwatch 2 is just a fat update for overwatch 1', 'time': 1670674293, 'resto': 620640409}]",1670674293,,,
56,620688617,12/10/22(Sat)05:05:02,Anonymous,"<span class=""quote"">&gt;saves FF</span>",ff,.png,1465.0,1080.0,250.0,184.0,1670666702258850.0,1670666702,oZpD6N/PAOnv4GXqPZYF+g==,1355954.0,0,1.0,0,0,saves-ff,1,27,0,22.0,0.0,"[{'no': 620692807, 'now': '12/10/22(Sat)06:20:34', 'name': 'Anonymous', 'com': '<a href=""#p620691330"" class=""quotelink"">&gt;&gt;620691330</a><br><span class=""quote"">&gt;Square Enix is full of racists</span><br>This shit really drove me up the fucking wall. 7R had black people or poc, XIV, XV, XIII, XII, XI, X, VII (I didn&#039;t put VIII because I&#039;ve never played VIII and I don&#039;t think IX had poc). One game, ONE FUCKING GAME that doesn&#039;t show a black person or poc front and center, and suddenly SE is anti-blackness or a racist. Jesus fucking christ. What more to these motherfuckers even want.', 'time': 1670671234, 'resto': 620688617}, {'no': 620693505, 'now': '12/10/22(Sat)06:32:50', 'name': 'Anonymous', 'com': '<a href=""#p620692807"" class=""quotelink"">&gt;&gt;620692807</a><br>It&#039;s just the new age &quot;FF fans&quot; that started with FFXIV. Same people tried to complain that Y&#039;shtola&#039;s skin color got lighter even though her 1.0 and ARR renders are exactly the same as her current ones. But hey it&#039;s definitely not the games dog shit lightning or anything.', 'time': 1670671970, 'resto': 620688617}, {'no': 620694565, 'now': '12/10/22(Sat)06:52:55', 'name': 'Anonymous', 'com': '<a href=""#p620692807"" class=""quotelink"">&gt;&gt;620692807</a><br>yoshida being the guy that he is and overexplaining himself didn&#039;t help this at all. But seriously, how can you go through FFXIV and think the developers are racist?<br><br>Because Thancred and Y&#039;shtola lost their tan? I swear half those cunts just want to project and see evil where there is none. But god of war gets bonus points for including two token black characters, one of them being a manic pixie girl plot device, the other one just shows up and is irrelevant soon after. That&#039;s way more offensive', 'time': 1670673175, 'resto': 620688617}, {'no': 620695185, 'now': '12/10/22(Sat)07:03:39', 'name': 'Anonymous', 'com': '<a href=""#p620688617"" class=""quotelink"">&gt;&gt;620688617</a><br>Then why is there zero hype?', 'time': 1670673819, 'resto': 620688617}, {'no': 620695615, 'now': '12/10/22(Sat)07:11:30', 'name': 'Anonymous', 'com': '<a href=""#p620695185"" class=""quotelink"">&gt;&gt;620695185</a><br>No FMV for first trailer.<br>That literally the whole reason.', 'time': 1670674290, 'resto': 620688617}]",1670674290,,,
57,620695612,12/10/22(Sat)07:11:26,Anonymous,simplified dogshit,i1568742297124374,.jpg,1200.0,800.0,250.0,166.0,1670674286097988.0,1670674286,Zg//sT4bp400zxNVT6G7cQ==,130943.0,0,1.0,0,0,simplified-dogshit,1,0,0,,,,1670674286,,,
