,no,now,name,com,filename,ext,w,h,tn_w,tn_h,tim,time,md5,fsize,resto,bumplimit,imagelimit,semantic_url,custom_spoiler,replies,images,omitted_posts,omitted_images,last_replies,last_modified,m_img,sub,trip
91,620983678,12/12/22(Mon)19:27:26,Anonymous,play Flopspoken,1670887090627824,.png,960,720,250,187,1670891246955089,1670891246,y0VNG8gDpEIBpsN/S4ljTQ==,1263133,0,0,0,play-flopspoken,1,447,118,442.0,117.0,"[{'no': 621030381, 'now': '12/13/22(Tue)06:56:48', 'name': 'Anonymous', 'com': '<a href=""#p620984853"" class=""quotelink"">&gt;&gt;620984853</a><br><span class=""quote"">&gt;Left Alive was meant to be a mech game</span><br><span class=""quote"">&gt;spend more time bumbling around slamming shit with a pipe</span><br>If I wanted to play that shit I&#039;d go start up Condemned again. At least their physics give enough feedback to make it worth playing.', 'time': 1670932608, 'resto': 620983678}, {'no': 621030475, 'now': '12/13/22(Tue)06:58:16', 'name': 'Anonymous', 'com': '<a href=""#p621030359"" class=""quotelink"">&gt;&gt;621030359</a><br>Can confirm, it is. They actually ask for money in the online store for the Forspoken demo. At least in Germany.', 'time': 1670932696, 'resto': 620983678}, {'no': 621030642, 'now': '12/13/22(Tue)07:01:19', 'name': 'Anonymous', 'com': '<a href=""#p621030475"" class=""quotelink"">&gt;&gt;621030475</a><br>I wonder if it&#039;s sony who added that tax or square enix', 'time': 1670932879, 'resto': 620983678}, {'no': 621031068, 'now': '12/13/22(Tue)07:10:13', 'name': 'Anonymous', 'com': '<a href=""#p621009742"" class=""quotelink"">&gt;&gt;621009742</a><br><span class=""quote"">&gt;cealing</span>', 'filename': '1638867310943', 'ext': '.jpg', 'w': 597, 'h': 514, 'tn_w': 125, 'tn_h': 107, 'tim': 1670933413385528, 'time': 1670933413, 'md5': '+NONpUD+2sbm5Tzj6sES7g==', 'fsize': 24110, 'resto': 620983678}, {'no': 621031102, 'now': '12/13/22(Tue)07:10:49', 'name': 'Anonymous', 'com': 'I dindu magik n shit', 'time': 1670933449, 'resto': 620983678}]",1670933449,,,
92,621028426,12/13/22(Tue)06:18:36,Anonymous,"Well well well, what do we have here?",IMG_1120,.jpg,4032,3024,250,187,1670930316312487,1670930316,w83jVs7cTu5yc2btSP3d3A==,2648021,0,0,0,well-well-well-what-do-we-have-here,1,22,7,17.0,6.0,"[{'no': 621029707, 'now': '12/13/22(Tue)06:42:46', 'name': 'Anonymous', 'com': '<a href=""#p621029536"" class=""quotelink"">&gt;&gt;621029536</a><br>But I’m not a troon, and I’m with my father right now', 'time': 1670931766, 'resto': 621028426}, {'no': 621029740, 'now': '12/13/22(Tue)06:43:30', 'name': 'Anonymous', 'com': 'Moderators.', 'time': 1670931810, 'resto': 621028426}, {'no': 621030169, 'now': '12/13/22(Tue)06:52:30', 'name': 'Anonymous', 'filename': 'Roasted SW Tendie', 'ext': '.webm', 'w': 768, 'h': 432, 'tn_w': 125, 'tn_h': 70, 'tim': 1670932350433448, 'time': 1670932350, 'md5': 'vZhkqtAbQ7Ls+MM/zcQA1A==', 'fsize': 2862511, 'resto': 621028426}, {'no': 621030202, 'now': '12/13/22(Tue)06:53:14', 'name': 'Anonymous', 'com': 'god these threads are always fucking lame kill yourself OP', 'time': 1670932394, 'resto': 621028426}, {'no': 621031084, 'now': '12/13/22(Tue)07:10:35', 'name': 'Anonymous', 'com': '<a href=""#p621028540"" class=""quotelink"">&gt;&gt;621028540</a><br><span class=""quote"">&gt;I’m not black baka</span><br>dropped', 'time': 1670933435, 'resto': 621028426}]",1670933435,1.0,,
93,621010381,12/13/22(Tue)00:59:59,Anonymous,Delicious vidya chocolate thread,__urbosa_the_legend_of_zelda_and_1_more_drawn_by_pinkdrawz__2a196e6ce3c5477273187408ea7a92fd,.jpg,1000,1000,250,250,1670911199327641,1670911199,2G0Uzb5ASD7SqozRGABywQ==,119468,0,0,0,delicious-vidya-chocolate-thread,1,128,55,123.0,54.0,"[{'no': 621030682, 'now': '12/13/22(Tue)07:02:11', 'name': 'Anonymous', 'com': '<a href=""#p621030528"" class=""quotelink"">&gt;&gt;621030528</a><br>a lot of artists have aliases too, just curious', 'time': 1670932931, 'resto': 621010381}, {'no': 621030905, 'now': '12/13/22(Tue)07:06:51', 'name': 'Anonymous', 'com': '<a href=""#p621030668"" class=""quotelink"">&gt;&gt;621030668</a><br>There are a lot of details in their art that are pretty different I think people are just looking for patterns. I remember multiple times people thought I was legoman<br><a href=""#p621030682"" class=""quotelink"">&gt;&gt;621030682</a><br>I see no reason for legoman to have', 'time': 1670933211, 'resto': 621010381}, {'no': 621031003, 'now': '12/13/22(Tue)07:08:45', 'name': 'Anonymous', 'com': '<a href=""#p621030369"" class=""quotelink"">&gt;&gt;621030369</a><br><a href=""#p621030445"" class=""quotelink"">&gt;&gt;621030445</a><br>No, Pinkdraws is a little too basic and idiosyncratic in their work (a lot of the same poses &amp; backdrops, constant use of bodysuits with stirrups or certain kinds of heels to show feet) to line up with Legoman. Pink at least colors pretty much everything and shades nearly everything.', 'time': 1670933325, 'resto': 621010381}, {'no': 621031062, 'now': '12/13/22(Tue)07:10:04', 'name': 'Anonymous', 'com': '<a href=""#p621010532"" class=""quotelink"">&gt;&gt;621010532</a><br>LOVE the smokey teenage girl eyeliner', 'time': 1670933404, 'resto': 621010381}, {'no': 621031080, 'now': '12/13/22(Tue)07:10:30', 'name': 'Anonymous', 'com': 'I suffer from a bad case of brown fever and racist parents.', 'filename': '1548783081432', 'ext': '.png', 'w': 1920, 'h': 1080, 'tn_w': 125, 'tn_h': 70, 'tim': 1670933430042332, 'time': 1670933430, 'md5': 'y1Iil+BMIbO61g5j/ZubwA==', 'fsize': 1674791, 'resto': 621010381, 'm_img': 1}]",1670933430,,,
94,621030956,12/13/22(Tue)07:07:49,Anonymous,Astolfo brought you hot coco!,1552672289476,.jpg,800,1066,187,250,1670933269288922,1670933269,PeEcLIPnPpNNVmZ58unUfQ==,123161,0,0,0,astolfo-brought-you-hot-coco,1,3,1,,,"[{'no': 621031023, 'now': '12/13/22(Tue)07:09:05', 'name': 'Anonymous', 'com': 'Fat-ass faggot. Sit on my face you little queer.', 'time': 1670933345, 'resto': 621030956}, {'no': 621031058, 'now': '12/13/22(Tue)07:10:02', 'name': 'Anonymous', 'com': '<a href=""#p621030956"" class=""quotelink"">&gt;&gt;621030956</a><br>Thanks Astolfo, let me suck your cock.', 'time': 1670933402, 'resto': 621030956}, {'no': 621031065, 'now': '12/13/22(Tue)07:10:12', 'name': 'Anonymous', 'com': 'You’re a dumb whore with a fat ass Astolfo!', 'filename': 'CAD689CB-2F93-4F88-AD09-E93AF348E4E4', 'ext': '.jpg', 'w': 736, 'h': 416, 'tn_w': 125, 'tn_h': 70, 'tim': 1670933412220133, 'time': 1670933412, 'md5': 'rQmODN/d5bnMwOYnrzsaxQ==', 'fsize': 16204, 'resto': 621030956}]",1670933412,1.0,,
95,620988976,12/12/22(Mon)20:23:28,Anonymous,Sex makes video game better or worse?,lolibooru 417371 ass_visible_through_thighs eyebrows_visible_through_hair photoshop_(medium) see-through_shirt shinryaku!_ikamusume swimsuit_under_clothes,.jpg,1955,2750,177,250,1670894608694011,1670894608,v1B3QadgIkH8vnltG6YzuQ==,1957566,0,0,0,thoughts,1,172,47,167.0,47.0,"[{'no': 621030291, 'now': '12/13/22(Tue)06:55:02', 'name': 'Anonymous', 'com': '<a href=""#p621029847"" class=""quotelink"">&gt;&gt;621029847</a><br>this looks kinda cute and funny, what is it?', 'time': 1670932502, 'resto': 620988976}, {'no': 621030373, 'now': '12/13/22(Tue)06:56:35', 'name': 'Anonymous', 'com': '<a href=""#p621030201"" class=""quotelink"">&gt;&gt;621030201</a><br><span class=""quote"">&gt;feel old</span><br>Nani? Ika musume is newfag stuff...', 'time': 1670932595, 'resto': 620988976}, {'no': 621030458, 'now': '12/13/22(Tue)06:58:02', 'name': 'Anonymous', 'com': '<a href=""#p621030201"" class=""quotelink"">&gt;&gt;621030201</a><br><span class=""quote"">&gt;MGQ</span><br>Kids manga had a crossover with porn?', 'time': 1670932682, 'resto': 620988976}, {'no': 621030867, 'now': '12/13/22(Tue)07:06:07', 'name': 'Anonymous', 'com': '<a href=""#p621030458"" class=""quotelink"">&gt;&gt;621030458</a><br>JP mangakas are often degenerates and don&#039;t give a fuck. See: Coolkyou.', 'time': 1670933167, 'resto': 620988976}, {'no': 621031060, 'now': '12/13/22(Tue)07:10:03', 'name': 'Anonymous', 'com': '<a href=""#p621023065"" class=""quotelink"">&gt;&gt;621023065</a><br>Pedophiles on 4chan? Sounds a little far fetched but I’ll keep an eye out.', 'time': 1670933403, 'resto': 620988976}]",1670933403,1.0,Thoughts,
96,620955591,12/12/22(Mon)14:40:18,Anonymous,"<span class=""quote"">&gt;I need you Mio!</span>",54634523,.png,1280,720,250,140,1670874018254023,1670874018,XGtySaHwAapC4Mfe83gK0A==,1353892,0,0,0,xenoblade-chronicles,1,217,72,212.0,72.0,"[{'no': 621029902, 'now': '12/13/22(Tue)06:47:00', 'name': 'Anonymous', 'com': '<a href=""#p621029349"" class=""quotelink"">&gt;&gt;621029349</a><br>I only know of a website that has the 2 models, never saw one for 3', 'time': 1670932020, 'resto': 620955591}, {'no': 621029983, 'now': '12/13/22(Tue)06:48:48', 'name': 'Anonymous', 'com': '<a href=""#p621027074"" class=""quotelink"">&gt;&gt;621027074</a><br>Always has been. Ethel is very bland even before her death', 'time': 1670932128, 'resto': 620955591}, {'no': 621030154, 'now': '12/13/22(Tue)06:52:16', 'name': 'Anonymous', 'com': '<a href=""#p621029983"" class=""quotelink"">&gt;&gt;621029983</a><br>But she does have nice boobs.', 'time': 1670932336, 'resto': 620955591}, {'no': 621030290, 'now': '12/13/22(Tue)06:55:00', 'name': 'Anonymous', 'com': '<a href=""#p621022570"" class=""quotelink"">&gt;&gt;621022570</a><br>Based canon chad.', 'time': 1670932500, 'resto': 620955591}, {'no': 621031054, 'now': '12/13/22(Tue)07:09:53', 'name': 'Anonymous', 'com': 'Sup Poppifag', 'time': 1670933393, 'resto': 620955591}]",1670933393,1.0,Xenoblade Chronicles,
97,621015883,12/13/22(Tue)02:31:14,Anonymous,Rank &#039;em,51kFdznv0bL._AC_SY580_,.jpg,357,500,178,250,1670916674475622,1670916674,vOv5RgQ0OyAUAA7fhKYQIA==,46254,0,0,0,castlevania-thread,1,58,12,53.0,11.0,"[{'no': 621030273, 'now': '12/13/22(Tue)06:54:43', 'name': 'Anonymous', 'com': '<a href=""#p621015883"" class=""quotelink"">&gt;&gt;621015883</a><br>Here is my list :)', 'filename': 'Untitled', 'ext': '.jpg', 'w': 817, 'h': 739, 'tn_w': 125, 'tn_h': 113, 'tim': 1670932483850917, 'time': 1670932483, 'md5': 'Cj9QTRvxN9Sq/J98FapNbA==', 'fsize': 208005, 'resto': 621015883}, {'no': 621030665, 'now': '12/13/22(Tue)07:01:55', 'name': 'Anonymous', 'com': '<a href=""#p621018943"" class=""quotelink"">&gt;&gt;621018943</a><br>Are they any good? Can’t be worse than the n64 games', 'time': 1670932915, 'resto': 621015883}, {'no': 621030757, 'now': '12/13/22(Tue)07:03:48', 'name': 'Anonymous', 'com': '<a href=""#p621015968"" class=""quotelink"">&gt;&gt;621015968</a><br>1 and 4 are worth playing.', 'time': 1670933028, 'resto': 621015883}, {'no': 621030813, 'now': '12/13/22(Tue)07:04:57', 'name': 'Anonymous', 'com': 'desu while I love the series overall, if I look at any one game I can&#039;t help but think it comes off as a mixed bag.<br><span class=""quote"">&gt;1 is a slow 1986 game</span><br><span class=""quote"">&gt;2</span><br><span class=""quote"">&gt;3 is that level the game</span><br><span class=""quote"">&gt;IV soft and sometimes barren enemy design with difficulty spikes mainly from awkward platforming gimmicks</span><br><span class=""quote"">&gt;rondo richter kind of controls like ass and it invests too much in being an inconveniently structured symphony prototype</span><br><span class=""quote"">&gt;bloodlines too many techdemo golem and suit of armor bosses that are boring to look at and kind of boring to fight, like CVIV the challenge is too reliant on gimmick platforming instead of bread n butter enemy stage design.</span>', 'time': 1670933097, 'resto': 621015883}, {'no': 621031036, 'now': '12/13/22(Tue)07:09:27', 'name': 'Anonymous', 'com': 'Symphony of the Night in Dracula X Chronicles adds in Maria from the Saturn version. But not the areas. Why?', 'time': 1670933367, 'resto': 621015883}]",1670933367,,Castlevania Thread,
98,620990881,12/12/22(Mon)20:43:42,Anonymous,"Play any good h-games lately, /v/?",experience,.png,1024,768,250,187,1670895822674968,1670895822,rAjoI3+IMmGd8s3YKDYt+A==,567248,0,0,0,play-any-good-hgames-lately-v,1,276,65,271.0,65.0,"[{'no': 621030164, 'now': '12/13/22(Tue)06:52:27', 'name': 'Anonymous', 'com': '<a href=""#p621006304"" class=""quotelink"">&gt;&gt;621006304</a><br><span class=""quote"">&gt;linking to the webring</span><br>You dumb motherfucker, you absolute pavement-ape, you quilsing, you sissy nonce!', 'time': 1670932347, 'resto': 620990881}, {'no': 621030368, 'now': '12/13/22(Tue)06:56:25', 'name': 'Anonymous', 'com': '<a href=""#p621029158"" class=""quotelink"">&gt;&gt;621029158</a><br>Well like I said earlier, there was Mission Mermaiden, though that&#039;s not especially obscure honestly, that gives being hypnotized a mechanical effect(occasionally when trying to resist being molested, you&#039;ll fall into a trance and stop resisting for a few seconds). <br>Also one later level has healing chairs that freely heal you. One is trapped and brainwashes you to be addicted to them, and going into the level boss while still addicted is an auto game over when the boss pulls up a chair when you enter the arena and you immediately surrender to her to use the chair more.', 'time': 1670932585, 'resto': 620990881}, {'no': 621030804, 'now': '12/13/22(Tue)07:04:45', 'name': 'Anonymous', 'com': '<a href=""#p620990881"" class=""quotelink"">&gt;&gt;620990881</a><br>Yeah, Skyrim.', 'time': 1670933085, 'resto': 620990881}, {'no': 621030970, 'now': '12/13/22(Tue)07:08:03', 'name': 'Anonymous', 'com': '<a href=""#p620990881"" class=""quotelink"">&gt;&gt;620990881</a><br>Sauce?', 'time': 1670933283, 'resto': 620990881}, {'no': 621031032, 'now': '12/13/22(Tue)07:09:21', 'name': 'Anonymous', 'com': '<a href=""#p620994709"" class=""quotelink"">&gt;&gt;620994709</a><br>I said, with a posed look.', 'time': 1670933361, 'resto': 620990881}]",1670933361,,,
99,621024995,12/13/22(Tue)05:11:48,Anonymous,"wake up anon, its Christmas 1997 in Manhattan and some bitch named EVE is turning everyone into goo and killing everyone. apparently the mitochondria has something to do with this shit.<br>now go and take care of it before the public finds out and I get demoted!",8ee150f2476efc362dc686e432412274,.jpg,1280,720,250,140,1670926308849865,1670926308,UB0q7czHUdG5ElLCDPABhQ==,107186,0,0,0,parasite-eve,1,21,2,16.0,1.0,"[{'no': 621030427, 'now': '12/13/22(Tue)06:57:29', 'name': 'Anonymous', 'com': '<a href=""#p621028773"" class=""quotelink"">&gt;&gt;621028773</a><br>They don&#039;t own &quot;Parasite Eve&quot; anymore because the book author threw a hissy fit. That&#039;s why the 3rd game was called &quot;3rd Birthday&quot;', 'time': 1670932649, 'resto': 621024995}, {'no': 621030489, 'now': '12/13/22(Tue)06:58:30', 'name': 'Anonymous', 'com': '<a href=""#p621030427"" class=""quotelink"">&gt;&gt;621030427</a><br>The original is best. 3rd birthday was a waste', 'time': 1670932710, 'resto': 621024995}, {'no': 621030639, 'now': '12/13/22(Tue)07:01:11', 'name': 'Anonymous', 'com': '<a href=""#p621030489"" class=""quotelink"">&gt;&gt;621030489</a><br><span class=""quote"">&gt;3rd birthday was a waste</span><br>It wasn&#039;t all a waste.', 'filename': '3rdBOutfits', 'ext': '.jpg', 'w': 903, 'h': 503, 'tn_w': 125, 'tn_h': 69, 'tim': 1670932871374789, 'time': 1670932871, 'md5': 'b8SgScPc1DVbFslUkXXbDw==', 'fsize': 153208, 'resto': 621024995}, {'no': 621030973, 'now': '12/13/22(Tue)07:08:04', 'name': 'Anonymous', 'com': '<a href=""#p621028428"" class=""quotelink"">&gt;&gt;621028428</a><br>I hit cancel when I had the chance to name 2 pieces of equipment and immediately saved on the phone. Only later did I find out what it was for.<br>Never did NG+ because of it.', 'time': 1670933284, 'resto': 621024995}, {'no': 621031031, 'now': '12/13/22(Tue)07:09:19', 'name': 'Anonymous', 'com': 'How do you play this without emulating now? Do I have to literally drag my PS3 or PS1 out of the attic to play it? I would honestly buy a Remake/Remaster but I don&#039;t trust current Square to do it.', 'time': 1670933359, 'resto': 621024995}]",1670933359,1.0,Parasite Eve,
100,621004306,12/12/22(Mon)23:34:15,Anonymous,this is literally the pinnacle of gaming why don&#039;t you have one?,1059491[1],.jpg,824,494,249,149,1670906055957793,1670906055,bFzMrF5eOQ2wvJXHy8Ufuw==,54906,0,0,0,this-is-literally-the-pinnacle-of-gaming-why-dont,1,204,29,199.0,29.0,"[{'no': 621028745, 'now': '12/13/22(Tue)06:24:41', 'name': 'Anonymous', 'com': '<a href=""#p621007674"" class=""quotelink"">&gt;&gt;621007674</a><br>You shouldn&#039;t have bought a second hand graphics card.', 'time': 1670930681, 'resto': 621004306}, {'no': 621028948, 'now': '12/13/22(Tue)06:28:34', 'name': 'Anonymous', 'com': '<a href=""#p621025963"" class=""quotelink"">&gt;&gt;621025963</a><br>league of legends', 'time': 1670930914, 'resto': 621004306}, {'no': 621028992, 'now': '12/13/22(Tue)06:29:16', 'name': 'Anonymous', 'com': '<a href=""#p621007674"" class=""quotelink"">&gt;&gt;621007674</a><br>Go AMD. They&#039;re more reliable.', 'time': 1670930956, 'resto': 621004306}, {'no': 621029286, 'now': '12/13/22(Tue)06:34:30', 'name': 'Anonymous', 'com': '<a href=""#p621013561"" class=""quotelink"">&gt;&gt;621013561</a><br>no but rtx remix lets you add ray tracing to just about any dx8 or 9 game<br>there&#039;s screenshots of people using raytracing in max payne and swat even though the public doesn&#039;t have access to rtx remix tools yet', 'time': 1670931270, 'resto': 621004306}, {'no': 621031028, 'now': '12/13/22(Tue)07:09:17', 'name': 'Anonymous', 'com': '<a href=""#p621029286"" class=""quotelink"">&gt;&gt;621029286</a><br><span class=""quote"">&gt;or 9</span><br>nope<br>just DX8 from what I hear<br>God I wish it was DX9, I want to see how RTX Remix looks on a game called ECHO by ultra ultra', 'time': 1670933357, 'resto': 621004306}]",1670933357,,,
101,621028943,12/13/22(Tue)06:28:28,Anonymous,Did he actually predict the Covid pandemic with Death Stranding?,1608440031127,.jpg,587,600,244,250,1670930908408574,1670930908,cQCfvR5GysTqd/cq3EyyBA==,48062,0,0,0,did-he-actually-predict-the-covid-pandemic-with,1,16,1,11.0,1.0,"[{'no': 621030861, 'now': '12/13/22(Tue)07:06:01', 'name': 'Anonymous', 'com': 'Kojamba&#039;s genius surpasses that of every human being that lived, lives, will live.', 'time': 1670933161, 'resto': 621028943}, {'no': 621030892, 'now': '12/13/22(Tue)07:06:41', 'name': 'Anonymous', 'com': '/v/ hates kojima because he scares them', 'time': 1670933201, 'resto': 621028943}, {'no': 621030946, 'now': '12/13/22(Tue)07:07:39', 'name': 'Anonymous', 'com': '<a href=""#p621029101"" class=""quotelink"">&gt;&gt;621029101</a><br>elites told me your moms a whore and your dad gets fucked by niggers', 'time': 1670933259, 'resto': 621028943}, {'no': 621030961, 'now': '12/13/22(Tue)07:07:52', 'name': 'Anonymous', 'com': '<a href=""#p621028943"" class=""quotelink"">&gt;&gt;621028943</a><br>No, he&#039;s just got a generally good sense of how humans behave. DS2 will be broadly about schizos and /pol/ will seethe.', 'time': 1670933272, 'resto': 621028943}, {'no': 621031027, 'now': '12/13/22(Tue)07:09:16', 'name': 'Anonymous', 'com': 'DS2 will underperform.', 'time': 1670933356, 'resto': 621028943}]",1670933356,,,
102,621029867,12/13/22(Tue)06:46:08,Anonymous,Anyone who likes Waluigi should be euthanised. That is all.,1200px-SuperMarioParty_Waluigi[1],.png,1200,1713,175,249,1670931968319078,1670931968,fjWEazgFmxS+iPp4WeKRDQ==,1525924,0,0,0,anyone-who-likes-waluigi-should-be-euthanised,1,6,1,1.0,0.0,"[{'no': 621030000, 'now': '12/13/22(Tue)06:49:05', 'name': 'Anonymous', 'com': '<a href=""#p621029867"" class=""quotelink"">&gt;&gt;621029867</a><br>*doesnt', 'time': 1670932145, 'resto': 621029867}, {'no': 621030103, 'now': '12/13/22(Tue)06:51:12', 'name': 'Anonymous', 'com': '<a href=""#p621029867"" class=""quotelink"">&gt;&gt;621029867</a><br><span class=""quote"">&gt;grown ass &quot;man&quot; wishes death to a fictional character from a children&#039;s video game</span><br>Why are Nintroondo fans like this?', 'time': 1670932272, 'resto': 621029867}, {'no': 621030667, 'now': '12/13/22(Tue)07:01:56', 'name': 'Anonymous', 'com': '<a href=""#p621030103"" class=""quotelink"">&gt;&gt;621030103</a><br><span class=""quote"">&gt;Can&#039;t even read</span><br>Shocker', 'time': 1670932916, 'resto': 621029867}, {'no': 621030856, 'now': '12/13/22(Tue)07:05:54', 'name': 'Anonymous', 'com': '<a href=""#p621030103"" class=""quotelink"">&gt;&gt;621030103</a>', 'filename': '1640162613546', 'ext': '.jpg', 'w': 927, 'h': 927, 'tn_w': 125, 'tn_h': 125, 'tim': 1670933154286791, 'time': 1670933154, 'md5': 'uO2ZWcluEbu0dTpcV/D4yg==', 'fsize': 104596, 'resto': 621029867}, {'no': 621031017, 'now': '12/13/22(Tue)07:08:57', 'name': 'Anonymous', 'com': '<a href=""#p621029867"" class=""quotelink"">&gt;&gt;621029867</a><br>Okay tranime sword character #1000000', 'time': 1670933337, 'resto': 621029867}]",1670933337,1.0,,
103,621025207,12/13/22(Tue)05:16:15,Anonymous,,JamieMayer,.jpg,500,697,179,250,1670926575062947,1670926575,cg4dSVvtwbCf2epEBf4xgg==,68792,0,0,0,heres-your-spiderman-2-writer-bro,1,15,1,10.0,0.0,"[{'no': 621026056, 'now': '12/13/22(Tue)05:33:38', 'name': 'Anonymous', 'com': '<a href=""#p621025279"" class=""quotelink"">&gt;&gt;621025279</a><br>Indeed, really horrible garments. When it dawns on you you realise how unkempt so many people look, I stopped wearing jeans in about 2010 (outside of dirty work) and switched to chinos/types of trousers of that ilk. More comfortable, more choice, much more aesthetic just overall superior.', 'time': 1670927618, 'resto': 621025207}, {'no': 621026086, 'now': '12/13/22(Tue)05:34:28', 'name': 'Anonymous', 'com': '<a href=""#p621025207"" class=""quotelink"">&gt;&gt;621025207</a><br>Who dat? Do she do porn?', 'filename': '1659905352294250', 'ext': '.gif', 'w': 400, 'h': 224, 'tn_w': 125, 'tn_h': 70, 'tim': 1670927668593076, 'time': 1670927668, 'md5': 'VnYWT590ye7mTlTObuMOBw==', 'fsize': 843372, 'resto': 621025207}, {'no': 621028928, 'now': '12/13/22(Tue)06:28:13', 'name': 'Anonymous', 'com': '<a href=""#p621025207"" class=""quotelink"">&gt;&gt;621025207</a><br>Okay... Is she a good writer? That&#039;s what matters, right guys?', 'time': 1670930893, 'resto': 621025207}, {'no': 621031012, 'now': '12/13/22(Tue)07:08:53', 'name': 'Anonymous', 'com': '<a href=""#p621025207"" class=""quotelink"">&gt;&gt;621025207</a><br>She looks cute and fairly well-adjusted. What&#039;s the issue, OP?', 'time': 1670933333, 'resto': 621025207}, {'no': 621031245, 'now': '12/13/22(Tue)07:13:31', 'name': 'Anonymous', 'com': '<a href=""#p621025279"" class=""quotelink"">&gt;&gt;621025279</a><br>They&#039;re better than cargo shorts, chudcel.', 'time': 1670933611, 'resto': 621025207}]",1670933611,,Here&#039;s your Spider-Man 2 writer bro,
104,621024370,12/13/22(Tue)04:59:28,Anonymous,"What&#039;s the appeal of this game? I pirated it to try it out, and it just seemed like a standard bullet hell.",Vampire Survivors,.jpg,2560,1467,250,143,1670925568341709,1670925568,4fhg2gtOB3b+XIGkkrO4Iw==,444420,0,0,0,whats-the-appeal-of-this-game-i-pirated-it-to-try,1,15,3,10.0,2.0,"[{'no': 621026515, 'now': '12/13/22(Tue)05:42:25', 'name': 'Anonymous', 'com': '<a href=""#p621024370"" class=""quotelink"">&gt;&gt;621024370</a><br>It&#039;s fun for a little while, as it still is a little bit challenging, but once you figure out what to do you unlock stuff left and right and each run starts to feel like the same mush and it becomes more of a chore quickly. <br><br>In the end it&#039;s pretty much a mobile game you boot up while stuck at the shitter. Can be fun in short bursts, but is too simple to stay intersting', 'time': 1670928145, 'resto': 621024370}, {'no': 621027180, 'now': '12/13/22(Tue)05:54:56', 'name': 'Anonymous', 'com': '<a href=""#p621024370"" class=""quotelink"">&gt;&gt;621024370</a><br>Guy used to program slot machine software. It&#039;s intentionally designed to be a constant drip feed of dopamine like a casino, just without the losing money part.', 'time': 1670928896, 'resto': 621024370}, {'no': 621027548, 'now': '12/13/22(Tue)06:02:01', 'name': 'Anonymous', 'com': '<a href=""#p621024370"" class=""quotelink"">&gt;&gt;621024370</a><br>Honestly, its just normie-tier bullet hell. Its starts easy and you get fun upgrades, also its rougelike so you just start over again if youre shit. Nothing special but it was fun for a couple days.', 'filename': '1458100485116', 'ext': '.jpg', 'w': 640, 'h': 1136, 'tn_w': 70, 'tn_h': 125, 'tim': 1670929321920835, 'time': 1670929321, 'md5': 'sQHDx7NPvfMI/FHtIu/wFA==', 'fsize': 114845, 'resto': 621024370, 'm_img': 1}, {'no': 621027782, 'now': '12/13/22(Tue)06:06:45', 'name': 'Anonymous', 'com': '<a href=""#p621026068"" class=""quotelink"">&gt;&gt;621026068</a><br>I looked up some gameplay of Soulstone Survivors, but it was a VFX clusterfuck. So I wondered if maybe the original VS looks cleaner since it&#039;s 2D. But doesn&#039;t seem like it&#039;s the case. Honestly, so far only HoloCure manages to retain at least some visual clarity in the endgame.', 'time': 1670929605, 'resto': 621024370}, {'no': 621031009, 'now': '12/13/22(Tue)07:08:52', 'name': 'Anonymous', 'com': '<a href=""#p621024568"" class=""quotelink"">&gt;&gt;621024568</a><br>walking simulator.', 'time': 1670933332, 'resto': 621024370}]",1670933332,1.0,,
105,621031007,12/13/22(Tue)07:08:47,Anonymous,Why aren&#039;t there more Bronze Age vidya?,UneticeAryans,.jpg,563,619,227,249,1670933327247136,1670933327,cyZVxytI4AbrHm293Q7sdQ==,100456,0,0,0,why-arent-there-more-bronze-age-vidya,1,0,0,,,,1670933327,,,
