,no,now,name,com,filename,ext,w,h,tn_w,tn_h,tim,time,md5,fsize,resto,m_img,bumplimit,imagelimit,semantic_url,custom_spoiler,replies,images,omitted_posts,omitted_images,last_replies,last_modified,sub,trip,filedeleted
135,620694842,12/10/22(Sat)06:57:23,Anonymous,what are some games where you can be a massive loser?,FiAQjGPXgAE7Urk,.jpg,1080.0,1895.0,142.0,250.0,1670673443787089.0,1670673443,1wQAav5w5/BdyhoIgWvJ+g==,215859.0,0,1.0,0,0,what-are-some-games-where-you-can-be-a-massive,1,8,1,3.0,0.0,"[{'no': 620695349, 'now': '12/10/22(Sat)07:06:47', 'name': 'Anonymous', 'com': '<a href=""#p620695235"" class=""quotelink"">&gt;&gt;620695235</a><br>based and starve ytboi pill', 'time': 1670674007, 'resto': 620694842}, {'no': 620695412, 'now': '12/10/22(Sat)07:07:51', 'name': 'Anonymous', 'com': '<a href=""#p620694842"" class=""quotelink"">&gt;&gt;620694842</a><br>tl;dr<br><br>sauce?', 'time': 1670674071, 'resto': 620694842}, {'no': 620695434, 'now': '12/10/22(Sat)07:08:15', 'name': 'Anonymous', 'com': '<a href=""#p620695412"" class=""quotelink"">&gt;&gt;620695412</a><br>for the edit or the pic?', 'time': 1670674095, 'resto': 620694842}, {'no': 620695586, 'now': '12/10/22(Sat)07:11:05', 'name': 'Anonymous', 'com': 'My hotwife', 'time': 1670674265, 'resto': 620694842}, {'no': 620695618, 'now': '12/10/22(Sat)07:11:33', 'name': 'Anonymous', 'com': '<a href=""#p620695586"" class=""quotelink"">&gt;&gt;620695586</a><br>our hotwife*', 'filename': 'FejrhHOXEAASNXu', 'ext': '.jpg', 'w': 1080, 'h': 1350, 'tn_w': 100, 'tn_h': 125, 'tim': 1670674293609115, 'time': 1670674293, 'md5': 'je0MAvAOvcUUQZtRXDWcJA==', 'fsize': 188726, 'resto': 620694842, 'm_img': 1}]",1670674293,,,
136,620645872,12/09/22(Fri)19:30:55,Anonymous,Are they the best zombies in gaming?,Slasherimage,.png,1006.0,879.0,250.0,218.0,1670632255776671.0,1670632255,8aDH0AwVKXdqiUtI4+o+lQ==,883613.0,0,,0,0,are-they-the-best-zombies-in-gaming,1,319,55,314.0,53.0,"[{'no': 620694375, 'now': '12/10/22(Sat)06:49:50', 'name': 'Anonymous', 'com': '<a href=""#p620652303"" class=""quotelink"">&gt;&gt;620652303</a><br>Why do you type like that... Like a redditor?', 'time': 1670672990, 'resto': 620645872}, {'no': 620694598, 'now': '12/10/22(Sat)06:53:26', 'name': 'Anonymous', 'com': '<a href=""#p620694375"" class=""quotelink"">&gt;&gt;620694375</a><br>Why do you know...how a Redditor types??', 'time': 1670673206, 'resto': 620645872}, {'no': 620694641, 'now': '12/10/22(Sat)06:54:11', 'name': 'Anonymous', 'com': '<span class=""quote"">&gt;I was only 19 years old</span><br><span class=""quote"">&gt;I followed Unitology so faithfully, I had scrawled their teachings and glyphs on the walls of my cell</span><br><span class=""quote"">&gt;I pray to the Marker every night before rest, thanking him for the change I&#039;ve been promised</span><br><span class=""quote"">&gt;&quot;Unitology is love&quot; I say. &quot;Unitology is life&quot;</span><br><span class=""quote"">&gt;My doctor charges in and declares me a &#039;lunatic&#039;</span><br><span class=""quote"">&gt;Taken aback by this, I scoff and decry him an infidel</span><br><span class=""quote"">&gt;He sedates me and I go unconscious</span><br><span class=""quote"">&gt;I awake now, and my body is aching</span><br><span class=""quote"">&gt;Its as cold as always and my writings seem to have been washed off</span><br><span class=""quote"">&gt;Before I could whine in anguish, I feel a divine presence approach me</span><br><span class=""quote"">&gt;I turn</span><br><span class=""quote"">&gt;Its an angel of the Marker! I was never more happy in my life</span><br><span class=""quote"">&gt;It appeared less &#039;angel-like&#039; than it did in the official illustrations, but nothing was fooling me</span><br><span class=""quote"">&gt;It lowers its headless gaze toward mine and whispers &quot;gRRlkk thKKK rLKeKk&quot;</span><br><span class=""quote"">&gt;An intestine-like appendage shot forward from its open chest, rappelling me toward it as it grabbed me with powerful wing-like arms, holding me in the air</span><br><span class=""quote"">&gt;I&#039;m ready</span><br><span class=""quote"">&gt;A jointed limb sprouts from its body</span><br><span class=""quote"">&gt;It penetrates into my forehead</span><br><span class=""quote"">&gt;The pain should be unbearable, but I do it for the Marker.</span><br><span class=""quote"">&gt;I can feel new limbs tearing forth from my abdomen as my current arms lengthen</span><br><span class=""quote"">&gt;Spikes burst out of my palms</span><br><span class=""quote"">&gt;I hope I&#039;ve pleased the Marker</span><br><span class=""quote"">&gt;I let out a beautiful choir with my freed vocal chords as the angel drops me</span><br><span class=""quote"">&gt;My doctor walks in, shocked at the angel and my new body</span><br><span class=""quote"">&gt;It turns to him and shrieks &quot;REEAKKLHTHTH&quot;</span><br><span class=""quote"">&gt;The angel leaves through the vent as I tear into the doctor</span><br><br>Unitology is love, Unitology is life.', 'filename': 'Infector_normal', 'ext': '.png', 'w': 1216, 'h': 1080, 'tn_w': 124, 'tn_h': 111, 'tim': 1670673251703408, 'time': 1670673251, 'md5': 'w1FWJsva0ExBtPHSnC5q9Q==', 'fsize': 1372279, 'resto': 620645872, 'm_img': 1}, {'no': 620694651, 'now': '12/10/22(Sat)06:54:22', 'name': 'Anonymous', 'com': '<a href=""#p620656810"" class=""quotelink"">&gt;&gt;620656810</a><br><a href=""#p620685354"" class=""quotelink"">&gt;&gt;620685354</a><br><span class=""quote"">&gt;bodypart glows with unnatural color</span><br>god i hate this.<br>It feels so cartoon-ish', 'time': 1670673262, 'resto': 620645872}, {'no': 620694835, 'now': '12/10/22(Sat)06:57:12', 'name': 'Anonymous', 'com': '<a href=""#p620693390"" class=""quotelink"">&gt;&gt;620693390</a><br><span class=""quote"">&gt;What do they do in terms of gameplay that sets them apart?</span><br>The fact that you can&#039;t kill them by shooting them in the head or torso and you need to rip them apart to kill them is pretty big <br><span class=""quote"">&gt;They just run at you screaming and then hit or grab you.</span><br>Not different types of necros work in different ways <br>spitters shoot spit at you that will either hurt you or slow you to a crawl as they mostly attack from afar <br>Luckers hang on walls and celling&#039;s shooting at you with projectiles <br>Stalkers hide around corners and try to flank you and attack you <br>Exploders try to get close and explode on you of course <br>The pack attack in numbers <br>Pregnant necros spawn enemies if you shot in the belly <br>Dividers turn into multiple smaller enemies when damaged <br><br>I could go on but Necromorphs are more than just enemies that rush at you to try to kill you. that mostly applies to slashers and leapers and those are the basic enemy types', 'filename': 'FW7_f-RWYAErWp9', 'ext': '.jpg', 'w': 1000, 'h': 648, 'tn_w': 125, 'tn_h': 81, 'tim': 1670673432059481, 'time': 1670673432, 'md5': 'gWhVy6anwEtz/MpbJgWCNQ==', 'fsize': 82007, 'resto': 620645872}]",1670673432,,,
137,620659278,12/09/22(Fri)21:43:31,Anonymous,Why are you not playing Genshin /v/?<br><br>You&#039;re missing the GOTY,1665990728571,.png,1129.0,1111.0,250.0,246.0,1670640211200415.0,1670640211,pLTZV8vlXyOiJN5h18SoVg==,1892074.0,0,1.0,0,0,why-are-you-not-playing-genshin-v,1,255,63,250.0,63.0,"[{'no': 620692964, 'now': '12/10/22(Sat)06:23:10', 'name': 'Anonymous', 'com': 'What did you name your &#039;mouche?', 'time': 1670671390, 'resto': 620659278}, {'no': 620693131, 'now': '12/10/22(Sat)06:26:09', 'name': 'Anonymous', 'com': '<a href=""#p620692964"" class=""quotelink"">&gt;&gt;620692964</a><br>pinocchio', 'time': 1670671569, 'resto': 620659278}, {'no': 620693176, 'now': '12/10/22(Sat)06:26:59', 'name': 'Anonymous', 'com': '<a href=""#p620692314"" class=""quotelink"">&gt;&gt;620692314</a><br>Most characters aren&#039;t designed to be on-field attackers so their weapon largely does not matter.', 'time': 1670671619, 'resto': 620659278}, {'no': 620693831, 'now': '12/10/22(Sat)06:38:43', 'name': 'Anonymous', 'com': '<a href=""#p620692589"" class=""quotelink"">&gt;&gt;620692589</a><br><span class=""quote"">&gt;bp</span><br><span class=""quote"">&gt;tf2</span><br>what games are these?', 'time': 1670672323, 'resto': 620659278}, {'no': 620694821, 'now': '12/10/22(Sat)06:57:02', 'name': 'Anonymous', 'com': '<a href=""#p620692314"" class=""quotelink"">&gt;&gt;620692314</a><br>Yaoyao and Xiangling both learn martial arts from Madame Ping and all 3 of them use polearms', 'time': 1670673422, 'resto': 620659278}]",1670673422,,,
138,620602121,12/09/22(Fri)11:30:05,Anonymous,how can fallout 4 even compete?,uncle,.jpg,1280.0,1707.0,187.0,250.0,1670603405864166.0,1670603405,ZGyBxnT0gl28O6/zuhhyYw==,192706.0,0,1.0,0,0,how-can-fallout-4-even-compete,1,303,82,298.0,80.0,"[{'no': 620691394, 'now': '12/10/22(Sat)05:56:27', 'name': 'Anonymous', 'com': '<a href=""#p620656715"" class=""quotelink"">&gt;&gt;620656715</a><br><span class=""quote"">&gt;no way to escape</span><br>b-bros?!...', 'time': 1670669787, 'resto': 620602121}, {'no': 620691462, 'now': '12/10/22(Sat)05:57:27', 'name': 'Anonymous', 'com': '<a href=""#p620665512"" class=""quotelink"">&gt;&gt;620665512</a><br>Because clear glass doors puzzle, confuse and enrage Americans.', 'filename': '1660790271353514', 'ext': '.png', 'w': 1000, 'h': 1816, 'tn_w': 68, 'tn_h': 124, 'tim': 1670669847444672, 'time': 1670669847, 'md5': 'CrPCOVakhFzHaxTNayQtpg==', 'fsize': 1614921, 'resto': 620602121, 'm_img': 1}, {'no': 620691893, 'now': '12/10/22(Sat)06:04:26', 'name': 'Anonymous', 'com': '<a href=""#p620672161"" class=""quotelink"">&gt;&gt;620672161</a><br>Stop being such elitist faggot<br>all robots sexy', 'filename': 'file', 'ext': '.png', 'w': 2000, 'h': 1754, 'tn_w': 125, 'tn_h': 109, 'tim': 1670670266178957, 'time': 1670670266, 'md5': 'g07j99C1RH9hBITMJXC3eQ==', 'fsize': 938034, 'resto': 620602121, 'm_img': 1}, {'no': 620694604, 'now': '12/10/22(Sat)06:53:29', 'name': 'Anonymous', 'com': '<a href=""#p620674469"" class=""quotelink"">&gt;&gt;620674469</a><br>Thanks for ruining my day anon. Mavis :&#039;(', 'time': 1670673209, 'resto': 620602121}, {'no': 620694806, 'now': '12/10/22(Sat)06:56:53', 'name': 'Anonymous', 'com': '<a href=""#p620602121"" class=""quotelink"">&gt;&gt;620602121</a><br><span class=""quote"">&gt;inb4 the game turns out to be shit</span><br>At least we have new robot waifu I guess.', 'time': 1670673413, 'resto': 620602121}]",1670673413,,,
139,620694605,12/10/22(Sat)06:53:32,Anonymous,What if Fiona was in Village?,__alcina_dimitrescu_fiona_belli_and_daniela_dimitrescu_resident_evil_and_3_more_drawn_by_alex_ahad__f017364c347a47022e941084b9ec08f2,.png,1000.0,1185.0,210.0,250.0,1670673212137069.0,1670673212,8Bc2TDR6RwIulBCEuewI8g==,467133.0,0,,0,0,what-if-fiona-was-in-village,1,1,0,,,"[{'no': 620694764, 'now': '12/10/22(Sat)06:56:13', 'name': 'Anonymous', 'com': 'Damn Alex Ahad&#039;s still alive?', 'time': 1670673373, 'resto': 620694605}]",1670673373,,,
140,620693898,12/10/22(Sat)06:40:08,Anonymous,"<span class=""quote"">&gt;dude, that ellie girl...</span>",image (8),.png,286.0,159.0,250.0,138.0,1670672408575736.0,1670672408,LjRyzUUVbZnlTyoN/OUvvA==,98668.0,0,,0,0,dude-that-ellie-girl,1,5,3,,,"[{'no': 620694145, 'now': '12/10/22(Sat)06:44:59', 'name': 'Anonymous', 'com': '<span class=""deadlink"">&gt;&gt;620694041</span><br>mizkids have no one else now mizkif only appeals to 12 year old W niggers', 'time': 1670672699, 'resto': 620693898}, {'no': 620694162, 'now': '12/10/22(Sat)06:45:29', 'name': 'Anonymous', 'filename': 'emoney', 'ext': '.jpg', 'w': 880, 'h': 1315, 'tn_w': 83, 'tn_h': 124, 'tim': 1670672729940015, 'time': 1670672729, 'md5': 'zywEccq0KwhngeTMwJ8lDQ==', 'fsize': 140426, 'resto': 620693898, 'm_img': 1}, {'no': 620694196, 'now': '12/10/22(Sat)06:46:00', 'name': 'Anonymous', 'com': 'ya smell me', 'time': 1670672760, 'resto': 620693898}, {'no': 620694654, 'now': '12/10/22(Sat)06:54:25', 'name': 'Anonymous', 'com': '<a href=""#p620693898"" class=""quotelink"">&gt;&gt;620693898</a><br>Imagine growing up and finding out your mother ate rabbit poop in front of thousands of people and your fathers legacy is some weird ass quote about that ellie girl', 'filename': '1669294641286335m', 'ext': '.jpg', 'w': 1024, 'h': 700, 'tn_w': 125, 'tn_h': 85, 'tim': 1670673265069503, 'time': 1670673265, 'md5': 'tHfKv7KcFSrI3SnNirZYSA==', 'fsize': 76707, 'resto': 620693898}, {'no': 620694761, 'now': '12/10/22(Sat)06:56:10', 'name': 'Anonymous', 'com': '*blocks your path*', 'filename': '1664820139685', 'ext': '.png', 'w': 1095, 'h': 958, 'tn_w': 125, 'tn_h': 109, 'tim': 1670673370386389, 'time': 1670673370, 'md5': '+QJR7LSOuCZ4tQg/z34OuQ==', 'fsize': 1852505, 'resto': 620693898, 'm_img': 1}]",1670673370,,,
141,620648092,12/09/22(Fri)19:52:09,Anonymous,Jimi Henrix,1670457380468460,.jpg,538.0,900.0,149.0,250.0,1670633529272213.0,1670633529,/TWGdDPokBTpIBbb3pUrmg==,331717.0,0,,1,0,warhammer-40k-rogue-trader,1,503,51,498.0,51.0,"[{'no': 620694749, 'now': '12/10/22(Sat)06:56:00', 'name': 'Anonymous', 'com': '<a href=""#p620694615"" class=""quotelink"">&gt;&gt;620694615</a><br>oh...so not too much', 'time': 1670673360, 'resto': 620648092}, {'no': 620694830, 'now': '12/10/22(Sat)06:57:09', 'name': 'Anonymous', 'com': '<a href=""#p620694615"" class=""quotelink"">&gt;&gt;620694615</a><br>There might more stuff hidden in the Russian json, but I don&#039;t comprehend Black Speech, so I won&#039;t be much help.', 'time': 1670673429, 'resto': 620648092}, {'no': 620694939, 'now': '12/10/22(Sat)06:59:08', 'name': 'Anonymous', 'com': '<a href=""#p620694521"" class=""quotelink"">&gt;&gt;620694521</a><br>mon-keigh not monkey<br>Mon-keigh was some kind of canniballistic creatures<br><br>Ok, it not mean much for self respected coomer but still', 'time': 1670673548, 'resto': 620648092}, {'no': 620695253, 'now': '12/10/22(Sat)07:05:00', 'name': 'Anonymous', 'com': '<a href=""#p620694939"" class=""quotelink"">&gt;&gt;620694939</a><br>Say it out loud.', 'time': 1670673900, 'resto': 620648092}, {'no': 620695554, 'now': '12/10/22(Sat)07:10:28', 'name': 'Anonymous', 'com': '<a href=""#p620695253"" class=""quotelink"">&gt;&gt;620695253</a><br>Ok, but I mean way of writing', 'time': 1670674228, 'resto': 620648092}]",1670674228,Warhammer 40k: Rogue Trader,,
142,620694713,12/10/22(Sat)06:55:13,Anonymous,"<span class=""quote"">&gt;indie game</span><br><span class=""quote"">&gt;early access</span><br><span class=""quote"">&gt;turn-based combat</span><br><span class=""quote"">&gt;??</span>",KnXqhCP,.png,1920.0,1080.0,250.0,140.0,1670673313691968.0,1670673313,uyU1IwS4DhloGmRlOd8Zow==,3136724.0,0,1.0,0,0,indie-game,1,0,0,,,,1670673313,,,
143,620689415,12/10/22(Sat)05:20:16,Anonymous,Thoughts on Fire Emblem&#039;s newest character?,1670576287728457,.png,1149.0,707.0,250.0,153.0,1670667616028266.0,1670667616,KXZk0Ai21UmFqnf+0XDsEw==,751711.0,0,1.0,0,0,thoughts-on-fire-emblems-newest-character,1,19,2,14.0,1.0,"[{'no': 620693609, 'now': '12/10/22(Sat)06:34:54', 'name': 'Anonymous', 'com': '<a href=""#p620693519"" class=""quotelink"">&gt;&gt;620693519</a><br>Only fags and christkikes have a problem with that.', 'time': 1670672094, 'resto': 620689415}, {'no': 620693673, 'now': '12/10/22(Sat)06:35:50', 'name': 'Anonymous', 'com': '<a href=""#p620693609"" class=""quotelink"">&gt;&gt;620693609</a><br>Being on /v/, it&#039;d be fair to say it could easily be either.', 'time': 1670672150, 'resto': 620689415}, {'no': 620694297, 'now': '12/10/22(Sat)06:48:20', 'name': 'Anonymous', 'com': '<a href=""#p620693425"" class=""quotelink"">&gt;&gt;620693425</a><br>His colour scheme&#039;s white and black, what freakin&#039; flag is that for?', 'time': 1670672900, 'resto': 620689415}, {'no': 620694693, 'now': '12/10/22(Sat)06:55:00', 'name': 'Anonymous', 'com': '<a href=""#p620694297"" class=""quotelink"">&gt;&gt;620694297</a>', 'filename': 'file', 'ext': '.png', 'w': 243, 'h': 152, 'tn_w': 125, 'tn_h': 78, 'tim': 1670673300401351, 'time': 1670673300, 'md5': 'Czooa0qXrD30JVnk1OBEUw==', 'fsize': 36227, 'resto': 620689415}, {'no': 620694803, 'now': '12/10/22(Sat)06:56:47', 'name': 'Anonymous', 'com': '<a href=""#p620693591"" class=""quotelink"">&gt;&gt;620693591</a><br><span class=""quote"">&gt;nice try Rossad</span>', 'time': 1670673407, 'resto': 620689415}]",1670673407,,,
144,620671153,12/10/22(Sat)00:04:19,Anonymous,You think he has proposed to any of the girls he has worked with?,0F39A8C4-D2A2-4FFE-8B6B-F780FFA3D293,.jpg,1374.0,2048.0,167.0,250.0,1670648659509034.0,1670648659,mtKXX1HCb7sYgkzQ2r9anw==,418270.0,0,1.0,0,0,make-games-get-top-quality-pussy,1,62,9,57.0,8.0,"[{'no': 620694295, 'now': '12/10/22(Sat)06:48:18', 'name': 'Anonymous', 'com': 'Why does Lea look like she&#039;s absolutely done with everything?', 'time': 1670672898, 'resto': 620671153}, {'no': 620694385, 'now': '12/10/22(Sat)06:50:02', 'name': 'Anonymous', 'com': '<a href=""#p620691302"" class=""quotelink"">&gt;&gt;620691302</a><br>it just works', 'time': 1670673002, 'resto': 620671153}, {'no': 620694450, 'now': '12/10/22(Sat)06:51:02', 'name': 'Anonymous', 'com': '<a href=""#p620688238"" class=""quotelink"">&gt;&gt;620688238</a><br><span class=""quote"">&gt;No hover hand</span><br>Based', 'time': 1670673062, 'resto': 620671153}, {'no': 620694482, 'now': '12/10/22(Sat)06:51:31', 'name': 'Anonymous', 'com': '<a href=""#p620688238"" class=""quotelink"">&gt;&gt;620688238</a><br>Who dat?', 'time': 1670673091, 'resto': 620671153}, {'no': 620694685, 'now': '12/10/22(Sat)06:54:54', 'name': 'Anonymous', 'com': '<a href=""#p620671153"" class=""quotelink"">&gt;&gt;620671153</a><br>wtf is this', 'filename': 'file', 'ext': '.png', 'w': 107, 'h': 64, 'tn_w': 107, 'tn_h': 64, 'tim': 1670673294706576, 'time': 1670673294, 'md5': 'Du3mefgcDP69al+i7kXFCQ==', 'fsize': 13578, 'resto': 620671153}]",1670673294,Make games. Get top quality pussy,,
145,620686713,12/10/22(Sat)04:26:37,Anonymous,"OK, to get the disclaimer out of the way, these rules are probably applicable in large part to the other Bethesda engine games I know NV is Obsidian, not to mention other videogames too, but NV is where I originally thought these rules up for.<br><br>First things first, character creation. You should aim to be realistic to your IRL self, by which I mean raising intelligence and probably dexterity at the expense of strength, charisma and luck. This is among other things a challenge run, as is good for a beta loser, so resist the urge to minmax. I don’t remember what traits I picked, but the one that requires you to wear glasses is pretty appropriate - you are a nerd, after all. Your perks are not particularly important, but taking Cherchez la Femme or Confirmed Bachelor is strictly prohibited - you’re a reject virgin, remember.<br><br>Now for the more interesting side of things: gameplay rules. These will mostly come into effect when you come into contact with female characters.",Q7O_Ixo4_400x400,.jpg,400.0,400.0,250.0,250.0,1670664397503305.0,1670664397,u2d464RbRpA4GOIG+GAoaw==,36356.0,0,,0,0,a-femdomstyle-fallout-new-vegas-playthrough,1,65,17,60.0,15.0,"[{'no': 620694201, 'now': '12/10/22(Sat)06:46:01', 'name': 'Anonymous', 'com': '<a href=""#p620686713"" class=""quotelink"">&gt;&gt;620686713</a><br><a href=""#p620686734"" class=""quotelink"">&gt;&gt;620686734</a>', 'filename': '1670672760135', 'ext': '.jpg', 'w': 660, 'h': 574, 'tn_w': 125, 'tn_h': 108, 'tim': 1670672761254861, 'time': 1670672761, 'md5': 'lZaDITYztyW6wQGXqaxhLg==', 'fsize': 31598, 'resto': 620686713}, {'no': 620694549, 'now': '12/10/22(Sat)06:52:41', 'name': 'Anonymous', 'com': '<a href=""#p620687329"" class=""quotelink"">&gt;&gt;620687329</a><br>sometime you&#039;re just in a hurry. what else can one do?', 'time': 1670673161, 'resto': 620686713}, {'no': 620694597, 'now': '12/10/22(Sat)06:53:26', 'name': 'Anonymous', 'com': '<a href=""#p620686734"" class=""quotelink"">&gt;&gt;620686734</a><br><span class=""deadlink"">&gt;&gt;2</span>) When you meet a female NPC, you must immediately drop everything and exhaust all of their dialogue options. If they offer you a quest you must forget your current objectives and prioritise it above all else. (If you’re given two quests by women, use your own discretion).<br><span class=""deadlink"">&gt;&gt;4</span>) In general you should choose the most meek and discreet options when talking with a woman, as much as possible.<br><br>I&#039;m sorry anon, but you contradicted yourself.', 'time': 1670673206, 'resto': 620686713}, {'no': 620694643, 'now': '12/10/22(Sat)06:54:13', 'name': 'Anonymous', 'com': '<a href=""#p620694549"" class=""quotelink"">&gt;&gt;620694549</a><br>to die', 'time': 1670673253, 'resto': 620686713}, {'no': 620694667, 'now': '12/10/22(Sat)06:54:36', 'name': 'Anonymous', 'com': '<a href=""#p620686713"" class=""quotelink"">&gt;&gt;620686713</a><br>the absolute state of this board', 'filename': '1460168596551', 'ext': '.jpg', 'w': 419, 'h': 480, 'tn_w': 109, 'tn_h': 125, 'tim': 1670673276543182, 'time': 1670673276, 'md5': 'V/3xd0cqC8+izKUot051oA==', 'fsize': 82824, 'resto': 620686713}]",1670673276,A femdom-style Fallout: New Vegas playthrough,,
146,620686162,12/10/22(Sat)04:16:25,Anonymous,Essex,A0848F76-8F1A-4640-8DCB-2C69DFEAA51F,.png,1622.0,732.0,250.0,112.0,1670663785020882.0,1670663785,UkTSM80AkNUv/bDkhjGfRg==,1820758.0,0,1.0,0,0,essex,1,15,14,10.0,9.0,"[{'no': 620691459, 'now': '12/10/22(Sat)05:57:23', 'name': 'Anonymous', 'com': 'eh?', 'filename': '97288404_p0', 'ext': '.jpg', 'w': 1500, 'h': 2042, 'tn_w': 91, 'tn_h': 125, 'tim': 1670669843876749, 'time': 1670669843, 'md5': 'AC3Bn95zZRglSpqHvMwveQ==', 'fsize': 894211, 'resto': 620686162, 'm_img': 1}, {'no': 620691570, 'now': '12/10/22(Sat)05:59:21', 'name': 'Anonymous', 'com': 'essex issue', 'filename': 'skillsex', 'ext': '.gif', 'w': 600, 'h': 338, 'tn_w': 125, 'tn_h': 70, 'tim': 1670669961389451, 'time': 1670669961, 'md5': '1z+U16/jyNWmqyP7Tf7KQA==', 'fsize': 3933129, 'resto': 620686162}, {'no': 620691798, 'now': '12/10/22(Sat)06:03:02', 'name': 'Anonymous', 'filename': '1670429389571101', 'ext': '.gif', 'w': 500, 'h': 500, 'tn_w': 125, 'tn_h': 125, 'tim': 1670670182496574, 'time': 1670670182, 'md5': 'KVFgGnRudbuHDU947hB6/g==', 'fsize': 118521, 'resto': 620686162}, {'no': 620692145, 'now': '12/10/22(Sat)06:08:39', 'name': 'Anonymous', 'filename': '1664220925183290', 'ext': '.png', 'w': 1058, 'h': 1200, 'tn_w': 110, 'tn_h': 125, 'tim': 1670670519203905, 'time': 1670670519, 'md5': 'V0XwZTF6Ei//eIPoF5OIWw==', 'fsize': 1045859, 'resto': 620686162, 'm_img': 1}, {'no': 620694665, 'now': '12/10/22(Sat)06:54:36', 'name': 'Anonymous', 'filename': 'sex', 'ext': '.png', 'w': 207, 'h': 243, 'tn_w': 106, 'tn_h': 125, 'tim': 1670673276299280, 'time': 1670673276, 'md5': 'cRzxg4DkYzvcOj1H285ODw==', 'fsize': 52612, 'resto': 620686162}]",1670673276,Essex,,
