,no,now,name,com,filename,ext,w,h,tn_w,tn_h,tim,time,md5,fsize,resto,bumplimit,imagelimit,semantic_url,custom_spoiler,replies,images,omitted_posts,omitted_images,last_replies,last_modified,m_img,sub,trip
137,620969371,12/12/22(Mon)17:05:55,Anonymous,Why won&#039;t my Egg VP Teammates stay and protect the Egg Basket?,ebdcdb013f0a227ad2810edfed6d0b8d,.png,1086,756,250,174,1670882755320853,1670882755,UOrqDjzXd97BKjgeSzzQdg==,1641266,0,0,0,splatoon-3,1,390,68,385.0,67.0,"[{'no': 621030329, 'now': '12/13/22(Tue)06:55:46', 'name': 'Anonymous', 'com': '<a href=""#p620978309"" class=""quotelink"">&gt;&gt;620978309</a><br>Depends on the angle (since flingza still kills in one shot if you are close enough) and if your opponent knows you are about to splat them since they will probs try to run away if that&#039;s the case. &#039;Cause of that I usually open with bomb when I&#039;m approaching people from a more frontal path.<br>But desu you&#039;ll probs build a sense for it overtime', 'filename': 'coolsquidwithsunglassesfrompixiv', 'ext': '.png', 'w': 660, 'h': 566, 'tn_w': 125, 'tn_h': 107, 'tim': 1670932546707734, 'time': 1670932546, 'md5': 'c39OwLyNK3/XUOvAz9sD9w==', 'fsize': 222129, 'resto': 620969371}, {'no': 621030402, 'now': '12/13/22(Tue)06:57:07', 'name': 'Anonymous', 'com': '<a href=""#p621023871"" class=""quotelink"">&gt;&gt;621023871</a><br><span class=""quote"">&gt;no way forced to look at.</span><br><span class=""quote"">&gt;literally spawns in your face in hub</span><br><span class=""quote"">&gt;no way to ban certain retards only halfmeasures like remove posts completely or switch to jap region</span>', 'time': 1670932627, 'resto': 620969371}, {'no': 621030453, 'now': '12/13/22(Tue)06:57:57', 'name': 'Anonymous', 'com': '<a href=""#p621030302"" class=""quotelink"">&gt;&gt;621030302</a><br>*silence*', 'time': 1670932677, 'resto': 620969371}, {'no': 621030482, 'now': '12/13/22(Tue)06:58:22', 'name': 'Anonymous', 'com': '<a href=""#p621029610"" class=""quotelink"">&gt;&gt;621029610</a><br>Yes, now imagine the game if no one was overlooking the art team/if it had less members', 'time': 1670932702, 'resto': 620969371}, {'no': 621030524, 'now': '12/13/22(Tue)06:59:01', 'name': 'Anonymous', 'com': '<a href=""#p621030482"" class=""quotelink"">&gt;&gt;621030482</a><br>Seita Inoue would probably turn Splatoon into a porn game<br>You know he wants to with how horny his designs are', 'time': 1670932741, 'resto': 620969371}]",1670932741,1.0,Splatoon 3,
138,621026281,12/13/22(Tue)05:38:07,Anonymous,"<span class=""quote"">&gt;1440p</span><br><span class=""quote"">&gt;500 nits</span><br><span class=""quote"">&gt;165hz</span><br><span class=""quote"">&gt;16 inch</span><br>literally all you need.",71A2ZrFjX9L,.jpg,2000,2000,250,250,1670927887465490,1670927887,vo9y5BTUY5uANQfSzfuUQQ==,294195,0,0,0,1440p,1,31,4,26.0,3.0,"[{'no': 621029904, 'now': '12/13/22(Tue)06:47:02', 'name': 'Anonymous', 'com': '<a href=""#p621029192"" class=""quotelink"">&gt;&gt;621029192</a><br>Momokuri', 'time': 1670932022, 'resto': 621026281}, {'no': 621030249, 'now': '12/13/22(Tue)06:54:11', 'name': 'Anonymous', 'com': '<a href=""#p621026281"" class=""quotelink"">&gt;&gt;621026281</a><br><span class=""quote"">&gt;some part breaks/need upgrade</span><br><span class=""quote"">&gt;that will be $900 + the tip</span><br>Craptops are the goyslop of computers.', 'time': 1670932451, 'resto': 621026281}, {'no': 621030327, 'now': '12/13/22(Tue)06:55:41', 'name': 'Anonymous', 'com': '<a href=""#p621026281"" class=""quotelink"">&gt;&gt;621026281</a><br>enjoy playing cs 1.6, thats all it can run at 1440p 165fps', 'filename': '1662038300355', 'ext': '.gif', 'w': 220, 'h': 220, 'tn_w': 125, 'tn_h': 125, 'tim': 1670932541831099, 'time': 1670932541, 'md5': 'WuB+attjRtQykspV0BdtAQ==', 'fsize': 186063, 'resto': 621026281}, {'no': 621030413, 'now': '12/13/22(Tue)06:57:19', 'name': 'Anonymous', 'com': '<a href=""#p621029904"" class=""quotelink"">&gt;&gt;621029904</a><br>Thanks', 'time': 1670932639, 'resto': 621026281}, {'no': 621030495, 'now': '12/13/22(Tue)06:58:40', 'name': 'Anonymous', 'com': '<a href=""#p621030249"" class=""quotelink"">&gt;&gt;621030249</a><br><span class=""quote"">&gt;can&#039;t solder or do his own repairs</span><br><span class=""quote"">&gt;can&#039;t make it through a post without buzzwords</span><br>You don&#039;t belong here.', 'time': 1670932720, 'resto': 621026281}]",1670932720,1.0,,
139,621025115,12/13/22(Tue)05:14:30,Anonymous,What kind of RPG combat systems do you like?<br>Should the Shin Megami Tensei franchise switch to Active Time Battle system? Even adding some timing based challenges to the turn based combat like the Yakuza RPG or the Mario RPGs do would help make the game feel fasters.<br><br>I tried to play Persona 5 but I&#039;m not vibing with the combat.,digital-devil-story-a-history-of-shin-megami-tensei_xb3z,.jpg,1280,720,250,140,1670926470544150,1670926470,KUhmBqiQrMfxZ5tnikEbkA==,253820,0,0,0,what-kind-of-rpg-combat-systems-do-you-like,1,14,2,9.0,2.0,"[{'no': 621027513, 'now': '12/13/22(Tue)06:01:17', 'name': 'Anonymous', 'com': '<a href=""#p621027367"" class=""quotelink"">&gt;&gt;621027367</a><br><span class=""quote"">&gt;Press-Turn</span><br><span class=""quote"">&gt;good</span><br>No.', 'time': 1670929277, 'resto': 621025115}, {'no': 621027814, 'now': '12/13/22(Tue)06:07:20', 'name': 'Anonymous', 'com': '<a href=""#p621025115"" class=""quotelink"">&gt;&gt;621025115</a><br><span class=""quote"">&gt;Should the Shin Megami Tensei franchise switch to Active Time Battle system</span><br>Why would you switch to an inferior battle system?', 'time': 1670929640, 'resto': 621025115}, {'no': 621028207, 'now': '12/13/22(Tue)06:14:36', 'name': 'Anonymous', 'com': '<a href=""#p621027367"" class=""quotelink"">&gt;&gt;621027367</a><br><span class=""quote"">&gt;SMT and Black Souls have the best RPG combat systems.</span><br>Also Crystal Project', 'time': 1670930076, 'resto': 621025115}, {'no': 621028919, 'now': '12/13/22(Tue)06:28:01', 'name': 'Anonymous', 'com': '<a href=""#p621025115"" class=""quotelink"">&gt;&gt;621025115</a><br><span class=""quote"">&gt;Should the Shin Megami Tensei franchise switch to Active Time Battle system?</span><br>Fuck no. Forcing the player to make a decision in an amount of time goes against the point of turn based RPGs.<br><br>Atlus is doing alright right now, they have no reason to change the format. <br><br><span class=""quote"">&gt;I tried to play Persona 5 but I&#039;m not vibing with the combat</span><br><br>Getting filtered by their most normie game ever.', 'time': 1670930881, 'resto': 621025115}, {'no': 621030449, 'now': '12/13/22(Tue)06:57:56', 'name': 'Anonymous', 'com': 'I feel like press turn is a bit overrated, the odds in your favor grow dramatically as soon you&#039;re allowed to have demons with repel or drain on your team that will instantly end enemy turn regardless of how many turns they have.', 'time': 1670932676, 'resto': 621025115}]",1670932676,1.0,,
140,621027504,12/13/22(Tue)06:01:05,Anonymous,:),3318bb96f9f8e1903b173e63e0d80bd6,.jpg,853,430,250,126,1670929265646291,1670929265,GjwmUoLT11I9F2Bpw3tosQ==,36622,0,0,0,,1,9,2,4.0,1.0,"[{'no': 621029876, 'now': '12/13/22(Tue)06:46:25', 'name': 'Anonymous', 'com': '<a href=""#p621027504"" class=""quotelink"">&gt;&gt;621027504</a><br>:(', 'filename': '34556798', 'ext': '.jpg', 'w': 1280, 'h': 800, 'tn_w': 125, 'tn_h': 78, 'tim': 1670931985606978, 'time': 1670931985, 'md5': 'ZHWYqaB95Gem/w28LtxmTQ==', 'fsize': 156655, 'resto': 621027504, 'm_img': 1}, {'no': 621029968, 'now': '12/13/22(Tue)06:48:27', 'name': 'Anonymous', 'com': '<a href=""#p621027504"" class=""quotelink"">&gt;&gt;621027504</a><br>John Deadspace my beloved', 'time': 1670932107, 'resto': 621027504}, {'no': 621030152, 'now': '12/13/22(Tue)06:52:16', 'name': 'Anonymous', 'com': '<a href=""#p621027504"" class=""quotelink"">&gt;&gt;621027504</a><br>grey hair mods will fix it', 'time': 1670932336, 'resto': 621027504}, {'no': 621030310, 'now': '12/13/22(Tue)06:55:28', 'name': 'Anonymous', 'com': '<a href=""#p621029556"" class=""quotelink"">&gt;&gt;621029556</a><br>It is his original face model.<br>The difference is that they&#039;re using a face-scan this time instead of creating his face from the reference.', 'time': 1670932528, 'resto': 621027504}, {'no': 621030448, 'now': '12/13/22(Tue)06:57:55', 'name': 'Anonymous', 'com': '<a href=""#p621029876"" class=""quotelink"">&gt;&gt;621029876</a><br>Kotor lookin motherfucker', 'time': 1670932675, 'resto': 621027504}]",1670932675,,,
141,621029501,12/13/22(Tue)06:38:48,Anonymous,"<span class=""quote"">&gt;2 GOTYs in 4 years</span><br><span class=""quote"">&gt;meanwhile Nintendo only 1 in 30 years</span><br><br>How did Nintendo lose it all?",Zaki,.jpg,903,508,250,140,1670931528313448,1670931528,rhDyxRt7ct4YWmy3xtYDfA==,46303,0,0,0,2-gotys-in-4-years,1,2,0,,,"[{'no': 621030307, 'now': '12/13/22(Tue)06:55:25', 'name': 'Anonymous', 'com': '<a href=""#p621029501"" class=""quotelink"">&gt;&gt;621029501</a><br>If you&#039;re referring to The Game Awards <br>this award is only 8 years old starting in 2014', 'time': 1670932525, 'resto': 621029501}, {'no': 621030440, 'now': '12/13/22(Tue)06:57:43', 'name': 'Anonymous', 'com': '<a href=""#p621029501"" class=""quotelink"">&gt;&gt;621029501</a><br>I like to nominate my reformed orthodox rabbi bill clinton thank you very much', 'time': 1670932663, 'resto': 621029501}]",1670932663,,,
142,621022950,12/13/22(Tue)04:30:34,Anonymous,"Don&#039;t listen to /v/, this is an amazing game.<br><br>I played it for the first time recently and it&#039;s really good",sky,.jpg,1600,1200,250,187,1670923834690128,1670923834,FGpPgO0oBgxLBmA/s5ej/Q==,142952,0,0,0,dont-listen-to-v-this-is-an-amazing-game,1,28,3,23.0,3.0,"[{'no': 621026604, 'now': '12/13/22(Tue)05:44:10', 'name': 'Anonymous', 'com': 'Do you think the next elder scrolls game will be good?', 'time': 1670928250, 'resto': 621022950}, {'no': 621027530, 'now': '12/13/22(Tue)06:01:44', 'name': 'Anonymous', 'com': '<a href=""#p621023075"" class=""quotelink"">&gt;&gt;621023075</a><br>I would put Fallout 3, New Vegas and Skyrim in my top ten favorite games of all time and I was blown away by what absolute fucking trash Fallout 4 is and I wish I had never played it', 'time': 1670929304, 'resto': 621022950}, {'no': 621029714, 'now': '12/13/22(Tue)06:42:52', 'name': 'Anonymous', 'com': '<a href=""#p621026604"" class=""quotelink"">&gt;&gt;621026604</a><br>I hope so, I&#039;m also looking forward to Starfield', 'time': 1670931772, 'resto': 621022950}, {'no': 621030294, 'now': '12/13/22(Tue)06:55:04', 'name': 'Anonymous', 'com': 'let me tell you a story that happened in my wabbajack modlist playthru<br><span class=""quote"">&gt;be lvl 20+ something and go to riften for first time </span><br><span class=""quote"">&gt;soon as i enter to marketplace some random cultists attacks me</span><br><span class=""quote"">&gt;they use aoe spells and aggro alot of npcs fighting</span><br><span class=""quote"">&gt;aftermath of chaos there are bodies everywhere</span><br><span class=""quote"">&gt;grelka, balimund, foodsellingelflady, guards and cultists</span><br><span class=""quote"">&gt;there was even a some sinister dude </span><s> <br>some kinda modded &quot;boss&quot; </s><br><span class=""quote"">&gt;laugh good minute and wonder what the fuck i just saw</span><br>very fun', 'time': 1670932504, 'resto': 621022950}, {'no': 621030438, 'now': '12/13/22(Tue)06:57:41', 'name': 'Anonymous', 'com': 'Why is the main quest so broken especially Rikke&#039;s part?<br>I&#039;ve got to the point again where you give the documents to the Stormcloak and then she just gives no more orders.', 'time': 1670932661, 'resto': 621022950}]",1670932661,1.0,,
143,621012645,12/13/22(Tue)01:35:47,Anonymous,Is this all Nintendo had left?,1670295387963760,.png,452,508,222,250,1670913347594379,1670913347,1+y2xH/kaz1ynVIFkkML8g==,472174,0,0,0,is-this-all-nintendo-had-left,1,95,5,90.0,5.0,"[{'no': 621028584, 'now': '12/13/22(Tue)06:21:29', 'name': 'Anonymous', 'com': 'The Switch has been out for almost 6 years and it still hasn&#039;t gotten an its own Zelda game. What the fuck is Nintendo doing other than turning Splatoon and Pokemon into tranny games?', 'time': 1670930489, 'resto': 621012645}, {'no': 621029378, 'now': '12/13/22(Tue)06:36:19', 'name': 'Anonymous', 'com': 'It&#039;s strange that they&#039;ve still shown nothing substantial for such a big tentpole game when it&#039;s less than five months from release. By this point before BotW released, we had hours of gameplay footage for months. We don&#039;t even need that much, but the fact that we&#039;re still only getting teasers this late is setting off... I won&#039;t say &quot;red flags&quot; yet, but at least &quot;yellow flags&quot;.', 'time': 1670931379, 'resto': 621012645}, {'no': 621029429, 'now': '12/13/22(Tue)06:37:32', 'name': 'Anonymous', 'com': '<a href=""#p621026931"" class=""quotelink"">&gt;&gt;621026931</a><br><span class=""quote"">&gt;Probably still in progress</span><br>lol. Lmao, even.', 'time': 1670931452, 'resto': 621012645}, {'no': 621030419, 'now': '12/13/22(Tue)06:57:26', 'name': 'Anonymous', 'com': '<a href=""#p621026931"" class=""quotelink"">&gt;&gt;621026931</a><br><span class=""quote"">&gt;I&#039;m really curious what exactly the first studio showed</span><br><br>It wasn&#039;t one studio. It was a couple of studios working on it. Nintendo were trying an idea of having different parts of the game made by different studio. It was a shit show. Retro approached Nintendo and made their pitch. Nintendo shitcanned all the work done and handed the licence to Retro', 'time': 1670932646, 'resto': 621012645}, {'no': 621030420, 'now': '12/13/22(Tue)06:57:26', 'name': 'Anonymous', 'com': '<a href=""#p621022179"" class=""quotelink"">&gt;&gt;621022179</a><br><span class=""quote"">&gt;Metroid Prime 4...a game that should have only been in development for around 3 years</span><br>You are greatly underestimating how much time it takes to make a game like Prime from the ground up. I had no doubt it would not release this year. I thought we might see something, but I understand they don&#039;t want to build hype too early. I think we&#039;ll see something next year for sure, with a slim chance of end of year release. I&#039;m picking 2024 though.', 'time': 1670932646, 'resto': 621012645}]",1670932646,,,
144,621030012,12/13/22(Tue)06:49:20,Anonymous,Help me remember this game /v/<br>Around 20 something years old<br>Rpg<br>Top down view<br>You wake up in front of a farm on fire and some dude tells you something<br>Pretty sure he gets killed right away<br>The game begins,1654167606870,.jpg,750,726,250,242,1670932160193164,1670932160,9aC1RgzRybEfWDGDIRK7iA==,88706,0,0,0,help-me-remember-this-game-v,1,2,1,,,"[{'no': 621030287, 'now': '12/13/22(Tue)06:54:58', 'name': 'Anonymous', 'com': 'The first Breath Of Fire game has something like that. Like 5 minutes after the game starts your entire starting village is on fire.', 'filename': 'BOF_Clipboard01', 'ext': '.jpg', 'w': 650, 'h': 650, 'tn_w': 125, 'tn_h': 125, 'tim': 1670932498833780, 'time': 1670932498, 'md5': 'lkoJUqSoG+9VUWcZzW7mVQ==', 'fsize': 129067, 'resto': 621030012}, {'no': 621030406, 'now': '12/13/22(Tue)06:57:08', 'name': 'Anonymous', 'com': '<a href=""#p621030287"" class=""quotelink"">&gt;&gt;621030287</a><br>Video at https://youtu.be/g4GFmWMwRIs?t=971 at 16:11 for the fire part', 'time': 1670932628, 'resto': 621030012}]",1670932628,,,
145,621028408,12/13/22(Tue)06:18:26,Anonymous,"<span class=""quote"">&gt;game is fun with friends</span><br><span class=""quote"">&gt;all my friends are either &quot;Do Not Disturb&quot;, offline or deliberately set their status to &quot;Offline&quot;</span>",1670836015948223,.jpg,578,599,241,250,1670930306474495,1670930306,ZbxYN428cqHAnKPBTCAqyg==,71472,0,0,0,game-is-fun-with-friends,1,9,1,4.0,1.0,"[{'no': 621029798, 'now': '12/13/22(Tue)06:44:40', 'name': 'Anonymous', 'com': '<a href=""#p621028840"" class=""quotelink"">&gt;&gt;621028840</a><br>tsubasa reservoir chronicle', 'time': 1670931880, 'resto': 621028408}, {'no': 621029960, 'now': '12/13/22(Tue)06:48:10', 'name': 'Anonymous', 'com': '<a href=""#p621028840"" class=""quotelink"">&gt;&gt;621028840</a><br>Cardcaptor Sakura', 'time': 1670932090, 'resto': 621028408}, {'no': 621029980, 'now': '12/13/22(Tue)06:48:45', 'name': 'Anonymous', 'com': '<a href=""#p621029798"" class=""quotelink"">&gt;&gt;621029798</a><br>LIAR<br><br><a href=""#p621029960"" class=""quotelink"">&gt;&gt;621029960</a><br>Thanks :)', 'time': 1670932125, 'resto': 621028408}, {'no': 621030192, 'now': '12/13/22(Tue)06:52:56', 'name': 'Anonymous', 'com': '<a href=""#p621028840"" class=""quotelink"">&gt;&gt;621028840</a><br>How new?', 'time': 1670932376, 'resto': 621028408}, {'no': 621030328, 'now': '12/13/22(Tue)06:55:42', 'name': 'Anonymous', 'com': '<a href=""#p621030192"" class=""quotelink"">&gt;&gt;621030192</a><br>Don&#039;t fall for the bait anon, he&#039;s trying to force discussion about the anime', 'time': 1670932542, 'resto': 621028408}]",1670932542,,,
146,621030124,12/13/22(Tue)06:51:36,Anonymous,ok.. but what if mushrooms from mario games are actually drugs??<br>that would be deep af fr thou..<br>like... him getting bigger and smaller... it&#039;s just mario&#039;s imagination under the influences..<br>just think about it..,2Q==,.jpg,310,163,249,131,1670932296524462,1670932296,mnGy7MNhki5KigHZuVPWxg==,14222,0,0,0,ok-but-what-if-mushrooms-from-mario-games-are,1,1,0,,,"[{'no': 621030312, 'now': '12/13/22(Tue)06:55:29', 'name': 'Anonymous', 'com': '<a href=""#p621030124"" class=""quotelink"">&gt;&gt;621030124</a><br>drugs are illegal so that&#039;s impossible dumbass', 'time': 1670932529, 'resto': 621030124}]",1670932529,,,
147,621021438,12/13/22(Tue)04:02:17,Anonymous,How do we improve the horror genre?,1670875635782137,.jpg,2300,1600,250,173,1670922137717741,1670922137,fjj0c5lXwuIxXdl2tSSfRA==,292315,0,0,0,how-do-we-improve-the-horror-genre,1,16,5,11.0,3.0,"[{'no': 621024172, 'now': '12/13/22(Tue)04:55:25', 'name': 'Anonymous', 'com': '<a href=""#p621021438"" class=""quotelink"">&gt;&gt;621021438</a><br><a href=""#p621023830"" class=""quotelink"">&gt;&gt;621023830</a><br><a href=""#p621023885"" class=""quotelink"">&gt;&gt;621023885</a><br>sexo', 'time': 1670925325, 'resto': 621021438}, {'no': 621025886, 'now': '12/13/22(Tue)05:30:11', 'name': 'Anonymous', 'com': '<a href=""#p621021438"" class=""quotelink"">&gt;&gt;621021438</a><br><a href=""#p621023771"" class=""quotelink"">&gt;&gt;621023771</a><br><a href=""#p621023830"" class=""quotelink"">&gt;&gt;621023830</a><br><a href=""#p621023885"" class=""quotelink"">&gt;&gt;621023885</a><br>I will never understand how people can get off to this', 'filename': '1654002899616', 'ext': '.png', 'w': 305, 'h': 348, 'tn_w': 109, 'tn_h': 124, 'tim': 1670927411103207, 'time': 1670927411, 'md5': 'AH90jq83s0UUv/iPtaSkNg==', 'fsize': 151438, 'resto': 621021438}, {'no': 621028917, 'now': '12/13/22(Tue)06:27:59', 'name': 'Anonymous', 'com': '<a href=""#p621021438"" class=""quotelink"">&gt;&gt;621021438</a><br>Game ships with a tazer that hooks up to your balls everytime you&#039;re hit or die you get zapped', 'time': 1670930879, 'resto': 621021438}, {'no': 621029382, 'now': '12/13/22(Tue)06:36:25', 'name': 'Anonymous', 'com': '<a href=""#p621021438"" class=""quotelink"">&gt;&gt;621021438</a><br>player can choose a phobia/theme and game will generate a fitting scenario', 'time': 1670931385, 'resto': 621021438}, {'no': 621030295, 'now': '12/13/22(Tue)06:55:06', 'name': 'Anonymous', 'com': '<a href=""#p621021438"" class=""quotelink"">&gt;&gt;621021438</a><br>Simply - we need BIGGER monsters', 'filename': 'IMG_20221213_155444', 'ext': '.png', 'w': 1200, 'h': 800, 'tn_w': 125, 'tn_h': 83, 'tim': 1670932506244610, 'time': 1670932506, 'md5': 'APe0f3Tb3oLNLEVj8R7LPQ==', 'fsize': 1197607, 'resto': 621021438, 'm_img': 1}]",1670932506,1.0,,
148,620955898,12/12/22(Mon)14:43:27,Anonymous,Zoomers ruined immersive sim discussion.,2D6D0C0E-E6FA-4025-861B-07677DF8B4BC,.png,1054,925,250,219,1670874207565570,1670874207,TTtayl8b+fHlvZO56ibkKQ==,1579816,0,0,0,zoomers-ruined-immersive-sim-discussion,1,299,69,294.0,68.0,"[{'no': 621027621, 'now': '12/13/22(Tue)06:03:50', 'name': 'Anonymous', 'com': '<a href=""#p620991370"" class=""quotelink"">&gt;&gt;620991370</a><br><span class=""quote"">&gt;Holy shit Swat 4 is an immersive sim.</span><br>Yes, YES, YOU ABSOLUTE RETARD, yes it is!.', 'time': 1670929430, 'resto': 620955898}, {'no': 621027713, 'now': '12/13/22(Tue)06:05:18', 'name': 'Anonymous', 'com': '<a href=""#p621027621"" class=""quotelink"">&gt;&gt;621027621</a>', 'filename': '85', 'ext': '.gif', 'w': 200, 'h': 200, 'tn_w': 125, 'tn_h': 125, 'tim': 1670929518478852, 'time': 1670929518, 'md5': 'Z86Ne+9OOAbI9Ms3lymkiQ==', 'fsize': 1176494, 'resto': 620955898}, {'no': 621028556, 'now': '12/13/22(Tue)06:20:56', 'name': 'Anonymous', 'com': '<a href=""#p621027713"" class=""quotelink"">&gt;&gt;621027713</a><br><a href=""#p620991370"" class=""quotelink"">&gt;&gt;620991370</a><br><a href=""#p620967175"" class=""quotelink"">&gt;&gt;620967175</a><br><span class=""quote"">&gt;this game following the same gameplay conventions isn&#039;t in the same genre because... becasue it just isn&#039;t, ok!</span>', 'time': 1670930456, 'resto': 620955898}, {'no': 621029367, 'now': '12/13/22(Tue)06:36:14', 'name': 'Anonymous', 'com': '<a href=""#p621027204"" class=""quotelink"">&gt;&gt;621027204</a><br><span class=""quote"">&gt;he doesn&#039;t know who terri brosius, sara verrilli or laura baldwin are</span>', 'time': 1670931374, 'resto': 620955898}, {'no': 621030275, 'now': '12/13/22(Tue)06:54:45', 'name': 'Anonymous', 'com': '<a href=""#p621029367"" class=""quotelink"">&gt;&gt;621029367</a><br>If they did anything important, people would know who they are.', 'time': 1670932485, 'resto': 620955898}]",1670932485,1.0,,
149,621023705,12/13/22(Tue)04:45:58,Anonymous,Apologies.,D6682AAD-6072-4741-9B22-850A9FBE9ED3,.jpg,1280,720,250,140,1670924758832414,1670924758,Wl2iIKOF2NtUrglSK0yQjQ==,483330,0,0,0,pc-doesnt-have-go,1,8,0,3.0,0.0,"[{'no': 621025720, 'now': '12/13/22(Tue)05:26:40', 'name': 'Anonymous', 'com': '<a href=""#p621023705"" class=""quotelink"">&gt;&gt;621023705</a><br>When will season 4 dlc be cracked?<br><br>Not a poorfag. Just don&#039;t wanna give ubisoft my money.<br><br>Also having to use that cringey launcher of theirs is garbage', 'time': 1670927200, 'resto': 621023705}, {'no': 621027119, 'now': '12/13/22(Tue)05:53:52', 'name': 'Anonymous', 'com': '<a href=""#p621025720"" class=""quotelink"">&gt;&gt;621025720</a><br>This', 'time': 1670928832, 'resto': 621023705}, {'no': 621028615, 'now': '12/13/22(Tue)06:22:03', 'name': 'Anonymous', 'com': '<a href=""#p621023705"" class=""quotelink"">&gt;&gt;621023705</a><br><span class=""quote"">&gt;uPlay launcher AND Denuvo</span><br>I want to play this game, but the cancer is too much.', 'time': 1670930523, 'resto': 621023705}, {'no': 621029093, 'now': '12/13/22(Tue)06:30:59', 'name': 'Anonymous', 'com': '<a href=""#p621023705"" class=""quotelink"">&gt;&gt;621023705</a><br><span class=""quote"">&gt;Apologies</span><br>You are forgiven', 'time': 1670931059, 'resto': 621023705}, {'no': 621030163, 'now': '12/13/22(Tue)06:52:27', 'name': 'Anonymous', 'com': '<a href=""#p621025720"" class=""quotelink"">&gt;&gt;621025720</a><br><a href=""#p621027119"" class=""quotelink"">&gt;&gt;621027119</a><br>There&#039;s that tool where you only need the base game to get all DLC', 'time': 1670932347, 'resto': 621023705}]",1670932347,1.0,PC doesn’t have go-,
150,621020202,12/13/22(Tue)03:41:52,Anonymous,"<span class=""quote"">&gt;Back from work</span><br><span class=""quote"">&gt;too tired to play vidya game unless it&#039;s a 10/10</span><br>is this why normalfags love cinematic game so much?",1645479057209,.jpg,380,380,250,250,1670920912964239,1670920912,zEr/y+qQVEVxJ8pLbuYKOA==,51350,0,0,0,back-from-work,1,20,7,15.0,6.0,"[{'no': 621029641, 'now': '12/13/22(Tue)06:41:40', 'name': 'Anonymous', 'com': '<a href=""#p621029317"" class=""quotelink"">&gt;&gt;621029317</a><br>When was the last time gook moot added a board about Japan or tranime?', 'time': 1670931700, 'resto': 621020202}, {'no': 621029787, 'now': '12/13/22(Tue)06:44:28', 'name': 'Anonymous', 'com': '<a href=""#p621029641"" class=""quotelink"">&gt;&gt;621029641</a><br>I think /vt/ was the last one, around 2020 I think.', 'time': 1670931868, 'resto': 621020202}, {'no': 621029970, 'now': '12/13/22(Tue)06:48:32', 'name': 'Anonymous', 'com': '<a href=""#p621022442"" class=""quotelink"">&gt;&gt;621022442</a><br>How do we solve this short of playing csgo with isreal in roblox?', 'time': 1670932112, 'resto': 621020202}, {'no': 621030097, 'now': '12/13/22(Tue)06:51:09', 'name': 'Anonymous', 'com': '<a href=""#p621020202"" class=""quotelink"">&gt;&gt;621020202</a><br><span class=""quote"">&gt;too tired to press buttons </span><br>Lol', 'time': 1670932269, 'resto': 621020202}, {'no': 621030146, 'now': '12/13/22(Tue)06:52:04', 'name': 'Anonymous', 'com': '<a href=""#p621020850"" class=""quotelink"">&gt;&gt;621020850</a><br><span class=""quote"">&gt;Work in factory doing lab stuff during Covid</span><br><span class=""quote"">&gt;Make us wear a mask for 2 years</span><br><span class=""quote"">&gt;Everyone larping and acting like none of these ridiculous protocols over a cold are a big deal</span><br><br>I am pretty sure I aged 5 years in the span of 2 my hair is starting to fall out from the stress of all that, at least I don&#039;t work anymore.', 'filename': '1534713814704', 'ext': '.gif', 'w': 500, 'h': 500, 'tn_w': 125, 'tn_h': 125, 'tim': 1670932324136798, 'time': 1670932324, 'md5': 'uDJHjueL3ITFnATUGiOlDQ==', 'fsize': 1798892, 'resto': 621020202}]",1670932324,,,
