,no,now,name,com,filename,ext,w,h,tn_w,tn_h,tim,time,md5,fsize,resto,bumplimit,imagelimit,semantic_url,custom_spoiler,replies,images,omitted_posts,omitted_images,last_replies,last_modified,m_img,sub,trip
53,621015795,12/13/22(Tue)02:29:39,NightShiftAnon,"KEEP ALL TOURNAMENT TALK ITT!<br><br>►VOTE: https://forms.gle/oRLt6JanhGcMqck56<wbr><br>—Timer: https://itsalmo.st/time-for-round-3<wbr>-bmtc<br><br>►Nomination List: https://docs.google.com/spreadsheet<wbr>s/d/1x9oxZFKDrSWqtzOytHiJ0609Yxoqiq<wbr>kL1g8Qj1c28vQ/edit?usp=sharing<br><br>►Qualifier results: https://docs.google.com/spreadsheet<wbr>s/d/1K5Hra01e0p-yWQKUv1IgbowM_QEeZ2<wbr>Qkg1yEIqF879s/edit?usp=sharing<br><br>►Bracket: https://challonge.com/gjlkx98j<br><br>►Rules: https://pastebin.com/ZXkZ23UB<br><br>►OC (UPLOAD TOURNEY OC HERE)<br>https://queenkingv.booru.org/<br>https://booru.plus/+queenkingvbooru<wbr>plus<br><br>►Judges: Yotsuba, /v/-tan, Tre/vr/, Steven Armstrong<br><br>►Hosts<br><span class=""quote"">&gt;NightShiftAnon !!9A2duD1C25+</span><br><span class=""quote"">&gt;Ghost !!eh0Fgi0FQSV</span><br><span class=""quote"">&gt;BallsAnon !th0DR5qBxs</span><br><br>Previous:<a href=""/v/thread/621005687#p621005687"" class=""quotelink"">&gt;&gt;621005687</a><br>Round 2: <a href=""/v/thread/620988468#p620988468"" class=""quotelink"">&gt;&gt;620988468</a><br>Round 1: <a href=""/v/thread/620876809#p620876809"" class=""quotelink"">&gt;&gt;620876809</a><br>Qualifiers:<a href=""/v/thread/620766656#p620766656"" class=""quotelink"">&gt;&gt;620766656</a><br>Nominations: <a href=""/v/thread/620648163#p620648163"" class=""quotelink"">&gt;&gt;620648163</a>",1670909029018621,.jpg,981,913,249,232,1670916579237062,1670916579,rRzc0Pt7GW07cLusb73jQA==,326449,0,0,0,king-of-v-2022round-2-part-4,1,409,211,404.0,209.0,"[{'no': 621030995, 'now': '12/13/22(Tue)07:08:31', 'name': 'Anonymous', 'com': '<a href=""#p621024635"" class=""quotelink"">&gt;&gt;621024635</a><br>Now now, Kleiner i get the exitement you are having right now, but this is no time to be trashing your opponent without a Backup plan!<br>Thankfully i have got something for you that can help in case of failure... Ofcourse i know you are as well trained as much Gordon Freeman, so the chances of that happening are under the 2% but we don&#039;t want to have another Resonance cascade now do we?', 'filename': 'Einstein', 'ext': '.png', 'w': 268, 'h': 268, 'tn_w': 125, 'tn_h': 125, 'tim': 1670933311751593, 'time': 1670933311, 'md5': 'MthIWmoMT+dipFysvCBD3A==', 'fsize': 74174, 'resto': 621015795}, {'no': 621031072, 'now': '12/13/22(Tue)07:10:14', 'name': 'Anonymous', 'com': '<a href=""#p621030876"" class=""quotelink"">&gt;&gt;621030876</a><br>Kek', 'time': 1670933414, 'resto': 621015795}, {'no': 621031201, 'now': '12/13/22(Tue)07:12:45', 'name': 'Anonymous', 'com': '<a href=""#p621030995"" class=""quotelink"">&gt;&gt;621030995</a><br>Here it is, HellTaker, this is Sarah from the X-labs, if you get to win, in exchange of you not beating my couleague you get to have her, just threat her nice as her legs are stronger than our Garbage compactor.', 'filename': 'file', 'ext': '.png', 'w': 890, 'h': 665, 'tn_w': 125, 'tn_h': 93, 'tim': 1670933565126241, 'time': 1670933565, 'md5': 'zsgB7cbES/7O/uS94+Xutg==', 'fsize': 761173, 'resto': 621015795}, {'no': 621031232, 'now': '12/13/22(Tue)07:13:20', 'name': 'Anonymous', 'com': '<a href=""#p621030876"" class=""quotelink"">&gt;&gt;621030876</a><br>The mass murdering bio weapon is disgusted by a Chinese silk farming forum’s average discussion.', 'time': 1670933600, 'resto': 621015795}, {'no': 621031256, 'now': '12/13/22(Tue)07:13:48', 'name': 'Anonymous', 'com': '<a href=""#p621029090"" class=""quotelink"">&gt;&gt;621029090</a><br>Mornin', 'time': 1670933628, 'resto': 621015795}]",1670933628,,King of /v/ 2022:Round 2 Part 4,!!9A2duD1C25+
54,621031150,12/13/22(Tue)07:11:54,Anonymous,,1670524603700792,.jpg,717,550,250,191,1670933514515982,1670933514,ZFD+tLmeY9njWKU2lVaVWw==,97808,0,0,0,v-humour-thread,1,1,0,,,"[{'no': 621031254, 'now': '12/13/22(Tue)07:13:47', 'name': 'Anonymous', 'com': 'I hate how fake these greentexts are, I don&#039;t know how to suspend my disbelief anymore', 'time': 1670933627, 'resto': 621031150}]",1670933627,,/v/ humour thread,
55,621030817,12/13/22(Tue)07:05:02,Anonymous,"<span class=""quote"">&gt;diversity ruined gami-</span>",aaa-865x405,.jpg,1067,653,250,152,1670933102740635,1670933102,S+vyLmPPogBbOFm9Abi94w==,210029,0,0,0,diversity-ruined-gami,1,13,0,8.0,0.0,"[{'no': 621031103, 'now': '12/13/22(Tue)07:10:50', 'name': 'Anonymous', 'com': '<a href=""#p621030963"" class=""quotelink"">&gt;&gt;621030963</a><br>Demoman, his entire personality is &quot;alcoholic&quot; (dude drugs lmao)', 'time': 1670933450, 'resto': 621030817}, {'no': 621031106, 'now': '12/13/22(Tue)07:10:51', 'name': 'Anonymous', 'com': '<a href=""#p621030963"" class=""quotelink"">&gt;&gt;621030963</a><br>Tracer.<br><br>Honestly, look at how characters are marketed, then compare to how they used to just be a casual part of gameplay.', 'time': 1670933451, 'resto': 621030817}, {'no': 621031127, 'now': '12/13/22(Tue)07:11:20', 'name': 'Anonymous', 'com': '<a href=""#p621030817"" class=""quotelink"">&gt;&gt;621030817</a><br>Only when its forced.', 'time': 1670933480, 'resto': 621030817}, {'no': 621031163, 'now': '12/13/22(Tue)07:12:09', 'name': 'Anonymous', 'com': '<a href=""#p621030817"" class=""quotelink"">&gt;&gt;621030817</a><br>If those black characters were created today, they&#039;d be flawless mary sue archetypes with obnoxious hairstyles and nobody would ever remember them.<br>The ideology of developers changed.', 'time': 1670933529, 'resto': 621030817}, {'no': 621031247, 'now': '12/13/22(Tue)07:13:34', 'name': 'Anonymous', 'com': '<a href=""#p621031038"" class=""quotelink"">&gt;&gt;621031038</a><br><span class=""quote"">&gt;Interact with character</span><br><span class=""quote"">&gt;Is it shit? </span><br>Most brownoid characters nowadays are a &quot;Yes&quot;', 'time': 1670933614, 'resto': 621030817}]",1670933614,1.0,,
56,621029215,12/13/22(Tue)06:33:06,Anonymous,"<span class=""quote"">&gt;gamers humor</span>",Fj1ce06aMAAwESc,.jpg,550,558,246,250,1670931186238206,1670931186,sg37xDAsPwrF1fjnFSDoUA==,60833,0,0,0,gamers-humor,1,27,4,22.0,3.0,"[{'no': 621030971, 'now': '12/13/22(Tue)07:08:03', 'name': 'Anonymous', 'com': '<a href=""#p621029215"" class=""quotelink"">&gt;&gt;621029215</a><br>That was literally the plot twist of that shitty Detective Pikachu movie', 'time': 1670933283, 'resto': 621029215}, {'no': 621031071, 'now': '12/13/22(Tue)07:10:14', 'name': 'Anonymous', 'com': '<a href=""#p621029215"" class=""quotelink"">&gt;&gt;621029215</a><br>fixed', 'filename': '1670931186238206', 'ext': '.jpg', 'w': 550, 'h': 602, 'tn_w': 114, 'tn_h': 125, 'tim': 1670933414456580, 'time': 1670933414, 'md5': 'dqflNdEA6DjfuNWWpMlv3A==', 'fsize': 119737, 'resto': 621029215}, {'no': 621031152, 'now': '12/13/22(Tue)07:11:55', 'name': 'Anonymous', 'com': '<a href=""#p621031071"" class=""quotelink"">&gt;&gt;621031071</a><br>based', 'time': 1670933515, 'resto': 621029215}, {'no': 621031194, 'now': '12/13/22(Tue)07:12:41', 'name': 'Anonymous', 'com': '<a href=""#p621031071"" class=""quotelink"">&gt;&gt;621031071</a><br>You didn&#039;t understand the joke. Your version removed the joke.', 'time': 1670933561, 'resto': 621029215}, {'no': 621031241, 'now': '12/13/22(Tue)07:13:26', 'name': 'Anonymous', 'com': '<a href=""#p621029215"" class=""quotelink"">&gt;&gt;621029215</a><br>That&#039;s a thing in fallout 4 too.', 'time': 1670933606, 'resto': 621029215}]",1670933606,,,
57,620982182,12/12/22(Mon)19:13:00,Anonymous,for what purpose a librarian need tits big like this?<br>it makes no sense.,f7dc5004854239c760da40af51ba94f7,.jpg,1450,2048,177,250,1670890380457805,1670890380,g5DHAXqfoYFW0f5aeKjfkA==,1735556,0,0,0,for-what-purpose-a-librarian-need-tits-big-like,1,321,107,316.0,106.0,"[{'no': 621030702, 'now': '12/13/22(Tue)07:02:36', 'name': 'Anonymous', 'com': '<a href=""#p621030332"" class=""quotelink"">&gt;&gt;621030332</a><br>He should draw foota instead', 'time': 1670932956, 'resto': 620982182}, {'no': 621030920, 'now': '12/13/22(Tue)07:07:01', 'name': 'Anonymous', 'com': 'Boomer here. I played 6, 7, and 8 back in 2008 or so.<br>I want to get back into Touhou. What should I play now?', 'filename': '1217991986079', 'ext': '.jpg', 'w': 1024, 'h': 725, 'tn_w': 125, 'tn_h': 88, 'tim': 1670933221973540, 'time': 1670933221, 'md5': 'ilvkefGIrBFk2R37RCLhsw==', 'fsize': 301372, 'resto': 620982182}, {'no': 621031167, 'now': '12/13/22(Tue)07:12:12', 'name': 'Anonymous', 'com': '<a href=""#p621030702"" class=""quotelink"">&gt;&gt;621030702</a><br>Why anyone want a girl with a foot instead of a pussy?', 'time': 1670933532, 'resto': 620982182}, {'no': 621031198, 'now': '12/13/22(Tue)07:12:43', 'name': 'Anonymous', 'com': '<a href=""#p621030920"" class=""quotelink"">&gt;&gt;621030920</a><br>PCB or IN to get back in the swing of things. Then whatever game you think has the cutest girls except LOLK.', 'time': 1670933563, 'resto': 620982182}, {'no': 621031240, 'now': '12/13/22(Tue)07:13:26', 'name': 'Anonymous', 'com': '<a href=""#p621030702"" class=""quotelink"">&gt;&gt;621030702</a><br>Why would anyone want a girl with a feet instead of a futa dick? I don&#039;t get you people&#039;s fetishes.', 'time': 1670933606, 'resto': 620982182}]",1670933606,1.0,,
58,621031238,12/13/22(Tue)07:13:24,MiximumDennis,"<span class=""quote"">&gt;worked hours and hours on a meme edit</span><br><span class=""quote"">&gt;got almost no feedback on the post itself</span><br><span class=""quote"">&gt;my dream of being content creator is falling</span><br><span class=""quote"">&gt;in desperate attempt I finally start using 4chan</span><br><br>https://youtu.be/A5plnFdMNyw",4f0d9cf9-5a1c-4224-8bf6-9af7a6488875,.jpg,1215,717,250,147,1670933604077624,1670933604,iXOSuLxigBOCO4DI5NPwfw==,207207,0,0,0,inazuma-011,1,0,0,,,,1670933604,1.0,Inazuma 0/11,
59,620990162,12/12/22(Mon)20:35:57,Anonymous,This isn&#039;t a shitpost.,FiJJUfiWAAE9dLM,.jpg,652,1072,152,250,1670895357990131,1670895357,bDJDLFAJcew66Yd2/LvS2g==,101205,0,0,0,name-a-vidya-character-who-went-through-more-pain,1,274,98,269.0,96.0,"[{'no': 621030634, 'now': '12/13/22(Tue)07:01:06', 'name': 'Anonymous', 'com': '<a href=""#p620994652"" class=""quotelink"">&gt;&gt;620994652</a><br>Depends on how much ego you have.', 'time': 1670932866, 'resto': 620990162}, {'no': 621030898, 'now': '12/13/22(Tue)07:06:48', 'name': 'Anonymous', 'com': '<a href=""#p620990162"" class=""quotelink"">&gt;&gt;620990162</a><br><span class=""quote"">&gt;A prime soul is an incredibly rare occurrence in which a soul amasses so much power that it no longer requires a Husk as a vessel to manifest physically.</span><br><span class=""quote"">&gt;As manifestations of pure will, prime souls are incredibly powerful, to the point that even the prideful angels see them as a threat and will use any means necessary to stop them from forming.</span><br><span class=""quote"">&gt;King Minos felt that eternal suffering was unfair and unreasonable for those whose only sin was loving another. After the disappearance of God, as the angels were lost and heaven was in chaos, Minos began his efforts to reform the lust layer.</span><br><span class=""quote"">&gt;The Lust renaissance was prosperous, as King Minos guided its inhabitants to come together and build a new civilization. The combined efforts of the countless who have been damned to the second layer bore great results as the grand city of Lust grew and grew.</span><br><span class=""quote"">&gt;However, after the council took control of heaven and brought stability to it through their iron fist rule, they saw that Minos had gone against God&#039;s will by freeing sinners from the punishment that God had designed for them.</span><br><span class=""quote"">&gt;Gabriel, the brightest of the angels, was sent to kill Minos. The king, rather than fight back, tried to reason with him, but Gabriel mercilessly struck him down without listening.</span><br><span class=""quote"">&gt;As Minos&#039; will was strong enough to attempt to stand up to heaven&#039;s rule, the angels chose to imprison his soul in an attempt to stop it from forming into a prime soul and appointed Gabriel as the new Judge of Hell.</span><br><span class=""quote"">&gt;From the prison inside his own body, Minos helplessly watched as his soulless corpse, now controlled by parasites, tore apart everything he had worked so hard to build, cursing his own weakness for failing to protect his own people, vowing to take revenge...</span>', 'filename': 'pinos', 'ext': '.png', 'w': 312, 'h': 352, 'tn_w': 110, 'tn_h': 125, 'tim': 1670933208477201, 'time': 1670933208, 'md5': '3OZ3c4e1h5crLmqMSCnOzw==', 'fsize': 183960, 'resto': 620990162}, {'no': 621031037, 'now': '12/13/22(Tue)07:09:28', 'name': 'Anonymous', 'com': '<a href=""#p620997731"" class=""quotelink"">&gt;&gt;620997731</a><br>Final Fantasy ten is a good one.', 'time': 1670933368, 'resto': 620990162}, {'no': 621031096, 'now': '12/13/22(Tue)07:10:44', 'name': 'Anonymous', 'com': '<a href=""#p621029356"" class=""quotelink"">&gt;&gt;621029356</a><br><span class=""quote"">&gt;LizaEblan.jpg</span><br>Чё тaкoй дepзкий?', 'time': 1670933444, 'resto': 620990162}, {'no': 621031236, 'now': '12/13/22(Tue)07:13:23', 'name': 'Anonymous', 'com': '<a href=""#p620990162"" class=""quotelink"">&gt;&gt;620990162</a>', 'filename': '1655452199658', 'ext': '.png', 'w': 194, 'h': 259, 'tn_w': 93, 'tn_h': 125, 'tim': 1670933603110931, 'time': 1670933603, 'md5': 'yjkQKe+nyAWg9yqd2+JJ9w==', 'fsize': 48418, 'resto': 620990162}]",1670933603,1.0,Name a vidya character who went through more pain,
60,621014259,12/13/22(Tue)02:03:26,Anonymous,pure kino,halo4,.png,250,317,197,250,1670915006837667,1670915006,QR8WkkitFGNeNbWz7NlQ3Q==,158985,0,0,0,pure-kino,1,110,20,105.0,20.0,"[{'no': 621030781, 'now': '12/13/22(Tue)07:04:09', 'name': 'Anonymous', 'com': '<a href=""#p621030731"" class=""quotelink"">&gt;&gt;621030731</a><br><span class=""quote"">&gt;On the other hand, trying to search for anything outside of Invasion, Slayer, and Infection would last minutes.</span><br>Meant for Reach', 'time': 1670933049, 'resto': 621014259}, {'no': 621030967, 'now': '12/13/22(Tue)07:07:59', 'name': 'Anonymous', 'com': '<a href=""#p621014259"" class=""quotelink"">&gt;&gt;621014259</a><br>This. The only good Halo and it&#039;s not even close. Only good Cortana too.', 'time': 1670933279, 'resto': 621014259}, {'no': 621031064, 'now': '12/13/22(Tue)07:10:08', 'name': 'Anonymous', 'com': '<a href=""#p621030731"" class=""quotelink"">&gt;&gt;621030731</a><br><a href=""#p621030781"" class=""quotelink"">&gt;&gt;621030781</a><br>There&#039;s other anecdotes similar. One guy on /hg/ said how odd he felt when other say Reach is their fave because he can recall seeing many returned Reach copies that sat on the return shelf for a long time.<br><br>Wow, this thread has become more anti-Reach than discussing 4 but I do agree with everyone that says there&#039;s some annoying historical revisionism, treating post Halo 3 Bungie games like they were universally loved or came close to 3&#039;s massive success. It&#039;s possible to say 343 sucks while also saying post Halo 3 Bungie weren&#039;t miracle workers.', 'time': 1670933408, 'resto': 621014259}, {'no': 621031067, 'now': '12/13/22(Tue)07:10:12', 'name': 'Anonymous', 'com': 'Halo 4 is the only cannon Halo game. The rest do not matter.', 'time': 1670933412, 'resto': 621014259}, {'no': 621031231, 'now': '12/13/22(Tue)07:13:16', 'name': 'Anonymous', 'com': '<a href=""#p621029789"" class=""quotelink"">&gt;&gt;621029789</a><br>Yeah I agree, it was awful.<br>It&#039;s a shame, Halo up to that point was one of the greatest gaming experiences of my youth.', 'time': 1670933596, 'resto': 621014259}]",1670933596,,,
61,621007260,12/13/22(Tue)00:13:54,Anonymous,I still can&#039;t tell the difference.,hdr,.png,600,437,250,182,1670908434124485,1670908434,oyqRi6kE6lgrEYzt3Gr6WA==,22036,0,0,0,i-still-cant-tell-the-difference,1,75,8,70.0,8.0,"[{'no': 621030850, 'now': '12/13/22(Tue)07:05:51', 'name': 'Anonymous', 'com': '<a href=""#p621010525"" class=""quotelink"">&gt;&gt;621010525</a><br>What meme? <br><span class=""quote"">&gt;No I hate playing my vidya on the couch and on triple the size</span><br>Who gives a fuck about 10ms delay?', 'time': 1670933151, 'resto': 621007260}, {'no': 621030947, 'now': '12/13/22(Tue)07:07:39', 'name': 'Anonymous', 'com': 'Seems like a good thread to ask what are the things to look for if I want to buy a new monitor.<br>I want great colors, FPS don&#039;t matter (I&#039;m ok with 60), 1440p at most...<br>From what I read, Qled is the best but it also cost the more. HDR400 is a meme. Should have 1000 nits at least? Is HDMI is preferable to DVI?', 'time': 1670933259, 'resto': 621007260}, {'no': 621031010, 'now': '12/13/22(Tue)07:08:52', 'name': 'Anonymous', 'com': '<a href=""#p621007863"" class=""quotelink"">&gt;&gt;621007863</a><br>Which picture is the hdr picture? The right one?', 'time': 1670933332, 'resto': 621007260}, {'no': 621031083, 'now': '12/13/22(Tue)07:10:35', 'name': 'Anonymous', 'com': '<a href=""#p621030947"" class=""quotelink"">&gt;&gt;621030947</a><br>PC Monitor&#039;s suck for HDR, also sitting that close to such a bright screen wouldn&#039;t be good.<br><br>But yeah HDR400 is useless and HDMI 2.1 is fine, DP use to be a lot better when it was needed for 144hz.', 'time': 1670933435, 'resto': 621007260}, {'no': 621031230, 'now': '12/13/22(Tue)07:13:16', 'name': 'Anonymous', 'com': '<a href=""#p621014664"" class=""quotelink"">&gt;&gt;621014664</a><br>Maybe, but there is still a difference, though. The picture quality in a 2000 dollar tv will always be noticeable better than on a 1000 dollar tv.', 'time': 1670933596, 'resto': 621007260}]",1670933596,,,
62,621023148,12/13/22(Tue)04:34:29,Anonymous,"<span class=""quote"">&gt;scam citizen</span><br><span class=""quote"">&gt;x4 still broken/sucks</span><br><span class=""quote"">&gt;2d indie shit</span><br><span class=""quote"">&gt;whatever jank bethesda is working on</span><br>Liking space games shouldn&#039;t include so much suffering.",torpedo,.jpg,399,509,195,250,1670924069537352,1670924069,77SpO1IUk2iGQa3QmSQ1wg==,85990,0,0,0,space-games,1,41,8,36.0,5.0,"[{'no': 621029853, 'now': '12/13/22(Tue)06:45:47', 'name': 'Anonymous', 'com': '<a href=""#p621025983"" class=""quotelink"">&gt;&gt;621025983</a><br>What kind of cuck mentality is that? If you&#039;re not gonna do it, then the enemy will.', 'time': 1670931947, 'resto': 621023148}, {'no': 621029890, 'now': '12/13/22(Tue)06:46:40', 'name': 'Anonymous', 'com': '<a href=""#p621029601"" class=""quotelink"">&gt;&gt;621029601</a><br>it was fucking fun...<br>I remember playing with /vg/ and going pirating <br>we hit an asteroid on the way back and ships controls got ejected into space<br>I flew the ship back manually imputing control values into the flight computer <br>fucking fun.<br><br>we also had a clowncar space scooter for cheap and fast boarding like some space somali', 'filename': 'image', 'ext': '.png', 'w': 2254, 'h': 1306, 'tn_w': 125, 'tn_h': 72, 'tim': 1670932000225041, 'time': 1670932000, 'md5': 'EE0jJslL7EAPZeK7OmAHhg==', 'fsize': 2303117, 'resto': 621023148, 'm_img': 1}, {'no': 621029940, 'now': '12/13/22(Tue)06:47:48', 'name': 'Anonymous', 'com': '<a href=""#p621029890"" class=""quotelink"">&gt;&gt;621029890</a>', 'filename': 'image-2', 'ext': '.png', 'w': 2560, 'h': 1440, 'tn_w': 125, 'tn_h': 70, 'tim': 1670932068721906, 'time': 1670932068, 'md5': 'laZipa0Vbk/RGbCn7tSy6w==', 'fsize': 381978, 'resto': 621023148}, {'no': 621030605, 'now': '12/13/22(Tue)07:00:39', 'name': 'Anonymous', 'com': '<a href=""#p621025983"" class=""quotelink"">&gt;&gt;621025983</a><br><br>Janeway did. She&#039;s beam a torpedo up your ass if she though she could do it.', 'filename': 'Toepedo', 'ext': '.webm', 'w': 512, 'h': 384, 'tn_w': 125, 'tn_h': 93, 'tim': 1670932839429604, 'time': 1670932839, 'md5': 'ueGrt1I7Z03YVXmT5MzSpQ==', 'fsize': 1771161, 'resto': 621023148}, {'no': 621031229, 'now': '12/13/22(Tue)07:13:15', 'name': 'Anonymous', 'com': 'recently tried out ixion because it has SPACE and i thought it was a comfy space builder...it wasn&#039;t. i dont think these builders are my thing desu...not really clicking with me', 'time': 1670933595, 'resto': 621023148}]",1670933595,,SPACE GAMES,
63,621024481,12/13/22(Tue)05:01:51,Anonymous,"<span class=""quote"">&gt;Meanwhile, at the RPG starting /v/illage...</span>",1649096299601,.png,1024,1024,250,250,1670925711896775,1670925711,0d0oTcvqFrnGryqRtyv/XA==,1857499,0,0,0,meanwhile-at-the-rpg-starting-village,1,48,17,43.0,15.0,"[{'no': 621029907, 'now': '12/13/22(Tue)06:47:12', 'name': 'Anonymous', 'com': 'Who killed my fucking rats?? It&#039;s impossible to keep pet rats with adventurers around, I hid them in the fucking BASEMENT and you fuckers still found and slaughtered them. Fuck you guys<br>Pic rel was my favourite one, and it&#039;s gone now because of murderhobo trash like you', 'filename': '1606153861283', 'ext': '.jpg', 'w': 1080, 'h': 1440, 'tn_w': 93, 'tn_h': 125, 'tim': 1670932032734938, 'time': 1670932032, 'md5': 'f66KpOtZEXmAU5t/v9Mxyg==', 'fsize': 81984, 'resto': 621024481, 'm_img': 1}, {'no': 621029986, 'now': '12/13/22(Tue)06:48:51', 'name': 'Anonymous', 'com': '<a href=""#p621029907"" class=""quotelink"">&gt;&gt;621029907</a><br>Sorry but the fighters guild told me to kill your rats', 'time': 1670932131, 'resto': 621024481}, {'no': 621030143, 'now': '12/13/22(Tue)06:52:01', 'name': 'Anonymous', 'com': '<a href=""#p621029261"" class=""quotelink"">&gt;&gt;621029261</a><br>right? that shit looks badass as fuck. putting a claymore where the disc should be is peak design.', 'time': 1670932321, 'resto': 621024481}, {'no': 621030549, 'now': '12/13/22(Tue)06:59:28', 'name': 'Anonymous', 'com': '<span class=""quote"">&gt;Go through dungeon</span><br><span class=""quote"">&gt;Fix up all the traps</span><br><span class=""quote"">&gt;Leave</span><br>Eat shit losers', 'filename': 'Devilish', 'ext': '.jpg', 'w': 600, 'h': 760, 'tn_w': 98, 'tn_h': 125, 'tim': 1670932768398888, 'time': 1670932768, 'md5': 'L+XCsTEIXv/rtwD0yKSGZg==', 'fsize': 60487, 'resto': 621024481}, {'no': 621031223, 'now': '12/13/22(Tue)07:13:11', 'name': 'Anonymous', 'com': '<a href=""#p621027064"" class=""quotelink"">&gt;&gt;621027064</a><br>Give me your delicious girlfriend for three nights for this single, game-changing spell, MCvck. Do not mind the child in the upcoming months', 'time': 1670933591, 'resto': 621024481}]",1670933591,,,
64,621027236,12/13/22(Tue)05:55:48,Anonymous,"What are some good games for a low-end PC? The most graphically intense games I can run without problems are BF3 and Far Cry 3.<br><br>My fave games are Dishonored 1, DMC3, Cry of Fear, Spellforce 1, Payday 2, Borderlands 2, League of Legends, Disco Elysium and Monster Hunter.",1670285448823664,.jpg,2400,1778,250,185,1670928948996954,1670928948,kUx1zwBkhAHip3fAQne23g==,378756,0,0,0,what-are-some-good-games-for-a-lowend-pc-the-most,1,13,1,8.0,1.0,"[{'no': 621029214, 'now': '12/13/22(Tue)06:33:05', 'name': 'Anonymous', 'com': '<a href=""#p621028006"" class=""quotelink"">&gt;&gt;621028006</a><br>Tall. Dark. Handsome. Strangers.', 'time': 1670931185, 'resto': 621027236}, {'no': 621029263, 'now': '12/13/22(Tue)06:34:07', 'name': 'Anonymous', 'com': '<a href=""#p621028006"" class=""quotelink"">&gt;&gt;621028006</a><br>in the current year?<br>probably each other desu', 'time': 1670931247, 'resto': 621027236}, {'no': 621029359, 'now': '12/13/22(Tue)06:36:04', 'name': 'Anonymous', 'com': '<a href=""#p621029263"" class=""quotelink"">&gt;&gt;621029263</a><br>KEK', 'time': 1670931364, 'resto': 621027236}, {'no': 621029691, 'now': '12/13/22(Tue)06:42:32', 'name': 'Anonymous', 'com': '<a href=""#p621028006"" class=""quotelink"">&gt;&gt;621028006</a><br>equine, canine', 'time': 1670931752, 'resto': 621027236}, {'no': 621031224, 'now': '12/13/22(Tue)07:13:11', 'name': 'Anonymous', 'com': '<a href=""#p621028006"" class=""quotelink"">&gt;&gt;621028006</a><br>Anyone and anything except white men', 'time': 1670933591, 'resto': 621027236}]",1670933591,1.0,,
