,no,now,name,sub,com,filename,ext,w,h,tn_w,tn_h,tim,time,md5,fsize,resto,bumplimit,imagelimit,semantic_url,custom_spoiler,replies,images,omitted_posts,omitted_images,last_replies,last_modified,trip,filedeleted
112,41843381,11/22/22(Tue)07:10:02,Anonymous,,Ritsuko is old and busted btw,1847288255,.jpg,850.0,1200.0,177.0,250.0,1669119002160470.0,1669119002,nLiuD+TFhPaU7PmlH+pisg==,703503.0,0,0,0,ritsuko-is-old-and-busted-btw,1,52,20,47.0,16.0,"[{'no': 41996258, 'now': '12/08/22(Thu)05:08:09', 'name': 'Anonymous', 'com': '<a href=""#p41993697"" class=""quotelink"">&gt;&gt;41993697</a><br>She can whip me anytime', 'time': 1670494089, 'resto': 41843381}, {'no': 42003225, 'now': '12/08/22(Thu)20:51:55', 'name': 'Anonymous', 'filename': '1670550714974', 'ext': '.jpg', 'w': 850, 'h': 1200, 'tn_w': 88, 'tn_h': 125, 'tim': 1670550715139004, 'time': 1670550715, 'md5': 'ABA3beyLGMMzVUmwG0OoNA==', 'fsize': 178588, 'resto': 41843381}, {'no': 42006722, 'now': '12/09/22(Fri)07:57:05', 'name': 'Anonymous', 'filename': '1670590626241', 'ext': '.jpg', 'w': 850, 'h': 638, 'tn_w': 125, 'tn_h': 93, 'tim': 1670590625459247, 'time': 1670590625, 'md5': 'hs6tKXMC85Ens30vHWkt+w==', 'fsize': 79472, 'resto': 41843381}, {'no': 42010067, 'now': '12/09/22(Fri)15:20:46', 'name': 'Anonymous', 'filename': '11463ee43e8851813909cc879857e9df', 'ext': '.jpg', 'w': 954, 'h': 1424, 'tn_w': 83, 'tn_h': 125, 'tim': 1670617246426013, 'time': 1670617246, 'md5': 'kwxy3wcZcY2DmQ5P6MnBGg==', 'fsize': 188773, 'resto': 41843381}, {'no': 42012570, 'now': '12/09/22(Fri)21:15:28', 'name': 'Anonymous', 'filename': '1670638506578', 'ext': '.jpg', 'w': 850, 'h': 1202, 'tn_w': 88, 'tn_h': 125, 'tim': 1670638528823889, 'time': 1670638528, 'md5': 'Fir+HQeek84m75AD/CvSwA==', 'fsize': 75650, 'resto': 41843381}]",1670638528,,
113,41779501,11/15/22(Tue)09:27:24,Anonymous,,YUKIHO HAS NOW HER OWN THREAD!,__hagiwara_yukiho_idolmaster_and_1_more_drawn_by_darutanyan1023__f8b398c3542c4810e68b2849633d2a9a,.jpg,2500.0,3905.0,160.0,250.0,1668522444370877.0,1668522444,0Aegm4VwriAPw7vLqJ1YRQ==,3378458.0,0,0,0,yukiho-has-now-her-own-thread,1,87,29,82.0,28.0,"[{'no': 41996271, 'now': '12/08/22(Thu)05:11:02', 'name': 'Anonymous', 'com': '<a href=""#p41987768"" class=""quotelink"">&gt;&gt;41987768</a><br>What is wrong?', 'time': 1670494262, 'resto': 41779501}, {'no': 42003192, 'now': '12/08/22(Thu)20:47:00', 'name': 'Anonymous', 'com': '<a href=""#p41990260"" class=""quotelink"">&gt;&gt;41990260</a><br>What the fuck is that thing flying in the background?', 'time': 1670550420, 'resto': 41779501}, {'no': 42006619, 'now': '12/09/22(Fri)07:45:26', 'name': 'Anonymous', 'filename': '1670589924282', 'ext': '.jpg', 'w': 850, 'h': 1350, 'tn_w': 78, 'tn_h': 125, 'tim': 1670589926672470, 'time': 1670589926, 'md5': 'BjbNhOgt98QessxRQrfvQg==', 'fsize': 163345, 'resto': 41779501}, {'no': 42010029, 'now': '12/09/22(Fri)15:17:17', 'name': 'Anonymous', 'com': '<a href=""#p42006619"" class=""quotelink"">&gt;&gt;42006619</a><br>me on right', 'time': 1670617037, 'resto': 41779501}, {'no': 42012555, 'now': '12/09/22(Fri)21:12:54', 'name': 'Anonymous', 'com': '<a href=""#p42010029"" class=""quotelink"">&gt;&gt;42010029</a><br>Slut', 'time': 1670638374, 'resto': 41779501}]",1670638374,,
114,42012537,12/09/22(Fri)21:10:17,Anonymous,Otoboke Beaver,Do you like Otoboke beaver?<br><br>https://youtu.be/fkWfFXnLpYg<br><br>https://www.otobokebeaver.com/,otoboke,.jpg,1200.0,800.0,250.0,166.0,1670638217324341.0,1670638217,vZJbkoH+2nGVEsCYWGYzFQ==,360332.0,0,0,0,otoboke-beaver,1,0,0,,,,1670638217,,
115,41782712,11/15/22(Tue)17:30:28,Anonymous,,"Oh Miki, what a pity, you don&#039;t understand.<br>You take me by the heart when you take me by the hand.",1d86764d5b3f5a4be2e277780e422856,.png,1000.0,1000.0,250.0,250.0,1668551428450083.0,1668551428,xPnkqQ4stPRz4YEK769lDw==,920215.0,0,0,0,oh-miki-what-a-pity-you-dont-understand,1,77,19,72.0,19.0,"[{'no': 41996495, 'now': '12/08/22(Thu)05:52:17', 'name': 'Anonymous', 'com': '<a href=""#p41996231"" class=""quotelink"">&gt;&gt;41996231</a><br>to cum deep inside so <br><br>if you have a short dick some might come out when you pull out and takane will get preggo', 'time': 1670496737, 'resto': 41782712}, {'no': 42003287, 'now': '12/08/22(Thu)20:59:29', 'name': 'Anonymous', 'com': '<a href=""#p41996495"" class=""quotelink"">&gt;&gt;41996495</a><br>Well I can&#039;t change my small pp so might as well go in raw and hard with Takane.', 'time': 1670551169, 'resto': 41782712}, {'no': 42006611, 'now': '12/09/22(Fri)07:43:56', 'name': 'Anonymous', 'com': '<a href=""#p41992895"" class=""quotelink"">&gt;&gt;41992895</a><br>So you like Miki?', 'time': 1670589836, 'resto': 41782712}, {'no': 42010023, 'now': '12/09/22(Fri)15:16:45', 'name': 'Anonymous', 'com': '<a href=""#p42006611"" class=""quotelink"">&gt;&gt;42006611</a><br>yes', 'time': 1670617005, 'resto': 41782712}, {'no': 42012531, 'now': '12/09/22(Fri)21:09:33', 'name': 'Anonymous', 'com': '<a href=""#p41993455"" class=""quotelink"">&gt;&gt;41993455</a><br>Why?', 'time': 1670638173, 'resto': 41782712}]",1670638173,,
116,41563788,10/24/22(Mon)04:07:05,Anonymous,Amami Haruka,Does she still deserves a thread or she&#039;s too old?,FeJyCQFaYAAUu60,.jpg,1260.0,2048.0,153.0,250.0,1666598825650893.0,1666598825,vRG6Uj9ZC6MprPNQ5q7/mA==,160037.0,0,0,0,amami-haruka,1,223,78,218.0,75.0,"[{'no': 42006869, 'now': '12/09/22(Fri)08:18:32', 'name': 'Anonymous', 'com': '<a href=""#p42005586"" class=""quotelink"">&gt;&gt;42005586</a><br>very meaty', 'time': 1670591912, 'resto': 41563788}, {'no': 42006886, 'now': '12/09/22(Fri)08:21:05', 'name': 'Anonymous', 'com': 'i want to lick haruka&#039;s sweat and stroke her ribbon in that order', 'time': 1670592065, 'resto': 41563788}, {'no': 42010050, 'now': '12/09/22(Fri)15:19:06', 'name': 'Anonymous', 'filename': '172598edb979c598bd7028f6507b5a75', 'ext': '.jpg', 'w': 600, 'h': 800, 'tn_w': 93, 'tn_h': 125, 'tim': 1670617146953457, 'time': 1670617146, 'md5': 'faTtAOt/DRSfd/VllFQYvw==', 'fsize': 208054, 'resto': 41563788}, {'no': 42010208, 'now': '12/09/22(Fri)15:34:15', 'name': 'Anonymous', 'filename': '1659328203301', 'ext': '.jpg', 'w': 1000, 'h': 1027, 'tn_w': 121, 'tn_h': 125, 'tim': 1670618055542219, 'time': 1670618055, 'md5': 'CXu+nI+tvtFKElGVoNwszw==', 'fsize': 196849, 'resto': 41563788}, {'no': 42012421, 'now': '12/09/22(Fri)20:50:33', 'name': 'Anonymous', 'filename': '1653111550341', 'ext': '.png', 'w': 1574, 'h': 2048, 'tn_w': 96, 'tn_h': 125, 'tim': 1670637033120907, 'time': 1670637033, 'md5': 'eQcjzJ4sPyyoAfDRJp5VvA==', 'fsize': 1851870, 'resto': 41563788}]",1670637033,,
117,41843306,11/22/22(Tue)07:02:37,Anonymous,,One for Mano!,mano1062,.jpg,850.0,1140.0,186.0,250.0,1669118557954495.0,1669118557,muDHwTBqG7/dp0E+COydjQ==,114987.0,0,0,0,one-for-mano,1,49,20,44.0,19.0,"[{'no': 42003202, 'now': '12/08/22(Thu)20:48:41', 'name': 'Anonymous', 'com': '<a href=""#p41996280"" class=""quotelink"">&gt;&gt;41996280</a><br>Cute feet', 'time': 1670550521, 'resto': 41843306}, {'no': 42006710, 'now': '12/09/22(Fri)07:55:59', 'name': 'Anonymous', 'filename': '1670590560269', 'ext': '.jpg', 'w': 850, 'h': 1241, 'tn_w': 85, 'tn_h': 125, 'tim': 1670590559902889, 'time': 1670590559, 'md5': 'yKQuuCbOqqjXypAEiVKyOg==', 'fsize': 96701, 'resto': 41843306}, {'no': 42006732, 'now': '12/09/22(Fri)07:58:08', 'name': 'Anonymous', 'com': '<a href=""#p42006710"" class=""quotelink"">&gt;&gt;42006710</a><br>mmmm breeze', 'time': 1670590688, 'resto': 41843306}, {'no': 42010035, 'now': '12/09/22(Fri)15:17:59', 'name': 'Anonymous', 'com': '<a href=""#p41991278"" class=""quotelink"">&gt;&gt;41991278</a><br>is that true?', 'time': 1670617079, 'resto': 41843306}, {'no': 42012334, 'now': '12/09/22(Fri)20:38:43', 'name': 'Anonymous', 'com': 'Mano a Mano', 'time': 1670636323, 'resto': 41843306}]",1670636323,,
118,41994597,12/07/22(Wed)22:32:30,Anonymous,,"Reminder that reimu is in a normal relationship because she doesn&#039;t care what anyone else thinks, while sanae fucks kids because she is too scared of what people might think of her (but still wants to get fucked silly)",1670126821557797,.jpg,850.0,638.0,250.0,187.0,1670470350119801.0,1670470350,yyUsI+WaQccMVNVzmKKT4A==,95100.0,0,0,0,reminder-that-reimu-is-in-a-normal-relationship,1,12,5,7.0,5.0,"[{'no': 42008005, 'now': '12/09/22(Fri)10:47:38', 'name': 'Anonymous', 'com': '<a href=""#p41997429"" class=""quotelink"">&gt;&gt;41997429</a><br>Jewish society deeply disapproves of not infringing children rights', 'time': 1670600858, 'resto': 41994597}, {'no': 42008037, 'now': '12/09/22(Fri)10:49:51', 'name': 'Anonymous', 'com': '<a href=""#p41997429"" class=""quotelink"">&gt;&gt;41997429</a><br>Caring about that kind of thing is a western issue', 'time': 1670600991, 'resto': 41994597}, {'no': 42008059, 'now': '12/09/22(Fri)10:51:50', 'name': 'Anonymous', 'com': '<a href=""#p42008005"" class=""quotelink"">&gt;&gt;42008005</a><br>I can&#039;t believe Sanae circumcises...', 'time': 1670601110, 'resto': 41994597}, {'no': 42008085, 'now': '12/09/22(Fri)10:53:51', 'name': 'Anonymous', 'com': '<a href=""#p42008059"" class=""quotelink"">&gt;&gt;42008059</a><br>Sanae Goldberg...', 'time': 1670601231, 'resto': 41994597}, {'no': 42012105, 'now': '12/09/22(Fri)20:08:52', 'name': 'Anonymous', 'com': '<a href=""#p41994597"" class=""quotelink"">&gt;&gt;41994597</a><br>The boy on the right is a make-a-wish kid. Sanae is a hero, actually.', 'time': 1670634532, 'resto': 41994597}]",1670634532,,
119,42010951,12/09/22(Fri)17:05:02,Anonymous,,It&#039;s Metal Momoko.,1661408034670826,.jpg,2048.0,2048.0,250.0,250.0,1670623502696113.0,1670623502,wed2hJOCkxcqVSMuIp+Nhw==,637563.0,0,0,0,its-metal-momoko,1,1,0,,,"[{'no': 42012092, 'now': '12/09/22(Fri)20:07:21', 'name': 'Anonymous', 'com': 'She&#039;s back!', 'time': 1670634441, 'resto': 42010951}]",1670634441,,
120,41625209,10/30/22(Sun)16:00:55,Anonymous,,Why are they a trio?,__imaizumi_kagerou_sekibanki_and_wakasagihime_touhou_drawn_by_miyakouji__87b6a3253cdbf3e077b0a06d818d1541,.jpg,1074.0,985.0,250.0,229.0,1667160055822520.0,1667160055,aM/56PsnwI6FwQNfHU/9YA==,757141.0,0,0,0,why-are-they-a-trio,1,209,106,204.0,104.0,"[{'no': 42008953, 'now': '12/09/22(Fri)12:38:38', 'name': 'Anonymous', 'com': 'I am scared of the wolf.', 'time': 1670607518, 'resto': 41625209}, {'no': 42009927, 'now': '12/09/22(Fri)15:05:00', 'name': 'Anonymous', 'com': 'Six! I repeat, six big tits!', 'time': 1670616300, 'resto': 41625209}, {'no': 42010712, 'now': '12/09/22(Fri)16:33:47', 'name': 'Anonymous', 'com': '1/2<br>The underwater room was a mess, artifacts, gemstones and knick-nacks lay haphazardly around the room.<br>Wakasagihime was dashing around her treasury in a frantic panic talking to herself<br>&quot;Where could it be, I can&#039;t go without it.&quot;<br>As another gemstone fell discarded to the sea floor she swam to the top of the room.<br>&quot;Of course, how could I forget.&quot;<br>As she dug a small box from a hidden alcove and popped it open she let out a deep sigh.<br>&quot;There you are, oh Kagerou is absolutely going to love you!&quot;<br>With the treasure safely in her hands the mermaid princess makes a mad dash out of her home, leaving it looking like a school of sharks had passed through it.<br><br>Up top a lonely werewolf is sitting with her head resting in her hands.<br>&quot;Where could she be, there is no way she would miss today of all days&quot;<br>It was the monthly outing with Waggy-chan and she was late, Kagerou had started to grow worried.<br>Closing her eyes she tried not to imagine what could have happened to her.<br>&quot;Sometimes she just gets distracted, it&#039;s fine... I&#039;m sure&quot;<br>As if on que with a big splash Wakasagihime bursts out of the lake, landing half on land with a big smile on her face and holding her hands out to the werewolf.<br>&quot;Kagerou-chan! I hope I didn&#039;t keep you waiting&quot;<br>With a jolt Kagerou jumps up and after a moment grasps down at the princesses hands<br>&quot;Of course you did, what were you doing this time? Did you get lost sorting out the trash from the mansion again?&quot;<br>&quot;No, they don&#039;t let me swim around there anymore. I was actually looking for this!&quot;<br>She pushes the little gemstone to Kagerous hand.<br>&quot;Isn&#039;t it pretty? The blue shade truly shines in the sunlight!&quot;<br>Opening her hands Kagerou finds herself holding a blue gemstone with a thin necklace attacked to it.<br>Holding it up so the light catches the stone, it shines brightly showing its almost flawless surface.<br>&quot;It really is, I guess it makes sense to dress up for today&quot;<br>Accepting the reason for the princess lateness Kagerou hands the gemstone back.<br>&quot;Of course, I need to keep up appearances after all&quot;<br>Taking the gemstone back Wakasagihime ties it around her neck and then holds her hands out once more<br>&quot;Shall we go then?&quot;<br>With a practiced ease Kagerou takes her hands and lifts her up on her shoulders and starts walking towards the wooden barrel located a little ways behind her.<br>Waggy happily examines her gemstone as she is carried over and dumped into the barrel which is filled with water that overflows as she enters.<br>&quot;There we go, where shall her highness visit today then?&quot;<br>Kagerou asks with a mocking bow as she takes her place behind the barrel.<br>&quot;I was thinking of paying a visit to my good friend Kagerou-chan today, in the bamboo forest&quot; <br>Waggy replies with a sly smile.<br>&quot;As she whisesh&quot;<br>And with that, Kagerou begins to push the barrel. With the wheels installed at the bottom it begins to roll relatively easily, even with all the weight from the water and the princess inside it.', 'filename': '1639300969985', 'ext': '.png', 'w': 770, 'h': 700, 'tn_w': 125, 'tn_h': 113, 'tim': 1670621627983757, 'time': 1670621627, 'md5': 'OkJdtDLGqTD9jh/TpGXWOA==', 'fsize': 497269, 'resto': 41625209}, {'no': 42010725, 'now': '12/09/22(Fri)16:34:52', 'name': 'Anonymous', 'com': '<a href=""#p42010712"" class=""quotelink"">&gt;&gt;42010712</a><br>2/2<br>The trip to the bamboo forest is calm so both it&#039;s no surprise when both of them get engrossed in talking and realize a little too late, they are lost in the bamboo forest.<br>&quot;I&#039;m sure we passed that rock twice already!&quot;<br>Shouts the princess of the barrel as she peeks her head out.<br>&quot;I&#039;m sure we did, I think we are a bit more than lost at this point.&quot;<br>Kagerou sighs, the heavy barrel starting to take its toll on her after such a long time of walking.<br>&quot;Maybe we should stop for a while and ask for help?&quot;<br>&quot;From who, the only other residents of the bamboo forest are the rabbits and the occasional fairies. And I&#039;v never seen anyone but the rabbits leave the mansion. &quot;<br>&quot;Well, how bout her?&quot;<br>Following the pointing finger of her friend Kagerou notices a human sitting on a rock in the distance.<br>&quot;They are likely just as lost as we are, but not like we have much to loose at this point&quot;<br>Heading over Wakasagihime shouts a greeting at the figure.<br>&quot;Hello! How do you do, we would like to ask for directions.&quot;<br>The human had been watching them approach for a little while now, the barrel not being exactly stealthy.<br>&quot;Hello there, you sure aren&#039;t what I was expecting. When I noticed someone was lost in the bamboos I was sure it was another human&quot;<br>The human stands up and starts walking towards them<br>&quot;Sure I can give you two directions, but how did you get lost in your own backyard?&quot;<br>Pointing at Kagerou the human raises an eyebrow<br>&quot;It&#039;s not my fault, it&#039;s this damn magical barrier. I usually keep out of this area completely!&quot;<br>Kagerou snaps back, trying to hide the blush on her cheeks.<br>&quot;Oh thank you very much! I really should give you a reward, would this gem do?&quot;<br>Waggy turns around a couple times looking for a suitable offering and settles on the gem hanging from her neck.<br>&quot;no no, I could never. This is kinda like a hobby for me, and besides I could not break such a nice matching set of jewels apart.&quot;<br>With slight confusion Wakasagihime looks back at her hand seeing only one gem.<br>&quot;But I only have one of these, what do you mean?&quot;<br>&quot;Isn&#039;t it a pair for the red ruby on her brooch?&quot;<br>With that both Kagerou and Wakasagihime turn to look at the jewel hanging from her hood<br>&quot;Oh! It is, isn&#039;t! Hehe, we watch Kagerou-chan!&quot;<br>Like a bunch of school girls both of them start swooning over their gems and comparing them, while Mokou leads them out of the forest in relative silence.<br>&quot;And here you go, try not to wander aimlessly in the bamboo forest again&quot;<br>&quot;Thank you so very much Mokou-chan, I hope we can visit your some other day!&quot;<br>&quot;I&#039;m sorry for the trouble, I didn&#039;t mean to make you push her barrel as well&quot;<br>&quot;It&#039;s fine, now get going it&#039;s starting to get late&quot;<br>With a wave they part ways and Kagerou brings Waggy back to her lake with no further adventures.<br><br>When they reach the lake, both of them are so exhausted they promise to do this again in a week as usual and wish each other a good night as they part ways.<br>Waggy swims back to her home, and finds it in the same state as she left it.<br>An issue for tomorrow, she is far too tired to start setting up her collection again.<br>For now she finds the most visible spot in her cave and displays her newest greatest treasure so she can always look at it, to remember this day and her dear friend.<br><br><s>I&#039;m sorry, I just wanted to write something in honor of the lost fish thread.</s>', 'filename': '1666729341431', 'ext': '.webm', 'w': 640, 'h': 480, 'tn_w': 125, 'tn_h': 93, 'tim': 1670621692938687, 'time': 1670621692, 'md5': 'pd/VvVXFye7LM2g8BVgG8Q==', 'fsize': 1830656, 'resto': 41625209}, {'no': 42011752, 'now': '12/09/22(Fri)19:30:52', 'name': 'Anonymous', 'com': '<a href=""#p42010712"" class=""quotelink"">&gt;&gt;42010712</a><br><a href=""#p42010725"" class=""quotelink"">&gt;&gt;42010725</a><br>Cute fish', 'time': 1670632252, 'resto': 41625209}]",1670632252,,
121,41746648,11/11/22(Fri)23:14:49,Anonymous,,woooooooooooooooooooo~!,91a983ccafc514321c85d338fb6914ca,.png,887.0,889.0,249.0,250.0,1668226489303247.0,1668226489,kamDzK/FFDIchdM4+2kUyg==,468288.0,0,0,0,woooooooooooooooooooo,1,140,70,135.0,68.0,"[{'no': 41995858, 'now': '12/08/22(Thu)03:05:42', 'name': 'Anonymous', 'com': '<a href=""#p41882509"" class=""quotelink"">&gt;&gt;41882509</a><br>Ah yes, a fellow long knife enjoyer, you must come quick...', 'time': 1670486742, 'resto': 41746648}, {'no': 41998451, 'now': '12/08/22(Thu)09:57:12', 'name': 'Anonymous', 'com': '<a href=""#p41995782"" class=""quotelink"">&gt;&gt;41995782</a><br>why it doesnt matter?<br>if i were alive i would be put in hell by the yama for bascially suicide because i wanted to talk with ghosts<br>if im dead, im dead, i wait for reincarnation', 'time': 1670511432, 'resto': 41746648}, {'no': 42001568, 'now': '12/08/22(Thu)17:00:25', 'name': 'Anonymous', 'filename': 'RDT_20221024_2008148057761693991501019', 'ext': '.jpg', 'w': 549, 'h': 499, 'tn_w': 125, 'tn_h': 113, 'tim': 1670536825713986, 'time': 1670536825, 'md5': '5wyjl0F4dOqoRl1DY0/86w==', 'fsize': 39986, 'resto': 41746648}, {'no': 42008657, 'now': '12/09/22(Fri)12:05:02', 'name': 'Anonymous', 'com': '<a href=""#p42001568"" class=""quotelink"">&gt;&gt;42001568</a><br>Both are fine', 'time': 1670605502, 'resto': 41746648}, {'no': 42011616, 'now': '12/09/22(Fri)19:13:44', 'name': 'Anonymous', 'com': 'should i take her hand?<br>where am i going to go?', 'filename': '102247112_p0', 'ext': '.jpg', 'w': 1448, 'h': 2048, 'tn_w': 88, 'tn_h': 125, 'tim': 1670631224298539, 'time': 1670631224, 'md5': 'nyHa5sKAI7raW1h9ErCO8Q==', 'fsize': 400039, 'resto': 41746648}]",1670631224,,
122,41726013,11/09/22(Wed)16:56:18,Anonymous,774inc thread,774inc thread Kanon-chan edition,FS8nwgCaUAECpqa,.jpg,1082.0,1070.0,250.0,247.0,1668030978143342.0,1668030978,w3GvctSW9Re67pxquHmFhg==,89029.0,0,0,0,774inc-thread,1,260,80,255.0,77.0,"[{'no': 42005544, 'now': '12/09/22(Fri)05:17:18', 'name': 'Anonymous', 'com': 'I didn&#039;t realise how much I&#039;ve missed YOMS..........', 'time': 1670581038, 'resto': 41726013}, {'no': 42005897, 'now': '12/09/22(Fri)06:18:44', 'name': 'Anonymous', 'com': 'they finally have noses', 'filename': 'snapshot', 'ext': '.jpg', 'w': 1280, 'h': 720, 'tn_w': 125, 'tn_h': 70, 'tim': 1670584724208234, 'time': 1670584724, 'md5': '45CYeI7IyiLIx8gdd811ew==', 'fsize': 277741, 'resto': 41726013}, {'no': 42007495, 'now': '12/09/22(Fri)09:50:25', 'name': 'Anonymous', 'filename': 'FO3m_6WaIAAwMnZ', 'ext': '.jpg', 'w': 1013, 'h': 1300, 'tn_w': 97, 'tn_h': 125, 'tim': 1670597425886306, 'time': 1670597425, 'md5': 'ZjDILOn2QWa+w8eVREZ55A==', 'fsize': 378741, 'resto': 41726013}, {'no': 42007860, 'now': '12/09/22(Fri)10:32:48', 'name': 'Anonymous', 'com': '<a href=""#p42005544"" class=""quotelink"">&gt;&gt;42005544</a><br>Yuri-On-Mary-Sex?', 'time': 1670599968, 'resto': 41726013}, {'no': 42011522, 'now': '12/09/22(Fri)18:59:22', 'name': 'Anonymous', 'filename': 'FZuHkGaUcAErP7S@shio_midori', 'ext': '.jpg', 'w': 1594, 'h': 2221, 'tn_w': 89, 'tn_h': 125, 'tim': 1670630362163776, 'time': 1670630362, 'md5': '8mmW701AtMJhd/7oW7Y4Yg==', 'fsize': 517624, 'resto': 41726013}]",1670630362,,
123,41940972,12/02/22(Fri)13:51:24,Anonymous,Gravure Thread,"Previous <a href=""/jp/thread/41878954#p41878954"" class=""quotelink"">&gt;&gt;41878954</a><br><br>Post Japanese gravure here (remember this is a SFW board)<br><br>A gravure idol (グラビアアイドル gurabia aidoru), often abbreviated to gradol (グラドル guradoru), is a Japanese female model who primarily models on magazines, especially men&#039;s magazines, photobooks or DVDs. Gravure idols appear in a wide range of photography styles and genres. Their photos are largely aimed at male audiences with poses or activities intended to be provocative or suggestive, generally accentuated by an air of playfulness and innocence rather than aggressive sexuality. Although gravure models may sometimes wear clothing that exposes most of their body, they seldom appear fully nude.<br><br><span class=""quote"">&gt;Sales Rankings</span><br>https://www.amazon.co.jp/gp/bestsel<wbr>lers/dvd/680358011/ref=zg_bs_nav_d_<wbr>2_562030<br>http://www.dmm.com/mono/dvd/-/ranki<wbr>ng/=/mode=idol/term=monthly/<br>http://c.manifo.jp/<br><br><span class=""quote"">&gt;What&#039;s New</span><br>https://www.amazon.co.jp/gp/new-rel<wbr>eases/dvd/680358011/ref=zg_bs_tab_t<wbr>_bsnr<br>http://www.cdjapan.co.jp/products?t<wbr>erm.cat_id=UB-06-01&amp;order=rel&amp;page=<wbr>1&amp;opt.on_preorder=0&amp;opt.on_released<wbr>=1&amp;range.rel=&amp;term.release_month=<br>http://gradoldynamite.blog.fc2.com/<wbr><br><br><span class=""quote"">&gt;Profile Info</span><br>https://ja.wikipedia.org/wiki/Categ<wbr>ory:%E3%82%B0%E3%83%A9%E3%83%93%E3%<wbr>82%A2%E3%82%A2%E3%82%A4%E3%83%89%E3<wbr>%83%AB<br>http://www.gravure-idol-ranking.com<wbr>/",fumie54♥,.jpg,1785.0,2523.0,176.0,250.0,1670007084559540.0,1670007084,s46FRh8Ewh2z35/T+9mBxw==,264837.0,0,1,0,gravure-thread,1,322,156,317.0,154.0,"[{'no': 42013320, 'now': '12/09/22(Fri)23:22:29', 'name': 'Anonymous', 'com': '<a href=""#p42012616"" class=""quotelink"">&gt;&gt;42012616</a><br>I already have it, I don&#039;t have to wait 10 days<br>and yes, it should be on blu-ray', 'filename': 'cap', 'ext': '.png', 'w': 955, 'h': 535, 'tn_w': 125, 'tn_h': 70, 'tim': 1670646149548484, 'time': 1670646149, 'md5': '5fYpnlj1Kq4fSFtROkuwLA==', 'fsize': 521327, 'resto': 41940972}, {'no': 42013542, 'now': '12/10/22(Sat)00:01:48', 'name': 'Anonymous', 'com': 'SEX WITH AIKA UNDER THE INTENT OF REPRODUCTION!!!', 'time': 1670648508, 'resto': 41940972}, {'no': 42013569, 'now': '12/10/22(Sat)00:07:31', 'name': 'Anonymous', 'com': '<a href=""#p42013542"" class=""quotelink"">&gt;&gt;42013542</a><br>this but umi, hina, and nagasawa', 'time': 1670648851, 'resto': 41940972}, {'no': 42014783, 'now': '12/10/22(Sat)04:55:55', 'name': 'Anonymous', 'com': '<a href=""#p41965275"" class=""quotelink"">&gt;&gt;41965275</a><br>oaaaa :DD', 'time': 1670666155, 'resto': 41940972}, {'no': 42014903, 'now': '12/10/22(Sat)05:21:19', 'name': 'Anonymous', 'com': 'ooohh Umi oooOOOOHH', 'filename': '221210 Shinonome Umi 東雲 うみ (instagram @umi_portrait) (1)', 'ext': '.jpg', 'w': 2139, 'h': 2869, 'tn_w': 93, 'tn_h': 125, 'tim': 1670667679652757, 'time': 1670667679, 'md5': 'DJpGU3yj/Agfikbk5ImlwA==', 'fsize': 1962246, 'resto': 41940972}]",1670667679,,
