,no,now,name,com,filename,ext,w,h,tn_w,tn_h,tim,time,md5,fsize,resto,bumplimit,imagelimit,semantic_url,custom_spoiler,replies,images,omitted_posts,omitted_images,last_replies,last_modified,sub,trip
33,41934181,12/01/22(Thu)18:18:51,Anonymous,"Previous thread <span class=""deadlink"">&gt;&gt;41771368</span>",1657079247095,.jpg,2160,1440,250,166,1669936731755971,1669936731,sqOvlVr5JzTrCXkksQ9YuA==,1013820,0,0,0,hp-upfront-helloproject-general-thread-735,1,215,141,210.0,136.0,"[{'no': 42038493, 'now': '12/12/22(Mon)17:13:36', 'name': 'Anonymous', 'filename': 'FjsiPcmVIAALi9G', 'ext': '.jpg', 'w': 2047, 'h': 1597, 'tn_w': 125, 'tn_h': 97, 'tim': 1670883216325266, 'time': 1670883216, 'md5': 'KSLJ48aod6hD1Br59U501Q==', 'fsize': 424856, 'resto': 41934181}, {'no': 42038856, 'now': '12/12/22(Mon)18:00:08', 'name': 'Anonymous', 'filename': 'o1080144015215518529', 'ext': '.jpg', 'w': 1080, 'h': 1440, 'tn_w': 93, 'tn_h': 125, 'tim': 1670886008100227, 'time': 1670886008, 'md5': '16OeGUoAAiDetgjhtC1CsA==', 'fsize': 429067, 'resto': 41934181}, {'no': 42040897, 'now': '12/12/22(Mon)23:06:33', 'name': 'Anonymous', 'com': 'bring back blond idols', 'filename': '319532397_5708488909188448_8233971599341599064_n', 'ext': '.jpg', 'w': 1440, 'h': 1800, 'tn_w': 100, 'tn_h': 125, 'tim': 1670904393284813, 'time': 1670904393, 'md5': 'FltAx+7ZpniFSvchxGJwKw==', 'fsize': 362892, 'resto': 41934181}, {'no': 42041914, 'now': '12/13/22(Tue)03:59:49', 'name': 'Anonymous', 'filename': '1644984845658', 'ext': '.jpg', 'w': 1108, 'h': 1478, 'tn_w': 93, 'tn_h': 125, 'tim': 1670921989011570, 'time': 1670921989, 'md5': 'dPoauKeGbjGChRrWPWpJrw==', 'fsize': 242233, 'resto': 41934181}, {'no': 42042534, 'now': '12/13/22(Tue)06:19:05', 'name': 'Anonymous', 'com': 'https://www.youtube.com/watch?v=v9C<wbr>8327-BJE', 'filename': '八木栞VS小野瑞歩', 'ext': '.jpg', 'w': 1920, 'h': 1080, 'tn_w': 125, 'tn_h': 70, 'tim': 1670930345783373, 'time': 1670930345, 'md5': 'Q2ERd/axldunJTV96fGdZg==', 'fsize': 1801246, 'resto': 41934181}]",1670930345,/h!p/ - Up-Front &amp; Hello!Project General Thread #735,
34,42041343,12/13/22(Tue)01:09:52,Anonymous,"Information for live shows and viewings:<br>https://lovelive-anime.jp<br>https://twitter.com/LoveLive_staff<br><br>SNS and concerts:<br>https://rentry.org/llst-2022-new<br><br>https://discord.gg/6As836P9rN<br><br>Previous:<a href=""/jp/thread/42019631#p42019631"" class=""quotelink"">&gt;&gt;42019631</a>",1670887742885883,.jpg,1080,1080,250,250,1670911792458141,1670911792,LsfuKZUnLJ2BVQYGsNAZZA==,309275,0,0,0,love-live-seiyuu-thread-759,1,8,3,3.0,1.0,"[{'no': 42041487, 'now': '12/13/22(Tue)01:44:44', 'name': 'Anonymous', 'com': '<a href=""#p42041343"" class=""quotelink"">&gt;&gt;42041343</a><br><a href=""#p42041371"" class=""quotelink"">&gt;&gt;42041371</a><br><br>Young paypal looks like georgia meloni in her 20s', 'time': 1670913884, 'resto': 42041343}, {'no': 42041568, 'now': '12/13/22(Tue)02:10:32', 'name': 'Anonymous', 'filename': 'bd9086afe913c31221ed4fdb2af01dee (1)', 'ext': '.jpg', 'w': 235, 'h': 366, 'tn_w': 80, 'tn_h': 125, 'tim': 1670915432651862, 'time': 1670915432, 'md5': 'R/x3SeE8x3YQlUWI940q1Q==', 'fsize': 11744, 'resto': 42041343}, {'no': 42041815, 'now': '12/13/22(Tue)03:26:53', 'name': 'Anonymous', 'com': '<a href=""#p42041343"" class=""quotelink"">&gt;&gt;42041343</a><br>paywhore!', 'time': 1670920013, 'resto': 42041343}, {'no': 42041912, 'now': '12/13/22(Tue)03:59:07', 'name': 'Anonymous', 'com': '<a href=""#p42041343"" class=""quotelink"">&gt;&gt;42041343</a><br><a href=""#p42041371"" class=""quotelink"">&gt;&gt;42041371</a><br>Being a child idol must be hell', 'time': 1670921947, 'resto': 42041343}, {'no': 42042498, 'now': '12/13/22(Tue)06:13:50', 'name': 'Anonymous', 'filename': 'paywink', 'ext': '.jpg', 'w': 1314, 'h': 1080, 'tn_w': 125, 'tn_h': 102, 'tim': 1670930030865668, 'time': 1670930030, 'md5': '9RFjKjOQmpXh/Hfro58Gog==', 'fsize': 140091, 'resto': 42041343}]",1670930030,Love Live! Seiyuu Thread #759,
35,42027977,12/11/22(Sun)15:18:49,VNTS,"Visual Novel translation status<br><br><br>Aiyoku No Eustia - 100% Translated and edited and TLC<br>Akatsuki no Goei ~Principal-tachi no Kyuujitsu~ - 100% translated, <br>Amagami - 2nd public Beta patch released<br>Aonatsu Line - Translation starting<br>Baku Ane 2 - Prologue, Ritsuka translated, Route (30% edited), Wakana 2/8 Lessons, Mashiro 3/8 lessions, Miran 1/5 events and Sayaka 1/3 events translated, Ritsuka lessons patch released<br>Bishoujo Mangekyou -Kami ga Tsukuritamouta Shoujo-tachi- - 30% translated<br>Caucasus - 100% translated, image editing complete, editing, QC/TLC , and playtesting remain<br>Chaos;Head Noah - 100% translated TLC, and edited, targeting a late October release<br>Chicchakunai Mon - 100% translated and 32.39% edited<br><span class=""quote"">&gt;Chusingura 46+1 - 13893/82770 (16.79%) lines translated</span><br>Clearworld - Translation starting<br>Dragon Knight 4 - Being translated<br><span class=""quote"">&gt;Eimmy to Yobanaide - Partly retranslated patch released</span><br>Fate/Extra CCC - 100% translated<br>GinIro Haruka  - Mizuha route &quot;Translation finished. Second pass finished. Editing underway.&quot;, Yuzuki route fully translated and second pass finished, aiming for a Christmas release for Mizuha and early 2023 release for Yuzuki<br><span class=""quote"">&gt;H2O √ after and another Complete story Edition - 46530/73547 lines translated (63.3%)</span><br>Hakuchuumu no Aojashin - Restoration patch focused on Case 1 released, work being done on the rest of the untranslated scenes<br>Haruka na Sora  - Sora and Yahiro routes translated, Total: TL 66% TLC 41% ED 1%<br><span class=""quote"">&gt;Hyouryuu Kangoku Chronos - 75% translated, 75% edited, 75% partial patch released</span><br>If My Heart Had Wings: Snow Presents - 23% translated<br><span class=""quote"">&gt;Ikisugi! M Lesson - Released</span><br>Junketsu Megami-Sama - 2nd Alpha patch released, Astarotte route finishing up<br>Kareshi Inai Reki = Nenrei - Translated 19442 / 58264 text lines (33.37%)<br>Koukan no Toriko-Tachi - Prologue 100%, Common Route 90% translated<br>Kud Wafter - 23,835 / 31,579 (73.5%) lines translated<br>Kusarihime ~Euthanasia~ - &quot;Translation finished. Rest of the processes ongoing.&quot;<br>Lover Able - 100% translated and edited, 2928/34467 lines approved (8.49%)<br>Maji Koi A-5 - Partial patch with Full Margit + Hound Route released, 100% translated<br>Manakashi no Yuri wa Akaku Somaru - 54% translated<br>Miagete Goran, Yozora no Hoshi o - 1 of 4 routes translation finished for the restoration patch<br>Nursery Rhyme - 100% translated and edited, text insertion 100% complete, testing ongoing<br><span class=""quote"">&gt;Oppai no Ouja 48  - Released</span><br>Planetarian Snow Globe - 25% translated<br>Pure Pure - 100% translated, needs proofreading, partial patch released, all routes have been inserted<br>Rui wa Tomo o Yobu - 19.32% translated, 4.20% edited<br>Sen no Hatou, Tsukisome no Kouki - Both original and fan disc     100% translated, in need of editing<br>Shin Hayarigami - 48% translated<br><span class=""quote"">&gt;Shin Koihime Musou - 100% translated, 61% (66954/108888) edited</span><br>Shirotsume Yubiwa  - 100% translated, 50% beta patch released<br>Tenshi no Inai 12-gatsu -  Common, Touko, and Sakaki routes fully translated, Asuna route 20% complete<br><span class=""quote"">&gt;Tsukihime - A piece of blue glass moon  - Arcueid route patch released, Ciel route 100% translated, days 3 through 9 edited and days 3 through 7 finalized</span><br>Umi kara Kuru Mono - 14/138 scripts translated<br>Watashi wa Kyou Koko de Shinimasu - 100% translated, 99% (2254/2265) lines edited, 36% (826/2265) lines QC<br>Walkure Romanze - Common + Celia + Lisa routes patch released<br>Yosuga no Sora - Translation finished, editing and TLC ongoing, Total: TL 100% TLC 64% ED 27%, Common + Kazuha routes fully edited<br><br><br>Official work<br><br>MangaGamer<br>How a Healthy Hentai Administers Public Service - December 15th release<br>Ciconia - Phase 1 Released<br>Hadaka Shitsuji fandisc - Picked up<br>Shiei no Sona-Nyl - Translation is complete, heading to scripting<br>Rance IX - &quot;out of beta and in post-beta scripting&quot;<br>Rance X - 47% translated, 5% edited<br>Luckydog1 - Picked up<br>The Pillagers of Raillore - Fully translated and edited, being prepared for beta<br>Rance 03 - Picked up<br>Lkyt - Fully translated and edited, being prepared for beta<br>Funbag Fantasy 4 - 33% translated, 32% edited<br>Nightmare x Onmyouji - Paradox of Forbiddance - Fully translated and edited<br>Eve of the 12th Month - 88% translated, 5% edited<br><br>JAST<br>Tokyo Necro - Fully translated and edited, 2022 release<br>Sorcerer&#039;s Choice - Angel or Demon? - Scheduled for release &quot;a few months from now&quot;<br>Sumaga-  Slow progress ongoing<br>Katahane - Progress being made again<br>Django - Not actively making progress<br>Gears of Dragoon: Fragments of a New Era - In Testing<br><span class=""quote"">&gt;Tokyo Hero Project - Translation finished</span><br>Machine Child - Still being developed<br>Onigokko! Fandisc - Picked up<br><br>Age titles<br>Kiminozo - &quot;We will have more information on this title at a later date. Please look forward to it.&quot;<br>Schwarzesmarken - Through Greenlight<br><br>Frontwing<br>Sharin no Kuni - Delayed for 3-6 months to resolve swapping resolution problem",12-11 releases,.png,1147,310,250,67,1670789929458501,1670789929,oq2elB+Jkm+UxjZ1BpA35Q==,626771,0,0,0,visual-novel-translation-status,1,23,3,18.0,1.0,"[{'no': 42037032, 'now': '12/12/22(Mon)14:07:59', 'name': 'Anonymous', 'com': '<a href=""#p42035605"" class=""quotelink"">&gt;&gt;42035605</a><br>Which is why I will not pay for anything they do', 'time': 1670872079, 'resto': 42027977}, {'no': 42038761, 'now': '12/12/22(Mon)17:47:09', 'name': 'Anonymous', 'com': '<a href=""#p42035605"" class=""quotelink"">&gt;&gt;42035605</a><br>Which is why I will pay for everything they do.', 'time': 1670885229, 'resto': 42027977}, {'no': 42040126, 'now': '12/12/22(Mon)21:04:52', 'name': 'Anonymous', 'com': 'still waiting...', 'filename': 'file', 'ext': '.png', 'w': 671, 'h': 70, 'tn_w': 125, 'tn_h': 13, 'tim': 1670897092448257, 'time': 1670897092, 'md5': 'NG683ovW+xGe9jurZ3BzYw==', 'fsize': 8197, 'resto': 42027977}, {'no': 42040230, 'now': '12/12/22(Mon)21:19:16', 'name': 'Anonymous', 'com': '<a href=""#p42040126"" class=""quotelink"">&gt;&gt;42040126</a><br>You can wait a few more years.', 'filename': '1650983613122', 'ext': '.png', 'w': 1200, 'h': 197, 'tn_w': 125, 'tn_h': 20, 'tim': 1670897956600740, 'time': 1670897956, 'md5': 'fhiDDm32h8Bulew0iDoQNg==', 'fsize': 93057, 'resto': 42027977}, {'no': 42042483, 'now': '12/13/22(Tue)06:11:36', 'name': 'Anonymous', 'com': '<a href=""#p42035605"" class=""quotelink"">&gt;&gt;42035605</a><br>They should follow the Venus Blood formula.', 'time': 1670929896, 'resto': 42027977}]",1670929896,,!!UcDDlzwANFs
36,42039578,12/12/22(Mon)19:39:52,Anonymous,"This general is for discussing Japanese Mobile Games that don&#039;t have their own dedicated general elsewhere. Occasionally some Chinese and Korean games will be discussed too.<br><br><span class=""quote"">&gt;List of frequently discussed games and guides for them:</span><br>https://docs.google.com/document/d/<wbr>1zMS5UYhWpWtxSla0dt3TutdezA1zWSL0pz<wbr>I3i9vwjTo<br><br>Read this Pastebin about how to get around region locks for both Android and iOS:<br>https://pastebin.com/kdChFL5n<br><br>Previous: <a href=""/jp/thread/41919947#p41919947"" class=""quotelink"">&gt;&gt;41919947</a>",1669434869453090,.jpg,2800,1752,250,156,1670891992704787,1670891992,Li7AIDGEK6dA7706KSfSZw==,1234858,0,0,0,mbgg-mobage-general-193,1,46,3,41.0,2.0,"[{'no': 42042341, 'now': '12/13/22(Tue)05:46:17', 'name': 'Anonymous', 'com': 'Whats available on PC besides genshit?<br>I hate using phones to play games.', 'time': 1670928377, 'resto': 42039578}, {'no': 42042348, 'now': '12/13/22(Tue)05:47:39', 'name': 'Anonymous', 'com': '<a href=""#p42042341"" class=""quotelink"">&gt;&gt;42042341</a><br>Dolphin Wave', 'time': 1670928459, 'resto': 42039578}, {'no': 42042367, 'now': '12/13/22(Tue)05:52:25', 'name': 'Anonymous', 'com': '<a href=""#p42042335"" class=""quotelink"">&gt;&gt;42042335</a><br><span class=""quote"">&gt;and the CPU isn&#039;t retarded</span><br>Which has never happened, so yeah. Turn based also tends to be a lot slower, at least autobattlers can proc actions simultaneously.', 'time': 1670928745, 'resto': 42039578}, {'no': 42042378, 'now': '12/13/22(Tue)05:55:16', 'name': 'Anonymous', 'com': '<a href=""#p42042348"" class=""quotelink"">&gt;&gt;42042348</a><br>Eh, seems retarded enough. I will give it a shot.', 'time': 1670928916, 'resto': 42039578}, {'no': 42042477, 'now': '12/13/22(Tue)06:11:13', 'name': 'Anonymous', 'com': '<a href=""#p42042378"" class=""quotelink"">&gt;&gt;42042378</a><br>If you like it, join us on /vmg/', 'filename': 'Fi9QvCPUcAA8svu', 'ext': '.jpg', 'w': 1920, 'h': 1080, 'tn_w': 125, 'tn_h': 70, 'tim': 1670929873771451, 'time': 1670929873, 'md5': 'Edu3a2Fq6LB4lW80DGAEvg==', 'fsize': 918352, 'resto': 42039578}]",1670929873,/mbgg/ - Mobage General #193,
37,42042163,12/13/22(Tue)04:58:17,Anonymous,Thread dedicated to the awoo,1670758771549293,.jpg,849,1200,176,250,1670925497362025,1670925497,KcjtOTimMkOcC/DNuGwtjg==,129756,0,0,0,momiji-thread,1,1,1,,,"[{'no': 42042398, 'now': '12/13/22(Tue)05:59:43', 'name': 'Anonymous', 'com': 'Low caste bhangi tengu<br>Fucktoy for upper caste male tengu<br>belongs to the sewers', 'filename': '51b78585b9148', 'ext': '.png', 'w': 256, 'h': 256, 'tn_w': 125, 'tn_h': 125, 'tim': 1670929183010612, 'time': 1670929183, 'md5': 'QxnaZtMktH4eKExvh5/U3w==', 'fsize': 94613, 'resto': 42042163}]",1670929183,Momiji thread,
38,41906830,11/28/22(Mon)18:41:45,Anonymous,"Your sins have been judged. You are not worthy of heaven, but you aren&#039;t bad enough to send to hell either. Therefor, you shall instead serve me here in Higan as an intern until I decide to whether you should be reincarnated or sent off to the netherworld.",9d9e4732be2b3599bf2c06907927f657,.jpg,1200,1200,250,250,1669678905179692,1669678905,PK3wjw8fCiv/uDrSvtajvw==,1050047,0,0,0,your-sins-have-been-judged-you-are-not-worthy-of,1,79,28,74.0,27.0,"[{'no': 42023530, 'now': '12/11/22(Sun)05:05:25', 'name': 'Anonymous', 'com': '<a href=""#p42010141"" class=""quotelink"">&gt;&gt;42010141</a><br>fucking fake and gay<br>Marisa would never high five with Alice', 'time': 1670753125, 'resto': 41906830}, {'no': 42026021, 'now': '12/11/22(Sun)11:08:14', 'name': 'Anonymous', 'com': '<a href=""#p42023530"" class=""quotelink"">&gt;&gt;42023530</a><br>sorry anon but you&#039;re wrong last time me and Marisa were laughing about alice behind her back she said she acts all friendly all the time but always has some hand sanitizer to use after she high fives her', 'time': 1670774894, 'resto': 41906830}, {'no': 42031661, 'now': '12/12/22(Mon)00:26:55', 'name': 'Anonymous', 'com': 'Bumpies', 'time': 1670822815, 'resto': 41906830}, {'no': 42040940, 'now': '12/12/22(Mon)23:23:32', 'name': 'Anonymous', 'com': '<a href=""#p42003366"" class=""quotelink"">&gt;&gt;42003366</a><br>Should have known getting a dolphin pool would be over the limit.', 'filename': '__shiki_eiki_and_onozuka_komachi_touhou_drawn_by_ginnkei__f884954b28f78d408fe2d4dbb69b7c62', 'ext': '.jpg', 'w': 1880, 'h': 2272, 'tn_w': 103, 'tn_h': 125, 'tim': 1670905412309235, 'time': 1670905412, 'md5': '+ISVSyj3jUCP4tTbtpt8Yg==', 'fsize': 3679840, 'resto': 41906830}, {'no': 42042393, 'now': '12/13/22(Tue)05:59:15', 'name': 'Anonymous', 'com': 'There is nothing I want more than Eiki.<br>I want to tell Eiki she&#039;s the best every single day.', 'time': 1670929155, 'resto': 41906830}]",1670929155,,
39,41969618,12/05/22(Mon)11:12:00,Anonymous,yaaaaaaaaawn ugh,1668683438963,.jpg,1050,1050,250,250,1670256720256830,1670256720,FCt4ZzqiTKcZpbTcDdOF8A==,393825,0,0,0,yaaaaaaaaawn-ugh,1,34,17,29.0,15.0,"[{'no': 42036837, 'now': '12/12/22(Mon)13:42:42', 'name': 'Anonymous', 'com': 'Does anyone have that image of orin begging on her knees for you to please kill yourself?', 'time': 1670870562, 'resto': 41969618}, {'no': 42037252, 'now': '12/12/22(Mon)14:33:28', 'name': 'Anonymous', 'com': '<a href=""#p42036837"" class=""quotelink"">&gt;&gt;42036837</a><br><a href=""/jp/thread/41991228#p42020455"" class=""quotelink"">&gt;&gt;42020455</a>', 'time': 1670873608, 'resto': 41969618}, {'no': 42038235, 'now': '12/12/22(Mon)16:38:43', 'name': 'Anonymous', 'com': 'Does anyone have Orin', 'time': 1670881123, 'resto': 41969618}, {'no': 42038297, 'now': '12/12/22(Mon)16:46:25', 'name': 'Anonymous', 'com': '<a href=""#p42038235"" class=""quotelink"">&gt;&gt;42038235</a><br>Yeah', 'filename': 'IMG_20210121_091856', 'ext': '.jpg', 'w': 2722, 'h': 3629, 'tn_w': 93, 'tn_h': 124, 'tim': 1670881585759206, 'time': 1670881585, 'md5': 'LABFR1aHz2VJ58QFwSbP8w==', 'fsize': 1155298, 'resto': 41969618}, {'no': 42042366, 'now': '12/13/22(Tue)05:52:15', 'name': 'Anonymous', 'filename': 'Fg9BEd_acAAtJef', 'ext': '.png', 'w': 509, 'h': 367, 'tn_w': 125, 'tn_h': 90, 'tim': 1670928735092378, 'time': 1670928735, 'md5': 'nJYuaX5anSrm6o/wqSi4gA==', 'fsize': 20925, 'resto': 41969618}]",1670928735,,
40,41904912,11/28/22(Mon)13:59:15,Anonymous,Other Touhou bunnies can stay here too,_seiran_da7df3c225a6f384bdaf68ae0d539df1,.jpg,1080,1440,187,250,1669661955402321,1669661955,DWhnleg6ATVGrNeygZfL2w==,1259542,0,0,0,seiran-thread,1,64,36,59.0,33.0,"[{'no': 42036106, 'now': '12/12/22(Mon)12:11:02', 'name': 'Anonymous', 'com': '<a href=""#p42026914"" class=""quotelink"">&gt;&gt;42026914</a><br><a href=""#p42030535"" class=""quotelink"">&gt;&gt;42030535</a><br>His chastity, money, and sanity', 'time': 1670865062, 'resto': 41904912}, {'no': 42041807, 'now': '12/13/22(Tue)03:23:36', 'name': 'Anonymous', 'com': 'Sunset with Seiran.', 'filename': '__seiran_touhou_drawn_by_kayon_touzoku__c7484cda4f71e109e5f2db4304ddbc0d', 'ext': '.jpg', 'w': 1532, 'h': 1728, 'tn_w': 110, 'tn_h': 125, 'tim': 1670919816503479, 'time': 1670919816, 'md5': 'e6XUE14CHyNIe+JMyWbsGA==', 'fsize': 1527312, 'resto': 41904912}, {'no': 42041949, 'now': '12/13/22(Tue)04:07:59', 'name': 'Anonymous', 'com': '<a href=""#p42041807"" class=""quotelink"">&gt;&gt;42041807</a><br>Thats one tiny bun', 'time': 1670922479, 'resto': 41904912}, {'no': 42042302, 'now': '12/13/22(Tue)05:35:33', 'name': 'Anonymous', 'com': '<a href=""#p42041949"" class=""quotelink"">&gt;&gt;42041949</a><br>Made to size to fit comfortably on your lap while you work.', 'filename': 'FTCWeQPVIAAHCq5', 'ext': '.jpg', 'w': 2894, 'h': 4093, 'tn_w': 88, 'tn_h': 125, 'tim': 1670927733839804, 'time': 1670927733, 'md5': 'I3Sdyn3CptR11hX8RNW1hA==', 'fsize': 881401, 'resto': 41904912}, {'no': 42042349, 'now': '12/13/22(Tue)05:47:58', 'name': 'Anonymous', 'com': '<a href=""#p42041807"" class=""quotelink"">&gt;&gt;42041807</a><br>She is made for handholding, cuddling, and successful entrepreneurship.', 'filename': '1659837635819', 'ext': '.png', 'w': 1269, 'h': 1536, 'tn_w': 103, 'tn_h': 125, 'tim': 1670928478909641, 'time': 1670928478, 'md5': 'luYML8T3UFSoxUNYC//1NQ==', 'fsize': 3371272, 'resto': 41904912}]",1670928478,Seiran thread,
41,41962259,12/04/22(Sun)17:58:35,Anonymous,"Snowman Edition<br><br>BJD thread, primarily for vinyl dolls with an anime aesthetic.<br>Previous Thread: <a href=""/jp/thread/41776413#p41776413"" class=""quotelink"">&gt;&gt;41776413</a><br>Resin Dolls Thread: Dead Again (but you can post here, too.)<br>Fashion/Other Dolls Thread: <a href=""//boards.4channel.org/toy/thread/10161375#p10161375"" class=""quotelink"">&gt;&gt;&gt;/toy/10161375</a><br><br>FAQs and Links<br>New Guide: anime-dolls.moe<br>Old Guide: dollfaq.buyfags.moe<br>bjd.booru.org<br>Sewing pattern books:<br>https://mega.nz/folder/iFd3wapa#B70<wbr>grHUe4xsTkLU_s8Ag_Q<br>Doll Calendar Project: https://docs.google.com/spreadsheet<wbr>s/d/1abqGwCjvHI0DalA13tDVTwtgYyXPgG<wbr>1UXJ98AcNCeQk/edit?usp=sharing<br>BJD Telegram:<br>https://t.me/BallJointDolls<br><br>Current Photo Challenge: Anon&#039;s Doll Calendar<br>Previous Photo Challenge: Lazy Day<br>If your doll is for fucking, go to /ona/:<br><a href=""/jp/thread/41920271#p41920271"" class=""quotelink"">&gt;&gt;41920271</a><br>(The thing you&#039;re looking for is made by Six House Dolls.)",cold,.jpg,1371,2048,167,250,1670194715002700,1670194715,IBQkJITapn2vlXblhbFg7A==,349122,0,0,0,snowman-edition,1,120,62,115.0,59.0,"[{'no': 42040281, 'now': '12/12/22(Mon)21:25:32', 'name': 'Anonymous', 'com': '<a href=""#p42039466"" class=""quotelink"">&gt;&gt;42039466</a>', 'filename': '20221212_212456', 'ext': '.jpg', 'w': 1840, 'h': 1384, 'tn_w': 125, 'tn_h': 94, 'tim': 1670898332349635, 'time': 1670898332, 'md5': 'DA+E8gBgxyGrKazkbByNoA==', 'fsize': 871036, 'resto': 41962259}, {'no': 42040547, 'now': '12/12/22(Mon)22:04:08', 'name': 'Anonymous', 'com': '<a href=""#p42038954"" class=""quotelink"">&gt;&gt;42038954</a><br>I can feel my wallet drying up', 'time': 1670900648, 'resto': 41962259}, {'no': 42041130, 'now': '12/13/22(Tue)00:16:20', 'name': 'Anonymous', 'com': '<a href=""#p42040547"" class=""quotelink"">&gt;&gt;42040547</a><br>That&#039;s just this hobby in a nutshell.', 'filename': '1644762050529', 'ext': '.jpg', 'w': 1944, 'h': 2592, 'tn_w': 93, 'tn_h': 125, 'tim': 1670908580274246, 'time': 1670908580, 'md5': 'bhccbiz+AQt2n+GLHvLgnw==', 'fsize': 1660209, 'resto': 41962259}, {'no': 42041182, 'now': '12/13/22(Tue)00:26:04', 'name': 'Anonymous', 'com': '<a href=""#p42040281"" class=""quotelink"">&gt;&gt;42040281</a><br>Doll goals desu', 'time': 1670909164, 'resto': 41962259}, {'no': 42042259, 'now': '12/13/22(Tue)05:25:51', 'name': 'Anonymous', 'com': 'After a very long time, i finally decided to stop looking and start buying some dolls. <br>I&#039;m looking at making custom heads, wigs and clothes.<br>Are there any sewing guides for piconeemo P bodies and pureneemo reflection 1/6? For faceup are there specific products?', 'filename': 'photo_2022-12-13_11-13-53', 'ext': '.jpg', 'w': 960, 'h': 1280, 'tn_w': 93, 'tn_h': 125, 'tim': 1670927151477952, 'time': 1670927151, 'md5': '/Q5P7kmQ4VV3PlIDQtucFg==', 'fsize': 141207, 'resto': 41962259}]",1670927151,,
42,41687043,11/05/22(Sat)21:48:27,Anonymous,"Post photos of Japan, no links or anything because I&#039;ve literally never made this thread before and don&#039;t know how this works,but after months of nothing I refuse to let this general die again.",78145209_463916517597254_3889686773130854400_n,.jpg,1440,1800,200,250,1667699307446531,1667699307,f7sAF6aDWvpmUXVKwPhYMg==,360124,0,0,0,post-photos-of-japan-no-links-or-anything-because,1,218,112,213.0,110.0,"[{'no': 42032352, 'now': '12/12/22(Mon)04:00:27', 'name': 'Anonymous', 'com': '<a href=""#p42030554"" class=""quotelink"">&gt;&gt;42030554</a><br>America sided with Hitler at first.', 'time': 1670835627, 'resto': 41687043}, {'no': 42037637, 'now': '12/12/22(Mon)15:22:06', 'name': 'Anonymous', 'com': '<a href=""#p42032352"" class=""quotelink"">&gt;&gt;42032352</a><br>well america was founded on racist ideology so it was only natural', 'time': 1670876526, 'resto': 41687043}, {'no': 42038554, 'now': '12/12/22(Mon)17:22:49', 'name': 'Anonymous', 'filename': 'FjSVnakVQAA3r2j', 'ext': '.jpg', 'w': 2048, 'h': 1366, 'tn_w': 125, 'tn_h': 83, 'tim': 1670883769918575, 'time': 1670883769, 'md5': 'Mojdpw0IooQx+NYeU/e9eQ==', 'fsize': 426084, 'resto': 41687043}, {'no': 42038784, 'now': '12/12/22(Mon)17:50:32', 'name': 'Anonymous', 'com': '<a href=""#p42038554"" class=""quotelink"">&gt;&gt;42038554</a><br>Makoto Shinkai tracing as we speak.', 'time': 1670885432, 'resto': 41687043}, {'no': 42042222, 'now': '12/13/22(Tue)05:14:02', 'name': 'Anonymous', 'com': 'Narai-juku', 'filename': 'Narai5-1024x683', 'ext': '.jpg', 'w': 1024, 'h': 683, 'tn_w': 125, 'tn_h': 83, 'tim': 1670926442800103, 'time': 1670926442, 'md5': 'ty0Ae4NTgYnICBJNabf52g==', 'fsize': 214449, 'resto': 41687043}]",1670926442,日本の風景,
43,42032036,12/12/22(Mon)02:07:09,Anonymous,"https://twitter.com/aniki_z/status/<wbr>1602184533524508675<br>Today, we&#039;ve lost one more Aniki.",ANIKING,.jpg,1153,1730,166,250,1670828829140802,1670828829,IUUXV4bIsEN8ERciE37M/w==,131168,0,0,0,today-weve-lost-one-more-aniki,1,3,0,,,"[{'no': 42032130, 'now': '12/12/22(Mon)02:34:54', 'name': 'Anonymous', 'com': 'A legend. Rest in peace aniki.', 'time': 1670830494, 'resto': 42032036}, {'no': 42032341, 'now': '12/12/22(Mon)03:54:00', 'name': 'Anonymous', 'com': 'Fuck cancer.<br><br>RIP legend.', 'time': 1670835240, 'resto': 42032036}, {'no': 42042182, 'now': '12/13/22(Tue)05:04:20', 'name': 'Anonymous', 'com': 'https://www.youtube.com/watch?v=MR7<wbr>xA2JbNCQ', 'time': 1670925860, 'resto': 42032036}]",1670925860,,
