,no,now,name,sub,com,filename,ext,w,h,tn_w,tn_h,tim,time,md5,fsize,resto,bumplimit,imagelimit,semantic_url,custom_spoiler,replies,images,omitted_posts,omitted_images,last_replies,last_modified,trip,filedeleted
62,41931021,12/01/22(Thu)10:59:38,Anonymous,,"Hi. I like Keine. I think she&#039;s super cute, and I like the titty porn. I prefer blue Keine to ex-Keine, but they&#039;re both good. I think I&#039;m an outlier in that regard. Anyway, please teach me more about Keine so that I can appreciate her on a deeper level, and maybe write her/a story about her.",c70eeb519dd57f503501fdf74c30a806,.png,650.0,679.0,239.0,250.0,1669910378880992.0,1669910378,xw7rUZ3Vf1A1Af33TDCoBg==,256858.0,0,0,0,hi-i-like-keine-i-think-shes-super-cute-and-i,1,58,27,53.0,22.0,"[{'no': 42014072, 'now': '12/10/22(Sat)02:15:13', 'name': 'Anonymous', 'filename': '1629428488944', 'ext': '.jpg', 'w': 800, 'h': 1000, 'tn_w': 100, 'tn_h': 125, 'tim': 1670656513716261, 'time': 1670656513, 'md5': 'ezbecxPNK1iXx/SjUKl7pw==', 'fsize': 134149, 'resto': 41931021}, {'no': 42014100, 'now': '12/10/22(Sat)02:22:51', 'name': 'Anonymous', 'filename': '__kamishirasawa_keine_touhou_drawn_by_itomugi_kun__fcabff1ee15ec585c507f60062b700e2', 'ext': '.png', 'w': 650, 'h': 692, 'tn_w': 117, 'tn_h': 125, 'tim': 1670656971108131, 'time': 1670656971, 'md5': '/Kv/HuFexYXFB/YAYrcA4g==', 'fsize': 379856, 'resto': 41931021}, {'no': 42014162, 'now': '12/10/22(Sat)02:39:01', 'name': 'Anonymous', 'filename': '__kamishirasawa_keine_touhou_drawn_by_tuck__72f20b8a0979223a16416b85637ddcac', 'ext': '.jpg', 'w': 1498, 'h': 1032, 'tn_w': 125, 'tn_h': 86, 'tim': 1670657941814833, 'time': 1670657941, 'md5': '5rs5jzLoZBqpG1CMNPfOLQ==', 'fsize': 907533, 'resto': 41931021}, {'no': 42014175, 'now': '12/10/22(Sat)02:43:50', 'name': 'Anonymous', 'filename': '__kamishirasawa_keine_touhou_drawn_by_dada_dolce__4e7dda4c7bc9dbbeb6405802a9a83926', 'ext': '.jpg', 'w': 368, 'h': 750, 'tn_w': 61, 'tn_h': 125, 'tim': 1670658230797375, 'time': 1670658230, 'md5': 'LCgyuGXpNgtua8Yq9HqB6w==', 'fsize': 129399, 'resto': 41931021}, {'no': 42014420, 'now': '12/10/22(Sat)03:45:38', 'name': 'Anonymous', 'filename': '__kamishirasawa_keine_touhou_drawn_by_iwamoto_zerogo__c955fb7d81db9009650aa70fa4bc749c', 'ext': '.jpg', 'w': 530, 'h': 707, 'tn_w': 93, 'tn_h': 125, 'tim': 1670661938551795, 'time': 1670661938, 'md5': 'RP63ns+PCnwZcNxIusivgA==', 'fsize': 101340, 'resto': 41931021}]",1670661938,,
63,41975987,12/06/22(Tue)02:25:19,Anonymous,,Where is it?,1476252019857,.png,1150.0,1500.0,191.0,250.0,1670311519706168.0,1670311519,wdDTS0haWR60qjdnyi5tJg==,278728.0,0,0,0,where-is-it,1,13,3,8.0,3.0,"[{'no': 41995864, 'now': '12/08/22(Thu)03:08:07', 'name': 'Anonymous', 'com': '<a href=""#p41993090"" class=""quotelink"">&gt;&gt;41993090</a><br>Jp heritage.', 'time': 1670486887, 'resto': 41975987}, {'no': 42005104, 'now': '12/09/22(Fri)03:25:52', 'name': 'Anonymous', 'com': 'If the most exciting time of day never comes, then how is this no different than purgatory?', 'time': 1670574352, 'resto': 41975987}, {'no': 42005124, 'now': '12/09/22(Fri)03:32:07', 'name': 'Anonymous', 'com': '<a href=""#p42005104"" class=""quotelink"">&gt;&gt;42005104</a><br>purgatory cleanses you soul before salvation<br>in its current state, /jp/ is more like hell', 'time': 1670574727, 'resto': 41975987}, {'no': 42012058, 'now': '12/09/22(Fri)20:04:16', 'name': 'Anonymous', 'com': '<a href=""#p42005124"" class=""quotelink"">&gt;&gt;42005124</a><br>Too many teens on the jay.', 'time': 1670634256, 'resto': 41975987}, {'no': 42014417, 'now': '12/10/22(Sat)03:44:59', 'name': 'Anonymous', 'com': 'In my restless dreams, I see that png. Flanfly. You promised me you&#039;d post it again someday. But you never did. Well, I&#039;m alone there now... In our &#039;special thread&#039;... Waiting for you...', 'time': 1670661899, 'resto': 41975987}]",1670661899,,
64,41982082,12/06/22(Tue)17:25:17,Anonymous,Christmas 2hus,How do your 2hus look on Christmas?,chrismashu,.jpg,2383.0,2103.0,249.0,220.0,1670365517935103.0,1670365517,81xxF7UNiHjOe23aE4kVzQ==,977300.0,0,0,0,christmas-2hus,1,30,19,25.0,15.0,"[{'no': 42008183, 'now': '12/09/22(Fri)11:05:26', 'name': 'Anonymous', 'com': '<a href=""#p42007294"" class=""quotelink"">&gt;&gt;42007294</a><br>They have some awareness of the pop culture version.', 'filename': 'sopm-christmas', 'ext': '.png', 'w': 1361, 'h': 620, 'tn_w': 125, 'tn_h': 56, 'tim': 1670601926964640, 'time': 1670601926, 'md5': 'DCZCMlH7p4txOR7sscnvnQ==', 'fsize': 40068, 'resto': 41982082}, {'no': 42008830, 'now': '12/09/22(Fri)12:24:51', 'name': 'Anonymous', 'com': '<a href=""#p42007320"" class=""quotelink"">&gt;&gt;42007320</a><br>Because Christmas art is cute, I don&#039;t care if they&#039;d actually celebrate it or not.', 'time': 1670606691, 'resto': 41982082}, {'no': 42008923, 'now': '12/09/22(Fri)12:36:06', 'name': 'Anonymous', 'filename': '1662213519991', 'ext': '.png', 'w': 640, 'h': 480, 'tn_w': 125, 'tn_h': 93, 'tim': 1670607366535941, 'time': 1670607366, 'md5': 'VM0T+Oq9/Y4r3HWzBRBUEg==', 'fsize': 576760, 'resto': 41982082}, {'no': 42014346, 'now': '12/10/22(Sat)03:30:15', 'name': 'Anonymous', 'com': '<a href=""#p41984315"" class=""quotelink"">&gt;&gt;41984315</a><br>Suika Claus will leave alcohol in everyone&#039;s stocking!', 'filename': '__ibuki_suika_touhou_drawn_by_yanagi_nurikoboshi__88dbafbe01fbb54007da6612fbbada9f', 'ext': '.jpg', 'w': 900, 'h': 800, 'tn_w': 125, 'tn_h': 111, 'tim': 1670661015359267, 'time': 1670661015, 'md5': 'xLyOvcHuzi8tVH6/qbno1A==', 'fsize': 454698, 'resto': 41982082}, {'no': 42014411, 'now': '12/10/22(Sat)03:42:55', 'name': 'Anonymous', 'com': '<a href=""#p41982082"" class=""quotelink"">&gt;&gt;41982082</a>', 'filename': 'no more nuzzles uthh', 'ext': '.jpg', 'w': 850, 'h': 1065, 'tn_w': 99, 'tn_h': 125, 'tim': 1670661775167170, 'time': 1670661775, 'md5': 'OtcQLbAf898mT9tMuvO8CA==', 'fsize': 145744, 'resto': 41982082}]",1670661775,,
65,41554407,10/23/22(Sun)04:23:05,Anonymous,"Yoshika, Seiga, Tojiko, Futo, and Miko",I&#039;m very angrily making this thread because the Yoshika thread died. I have no choice but to make this bundled offering.,89feb4924e5b569fcaa224a086d64baf,.jpg,3884.0,1410.0,250.0,90.0,1666513385135921.0,1666513385,HWm61vqXWUn4aFaJNN780w==,906284.0,0,0,0,yoshika-seiga-tojiko-futo-and-miko,1,149,109,144.0,105.0,"[{'no': 41993787, 'now': '12/07/22(Wed)21:09:17', 'name': 'Anonymous', 'com': '<a href=""#p41554407"" class=""quotelink"">&gt;&gt;41554407</a><br>Okay.', 'time': 1670465357, 'resto': 41554407}, {'no': 41996169, 'now': '12/08/22(Thu)04:47:57', 'name': 'Anonymous', 'com': 'Road trip!', 'filename': '__toyosatomimi_no_miko_mononobe_no_futo_kaku_seiga_soga_no_tojiko_and_miyako_yoshika_touhou_drawn_by_user_ykeh5284__e2979da2652a83a2ed7bfe7613e83768', 'ext': '.png', 'w': 1181, 'h': 1748, 'tn_w': 84, 'tn_h': 125, 'tim': 1670492877420138, 'time': 1670492877, 'md5': '4pedomUqg6Lte/52E+g3aA==', 'fsize': 384472, 'resto': 41554407}, {'no': 42004320, 'now': '12/08/22(Thu)23:35:31', 'name': 'Anonymous', 'com': 'miko&#039;s thread died', 'filename': '__toyosatomimi_no_miko_touhou_drawn_by_furorida__b55fea8d03f28f4d04171c317715fb08', 'ext': '.png', 'w': 500, 'h': 699, 'tn_w': 89, 'tn_h': 125, 'tim': 1670560531556359, 'time': 1670560531, 'md5': 'tV/qjQPyj00EFxwxdxX7CA==', 'fsize': 221296, 'resto': 41554407}, {'no': 42009094, 'now': '12/09/22(Fri)12:57:17', 'name': 'Anonymous', 'com': 'They told Futo her drink was very hot but she didn&#039;t listen.', 'filename': 'sosakutofu-1600522022244610048-img1', 'ext': '.jpg', 'w': 1228, 'h': 868, 'tn_w': 125, 'tn_h': 88, 'tim': 1670608637909685, 'time': 1670608637, 'md5': '+u6xgMqtsC2/9EOkZg9B0Q==', 'fsize': 185243, 'resto': 41554407}, {'no': 42014395, 'now': '12/10/22(Sat)03:41:14', 'name': 'Anonymous', 'com': '<a href=""#p42004320"" class=""quotelink"">&gt;&gt;42004320</a><br>She made it to bump limit without derailment or rampant shit-flinging. That&#039;s a good end.', 'filename': '__toyosatomimi_no_miko_touhou_drawn_by_pipita__0b5787d33cb012f5324b2de1799a22e0', 'ext': '.jpg', 'w': 1658, 'h': 2048, 'tn_w': 101, 'tn_h': 125, 'tim': 1670661674037206, 'time': 1670661674, 'md5': 'PjtNzp5f+fOx+Qx2rVIz0w==', 'fsize': 212482, 'resto': 41554407}]",1670661674,,
66,42012664,12/09/22(Fri)21:30:45,Anonymous,,https://youtu.be/spJuVCEbSqU?t=5,eb3dc3a246d37d8e114380b572d174a7[1],.jpg,768.0,844.0,227.0,250.0,1670639445533015.0,1670639445,6z3DokbTfY4RQ4C1ctF0pw==,245614.0,0,0,0,,1,2,1,,,"[{'no': 42012676, 'now': '12/09/22(Fri)21:33:14', 'name': 'Anonymous', 'com': '<a href=""#p42012664"" class=""quotelink"">&gt;&gt;42012664</a><br>Me when I see Okina flower', 'time': 1670639594, 'resto': 42012664}, {'no': 42014387, 'now': '12/10/22(Sat)03:39:19', 'name': 'Anonymous', 'com': '<a href=""#p42012664"" class=""quotelink"">&gt;&gt;42012664</a><br>If you live somewhere like Southern California where there&#039;s a lot of this sort of stuff going on every morning you know it can be annoying, but a way to make it a lot better is pretend that it&#039;s Youmu outside instead of five Guatemalans who apparently arrived in the same single cab Tacoma.', 'filename': '__konpaku_youmu_and_konpaku_youmu_touhou_drawn_by_fjsmu__e2b833e5d5264d550a66497cfbf4e577', 'ext': '.jpg', 'w': 1227, 'h': 1920, 'tn_w': 79, 'tn_h': 125, 'tim': 1670661559465682, 'time': 1670661559, 'md5': '4rgz5dUmTVUKZkl8+/Tldw==', 'fsize': 1656326, 'resto': 42012664}]",1670661559,,
67,41961369,12/04/22(Sun)16:04:14,VNTS,,"Visual Novel translation status<br><br><br>Aiyoku No Eustia - 100% Translated and edited and TLC<br><span class=""quote"">&gt;Akatsuki no Goei ~Principal-tachi no Kyuujitsu~ - Prologue + Kyouka/Reika + Aya + Moe + Tsuki + Takanori Extra translated, Anzu 50% translated</span><br>Amagami - 2nd public Beta patch released<br>Aonatsu Line - Translation starting<br><span class=""quote"">&gt;Baku Ane 2 - Prologue, Ritsuka translated, Route (30% edited), Wakana 2/8 Lessons, Mashiro 3/8 lessions, Miran 1/5 events and Sayaka 1/3 events translated, Ritsuka lessons patch released</span><br>Bishoujo Mangekyou -Kami ga Tsukuritamouta Shoujo-tachi- - 30% translated<br>Caucasus - 100% translated, image editing complete, editing, QC/TLC , and playtesting remain<br>Chaos;Head Noah - 100% translated TLC, and edited, targeting a late October release<br>Chicchakunai Mon - 100% translated and 32.39% edited<br><span class=""quote"">&gt;Chusingura 46+1 - 13547/82770 (16.37%) lines translated</span><br>Clearworld - Translation starting<br>Dragon Knight 4 - Being translated<br>Fate/Extra CCC - 100% translated<br>GinIro Haruka  - Mizuha route &quot;Translation finished. Second pass finished. Editing underway.&quot;, Yuzuki route fully translated and second pass finished, aiming for a Christmas release for Mizuha and early 2023 release for Yuzuki<br><span class=""quote"">&gt;H2O √ after and another Complete story Edition - 41685/73547 lines translated (56.7%)</span><br>Hakuchuumu no Aojashin - Restoration patch focused on Case 1 released, work being done on the rest of the untranslated scenes<br>Haruka na Sora  - Sora and Yahiro routes translated, Total: TL 66% TLC 41% ED 1%<br><span class=""quote"">&gt;Hyouryuu Kangoku Chronos - 75% translated, 75% edited, 35% proofread, partial patch released</span><br>If My Heart Had Wings: Snow Presents - 23% translated<br>Ikisugi! M Lesson - Common+Mizue+Maki Routes patch released, 100% of Nana&#039;s route translated and in editing with a early to mid December release<br>Junketsu Megami-Sama - 2nd Alpha patch released, Astarotte route finishing up<br>Kareshi Inai Reki = Nenrei - Translated 19442 / 58264 text lines (33.37%)<br><span class=""quote"">&gt;Koukan no Toriko-Tachi - Prologue 100%, Common Route 90% translated</span><br>Kud Wafter - 23,835 / 31,579 (73.5%) lines translated<br>Kusarihime ~Euthanasia~ - &quot;Translation finished. Rest of the processes ongoing.&quot;<br>Lover Able - 100% translated and edited, 2928/34467 lines approved (8.49%)<br><span class=""quote"">&gt;Maji Koi A-5 - Partial patch with Full Margit + Hound Route released, 100% translated</span><br>Manakashi no Yuri wa Akaku Somaru - 54% translated<br>Miagete Goran, Yozora no Hoshi o - 1 of 4 routes translation finished for the restoration patch<br><span class=""quote"">&gt;Netorasezuma, Miina  - Released</span><br>Nursery Rhyme - 100% translated and edited, text insertion 100% complete, testing ongoing<br>Oppai no Ouja 48  - Work in progress patch released<br>Planetarian Snow Globe - 25% translated<br>Pure Pure - 100% translated, needs proofreading, partial patch released, all routes have been inserted<br>Rui wa Tomo o Yobu - 19.32% translated, 4.20% edited<br>Sen no Hatou, Tsukisome no Kouki - Both original and fan disc     100% translated, in need of editing<br>Shin Hayarigami - 48% translated<br><span class=""quote"">&gt;Shin Koihime Musou - 100% translated, 60%(65848/108888) edited</span><br>Shirotsume Yubiwa  - 100% translated, 50% beta patch released<br>Tenshi no Inai 12-gatsu -  Common, Touko, and Sakaki routes fully translated, Asuna route 20% complete<br><span class=""quote"">&gt;Tsukihime - A piece of blue glass moon  - Arcueid route patch released, Ciel route 100% translated, days 3 through 8 edited and days 3 through 6 finalized</span><br><span class=""quote"">&gt;Umi kara Kuru Mono - 14/138 scripts translated</span><br>Watashi wa Kyou Koko de Shinimasu - 100% translated, 99% (2254/2265) lines edited, 36% (826/2265) lines QC<br>Walkure Romanze - Common + Celia + Lisa routes patch released<br>Yosuga no Sora - Translation finished, editing and TLC ongoing, Total: TL 100% TLC 64% ED 27%, Common + Kazuha routes fully edited<br><br><br>Official work<br><br>MangaGamer<br>How a Healthy Hentai Administers Public Service - December 15th release<br>Ciconia - Phase 1 Released<br>Hadaka Shitsuji fandisc - Picked up<br>Shiei no Sona-Nyl - Translation is complete, heading to scripting<br>Rance IX - &quot;out of beta and in post-beta scripting&quot;<br>Rance X - 47% translated, 5% edited<br>Luckydog1 - Picked up<br>The Pillagers of Raillore - Fully translated and edited, being prepared for beta<br>Rance 03 - Picked up<br>Lkyt - Fully translated and edited, being prepared for beta<br>Funbag Fantasy 4 - 33% translated, 32% edited<br>Nightmare x Onmyouji - Paradox of Forbiddance - Fully translated and edited<br>Eve of the 12th Month - 88% translated, 5% edited<br><br>JAST<br>Tokyo Necro - Fully translated and edited, 2022 release<br>Sorcerer&#039;s Choice - Angel or Demon? - Scheduled for release &quot;a few months from now&quot;<br>Sumaga-  Slow progress ongoing<br>Katahane - Progress being made again<br>Django - Not actively making progress<br>Gears of Dragoon: Fragments of a New Era - In Testing<br>Tokyo Hero Project - Almost finished<br>Machine Child - Still being developed<br>Onigokko! Fandisc - Picked up<br><br>Age titles<br>Kiminozo - &quot;We will have more information on this title at a later date. Please look forward to it.&quot;<br>Schwarzesmarken - Through Greenlight<br><br>Frontwing<br>Sharin no Kuni - Delayed for 3-6 months to resolve swapping resolution problem",12-4 releases,.png,1022.0,400.0,250.0,97.0,1670187854156622.0,1670187854,HZTZfjzv1TjN9xxoDjj1cQ==,721679.0,0,0,0,visual-novel-translation-status,1,72,10,67.0,10.0,"[{'no': 42007741, 'now': '12/09/22(Fri)10:16:57', 'name': 'Anonymous', 'com': '<a href=""#p42006132"" class=""quotelink"">&gt;&gt;42006132</a><br>How does this work?', 'time': 1670599017, 'resto': 41961369}, {'no': 42007919, 'now': '12/09/22(Fri)10:39:04', 'name': 'Anonymous', 'com': '<a href=""#p42007741"" class=""quotelink"">&gt;&gt;42007741</a><br>CREST is a big company with their own in-house localization arm, there is no reason for them to license their games out to anyone, when they can do it themselves.', 'time': 1670600344, 'resto': 41961369}, {'no': 42011360, 'now': '12/09/22(Fri)18:21:55', 'name': 'Anonymous', 'com': '<a href=""#p42007919"" class=""quotelink"">&gt;&gt;42007919</a><br>I wonder if they will actually do something with it.', 'time': 1670628115, 'resto': 41961369}, {'no': 42012839, 'now': '12/09/22(Fri)21:57:26', 'name': 'Anonymous', 'com': '<a href=""#p42005396"" class=""quotelink"">&gt;&gt;42005396</a><br>Surely most people bought it on Johren.', 'time': 1670641046, 'resto': 41961369}, {'no': 42014360, 'now': '12/10/22(Sat)03:33:23', 'name': 'Anonymous', 'com': '<a href=""#p42012839"" class=""quotelink"">&gt;&gt;42012839</a><br>It&#039;s not even on Johren, none of the Uta games are.', 'time': 1670661203, 'resto': 41961369}]",1670661203,!!UcDDlzwANFs,
68,41684379,11/05/22(Sat)15:44:16,Anonymous,Touhou Doujin Music Thread,"Dark PHOENIX Edition<br><br>Doujin circles, Touhou Lossless Music Collection, Spotify, Gensokyo Radio and other links:<br>https://pastebin.com/xE3uwAQH<br><br>https://www.youtube.com/watch?v=HzR<wbr>akY0oli0<br>https://www.youtube.com/watch?v=BSV<wbr>qHVfaz8w<br>https://www.youtube.com/watch?v=H_C<wbr>JCEKtk3c<br><br>Previous thread <span class=""deadlink"">&gt;&gt;41663433</span>",__shameimaru_aya_touhou_drawn_by_shuu_maihikuboshuchu__4a2defab1b0925f29c39bd27f4b4759b,.png,1260.0,1260.0,250.0,250.0,1667677456853570.0,1667677456,OoFna+4NPtieM7YLKgt1mA==,2329334.0,0,0,0,touhou-doujin-music-thread,1,200,97,195.0,93.0,"[{'no': 42001395, 'now': '12/08/22(Thu)16:24:40', 'name': 'Anonymous', 'com': 'https://www.youtube.com/watch?v=Eex<wbr>4iWSqYtI<br>A song that gives me a nostalgic feeling', 'filename': 'LIMIT BREAK', 'ext': '.jpg', 'w': 400, 'h': 400, 'tn_w': 125, 'tn_h': 125, 'tim': 1670534680641645, 'time': 1670534680, 'md5': '0s5MRBSz760/EVHhPaEHeQ==', 'fsize': 99357, 'resto': 41684379}, {'no': 42008162, 'now': '12/09/22(Fri)11:02:49', 'name': 'Anonymous', 'com': 'I found this UN Owen Arrange uploaded just now which was pretty decent.<br>I&#039;m kind of wondering when someone&#039;s gonna combine Flan and Toutetsu&#039;s themes for a song though.<br>https://www.youtube.com/watch?v=5Wd<wbr>xZg9P-rU', 'filename': 'goat vampire', 'ext': '.jpg', 'w': 1008, 'h': 284, 'tn_w': 125, 'tn_h': 35, 'tim': 1670601769031194, 'time': 1670601769, 'md5': 'iD2eV1HFoVqhpVJIxlxGxA==', 'fsize': 389406, 'resto': 41684379}, {'no': 42009774, 'now': '12/09/22(Fri)14:44:20', 'name': 'Anonymous', 'com': 'https://www.youtube.com/watch?v=ERq<wbr>vF4W961c', 'filename': '__komeiji_koishi_touhou_drawn_by_sorani_kaeru0768__677dd6b2e5614745f2af95472466d2e0', 'ext': '.jpg', 'w': 1500, 'h': 2000, 'tn_w': 93, 'tn_h': 125, 'tim': 1670615060390907, 'time': 1670615060, 'md5': 'xevf8MykQWWobZ3yWDZ0NQ==', 'fsize': 327509, 'resto': 41684379}, {'no': 42010315, 'now': '12/09/22(Fri)15:46:38', 'name': 'Anonymous', 'com': 'https://youtu.be/kfu2Qedx6mI<br><br>I found out about this circle many months ago but didn&#039;t really get into listening to more of their stuff until recently. I prefer their stuff with the vocals but there&#039;s just something about this song in particular that does it for me, especially in conjunction with the album art. I want to keep marveling at it on loop but I&#039;m afraid it will lose its magic if I do.<br><br>Great circle in general that had me feeling shit I haven&#039;t felt in a long time.', 'time': 1670618798, 'resto': 41684379}, {'no': 42014356, 'now': '12/10/22(Sat)03:32:10', 'name': 'Anonymous', 'com': 'https://www.youtube.com/watch?v=y3i<wbr>SaWn0fc4', 'filename': '__rumia_touhou_drawn_by_azuki_azuki_taste__35b38b6176e8ddbee1ff746b1565c7cc', 'ext': '.jpg', 'w': 900, 'h': 1200, 'tn_w': 93, 'tn_h': 125, 'tim': 1670661130518111, 'time': 1670661130, 'md5': 'qdNgj5aeNgWKwvcHKp0qGQ==', 'fsize': 91902, 'resto': 41684379}]",1670661130,,
69,41909390,11/29/22(Tue)03:57:11,Anonymous,Nitori thread,Post kappas,3CBD7CA4-4AA6-48B7-B7F6-6916B5701C66,.jpg,875.0,995.0,219.0,249.0,1669712231148192.0,1669712231,358hxSSe0yubXIjMHhmKSA==,438387.0,0,0,0,nitori-thread,1,65,21,60.0,19.0,"[{'no': 42002214, 'now': '12/08/22(Thu)18:32:45', 'name': 'Anonymous', 'com': '<a href=""#p42001959"" class=""quotelink"">&gt;&gt;42001959</a><br>Show her all the old, then take her to Starbase to witness the new', 'time': 1670542365, 'resto': 41909390}, {'no': 42010004, 'now': '12/09/22(Fri)15:15:02', 'name': 'Anonymous', 'com': '<a href=""#p42001684"" class=""quotelink"">&gt;&gt;42001684</a><br>The kappa on tour!', 'filename': '__kawashiro_nitori_kappa_mob_and_dark_haired_kappa_touhou_drawn_by_aoyoshi__71e47a7163f4d56bcf183768d4dd9aee', 'ext': '.jpg', 'w': 2150, 'h': 2973, 'tn_w': 90, 'tn_h': 125, 'tim': 1670616902197202, 'time': 1670616902, 'md5': '6Kk2AE7Jg5c0sED81WmlZA==', 'fsize': 895630, 'resto': 41909390}, {'no': 42010022, 'now': '12/09/22(Fri)15:16:39', 'name': 'Anonymous', 'com': '<a href=""#p42010004"" class=""quotelink"">&gt;&gt;42010004</a><br>Mob kappas are always full of soul', 'time': 1670616999, 'resto': 41909390}, {'no': 42014311, 'now': '12/10/22(Sat)03:21:36', 'name': 'Anonymous', 'com': '<a href=""#p42010022"" class=""quotelink"">&gt;&gt;42010022</a><br>I bet they would make for a fun gag series.', 'filename': '__kawashiro_nitori_kappa_mob_dark_haired_kappa_glasses_kappa_and_hair_tie_kappa_touhou_drawn_by_ichiba_youichi__01cf42696b5eedd39bd073e13c26f577', 'ext': '.png', 'w': 1433, 'h': 1013, 'tn_w': 125, 'tn_h': 88, 'tim': 1670660496260019, 'time': 1670660496, 'md5': 'Ac9CaWte7dOb0HPhPCb1dw==', 'fsize': 1159250, 'resto': 41909390}, {'no': 42014339, 'now': '12/10/22(Sat)03:28:10', 'name': 'Anonymous', 'com': '<a href=""#p42014311"" class=""quotelink"">&gt;&gt;42014311</a><br>Rolling', 'time': 1670660890, 'resto': 41909390}]",1670660890,,
70,41897005,11/27/22(Sun)16:54:29,Anonymous,,There are far too many Futos.,1668339948272689,.jpg,850.0,892.0,238.0,249.0,1669586069350639.0,1669586069,hrWGKaPleQOPa7G1b8f+UQ==,204331.0,0,0,0,there-are-far-too-many-futos,1,62,16,57.0,16.0,"[{'no': 42000446, 'now': '12/08/22(Thu)13:58:28', 'name': 'Anonymous', 'com': '<a href=""#p41993969"" class=""quotelink"">&gt;&gt;41993969</a><br>14 futos. One for the day and one for the night. We now multiple that for every day of the week and we get our ideal amount of Futos.', 'time': 1670525908, 'resto': 41897005}, {'no': 42008521, 'now': '12/09/22(Fri)11:48:49', 'name': 'Anonymous', 'com': '<a href=""#p41991676"" class=""quotelink"">&gt;&gt;41991676</a><br>They are turning into a Futo.', 'time': 1670604529, 'resto': 41897005}, {'no': 42008939, 'now': '12/09/22(Fri)12:37:31', 'name': 'Anonymous', 'com': '<a href=""#p42008521"" class=""quotelink"">&gt;&gt;42008521</a><br>How can we save them?', 'time': 1670607451, 'resto': 41897005}, {'no': 42009606, 'now': '12/09/22(Fri)14:20:53', 'name': 'Anonymous', 'com': '<a href=""#p41994018"" class=""quotelink"">&gt;&gt;41994018</a><br>I refuse to believe literally everyone on /jp/ are manlets say it ain&#039;t so!', 'time': 1670613653, 'resto': 41897005}, {'no': 42014273, 'now': '12/10/22(Sat)03:12:56', 'name': 'Anonymous', 'com': '<a href=""#p42008939"" class=""quotelink"">&gt;&gt;42008939</a><br>I don&#039;t know if we can. The best thing to do is keep them away from any source of fire.<br>If we find their prince we might be able to gain control of the Futo hivemind.', 'time': 1670659976, 'resto': 41897005}]",1670659976,,
71,41996858,12/08/22(Thu)06:55:53,Unipux,Hmm...,,bigthink,.png,1012.0,1292.0,195.0,250.0,1670500553996151.0,1670500553,xhSBdShPmp1k8aqhTyE5og==,778436.0,0,0,0,hmm,1,20,18,15.0,14.0,"[{'no': 42001170, 'now': '12/08/22(Thu)15:44:48', 'name': 'Anonymous', 'com': '<a href=""#p42001103"" class=""quotelink"">&gt;&gt;42001103</a><br>Parsee actually is real.', 'time': 1670532288, 'resto': 41996858}, {'no': 42005391, 'now': '12/09/22(Fri)04:51:19', 'name': 'Unipux', 'com': 'What is real?', 'filename': 'paru', 'ext': '.jpg', 'w': 720, 'h': 960, 'tn_w': 93, 'tn_h': 125, 'tim': 1670579479913055, 'time': 1670579479, 'md5': 'HvAxP9hg9wKPViKtjTy8LQ==', 'fsize': 805363, 'resto': 41996858, 'trip': '!FSxZZPzWfA'}, {'no': 42008472, 'now': '12/09/22(Fri)11:40:45', 'name': 'Unipux', 'filename': 'paru', 'ext': '.jpg', 'w': 600, 'h': 750, 'tn_w': 100, 'tn_h': 125, 'tim': 1670604045515634, 'time': 1670604045, 'md5': 'Im4ROvGX0Eh2oY8vgg0ixA==', 'fsize': 232235, 'resto': 41996858, 'trip': '!Ehi4f3VLI2'}, {'no': 42008512, 'now': '12/09/22(Fri)11:47:35', 'name': 'Unipux', 'filename': 'parsee6', 'ext': '.jpg', 'w': 700, 'h': 700, 'tn_w': 125, 'tn_h': 125, 'tim': 1670604455705283, 'time': 1670604455, 'md5': 'hZIIp4ZukqpAR8o9O1TPow==', 'fsize': 466521, 'resto': 41996858, 'trip': '!Ehi4f3VLI2'}, {'no': 42014262, 'now': '12/10/22(Sat)03:10:36', 'name': 'Unipux', 'com': 'Real jealous of anyone who hasn&#039;t put up with as much shit as I have.', 'filename': 'parsee', 'ext': '.png', 'w': 1000, 'h': 750, 'tn_w': 125, 'tn_h': 93, 'tim': 1670659836940636, 'time': 1670659836, 'md5': 'otwYOGNEvuXBo63x0YEVIw==', 'fsize': 225796, 'resto': 41996858, 'trip': '!FSxZZPzWfA'}]",1670659836,!!QEIAmWnR8w1,
72,42014118,12/10/22(Sat)02:29:43,Anonymous,,What is being referenced here?,[Rododendron] Joshiraku OVA (DVD 480p) [D1A68727]00_11_34.893,.png,853.0,480.0,250.0,140.0,1670657383582509.0,1670657383,ea72tZjx/ncL7N2kr9CDRg==,617200.0,0,0,0,what-is-being-referenced-here,1,1,0,,,"[{'no': 42014241, 'now': '12/10/22(Sat)03:03:08', 'name': 'Anonymous', 'com': '<a href=""#p42014118"" class=""quotelink"">&gt;&gt;42014118</a><br>Nigga stole my bike', 'time': 1670659388, 'resto': 42014118}]",1670659388,,
