,no,now,name,com,filename,ext,w,h,tn_w,tn_h,tim,time,md5,fsize,resto,bumplimit,imagelimit,semantic_url,custom_spoiler,replies,images,omitted_posts,omitted_images,last_replies,last_modified,sub,trip
0,41979551,12/06/22(Tue)11:33:55,Anonymous,"It&#039;s my birthday today, /jp/.<br><br>Can we have a Marisa thread?",marisa_cake,.png,2150,3035,177,249,1670344435974920,1670344435,wKDyVbUSTfYIahhUDCP66Q==,3508890,0,0,0,its-my-birthday-today-jp,1,34,21,29.0,19.0,"[{'no': 42024760, 'now': '12/11/22(Sun)08:43:01', 'name': 'Anonymous', 'com': '<a href=""#p41979551"" class=""quotelink"">&gt;&gt;41979551</a><br>As a gift<br>Non lewd doujin recommendation.<br>Touhou - The Magician Who Loved a Fake<br><br>https://mangadex.org/title/af92c88e<wbr>-c18f-4b11-aa59-e506c9c00176/touhou<wbr>-the-magician-who-loved-a-fake-douj<wbr>inshi?tab=chapters', 'filename': '9e3cf461-a62f-43ab-9c3e-3e8690c65b8a', 'ext': '.png', 'w': 1200, 'h': 1723, 'tn_w': 87, 'tn_h': 125, 'tim': 1670766181847049, 'time': 1670766181, 'md5': 'Bo3tXnBm14K8gCfqMtb7Zw==', 'fsize': 3329089, 'resto': 41979551}, {'no': 42029824, 'now': '12/11/22(Sun)18:44:01', 'name': 'Anonymous', 'com': '<a href=""#p42024760"" class=""quotelink"">&gt;&gt;42024760</a><br>Thanks!', 'time': 1670802241, 'resto': 41979551}, {'no': 42032868, 'now': '12/12/22(Mon)05:49:26', 'name': 'Anonymous', 'com': '<a href=""#p42024677"" class=""quotelink"">&gt;&gt;42024677</a><br>I want to spank Marisa&#039;s ass', 'time': 1670842166, 'resto': 41979551}, {'no': 42042587, 'now': '12/13/22(Tue)06:28:32', 'name': 'Anonymous', 'com': 'I love my sexy wife Marisa', 'filename': '410344cede311beb5059e403b7e4e18d', 'ext': '.jpg', 'w': 960, 'h': 1440, 'tn_w': 83, 'tn_h': 125, 'tim': 1670930912487693, 'time': 1670930912, 'md5': '8pWJfDAgRCZh6lFtknZEJQ==', 'fsize': 531018, 'resto': 41979551}, {'no': 42042923, 'now': '12/13/22(Tue)07:15:18', 'name': 'Anonymous', 'com': '<a href=""#p41979551"" class=""quotelink"">&gt;&gt;41979551</a><br>How old are you?', 'time': 1670933718, 'resto': 41979551}]",1670933718,,
1,42032336,12/12/22(Mon)03:51:55,Anonymous,"Discussion concerning Higurashi, Umineko, Ciconia, Rose Guns Days, Higanbana, TRianThology, and all other 07th Expansion works.<br><br>07th Expansion archive:<br>https://1drv.ms/u/s!Apo9jt_5n1kcbru<wbr>VfFQLmtYesrY?e=q2ARE6<br>Password: 07<br><br>Old archive backup at:<br>magnet: xt=urn:btih:311bb86e9f983a9393cca7d<wbr>2190233c5b86a872c&amp;dn=07th%20Expansi<wbr>on%20archive&amp;tr=udp%3a%2f%2ftracker<wbr>.opentrackr.org%3a1337%2fannounce<br><br>07th Links:<br>https://pastebin.com/XjcX45p6 <br>Umineko colored truths script:<br>https://controlc.com/27143a5a<br><br>Previous thread:<a href=""/jp/thread/42007730#p42007730"" class=""quotelink"">&gt;&gt;42007730</a>",1636566856175,.jpg,1543,2384,161,250,1670835115547082,1670835115,Sveax2Q0hKts2/Hrwg2vUg==,386454,0,0,0,07th-expansion-thread,1,241,148,236.0,146.0,"[{'no': 42042765, 'now': '12/13/22(Tue)06:54:26', 'name': 'Anonymous', 'com': 'wHY Rika is the  GIRL??! OF GIRLS?', 'time': 1670932466, 'resto': 42032336}, {'no': 42042807, 'now': '12/13/22(Tue)07:00:04', 'name': 'Anonymous', 'com': 'Rika is dead', 'time': 1670932804, 'resto': 42032336}, {'no': 42042843, 'now': '12/13/22(Tue)07:04:35', 'name': 'Anonymous', 'com': '<a href=""#p42042807"" class=""quotelink"">&gt;&gt;42042807</a><br>you&#039;re dead to me', 'time': 1670933075, 'resto': 42032336}, {'no': 42042880, 'now': '12/13/22(Tue)07:09:40', 'name': 'Anonymous', 'com': 'holy shit cunny!', 'filename': '1664293376767090', 'ext': '.jpg', 'w': 1398, 'h': 957, 'tn_w': 125, 'tn_h': 85, 'tim': 1670933380447365, 'time': 1670933380, 'md5': '/3VTkWHdLUrhjjcoIK91eg==', 'fsize': 580671, 'resto': 42032336}, {'no': 42042920, 'now': '12/13/22(Tue)07:15:06', 'name': 'Anonymous', 'com': 'literally no one can compete with this', 'filename': '100980304_p0', 'ext': '.jpg', 'w': 3620, 'h': 2460, 'tn_w': 125, 'tn_h': 84, 'tim': 1670933706466235, 'time': 1670933706, 'md5': '50bzm7ep3XIeI7Eu7Vl82A==', 'fsize': 1448066, 'resto': 42032336}]",1670933706,/07/th Expansion Thread,
2,42042919,12/13/22(Tue)07:15:04,Anonymous,Well? Did you enjoy her year?,__hijiri_byakuren_nazrin_houjuu_nue_toramaru_shou_murasa_minamitsu_and_2_more_touhou_drawn_by_ari_don__2d43325ebaa264b548d6e2cef1c4446d,.jpg,720,720,250,250,1670933704864819,1670933704,zRW2mKsir3M6kglfyjTDIw==,578824,0,0,0,well-did-you-enjoy-her-year,1,0,0,,,,1670933704,,
3,42042167,12/13/22(Tue)04:58:57,Anonymous,"jp, i am lonely",newimage,.png,186,283,164,249,1670925537419021,1670925537,MCTvhUB9Ns+XGLytxL+mUA==,70371,0,0,0,jp-i-am-lonely,1,1,0,,,"[{'no': 42042918, 'now': '12/13/22(Tue)07:15:01', 'name': 'Anonymous', 'com': 'herro ronery, I am otou-san', 'time': 1670933701, 'resto': 42042167}]",1670933701,,
4,42042813,12/13/22(Tue)07:00:33,Anonymous,"Advent, Day XIII: Mari-Santa Edition<br><br>Last: <a href=""/jp/thread/42010077#p42010077"" class=""quotelink"">&gt;&gt;42010077</a><br><br><span class=""quote"">&gt;What is this?</span><br><br>Era games are a group of (usually) Japanese-developed text porn games.<br>They&#039;re not exclusively related to the Touhou franchise, but it&#039;s one of the series with most era games.<br><br><span class=""quote"">&gt;Games usually discussed here</span><br>eraTohoTW - Comfy Touhou dating simulator with time stop shenanigans.<br>eraTohoK - Tactical game about conquering Gensokyo through any (absolutely any) means.<br>eraMegaten - Dungeon crawler based on the Shin Megami Tensei series, with tons of characters from other series (Fate, Touhou, Madoka, etc) included.<br><br><span class=""quote"">&gt;Links</span><br>- WIKI: https://wiki.eragames.rip/index.php<wbr>/Main_Page<br>Guides and downloads for all era games. For TW you should get the eng-development version, eng-release is several years old.<br>- GIT: https://gitgud.io/era-games<br>Git repository that has latest official builds to any of the games, you can sometimes find more recent versions than the ones on the wiki.<br>- AUTO UPDATER: http://madhammer.club/files/era-upd<wbr>ater.7z<br>Fetches the latest version of TW, K or Megaten from the official git, no login needed.<br>- TW NEODEV: https://gitgud.io/Pedy/pedy-tw/-/re<wbr>leases<br>Git repository with a version of TW that gets more frequent updates. Might introduce more bugs, though they usually get fixed on the following release.<br>- JAP WIKI: https://seesaawiki.jp/eraseries/<br>- TRANSLATOR: https://wiki.eragames.rip/index.php<wbr>/Sugoi<br>Automatic translator which copies text straight from the game. Comes with an optional customized built-in offline model.<br>You can also download the latest version at:<br>https://drive.google.com/file/d/1DA<wbr>8voYO62ARtORzxJUBhMWK2FWbt6Vlq/view<wbr><br>- BUGS?: https://wiki.eragames.rip/bugreport<wbr>.php<br>Report them over here.<br><br><span class=""quote"">&gt;How to play?</span><br>Run anchor.exe, japanese locale is advised so you don&#039;t run into untranslated text.<br>If you wish to manually update, delete old files aside the sav and dat folders to avoid any bugs.<br><br><span class=""quote"">&gt;How can I help?</span><br>Read https://wiki.eragames.rip/index.php<wbr>/Contributing for starters.<br>You could try your hand at translating dialogue, there are guides currently in the TW folder (in #Translation) on what to do, not sure if it that folder exists in other games.<br>Another guide is:<br>1) Download an IDE. VS Code, for example.<br>1a) If using VS Code, install the EraBasic addon<br>2) Select UTF8 encoding<br>3) Open the ERB files and edit them<br>That way you can now edit files without much trouble.<br>The path for files to edit is usually the ERB folder:<br>K: ERB/口上<br>TW: ERB\口上・メッセージ関連\個人口上<br><br>You can also report bugs or typos here on the thread when you see them.<br>If you&#039;d like to either edit or add your own portraits, the files are located within the &#039;resources&#039; folder in webp format. You can use paint.net to edit them",4276052,.jpg,1034,2048,126,250,1670932833535676,1670932833,GHZLRocefhNw3YIg7gQscw==,451166,0,0,0,egg-era-games-general,1,4,1,,,"[{'no': 42042823, 'now': '12/13/22(Tue)07:01:43', 'name': 'Anonymous', 'com': 'All 2hus are already taken.', 'filename': 'yakumo fam', 'ext': '.png', 'w': 600, 'h': 800, 'tn_w': 93, 'tn_h': 125, 'tim': 1670932903745472, 'time': 1670932903, 'md5': '2xBksGnj84Up27BQNTjvgQ==', 'fsize': 431641, 'resto': 42042813}, {'no': 42042828, 'now': '12/13/22(Tue)07:02:30', 'name': 'Anonymous', 'com': 'Considering the gimmick of kappas in mythology, I would like to suggest a mechanic change to TW where any kappa that gets too close to your asshole gives in to their instincts and kills you by ripping your soul out through it', 'time': 1670932950, 'resto': 42042813}, {'no': 42042903, 'now': '12/13/22(Tue)07:13:03', 'name': 'Anonymous', 'com': '<a href=""#p42042828"" class=""quotelink"">&gt;&gt;42042828</a><br>Let&#039;s compromise and have them just rip out your prostate after giving it a good squeeze or two. You can still have it be fatal if you fail the anal circumference check.', 'time': 1670933583, 'resto': 42042813}, {'no': 42042916, 'now': '12/13/22(Tue)07:14:43', 'name': 'Anonymous', 'com': '<a href=""#p42042903"" class=""quotelink"">&gt;&gt;42042903</a><br>Your terms are acceptable.', 'time': 1670933683, 'resto': 42042813}]",1670933683,/egg/ — Era Games General,
5,42042907,12/13/22(Tue)07:13:42,Anonymous,"Links and resources: https://pastebin.com/jDHxU1Jw<br>Album recommendations and YouTube playlist: https://pastebin.com/dMX8CJhk<br><br>Last Thread: <a href=""/jp/thread/41827552#p41827552"" class=""quotelink"">&gt;&gt;41827552</a>",5cf2698ae83ab33fb7f78b66d44c8efa,.jpg,850,1202,176,250,1670933622823851,1670933622,/e0NRseOW8t3+bYagroN4g==,109904,0,0,0,vocaloid-thread,1,1,1,,,"[{'no': 42042924, 'now': '12/13/22(Tue)07:15:29', 'name': 'Anonymous', 'filename': 'ce65612ffcd2dc1659d94c044bb8d1c3', 'ext': '.jpg', 'w': 2860, 'h': 3750, 'tn_w': 95, 'tn_h': 125, 'tim': 1670933729486456, 'time': 1670933729, 'md5': 'nw1a74/qM+xSLe3lbZbNUg==', 'fsize': 1733268, 'resto': 42042907}]",1670933729,Vocaloid Thread,
6,42022240,12/11/22(Sun)01:16:58,Anonymous,len&#039;en thread post cool touhou art i guess =),__adagumo_no_saragimaru_and_adagumo_no_yaorochi_len_en_drawn_by_jian_xing_zao__f2482c0ebc74d64403c05ffa5448c6b8,.jpg,1186,646,250,136,1670739418450188,1670739418,GoVhFXCZMwBb6W175yBp6g==,544785,0,0,0,fuck-you-touhou-fans-lenen-thread,1,96,91,91.0,86.0,"[{'no': 42041827, 'now': '12/13/22(Tue)03:29:24', 'name': 'Anonymous', 'com': '<a href=""#p42038822"" class=""quotelink"">&gt;&gt;42038822</a><br>yes', 'filename': '__ooama_no_ake_no_mitori_len_en_drawn_by_ougi_hina__9041685767cb5c9197486549c4a8876e', 'ext': '.jpg', 'w': 1791, 'h': 1516, 'tn_w': 125, 'tn_h': 105, 'tim': 1670920164198097, 'time': 1670920164, 'md5': 'kEFoV2fLXJGXSGVJxKiHbg==', 'fsize': 1742503, 'resto': 42022240}, {'no': 42042863, 'now': '12/13/22(Tue)07:07:22', 'name': 'Anonymous', 'filename': '__ooama_no_ake_no_mitori_len_en_drawn_by_yukkyon_kyon__55877fcc0006cf1babb7d7156481d888', 'ext': '.jpg', 'w': 1300, 'h': 1600, 'tn_w': 101, 'tn_h': 125, 'tim': 1670933242857771, 'time': 1670933242, 'md5': 'OvpPQd7qeH0u54Fwp41GCw==', 'fsize': 477765, 'resto': 42022240}, {'no': 42042884, 'now': '12/13/22(Tue)07:10:17', 'name': 'Anonymous', 'com': 'TOUHOU WILL NEVER HAVE A OFFICAL VTUBER', 'filename': '__rei_len_en_drawn_by_hemo_hemoroda__b1db9d9eb11084e7e49156257a764dae', 'ext': '.png', 'w': 1440, 'h': 990, 'tn_w': 125, 'tn_h': 85, 'tim': 1670933417823163, 'time': 1670933417, 'md5': 'sdudnrEQhOfkkVYlenZNrg==', 'fsize': 3048679, 'resto': 42022240}, {'no': 42042895, 'now': '12/13/22(Tue)07:11:38', 'name': 'Anonymous', 'com': 'rei is so cute , also to all the people still lurking here what are your predictions for len&#039;en ?', 'filename': '__rei_len_en_drawn_by_ougi_hina__cd3abe5a3a0aac03681be1432436b76e', 'ext': '.jpg', 'w': 1378, 'h': 1860, 'tn_w': 92, 'tn_h': 124, 'tim': 1670933498511052, 'time': 1670933498, 'md5': 'zTq+WjoKrANoG+FDJDa3bg==', 'fsize': 1045652, 'resto': 42022240}, {'no': 42042901, 'now': '12/13/22(Tue)07:12:42', 'name': 'Anonymous', 'filename': '__senri_haiji_len_en_drawn_by_hemo_hemoroda__0bbf87125273a06eac4401fc2ba78870', 'ext': '.png', 'w': 1024, 'h': 768, 'tn_w': 125, 'tn_h': 93, 'tim': 1670933562851772, 'time': 1670933562, 'md5': 'C7+HElJzoG6sRAH8K6eIcA==', 'fsize': 1253587, 'resto': 42022240}]",1670933562,"fuck you touhou fans , len&#039;en thread",
7,42032272,12/12/22(Mon)03:32:51,Anonymous,"Discussion concerning Higurashi, Umineko, Rose Guns Days, Higanbana, TRianThology, and all other 07th Expansion works.<br><br>07th Expansion archive:<br>https://1drv.ms/u/s!Apo9jt_5n1kcbru<wbr>VfFQLmtYesrY?e=q2ARE6<br>Password: 07<br><br>Old archive backup at:<br>magnet: xt=urn:btih:311bb86e9f983a9393cca7d<wbr>2190233c5b86a872c&amp;dn=07th%20Expansi<wbr>on%20archive&amp;tr=udp%3a%2f%2ftracker<wbr>.opentrackr.org%3a1337%2fannounce<br><br>07th Links:<br>https://pastebin.com/XjcX45p6<br>Umineko colored truths script:<br>https://controlc.com/27143a5a<br><br>Previous thread: <a href=""/jp/thread/42005289#p42005289"" class=""quotelink"">&gt;&gt;42005289</a>",Fi_ch-waYAA-Tl4,.jpg,1200,1200,250,250,1670833971463962,1670833971,JtGdUKDFVoqmWIhhVGdjIQ==,171121,0,0,0,07th-expansion-thread,1,266,90,261.0,87.0,"[{'no': 42042855, 'now': '12/13/22(Tue)07:06:17', 'name': 'Anonymous', 'com': 'Satothiggs', 'filename': '__houjou_satoko_higurashi_no_naku_koro_ni_drawn_by_yuura2124__ff02eb0240a5d8e5053520e853c6f8b0', 'ext': '.jpg', 'w': 800, 'h': 960, 'tn_w': 104, 'tn_h': 125, 'tim': 1670933177539881, 'time': 1670933177, 'md5': 'AmwamVfyfI86dqFGYMelRg==', 'fsize': 603838, 'resto': 42032272}, {'no': 42042872, 'now': '12/13/22(Tue)07:08:28', 'name': 'Anonymous', 'com': '<a href=""#p42042855"" class=""quotelink"">&gt;&gt;42042855</a><br>You will never have sex with shitoko and rika is better fuck off and take a hike', 'time': 1670933308, 'resto': 42032272}, {'no': 42042877, 'now': '12/13/22(Tue)07:09:14', 'name': 'Anonymous', 'com': 'Satoswimming', 'filename': '1629311623127', 'ext': '.jpg', 'w': 768, 'h': 1024, 'tn_w': 93, 'tn_h': 125, 'tim': 1670933354250918, 'time': 1670933354, 'md5': 'uLwucQHwnb4n18k+vZvnQg==', 'fsize': 103859, 'resto': 42032272}, {'no': 42042900, 'now': '12/13/22(Tue)07:12:41', 'name': 'Anonymous', 'com': 'Satonurse', 'filename': 'fymmywuacaabbdw', 'ext': '.jpg', 'w': 1116, 'h': 1507, 'tn_w': 92, 'tn_h': 125, 'tim': 1670933561966322, 'time': 1670933561, 'md5': '7C4po6UyOIPb6tY/9PRnYg==', 'fsize': 183153, 'resto': 42032272}, {'no': 42042910, 'now': '12/13/22(Tue)07:13:56', 'name': 'Anonymous', 'com': 'nushitokoshitposter is a shitty fucking troll and he will die of cancer', 'time': 1670933636, 'resto': 42032272}]",1670933636,/07/th Expansion Thread,
8,42042114,12/13/22(Tue)04:43:27,Anonymous,"Previous <a href=""/jp/thread/42013665#p42013665"" class=""quotelink"">&gt;&gt;42013665</a>",Toricago269,.jpg,2612,3482,187,250,1670924607799946,1670924607,Zb3DNt/trGJAgraLS9w95Q==,2056404,0,0,0,alt-alternative-idols-general-771,1,15,7,10.0,4.0,"[{'no': 42042769, 'now': '12/13/22(Tue)06:55:02', 'name': 'Anonymous', 'com': '<a href=""#p42042710"" class=""quotelink"">&gt;&gt;42042710</a><br>she was in ho6la', 'time': 1670932502, 'resto': 42042114}, {'no': 42042771, 'now': '12/13/22(Tue)06:55:15', 'name': 'Anonymous', 'com': '<a href=""#p42042710"" class=""quotelink"">&gt;&gt;42042710</a><br>This one was in the failed ham group.', 'filename': '242179434_391005752471500_8313040909077925563_n', 'ext': '.jpg', 'w': 1274, 'h': 1274, 'tn_w': 125, 'tn_h': 125, 'tim': 1670932515686433, 'time': 1670932515, 'md5': 'K92K7Xio6Meyfnt9R2JgHg==', 'fsize': 195163, 'resto': 42042114}, {'no': 42042785, 'now': '12/13/22(Tue)06:57:35', 'name': 'Anonymous', 'com': '<a href=""#p42042572"" class=""quotelink"">&gt;&gt;42042572</a><br>She&#039;s gonna comeback only to do a graduation performance and then leave forever. That&#039;s the typical play for an idol out for this long.', 'time': 1670932655, 'resto': 42042114}, {'no': 42042808, 'now': '12/13/22(Tue)07:00:05', 'name': 'Anonymous', 'com': '<a href=""#p42042719"" class=""quotelink"">&gt;&gt;42042719</a><br>Bigger discovery, this one is lewd.', 'filename': 'EnBypECVoAAVMA7', 'ext': '.jpg', 'w': 1804, 'h': 2048, 'tn_w': 110, 'tn_h': 125, 'tim': 1670932805744515, 'time': 1670932805, 'md5': 'Dao7ejq4xF413vDQ8gyToA==', 'fsize': 345379, 'resto': 42042114}, {'no': 42042894, 'now': '12/13/22(Tue)07:11:16', 'name': 'Anonymous', 'com': 'real gamer', 'filename': 'Fj21V-ZVIAA7FQT', 'ext': '.jpg', 'w': 1548, 'h': 1991, 'tn_w': 97, 'tn_h': 125, 'tim': 1670933476598478, 'time': 1670933476, 'md5': 'quoidIix5NB3ebkoC1ijtw==', 'fsize': 692411, 'resto': 42042114}]",1670933476,/alt/ - Alternative Idols General #771,
9,41770946,11/14/22(Mon)12:21:20,Anonymous,Never ever alone again!,101754848_p0,.png,2600,2000,250,192,1668446480553445,1668446480,kPpna/tvbh16Ozr+fF7daA==,3420379,0,0,0,never-ever,1,131,110,126.0,107.0,"[{'no': 42023688, 'now': '12/11/22(Sun)05:29:46', 'name': 'Anonymous', 'com': '<a href=""#p42022811"" class=""quotelink"">&gt;&gt;42022811</a><br>Sorry Kana i was busy, Good morning!', 'filename': '74013306', 'ext': '.jpg', 'w': 2019, 'h': 1435, 'tn_w': 125, 'tn_h': 88, 'tim': 1670754586494636, 'time': 1670754586, 'md5': 'ghufEmp5XdgDuQW0ISnUSA==', 'fsize': 1146920, 'resto': 41770946}, {'no': 42029062, 'now': '12/11/22(Sun)17:23:59', 'name': 'Anonymous', 'com': '<a href=""#p42022811"" class=""quotelink"">&gt;&gt;42022811</a><br>Because it&#039;s night.', 'time': 1670797439, 'resto': 41770946}, {'no': 42032619, 'now': '12/12/22(Mon)04:50:46', 'name': 'Anonymous', 'com': '<a href=""#p42029062"" class=""quotelink"">&gt;&gt;42029062</a><br>It&#039;s always morning somewhere<br>Good morning!', 'filename': '1660499509917', 'ext': '.png', 'w': 1536, 'h': 2048, 'tn_w': 93, 'tn_h': 125, 'tim': 1670838646382072, 'time': 1670838646, 'md5': 'tPJnAsBOc0/ft9kT0xHz9Q==', 'fsize': 3098791, 'resto': 41770946}, {'no': 42041362, 'now': '12/13/22(Tue)01:15:22', 'name': 'Anonymous', 'com': '<a href=""#p42032619"" class=""quotelink"">&gt;&gt;42032619</a><br>Good afternoon!', 'time': 1670912122, 'resto': 41770946}, {'no': 42042888, 'now': '12/13/22(Tue)07:10:53', 'name': 'Anonymous', 'com': '<a href=""#p42032619"" class=""quotelink"">&gt;&gt;42032619</a><br><a href=""#p42041362"" class=""quotelink"">&gt;&gt;42041362</a><br>Good afternoon!', 'filename': '1662847911819076', 'ext': '.png', 'w': 1000, 'h': 960, 'tn_w': 125, 'tn_h': 120, 'tim': 1670933453241206, 'time': 1670933453, 'md5': '5QGIwbvtIA60O7oNkGIEUQ==', 'fsize': 940832, 'resto': 41770946}]",1670933453,Never ever!,
10,42042734,12/13/22(Tue)06:51:29,Anonymous,"Guide: https://itazuraneko.neocities.org/<br><br>Previous threads:<br><a href=""/jp/thread/42029197#p42029197"" class=""quotelink"">&gt;&gt;42029197</a> (#3445)<br><a href=""/jp/thread/42007750#p42007750"" class=""quotelink"">&gt;&gt;42007750</a> (#3444)<br><a href=""/jp/thread/42007678#p42007678"" class=""quotelink"">&gt;&gt;42007678</a> (#3443)",DJT - Computer,.jpg,1058,1264,209,250,1670932289061521,1670932289,Eru1TqNkYQaynKZJYDWZPQ==,158900,0,0,0,djt-daily-japanese-thread-3446,1,2,1,,,"[{'no': 42042782, 'now': '12/13/22(Tue)06:57:12', 'name': 'Anonymous', 'com': '<a href=""#p42042734"" class=""quotelink"">&gt;&gt;42042734</a><br>what the fuck is ajatt (the website no the &quot;method&quot;, I think I get the gist of that)? the &quot;start here&quot; section of the page has a lot of words but doesn&#039;t really explain shit. anyone here use it?<br>yes I am a newfriend', 'time': 1670932632, 'resto': 42042734}, {'no': 42042867, 'now': '12/13/22(Tue)07:07:52', 'name': 'Anonymous', 'com': 'ai torpedo chichis', 'filename': '103552609_p0', 'ext': '.png', 'w': 768, 'h': 1152, 'tn_w': 83, 'tn_h': 125, 'tim': 1670933272537480, 'time': 1670933272, 'md5': 'R6I2IlP6MaPcPd69bUNIhg==', 'fsize': 752701, 'resto': 42042734}]",1670933272,DJT - Daily Japanese Thread #3446,
11,41905057,11/28/22(Mon)14:16:35,Anonymous,"Previous: <span class=""deadlink"">&gt;&gt;41722980</span>",FiaBs5FagAQ9Cvf,.jpg,1920,1080,250,140,1669662995514691,1669662995,7suEe1UqzyCGxjQrB1v9NA==,252315,0,0,0,virtual-youtubers,1,295,94,290.0,91.0,"[{'no': 42041207, 'now': '12/13/22(Tue)00:33:28', 'name': 'Anonymous', 'filename': '1658766176798645', 'ext': '.jpg', 'w': 1464, 'h': 2048, 'tn_w': 89, 'tn_h': 125, 'tim': 1670909608015192, 'time': 1670909608, 'md5': 'Z1+HqHDPMNYq+8VQ6qCCKQ==', 'fsize': 247574, 'resto': 41905057}, {'no': 42042073, 'now': '12/13/22(Tue)04:35:18', 'name': 'Anonymous', 'com': 'Apparently there a weekly VEE show on TokyoMX now. It&#039;s 2D and got no budget<br>https://mega.nz/folder/MNwVgayZ#SCS<wbr>FjbQ3QB7NJCW7EaqZvQ', 'filename': 'temp', 'ext': '.jpg', 'w': 1280, 'h': 720, 'tn_w': 125, 'tn_h': 70, 'tim': 1670924118851663, 'time': 1670924118, 'md5': '9ooR+4+Nu1BHYE1cdDTgkA==', 'fsize': 248781, 'resto': 41905057}, {'no': 42042612, 'now': '12/13/22(Tue)06:33:03', 'name': 'Anonymous', 'com': 'https://twitter.com/re_act_/status/<wbr>1602604242698502144<br>Haven’t been that many graduations from Re:AcT recently but you can’t escape the curse.', 'time': 1670931183, 'resto': 41905057}, {'no': 42042619, 'now': '12/13/22(Tue)06:33:54', 'name': 'Anonymous', 'filename': '1670917545233958', 'ext': '.jpg', 'w': 850, 'h': 1202, 'tn_w': 88, 'tn_h': 125, 'tim': 1670931234897338, 'time': 1670931234, 'md5': 'bpMcCUCw/pwHSRsGIPQW3A==', 'fsize': 101565, 'resto': 41905057}, {'no': 42042833, 'now': '12/13/22(Tue)07:02:49', 'name': 'Anonymous', 'com': 'it&#039;s pretty painful seeing siro bleeding subs', 'time': 1670932969, 'resto': 41905057}]",1670932969,Virtual Youtubers,
12,41889251,11/26/22(Sat)21:21:52,Anonymous,"Previous: <span class=""deadlink"">&gt;&gt;41832358</span>",FhMFiNcagAEnslP,.jpg,1536,2048,187,250,1669515712949649,1669515712,q0kFEU9TGs6eWhEyQPSYkw==,913671,0,0,0,rhythm-game-thread,1,158,25,153.0,24.0,"[{'no': 42040142, 'now': '12/12/22(Mon)21:06:40', 'name': 'Anonymous', 'com': '<a href=""#p42039870"" class=""quotelink"">&gt;&gt;42039870</a><br>Terrible sensors with awful sensitivity.<br>Buy L-TEK.', 'time': 1670897200, 'resto': 41889251}, {'no': 42040216, 'now': '12/12/22(Mon)21:17:06', 'name': 'Anonymous', 'com': '<a href=""#p42039870"" class=""quotelink"">&gt;&gt;42039870</a><br>You can buy a softpad to get started. The biggest problem with softpads is that they slip around (which can be solved with tape) and that their sensors degrade with use. None of these are a big issue when you just start out. Just don&#039;t go for a used pad and you should be good for several months.<br>I modded a softpad using this guide https://www.angelfire.com/pro2/soft<wbr>padmod/<br>and it honestly works great. I have it as a P2 pad when I have guests over. The sensitivity might even be better than stock L-tek, but it hasn&#039;t seen heavy use so I can&#039;t comment on its durability. I would advice against raising the panels, but it won&#039;t matter much until you start getting into faster streams, and the tactile feedback from the raised panels might help you out as a beginner.', 'time': 1670897826, 'resto': 41889251}, {'no': 42041779, 'now': '12/13/22(Tue)03:16:04', 'name': 'Anonymous', 'com': 'wtf am I looking at', 'filename': 'Fj19TMoUAAAqjc6', 'ext': '.jpg', 'w': 512, 'h': 544, 'tn_w': 117, 'tn_h': 125, 'tim': 1670919364934381, 'time': 1670919364, 'md5': 'Gc2JmVt2chB/fo//vpPgEA==', 'fsize': 271137, 'resto': 41889251}, {'no': 42041922, 'now': '12/13/22(Tue)04:01:59', 'name': 'Anonymous', 'com': '<a href=""#p42025159"" class=""quotelink"">&gt;&gt;42025159</a><br>they did it again with ReRave upgrade kits that can be installed on Technika cabs. good thing our local arcade didn&#039;t bit the bait, though unfortunately Technika cabs are basically extinct now <s>crack for T3 data when?</s>', 'time': 1670922119, 'resto': 41889251}, {'no': 42042830, 'now': '12/13/22(Tue)07:02:41', 'name': 'Anonymous', 'com': '<a href=""#p42041779"" class=""quotelink"">&gt;&gt;42041779</a><br>New jubeat Ave. unlock.', 'time': 1670932961, 'resto': 41889251}]",1670932961,Rhythm Game Thread,
