,no,now,name,com,filename,ext,w,h,tn_w,tn_h,tim,time,md5,fsize,resto,bumplimit,imagelimit,semantic_url,custom_spoiler,replies,images,omitted_posts,omitted_images,last_replies,last_modified,sub,trip
65,41811737,11/18/22(Fri)23:22:25,Anonymous,Why is Reimu lazy for a shrine maiden? Isn’t she worried that Sanae will steal her thunder?,1668021547491929,.png,1301,476,250,91,1668831745750491,1668831745,B7Rne8LHqk+zbL9x53qtwg==,362193,0,0,0,why-is-reimu-lazy-for-a-shrine-maiden-isnt-she,1,147,76,142.0,72.0,"[{'no': 42033707, 'now': '12/12/22(Mon)07:43:57', 'name': 'Anonymous', 'com': '<a href=""#p42031652"" class=""quotelink"">&gt;&gt;42031652</a><br>I wanna see her husband get stolen away after being endlessly harassed by the girls and tempted with genuine love and affection', 'time': 1670849037, 'resto': 41811737}, {'no': 42035939, 'now': '12/12/22(Mon)11:47:44', 'name': 'Winter Blues vi', 'com': 'Schedules were made and became iron clad rules, as the days alternated you were going from spending quality time with Reimu where she clung to you and tried appealing to whatever feelings you still held with her to the wild experiments with Marisa and personally tailored lesson from Kasen which left you enriched. Marisa took you and started teaching you magic and alchemy much to Reimu&#039;s disapproval and Kasen taught you the harsh lessons a hermit learns and helped forge your body and mind in an effort to regain your oldself. With all your heart you wanted too remember Reimu as the one that gave you the most but after the first year or so of pure love you shared you couldn&#039;t remember anything but the years of pain and loathing which in the end was only remedied by the love Kasen and Marisa shared with you during your short but eventful stay at Kasen&#039;s senkai.<br>Despite winter coming into itself properly as per this time of year and the sky being more gray and overcast then in the autumn months the gray seemed less intense then it used to be by a smidge. The cold wind that more often then not held a flurry or two of pure white snowfall didn&#039;t seem to penetrate the shrine with its biting chill either as the monotone that threatened the world was stopped at the paper walls. Today was one of Reimu&#039;s days to watch you and despite the girls often hoarding you to themselves it went without saying that a lot of the free time you all shared was spent in the familiar living room of the shrine chatting and sipping tea under the Kotatsu that seemed to sap all the will out its residents.<br>As it was Reimu&#039;s day the jealous miko was clinging to your side often trying to engage you in conversation you didn&#039;t care to carry on much as the rest of the girls aside from Aunn ignored Reimu almost pointedly. Aunn engaged with Reimu perhaps feeling sorry for her while Aunn was practically submerged into the kotatsu, something thats become a habit ever since she gained her human form, and became Reimu&#039;s emotional support despite the manifest weariness that showed in Aunn&#039;s eyes as she looked at her. Perhaps out of habit but when Reimu started seeming about to breakdown from the paradoxical isolation in the crowded living room you stroked her shoulders or held her hand tighter allowing her that much needed relief from the hole she dug for herself over the years which resulted in everyone close to her abandoning her.<br>The morning passed quickly after everyone filtered out to get up to their own devices and Reimu herself had you in tow as she did mundane tasks no one else was willing to help her with like snow shoveling and upkeeping the shrine. You could tell she was growing ever more dependent on you in the short time the girls she once called friends started openly trying to make their moves on you and the memories of her desperation in preventing your suicide were fresh. Back when your relationship was new and again before your failed attempt at ending your life Reimu was happy enough letting you take one task as she does another but now it seemed that she won&#039;t let you out of earshot and seemed to fumble over herself at every word you said in a scramble for any bit of attention you&#039;d give her despite the mask she thought she could wear around you. Soon enough the snow along the path to the offering box and leading to the residence was cleared enough to satisfy the needy miko and as you put the shovels away into the little auxiliary shed with her and she pulled you aside before you could walk out. With a bashful and somewhat desperate expression on her face she whispered as if someone could be listening in at any point, &quot;Hey Anon... You know we don&#039;t really have much privacy at home anymore so would you want to... do it in here...?&quot;. Reimus face flushed a bit as she glanced at a relatively clear table stored away and you face remained rather impassive despite the pang of lust that seemed to flare up despite not feeling anything approaching it for a very long time, you knew after all that Reimu and the other girls were treating you like a piece of meat at times in the way they&#039;ve been stealing glances at your body and all but openly inviting you into their futons when you&#039;ve been all but forced to sleep in the same rooms as them as per the agreement they made amongst themselves.<br>Returning her blushing gaze with the tired emotionless mood you&#039;ve found yourself rutted in you could only ask, &quot;Do you really need to do that sort of thing now?&quot; which seemed like a splash of water on Reimu as she couldn&#039;t keep herself calm. Her eyes turned watery as she held herself back emotionally, &quot;A-ah no of course not, if its a bother its fine! Really I should&#039;ve known that you wouldn&#039;t be in the mood considering...&quot;. Reimu moved with embarrassment out of the shed and you sighed inwardly, for better or worse you were her husband and this was but one of your duties in the end so you scooped her up making her yelp and you placed her on the table butt first.', 'filename': 'Reimu dodging', 'ext': '.jpg', 'w': 850, 'h': 1511, 'tn_w': 70, 'tn_h': 125, 'tim': 1670863664559851, 'time': 1670863664, 'md5': 'hdeiAtG8x8tu93HQj7ESTA==', 'fsize': 173102, 'resto': 41811737}, {'no': 42040092, 'now': '12/12/22(Mon)21:00:12', 'name': 'Winter Blues vi', 'com': 'Reimu at first was a little confused as she looked at you, trying to determine what you were thinking and perhaps due to your earlier reluctance her proposed tryst on the very same table your motivation didn&#039;t come to her quickly. Seeing her confused face try to figure out what you were up too as you loomed over her was genuinely amusing but delaying any longer would only waste your time and you had to get lunch ready soon. &quot;Umm, Anon you&#039;re not mad are you...?&quot;, Reimu asked in a soft and cute voice that seemed to drown itself out as she spoke into the muffler wrapped around her neck. You shook your head and with a firm tone you said without mincing words, &quot;I haven&#039;t felt that a very long time, and taking care of you is my job&quot;. Your voice carried no warmth however and caused a complex expression to come over Reimu&#039;s face but she made no more comments as you took her into your arms.<br>She didn&#039;t resist in anyway but she didn&#039;t seem to return the favor as you took to her lips softly as if tasting them after kissing up her neck to reach them while caressing her like you knew she liked in order to get her in the mood. Her body was pleasantly warm to the touch as your hands purposefully glided over her skin and you teasingly increased her sensitivity after slipping them under her warm and baggy winter miko outfit, and despite her troubled expression you knew what you were doing and recognized all her tells. You pushed her back further onto the table as you shifted her waist up and sifted in her long dress till you could work through the multi layers of puff and reached the traditional puffy bloomers all girls in Gensokyo seemed to wear, &quot;a job...&quot; you heard escape from Reimu&#039;s mouth. With nimble and practiced fingers you started massaging Reimu&#039;s familiar and warm puffy lips with your thumb and fingers in the way you knew she liked and reading your mark right you soon were rewarded with a feeling of hot wetness that leaked through her bloomers.<br>You pulled back to get ready for the next part taking in the seemingly contradictory sight of the emotional miko&#039;s flushed face showing clear signs of pleasure while also betraying a deeper sadness every time her eyes met your own impassive face. However she said nothing to stop you from doing what she asked for and you slid off her bloomers casting them to the side on a relatively clean crate. Her dress was pulled up revealing her supple and lithe hips and always alluring lower mouth topped with a thick patch of black hair that was already slick with her love juice and slightly parted as if already begging for you to plug her. Merely the sight of the sloppy looking entrance was enough to start getting you hard as you pulled out your own semi-hard penis and grasped her by the waist pulling her eager and flushed pussy up to your manhood. Despite Reimu&#039;s sense of guilt the mood had clearly gotten the better of her as she stripped the glove off one of her hands and reached down her torso to grasp your hovering manhood stroking it with her own slightly cold hands that felt rather pleasant in contrast to your own cock which was only getting hotter as it got stiffer under her careful and greedy strokes and tugs and you returned the favor of coaxing her clit out of its hiding place and lightly pinching and rubbing it. She didn&#039;t stop her relentless assault even as your hips started moving as if possessed by your lust and started establishing a rhythm as you pressed your now erect and hot dick against her cool fingers and palm.<br>It wasn&#039;t long at that point till your mind had nothing but plunging into the lewd miko in it and as she climaxed from your relentless assault on her lusty clit she let you go allowing you to line yourself up and plunge into her. &quot;W-wait I just came! Don&#039;t be so..!&quot;, despite her protests you couldn&#039;t help yourself and while you wanted to give her some time to recover you couldn&#039;t bear it and started moving your hips instinctively and with a wet sound the miko&#039;s lewd voice rang out into the small shed as she clung to you for stability as the powerful sensations rocked her body. You moved slowly at first with all the restraint you were willing to muster as a flushed miko had her arms wrapped around the back of your neck and soon she passionately returned the kisses you gave her tenfold. You took this as your queue to start moving in earnest as your hips sped up naturally seeking her weak spots as your arms wrapped around her and her legs locked into place around your waist. The hot wet sensations enveloped your mind entirely as you frantically thrust into her hitting her right where it felt best over and over causing her to moan into your mouth before an orgasm caused her to wrap you up tighter as your own cock sprayed its hot load into the miko&#039;s thirsty pussy.<br>You both basked in the afterglow before composing yourself and she clung to your arm as you walked back to the warmth of the shrine where she gave the girls the smuggest look you&#039;ve seen on her face.', 'filename': 'Reimu teasing', 'ext': '.jpg', 'w': 1241, 'h': 1879, 'tn_w': 82, 'tn_h': 125, 'tim': 1670896812431151, 'time': 1670896812, 'md5': 'IKSGRhGveYmJ0Ro+O+EC7g==', 'fsize': 285923, 'resto': 41811737}, {'no': 42040103, 'now': '12/12/22(Mon)21:01:25', 'name': 'Winter Blues vi', 'com': 'So technically a part two of the last story despite the time that&#039;s passed IRL but I hope one of you is able to enjoy it before we move the main story on further!<br>Lets all love our &#039;mu!', 'filename': 'Reimu fumo', 'ext': '.gif', 'w': 468, 'h': 498, 'tn_w': 117, 'tn_h': 125, 'tim': 1670896885437443, 'time': 1670896885, 'md5': 'oynO+AaPVGCrrVOhMbs8cA==', 'fsize': 3720749, 'resto': 41811737}, {'no': 42041873, 'now': '12/13/22(Tue)03:41:55', 'name': 'Winter Blues vii', 'com': 'The interior of Marisa&#039;s borrowed workshop was rather cramped and since she didn&#039;t let you clean up in here it was getting rather dusty in certain places over the past week or so since she set everything up. The room was warm on account of her magically powered room heater that looked suspiciously like a model from the outside world that she insisted she bought from the kappa and the body heat from the two of you, you sat across a scuffed waist high table with books in the both of your hands as you studied. Silence prevailed in the room with only the occasional clicking of the heating elements going on and off periodically as it fought to keep the room a comfortable temperature despite the freezing cold that liked to try creeping in through the largely uninsulated walls. The room was stuffed with a motley collection of items some with clear purpose and some you suspected she brought in just because she liked the way it looked, all of it arranged around a cluttered work station covered in alchemical ingredients, tools of the trade, and magical devices in various states of dissemble as well on the opposing wall of the station was a large bookshelf with some of the shelves covered with other ingredients and devices whoes functions and uses you couldn&#039;t grasp. The good lighting that brightened up the room well came from a single bright standing lamp that illuminated the room well and seemed to be controlled by input from the black and white mage with a simple flick of the wrist which you suspected wasn&#039;t actually needed.<br>Not for the first time you were impressed by the studious nature of the blonde witch that you&#039;d never get if you only knew her as the reckless girl she presents herself as. You were honored that you were one of the few people that actually knew this side of the straightforward and brash yet somewhat whimsical witch and noted that on the times you&#039;ve been able to visit her house it was cluttered with even more materials, books, and devices that you knew were all read and experimented on. The blonde and white witch sat upon her practically made padded wooden chair with the black tea you&#039;ve previously provided sitting in a western style cup infront of her, a pair of reading glasses rested on the gentle curve of her nose as her sharp blue eyes focused on the knowledge in front of her. You noted that every now and then her braid would fall onto her face which seemed to bother her slightly as she always reset it only for the cycle to repeat again as she moved subtly shifting about slightly as she read, her eyes never breaking contact with the words on the page and you couldn&#039;t help but have your gaze transfixed onto her whenever you looked up from your own reading material.<br>Being with Marisa like this seemed to let you truly relax it seemed, with Reimu even when you were simply resting together or enjoying a meal you always seemed to be set slightly on edge as an ingrained response that you couldn&#039;t quite shake from the past 3 years of hell you went through. However this was never an issue with the girl in front of you, you&#039;ve seen her mad for sure but it was always a &quot;normal&quot; kind of rage that dissipated itself and even at worst wasn&#039;t overly sadistic. You couldn&#039;t help another gaze after finishing the latest chapter of the book you held that went over the basics of the elements and what they are in nature and once again you found yourself enchanted by the enchantress in front of you as she sat with her legs crossed as the winter hardened black dress she usually wore somehow accented her form despite its increased bagginess but perhaps that was your thoughts only because you still remember the night you shared together.<br>You remembered your vows however and dispelled those thoughts from your mind and any stirring thoughts and feelings of love in you died as you remembered the lot you made for yourself as the weight of your fate replaced the hope you felt and a part of you cursed yourself for letting your heart of letting yourself taste those feelings again. You placed the bookmark in your learning materials and closed it softly, you were almost through with it but in more ways then one you needed a break. That action caught Marisa&#039;s attention and she looked up from her book, barely halfway through but the material in it was undoubtedly denser and you heard her voice ring out lacking the usual teasing aspects and levity &quot;need a break anon-kun? I need to rest my eyes so lets get out the snacks&quot;. She closed the book after marking it with a dog ear and took off her reading glasses placing them both on the table in front of her carefully as if the book would fall apart. With some rummaging worryingly close to the alchemical ingredients she told you were dangerous and to be avoided she pulled out a simple box and placed it on the table, and with the usual attitude returning she smiled brightly &quot;Here, I got these from the village last time I went out since I thought they&#039;d go great with your tea, try them!&quot;', 'filename': 'Reimu Marisa yukkuri', 'ext': '.jpg', 'w': 1500, 'h': 1057, 'tn_w': 125, 'tn_h': 88, 'tim': 1670920915194511, 'time': 1670920915, 'md5': 'BULeQG3tey6ZtVpU5ettpg==', 'fsize': 756590, 'resto': 41811737}]",1670920915,,
66,42041134,12/13/22(Tue)00:16:53,Anonymous,hololive,1660697941159057,.jpg,801,214,250,66,1670908613502399,1670908613,hRp1yJ+TDpFbZL4w5Jha0g==,41596,0,1,0,hololive,1,862,207,857.0,207.0,"[{'no': 42042911, 'now': '12/13/22(Tue)07:14:05', 'name': 'Anonymous', 'com': '<span class=""quote"">&gt;losing to miko</span><br>what a horrifying fate', 'time': 1670933645, 'resto': 42041134}, {'no': 42042913, 'now': '12/13/22(Tue)07:14:26', 'name': 'Anonymous', 'com': 'ayame just bluergh&#039;d at nakirigumi...', 'time': 1670933666, 'resto': 42041134}, {'no': 42042914, 'now': '12/13/22(Tue)07:14:32', 'name': 'Anonymous', 'com': 'migo&#039;s being weird again', 'time': 1670933672, 'resto': 42041134}, {'no': 42042915, 'now': '12/13/22(Tue)07:14:38', 'name': 'Anonymous', 'com': '<a href=""#p42042906"" class=""quotelink"">&gt;&gt;42042906</a><br>Irrelevant sidebranch watching dog seething when confronted with the gospel truth. You will never be tolerated.', 'time': 1670933678, 'resto': 42041134}, {'no': 42042922, 'now': '12/13/22(Tue)07:15:13', 'name': 'Anonymous', 'com': '<span class=""quote"">&gt;chat going &quot;nice mikochi&quot;</span><br>fucking degenerates all of you', 'time': 1670933713, 'resto': 42041134}]",1670933713,hololive,
67,41864124,11/24/22(Thu)08:31:51,Anonymous,A lovely thread for my lovely and beloved Alice Margatroid!,__alice_margatroid_touhou_drawn_by_nauka__af60c958233088519bf965afe28e2fa0,.jpg,1536,1920,200,250,1669296711215742,1669296711,/VEcuCqMrgJPXveYZq9nyA==,686582,0,0,0,alice-thread,1,89,58,84.0,54.0,"[{'no': 42032579, 'now': '12/12/22(Mon)04:41:27', 'name': 'Anonymous', 'com': 'I love alice so much bros she reminds me of my mother (who has almost as many mental diseases as her)', 'filename': 'alice crying', 'ext': '.jpg', 'w': 279, 'h': 350, 'tn_w': 99, 'tn_h': 125, 'tim': 1670838087733665, 'time': 1670838087, 'md5': 'FGubJCnivFddRWmSPXq7DA==', 'fsize': 28859, 'resto': 41864124}, {'no': 42036553, 'now': '12/12/22(Mon)13:08:19', 'name': 'Anonymous', 'com': '<a href=""#p42032579"" class=""quotelink"">&gt;&gt;42032579</a><br>we know, shanghai', 'time': 1670868499, 'resto': 41864124}, {'no': 42041043, 'now': '12/12/22(Mon)23:52:10', 'name': 'Alice&#039;s bf', 'com': '<a href=""#p42036553"" class=""quotelink"">&gt;&gt;42036553</a><br>If Alice is the mother then im the father', 'filename': '__alice_margatroid_and_shanghai_doll_touhou_drawn_by_ruku_alicecreation__5bbd99c8d2b38133328ed25c7dfb1e38 (1)', 'ext': '.jpg', 'w': 1200, 'h': 975, 'tn_w': 125, 'tn_h': 101, 'tim': 1670907130260120, 'time': 1670907130, 'md5': 'xk7TzK1nrNTN5AeGnFaayg==', 'fsize': 319349, 'resto': 41864124}, {'no': 42041489, 'now': '12/13/22(Tue)01:45:07', 'name': 'Anonymous', 'com': '<a href=""#p42036553"" class=""quotelink"">&gt;&gt;42036553</a><br>Wtf how&#039;d you figure it was me', 'filename': '__shanghai_doll_touhou_drawn_by_hammer_sunset_beach__bc0e53ec03fd85be259ee87aea3332bd', 'ext': '.jpg', 'w': 713, 'h': 1000, 'tn_w': 89, 'tn_h': 125, 'tim': 1670913907392727, 'time': 1670913907, 'md5': '/kFZGkOD2mi3btDVBPJqzw==', 'fsize': 618003, 'resto': 41864124}, {'no': 42041808, 'now': '12/13/22(Tue)03:23:52', 'name': 'Anonymous', 'com': '<a href=""#p41889889"" class=""quotelink"">&gt;&gt;41889889</a><br>based saucerful', 'filename': '29E317AB-F506-44BA-8FD1-35A2C48C4D0B', 'ext': '.jpg', 'w': 1602, 'h': 2048, 'tn_w': 97, 'tn_h': 125, 'tim': 1670919832857365, 'time': 1670919832, 'md5': 'AUC0LRNnZ2aTmU3ex8DXWA==', 'fsize': 335532, 'resto': 41864124}]",1670919832,Alice Thread,
68,42029685,12/11/22(Sun)18:29:09,Anonymous,"Okay so I&#039;m recently getting into JAV and god damn you because I can never look at disgusting western women again. Anyway, what goes on with JAV? <br>It&#039;s clearly a big industry with a lot of worldwide demand for the product. and yet all of that product seems to be made freely available from download sites like Onejav and Javjunkies immediately, in high quality file sizes, complete with cover art. Who is doing this? There are several films per day uploaded. Does anyone actually pay for JAV? Why would they?<br>Next: who makes and distributes it? I suppose the Yakuza are involved but what&#039;s their business model when it&#039;s free everywhere?<br>Next: the girls. They clearly don&#039;t get paid much because JAV has low production values, clearly low budget, almost gonzo quality porn so how much do the girls get paid? Why do the girls do it? Most of them seem like nice, sweet, normal girls rather than the tattooed drug-addled skanks in western porn. The Japanese girls seem wholesome, which makes it hotter. How do you get a pretty 18 year old girl to volunteer for the most fucked-up shit - jizzed on by fifty men, enema and squirting watery shit halfway across the room, licking some old dude&#039;s anus clean, simulated rape etc for clearly not much money?<br>It&#039;s just such a different cultural phenomenon to western porn, I love the whacky, inventive ways they compensate for the mosaic censorship.",1492815520685,.jpg,1920,1080,250,140,1670801349471560,1670801349,sZMbug2w4fOzQ6/+62nwEw==,183455,0,0,0,i-has-questions-about-jav,1,16,1,11.0,1.0,"[{'no': 42039116, 'now': '12/12/22(Mon)18:37:33', 'name': 'Anonymous', 'com': '<a href=""#p42036072"" class=""quotelink"">&gt;&gt;42036072</a><br>do you mean $7000? Even that&#039;s not much for having twenty random guys in ski-masks wank into my mouth or getting bundled into a van and raped in the woods. I don&#039;t know why pretty girls from first-world countries do it, low-self-esteem?', 'time': 1670888253, 'resto': 42029685}, {'no': 42039540, 'now': '12/12/22(Mon)19:33:38', 'name': 'Anonymous', 'com': '<a href=""#p42037170"" class=""quotelink"">&gt;&gt;42037170</a><br><span class=""quote"">&gt;I just can&#039;t think of a single western woman who could be mistaken for a normal, wholesome girl whereas that&#039;s the norm for JAV actresses.</span><br>There I fixed it for you.', 'time': 1670891618, 'resto': 42029685}, {'no': 42039593, 'now': '12/12/22(Mon)19:44:15', 'name': 'Anonymous', 'com': '<a href=""#p42039116"" class=""quotelink"">&gt;&gt;42039116</a><br>all of us have our kinks, for some of them when they are getting extremely horny they probably get overwhelmed with the desire to be penetrated by multiple guys', 'time': 1670892255, 'resto': 42029685}, {'no': 42039626, 'now': '12/12/22(Mon)19:49:37', 'name': 'Anonymous', 'com': '<a href=""#p42037279"" class=""quotelink"">&gt;&gt;42037279</a><br>The reason they need a side job is because the job isn&#039;t consistent. How many actresses do you know that are releasing a new film every week? The only cases I know of is of Workaholics like Yui Hatano and Ai Uehara. Most of them release a film once every 3 or so months, besides the fact that AV actresses aren&#039;t known to be wise using money (See; Hoshina Ai in host club debt almost killing herself, Ai uehara getting scammed, Mari Rika having to come out of retirement because she&#039;s broke). It is true that some of them get paid real low because their managers are taking advantage of them, but even then they make around 2k at the very least.<br><br><a href=""#p42037497"" class=""quotelink"">&gt;&gt;42037497</a><br>Are you talking about FC2 videos? Those are the japanese equivalent to homemade amateur actress director studios, so not much.<br><br><a href=""#p42038042"" class=""quotelink"">&gt;&gt;42038042</a><br><a href=""#p42037614"" class=""quotelink"">&gt;&gt;42037614</a><br>In USD<br><br><a href=""#p42039116"" class=""quotelink"">&gt;&gt;42039116</a><br>Put it into perspective: 7k is about 3 months of hard minimum wage work, why do that when you can make that in a single film? That is the type of thinking most of them have. Easy, quick money if albeit shameful.', 'time': 1670892577, 'resto': 42029685}, {'no': 42041556, 'now': '12/13/22(Tue)02:07:21', 'name': 'Anonymous', 'com': '<a href=""#p42034544"" class=""quotelink"">&gt;&gt;42034544</a><br>I&#039;ve always been curious to know how they do the fake creampies. I know they are using condoms but wonder how they get the fake cum inside.', 'time': 1670915241, 'resto': 42029685}]",1670919750,I has questions about JAV,
