,no,now,name,sub,com,filename,ext,w,h,tn_w,tn_h,tim,time,md5,fsize,resto,bumplimit,imagelimit,semantic_url,custom_spoiler,replies,images,omitted_posts,omitted_images,last_replies,last_modified,trip,filedeleted
33,41742800,11/11/22(Fri)14:05:14,Anonymous,Stardust Idols Thread #71,"Info, news, blog<br>http://www.stardustplanet.jp/<br>https://www.stacommu.jp/home<br>STARDUST PLANET - We Are &quot;STAR&quot; / https://youtu.be/AjGIED2W7I0<br><br>Previous Thread: <span class=""deadlink"">&gt;&gt;41559058</span>",FhSgVs8agAAN2WE,.jpg,1478.0,1108.0,250.0,187.0,1668193514282837.0,1668193514,zDZu1ABzqIXQdrqw+o9qvg==,220396.0,0,0,0,stardust-idols-thread-71,1,292,145,287.0,143.0,"[{'no': 42011375, 'now': '12/09/22(Fri)18:24:48', 'name': 'Anonymous', 'com': '<a href=""#p42009392"" class=""quotelink"">&gt;&gt;42009392</a><br>my d wouldnt be able to handle that', 'time': 1670628288, 'resto': 41742800}, {'no': 42011458, 'now': '12/09/22(Fri)18:42:33', 'name': 'Anonymous', 'com': '<a href=""#p42009392"" class=""quotelink"">&gt;&gt;42009392</a><br>julia is way sexier than cockona without even trying. imo cockona is arin tier sexy except she actually bought into her own act', 'time': 1670629353, 'resto': 41742800}, {'no': 42011750, 'now': '12/09/22(Fri)19:30:21', 'name': 'Anonymous', 'com': '<a href=""#p42011458"" class=""quotelink"">&gt;&gt;42011458</a><br>this, juli is naturally sexy <s>just her normal pics turn me on e.e</s><br><br>cocona is hot too but juli hnnngg', 'time': 1670632221, 'resto': 41742800}, {'no': 42013311, 'now': '12/09/22(Fri)23:20:55', 'name': 'Anonymous', 'filename': 'b.o.l.t.aya_shirahama_official-20221210-0004', 'ext': '.jpg', 'w': 1440, 'h': 1800, 'tn_w': 100, 'tn_h': 125, 'tim': 1670646055297137, 'time': 1670646055, 'md5': 'fo4qjHSvkwSA5WfkmptYsA==', 'fsize': 289969, 'resto': 41742800}, {'no': 42015076, 'now': '12/10/22(Sat)05:51:22', 'name': 'Anonymous', 'filename': 'KND_5529', 'ext': '.jpg', 'w': 1280, 'h': 855, 'tn_w': 125, 'tn_h': 83, 'tim': 1670669482963834, 'time': 1670669482, 'md5': 'aJEFfSC6zU+AtQxnOCRbHA==', 'fsize': 268571, 'resto': 41742800}]",1670669482,,
34,42013082,12/09/22(Fri)22:38:11,Anonymous,Denpa Thread,WELCOME TO DENPA WORLD<br><br>Denpa song English guide:<br>http://denpa.omaera.org<br>Wikipedia:<br>http://en.wikipedia.org/wiki/Denpa_<wbr>song<br>Denpa no Sekai Blog:<br>https://denpanosekai.blogspot.com/<br>Music downloads:<br>Various recent doujin uploads: https://doujinstyle.com<br>Artist discographies &amp; Collections: https://gist.github.com/dnpcllctns/<wbr>9424fcc4c80429253d3194251b4a15ed<br>Individual uploads since June 2018: https://gist.github.com/dnpcllctns/<wbr>f79394cd283ee30834ee6e4bb484b502<br>RTL Mediafire (older albums): http://www.mediafire.com/RapeTheLol<wbr>is<br>Outdated mediafire: http://www.mediafire.com/denpasong<br>Denpa song bot (new songs every day):<br>http://twitter.com/dempa_bot<br>In-detail analysis of denpa aesthetic:<br>http://altairandvega.wordpress.com/<wbr>2012/03/21/denpa-bigaku-riron-the-r<wbr>ise-of-the-radio-aesthetic-in-japan<wbr>ese-subculture-in-the-21st-century/<wbr><br>Denpunk bot:<br>http://twitter.com/dempunk_bot,DEMPA NYANNYAN,.jpg,600.0,600.0,250.0,250.0,1670643491399345.0,1670643491,/mw7Nj0QOU7b6ufh1/EhSQ==,276108.0,0,0,0,denpa-thread,1,3,0,,,"[{'no': 42013205, 'now': '12/09/22(Fri)23:00:53', 'name': 'Anonymous', 'com': 'I don&#039;t know if this one is well known but I found ちぃむdmp (team dmp) (2010-2014) (Momobako and Aihara Kaori) semi recently and it&#039;s growing on me. Overall fanservicey and fun, not special but good music, albums have nicer than usual flow.<br><br>https://vgmdb.net/artist/14737', 'time': 1670644853, 'resto': 42013082}, {'no': 42014821, 'now': '12/10/22(Sat)05:03:52', 'name': 'Anonymous', 'com': 'https://youtu.be/l4Bdk0_ATlI', 'time': 1670666632, 'resto': 42013082}, {'no': 42014999, 'now': '12/10/22(Sat)05:40:42', 'name': 'Anonymous', 'com': '<a href=""#p42013205"" class=""quotelink"">&gt;&gt;42013205</a><br>teamDMP was one of the popular groups back in the day yeah, momobako has gone on to become a vtuber named patra and still makes music.', 'time': 1670668842, 'resto': 42013082}]",1670668842,,
35,41580845,10/26/22(Wed)03:11:37,Anonymous,Ran,Yakumo,4ca3d109284986701e6fe1183157e32f,.jpg,2894.0,4093.0,176.0,250.0,1666768297285381.0,1666768297,hwbP83twXf6MorauaID4sQ==,3833531.0,0,0,0,ran,1,278,188,273.0,187.0,"[{'no': 42010055, 'now': '12/09/22(Fri)15:19:41', 'name': 'Anonymous', 'filename': '__yakumo_ran_touhou_drawn_by_poronegi__a851e618259521413a95fa0e0b41dc93', 'ext': '.jpg', 'w': 900, 'h': 1049, 'tn_w': 107, 'tn_h': 125, 'tim': 1670617181082007, 'time': 1670617181, 'md5': '2hJbBkgRf4/BM8l0F6kHmQ==', 'fsize': 161174, 'resto': 41580845}, {'no': 42012261, 'now': '12/09/22(Fri)20:29:58', 'name': 'Anonymous', 'com': '<a href=""#p42007111"" class=""quotelink"">&gt;&gt;42007111</a><br>I&#039;m still alive. I guess it wasn&#039;t me.', 'time': 1670635798, 'resto': 41580845}, {'no': 42012462, 'now': '12/09/22(Fri)20:56:55', 'name': 'Anonymous', 'com': '<a href=""#p42007111"" class=""quotelink"">&gt;&gt;42007111</a><br>Hope he finds the fluff and warm he was looking for, in the afterlife.', 'time': 1670637415, 'resto': 41580845}, {'no': 42013997, 'now': '12/10/22(Sat)01:58:31', 'name': 'Anonymous', 'com': '<a href=""#p42007111"" class=""quotelink"">&gt;&gt;42007111</a><br>Why did he choose today in particular?', 'time': 1670655511, 'resto': 41580845}, {'no': 42014969, 'now': '12/10/22(Sat)05:36:24', 'name': 'Anonymous', 'com': '<a href=""#p42007111"" class=""quotelink"">&gt;&gt;42007111</a><br>fuck these feels man<br>i came here to be tipsy and horny, not drunk and sad<br>i cant get ran&#039;s bright smile out of my head now', 'time': 1670668584, 'resto': 41580845}]",1670668584,,
36,41990352,12/07/22(Wed)13:58:46,Anonymous,Seiyuu Thread,"Previous: <a href=""/jp/thread/41938366#p41938366"" class=""quotelink"">&gt;&gt;41938366</a>",,,,,,,,1670439526,,,0,0,0,seiyuu-thread,1,249,49,244.0,47.0,"[{'no': 42013701, 'now': '12/10/22(Sat)00:34:33', 'name': 'Anonymous', 'com': '<a href=""#p42013655"" class=""quotelink"">&gt;&gt;42013655</a><br>This is idol seiyuu.<br>https://youtu.be/1dW3p8soDgU?t=1012<wbr>', 'time': 1670650473, 'resto': 41990352}, {'no': 42013721, 'now': '12/10/22(Sat)00:39:59', 'name': 'Anonymous', 'com': '<a href=""#p42013701"" class=""quotelink"">&gt;&gt;42013701</a><br>What a goddess. She got the whole stadium under her thumbs.', 'filename': 'snapshot2', 'ext': '.jpg', 'w': 1920, 'h': 1080, 'tn_w': 125, 'tn_h': 70, 'tim': 1670650799184012, 'time': 1670650799, 'md5': 'M6Geu8RmZ4+YTbN6TuR5Vw==', 'fsize': 238730, 'resto': 41990352}, {'no': 42013959, 'now': '12/10/22(Sat)01:44:46', 'name': 'Anonymous', 'com': 'https://twitter.com/tsuda_ken/statu<wbr>s/1601445137225482240<br><br>Tsuda Kenjiro tested positive for Covid19.', 'time': 1670654686, 'resto': 41990352}, {'no': 42014786, 'now': '12/10/22(Sat)04:56:49', 'name': 'Anonymous', 'com': 'https://youtube.com/watch?v=pLILj7X<wbr>2Jhk<br>https://youtube.com/watch?v=PSNu6p-<wbr>q7gg', 'filename': 'FjfcA-kVIAMe_Cg', 'ext': '.jpg', 'w': 1280, 'h': 720, 'tn_w': 125, 'tn_h': 70, 'tim': 1670666209045101, 'time': 1670666209, 'md5': 'iUMG5EmltVeqcazWUrCa4w==', 'fsize': 131990, 'resto': 41990352}, {'no': 42014945, 'now': '12/10/22(Sat)05:32:23', 'name': 'Anonymous', 'com': '<a href=""#p42014786"" class=""quotelink"">&gt;&gt;42014786</a><br>Wall wins again.', 'time': 1670668343, 'resto': 41990352}]",1670668343,,1.0
37,41676651,11/04/22(Fri)21:38:46,Anonymous,,Going on a date,__komeiji_koishi_touhou_drawn_by_kirikaze_ren__38d30c739591e6dae0395790b5df4e35,.png,1530.0,2164.0,176.0,250.0,1667612326815001.0,1667612326,NMyn+FQq1F6gkgzhVJImLA==,1917146.0,0,0,0,going-on-a-date,1,213,62,208.0,61.0,"[{'no': 41994242, 'now': '12/07/22(Wed)21:59:28', 'name': 'Anonymous', 'com': '<a href=""#p41679854"" class=""quotelink"">&gt;&gt;41679854</a><br>Nice', 'time': 1670468368, 'resto': 41676651}, {'no': 42001214, 'now': '12/08/22(Thu)15:53:09', 'name': 'Anonymous', 'com': '<a href=""#p41979205"" class=""quotelink"">&gt;&gt;41979205</a><br>I want to fuck Koishi so bad', 'time': 1670532789, 'resto': 41676651}, {'no': 42008697, 'now': '12/09/22(Fri)12:10:13', 'name': 'Anonymous', 'filename': '2bef0f5a36cb34828c43695c6f8b3c0c', 'ext': '.png', 'w': 1181, 'h': 1748, 'tn_w': 84, 'tn_h': 125, 'tim': 1670605813934769, 'time': 1670605813, 'md5': 'OsRgzQ2ivXZce5Z2w4EUsA==', 'fsize': 1740098, 'resto': 41676651}, {'no': 42008760, 'now': '12/09/22(Fri)12:17:05', 'name': 'Anonymous', 'com': '<a href=""#p42008697"" class=""quotelink"">&gt;&gt;42008697</a><br>Koishi, what&#039;s that between your legs?', 'time': 1670606225, 'resto': 41676651}, {'no': 42014922, 'now': '12/10/22(Sat)05:26:18', 'name': 'Anonymous', 'com': '<a href=""#p42008760"" class=""quotelink"">&gt;&gt;42008760</a><br>What is &quot;That&quot;?', 'time': 1670667978, 'resto': 41676651}]",1670667978,,
38,41947890,12/03/22(Sat)07:53:11,Anonymous,,The extremely fashionable Hecatia!,Fg42QKyaAAAsmEV,.jpg,768.0,994.0,193.0,249.0,1670071991890051.0,1670071991,mXXtu5LmPjUU6+p6AE8+7Q==,79575.0,0,0,0,the-extremely-fashionable-hecatia,1,27,11,22.0,9.0,"[{'no': 41981738, 'now': '12/06/22(Tue)16:31:07', 'name': 'Anonymous', 'filename': '03', 'ext': '.jpg', 'w': 1280, 'h': 1834, 'tn_w': 87, 'tn_h': 125, 'tim': 1670362267431017, 'time': 1670362267, 'md5': 'QZc571sBMz3rO9QxRay7LA==', 'fsize': 343788, 'resto': 41947890}, {'no': 41993051, 'now': '12/07/22(Wed)19:43:41', 'name': 'Anonymous', 'com': '<a href=""#p41947890"" class=""quotelink"">&gt;&gt;41947890</a><br>I would wear (a male version of) Hecatia&#039;s shirt. It&#039;s cool', 'time': 1670460221, 'resto': 41947890}, {'no': 41994655, 'now': '12/07/22(Wed)22:40:55', 'name': 'Anonymous', 'com': 'If anyone is starting a Hecatia cult make sure the uniforms cater to her fashion. This is NON-NEGOTIABLE.', 'filename': '__clownpiece_kishin_sagume_and_moon_rabbit_extra_touhou_drawn_by_misha_hoongju__6e2d0c61653d7476091390b093799bbf', 'ext': '.jpg', 'w': 700, 'h': 550, 'tn_w': 125, 'tn_h': 98, 'tim': 1670470855891875, 'time': 1670470855, 'md5': '0boYikgUBfG9QF5P0sW40w==', 'fsize': 89649, 'resto': 41947890}, {'no': 42005299, 'now': '12/09/22(Fri)04:24:41', 'name': 'Anonymous', 'com': '<a href=""#p41947890"" class=""quotelink"">&gt;&gt;41947890</a><br>Dress like a fatty', 'time': 1670577881, 'resto': 41947890}, {'no': 42006824, 'now': '12/09/22(Fri)08:12:04', 'name': 'Anonymous', 'com': 'Congratulate Hecatia on her new game!<br>https://www.youtube.com/watch?v=WzJ<wbr>_UhPptBQ', 'time': 1670591524, 'resto': 41947890}]",1670668484,,
39,41919947,11/30/22(Wed)06:47:56,Anonymous,/mbgg/ - Mobage General #192,"This general is for discussing Japanese Mobile Games that don&#039;t have their own dedicated general elsewhere. Occasionally some Chinese and Korean games will be discussed too.<br><br><span class=""quote"">&gt;List of frequently discussed games and guides for them:</span><br>https://docs.google.com/document/d/<wbr>1zMS5UYhWpWtxSla0dt3TutdezA1zWSL0pz<wbr>I3i9vwjTo<br><br>Read this Pastebin about how to get around region locks for both Android and iOS:<br>https://pastebin.com/kdChFL5n<br><br>Previous: <a href=""/jp/thread/41768947#p41768947"" class=""quotelink"">&gt;&gt;41768947</a>",RIP Infinity Souls,.png,1200.0,678.0,250.0,141.0,1669808876494135.0,1669808876,TlfqD2DOJkHIDu5oUDb3aQ==,767029.0,0,0,0,mbgg-mobage-general-192,1,269,39,264.0,39.0,"[{'no': 42014157, 'now': '12/10/22(Sat)02:38:08', 'name': 'Anonymous', 'com': '<a href=""#p42010124"" class=""quotelink"">&gt;&gt;42010124</a><br>In the console games side content isn&#039;t voiced either', 'time': 1670657888, 'resto': 41919947}, {'no': 42014691, 'now': '12/10/22(Sat)04:38:15', 'name': 'Anonymous', 'com': 'Do we have a release date for blue reflection?', 'time': 1670665095, 'resto': 41919947}, {'no': 42014723, 'now': '12/10/22(Sat)04:45:56', 'name': 'Anonymous', 'com': '<a href=""#p42014691"" class=""quotelink"">&gt;&gt;42014691</a><br>no exact date but they said in an interview they&#039;re aiming to still release this winter.', 'time': 1670665556, 'resto': 41919947}, {'no': 42014756, 'now': '12/10/22(Sat)04:50:39', 'name': 'Anonymous', 'com': '<a href=""#p42014691"" class=""quotelink"">&gt;&gt;42014691</a><br>Blue Reflection Sun: Winter 2023<br>Towa Tsugai: Winter 2023 (Feb 16th)<br>Engage Kill: Spring 2023<br>World Dai Star: Summer 2023<br>Untitled Magical Girls: Summer 2023<br>Shine Post Be Your Idols: TBD', 'time': 1670665839, 'resto': 41919947}, {'no': 42014882, 'now': '12/10/22(Sat)05:14:10', 'name': 'Anonymous', 'com': '<a href=""#p42014157"" class=""quotelink"">&gt;&gt;42014157</a><br>Wrong. Some minor stuff isn&#039;t, but a lot is voiced in BR2. I was actually positively surprised by that. BR1 didn&#039;t do that, but that game had the budget of.. I dunno. Did it have a budget?', 'time': 1670667250, 'resto': 41919947}]",1670667250,,
40,41944417,12/02/22(Fri)22:44:45,Anonymous,,Who let this dog out?!,4256984126958412,.png,821.0,850.0,241.0,250.0,1670039085125193.0,1670039085,x/jLjQpWV3FkqSXcEG2xow==,546180.0,0,0,0,who-let-this-dog-out,1,40,14,35.0,12.0,"[{'no': 42009753, 'now': '12/09/22(Fri)14:41:32', 'name': 'Anonymous', 'com': '<a href=""#p42009700"" class=""quotelink"">&gt;&gt;42009700</a><br>I&#039;ve already long given up on finding a virgin girl in this life. Whats one more disappointment for a prize like Momoji?', 'time': 1670614892, 'resto': 41944417}, {'no': 42009847, 'now': '12/09/22(Fri)14:53:48', 'name': 'Anonymous', 'com': '<a href=""#p42009753"" class=""quotelink"">&gt;&gt;42009753</a><br>Mojimoji is a retarded whore dumber than the average mutt dog you don&#039;t want to be with her', 'filename': 'touhou_girl_inubashiri_momiji_art_ears-563483', 'ext': '.jpg', 'w': 1600, 'h': 1131, 'tn_w': 125, 'tn_h': 88, 'tim': 1670615628038595, 'time': 1670615628, 'md5': '5we3gFiKKpySL8Ktzm+Zvg==', 'fsize': 300552, 'resto': 41944417}, {'no': 42009969, 'now': '12/09/22(Fri)15:10:33', 'name': 'Anonymous', 'com': '<a href=""#p42009847"" class=""quotelink"">&gt;&gt;42009847</a><br>Why are you so intent on bullying a wonderfully smart wolf like momoji?<br>What has she done to make you so mad?<br>She&#039;d be disappointed in you acting like that just to get a rise out of people', 'time': 1670616633, 'resto': 41944417}, {'no': 42011622, 'now': '12/09/22(Fri)19:14:33', 'name': 'Anonymous', 'com': '<a href=""#p42009969"" class=""quotelink"">&gt;&gt;42009969</a><br>she raped his dog', 'time': 1670631273, 'resto': 41944417}, {'no': 42014872, 'now': '12/10/22(Sat)05:12:11', 'name': 'Anonymous', 'com': '<a href=""#p42011622"" class=""quotelink"">&gt;&gt;42011622</a><br>It&#039;s not that. Low caste bhangi chamaar tengus don&#039;t deserve to be happy', 'filename': 'e9fa995fef4c76f4790f4e60447a4b7045e018db', 'ext': '.jpg', 'w': 851, 'h': 735, 'tn_w': 125, 'tn_h': 107, 'tim': 1670667131153282, 'time': 1670667131, 'md5': 'TNpmNX2aP7/Z+ddTVHdsig==', 'fsize': 168858, 'resto': 41944417}]",1670667131,,
41,42010077,12/09/22(Fri)15:22:01,Anonymous,/egg/ — Era Games General,"Advent, Day IX: Moriya Shrine Christmas Campaign Edition<br><br>Last: <a href=""/jp/thread/41975708#p41975708"" class=""quotelink"">&gt;&gt;41975708</a><br><br><span class=""quote"">&gt;What is this?</span><br><br>Era games are a group of (usually) Japanese-developed text porn games.<br>They&#039;re not exclusively related to the Touhou franchise, but it&#039;s one of the series with most era games.<br><br><span class=""quote"">&gt;Games usually discussed here</span><br>eraTohoTW - Comfy Touhou dating simulator with time stop shenanigans.<br>eraTohoK - Tactical game about conquering Gensokyo through any (absolutely any) means.<br>eraMegaten - Dungeon crawler based on the Shin Megami Tensei series, with tons of characters from other series (Fate, Touhou, Madoka, etc) included.<br><br><span class=""quote"">&gt;Links</span><br>- WIKI: https://wiki.eragames.rip/index.php<wbr>/Main_Page<br>Guides and downloads for all era games. For TW you should get the eng-development version, eng-release is several years old.<br>- GIT: https://gitgud.io/era-games<br>Git repository that has latest official builds to any of the games, you can sometimes find more recent versions than the ones on the wiki.<br>- AUTO UPDATER: http://madhammer.club/files/era-upd<wbr>ater.7z<br>Fetches the latest version of TW, K or Megaten from the official git, no login needed.<br>- TW NEODEV: https://gitgud.io/Pedy/pedy-tw/-/re<wbr>leases<br>Git repository with a version of TW that gets more frequent updates. Might introduce more bugs, though they usually get fixed on the following release.<br>- JAP WIKI: https://seesaawiki.jp/eraseries/<br>- TRANSLATOR: https://wiki.eragames.rip/index.php<wbr>/Sugoi<br>Automatic translator which copies text straight from the game. Comes with an optional customized built-in offline model.<br>You can also download the latest version at:<br>https://drive.google.com/file/d/1DA<wbr>8voYO62ARtORzxJUBhMWK2FWbt6Vlq/view<wbr><br>- BUGS?: https://wiki.eragames.rip/bugreport<wbr>.php<br>Report them over here.<br><br><span class=""quote"">&gt;How to play?</span><br>Run anchor.exe, japanese locale is advised so you don&#039;t run into untranslated text.<br>If you wish to manually update, delete old files aside the sav and dat folders to avoid any bugs.<br><br><span class=""quote"">&gt;How can I help?</span><br>Read https://wiki.eragames.rip/index.php<wbr>/Contributing for starters.<br>You could try your hand at translating dialogue, there are guides currently in the TW folder (in #Translation) on what to do, not sure if it that folder exists in other games.<br>Another guide is:<br>1) Download an IDE. VS Code, for example.<br>1a) If using VS Code, install the EraBasic addon<br>2) Select UTF8 encoding<br>3) Open the ERB files and edit them<br>That way you can now edit files without much trouble.<br>The path for files to edit is usually the ERB folder:<br>K: ERB/口上<br>TW: ERB\口上・メッセージ関連\個人口上<br><br>You can also report bugs or typos here on the thread when you see them.<br>If you&#039;d like to either edit or add your own portraits, the files are located within the &#039;resources&#039; folder in webp format. You can use paint.net to edit them",1882137,.jpg,540.0,960.0,140.0,250.0,1670617321571962.0,1670617321,rTEd4W3a9w6Sm/wtwLMumA==,169463.0,0,0,0,egg-era-games-general,1,50,9,45.0,7.0,"[{'no': 42013318, 'now': '12/09/22(Fri)23:22:18', 'name': 'Anonymous', 'com': 'So what actually happens when the Charisma market crashes? It&#039;s been 225 yen since I started my current game.', 'time': 1670646138, 'resto': 42010077}, {'no': 42013624, 'now': '12/10/22(Sat)00:15:24', 'name': 'Anonymous', 'com': '<a href=""#p42010077"" class=""quotelink"">&gt;&gt;42010077</a><br>hag saggers<br>hag navel', 'time': 1670649324, 'resto': 42010077}, {'no': 42013969, 'now': '12/10/22(Sat)01:47:41', 'name': 'Anonymous', 'com': '<span class=""quote"">&gt;tfw no cute bookworm wife to run a bookshop with</span>', 'filename': '__motoori_kosuzu_touhou_drawn_by_uisu_noguchipint__387d28f43e9a5c5e8cce119e50293cd5', 'ext': '.jpg', 'w': 959, 'h': 1100, 'tn_w': 108, 'tn_h': 125, 'tim': 1670654861558696, 'time': 1670654861, 'md5': '2NCw6Y7U/antCDsSxVV2zQ==', 'fsize': 189160, 'resto': 42010077}, {'no': 42014211, 'now': '12/10/22(Sat)02:53:41', 'name': 'Anonymous', 'com': 'What&#039;s Era sim?', 'time': 1670658821, 'resto': 42010077}, {'no': 42014866, 'now': '12/10/22(Sat)05:10:51', 'name': 'Anonymous', 'com': '<a href=""#p42014211"" class=""quotelink"">&gt;&gt;42014211</a><br>Era sim deez nuts', 'filename': 'Forty Hecs', 'ext': '.png', 'w': 292, 'h': 257, 'tn_w': 125, 'tn_h': 110, 'tim': 1670667051625340, 'time': 1670667051, 'md5': 'Xkqy6p/9o2C4en6HfQoeIg==', 'fsize': 77336, 'resto': 42010077}]",1670667051,,
42,41944421,12/02/22(Fri)22:45:27,Anonymous,NO.,they forgot about Chen.,BDEB2BFD-4E85-4736-8620-6FE3615CAD04,.png,700.0,900.0,194.0,250.0,1670039127570293.0,1670039127,DB0d1yBVueX9awBrs3cNXg==,465081.0,0,0,0,no,1,29,21,24.0,17.0,"[{'no': 42007943, 'now': '12/09/22(Fri)10:41:22', 'name': 'Anonymous', 'com': 'Who?', 'filename': '1563563462479', 'ext': '.jpg', 'w': 1819, 'h': 1786, 'tn_w': 125, 'tn_h': 122, 'tim': 1670600482777760, 'time': 1670600482, 'md5': 'LaegZEzXgWiO1EnErzfndA==', 'fsize': 519350, 'resto': 41944421}, {'no': 42008189, 'now': '12/09/22(Fri)11:06:36', 'name': 'Anonymous', 'com': '<a href=""#p42007943"" class=""quotelink"">&gt;&gt;42007943</a><br>Chan!', 'filename': 'bc1548ba0c3abec82e979c546506f5f57d5ba32c9e5047b728a5b6d4f12cf334 chen chan', 'ext': '.jpg', 'w': 978, 'h': 1408, 'tn_w': 86, 'tn_h': 125, 'tim': 1670601996856673, 'time': 1670601996, 'md5': 'nxIzEwq/MSmzn4Az+GJqWA==', 'fsize': 126841, 'resto': 41944421}, {'no': 42009645, 'now': '12/09/22(Fri)14:27:42', 'name': 'Anonymous', 'com': 'one in the world Cheeeeeeeeeeeen!!', 'filename': '__chen_touhou_drawn_by_kame_kamepan44231__a20b47a6bd0af3485f807c2cfafb4171', 'ext': '.jpg', 'w': 2552, 'h': 3370, 'tn_w': 94, 'tn_h': 124, 'tim': 1670614062860962, 'time': 1670614062, 'md5': 'e7JzvH3tIDWTvfGsXMer3A==', 'fsize': 1241470, 'resto': 41944421}, {'no': 42009764, 'now': '12/09/22(Fri)14:43:04', 'name': 'Anonymous', 'com': '<a href=""#p42009645"" class=""quotelink"">&gt;&gt;42009645</a><br><span class=""quote"">&gt;none in the world</span><br>FTFY', 'time': 1670614984, 'resto': 41944421}, {'no': 42014804, 'now': '12/10/22(Sat)05:00:39', 'name': 'Anonymous', 'com': '<a href=""#p41976356"" class=""quotelink"">&gt;&gt;41976356</a>', 'filename': 'fish', 'ext': '.jpg', 'w': 850, 'h': 531, 'tn_w': 125, 'tn_h': 78, 'tim': 1670666439874999, 'time': 1670666439, 'md5': '9c10GtbT9hhN9P21j5nbAg==', 'fsize': 117698, 'resto': 41944421}]",1670666439,,
43,42007678,12/09/22(Fri)10:10:13,Anonymous,DJT - Daily Japanese Thread #3443,"Guide: https://itazuraneko.neocities.org/<br><br>Previous threads:<br><a href=""/jp/thread/41994201#p41994201"" class=""quotelink"">&gt;&gt;41994201</a> (#3442)<br><a href=""/jp/thread/41979127#p41979127"" class=""quotelink"">&gt;&gt;41979127</a> (#3441)<br><a href=""/jp/thread/41977435#p41977435"" class=""quotelink"">&gt;&gt;41977435</a> (#3440)<br><a href=""/jp/thread/41966697#p41966697"" class=""quotelink"">&gt;&gt;41966697</a> (#3439)<br><a href=""/jp/thread/41955086#p41955086"" class=""quotelink"">&gt;&gt;41955086</a> (#3438)<br><a href=""/jp/thread/41938895#p41938895"" class=""quotelink"">&gt;&gt;41938895</a> (#3437)<br><a href=""/jp/thread/41926031#p41926031"" class=""quotelink"">&gt;&gt;41926031</a> (#3436)<br><a href=""/jp/thread/41913720#p41913720"" class=""quotelink"">&gt;&gt;41913720</a> (#3435)<br><a href=""/jp/thread/41900138#p41900138"" class=""quotelink"">&gt;&gt;41900138</a> (#3434)<br><span class=""deadlink"">&gt;&gt;41887507</span> (#3433)<br><span class=""deadlink"">&gt;&gt;41877048</span> (#3432)<br><span class=""deadlink"">&gt;&gt;41865182</span> (#3431)<br><span class=""deadlink"">&gt;&gt;41852791</span> (#3430)<br><span class=""deadlink"">&gt;&gt;41842985</span> (#3429)<br><span class=""deadlink"">&gt;&gt;41832392</span> (#3428)<br><span class=""deadlink"">&gt;&gt;41822345</span> (#3427)",DJT ,.jpg,1920.0,1080.0,250.0,140.0,1670598613411148.0,1670598613,UsoS94ntJG7JFCohXVJFrQ==,535580.0,0,0,0,djt-daily-japanese-thread-3443,1,290,45,285.0,45.0,"[{'no': 42014616, 'now': '12/10/22(Sat)04:21:25', 'name': 'Anonymous', 'com': 'たぬきのはなしなんですけど<br><br>いなかすぎて<br><br>あさばんかならずみるレベル', 'time': 1670664085, 'resto': 42007678}, {'no': 42014631, 'now': '12/10/22(Sat)04:24:49', 'name': 'Anonymous', 'com': '<a href=""#p42014616"" class=""quotelink"">&gt;&gt;42014616</a><br>アライグマでしょ', 'time': 1670664289, 'resto': 42007678}, {'no': 42014743, 'now': '12/10/22(Sat)04:48:59', 'name': 'Anonymous', 'com': '<a href=""#p42014631"" class=""quotelink"">&gt;&gt;42014631</a><br>イタチもみるし<br><br>キジもみるし<br><br>うんがいいときはウサギもみる', 'time': 1670665739, 'resto': 42007678}, {'no': 42014752, 'now': '12/10/22(Sat)04:49:58', 'name': 'Anonymous', 'com': 'hope you guys know your good and bad manners ie 寄せ箸 刺し箸', 'time': 1670665798, 'resto': 42007678}, {'no': 42014797, 'now': '12/10/22(Sat)04:59:06', 'name': 'Anonymous', 'com': '<a href=""#p42014752"" class=""quotelink"">&gt;&gt;42014752</a><br>i dont know anything that doesnt involve hashi', 'time': 1670666346, 'resto': 42007678}]",1670666346,,
