,no,now,name,sub,com,filename,ext,w,h,tn_w,tn_h,tim,time,md5,fsize,resto,bumplimit,imagelimit,semantic_url,custom_spoiler,replies,images,omitted_posts,omitted_images,last_replies,last_modified,trip,filedeleted
0,41993853,12/07/22(Wed)21:14:59,Anonymous,Mahjong,Anyone play this /jp/?,sample_493dda3bd88379c5c7b03d97717988e7,.jpg,850.0,1492.0,142.0,250.0,1670465699150098.0,1670465699,orooWxevizT6PyyPPuW0Fg==,279243.0,0,0,0,mahjong,1,6,2,1.0,1.0,"[{'no': 42005295, 'now': '12/09/22(Fri)04:22:39', 'name': 'Anonymous', 'com': '<a href=""#p41993972"" class=""quotelink"">&gt;&gt;41993972</a><br>Mahjong OD', 'time': 1670577759, 'resto': 41993853}, {'no': 42013361, 'now': '12/09/22(Fri)23:29:47', 'name': 'Anonymous', 'com': 'people only use the OMGANIMEWAIFUZ client now, so it&#039;s more of a /cn/ thing', 'time': 1670646587, 'resto': 41993853}, {'no': 42013750, 'now': '12/10/22(Sat)00:50:19', 'name': 'Anonymous', 'com': '<a href=""#p42013361"" class=""quotelink"">&gt;&gt;42013361</a><br>/cn/?', 'time': 1670651419, 'resto': 41993853}, {'no': 42013940, 'now': '12/10/22(Sat)01:41:10', 'name': 'Anonymous', 'com': 'Who doesn&#039;t? I thought everyone played this', 'filename': '96662173_p0_master1200', 'ext': '.jpg', 'w': 801, 'h': 1200, 'tn_w': 83, 'tn_h': 125, 'tim': 1670654470648069, 'time': 1670654470, 'md5': 'KxGt5Y7C2UUzvQrner7xgQ==', 'fsize': 556468, 'resto': 41993853}, {'no': 42015763, 'now': '12/10/22(Sat)07:13:33', 'name': 'Anonymous', 'com': '<a href=""#p41993853"" class=""quotelink"">&gt;&gt;41993853</a><br>Ask the discord', 'time': 1670674413, 'resto': 41993853}]",1670674413,,
1,42004466,12/09/22(Fri)00:13:52,Anonymous,Untranslated VN General / ノベルゲースレ,"Previous thread: <a href=""/jp/thread/41963695#p41963695"" class=""quotelink"">&gt;&gt;41963695</a><br><br>This thread is for the discussion of untranslated Japanese visual novels.<br><br>What are you playing? What are you looking forward to? What have you finished?",58987,.jpg,1280.0,720.0,250.0,140.0,1670562832474131.0,1670562832,6VNlN3ecvQItx4YaU7e2ZA==,191681.0,0,0,0,untranslated-vn-general,1,72,12,67.0,12.0,"[{'no': 42014865, 'now': '12/10/22(Sat)05:10:45', 'name': 'Anonymous', 'com': '<a href=""#p42014775"" class=""quotelink"">&gt;&gt;42014775</a><br>The most widely understood term is ノベルゲーム see <a href=""#p42013314"" class=""quotelink"">&gt;&gt;42013314</a> and <a href=""#p42013498"" class=""quotelink"">&gt;&gt;42013498</a>. If you walked up to a random Japanese person and said you play エロゲ they&#039;re not going to think of VNs in particular or know what the fuck you mean. Only a pedantic idiot would get angry that the VN thread isn&#039;t called the porn game thread.', 'time': 1670667045, 'resto': 42004466}, {'no': 42014904, 'now': '12/10/22(Sat)05:21:22', 'name': 'Anonymous', 'com': '<a href=""#p42014775"" class=""quotelink"">&gt;&gt;42014775</a><br><a href=""#p42014865"" class=""quotelink"">&gt;&gt;42014865</a><br>Also, I&#039;m pretty sure /vg/ has h-game generals for hentai games (mostly non-VN) but are also still broadly inclusive of random shitty nukige VNs. Those are actual エロゲ threads.', 'time': 1670667682, 'resto': 42004466}, {'no': 42014927, 'now': '12/10/22(Sat)05:27:37', 'name': 'Anonymous', 'com': 'hey guys, I know this is a really big long shot, but does anyone have the DLC for Dasoku, that Waffle eroguro game that released a few years ago? yes, I know haha ew &gt;guro but there are three dlcs, one that got released to panda but the other two are rare since they both cost a DLC point each. These were: an &quot;if&quot; DLC and a supposed eroguro &quot;enhancement&quot; patch. I went through the archive and saw that old /hgg/ thread from 2019 that found a way past the net-ride dlc catalog and it downloaded, but it requires knowing the waffle catalog &quot;code&quot; of the game. As far as I know, there are no CGs or any images from these DLCs, only one from bugbug and that was it. It&#039;s a pretty niche game and genre and I know its nasty, but I really have an itching autism to archive them. If this isn&#039;t the thread for this thing, I&#039;m sorry in advance.', 'time': 1670668057, 'resto': 42004466}, {'no': 42015150, 'now': '12/10/22(Sat)05:58:44', 'name': 'Anonymous', 'com': 'I wonder what Eushully is working on.', 'time': 1670669924, 'resto': 42004466}, {'no': 42015760, 'now': '12/10/22(Sat)07:13:00', 'name': 'Anonymous', 'com': '<a href=""#p42004466"" class=""quotelink"">&gt;&gt;42004466</a><br>Underrated Light game.', 'time': 1670674380, 'resto': 42004466}]",1670674380,,
2,41904912,11/28/22(Mon)13:59:15,Anonymous,Seiran thread,Other Touhou bunnies can stay here too,_seiran_da7df3c225a6f384bdaf68ae0d539df1,.jpg,1080.0,1440.0,187.0,250.0,1669661955402321.0,1669661955,DWhnleg6ATVGrNeygZfL2w==,1259542.0,0,0,0,seiran-thread,1,42,26,37.0,25.0,"[{'no': 42001359, 'now': '12/08/22(Thu)16:16:52', 'name': 'Anonymous', 'com': '<a href=""#p41998371"" class=""quotelink"">&gt;&gt;41998371</a><br>The bunny wants to play', 'time': 1670534212, 'resto': 41904912}, {'no': 42005079, 'now': '12/09/22(Fri)03:20:13', 'name': 'Anonymous', 'com': '<a href=""#p41998371"" class=""quotelink"">&gt;&gt;41998371</a><br>Artist who draw Tewi with a good ass are godly', 'time': 1670574013, 'resto': 41904912}, {'no': 42010056, 'now': '12/09/22(Fri)15:19:42', 'name': 'Anonymous', 'com': '<a href=""#p41983027"" class=""quotelink"">&gt;&gt;41983027</a><br>Pretty eyes', 'time': 1670617182, 'resto': 41904912}, {'no': 42015370, 'now': '12/10/22(Sat)06:26:44', 'name': 'Anonymous', 'com': '<a href=""#p42010056"" class=""quotelink"">&gt;&gt;42010056</a><br>Look deeper into them until all you can see is her', 'time': 1670671604, 'resto': 41904912}, {'no': 42015756, 'now': '12/10/22(Sat)07:12:20', 'name': 'Anonymous', 'com': '<a href=""#p41998371"" class=""quotelink"">&gt;&gt;41998371</a><br><a href=""#p42001359"" class=""quotelink"">&gt;&gt;42001359</a><br>its a devious trick<br>don&#039;t fall for it', 'filename': '1655180447254', 'ext': '.png', 'w': 351, 'h': 129, 'tn_w': 125, 'tn_h': 45, 'tim': 1670674340402634, 'time': 1670674340, 'md5': 'soKl8OqgCPb5kh89dQsHZQ==', 'fsize': 53462, 'resto': 41904912}]",1670674340,,
3,42013216,12/09/22(Fri)23:02:38,Anonymous,Bushiroad Seiyuu Thread #192,"BanG Dream!<br>https://bang-dream.com/<br>https://bang-dream.com/anime<br>https://twitter.com/bang_dream_info<wbr><br>https://twitter.com/bangdreamgbp_EN<wbr><br><br>Revue Starlight<br>https://revuestarlight.com/<br>https://revuestarlight.bushimo.jp/<br>https://twitter.com/revuestarlight<br><br>Dig Delight Direct Drive!<br>https://d4dj-pj.com/<br>https://twitter.com/D4DJ_pj<br>https://twitter.com/D4DJ_pj_en<br><br>Assault Lily<br>https://twitter.com/assaultlily_pj?<wbr>lang=en<br><br>Other information:<br>https://pastebin.com/jxAyPQSe<br>https://www.bseiyuu.com/<br><br>Miscellaneous media:<br>https://pastebin.com/xbHqHkS3<br><br>Bushiroad Seiyuu Thread information spreadsheet:<br>https://docs.google.com/spreadsheet<wbr>s/d/1J4uv8QpdN_suFDyGqPY3P4zMbSaIu4<wbr>KlGX4Idceox20/edit?usp=sharing<br><br>Bushiroad Seiyuu Thread information spreadsheet(Editable):<br>https://docs.google.com/spreadsheet<wbr>s/d/1LLYAqFc9A4MhX00DbE_igygIFLs7uW<wbr>k4ISYbODiGjXM/edit?usp=sharing<br><br>Previous thread: <a href=""/jp/thread/41976342#p41976342"" class=""quotelink"">&gt;&gt;41976342</a>",1670596457745202,.jpg,1416.0,2000.0,177.0,250.0,1670644958848938.0,1670644958,oWDFMfOdwR5jHF4R6QCtvg==,628356.0,0,0,0,bushiroad-seiyuu-thread-192,1,34,13,29.0,11.0,"[{'no': 42015064, 'now': '12/10/22(Sat)05:49:28', 'name': 'Anonymous', 'filename': 'FjnE6-tacAEuN_S', 'ext': '.jpg', 'w': 1479, 'h': 1109, 'tn_w': 125, 'tn_h': 93, 'tim': 1670669368288047, 'time': 1670669368, 'md5': 'PcNv1j0DmJVxI4Hta1zKtA==', 'fsize': 304234, 'resto': 42013216}, {'no': 42015067, 'now': '12/10/22(Sat)05:49:35', 'name': 'Anonymous', 'com': '<a href=""#p42014757"" class=""quotelink"">&gt;&gt;42014757</a><br>I want Aimi to be my mommy', 'time': 1670669375, 'resto': 42013216}, {'no': 42015509, 'now': '12/10/22(Sat)06:41:18', 'name': 'Anonymous', 'com': '<a href=""#p42014575"" class=""quotelink"">&gt;&gt;42014575</a><br>Idol DJ', 'time': 1670672478, 'resto': 42013216}, {'no': 42015712, 'now': '12/10/22(Sat)07:06:02', 'name': 'Anonymous', 'filename': 'FjmrO7UagAwpBm5', 'ext': '.jpg', 'w': 1536, 'h': 2048, 'tn_w': 93, 'tn_h': 125, 'tim': 1670673962497237, 'time': 1670673962, 'md5': 'BMkiuciA+H6EJRL/3ryH/g==', 'fsize': 414629, 'resto': 42013216}, {'no': 42015753, 'now': '12/10/22(Sat)07:11:49', 'name': 'Anonymous', 'com': 'I want to turn Aimi into a mommy', 'time': 1670674309, 'resto': 42013216}]",1670674309,,
4,42014172,12/10/22(Sat)02:42:55,Anonymous,JAV Thread #873,"Behind the scene edition.<br><br><span class=""quote"">&gt;Delisted Thread:</span><br><a href=""/jp/thread/41994559#p41994559"" class=""quotelink"">&gt;&gt;41994559</a><br><br><span class=""quote"">&gt;News</span><br>October Warosu archive lost<br><br><span class=""quote"">&gt;FAQ:</span><br>https://jav.now.sh/<br><br><span class=""quote"">&gt;Webm thread</span><br><a href=""/jp/thread/42014038#p42014038"" class=""quotelink"">&gt;&gt;42014038</a><br><a href=""//boards.4channel.org/wsg/thread/4838174#p4838174"" class=""quotelink"">&gt;&gt;&gt;/wsg/4838174</a><br><a href=""//boards.4chan.org/gif/thread/24103437#p24103437"" class=""quotelink"">&gt;&gt;&gt;/gif/24103437</a><br><a href=""//boards.4chan.org/gif/thread/24065393#p24065393"" class=""quotelink"">&gt;&gt;&gt;/gif/24065393</a>",duck,.png,351.0,403.0,217.0,250.0,1670658175531946.0,1670658175,swAtxgYMnrSPvKXR9D+iag==,218805.0,0,0,0,jav-thread-873,1,52,17,47.0,15.0,"[{'no': 42015683, 'now': '12/10/22(Sat)07:02:41', 'name': 'Anonymous', 'com': '<a href=""#p42015640"" class=""quotelink"">&gt;&gt;42015640</a><br>She has a special charisma, I like when you guys post her.<br><br>Also: God, I wish I had a bitchy leech gf like that.', 'filename': 'hnd00856jp-1', 'ext': '.jpg', 'w': 475, 'h': 474, 'tn_w': 125, 'tn_h': 124, 'tim': 1670673761585838, 'time': 1670673761, 'md5': '4Zn/aTCYzerxDDNrcX/fsQ==', 'fsize': 47634, 'resto': 42014172}, {'no': 42015694, 'now': '12/10/22(Sat)07:03:56', 'name': 'Anonymous', 'com': '<a href=""#p42015678"" class=""quotelink"">&gt;&gt;42015678</a><br><span class=""quote"">&gt;same as Minamo who is ok</span><br>Minamo isn&#039;t even spammed desu, only one retard keeps posting his autistic early retarded post in every thread kek', 'time': 1670673836, 'resto': 42014172}, {'no': 42015733, 'now': '12/10/22(Sat)07:08:36', 'name': 'Anonymous', 'com': '<a href=""#p42015683"" class=""quotelink"">&gt;&gt;42015683</a><br>This one time only delicious narrow eye beauty has a censored fc2 just so you know', 'time': 1670674116, 'resto': 42014172}, {'no': 42015735, 'now': '12/10/22(Sat)07:09:05', 'name': 'Anonymous', 'com': '<a href=""#p42015678"" class=""quotelink"">&gt;&gt;42015678</a><br>I don&#039;t mind Remu &amp;Suzu, i created some webms for them but i can&#039;t help but be disappointed when you see it in every thread. Gets boring really fast.<br><br><a href=""#p42015645"" class=""quotelink"">&gt;&gt;42015645</a><br>ATID-501, absolute Kino ft Alice Otsu.<br><br><a href=""#p42015683"" class=""quotelink"">&gt;&gt;42015683</a><br>Yeah she&#039;s really good in those bitchy roles, almost too real.', 'filename': 'minori beer', 'ext': '.webm', 'w': 1280, 'h': 720, 'tn_w': 125, 'tn_h': 70, 'tim': 1670674145488682, 'time': 1670674145, 'md5': 'qr0lNWy/ir2e9TzudPkBOA==', 'fsize': 2891059, 'resto': 42014172}, {'no': 42015743, 'now': '12/10/22(Sat)07:09:35', 'name': 'Anonymous', 'com': '<a href=""#p42015645"" class=""quotelink"">&gt;&gt;42015645</a><br>CARBS-022', 'time': 1670674175, 'resto': 42014172}]",1670674175,,
5,41954579,12/03/22(Sat)23:34:50,Anonymous,/KCS/ - Kigurumi Camping Session,"Last thread archived <a href=""/jp/thread/41880280#p41880280"" class=""quotelink"">&gt;&gt;41880280</a><br><br>Useful links:<br>- https://kigurumimask.web.fc2.com/<br>- https://www.google.com/maps/d/u/0/v<wbr>iewer?mid=1m0KiLcbTwbcg_WyN_eH4aye2<wbr>fTo<br>- https://discord.gg/kigurumi<br><br>Nsfw:<br>- Art: https://www.pixiv.net/search.php?s_<wbr>mode=s_tag&amp;word=%E7%9D%80%E3%81%90%<wbr>E3%82%8B%E3%81%BF<br>- Videos: https://www.findtubes.com/search/ki<wbr>gurumi<br>- Stick this in japanese sites: 着ぐるみ",FLj9_ZlVQAE91OK,.jpg,801.0,1200.0,166.0,250.0,1670128490420781.0,1670128490,j3uV38rZtZXFxI1lzP2dQw==,209955.0,0,0,0,kcs-kigurumi-camping-session,1,286,53,281.0,53.0,"[{'no': 42014814, 'now': '12/10/22(Sat)05:02:16', 'name': 'Anonymous', 'com': '<a href=""#p42011916"" class=""quotelink"">&gt;&gt;42011916</a><br>Luka and this girl are not fat. They are perfectly normal.', 'time': 1670666536, 'resto': 41954579}, {'no': 42014827, 'now': '12/10/22(Sat)05:04:26', 'name': 'Anonymous', 'com': '<a href=""#p42013190"" class=""quotelink"">&gt;&gt;42013190</a><br>&quot;Full figured&quot; is not fat. <br><br>Rotund = fat.<br><br>A girl that has no curves other than that of a barrel or a ball is fat.', 'time': 1670666666, 'resto': 41954579}, {'no': 42014869, 'now': '12/10/22(Sat)05:11:06', 'name': 'Anonymous', 'com': '<a href=""#p42009734"" class=""quotelink"">&gt;&gt;42009734</a><br>I don&#039;t know who the fuck that is and I just learned right now what &quot;incel&quot; means... so yeah... you&#039;ve latched on to certain words in my post rather than perceived its overarching message:<br><br>In general, girls (and probably boys as well--I don&#039;t look) are more attractive in cities, possibly because of a higher concentration of people and the need to stand out from the crowd.', 'time': 1670667066, 'resto': 41954579}, {'no': 42014938, 'now': '12/10/22(Sat)05:31:28', 'name': 'Anonymous', 'com': '<a href=""#p42014814"" class=""quotelink"">&gt;&gt;42014814</a><br>She&#039;s fat, end of discussion. Stop spreading misinformation.<br><br><a href=""#p42014827"" class=""quotelink"">&gt;&gt;42014827</a><br>&quot;Full figured&quot; sounds like a weasel word euphemism used by fatties in denial.', 'time': 1670668288, 'resto': 41954579}, {'no': 42015741, 'now': '12/10/22(Sat)07:09:32', 'name': 'Anonymous', 'com': '<a href=""#p42011916"" class=""quotelink"">&gt;&gt;42011916</a><br><span class=""quote"">&gt;I like a women who looks like she could break me in half</span><br>That&#039;s fine, but don&#039;t pretend as if you&#039;re weird fetish is the norm. Most people find fat people to be unattractive. It is morally wrong for you to encourage an unhealthy BMI just to get off to your weird fetish. Also, what this anon <a href=""#p42014814"" class=""quotelink"">&gt;&gt;42014814</a> said. That person is not fat, they&#039;re just muscular.', 'time': 1670674172, 'resto': 41954579}]",1670674172,,
6,42010514,12/09/22(Fri)16:15:15,Anonymous,Sakamichi General #1338,"This thread is for the discussion of Nogizaka46, Sakurazaka46, Hinatazaka46, Yoshimotozaka46 (on hiatus) and topics relating to them and their members.<br><br><span class=""quote"">&gt;News</span><br>(12/12) Nogizaka46 31st single Under Live at Zepp Fukuoka<br>(12/14) 2022 FNS Kayousai night2 on Fuji TV (Sakurazaka46)<br>(12/14,15) Nogizaka46 31st single Under Live at Zepp Nagoya<br>(12/16,17) Nogizaka46 31st single Under Live at Zepp Namba<br>(12/17,18) HinaKuri 2022 at Ariake Arena (Tokyo)<br>(12/18) Shin Nogizaka Star Tanjou! LIVE at Kobe World Memorial Hall (Hyogo) [PPV]<br>(12/18) Sugai Yuuka&#039;s Graduation Commemorative Book &quot;W-Encore&quot; release<br>(12/19) Nogizaka46 31st single Under Live at KT Zepp Yokohama [PPV]<br>(12/20) Asia Emotional Music Fes 2022 (Nogizaka46)<br>(12/20) Kanemura Miku 1st PB &quot;Rashinban&quot;<br>(12/21) Asia Emotional Music Fes 2022 (Sakurazaka46)<br>(12/21) Hinatazaka46 2nd Documentary &quot;Kibou to Zetsubou - Sono Namida wo Dare mo Shiranai&quot; BD/DVD<br>(12/23) Music Station Ultra Super Live 2022 on TV Asahi (Nogi/Saku/Hina)<br>(12/28) Countdown Japan 22/23 (Sakurazaka46)<br>(12/31) NHK Kouhaku Uta Gassen (Nogi/Hina)<br>(12/31) Saito Asuka final day of activities<br>(01/01) Hinatazaka de Aimashou vol.1 BD<br>(01/18) Yamashita Mizuki stars in the drama &quot;Stand Up Start&quot; on Fuji TV<br>(01/20-29) Sasaki Mirei stars in the stage play &quot;Piece of Cake&quot;<br>(01/24) NogiSatsu vol.3<br>(01/25-02/05) Hamagishi Hiyori stars in the stage play &quot;Odd Taxi: Diamond wa Kizutsukanai&quot;<br>(01/27) Shin Nogizaka Star Tanjou! vol.1 BD<br>(02/05-27) Umezawa Minami stars in the stage play &quot;Kingdom&quot;<br>(02/15) Sakurazaka46 5th single<br>(02/22-25) Nogizaka46 11th Year Birthday Live at Yokohama Arena<br>(03/06) Nogizaka46 31st single mini-live<br>(03/08-29) Sasaki Mirei stars in the musical &quot;Spy x Family&quot;<br>(03/17-04/16) Tamura Mayu stars in the stage play &quot;Tabun Kore Ginga Tetsudou no Yoru&quot;<br>(TBA) Kubo Shiori stars in the movie &quot;Tantei Mariko no Shougai de Ichiban Hisanna Hi&quot;<br>(TBA) Saito Asuka Graduation Concert<br><br><span class=""quote"">&gt;Links</span><br>Upcoming Sakamichi TV appearances: https://pastebin.com/c8tMgEmh<br>48/46 Group subs masterlist: https://docs.google.com/spreadsheet<wbr>s/d/1B1HFVF5iQBgvjDrPnmwfbq0Iz6VvaO<wbr>mDep0C2x8yoMo<br>Sakamichi subbed content: https://nogiarea.weebly.com/ | http://keyavids.com/<br>48/46 Group live shows: https://docs.google.com/document/d/<wbr>1JnKp_AEeGUNTNePfY3C3AO4veiVi7frza8<wbr>2lRo44ejQ<br>Sakamichi H/S: https://senublog.com/?s=完売表 | https://ameblo.jp/seto-kasumi (no longer updated)<br>Nogizaka46: https://www.nogizaka46.com/<br>Sakurazaka46: https://sakurazaka46.com/<br>Hinatazaka46: https://www.hinatazaka46.com/<br>Yoshimotozaka46: http://yoshimotozaka46.com/<br><br>Sakamichi on Showroom:<br>https://www.showroom-live.com/campa<wbr>ign/nogizaka46_sr<br>https://www.showroom-live.com/campa<wbr>ign/keyakizaka46_sr<br>https://www.showroom-live.com/campa<wbr>ign/hinatazaka46_sr<br>https://www.showroom-live.com/campa<wbr>ign/yoshimotozaka46<br><br>Previous Thread: <a href=""/jp/thread/42000926#p42000926"" class=""quotelink"">&gt;&gt;42000926</a>",221005,.jpg,1920.0,1080.0,250.0,140.0,1670620515655196.0,1670620515,Nt8Qy/2SpxAfNCw1T1Jjog==,233818.0,0,0,0,sakamichi-general-1338,1,208,112,203.0,109.0,"[{'no': 42015675, 'now': '12/10/22(Sat)07:00:56', 'name': 'Anonymous', 'com': '<a href=""#p42015669"" class=""quotelink"">&gt;&gt;42015669</a><br>2 minutes', 'filename': '1670295715840987', 'ext': '.webm', 'w': 720, 'h': 1280, 'tn_w': 70, 'tn_h': 125, 'tim': 1670673656882500, 'time': 1670673656, 'md5': '1Pi1x7db+FeFVVJ7Wiehkg==', 'fsize': 490873, 'resto': 42010514}, {'no': 42015677, 'now': '12/10/22(Sat)07:01:28', 'name': 'Anonymous', 'com': 'https://www.youtube.com/watch?v=jGa<wbr>z1zcqr6M', 'time': 1670673688, 'resto': 42010514}, {'no': 42015700, 'now': '12/10/22(Sat)07:05:11', 'name': 'Anonymous', 'com': 'I&#039;m glad Nogi shows how to be cool without cringe', 'time': 1670673911, 'resto': 42010514}, {'no': 42015704, 'now': '12/10/22(Sat)07:05:30', 'name': 'Anonymous', 'com': '<span class=""quote"">&gt;lil young</span><br>thug kaki', 'filename': '1652962567295', 'ext': '.jpg', 'w': 590, 'h': 800, 'tn_w': 92, 'tn_h': 125, 'tim': 1670673930091700, 'time': 1670673930, 'md5': 'VXdTndFqffPFkL3g9mWuDA==', 'fsize': 133223, 'resto': 42010514}, {'no': 42015731, 'now': '12/10/22(Sat)07:08:27', 'name': 'Anonymous', 'com': '<span class=""quote"">&gt;Edit：Runa</span><br><span class=""quote"">&gt;Title text：Yuri</span>', 'filename': '1636830347715', 'ext': '.jpg', 'w': 2000, 'h': 1500, 'tn_w': 125, 'tn_h': 93, 'tim': 1670674107581477, 'time': 1670674107, 'md5': 'D4WSJ+Tp7ayGCC2hN+4+ig==', 'fsize': 759585, 'resto': 42010514}]",1670674107,,
7,41938348,12/02/22(Fri)08:00:00,Anonymous,Elona,"<span class=""quote"">&gt;New? Start here</span><br>https://rentry.org/8vkaw<br><br><span class=""quote"">&gt;Mods</span><br>https://rentry.org/azzi6<br><br><span class=""quote"">&gt;Elona (1.16/1.22)</span><br>https://ylvania.org/en/elona<br><br><span class=""quote"">&gt;Elona Plus (2.14) and Custom GX (2.14.1.0)</span><br>https://wanwanplus.blog.fc2.com/blo<wbr>g-entry-38.html<br>https://github.com/Ruin0x11/ElonaPl<wbr>usCustom-GX<br><br><span class=""quote"">&gt;New child mechanics guide for plus</span><br>https://pastebin.com/7is8p4NF<br><br><span class=""quote"">&gt;Elona Mobile</span><br>https://play.google.com/store/apps/<wbr>details?id=com.ltgames.elona<br>https://apps.apple.com/us/app/elona<wbr>/id1512936641<br><br><span class=""quote"">&gt;Elin</span><br>https://store.steampowered.com/app/<wbr>2135150/Elin/<br><br>Errors? Set the compatibility of the .exe to Windows 7.<br>Save sprites in GIMP as 24-bit BMP with &quot;do not write color space&quot; checked.<br>Previous floor <a href=""/jp/thread/41581477#p41581477"" class=""quotelink"">&gt;&gt;41581477</a>",1669876769985261,.jpg,1912.0,1031.0,250.0,134.0,1669986000169721.0,1669986000,admjMwgM2q/pn0X6LsQi+Q==,716256.0,0,0,0,elona,1,182,24,177.0,24.0,"[{'no': 42010904, 'now': '12/09/22(Fri)16:59:40', 'name': 'Anonymous', 'com': '<a href=""#p42010397"" class=""quotelink"">&gt;&gt;42010397</a><br>so if you&#039;ve got a weapon with 3d2 and hit bonus of 5 and damage bonus of 5 it effectively becomes a weapon with 8d7?', 'time': 1670623180, 'resto': 41938348}, {'no': 42011094, 'now': '12/09/22(Fri)17:35:06', 'name': 'Anonymous', 'com': 'not quite. I&#039;ll use <a href=""#p41993977"" class=""quotelink"">&gt;&gt;41993977</a> weapon as an example. You see after the name is (4d5+2)(15)? That&#039;s your damage and to hit after the modifies hit/damage are applied. so the base weapon is a 4d5 damage roll, then an additional +2 after you&#039;ve rolled. Your character sheet will also show your current damage rolls after everything is added together in the bottom right.', 'time': 1670625306, 'resto': 41938348}, {'no': 42011100, 'now': '12/09/22(Fri)17:36:27', 'name': 'Anonymous', 'com': '<a href=""#p42011094"" class=""quotelink"">&gt;&gt;42011094</a><br><a href=""#p42010904"" class=""quotelink"">&gt;&gt;42010904</a><br>woops forgot the (You)<br>should also add, &quot;+X to hit&quot; is referring to the accuracy, not any damage rolls.', 'time': 1670625387, 'resto': 41938348}, {'no': 42011444, 'now': '12/09/22(Fri)18:39:16', 'name': 'Anonymous', 'com': '<a href=""#p42011094"" class=""quotelink"">&gt;&gt;42011094</a><br><span class=""quote"">&gt;Your character sheet will also show your current damage rolls after everything is added together in the bottom right.</span><br>Thanks i didn&#039;t know that', 'time': 1670629156, 'resto': 41938348}, {'no': 42015723, 'now': '12/10/22(Sat)07:07:32', 'name': 'Anonymous', 'com': '<a href=""#p42009003"" class=""quotelink"">&gt;&gt;42009003</a><br>How many rounds are you winning before cashing out?', 'time': 1670674052, 'resto': 41938348}]",1670674052,,
8,41887318,11/26/22(Sat)19:02:10,Anonymous,General Nutaku and DMM Thread 388,"Previous Thread: <span class=""deadlink"">&gt;&gt;41711768</span><br>Nutaku (R-18)<br>http://www.nutaku.net/games<br>Nutaku (All-ages)<br>http://www.nutaku.com/games<br>DMM (R-18)<br>http://www.dmm.co.jp<br>DMM (All-ages)<br>http://www.dmm.com<br>Forums<br>http://harem-battle.club/<br>http://harem-battle.club/wiki/<br>Pastebin<br>https://pst.klgrth.io/paste/9p36s/r<wbr>aw",FgHpF_UVIAEojAG,.jpg,1280.0,809.0,250.0,158.0,1669507330487551.0,1669507330,XwUP27jHXsJeB0cic26KEA==,298464.0,0,0,0,general-nutaku-and-dmm-thread-388,1,211,48,206.0,47.0,"[{'no': 42012897, 'now': '12/09/22(Fri)22:07:13', 'name': 'Anonymous', 'com': 'Aigis newfag here. Which of the two free black units should I get?', 'time': 1670641633, 'resto': 41887318}, {'no': 42013423, 'now': '12/09/22(Fri)23:41:26', 'name': 'Anonymous', 'com': '<a href=""#p42012897"" class=""quotelink"">&gt;&gt;42012897</a><br>If you&#039;re talking about the early pick tickets that can select from retired blacks, then Altair is the best long term investment while Moltena is the best early game carry. Altair being a constant cost generator while Moltena is a Beast Tamer who has token summons that can clear most low end content. Rinne is also a popular pick being an AoE healer with stealth. Nanaly and Rion scale extremely well with the gold Chef who buffs archers as well for very strong DPS early game. Dina and Dine are tank picks that have strong AoE SAWs. There are a lot of considerations depending on what you think your squad needs.', 'time': 1670647286, 'resto': 41887318}, {'no': 42013648, 'now': '12/10/22(Sat)00:22:29', 'name': 'Anonymous', 'com': 'chloe going on a rampage', 'filename': '俺のターン', 'ext': '.webm', 'w': 960, 'h': 540, 'tn_w': 125, 'tn_h': 70, 'tim': 1670649749248354, 'time': 1670649749, 'md5': '/bvJM0Kkbi+o/+OweenHpQ==', 'fsize': 3076931, 'resto': 41887318}, {'no': 42014760, 'now': '12/10/22(Sat)04:50:47', 'name': 'Anonymous', 'com': '<a href=""#p42012897"" class=""quotelink"">&gt;&gt;42012897</a><br>I would go for Amanda and her armor drop rates passive. All those characters are very old already, but at least Amanda&#039;s passive is still as good as ever', 'time': 1670665847, 'resto': 41887318}, {'no': 42015709, 'now': '12/10/22(Sat)07:05:51', 'name': 'Anonymous', 'com': 'Rosetta gets anal&#039;d but its a floating penis, good enough I suppose', 'time': 1670673951, 'resto': 41887318}]",1670673951,,
