,no,now,name,sub,com,filename,ext,w,h,tn_w,tn_h,tim,time,md5,fsize,resto,bumplimit,imagelimit,semantic_url,replies,images,omitted_posts,omitted_images,last_replies,last_modified
71,10445945,11/19/22(Sat)11:56:00,Anonymous,/ag/ - Vtuber Architecture General,"Thanksgiving Edition<br><br>Previous Fat: <span class=""deadlink"">&gt;&gt;10419459</span><br><br>Literature Link(s): https://docs.google.com/document/d/<wbr>e/2PACX-1vQs75WOnqh9vkZp4UuDgoNxwnM<wbr>YaBAQSmDicUxgw9zioeuGZCE5oRVX4-zlB0<wbr>aIF8MJf0men21IN7N-/pub<br><br>https://rentry.org/exq5m",1645397630104,.png,3758,2040,250,135,1668876960596957,1668876960,z1eremryPSwBzQ5VRi+l4A==,3508448,0,0,0,ag-vtuber-architecture-general,271,168,266.0,164.0,"[{'no': 10470604, 'now': '12/10/22(Sat)20:13:22', 'name': 'Anonymous', 'com': '<a href=""#p10470591"" class=""quotelink"">&gt;&gt;10470591</a><br>The thighs at least have some meat to them and god that chest... also the game-like reveal was really fun, I wonder if that would work into a fat kink story. Her options being all about stuffing herself etc<br><br>regardless of that she&#039;s simply the best uuuuuu', 'time': 1670721202, 'resto': 10445945}, {'no': 10470678, 'now': '12/10/22(Sat)21:12:49', 'name': 'Anonymous', 'filename': 'FXtZq4VUcAAqALR', 'ext': '.jpg', 'w': 2520, 'h': 1377, 'tn_w': 125, 'tn_h': 68, 'tim': 1670724769684510, 'time': 1670724769, 'md5': 'pRclspTkKYyLOjxtGPxpTg==', 'fsize': 881065, 'resto': 10445945}, {'no': 10470749, 'now': '12/10/22(Sat)22:44:46', 'name': 'Anonymous', 'filename': '1648414486062', 'ext': '.jpg', 'w': 3500, 'h': 2323, 'tn_w': 125, 'tn_h': 82, 'tim': 1670730286343119, 'time': 1670730286, 'md5': 'e444dESP3nAYeqHqR5X1ng==', 'fsize': 589708, 'resto': 10445945}, {'no': 10470779, 'now': '12/10/22(Sat)23:25:01', 'name': 'Anonymous', 'com': '<a href=""#p10470604"" class=""quotelink"">&gt;&gt;10470604</a><br><span class=""quote"">&gt;also the game-like reveal was really fun, I wonder if that would work into a fat kink story</span><br>Let&#039;s find out.', 'filename': 'wordpad_2022-12-10_23-21-36', 'ext': '.png', 'w': 602, 'h': 802, 'tn_w': 93, 'tn_h': 125, 'tim': 1670732701478784, 'time': 1670732701, 'md5': '2rA93ws9KJQ71as88+oN6w==', 'fsize': 55748, 'resto': 10445945}, {'no': 10470872, 'now': '12/11/22(Sun)01:21:43', 'name': 'Anonymous', 'com': '<a href=""#p10470779"" class=""quotelink"">&gt;&gt;10470779</a><br>We&#039;re blessed you&#039;re tackling this scenario. Looking forward to it!', 'filename': 'Fc9QTD1aIAE70r_', 'ext': '.jpg', 'w': 1230, 'h': 2048, 'tn_w': 75, 'tn_h': 125, 'tim': 1670739703237252, 'time': 1670739703, 'md5': '3MXM0uw7V2FzG4DTVDoRqQ==', 'fsize': 289869, 'resto': 10445945}]",1670739703
72,10451011,11/23/22(Wed)21:24:48,Anonymous,Hyper Muscular Girls Thread #1,"There’s been little consistency with the postings of these threads, so let’s restore the order. Starting our first new Hyper Muscle thread!<br><br>Post anything related to huge girls and their massively sexy, ripped, juicy, jacked bodies!<br><br>Only rules are:<br><span class=""quote"">&gt;no fat bitches</span><br><span class=""quote"">&gt;no futa</span><br><br>Everyone’s opinion on what Hyper Muscle is different, but this thread is for everyone. Post women jacked to the gills, and have fun!",D653FAF1-58A4-4AC2-B185-7B786CFB3BF4,.jpg,1687,2250,187,250,1669256688861019,1669256688,geSWZGfH+ABXK7R8bJS6zw==,2559516,0,0,0,hyper-muscular-girls-thread-1,104,81,99.0,77.0,"[{'no': 10470040, 'now': '12/10/22(Sat)12:03:43', 'name': 'Anonymous', 'com': '<a href=""#p10469605"" class=""quotelink"">&gt;&gt;10469605</a><br>You&#039;re struggling with the 45lb plates while she gets the 4t plates.', 'filename': '80228722_p3', 'ext': '.jpg', 'w': 1820, 'h': 1400, 'tn_w': 125, 'tn_h': 96, 'tim': 1670691823857153, 'time': 1670691823, 'md5': '+b7EiGRIkxDnfwJtuqLVYg==', 'fsize': 373836, 'resto': 10451011}, {'no': 10470070, 'now': '12/10/22(Sat)12:27:29', 'name': 'Anonymous', 'com': '<span class=""quote"">&gt;Look up muscle artist</span><br><span class=""quote"">&gt;Gore and Dominating shit</span><br><br>Every single person who&#039;s into this shit, is unhinged and deserve to get bullied. I despise how invasive futa gets but gore completely destroys the mood and for some fucking reason artists with over 100k followers like it', 'filename': 'erikatakoyakiwip_by_un_debido_ddg7l3i-pre', 'ext': '.jpg', 'w': 975, 'h': 820, 'tn_w': 124, 'tn_h': 105, 'tim': 1670693249921880, 'time': 1670693249, 'md5': '5lIbUnRpe4ntFQo4DbVqrA==', 'fsize': 88516, 'resto': 10451011}, {'no': 10470077, 'now': '12/10/22(Sat)12:29:48', 'name': 'Anonymous', 'com': '<a href=""#p10469446"" class=""quotelink"">&gt;&gt;10469446</a><br><span class=""quote"">&gt;Guitartist made his Deviantart private</span><br><span class=""quote"">&gt;He&#039;s only active on Twitter</span><br><span class=""quote"">&gt;90% of the posts is Juri art</span><br><br>Another one who fell hard', 'time': 1670693388, 'resto': 10451011}, {'no': 10470581, 'now': '12/10/22(Sat)19:50:34', 'name': 'Anonymous', 'filename': 'DF9C9E60-56E6-4161-ABD0-E63DF3FEF533', 'ext': '.jpg', 'w': 817, 'h': 882, 'tn_w': 115, 'tn_h': 125, 'tim': 1670719834374537, 'time': 1670719834, 'md5': 'wzRwnpgkRV7PpAXXpvEaqw==', 'fsize': 230664, 'resto': 10451011}, {'no': 10470868, 'now': '12/11/22(Sun)01:18:17', 'name': 'Anonymous', 'filename': 'E1BECEC6-EF40-444C-893F-D6145D0C5EDB', 'ext': '.jpg', 'w': 3101, 'h': 2333, 'tn_w': 125, 'tn_h': 94, 'tim': 1670739497480381, 'time': 1670739497, 'md5': 'wgjWtHUcyu7tmjuZdqVGEA==', 'fsize': 657888, 'resto': 10451011}]",1670739497
73,10458795,11/30/22(Wed)12:26:35,Anonymous,"Giantess/Size Booty, Anal Vore &amp; Fart thread III","Previous: <a href=""/d/thread/10424525#p10424525"" class=""quotelink"">&gt;&gt;10424525</a><br><br>Pretty much everything related to size stuff with female booties welcome, buttcrush/smothering, anal vore, and yes, to some people&#039;s chagrin, braps too.<br><br>Any pics with scat must have the scat censored or link to the pic on an external site.",658,.jpg,4096,1824,250,111,1669829195921400,1669829195,U+YQCNWzwJhIXoeyfV8D0A==,1730077,0,0,0,giantesssize-booty-anal-vore-fart-thread-iii,77,37,72.0,35.0,"[{'no': 10470185, 'now': '12/10/22(Sat)14:06:00', 'name': 'Anonymous', 'com': '<a href=""#p10470183"" class=""quotelink"">&gt;&gt;10470183</a>', 'filename': 'b3055157-4095-408b-a871-a84d038b0a02', 'ext': '.jpg', 'w': 1245, 'h': 1805, 'tn_w': 86, 'tn_h': 125, 'tim': 1670699160570224, 'time': 1670699160, 'md5': 'XRcrjepJglTgyYMnNDhamw==', 'fsize': 792595, 'resto': 10458795}, {'no': 10470411, 'now': '12/10/22(Sat)17:10:01', 'name': 'Anonymous', 'filename': '20221208_222426', 'ext': '.jpg', 'w': 1280, 'h': 750, 'tn_w': 125, 'tn_h': 73, 'tim': 1670710201833460, 'time': 1670710201, 'md5': 'gu2rCTre6VhQIW80XhoYew==', 'fsize': 280517, 'resto': 10458795}, {'no': 10470722, 'now': '12/10/22(Sat)22:08:39', 'name': 'Anonymous', 'com': 'It&#039;s probably best if the milf fart anons just got each others discord or some shit rather than filling these threads with their conversations.', 'time': 1670728119, 'resto': 10458795}, {'no': 10470812, 'now': '12/11/22(Sun)00:13:13', 'name': 'Anonymous', 'com': '<a href=""#p10470722"" class=""quotelink"">&gt;&gt;10470722</a><br><span class=""quote"">&gt;Be me</span><br><span class=""quote"">&gt;Son of a big-booty, lactose intolerant milf with zero shame</span><br><span class=""quote"">&gt;Always teased in school about how my mom carries me to school in her huge cleavage. </span><br><span class=""quote"">&gt;She hears about it, so she decides to do something about it one day</span><br><span class=""quote"">&gt;Squats down where everyone is waiting to enter the building</span><br><span class=""quote"">&gt;Rips a grade-A, WMD certified stinker that shatters every single window in the school</span><br><span class=""quote"">&gt;Forced to close school for three months as they try to remove the layer of stink imbedded into every surface</span><br><span class=""quote"">&gt;She casually shrugs and says that was only a tiny toot, if anyone tells her she was in the wrong then she’ll show them what REAL gas looks like</span>', 'time': 1670735593, 'resto': 10458795}, {'no': 10470850, 'now': '12/11/22(Sun)01:04:20', 'name': 'Anonymous', 'com': '<a href=""#p10470812"" class=""quotelink"">&gt;&gt;10470812</a><br><span class=""quote"">&gt;Be giantess mother </span><br><span class=""quote"">&gt;Kindergartener child comes home upset after another mom gassed him in the school</span><br><span class=""quote"">&gt;Complains he can&#039;t get the stench off of him</span><br><span class=""quote"">&gt;Ohthatbitchisgonnapay.jpg</span>', 'time': 1670738660, 'resto': 10458795}]",1670738660
74,10465409,12/06/22(Tue)02:26:01,Anonymous,Body Swap Thread,"Previous Thread: <a href=""/d/thread/10458834#p10458834"" class=""quotelink"">&gt;&gt;10458834</a>",1449864323815,.png,462,612,188,250,1670311561903795,1670311561,KYRGEP0auHl9OuAxbFcu/w==,321483,0,0,0,body-swap-thread,44,17,39.0,16.0,"[{'no': 10469485, 'now': '12/09/22(Fri)23:47:11', 'name': 'Anonymous', 'filename': '103268892_p0', 'ext': '.jpg', 'w': 2480, 'h': 3508, 'tn_w': 88, 'tn_h': 125, 'tim': 1670647631107281, 'time': 1670647631, 'md5': 'IasjCSwQ249ACTUxYHy2sA==', 'fsize': 4183938, 'resto': 10465409}, {'no': 10469493, 'now': '12/09/22(Fri)23:56:45', 'name': 'Anonymous', 'com': '<a href=""#p10469485"" class=""quotelink"">&gt;&gt;10469485</a><br>western in eastern style, story doesn&#039;t make much sense.<br>guy makes doll about a girl he clearly likes that apparently can make him swap places with her.<br>Essentially the swap is like Guy-&gt;Girl-&gt;Doll-&gt;Guy.<br>but that is only revealed in page 3 during the fap.<br>So page 1 is like &quot;an hour ago I got swapped&quot;<br>page 2 and 3 is like &quot;let&#039;s fap&quot;<br>like, uhm, aren&#039;t there other things you can do that are more /d/ for example and less stereotype /h/ or something, Even something wholesome would do imo.. but meh-, artist just wants to draw a girl fapping with a male-like mind in it apparently.', 'time': 1670648205, 'resto': 10465409}, {'no': 10469884, 'now': '12/10/22(Sat)08:31:29', 'name': 'Anonymous', 'com': 'Bump', 'time': 1670679089, 'resto': 10465409}, {'no': 10470561, 'now': '12/10/22(Sat)19:28:07', 'name': 'Anonymous', 'com': 'bumpin', 'time': 1670718487, 'resto': 10465409}, {'no': 10470848, 'now': '12/11/22(Sun)01:03:03', 'name': 'Anonymous', 'com': '<a href=""#p10469493"" class=""quotelink"">&gt;&gt;10469493</a><br>It&#039;s not really the artist, it&#039;s moreso the commissioner. Tsfsingularity is making hundreds a month uploading TSF content that&#039;s mostly half assed content that leads to just basically ends up with chick fapping with male-like mind. I&#039;ve seen the same comic idea basically recycled at least 5 different times between different artist. Less repetition as of recent but overall hinders potential for good body swap content to exist.', 'time': 1670738583, 'resto': 10465409}]",1670738583
75,10446344,11/19/22(Sat)19:31:03,Anonymous,Femboys getting tentacled,Post bois having fun times with squishy appendages.,20221120_010431,.jpg,1600,900,250,140,1668904263480413,1668904263,34jfgrfdqSuGn57aGJE3tg==,508785,0,0,0,femboys-getting-tentacled,79,40,74.0,37.0,"[{'no': 10469654, 'now': '12/10/22(Sat)03:14:14', 'name': 'Anonymous', 'com': 'bump', 'time': 1670660054, 'resto': 10446344}, {'no': 10470187, 'now': '12/10/22(Sat)14:08:18', 'name': 'Anonymous', 'com': '<a href=""#p10462930"" class=""quotelink"">&gt;&gt;10462930</a><br>based, wish there was more of it', 'time': 1670699298, 'resto': 10446344}, {'no': 10470796, 'now': '12/10/22(Sat)23:47:59', 'name': 'Anonymous', 'filename': '190850cf58a47bd1f36b3ce50fe1d0641f2b6477', 'ext': '.png', 'w': 1000, 'h': 1104, 'tn_w': 113, 'tn_h': 125, 'tim': 1670734079770531, 'time': 1670734079, 'md5': 'lfupSVHtAttCWlR2zF6Q0A==', 'fsize': 944960, 'resto': 10446344}, {'no': 10470844, 'now': '12/11/22(Sun)00:57:32', 'name': 'Anonymous', 'filename': 'FJQqv6VXIAE5RS9', 'ext': '.jpg', 'w': 2892, 'h': 4096, 'tn_w': 88, 'tn_h': 125, 'tim': 1670738252410343, 'time': 1670738252, 'md5': 'tDw7EAQp6mJkZtpUx25uPQ==', 'fsize': 3090331, 'resto': 10446344}, {'no': 10470845, 'now': '12/11/22(Sun)00:58:14', 'name': 'Anonymous', 'filename': 'FJQqv6XWUAE9wbk', 'ext': '.jpg', 'w': 2892, 'h': 4096, 'tn_w': 88, 'tn_h': 125, 'tim': 1670738294126006, 'time': 1670738294, 'md5': '+4s+fonATopXqI7glN0ZDA==', 'fsize': 3246079, 'resto': 10446344}]",1670738294
76,10402066,10/14/22(Fri)16:32:22,Anonymous,"Latex Thread Number: I can spot NovelAI latex instantly, you philistine",Alternative title: stop posting kilye IM so FUCKING mad,FHYvhPsXsAcVxDI,.png,920,920,250,250,1665779542938168,1665779542,WQ7rfedlyt4LvpRX33traA==,12049,0,0,0,latex-thread-number-i-can-spot-novelai-latex,209,181,204.0,178.0,"[{'no': 10469970, 'now': '12/10/22(Sat)10:43:19', 'name': 'Anonymous', 'filename': '20221016_003304', 'ext': '.jpg', 'w': 1609, 'h': 2452, 'tn_w': 82, 'tn_h': 125, 'tim': 1670686999233929, 'time': 1670686999, 'md5': '3oUQzOQ93TmqYu+BRkn+eA==', 'fsize': 246586, 'resto': 10402066}, {'no': 10470015, 'now': '12/10/22(Sat)11:32:06', 'name': 'Anonymous', 'com': '<a href=""#p10468761"" class=""quotelink"">&gt;&gt;10468761</a><br><a href=""#p10468744"" class=""quotelink"">&gt;&gt;10468744</a><br><a href=""#p10468940"" class=""quotelink"">&gt;&gt;10468940</a><br><br>Source?', 'time': 1670689926, 'resto': 10402066}, {'no': 10470216, 'now': '12/10/22(Sat)14:42:11', 'name': 'Anonymous', 'com': '<a href=""#p10470015"" class=""quotelink"">&gt;&gt;10470015</a><br><span class=""quote"">&gt;source is readily available in the filename</span><br>How cute and adorable. I&#039;ll take your hand and guide you through it.<br><a href=""#p10468761"" class=""quotelink"">&gt;&gt;10468761</a><br>Notice the filename? That&#039;s a pixiv-filename.<br>So what you do is you go to pixiv and you simply add the name at the end of the URL and it&#039;ll get you the original along with the artist.<br>https://www.pixiv.net/en/artworks/8<wbr>8294289<br>Like so.', 'time': 1670701331, 'resto': 10402066}, {'no': 10470234, 'now': '12/10/22(Sat)14:50:48', 'name': 'Anonymous', 'filename': '1434682886480', 'ext': '.jpg', 'w': 665, 'h': 1024, 'tn_w': 81, 'tn_h': 125, 'tim': 1670701848096555, 'time': 1670701848, 'md5': '/mbmTurTkadBdkg9FmhsbA==', 'fsize': 605661, 'resto': 10402066}, {'no': 10470842, 'now': '12/11/22(Sun)00:53:14', 'name': 'Anonymous', 'com': '<a href=""#p10468940"" class=""quotelink"">&gt;&gt;10468940</a>', 'filename': '143468278390', 'ext': '.jpg', 'w': 1280, 'h': 1807, 'tn_w': 88, 'tn_h': 125, 'tim': 1670737994099565, 'time': 1670737994, 'md5': '75uAxXYadLT29SPz5IXu0g==', 'fsize': 314328, 'resto': 10402066}]",1670737994
77,10443068,11/16/22(Wed)21:46:58,Anonymous,Foot Thread #140,"Previous:<br><span class=""deadlink"">&gt;&gt;10434382</span><br><span class=""deadlink"">&gt;&gt;10401046</span>",f145d87d8eff9d66d96baf5a77d4948c,.jpg,1851,1111,250,150,1668653218968483,1668653218,8UXYfY7/nWbZa69ad9SUjA==,2063092,0,0,0,foot-thread-140,281,257,276.0,252.0,"[{'no': 10470826, 'now': '12/11/22(Sun)00:31:43', 'name': 'Anonymous', 'filename': 'GOKU_PAN', 'ext': '.png', 'w': 2473, 'h': 3510, 'tn_w': 88, 'tn_h': 125, 'tim': 1670736703153125, 'time': 1670736703, 'md5': 'JWrUQHosh4O5UIdY+CyxoQ==', 'fsize': 4098079, 'resto': 10443068}, {'no': 10470827, 'now': '12/11/22(Sun)00:32:21', 'name': 'Anonymous', 'filename': '3259ecc72fdde542310eb3c41aa7491685224192', 'ext': '.jpg', 'w': 1024, 'h': 2321, 'tn_w': 55, 'tn_h': 125, 'tim': 1670736741409843, 'time': 1670736741, 'md5': 'kFvkQ3KvZjFPpaTphReZYQ==', 'fsize': 546524, 'resto': 10443068}, {'no': 10470829, 'now': '12/11/22(Sun)00:33:03', 'name': 'Anonymous', 'filename': '858d7719ec8cef549a3de0bc7662ad47', 'ext': '.png', 'w': 1360, 'h': 2040, 'tn_w': 83, 'tn_h': 125, 'tim': 1670736783247380, 'time': 1670736783, 'md5': 'irgQrN3Ack1cOHXdef7yJw==', 'fsize': 3788034, 'resto': 10443068}, {'no': 10470831, 'now': '12/11/22(Sun)00:33:44', 'name': 'Anonymous', 'filename': '48aee770e3ac66c0404e5c5bcf4f8c429ff45b04', 'ext': '.png', 'w': 1873, 'h': 2564, 'tn_w': 91, 'tn_h': 125, 'tim': 1670736824662890, 'time': 1670736824, 'md5': 'Sv8vRxwWa+KNevsaNaYkUg==', 'fsize': 3565712, 'resto': 10443068}, {'no': 10470832, 'now': '12/11/22(Sun)00:34:36', 'name': 'Anonymous', 'filename': '735fa97e445f0a177b2fe9725dd2bd4e', 'ext': '.jpg', 'w': 1212, 'h': 1700, 'tn_w': 89, 'tn_h': 125, 'tim': 1670736876785198, 'time': 1670736876, 'md5': 'RD5ANC2Fk265VK/8H4mlcA==', 'fsize': 1402723, 'resto': 10443068}]",1670736876
78,10247037,06/04/22(Sat)21:37:34,Anonymous,Dickneck,Post heads attached (or detached) to a body via a dick and pussy.,22788443,.png,600,700,214,250,1654393054182,1654393054,d2Ft6LtcmqsZTe+beDtu1w==,350405,0,0,0,dickneck,253,199,248.0,195.0,"[{'no': 10467412, 'now': '12/07/22(Wed)23:53:39', 'name': 'Anonymous', 'filename': '103092547_p3', 'ext': '.jpg', 'w': 768, 'h': 1024, 'tn_w': 93, 'tn_h': 125, 'tim': 1670475219885614, 'time': 1670475219, 'md5': 'k/1X+OngTWh/Wnp1zqJ6Vg==', 'fsize': 796040, 'resto': 10247037}, {'no': 10468534, 'now': '12/09/22(Fri)00:32:45', 'name': 'Anonymous', 'filename': 'FiVHwmgVUAAHTmZ', 'ext': '.jpg', 'w': 1464, 'h': 2048, 'tn_w': 89, 'tn_h': 125, 'tim': 1670563965021802, 'time': 1670563965, 'md5': 'XpIaFEEMD7PyuYNQ//86jw==', 'fsize': 344083, 'resto': 10247037}, {'no': 10468536, 'now': '12/09/22(Fri)00:33:16', 'name': 'Anonymous', 'com': '<a href=""#p10468534"" class=""quotelink"">&gt;&gt;10468534</a>', 'filename': 'FiVHwmdUcAA8b4I', 'ext': '.jpg', 'w': 1464, 'h': 2048, 'tn_w': 89, 'tn_h': 125, 'tim': 1670563996773422, 'time': 1670563996, 'md5': 'yyA3IVWHQHKOXR1LheOI6g==', 'fsize': 402669, 'resto': 10247037}, {'no': 10469785, 'now': '12/10/22(Sat)06:20:19', 'name': 'Anonymous', 'com': '<a href=""#p10464019"" class=""quotelink"">&gt;&gt;10464019</a><br>Yeah, this is one of those I don&#039;t really get either', 'time': 1670671219, 'resto': 10247037}, {'no': 10470821, 'now': '12/11/22(Sun)00:24:56', 'name': 'Anonymous', 'com': '<a href=""#p10469785"" class=""quotelink"">&gt;&gt;10469785</a><br>It&#039;s kind of a niche within a niche. I think you&#039;d kind of have to be into the headless detachable stuff in the first place, and also be okay with putting dicks and pussies in weird places.', 'filename': 'FMopZYAVcAAn8lb', 'ext': '.jpg', 'w': 1750, 'h': 2337, 'tn_w': 93, 'tn_h': 125, 'tim': 1670736296066712, 'time': 1670736296, 'md5': '9CAbKE/eU7CLttQSJBRhaQ==', 'fsize': 339478, 'resto': 10247037}]",1670736296
79,10430406,11/06/22(Sun)10:28:06,Anonymous,/ringo/ - VTuber bodily waste,"<span class=""quote"">&gt;What is this?</span><br>A place to share and discuss the piss, shit, farts, sweat, smell, burps, etc. of VTubers. We maintain a collection of real instances that have happened on stream, fanart, and fanfic stories. Reminder: visible scat is not allowed in /d/<br><span class=""quote"">&gt;Why &quot;ringo&quot;?</span><br><span class=""deadlink"">&gt;&gt;&gt;/vt/5422936</span> tl;dr /vt/ memes that lead to euphemisms for piss (ringo), shit (choco), farts (braps), and sweat (water). Our blue-haired mascot is Hoshimachi Suisei, straight-laced virtual idol who drinks an iconic ringo juice box, and whom many would like to drink the ringo juice from her box.<br><span class=""quote"">&gt;The usual BRAAP</span><br>Browse stories and greentext: https://rentry.org/ringotext<br>Rentry links: https://rentry.org/vtuberingo2<br>Artworks collection: https://mega.nz/folder/T81nEZJI#3rw<wbr>tDHdd7RExZNH7k6A2xA<br>Anon&#039;s creations: https://mega.nz/folder/aCpmnIDY#a6w<wbr>R-s7376_R3HWvM6KEgg<br>Previous thread: <span class=""deadlink"">&gt;&gt;10378122</span>",102453323_p1,.jpg,2636,1482,250,140,1667748486594794,1667748486,QVActg2PlC7yE/w3UpCbNA==,3857579,0,0,0,ringo-vtuber-bodily-waste,243,87,238.0,83.0,"[{'no': 10470550, 'now': '12/10/22(Sat)19:12:27', 'name': 'Anonymous', 'com': '<span class=""quote"">&gt;Ugh, those guys... even though they&#039;re always calling me a wall, they keep posting my lewds on Twitter and retweeting and are constantly jerking off to me. They&#039;re really the worst...</span><br><span class=""quote"">&gt;Anyways... if they&#039;re going to jerk off</span><br><span class=""quote"">&gt;Aren&#039;t there better holo-members for that? Why Sui-chan...</span><br><span class=""quote"">&gt;Aaahhh now I&#039;m irritated...! Even though I said on stream I don&#039;t want them to get so serious and they shouldn&#039;t have those kind of feelings for me... Can&#039;t they just say I&#039;m cute and be done? Stop fapping so much... now I&#039;m feeling weird~~</span><br><span class=""quote"">&gt;Aaaahh I&#039;m cumming!!</span>', 'filename': 'acd06a16-81e0-4680-bf5e-fdb1377264b0', 'ext': '.jpg', 'w': 3508, 'h': 2480, 'tn_w': 125, 'tn_h': 88, 'tim': 1670717547582505, 'time': 1670717547, 'md5': 'LVFhadLxxdPOXK3v2svcHA==', 'fsize': 641541, 'resto': 10430406}, {'no': 10470552, 'now': '12/10/22(Sat)19:16:49', 'name': 'Anonymous', 'com': '<a href=""#p10470443"" class=""quotelink"">&gt;&gt;10470443</a><br>Ame&#039;s chair has been dangerously squeaky for a good while now and she was perhaps a bit *too* quick to deny that it was anything other than<br><span class=""quote"">&gt;it&#039;s an old chair!~</span>', 'time': 1670717809, 'resto': 10430406}, {'no': 10470696, 'now': '12/10/22(Sat)21:23:32', 'name': 'Anonymous', 'com': '<span class=""quote"">&gt;Mika will burp, fart, and scratch her ass when she pleases</span><br>https://youtu.be/1PKyLDJOXzg<br><span class=""quote"">&gt;Shylily&#039;s alternate drinking techniques</span><br>https://youtu.be/qQInXmYYjWk<br><span class=""quote"">&gt;Lui offers to lick butt</span><br>https://youtu.be/ldg8vzjBG9k<br><span class=""quote"">&gt;Finana slimes her pillow</span><br>https://youtu.be/V_YbyjRh3KE<br><span class=""quote"">&gt;Bae in a pool of sweat taking off her clothes</span><br>https://youtu.be/3eo9gd9KnrE', 'filename': '103259093_p4', 'ext': '.png', 'w': 512, 'h': 768, 'tn_w': 83, 'tn_h': 125, 'tim': 1670725412492259, 'time': 1670725412, 'md5': 'G/gdnjOQxfacG7vUpMdPpw==', 'fsize': 664027, 'resto': 10430406}, {'no': 10470816, 'now': '12/11/22(Sun)00:15:04', 'name': 'Anonymous', 'filename': 'lemao', 'ext': '.png', 'w': 1049, 'h': 420, 'tn_w': 125, 'tn_h': 50, 'tim': 1670735704422548, 'time': 1670735704, 'md5': 'KTiGjG+UVgeGA5NQed9F6g==', 'fsize': 83564, 'resto': 10430406}, {'no': 10470818, 'now': '12/11/22(Sun)00:17:10', 'name': 'Anonymous', 'com': '<a href=""#p10470816"" class=""quotelink"">&gt;&gt;10470816</a><br>Oh it didn&#039;t show it.', 'filename': 'the_funny_in_question', 'ext': '.png', 'w': 1270, 'h': 109, 'tn_w': 125, 'tn_h': 10, 'tim': 1670735830085042, 'time': 1670735830, 'md5': 'n2E9VcDPKT5WgJsU3CGX/Q==', 'fsize': 26805, 'resto': 10430406}]",1670735830
80,10419437,10/27/22(Thu)14:53:31,Anonymous,Unbirth / vaginal vore,There hasn’t been an active thread so I’m kicking it off with some comic I’ve forgotten the name of.,166689659835363968,.jpg,1240,1754,176,250,1666896811621142,1666896811,2mU9OAyia7R41SdK41zLxA==,492437,0,0,0,unbirth-vaginal-vore,147,81,142.0,80.0,"[{'no': 10469497, 'now': '12/10/22(Sat)00:04:56', 'name': 'Anonymous', 'com': '<a href=""#p10453601"" class=""quotelink"">&gt;&gt;10453601</a><br>God, I need a continuation', 'time': 1670648696, 'resto': 10419437}, {'no': 10470201, 'now': '12/10/22(Sat)14:22:29', 'name': 'Anonymous', 'com': '<a href=""#p10458425"" class=""quotelink"">&gt;&gt;10458425</a><br><a href=""#p10469495"" class=""quotelink"">&gt;&gt;10469495</a>', 'filename': 'm87e', 'ext': '.jpg', 'w': 4299, 'h': 6071, 'tn_w': 88, 'tn_h': 125, 'tim': 1670700149603051, 'time': 1670700149, 'md5': 'hawUOHfBa0Waabfh7GFo+A==', 'fsize': 4151526, 'resto': 10419437}, {'no': 10470352, 'now': '12/10/22(Sat)16:35:25', 'name': 'Anonymous', 'com': '<a href=""#p10470201"" class=""quotelink"">&gt;&gt;10470201</a><br>the rude little dude is still alive?', 'time': 1670708125, 'resto': 10419437}, {'no': 10470554, 'now': '12/10/22(Sat)19:19:46', 'name': 'Anonymous', 'com': '<a href=""#p10470201"" class=""quotelink"">&gt;&gt;10470201</a><br>is this a new comic? Or is it still going? I thought that shit was over', 'time': 1670717986, 'resto': 10419437}, {'no': 10470811, 'now': '12/11/22(Sun)00:10:25', 'name': 'Anonymous', 'com': '<a href=""#p10470554"" class=""quotelink"">&gt;&gt;10470554</a><br>He rebooted it to remove any direct porn.', 'time': 1670735425, 'resto': 10419437}]",1670735425
