,no,now,name,sub,com,filename,ext,w,h,tn_w,tn_h,tim,time,md5,fsize,resto,bumplimit,imagelimit,semantic_url,replies,images,omitted_posts,omitted_images,last_replies,last_modified
42,10434353,11/09/22(Wed)15:09:38,Anonymous,Giantess Growth,"If it grows, it&#039;s gold. Previous thread <span class=""deadlink"">&gt;&gt;10381287</span><br><br>No futa, muscle, or other atypical growth. There&#039;s threads for that. This is for girls growing bigger and bigger.",tmpn5nyp9k_,.png,512,512,250,250,1668024578638482,1668024578,UxnbutzEPlDiiad4NFLdyA==,373206,0,0,0,giantess-growth,219,57,214.0,56.0,"[{'no': 10470350, 'now': '12/10/22(Sat)16:33:54', 'name': 'Anonymous', 'com': '<a href=""#p10464997"" class=""quotelink"">&gt;&gt;10464997</a><br>Tried it earlier. It&#039;s... OK? It tends to skip over the actual descriptions of growth you would get from a human author.', 'filename': 'Capture', 'ext': '.png', 'w': 723, 'h': 911, 'tn_w': 99, 'tn_h': 125, 'tim': 1670708034858223, 'time': 1670708034, 'md5': '1yRKEyQPn6vvtLgm+la/xg==', 'fsize': 82990, 'resto': 10434353}, {'no': 10470788, 'now': '12/10/22(Sat)23:42:48', 'name': 'Anonymous', 'com': '<a href=""#p10464997"" class=""quotelink"">&gt;&gt;10464997</a><br>I&#039;ve managed to get halfway decent results out of briefly describing the type of growth, what happens, and they putting in parenthesis (describe the process of your character growing in detail), then swiping on what&#039;s the best.<br>In general, messages with () in it are to and from the raw AI as opposed to the character so if you want to tell the AI to describe something in more detail or act a different way you can do () and it will respond back in (), usually doing what you ask.', 'time': 1670733768, 'resto': 10434353}, {'no': 10470789, 'now': '12/10/22(Sat)23:42:50', 'name': 'Anonymous', 'com': '<a href=""#p10463819"" class=""quotelink"">&gt;&gt;10463819</a><br>It&#039;s out now!', 'time': 1670733770, 'resto': 10434353}, {'no': 10470965, 'now': '12/11/22(Sun)03:58:21', 'name': 'Anonymous', 'com': '<a href=""#p10470789"" class=""quotelink"">&gt;&gt;10470789</a><br>https://tailblazer.gumroad.com/l/BB<wbr>2<br>16 minutes long, holy my dick. someone post this', 'time': 1670749101, 'resto': 10434353}, {'no': 10470974, 'now': '12/11/22(Sun)04:15:19', 'name': 'Anonymous', 'com': '<a href=""#p10470965"" class=""quotelink"">&gt;&gt;10470965</a><br>I bought and watched it. It’s a grab bag of like 15 different fetishes, 14 of which I don’t have, and several of which grossed me out. I consider giant women to be fairly vanilla and the few minutes of normal standard Christian growth was disappointing, since I was initially attracted by the 15 minute run time. Happy for the animator. But I’m not into any of this shit.<br>I’m not linking it because piracy bad', 'time': 1670750119, 'resto': 10434353}]",1670750119
43,10352786,09/02/22(Fri)18:01:03,Anonymous,Inanimate Transformation thread: gaming edition,"Obviously, theme is just a suggestion, but it&#039;s how I&#039;m going to start it.",ddtdph6-3cd368c8-5807-40d3-82a3-716aab339c82,.png,2100,3000,175,250,1662156063960993,1662156063,r4WvMP1J4+xfTO0vpIrt2Q==,4099681,0,0,0,inanimate-transformation-thread-gaming-edition,285,186,280.0,182.0,"[{'no': 10468241, 'now': '12/08/22(Thu)19:30:04', 'name': 'Anonymous', 'com': 'just wanna be a cute girl&#039;s dirty flip-flops bros', 'time': 1670545804, 'resto': 10352786}, {'no': 10468676, 'now': '12/09/22(Fri)04:10:40', 'name': 'Anonymous', 'filename': '1643308436094', 'ext': '.png', 'w': 1158, 'h': 897, 'tn_w': 125, 'tn_h': 96, 'tim': 1670577040566359, 'time': 1670577040, 'md5': 'yE7kWsZMpmSLhI6L9mpygQ==', 'fsize': 335155, 'resto': 10352786}, {'no': 10469681, 'now': '12/10/22(Sat)04:08:08', 'name': 'Anonymous', 'filename': '1665950227933', 'ext': '.jpg', 'w': 1024, 'h': 1178, 'tn_w': 108, 'tn_h': 125, 'tim': 1670663288474745, 'time': 1670663288, 'md5': 'qoJUv7AjvzNN01b1GR5O+Q==', 'fsize': 104883, 'resto': 10352786}, {'no': 10470451, 'now': '12/10/22(Sat)17:46:06', 'name': 'Anonymous', 'filename': '1643119368201', 'ext': '.png', 'w': 1600, 'h': 1384, 'tn_w': 125, 'tn_h': 108, 'tim': 1670712366623680, 'time': 1670712366, 'md5': 'RlqWnbaDgk+lpike77ydaw==', 'fsize': 2642398, 'resto': 10352786}, {'no': 10470972, 'now': '12/11/22(Sun)04:12:03', 'name': 'Anonymous', 'filename': '1643955833526', 'ext': '.jpg', 'w': 818, 'h': 1200, 'tn_w': 85, 'tn_h': 125, 'tim': 1670749923847111, 'time': 1670749923, 'md5': 'qrw8/plc4oqbIu3minrDTQ==', 'fsize': 309907, 'resto': 10352786}]",1670749923
44,10418626,10/26/22(Wed)19:43:07,Anonymous,Flattening and Shape-Change,You know the drill. Lovely ladies and lads getting smushed or reshaped!,1643951757721,.jpg,3508,2480,250,176,1666827787602587,1666827787,RHBHfHkBdsfDvH2/ik+vhQ==,1070405,0,0,0,flattening-and-shapechange,183,140,178.0,136.0,"[{'no': 10468677, 'now': '12/09/22(Fri)04:11:15', 'name': 'Anonymous', 'filename': '1647528608058', 'ext': '.png', 'w': 2656, 'h': 3297, 'tn_w': 100, 'tn_h': 125, 'tim': 1670577075297139, 'time': 1670577075, 'md5': 'YynyF5yInVJdtu3Eibgfkw==', 'fsize': 3671491, 'resto': 10418626}, {'no': 10469682, 'now': '12/10/22(Sat)04:09:22', 'name': 'Anonymous', 'filename': '1640114163158', 'ext': '.jpg', 'w': 1011, 'h': 1000, 'tn_w': 125, 'tn_h': 123, 'tim': 1670663362024260, 'time': 1670663362, 'md5': 'BHc1NNXQ5HM2YbNDjQfX8g==', 'fsize': 710021, 'resto': 10418626}, {'no': 10470452, 'now': '12/10/22(Sat)17:46:38', 'name': 'Anonymous', 'filename': '1647709735947', 'ext': '.jpg', 'w': 1448, 'h': 2048, 'tn_w': 88, 'tn_h': 125, 'tim': 1670712398998890, 'time': 1670712398, 'md5': '0XPncs7yy7vITeeAPojDRA==', 'fsize': 245960, 'resto': 10418626}, {'no': 10470499, 'now': '12/10/22(Sat)18:26:42', 'name': 'Anonymous', 'com': '<a href=""#p10465610"" class=""quotelink"">&gt;&gt;10465610</a><br>SWEET!!! <br>Got any more translated works?', 'time': 1670714802, 'resto': 10418626}, {'no': 10470971, 'now': '12/11/22(Sun)04:11:23', 'name': 'Anonymous', 'filename': '1662187837831', 'ext': '.jpg', 'w': 610, 'h': 688, 'tn_w': 110, 'tn_h': 125, 'tim': 1670749883560852, 'time': 1670749883, 'md5': 'AiDUAonjkiJj0WeqlHrizg==', 'fsize': 63153, 'resto': 10418626}]",1670749883
45,10458380,11/30/22(Wed)01:04:31,Anonymous,Giant Male: 9s Edition,"Previous Thread: <span class=""deadlink"">&gt;&gt;10431851</span><br>Short shorts make giant boys even cuter",D9QSgxSUwAEnHPW,.jpg,1920,1080,250,140,1669788271734887,1669788271,fuIEyx9Gat0wXdwHLTmc6g==,193659,0,0,0,giant-male-9s-edition,109,64,104.0,64.0,"[{'no': 10470825, 'now': '12/11/22(Sun)00:31:32', 'name': 'Anonymous', 'com': 'What&#039;s the giant male version of a big-tittied lactose-intolerant giantess milf?', 'time': 1670736692, 'resto': 10458380}, {'no': 10470932, 'now': '12/11/22(Sun)03:01:52', 'name': 'Anonymous', 'com': '<a href=""#p10470815"" class=""quotelink"">&gt;&gt;10470815</a><br>What&#039;s the syntax for talking with these bots anyway? Does putting stuff in asteriks and quotes actually work?', 'time': 1670745712, 'resto': 10458380}, {'no': 10470957, 'now': '12/11/22(Sun)03:46:43', 'name': 'Anonymous', 'com': '<a href=""#p10470932"" class=""quotelink"">&gt;&gt;10470932</a><br>Any syntax you want that makes sense to you. You can use asterisks or quotes if it feels better, or just type it out in plain text if that feels better, etc. They&#039;re trained on conversation so using converastion works.', 'time': 1670748403, 'resto': 10458380}, {'no': 10470962, 'now': '12/11/22(Sun)03:55:18', 'name': 'Anonymous', 'com': 'What would it be like for a tiny shota to go through elementary school with his normal-sized schoolmates?', 'time': 1670748918, 'resto': 10458380}, {'no': 10470964, 'now': '12/11/22(Sun)03:57:26', 'name': 'Anonymous', 'com': '<a href=""#p10466413"" class=""quotelink"">&gt;&gt;10466413</a><br>It&#039;s the fastest way to get to the prostate', 'time': 1670749046, 'resto': 10458380}]",1670749046
46,10455642,11/27/22(Sun)16:12:58,Anonymous,"Robots, Cyborgs, and Living Dolls","Robo-maid edition.<br>Previous thread: <span class=""deadlink"">&gt;&gt;10427698</span>",83336576_p0,.jpg,3508,4961,176,250,1669583578587278,1669583578,AFThtwVsrTBi1rVnDaFD0Q==,1294833,0,0,0,robots-cyborgs-and-living-dolls,192,123,187.0,118.0,"[{'no': 10470795, 'now': '12/10/22(Sat)23:47:49', 'name': 'Anonymous', 'com': 'This is Gekka. Gekka is a Gabu. She is also a combat veteran who saw death and killed fiddy men.', 'filename': '99969262_p0', 'ext': '.png', 'w': 1191, 'h': 1684, 'tn_w': 88, 'tn_h': 125, 'tim': 1670734069726028, 'time': 1670734069, 'md5': 'lCGWtl3QIB5/4xtjxDD23g==', 'fsize': 516881, 'resto': 10455642}, {'no': 10470800, 'now': '12/10/22(Sat)23:53:36', 'name': 'Anonymous', 'com': '<a href=""#p10470795"" class=""quotelink"">&gt;&gt;10470795</a><br>I dislike her design.', 'filename': '1629017641273', 'ext': '.png', 'w': 1058, 'h': 1714, 'tn_w': 77, 'tn_h': 125, 'tim': 1670734416339444, 'time': 1670734416, 'md5': 'kqA3WoABRDlq4mN1zvKQJA==', 'fsize': 910112, 'resto': 10455642}, {'no': 10470804, 'now': '12/10/22(Sat)23:57:14', 'name': 'Anonymous', 'com': '<a href=""#p10470800"" class=""quotelink"">&gt;&gt;10470800</a><br>That&#039;s just what she wears after The War.', 'filename': '1657910751832', 'ext': '.jpg', 'w': 1280, 'h': 720, 'tn_w': 125, 'tn_h': 70, 'tim': 1670734634397922, 'time': 1670734634, 'md5': 'RXzvpll3aN/dlF1x+r7Qug==', 'fsize': 360079, 'resto': 10455642}, {'no': 10470808, 'now': '12/11/22(Sun)00:00:01', 'name': 'Anonymous', 'com': '<a href=""#p10470804"" class=""quotelink"">&gt;&gt;10470804</a><br>I stand by what I said.', 'filename': '91657671_p0', 'ext': '.png', 'w': 2480, 'h': 3508, 'tn_w': 88, 'tn_h': 125, 'tim': 1670734801772038, 'time': 1670734801, 'md5': 'VMJKVCayl56CyhYUUtBWwA==', 'fsize': 3278231, 'resto': 10455642}, {'no': 10470963, 'now': '12/11/22(Sun)03:56:07', 'name': 'Anonymous', 'filename': '__original_drawn_by_sukabu__e78ecb2859fcc3f29478a045ffa7c943', 'ext': '.jpg', 'w': 1731, 'h': 2095, 'tn_w': 103, 'tn_h': 125, 'tim': 1670748967193813, 'time': 1670748967, 'md5': 'KBBFzLFGMjT2YgsGkp2/lw==', 'fsize': 999311, 'resto': 10455642}]",1670748967
47,10389313,10/05/22(Wed)15:15:14,Anonymous,BHM thread,Tight clothes edition. Post some boys wearing clothes that they&#039;re about 50 pounds too fat to fit in!,chub,.jpg,3580,3580,249,249,1664997314159761,1664997314,O3H/pz7RO1SSaBCLRDnS5A==,636326,0,0,0,bhm-thread,245,139,240.0,139.0,"[{'no': 10470759, 'now': '12/10/22(Sat)22:57:38', 'name': 'Anonymous', 'com': '<span class=""quote"">&gt;See fat guy with a massive belly</span><br><span class=""quote"">&gt;Start fantasizing about getting that fat</span><br><span class=""quote"">&gt;Make feabie account, browse feeders in my area</span><br><span class=""quote"">&gt;Getting excited, finish my profile</span><br><span class=""quote"">&gt;Reality starts to set in, don&#039;t want to get unhealthy</span><br><span class=""quote"">&gt;Sigh and delete my account yet again</span><br>Anyone else hate dealing with this fetish? I always keep my BMI around 20 to stay healthy, but the thought of just giving in and gorging until I&#039;m 300+ pounds just makes me stupidly horny. If it wasn&#039;t for knowing about the health problems, I&#039;d probably be a blimp by now.', 'time': 1670731058, 'resto': 10389313}, {'no': 10470866, 'now': '12/11/22(Sun)01:17:20', 'name': 'Anonymous', 'com': '<a href=""#p10470759"" class=""quotelink"">&gt;&gt;10470759</a><br>it depends on what kind of health problems you are worried about.<br>unless you mindlessly gorge on completely unhealthy shit there should be any severe problems around 300, just moderately annoying things like getting exhausted quicker and a few years off your lifespan, which by that point your body would be useless due to age anyways.<br>infact thats the main reason i dont really care about the negatives. id rather die doing what i love than stay healthy so that i can be old for the sake of being old', 'time': 1670739440, 'resto': 10389313}, {'no': 10470886, 'now': '12/11/22(Sun)01:45:45', 'name': 'Anonymous', 'com': '<a href=""#p10470866"" class=""quotelink"">&gt;&gt;10470866</a><br>SHOULDNT be. fuck', 'time': 1670741145, 'resto': 10389313}, {'no': 10470931, 'now': '12/11/22(Sun)03:01:10', 'name': 'Anonymous', 'com': '<a href=""#p10470759"" class=""quotelink"">&gt;&gt;10470759</a><br><br>Currently at 350lbs or around that, and can confirm that yeah if you&#039;re not stupid and just shoveling down doritos and dew all the time you&#039;ll be fine. Gain smart, keep your exercise up, look after yourself while you gain and enjoy it.', 'time': 1670745670, 'resto': 10389313}, {'no': 10470961, 'now': '12/11/22(Sun)03:53:16', 'name': 'Anonymous', 'com': '<a href=""#p10470931"" class=""quotelink"">&gt;&gt;10470931</a><br>it makes me wonder just how far someone could go with the perfect diet.<br>because THEORETICALLY if you can avoid destroying your health and having fat build around vital organs the only limit is is the point where your organs just cant provide enough for the sheer bulk of your body.', 'time': 1670748796, 'resto': 10389313}]",1670748796
48,10440541,11/14/22(Mon)17:46:45,Anonymous,Strongfat/Bulk thread,"Fuck it, no one else is restarting this.<br>For those who prefer their muscle girls on the rounder/softer side.",mother_s_day_special_6_by_sovietmarmalade_dekgefx,.png,2000,2000,250,250,1668466005362567,1668466005,J6EmlMxuwsX8ocSlpM2Fpg==,2058106,0,0,0,strongfatbulk-thread,103,70,98.0,68.0,"[{'no': 10469725, 'now': '12/10/22(Sat)05:09:47', 'name': 'Anonymous', 'com': '<a href=""#p10465033"" class=""quotelink"">&gt;&gt;10465033</a><br>Holy fuck I love this<br>Do you have a Twitter?', 'time': 1670666987, 'resto': 10440541}, {'no': 10469742, 'now': '12/10/22(Sat)05:24:02', 'name': 'Anonymous', 'com': '<a href=""#p10469594"" class=""quotelink"">&gt;&gt;10469594</a><br>I mean it&#039;s /d/, so anyway.', 'time': 1670667842, 'resto': 10440541}, {'no': 10470272, 'now': '12/10/22(Sat)15:17:05', 'name': 'Anonymous', 'com': '<a href=""#p10469594"" class=""quotelink"">&gt;&gt;10469594</a><br>The artist made a non futa variant it turns out.', 'filename': '33302107_p0', 'ext': '.jpg', 'w': 1200, 'h': 1057, 'tn_w': 125, 'tn_h': 110, 'tim': 1670703425415618, 'time': 1670703425, 'md5': 'UW6C0mudwGBdUcB3DirPyA==', 'fsize': 654282, 'resto': 10440541}, {'no': 10470915, 'now': '12/11/22(Sun)02:42:27', 'name': 'Anonymous', 'com': '<a href=""#p10469725"" class=""quotelink"">&gt;&gt;10469725</a><br>yea<br>https://twitter.com/BlackFrosto666', 'time': 1670744547, 'resto': 10440541}, {'no': 10470959, 'now': '12/11/22(Sun)03:51:04', 'name': 'Anonymous', 'filename': 'P237', 'ext': '.jpg', 'w': 1280, 'h': 1855, 'tn_w': 86, 'tn_h': 124, 'tim': 1670748664278100, 'time': 1670748664, 'md5': 'Ba8clf6gTypuhT4C+NJ0xw==', 'fsize': 579782, 'resto': 10440541}]",1670748664
49,10468096,12/08/22(Thu)16:26:34,Anonymous,Futa Monster Girls,monster chicks with dicks,2322b69e15dd6d93aed0bacda64b77c6,.jpg,2600,3244,200,250,1670534794702784,1670534794,Xkpqs3K2DUkLzMT4bF10gA==,2344393,0,0,0,futa-monster-girls,14,9,9.0,6.0,"[{'no': 10469872, 'now': '12/10/22(Sat)08:12:35', 'name': 'Anonymous', 'com': '<a href=""#p10469819"" class=""quotelink"">&gt;&gt;10469819</a><br>I&#039;m actually more curious as to what exactly or at least when did it happen, non-futa people raiding futa fans on /d/ sounds absurdly unlikely and usually such shitfights are in reverse direction.', 'filename': '1429336394305', 'ext': '.jpg', 'w': 850, 'h': 1136, 'tn_w': 93, 'tn_h': 125, 'tim': 1670677955012012, 'time': 1670677955, 'md5': 'l8vZmT6x0XGFtNu4vtxLHw==', 'fsize': 404228, 'resto': 10468096}, {'no': 10469894, 'now': '12/10/22(Sat)08:46:03', 'name': 'Anonymous', 'com': '<a href=""#p10469872"" class=""quotelink"">&gt;&gt;10469872</a><br>Four, five years ago I think, if it&#039;s the short run of futa threads I&#039;m thinking of. Never seen a discord link posted since, despite it being mentioned, so I&#039;m halfway convinced it doesn&#039;t actually exist.', 'time': 1670679963, 'resto': 10468096}, {'no': 10470532, 'now': '12/10/22(Sat)18:53:52', 'name': 'Anonymous', 'filename': '116620253749bdf9ad224418ed202762e98124e2', 'ext': '.jpg', 'w': 2045, 'h': 1805, 'tn_w': 125, 'tn_h': 110, 'tim': 1670716432046994, 'time': 1670716432, 'md5': 'n2MMmzaUf+WtB+hJY6i9cw==', 'fsize': 450404, 'resto': 10468096}, {'no': 10470569, 'now': '12/10/22(Sat)19:38:35', 'name': 'Anonymous', 'com': '<a href=""#p10469803"" class=""quotelink"">&gt;&gt;10469803</a><br>Next buck victim', 'time': 1670719115, 'resto': 10468096}, {'no': 10470956, 'now': '12/11/22(Sun)03:44:28', 'name': 'Anonymous', 'com': 'I&#039;ve decided to make separate full /d/ board on my monster girl chan as <a href=""/d/thread/10404669#p10468088"" class=""quotelink"">&gt;&gt;10468088</a> suggested, NO content limitations aside from being monster girls.<br>Link to the chan is on the image in this post: https://desuarchive.org/d/thread/10<wbr>438433/#q10440237<br>Need to keep it half-secret and not link directly until I have staff keeping the shitters out, the board you are interested in is /amg/.<br>Feel free to use the board normally, any traffic would be a big help because I need to know how much server resources are going to be needed for full launch.', 'filename': '0ac262307ef7af9021a35d58c1cb5589', 'ext': '.png', 'w': 2400, 'h': 1950, 'tn_w': 125, 'tn_h': 101, 'tim': 1670748268658274, 'time': 1670748268, 'md5': 'CsJiMH73r5Aho11YwctViQ==', 'fsize': 1810674, 'resto': 10468096}]",1670748268
50,10467589,12/08/22(Thu)04:47:54,SickDude,Vagina mouth thread,Post girls with a mouth that&#039;s been replaced by a vagina. Anything like that. The first dump of things are some art I&#039;ve done over the last few days.,FriyaRefSheetTrimmed,.png,1794,1242,250,173,1670492874468757,1670492874,qNSvnW7sQwQt2O1iF8HNHw==,532358,0,0,0,vagina-mouth-thread,17,15,12.0,11.0,"[{'no': 10469478, 'now': '12/09/22(Fri)23:42:04', 'name': 'Anonymous', 'com': '<a href=""#p10467608"" class=""quotelink"">&gt;&gt;10467608</a><br>Thats a nice edit right there, do ya have more by any chance?<br>Here’s one I made', 'filename': '89346C6D-BDE1-4919-898D-D0E330C9BEFA', 'ext': '.jpg', 'w': 850, 'h': 1274, 'tn_w': 83, 'tn_h': 125, 'tim': 1670647324880366, 'time': 1670647324, 'md5': 'xcvFxyW6GKnsCmqlwuEhAg==', 'fsize': 122110, 'resto': 10467589}, {'no': 10469481, 'now': '12/09/22(Fri)23:43:57', 'name': 'Anonymous', 'com': '<a href=""#p10468363"" class=""quotelink"">&gt;&gt;10468363</a><br>Think I made the original edit of this one some time ago :p', 'time': 1670647437, 'resto': 10467589}, {'no': 10470777, 'now': '12/10/22(Sat)23:22:57', 'name': 'Anonymous', 'filename': '1645323725340', 'ext': '.png', 'w': 3000, 'h': 3000, 'tn_w': 125, 'tn_h': 125, 'tim': 1670732577732596, 'time': 1670732577, 'md5': 'bmZWoD8PUN+2O3kWs8Ji/Q==', 'fsize': 854624, 'resto': 10467589}, {'no': 10470874, 'now': '12/11/22(Sun)01:22:28', 'name': 'Anonymous', 'com': '<a href=""#p10469481"" class=""quotelink"">&gt;&gt;10469481</a><br>what? no you didn&#039;t. I literally made that edit myself. that&#039;s my handwriting.', 'filename': '1659048588581', 'ext': '.png', 'w': 1016, 'h': 1157, 'tn_w': 109, 'tn_h': 125, 'tim': 1670739748504419, 'time': 1670739748, 'md5': 'JF6PS5RGcKvfucQUg0shlg==', 'fsize': 500039, 'resto': 10467589}, {'no': 10470953, 'now': '12/11/22(Sun)03:34:17', 'name': 'Anonymous', 'com': '<a href=""#p10470874"" class=""quotelink"">&gt;&gt;10470874</a><br>Oh boy, then I guess we literlly edited the same pic, exctly the same way', 'filename': 'B6C47B03-8469-4530-A459-FC15B1AD55E8', 'ext': '.jpg', 'w': 1468, 'h': 1972, 'tn_w': 93, 'tn_h': 125, 'tim': 1670747657196938, 'time': 1670747657, 'md5': 'Z7n7NZwjegzNhent86x5VA==', 'fsize': 210118, 'resto': 10467589}]",1670747657
51,10445738,11/19/22(Sat)06:39:29,Anonymous,Spanking thread,"Last thread : <span class=""deadlink"">&gt;&gt;10410652</span><br><br>Thread&#039;s about spanking, of the ass variety.",911,.png,650,867,187,250,1668857969078325,1668857969,JAlt8myX5NeoFjUiVI62Qg==,824537,0,0,0,spanking-thread,191,122,186.0,119.0,"[{'no': 10469774, 'now': '12/10/22(Sat)06:09:33', 'name': 'Anonymous', 'filename': 'aHR0cHM6Ly9kZXRyb2l0cmlvdGNpdHkuY29tL21lZGlhLzFhOWY2OWU2OWU2ZjQ2OTA3NTlmYTA5NmRiMGM0ZmFkMTAxOGUwMWEyNTViZTdlMjI0OWI2ZjJhNGM0ODA3MWYuanBn', 'ext': '.jpg', 'w': 1280, 'h': 1707, 'tn_w': 93, 'tn_h': 125, 'tim': 1670670573450546, 'time': 1670670573, 'md5': 'sCuZ0STInHkLbC32Se+jLA==', 'fsize': 223881, 'resto': 10445738}, {'no': 10469794, 'now': '12/10/22(Sat)06:28:21', 'name': 'Anonymous', 'filename': '01_25', 'ext': '.png', 'w': 1200, 'h': 1706, 'tn_w': 87, 'tn_h': 125, 'tim': 1670671701971395, 'time': 1670671701, 'md5': 'MCL+WVsIau/MsO5j5VZIYw==', 'fsize': 286315, 'resto': 10445738}, {'no': 10469796, 'now': '12/10/22(Sat)06:28:38', 'name': 'Anonymous', 'filename': 'Connected_With_Momiji_09', 'ext': '.jpg', 'w': 1235, 'h': 1800, 'tn_w': 85, 'tn_h': 125, 'tim': 1670671718337925, 'time': 1670671718, 'md5': 'g5r5a9/XkmlBa463PnsdeA==', 'fsize': 895590, 'resto': 10445738}, {'no': 10470000, 'now': '12/10/22(Sat)11:12:59', 'name': 'Anonymous', 'com': '<a href=""#p10469794"" class=""quotelink"">&gt;&gt;10469794</a><br>What manga is this? I like the art.', 'time': 1670688779, 'resto': 10445738}, {'no': 10470369, 'now': '12/10/22(Sat)16:44:46', 'name': 'Anonymous', 'com': '<a href=""#p10470000"" class=""quotelink"">&gt;&gt;10470000</a><br>Shiboritoranaide, Onna Shounin-san.<br><br>I don&#039;t think it has any other spanking scenes, but this one is right in the beginning and it&#039;s really good. He gets caught in a weak dungeon trap, so she takes advantage of him by selling him a &quot;remove trap&quot; scroll at an inflated price. Except she confused it with a &quot;spawn traps&quot; scroll, stumbled into a bunch of her own traps, and got a good tanning.', 'time': 1670708686, 'resto': 10445738}]",1670747578
52,10467102,12/07/22(Wed)16:35:45,Anonymous,Futanari Cumming Through Clothes,Thread of futanari cumming through/in clothing,e0eb1ce9730aed510189b497181cd70e,.png,942,870,250,230,1670448945234576,1670448945,4Osc6XMK7VEBibSXGBzXDg==,986840,0,0,0,futanari-cumming-through-clothes,16,13,11.0,11.0,"[{'no': 10468650, 'now': '12/09/22(Fri)03:25:57', 'name': 'Anonymous', 'filename': 'sample_3ef81fbb4f75018de8058617dd52d8ef', 'ext': '.jpg', 'w': 850, 'h': 1313, 'tn_w': 80, 'tn_h': 125, 'tim': 1670574357456061, 'time': 1670574357, 'md5': '2rd1pl0/JzmkWv7PF4QpvQ==', 'fsize': 168096, 'resto': 10467102}, {'no': 10468651, 'now': '12/09/22(Fri)03:26:48', 'name': 'Anonymous', 'filename': 'sample_029ad945743241c0be5f2c73f4a86fe0', 'ext': '.jpg', 'w': 850, 'h': 1204, 'tn_w': 88, 'tn_h': 125, 'tim': 1670574408311066, 'time': 1670574408, 'md5': 'FPgPpXp4PKj4CMGRUdum/g==', 'fsize': 341761, 'resto': 10467102}, {'no': 10469787, 'now': '12/10/22(Sat)06:24:18', 'name': 'Anonymous', 'com': '<a href=""#p10467405"" class=""quotelink"">&gt;&gt;10467405</a><br>Very nice', 'time': 1670671458, 'resto': 10467102}, {'no': 10470039, 'now': '12/10/22(Sat)12:03:27', 'name': 'Anonymous', 'com': '<span class=""quote"">&gt;sample</span>', 'time': 1670691807, 'resto': 10467102}, {'no': 10470950, 'now': '12/11/22(Sun)03:23:19', 'name': 'Anonymous', 'com': '<a href=""#p10470039"" class=""quotelink"">&gt;&gt;10470039</a><br>kek', 'time': 1670746999, 'resto': 10467102}]",1670746999
53,10435298,11/10/22(Thu)12:05:39,Anonymous,Demon Girls Thread,Post your favorite hellsluts,8dee58b7ce482430f9e53c5e883a745d,.jpg,800,1487,134,250,1668099939874983,1668099939,rFMI38z1on+lfOegb1e2JQ==,597500,0,0,0,demon-girls-thread,282,256,277.0,253.0,"[{'no': 10468531, 'now': '12/09/22(Fri)00:31:20', 'name': 'Anonymous', 'com': '<a href=""#p10466420"" class=""quotelink"">&gt;&gt;10466420</a><br>I wish they keep the original idea of making Lilith a trap. Would be the Bridget way Bridget was a scribble and along with Poison, would be Capcom sex symbols.', 'time': 1670563880, 'resto': 10435298}, {'no': 10469086, 'now': '12/09/22(Fri)14:42:23', 'name': 'Anonymous', 'filename': '1499275512648', 'ext': '.png', 'w': 744, 'h': 1049, 'tn_w': 88, 'tn_h': 125, 'tim': 1670614943883474, 'time': 1670614943, 'md5': '+VO9deapnix8yWqE1D9qpw==', 'fsize': 1083278, 'resto': 10435298}, {'no': 10469740, 'now': '12/10/22(Sat)05:22:45', 'name': 'Anonymous', 'com': '<a href=""#p10464763"" class=""quotelink"">&gt;&gt;10464763</a><br>Damn, nice', 'time': 1670667765, 'resto': 10435298}, {'no': 10470250, 'now': '12/10/22(Sat)15:02:58', 'name': 'Anonymous', 'filename': '1486803265109', 'ext': '.jpg', 'w': 900, 'h': 1200, 'tn_w': 93, 'tn_h': 125, 'tim': 1670702578539460, 'time': 1670702578, 'md5': 'mlU8Nqm+uXU9rke68fi1eA==', 'fsize': 148818, 'resto': 10435298}, {'no': 10470947, 'now': '12/11/22(Sun)03:15:33', 'name': 'Anonymous', 'filename': '1623721345252', 'ext': '.jpg', 'w': 2448, 'h': 3264, 'tn_w': 93, 'tn_h': 125, 'tim': 1670746533276883, 'time': 1670746533, 'md5': 'CuNyk7F5g7XGmHemeVzr9g==', 'fsize': 1376462, 'resto': 10435298}]",1670746533
