,no,now,name,sub,com,filename,ext,w,h,tn_w,tn_h,tim,time,md5,fsize,resto,bumplimit,imagelimit,semantic_url,replies,images,omitted_posts,omitted_images,last_replies,last_modified
0,10461033,12/02/22(Fri)08:35:21,Anonymous,Gentle Giantess: Low angle view edition!,"previous<br><br><a href=""/d/thread/10448348#p10448348"" class=""quotelink"">&gt;&gt;10448348</a>",6578395f3a6b9c7390bfac81ad7038dd,.jpg,1334,1920,173,250,1669988121223968,1669988121,kzvZgKl9FIeeHmUFdQpClQ==,248157,0,0,0,gentle-giantess-low-angle-view-edition,254,107,249.0,104.0,"[{'no': 10471056, 'now': '12/11/22(Sun)06:37:31', 'name': 'Anonymous', 'com': '<a href=""#p10470548"" class=""quotelink"">&gt;&gt;10470548</a><br><span class=""quote"">&gt;everyone is afraid of giant spider girls cause yknow spiders</span><br><span class=""quote"">&gt;they&#039;re in fact the most chillest of giant monstergirls and just want someone to talk to</span><br><span class=""quote"">&gt;the ones that haven&#039;t me humans are sometimes even afraid of them because OH GOD OH FUCK WHY IS IT SO FAST I NEED A CUP SO I CAN CATCH IT AND RELEASE IT OUTSIDE</span>', 'filename': '1653360679220', 'ext': '.jpg', 'w': 764, 'h': 720, 'tn_w': 125, 'tn_h': 117, 'tim': 1670758651524473, 'time': 1670758651, 'md5': 'cKBzmZerO9MOeN2rMQroUA==', 'fsize': 100903, 'resto': 10461033}, {'no': 10471057, 'now': '12/11/22(Sun)06:40:09', 'name': 'Anonymous', 'com': '<span class=""quote"">&gt;giant kaiju girls</span><br><span class=""quote"">&gt;giant robot girls</span><br><span class=""quote"">&gt;giant alien girls</span><br><span class=""quote"">&gt;sorta giant space marine girls</span><br><span class=""quote"">&gt;giant ork girls</span><br>once again, everyone forgets about the giant goblin girls. They deserve tiny boyfriends too. You can&#039;t igonore them just because they&#039;re a bit shorter than your average giant girl', 'filename': 'giantgoblingf', 'ext': '.jpg', 'w': 3532, 'h': 2244, 'tn_w': 125, 'tn_h': 79, 'tim': 1670758809769539, 'time': 1670758809, 'md5': 'H8sch6W1WdxVaD3zVCD4Iw==', 'fsize': 992049, 'resto': 10461033}, {'no': 10471062, 'now': '12/11/22(Sun)06:50:59', 'name': 'Anonymous', 'com': '<a href=""#p10471057"" class=""quotelink"">&gt;&gt;10471057</a><br>Sauce?', 'time': 1670759459, 'resto': 10461033}, {'no': 10471063, 'now': '12/11/22(Sun)06:53:54', 'name': 'Anonymous', 'com': '<a href=""#p10471062"" class=""quotelink"">&gt;&gt;10471062</a><br>https://twitter.com/slugmanoctavio/<wbr>status/1532406696001388548', 'time': 1670759634, 'resto': 10461033}, {'no': 10471068, 'now': '12/11/22(Sun)07:13:47', 'name': 'Anonymous', 'com': 'Alternative giant tomboy gf', 'filename': '1670619861598500', 'ext': '.jpg', 'w': 4632, 'h': 5362, 'tn_w': 107, 'tn_h': 124, 'tim': 1670760827334532, 'time': 1670760827, 'md5': '9aV5edhoIKckRxixw4Hz0A==', 'fsize': 2430722, 'resto': 10461033}]",1670760827
1,10450145,11/23/22(Wed)06:32:37,Anonymous,/rg/ - Ryona General 42,"Thread for cute anime girls getting demolished. No hard guro, entrails, decapitation, etc. Previous thread <span class=""deadlink"">&gt;&gt;10422805</span>",100985486_p0,.png,1457,2064,176,250,1669203157868831,1669203157,fGTiPS/eRGUQttgQRzkfeg==,2339776,0,0,0,rg-ryona-general-42,150,130,145.0,127.0,"[{'no': 10470980, 'now': '12/11/22(Sun)04:22:03', 'name': 'Anonymous', 'filename': '1663494891784', 'ext': '.jpg', 'w': 2500, 'h': 2008, 'tn_w': 125, 'tn_h': 100, 'tim': 1670750523874847, 'time': 1670750523, 'md5': '4QOzpEFS8cw2BxVCjLuc0A==', 'fsize': 484845, 'resto': 10450145}, {'no': 10470981, 'now': '12/11/22(Sun)04:25:33', 'name': 'Anonymous', 'com': 'such a thing.', 'filename': '6370110', 'ext': '.jpg', 'w': 750, 'h': 1000, 'tn_w': 93, 'tn_h': 125, 'tim': 1670750733869764, 'time': 1670750733, 'md5': 'Re6m0wVJW+4JUeCb/jxbnA==', 'fsize': 107646, 'resto': 10450145}, {'no': 10471032, 'now': '12/11/22(Sun)05:59:54', 'name': 'Anonymous', 'com': 'Has anyone got stuff that shows a girls bones being shattered while theire in a submission hold?', 'time': 1670756394, 'resto': 10450145}, {'no': 10471038, 'now': '12/11/22(Sun)06:11:58', 'name': 'Anonymous', 'com': '<a href=""#p10470981"" class=""quotelink"">&gt;&gt;10470981</a><br>nope nope nope nope', 'filename': '88809196_p0', 'ext': '.jpg', 'w': 3294, 'h': 1854, 'tn_w': 124, 'tn_h': 70, 'tim': 1670757118523004, 'time': 1670757118, 'md5': 'CjssXfUyFyIIYmddwWieKA==', 'fsize': 1645243, 'resto': 10450145}, {'no': 10471067, 'now': '12/11/22(Sun)07:11:58', 'name': 'Anonymous', 'com': '<a href=""#p10470981"" class=""quotelink"">&gt;&gt;10470981</a><br>I don&#039;t get this one', 'time': 1670760718, 'resto': 10450145}]",1670760718
2,10468481,12/08/22(Thu)23:59:02,Anonymous,TSF/Gender Bender/Rule 63/TGTF General,"Transfer Student Kingpin edition.<br><br>Previous thread: <a href=""/d/thread/10455025#p10455025"" class=""quotelink"">&gt;&gt;10455025</a>",01,.jpg,1280,1810,176,250,1670561942910859,1670561942,aeye7jes+1UR4XjMBa6Iwg==,298135,0,0,0,tsfgender-benderrule-63tgtf-general,60,36,55.0,36.0,"[{'no': 10471044, 'now': '12/11/22(Sun)06:18:40', 'name': 'Anonymous', 'com': '<a href=""#p10470640"" class=""quotelink"">&gt;&gt;10470640</a><br>Lesbian sex is less interesting, you dyke.', 'time': 1670757520, 'resto': 10468481}, {'no': 10471048, 'now': '12/11/22(Sun)06:31:36', 'name': 'Anonymous', 'com': '<a href=""#p10470943"" class=""quotelink"">&gt;&gt;10470943</a><br>My only issue with the story is that they set up the expectation of &quot;huge tits&quot;, but it ends up really conservative. Like, realistically speaking, those aren&#039;t small, especially for Japanese standards. But if you just want to go mildly above average, then you should probably rephrase that wish.<br>It sets up anticipation in the audience that will be left unfulfilled for no reason.', 'time': 1670758296, 'resto': 10468481}, {'no': 10471061, 'now': '12/11/22(Sun)06:47:03', 'name': 'Anonymous', 'com': '<a href=""#p10470640"" class=""quotelink"">&gt;&gt;10470640</a><br><span class=""quote"">&gt;Why is all this porn focused exclusively on dicking the former-boy? </span><br>well I can only speak for myself here but personally I think men are hot and it would be hot if I were attractive to the vast majority of them who are straight', 'time': 1670759223, 'resto': 10468481}, {'no': 10471064, 'now': '12/11/22(Sun)06:54:42', 'name': 'Anonymous', 'com': 'the only &#039;straight&#039; tg I like is if the girl becomes a guy or body swaps with the guy. or else its yuri all the way baby.', 'time': 1670759682, 'resto': 10468481}, {'no': 10471066, 'now': '12/11/22(Sun)07:00:38', 'name': 'Anonymous', 'com': '<a href=""#p10471064"" class=""quotelink"">&gt;&gt;10471064</a><br>the only straight tg I like is when the guy get turned into a girl because two girls having sex is gay and I&#039;m not gay, I just want to have sex with men (in a girl&#039;s body)', 'time': 1670760038, 'resto': 10468481}]",1670760038
3,10444348,11/18/22(Fri)00:34:18,Anonymous,Color and E/d/it Thread,"All Editors Welcome!<br>- Respect /d/ and global rules.<br>- Request in moderation<br>- Do not request edits of real people.<br>- Do not just post a link to your request from the previous thread. Re-state your request and repost your reference. You&#039;ll have to repost your full request after the thread 404&#039;s anyway, so please conserve post count.<br>- Avoid posting extra references as separate posts. These also eat up the post count, so try linking them instead.<br>- Do not &quot;bump&quot;, &quot;re-request&quot;, &quot;second&quot;, &quot;third&quot; etc. requests. They eat up the post limit.<br>- Be patient, not all requests will be fulfilled, it all comes down to plain dumb luck.<br>- Take it easy and please be nice to the artists! Remember, they do these for fun.<br>- Artists, don&#039;t hold back! if you like a request someone else already did, feel free to do your own take.<br>- Remember to use the Anchor for deliveries!<br>- If you would like to make the new color/edit thread, please be sure to wait until at least page 10 so that our awesome Booru-master doesn&#039;t get swamped!<br>-If you see someone asking for long nipples requests, particularly in broken english, spamming, begging etc., please ignore them and report their posts!<br>- Have fun and enjoy the lewd drawings that come from this!<br><br>Pictures of past threads are up at the /d/ booru.<br>Please tag any you have the time to!<br><br>http://deviants-despository.booru.o<wbr>rg/<br><br>If you&#039;re looking for a deleted thread try checking<br>https://desuarchive.org/<br>and enter the post # of the thread or any post for which you are searching.<br><br>You can also go to https://desustorage.org/d/search/te<wbr>xt/artists%2C%20don%27t%20hold%20ba<wbr>ck/<br>which has every thread that features this boilerplate.<br><br>Previous Thread: <span class=""deadlink"">&gt;&gt;10397500</span>",1668110694772602,.png,1060,2000,132,250,1668749658354167,1668749658,EvCw4GsGw18NyxYiLVfd/g==,717303,0,0,0,color-and-edit-thread,200,160,195.0,156.0,"[{'no': 10470306, 'now': '12/10/22(Sat)15:43:55', 'name': 'Anonymous', 'com': 'Please remove the robot joints in the arms and turn them into normal ones. Bonus points if you can make the vagina look more normal.', 'filename': '1667963161380215', 'ext': '.png', 'w': 896, 'h': 1152, 'tn_w': 97, 'tn_h': 125, 'tim': 1670705035193924, 'time': 1670705035, 'md5': '8unyk41FsFvnIH9S3f0VGQ==', 'fsize': 1414884, 'resto': 10444348}, {'no': 10470644, 'now': '12/10/22(Sat)20:45:50', 'name': 'Anonymous', 'com': 'Requesting hair/head/facial edit?? to actually resemble the character intended (Himeno CSM apparently)<br>https://files.catbox.moe/svhu93.jpg<wbr>', 'filename': '20221210_173706', 'ext': '.png', 'w': 1080, 'h': 1350, 'tn_w': 100, 'tn_h': 125, 'tim': 1670723150163996, 'time': 1670723150, 'md5': '7TmxoY8Z8vFRruKKXII6pg==', 'fsize': 435747, 'resto': 10444348}, {'no': 10470969, 'now': '12/11/22(Sun)04:07:41', 'name': 'Anonymous', 'com': '<a href=""#p10468933"" class=""quotelink"">&gt;&gt;10468933</a><br>Not OR but asking for a creampie and cum drip.', 'time': 1670749661, 'resto': 10444348}, {'no': 10471042, 'now': '12/11/22(Sun)06:16:35', 'name': 'Pingless', 'com': '<a href=""#p10456103"" class=""quotelink"">&gt;&gt;10456103</a><br>Something like this? Besides the skin the rest of the colors were pretty much already there lol', 'filename': '1669613670016535 Edit', 'ext': '.png', 'w': 1692, 'h': 2400, 'tn_w': 88, 'tn_h': 125, 'tim': 1670757395694237, 'time': 1670757395, 'md5': 'NddmEN2jDBBR48SzkDqKyQ==', 'fsize': 1840625, 'resto': 10444348}, {'no': 10471065, 'now': '12/11/22(Sun)07:00:14', 'name': 'Anonymous', 'com': '<a href=""#p10470969"" class=""quotelink"">&gt;&gt;10470969</a><br><a href=""#p10444351"" class=""quotelink"">&gt;&gt;10444351</a>', 'filename': '16BD1902-44F8-4113-A2D9-9745BC1749F9', 'ext': '.png', 'w': 1775, 'h': 1999, 'tn_w': 110, 'tn_h': 125, 'tim': 1670760014589327, 'time': 1670760014, 'md5': '6ASf7XvC6WC6k5I5l8PFPQ==', 'fsize': 2329227, 'resto': 10444348}]",1670760014
4,10446048,11/19/22(Sat)13:35:28,Anonymous,Creature/monster vore,Creature and monster vore,commission_061711152022am_by_snifer25_dfhxvxe-fullview,.jpg,1600,408,250,63,1668882928473680,1668882928,LJS5lRksNqJHi1Bb+KCbMA==,75469,0,0,0,creaturemonster-vore,251,141,246.0,141.0,"[{'no': 10470814, 'now': '12/11/22(Sun)00:13:48', 'name': 'Anonymous', 'com': '<a href=""#p10465346"" class=""quotelink"">&gt;&gt;10465346</a><br>Can someone do a translation/scanlation of this?', 'time': 1670735628, 'resto': 10446048}, {'no': 10470854, 'now': '12/11/22(Sun)01:09:59', 'name': 'Anonymous', 'com': '<a href=""#p10470360"" class=""quotelink"">&gt;&gt;10470360</a><br>Seems to be one pic, and people keep filling up his slots fairly quickly so I wouldn&#039;t be surprised If he ups it again in the near future.', 'time': 1670738999, 'resto': 10446048}, {'no': 10470897, 'now': '12/11/22(Sun)02:02:59', 'name': 'Anonymous', 'com': '<a href=""#p10465060"" class=""quotelink"">&gt;&gt;10465060</a><br>who is this artist?', 'time': 1670742179, 'resto': 10446048}, {'no': 10470905, 'now': '12/11/22(Sun)02:24:06', 'name': 'Anonymous', 'com': '<a href=""#p10470614"" class=""quotelink"">&gt;&gt;10470614</a><br>proper XIV vore. Bless you.', 'time': 1670743446, 'resto': 10446048}, {'no': 10471060, 'now': '12/11/22(Sun)06:46:31', 'name': 'Anonymous', 'com': '<a href=""#p10467222"" class=""quotelink"">&gt;&gt;10467222</a><br><span class=""quote"">&gt;https://aryion.com/g4/view/846405</span><br>Did you write this anon?', 'time': 1670759191, 'resto': 10446048}]",1670759191
5,10458793,11/30/22(Wed)12:25:12,Anonymous,[No Futa] /dmggg/ Vanilla Monster Girl Games General #17,"A new fucking gamy edition<br><br>This is a mainly vanilla general about monster girls games<br>Please read the rules at the bottom before posting.<br>General guideline for discussion here:<br><br>ALL monster girl games (as defined in the rules section) are allowed to be discussed, but you must avoid posting graphic content from them that is on the Do-not list, do keep in mind that Loli/Shota content isn&#039;t allowed on /d/.<br>In the same manner, all monster girls are allowed to be posted as long as you follow the rules section.<br><br>News:<br>Part 3 of MGQP will be released sometime in 2023.<br>Shrift 2 demo have been translated and is available bug free.<br>SHRIFT 2 chapter 1 have been released and is being translated<br>FOBS development has been officially put on hiatus, zell is focusing work on Shiro no Yakata which have been changed to be the same size a SA but lose the horror tag and a new horror game.<br><br>Notable Rentry additions:<br>added The Shimmering Horizon and Cursed Blacksmith, thanks to /d/10450174<br>added Sadiubus, thanks to /d/10449535<br>added Mermaid&#039;s Nutrition<br>added RJ299562, thanks to /d/10449154<br>added RJ429736<br>updated Paccsu to v1.00<br><br>Monster Girl Games Collection:<br>Rentry: https://rentry.org/zb6zw<br><br>Game guides and resources: https://rentry.org/53quw<br>Pstmoe mirror: https://pst.moe/paste/wqcmss<br><br>Rules:<br>Do:<br>Discuss/Post Monster Girls Centric Games (80%+ MG content)<br>Post Monster Girls of any kind and origin, naked or in the act but keep them vanilla and follow the Do-not section.<br>Respect other anons<br>Keep it vanilla!<br>Try to have some fun<br><br>Do-not:<br>Post futa, vore, loli, shota porn of any kind in any context.<br>Discuss futa, vore except for the strict purpose of game discussion, like plot events, game features and so on.<br>Pretend animals with Human heads, pegging, homos, buttplay, mpreg, futa, etc... to be vanilla to post porn<br>Bring drama/rivalry from other threads<br>Feed trolls (You). Report, filter, move on.<br><br>Previous Thread: <a href=""/d/thread/10438433#p10438433"" class=""quotelink"">&gt;&gt;10438433</a>",Shrift 2,.jpg,560,420,250,187,1669829112930996,1669829112,4kwZkamPCOMWE50PAEOK4Q==,58708,0,0,0,no-futa-dmggg-vanilla-monster-girl-games-general,155,95,150.0,93.0,"[{'no': 10471034, 'now': '12/11/22(Sun)06:03:40', 'name': 'Anonymous', 'com': '<a href=""#p10471031"" class=""quotelink"">&gt;&gt;10471031</a>', 'filename': 'Ew7tT1GVIAEGD9Q', 'ext': '.jpg', 'w': 1600, 'h': 1138, 'tn_w': 125, 'tn_h': 88, 'tim': 1670756620352819, 'time': 1670756620, 'md5': 'vCeANNp6Ogz1f49semj8jA==', 'fsize': 257335, 'resto': 10458793}, {'no': 10471035, 'now': '12/11/22(Sun)06:04:31', 'name': 'Anonymous', 'com': '<a href=""#p10471034"" class=""quotelink"">&gt;&gt;10471034</a><br>w-wew', 'time': 1670756671, 'resto': 10458793}, {'no': 10471036, 'now': '12/11/22(Sun)06:08:14', 'name': 'Anonymous', 'com': '<a href=""#p10471034"" class=""quotelink"">&gt;&gt;10471034</a><br><span class=""quote"">&gt;check artist</span><br><span class=""quote"">&gt;chastity + femboy fetish</span><br>Oh well.', 'filename': '99435468_p0', 'ext': '.jpg', 'w': 1000, 'h': 1453, 'tn_w': 86, 'tn_h': 125, 'tim': 1670756894109184, 'time': 1670756894, 'md5': 'awnZ+U6bDed9A4TY3+tAJA==', 'fsize': 206257, 'resto': 10458793}, {'no': 10471037, 'now': '12/11/22(Sun)06:08:43', 'name': 'Anonymous', 'com': '<a href=""#p10471029"" class=""quotelink"">&gt;&gt;10471029</a><br>makes me think of an escape artist performance where after she gets free you and her fuck in front of the audience and she&#039;s embarrassed because of the people watching but she just can&#039;t stop herself', 'time': 1670756923, 'resto': 10458793}, {'no': 10471059, 'now': '12/11/22(Sun)06:43:51', 'name': 'Anonymous', 'com': '<a href=""#p10471037"" class=""quotelink"">&gt;&gt;10471037</a><br><span class=""quote"">&gt;she&#039;s embarrassed because of the people watching</span><br>Anon, they&#039;re next.', 'time': 1670759031, 'resto': 10458793}]",1670759031
6,10466456,12/07/22(Wed)00:03:22,Anonymous,Purpose-made restraints and gear,"Armbinders, straitjackets, bitchsuits, hoods, and everything else that fits.",illust_103408609_20221206_225855,.png,2676,4093,163,250,1670389402670733,1670389402,qjjgmok4WDCunYlxBWEaLg==,4164478,0,0,0,purposemade-restraints-and-gear,27,26,22.0,21.0,"[{'no': 10468991, 'now': '12/09/22(Fri)12:52:14', 'name': 'Anonymous', 'com': '<a href=""#p10468990"" class=""quotelink"">&gt;&gt;10468990</a>', 'filename': '068', 'ext': '.jpg', 'w': 1120, 'h': 1600, 'tn_w': 87, 'tn_h': 125, 'tim': 1670608334021258, 'time': 1670608334, 'md5': 'KFhlHftXPPLcm19oHAh/EQ==', 'fsize': 636241, 'resto': 10466456}, {'no': 10468995, 'now': '12/09/22(Fri)12:56:24', 'name': 'Anonymous', 'com': '<a href=""#p10468991"" class=""quotelink"">&gt;&gt;10468991</a>', 'filename': '069', 'ext': '.jpg', 'w': 1120, 'h': 1600, 'tn_w': 87, 'tn_h': 125, 'tim': 1670608584265111, 'time': 1670608584, 'md5': 'u805jT7l7COXZvyM61+pXw==', 'fsize': 642511, 'resto': 10466456}, {'no': 10468996, 'now': '12/09/22(Fri)12:57:30', 'name': 'Anonymous', 'com': '<a href=""#p10468995"" class=""quotelink"">&gt;&gt;10468995</a>', 'filename': '058', 'ext': '.jpg', 'w': 1120, 'h': 1600, 'tn_w': 87, 'tn_h': 125, 'tim': 1670608650920724, 'time': 1670608650, 'md5': 'L8xEbiHjUlMfHl4Dr1cOsQ==', 'fsize': 612071, 'resto': 10466456}, {'no': 10470063, 'now': '12/10/22(Sat)12:20:22', 'name': 'Anonymous', 'filename': '1662619674046035', 'ext': '.jpg', 'w': 850, 'h': 1174, 'tn_w': 90, 'tn_h': 125, 'tim': 1670692822422294, 'time': 1670692822, 'md5': 'xnH8Dum7ISVu8ZYBQOtteQ==', 'fsize': 374410, 'resto': 10466456}, {'no': 10471058, 'now': '12/11/22(Sun)06:43:18', 'name': 'Anonymous', 'filename': '1639617597393 69411526_p0', 'ext': '.jpg', 'w': 1131, 'h': 1600, 'tn_w': 88, 'tn_h': 125, 'tim': 1670758998585730, 'time': 1670758998, 'md5': 'N9LTR0V94g8XM3Tz4hGYWQ==', 'fsize': 143052, 'resto': 10466456}]",1670758998
7,10469730,12/10/22(Sat)05:15:32,Anonymous,Giantess/Size,"Tinies work on weekends too edition<br><br>Previous : <br><a href=""/d/thread/10464815#p10464815"" class=""quotelink"">&gt;&gt;10464815</a>",1605375973381,.jpg,650,1096,148,250,1670667332103453,1670667332,/oVSM2/OFyMYFXDhREt0CQ==,443859,0,0,0,giantesssize,90,39,85.0,38.0,"[{'no': 10470990, 'now': '12/11/22(Sun)04:42:05', 'name': 'Anonymous', 'com': '<a href=""#p10470967"" class=""quotelink"">&gt;&gt;10470967</a><br>According to a scale calculator I found, 6.8 mph to 120 scale mph would be .0032 scale, assuming a 180cm human that would be about .578 cm tall or about 6 mm tall<br><br>But math and science are gay in this fetish, just gets in the way', 'time': 1670751725, 'resto': 10469730}, {'no': 10471041, 'now': '12/11/22(Sun)06:15:24', 'name': 'Anonymous', 'filename': '246239', 'ext': '.jpg', 'w': 1024, 'h': 748, 'tn_w': 125, 'tn_h': 91, 'tim': 1670757324195255, 'time': 1670757324, 'md5': 'yP52Y02EBc0eF7RcwfmeYg==', 'fsize': 168079, 'resto': 10469730}, {'no': 10471045, 'now': '12/11/22(Sun)06:21:52', 'name': 'Anonymous', 'com': '<a href=""#p10470919"" class=""quotelink"">&gt;&gt;10470919</a><br>there is an ending where she shrinks the city and steps on it but I can&#039;t find it. apparently you go into some military base? i think the a level card is the helicopter ending or the hand crush one.', 'time': 1670757712, 'resto': 10469730}, {'no': 10471047, 'now': '12/11/22(Sun)06:30:15', 'name': 'Anonymous', 'com': 'So I&#039;ve seen plenty of character.ai bots designed to play the giant girl role, but has anyone tried making a bot specifically to be tiny, and then roleplaying the giantess themselves? It seems like you could create a more complex roleplay if you play the character that naturally has more agency', 'time': 1670758215, 'resto': 10469730}, {'no': 10471055, 'now': '12/11/22(Sun)06:37:07', 'name': 'Anonymous', 'com': '<a href=""#p10471045"" class=""quotelink"">&gt;&gt;10471045</a><br>I miss that event too.<br>Something something deliver stuff but I don&#039;t know how.', 'time': 1670758627, 'resto': 10469730}]",1670758627
8,10433034,11/08/22(Tue)11:39:12,Anonymous,Recent Things,I have no idea where the other anon who did these threads went. Hoping to get the ball rolling with a couple of recents from pixiv.,102606642_p0,.jpg,2480,3508,176,250,1667925552385289,1667925552,iaKaQR9SYA5OVmjdzg63zg==,2653176,0,0,0,recent-things,172,156,167.0,151.0,"[{'no': 10469922, 'now': '12/10/22(Sat)09:20:54', 'name': 'Anonymous', 'filename': '103477123_p1', 'ext': '.jpg', 'w': 2000, 'h': 2250, 'tn_w': 111, 'tn_h': 125, 'tim': 1670682054284585, 'time': 1670682054, 'md5': '1D6zLQehR/8VeoSHVcYADA==', 'fsize': 4116014, 'resto': 10433034}, {'no': 10469931, 'now': '12/10/22(Sat)09:30:13', 'name': 'Anonymous', 'filename': 'cynthia', 'ext': '.jpg', 'w': 1000, 'h': 1000, 'tn_w': 125, 'tn_h': 125, 'tim': 1670682613809957, 'time': 1670682613, 'md5': 'G+eQQdpMwINO246rMrh9Xw==', 'fsize': 398157, 'resto': 10433034}, {'no': 10470601, 'now': '12/10/22(Sat)20:09:12', 'name': 'Anonymous', 'filename': 'FjixNppaEAcg6ti', 'ext': '.jpg', 'w': 1200, 'h': 1600, 'tn_w': 93, 'tn_h': 125, 'tim': 1670720952415843, 'time': 1670720952, 'md5': '3ficV67zNEql7DPKCbAZbg==', 'fsize': 194134, 'resto': 10433034}, {'no': 10470937, 'now': '12/11/22(Sun)03:04:33', 'name': 'Anonymous', 'filename': 'FjYgmN8akAA0Omy', 'ext': '.jpg', 'w': 1008, 'h': 1410, 'tn_w': 89, 'tn_h': 125, 'tim': 1670745873836914, 'time': 1670745873, 'md5': 'KsqC88Nmqv5HRVPWsMkXRA==', 'fsize': 1382605, 'resto': 10433034}, {'no': 10471054, 'now': '12/11/22(Sun)06:36:31', 'name': 'Anonymous', 'filename': 'FjsYdgsUcAEt_t2', 'ext': '.jpg', 'w': 1240, 'h': 1754, 'tn_w': 88, 'tn_h': 125, 'tim': 1670758591317639, 'time': 1670758591, 'md5': 'uMul8Jm8gYsLYqbroitvDg==', 'fsize': 266866, 'resto': 10433034}]",1670758591
9,10444472,11/18/22(Fri)03:07:13,Anonymous,Futa Is Always Bigger,"As long as the futa phallus is bigger than the dude&#039;s dick, any type of content is allowed.<br>Previous thread: <span class=""deadlink"">&gt;&gt;10405918</span>",1668035617912413,.jpg,1310,1920,170,250,1668758833394108,1668758833,j7KyMXlxS0CaOcuGo8xeXQ==,2189341,0,0,0,futa-is-always-bigger,220,89,215.0,88.0,"[{'no': 10471004, 'now': '12/11/22(Sun)05:10:49', 'name': 'Anonymous', 'com': '<a href=""#p10468642"" class=""quotelink"">&gt;&gt;10468642</a><br>https://pastebin.pl/view/5df90071<br>That&#039;s the entire synopsis to chapter 4 beat by beat, fully spoiled. I&#039;m not sure when I&#039;ll get to finish it because life&#039;s been fucky, so if you wanna know how it ends without my extremely beautiful heart rending soul crushing etc etc prose here you go.', 'time': 1670753449, 'resto': 10444472}, {'no': 10471022, 'now': '12/11/22(Sun)05:37:44', 'name': 'Anonymous', 'com': '<a href=""#p10471004"" class=""quotelink"">&gt;&gt;10471004</a><br>Honestly, I’m not really a fan of the whole “FBI conspiracy” angle. I think it detracts from the personal drama of the rest of the story, which IMO was what made it interesting in the first place.', 'time': 1670755064, 'resto': 10444472}, {'no': 10471024, 'now': '12/11/22(Sun)05:40:16', 'name': 'Anonymous', 'com': '<a href=""#p10471022"" class=""quotelink"">&gt;&gt;10471022</a><br>The story&#039;s still that. If you read the small preview you know that Kyle&#039;s angle is still the most important one, and the third person intermissions were supposed to be short, because they&#039;re not the point of the story. But, well, talking in conjectures about a story that&#039;s not yet written is useless, so I won&#039;t argue.', 'time': 1670755216, 'resto': 10444472}, {'no': 10471039, 'now': '12/11/22(Sun)06:14:58', 'name': 'Anonymous', 'com': '<a href=""#p10470153"" class=""quotelink"">&gt;&gt;10470153</a><br>I do really like the wholesome stuff, perhaps partly because it is relatively uncommon. I enjoy the in-story reversal when everything is close to vanilla romance with a cute feminine girl, but she has a big dick and wants to be the one doing the fucking.', 'filename': '11725519012', 'ext': '.png', 'w': 738, 'h': 2897, 'tn_w': 31, 'tn_h': 124, 'tim': 1670757298647057, 'time': 1670757298, 'md5': 'yElYHoNZ1VlGisOe7b/bsg==', 'fsize': 1236349, 'resto': 10444472}, {'no': 10471053, 'now': '12/11/22(Sun)06:35:21', 'name': 'Anonymous', 'com': '<a href=""#p10471004"" class=""quotelink"">&gt;&gt;10471004</a><br>i was really expecting gabby to be pregnant with Stacy&#039;s child, and the sudden sex craze gabby had was just trying to make sure she had Kyle&#039;s baby instead. and the big reveal would be 9 months later when their baby was born a futa.<br>part of what made the story so hot was the world domination where it became completely out of control and the future was fucked, so I&#039;m really disappointed that aspect gets nipped in the bud', 'time': 1670758521, 'resto': 10444472}]",1670758521
