,no,now,name,sub,com,filename,ext,w,h,tn_w,tn_h,tim,time,md5,fsize,resto,bumplimit,imagelimit,semantic_url,replies,images,omitted_posts,omitted_images,last_replies,last_modified
99,10411417,10/21/22(Fri)06:52:23,Anonymous,Ambush Thread,"You should know what it is by now<br>Previous thread: <span class=""deadlink"">&gt;&gt;10374545</span>",ba46ab59-1cc2-4e5d-972b-62d250246b72,.png,1300,2000,162,250,1666349543276690,1666349543,SIwfxznepAJXeFvOi8YBVg==,1617469,0,0,0,ambush-thread,274,226,269.0,224.0,"[{'no': 10469867, 'now': '12/10/22(Sat)08:04:06', 'name': 'Anonymous', 'com': 'bruh my n words and i were having a convo about what we find hot and i was trying to explain to them what an ambush was and they started clowning me and calling me gay<br>and i seen some dudes at my gym that look like these guys<br>so question<br>are we really lbgt', 'time': 1670677446, 'resto': 10411417}, {'no': 10469981, 'now': '12/10/22(Sat)10:52:52', 'name': 'Anonymous', 'com': '<a href=""#p10469867"" class=""quotelink"">&gt;&gt;10469867</a><br>I&#039;d say it depends on if you were sexually attracted to the men who looked like ambushes in your gym, because if you were, it would at least make you bisexual.<br>Also, why the fuck would you reveal your kinks to your friends, are you stupid?', 'time': 1670687572, 'resto': 10411417}, {'no': 10469993, 'now': '12/10/22(Sat)11:04:54', 'name': 'Anonymous', 'com': '<a href=""#p10469867"" class=""quotelink"">&gt;&gt;10469867</a><br>No. Because if I see this irl, I gag.<br><br>Now does anyone have sauce or name for <a href=""#p10411423"" class=""quotelink"">&gt;&gt;10411423</a>?', 'time': 1670688294, 'resto': 10411417}, {'no': 10470363, 'now': '12/10/22(Sat)16:41:48', 'name': 'Anonymous', 'filename': 'selfsucc', 'ext': '.jpg', 'w': 800, 'h': 1200, 'tn_w': 83, 'tn_h': 125, 'tim': 1670708508303235, 'time': 1670708508, 'md5': '7tC6U0b6vmktiEW4xslwfg==', 'fsize': 112236, 'resto': 10411417}, {'no': 10470728, 'now': '12/10/22(Sat)22:21:46', 'name': 'Anonymous', 'filename': '765', 'ext': '.jpg', 'w': 1006, 'h': 1200, 'tn_w': 104, 'tn_h': 125, 'tim': 1670728906964508, 'time': 1670728906, 'md5': 'iIArQEw7Mn+DGPGVLdObCw==', 'fsize': 110853, 'resto': 10411417}]",1670728906
100,10450818,11/23/22(Wed)18:04:57,Anonymous,Vacuum Blowjob/Hyottoko Face Thread :&gt;===,"Previous Thread: <span class=""deadlink"">&gt;&gt;10410521</span><br>post girls sucking with this dumb fucking face :&gt;==",102963878_p0,.jpg,1556,1000,250,160,1669244697162282,1669244697,2vqVGZRFgZsVfIzgjaH6DA==,1397974,0,0,0,vacuum-blowjobhyottoko-face-thread,148,142,143.0,138.0,"[{'no': 10469025, 'now': '12/09/22(Fri)13:38:42', 'name': 'Anonymous', 'filename': '__shimakaze_kantai_collection_drawn_by_kanikama__c1b3ada1bd3dcbd46192a85501ebce6b', 'ext': '.png', 'w': 750, 'h': 484, 'tn_w': 125, 'tn_h': 80, 'tim': 1670611122629655, 'time': 1670611122, 'md5': 'wbOtob09y9RhkqhVAevOaw==', 'fsize': 371811, 'resto': 10450818}, {'no': 10469416, 'now': '12/09/22(Fri)22:07:46', 'name': 'Anonymous', 'filename': '98802050_p0', 'ext': '.jpg', 'w': 2391, 'h': 3050, 'tn_w': 97, 'tn_h': 124, 'tim': 1670641666110574, 'time': 1670641666, 'md5': '6QkkgpW3bYuAU0paFeuLRA==', 'fsize': 2501257, 'resto': 10450818}, {'no': 10470174, 'now': '12/10/22(Sat)13:52:28', 'name': 'Anonymous', 'com': 'is sad to think that the previous thread, had more support than this', 'filename': '__kaname_madoka_mahou_shoujo_madoka_magica_drawn_by_kanikama__cdf493f6b5d23e8cfe24a73de9dc2e291', 'ext': '.png', 'w': 436, 'h': 900, 'tn_w': 60, 'tn_h': 125, 'tim': 1670698348537350, 'time': 1670698348, 'md5': 'ikLxx2eDJSJCk4kRfeQkTw==', 'fsize': 428427, 'resto': 10450818}, {'no': 10470186, 'now': '12/10/22(Sat)14:06:34', 'name': 'Anonymous', 'com': '<a href=""#p10458211"" class=""quotelink"">&gt;&gt;10458211</a><br><br><span class=""quote"">&gt;these days, many women choose to become new fellatians</span><br><br>god, can you imagine', 'filename': '100958106_p0', 'ext': '.jpg', 'w': 1849, 'h': 1440, 'tn_w': 124, 'tn_h': 97, 'tim': 1670699194504721, 'time': 1670699194, 'md5': 'IvbFgJbABjRL7OF84nbZYg==', 'fsize': 1882078, 'resto': 10450818}, {'no': 10470709, 'now': '12/10/22(Sat)21:43:31', 'name': 'Anonymous', 'com': '<a href=""#p10470186"" class=""quotelink"">&gt;&gt;10470186</a><br>These just look like pacifiers<br>Good idea ruined by going too long in the mouth, but it&#039;s Fellatrix so I didn&#039;t expect it to be anything but shit', 'time': 1670726611, 'resto': 10450818}]",1670726611
101,10461866,12/03/22(Sat)00:45:00,Anonymous,Wholesome Disability Hentai,"Hentai involving people with disabilities. No rape, no guro.",58f909f5a1668f3fc98ecdcaf35d8a34,.jpg,2459,3492,176,249,1670046300759276,1670046300,v+nlOYtwjVJxpgT5usxzNg==,2403995,0,0,0,wholesome-disability-hentai,45,26,40.0,22.0,"[{'no': 10469124, 'now': '12/09/22(Fri)15:47:04', 'name': 'Anonymous', 'filename': 'FjhjR2cWQAAdyzM', 'ext': '.jpg', 'w': 2400, 'h': 1400, 'tn_w': 125, 'tn_h': 72, 'tim': 1670618824921191, 'time': 1670618824, 'md5': '7Xdq7phISVwxxxszFjPm3A==', 'fsize': 903441, 'resto': 10461866}, {'no': 10469125, 'now': '12/09/22(Fri)15:47:38', 'name': 'Anonymous', 'filename': 'wheelchair', 'ext': '.jpg', 'w': 1000, 'h': 1000, 'tn_w': 125, 'tn_h': 125, 'tim': 1670618858067549, 'time': 1670618858, 'md5': 'XhXBoBJHtYUHj6B+fUeAeQ==', 'fsize': 282286, 'resto': 10461866}, {'no': 10469375, 'now': '12/09/22(Fri)21:17:09', 'name': 'Anonymous', 'com': '<a href=""#p10469124"" class=""quotelink"">&gt;&gt;10469124</a><br>I don&#039;t like this one. :(', 'time': 1670638629, 'resto': 10461866}, {'no': 10470168, 'now': '12/10/22(Sat)13:45:03', 'name': 'Anonymous', 'filename': '101489991_p0', 'ext': '.jpg', 'w': 2568, 'h': 1808, 'tn_w': 125, 'tn_h': 88, 'tim': 1670697903524327, 'time': 1670697903, 'md5': 'kDTPjz6Uve9R7iy/hJA8HA==', 'fsize': 586788, 'resto': 10461866}, {'no': 10470690, 'now': '12/10/22(Sat)21:17:46', 'name': 'Anonymous', 'filename': '80B72580-9B06-4A2A-99BC-99624AEEF696', 'ext': '.png', 'w': 1000, 'h': 1414, 'tn_w': 88, 'tn_h': 125, 'tim': 1670725066455632, 'time': 1670725066, 'md5': 'W+eJzwrIzPPUkzZasvD/Kw==', 'fsize': 450020, 'resto': 10461866}]",1670725066
102,10442033,11/16/22(Wed)00:32:02,Anonymous,Big Butt Thread,"This thread is for the biggest butts, though thicc thighs and wide hips are welcome too, and ass expansion is greatly welcomed.<br><br>No male, futa, gas, or scat, please.",FhkuAx2UUAAzlAj,.jpg,2148,3000,179,250,1668576722162862,1668576722,0p5F+FzApWzbEFIZ6lakhQ==,527071,0,1,0,big-butt-thread,301,198,296.0,196.0,"[{'no': 10470575, 'now': '12/10/22(Sat)19:44:49', 'name': 'Anonymous', 'filename': 'FPP1qjJXwBsUgqm', 'ext': '.jpg', 'w': 2635, 'h': 2635, 'tn_w': 125, 'tn_h': 125, 'tim': 1670719489332247, 'time': 1670719489, 'md5': 'AcqfOsbk43ccWwWyk6iOHA==', 'fsize': 724657, 'resto': 10442033}, {'no': 10470687, 'now': '12/10/22(Sat)21:16:21', 'name': 'Anonymous', 'filename': 'Fjp1JLVUoAE7BM3', 'ext': '.jpg', 'w': 964, 'h': 1400, 'tn_w': 86, 'tn_h': 125, 'tim': 1670724981757902, 'time': 1670724981, 'md5': 'Ury9cOyrXm+q90ZxAHh/Ng==', 'fsize': 159463, 'resto': 10442033}, {'no': 10470846, 'now': '12/11/22(Sun)00:59:29', 'name': 'Anonymous', 'com': 'Give us the Bombshell Barista.', 'time': 1670738369, 'resto': 10442033}, {'no': 10470852, 'now': '12/11/22(Sun)01:04:40', 'name': 'Anonymous', 'com': 'Bruh it&#039;s been out for like 2 hours...', 'time': 1670738680, 'resto': 10442033}, {'no': 10470881, 'now': '12/11/22(Sun)01:27:09', 'name': 'Anonymous', 'com': 'New thread:<br><a href=""/d/thread/10470871#p10470871"" class=""quotelink"">&gt;&gt;10470871</a>', 'time': 1670740029, 'resto': 10442033}]",1670740029
103,10458517,11/30/22(Wed)03:33:58,Anonymous,Deaf or Blind,"Hey anons, long time lurker here, just wanted to feed my new kink but didn&#039;t really know where to find stuff like this. Please post any deaf or blind related thing here, I&#039;m curious to see what the internet has for me. If there have been threads on this in the past please feel free to notify me and I&#039;ll link it somewhere for others just like me.",91687793727f7ee1b9ac2fb4473179ad,.jpg,850,1138,186,250,1669797238521771,1669797238,goaclRsxv5CL9hBf2J7e5A==,189758,0,0,0,deaf-or-blind,69,46,64.0,42.0,"[{'no': 10467773, 'now': '12/08/22(Thu)09:32:25', 'name': 'Anonymous', 'filename': 'a4ba86b27ae606c533e24526dd8d61e9855cf289', 'ext': '.png', 'w': 1306, 'h': 1600, 'tn_w': 102, 'tn_h': 125, 'tim': 1670509945310111, 'time': 1670509945, 'md5': 'NYkW71W7v5tgQSwOpLqzeA==', 'fsize': 1248049, 'resto': 10458517}, {'no': 10468774, 'now': '12/09/22(Fri)07:20:23', 'name': 'Anonymous', 'com': 'One-eyed girl with a prosthetic eye wearing an eyepatch over her good eye. Does this exist, real or hentai? Something I&#039;ve thought about occasionally', 'time': 1670588423, 'resto': 10458517}, {'no': 10468778, 'now': '12/09/22(Fri)07:32:09', 'name': 'Anonymous', 'com': '<a href=""#p10468774"" class=""quotelink"">&gt;&gt;10468774</a><br>Thought of this when I read your post. I cant recall seeing any other examples though.', 'filename': 'blind_lizard_by_hielga_dco1zqz', 'ext': '.jpg', 'w': 903, 'h': 1000, 'tn_w': 112, 'tn_h': 125, 'tim': 1670589129009223, 'time': 1670589129, 'md5': 'euATgbwPhHgmVPCsOYM7EA==', 'fsize': 587655, 'resto': 10458517}, {'no': 10469786, 'now': '12/10/22(Sat)06:22:14', 'name': 'Anonymous', 'filename': 'bec94e6959c5f59a721ebcccde350198', 'ext': '.jpg', 'w': 470, 'h': 755, 'tn_w': 77, 'tn_h': 125, 'tim': 1670671334224626, 'time': 1670671334, 'md5': 'H9bH/lCP0QCUl4iog9G2Bg==', 'fsize': 60044, 'resto': 10458517}, {'no': 10470685, 'now': '12/10/22(Sat)21:15:22', 'name': 'Anonymous', 'filename': 'D463DBE4-8558-4F12-84A4-62B03184DD44', 'ext': '.png', 'w': 2000, 'h': 2000, 'tn_w': 125, 'tn_h': 125, 'tim': 1670724922939906, 'time': 1670724922, 'md5': 'qZwX9KyPSm1J4qF52LbahQ==', 'fsize': 2579115, 'resto': 10458517}]",1670724922
104,10465089,12/05/22(Mon)20:10:09,Anonymous,Possession,"Girls having their bodies taken over by all sorts of entities<br><br>Previous Thread: <a href=""/d/thread/10439553#p10439553"" class=""quotelink"">&gt;&gt;10439553</a>",1,.jpg,1254,1771,177,250,1670289009061110,1670289009,tCQ3VozEjv8sFSt8f4u0Gw==,1631542,0,0,0,possession,61,33,56.0,33.0,"[{'no': 10470490, 'now': '12/10/22(Sat)18:22:07', 'name': 'Anonymous', 'com': '<a href=""#p10469896"" class=""quotelink"">&gt;&gt;10469896</a><br>Done by completing any girls quests fully up until the last and then choosing to stay home instead of doing their ending', 'time': 1670714527, 'resto': 10465089}, {'no': 10470496, 'now': '12/10/22(Sat)18:25:00', 'name': 'Anonymous', 'com': '<a href=""#p10470457"" class=""quotelink"">&gt;&gt;10470457</a><br>Well, looks like you got it to work. <br>That said, I am the same anon that attempted to see if it can be translated, so I am not surprised I got yours to work I guess.<br><br>What I am surprised about is that apparently it reads the image from the cg directory before it does from the pak file. That is interesting to know I guess.<br><br>but looking at your translation makes me wonder<br>nante ittara, bocchi ni natta. <br>is that slang?<br>I thought it was something like &quot;What am I saying. I&#039;ve diffidently become lonely.&quot;<br>your translation says that he&#039;ll be rejected by society if he says that.<br>like, the whole way i understood the line is different basically. If your intepretation is correct, is that line slang or something?', 'time': 1670714700, 'resto': 10465089}, {'no': 10470513, 'now': '12/10/22(Sat)18:42:43', 'name': 'Anonymous', 'com': '<a href=""#p10470496"" class=""quotelink"">&gt;&gt;10470496</a><br><span class=""quote"">&gt;What I am surprised about is that apparently it reads the image from the cg directory before it does from the pak file. That is interesting to know I guess.</span><br>Surprised me too. Spent so long trying to mess with the pak files, but I found a forum post saying just put them straight into the CG folder.<br><br><span class=""quote"">&gt;but looking at your translation makes me wonder</span><br>なんて言ったら、ボッチになった。I don&#039;t claim to be an expert, but here the use of &quot;nante&quot; and &quot;ttara&quot; means &quot;if I&quot;. You&#039;re right with &quot;bocchi&quot; which comes from &quot;hitoribocchi&quot; meaning alone/loneliness, but translating that to &quot;If I said that, I would be lonely.&quot; doesn&#039;t really convey the original meaning of being alone because you&#039;ve been alienated for having a possession/body swap fetish.<br><br>In a way, it&#039;s localization. A lot of things in Japanese make sense in Japanese, but a straight translation to English means you lose context.', 'time': 1670715763, 'resto': 10465089}, {'no': 10470563, 'now': '12/10/22(Sat)19:32:30', 'name': 'Anonymous', 'com': '<a href=""#p10470513"" class=""quotelink"">&gt;&gt;10470513</a><br>Thanks for explaining. Sorry about the question which I know is a bit misplaced on the thread. Its just... like I said, I stared for a few hours at lines to see if it could conceptually be done (translating this game i mean) and wanted what I did bring out to be correct, so I was a bit surprised. I honestly thought it was correct and such.<br>I guess I missed that.<br>anyway yeah I realized japanese is... quite difficult and its pretty easy to forget stuff I just read, especially those forms and particles and also easy to assume I remembered stuff correctly. Oh well.', 'time': 1670718750, 'resto': 10465089}, {'no': 10470676, 'now': '12/10/22(Sat)21:11:09', 'name': 'Anonymous', 'com': '<a href=""#p10469769"" class=""quotelink"">&gt;&gt;10469769</a><br>Just a heads up if anyone cares about about technicalities, this is technically a body swap, not a possession. The in-universe explanation is that you swap with your target and your old body gets tranquilized and sleeps for the whole swap. But really, the swap is never relevant and it functions essentially like a possession. However, this explains the ending where the person in your old body wakes up', 'time': 1670724669, 'resto': 10465089}]",1670724669
105,10400353,10/13/22(Thu)14:23:02,Anonymous,Headless/detachment thread (lost count at this point),-No cheap edits<br>-No furry<br>-No gore<br>-No shilling your Discord/Gumroad/Whatever,FbdWiRSXoAEKiY7,.jpg,2048,2650,193,250,1665685382906830,1665685382,TSgtJkW2yvrjmQYHiCQwJg==,340621,0,0,0,headlessdetachment-thread-lost-count-at-this,115,75,110.0,71.0,"[{'no': 10467331, 'now': '12/07/22(Wed)21:12:57', 'name': 'Anonymous', 'filename': 'rottytops__ghost____shantae_by_gaixas1_dffi63c', 'ext': '.jpg', 'w': 2208, 'h': 3864, 'tn_w': 71, 'tn_h': 125, 'tim': 1670465577275309, 'time': 1670465577, 'md5': '4XMUQSD8iXRplfEL3KOfFg==', 'fsize': 3102391, 'resto': 10400353}, {'no': 10467563, 'now': '12/08/22(Thu)04:04:36', 'name': 'Anonymous', 'filename': '2ED0730F-010E-447B-935C-3EB9679A8D4D', 'ext': '.jpg', 'w': 2048, 'h': 1460, 'tn_w': 125, 'tn_h': 89, 'tim': 1670490276037233, 'time': 1670490276, 'md5': 'Cwua8bnQXKKGTanovTey/Q==', 'fsize': 635488, 'resto': 10400353}, {'no': 10468301, 'now': '12/08/22(Thu)20:38:13', 'name': 'Anonymous', 'filename': 'FZ45SH1agAAs3y2', 'ext': '.jpg', 'w': 1920, 'h': 4096, 'tn_w': 58, 'tn_h': 125, 'tim': 1670549893503421, 'time': 1670549893, 'md5': '+SDhU9aRen4O451bNnVT3A==', 'fsize': 368850, 'resto': 10400353}, {'no': 10469789, 'now': '12/10/22(Sat)06:25:23', 'name': 'Anonymous', 'com': '<a href=""#p10464040"" class=""quotelink"">&gt;&gt;10464040</a><br>Definitely an ass-to-mouth kinda girl', 'time': 1670671523, 'resto': 10400353}, {'no': 10470638, 'now': '12/10/22(Sat)20:42:04', 'name': 'Anonymous', 'filename': 'FdwkIAvaEAAj7ZF', 'ext': '.jpg', 'w': 1250, 'h': 1250, 'tn_w': 125, 'tn_h': 125, 'tim': 1670722924948205, 'time': 1670722924, 'md5': '/NcsLirZ9+3VaVPR/oVNnw==', 'fsize': 163032, 'resto': 10400353}]",1670722924
106,10437530,11/12/22(Sat)10:26:27,Anonymous,Quicksand and sticky restrained,,IMG_3401,.jpg,590,816,180,250,1668266787277313,1668266787,Y+D6bqy3YTArQXjZymglUw==,209171,0,0,0,quicksand-and-sticky-restrained,82,69,77.0,65.0,"[{'no': 10468166, 'now': '12/08/22(Thu)18:07:00', 'name': 'Anonymous', 'com': '<a href=""#p10468165"" class=""quotelink"">&gt;&gt;10468165</a>', 'time': 1670540820, 'resto': 10437530}, {'no': 10468169, 'now': '12/08/22(Thu)18:09:08', 'name': 'Anonymous', 'com': '<a href=""#p10468165"" class=""quotelink"">&gt;&gt;10468165</a><br><a href=""#p10468166"" class=""quotelink"">&gt;&gt;10468166</a><br>Shameful display by myself, should have checked I had the image chosen', 'filename': 'riD6IR823huwlNBmwC6SjTGF', 'ext': '.png', 'w': 800, 'h': 562, 'tn_w': 125, 'tn_h': 87, 'tim': 1670540948665844, 'time': 1670540948, 'md5': 'FKy+p2mlxKk8cRmOyX1VUg==', 'fsize': 177919, 'resto': 10437530}, {'no': 10468641, 'now': '12/09/22(Fri)03:12:15', 'name': 'Anonymous', 'com': 'not sure if this one counts', 'filename': 'earthbind_by_artofkamina_dcnwwry-pre', 'ext': '.jpg', 'w': 864, 'h': 925, 'tn_w': 116, 'tn_h': 125, 'tim': 1670573535539791, 'time': 1670573535, 'md5': '7NAu3EEuGh0olc5LLcq+Ew==', 'fsize': 189601, 'resto': 10437530}, {'no': 10469801, 'now': '12/10/22(Sat)06:32:41', 'name': 'Anonymous', 'filename': '35TsowbIDGI', 'ext': '.jpg', 'w': 1056, 'h': 976, 'tn_w': 125, 'tn_h': 115, 'tim': 1670671961995550, 'time': 1670671961, 'md5': 'Jg6Aiy4p7HGEN+XOlHs78A==', 'fsize': 80476, 'resto': 10437530}, {'no': 10470635, 'now': '12/10/22(Sat)20:39:04', 'name': 'Anonymous', 'filename': '42255829_p1_master1200-1', 'ext': '.jpg', 'w': 600, 'h': 421, 'tn_w': 125, 'tn_h': 87, 'tim': 1670722744003509, 'time': 1670722744, 'md5': 'BNEihRV0Up7vIpSmyT8dDA==', 'fsize': 117955, 'resto': 10437530}]",1670732928
107,10465701,12/06/22(Tue)11:08:14,Anonymous,Detached Bodyparts,No gore if it&#039;s possible,self_assembly_by_hologears_ddwiqpt,.jpg,4000,2000,250,125,1670342894401018,1670342894,DMmqng4tJU4vFmTV6QRrtw==,838507,0,0,0,detached-bodyparts,25,21,20.0,17.0,"[{'no': 10469986, 'now': '12/10/22(Sat)10:57:27', 'name': 'Anonymous', 'filename': '1503355780330', 'ext': '.jpg', 'w': 847, 'h': 1200, 'tn_w': 88, 'tn_h': 125, 'tim': 1670687847151523, 'time': 1670687847, 'md5': '4MFjZ7hHIiDWEofmEwCgjg==', 'fsize': 383707, 'resto': 10465701}, {'no': 10469989, 'now': '12/10/22(Sat)10:59:43', 'name': 'Anonymous', 'filename': '1517051011733', 'ext': '.png', 'w': 740, 'h': 810, 'tn_w': 114, 'tn_h': 125, 'tim': 1670687983986014, 'time': 1670687983, 'md5': '5bVhzRpmYTSLMxxl8diPOg==', 'fsize': 342763, 'resto': 10465701}, {'no': 10470009, 'now': '12/10/22(Sat)11:22:37', 'name': 'Anonymous', 'filename': 'launna_s_parts_by_franktonius_dbbpeku', 'ext': '.png', 'w': 1000, 'h': 1000, 'tn_w': 125, 'tn_h': 125, 'tim': 1670689357713067, 'time': 1670689357, 'md5': 'cUWesrIJzebx2P5KrN4TuQ==', 'fsize': 568729, 'resto': 10465701}, {'no': 10470605, 'now': '12/10/22(Sat)20:13:29', 'name': 'Anonymous', 'filename': 'super_magic_show_by_taoyundao_ddln0ru', 'ext': '.png', 'w': 582, 'h': 463, 'tn_w': 124, 'tn_h': 99, 'tim': 1670721209786136, 'time': 1670721209, 'md5': 'qpep9NZmh8rAobGfH8Jm+A==', 'fsize': 311004, 'resto': 10465701}, {'no': 10470634, 'now': '12/10/22(Sat)20:38:24', 'name': 'Anonymous', 'com': '<a href=""#p10468871"" class=""quotelink"">&gt;&gt;10468871</a><br><span class=""quote"">&gt;Nice</span><br>There is a lack of self tasting in this thread.', 'time': 1670722704, 'resto': 10465701}]",1670722704
108,10446537,11/19/22(Sat)23:30:14,Anonymous,Big Sub/Small Dom(s),"Anything where a woman is being dominated by someone significantly smaller than herself. Giantesses dominated by normal folk and normal sized women dominated by small folk are both welcome. For bound giantesses, it&#039;s okay if her small captors are barely shown or only implied.",79671569_p0,.jpg,2560,1810,250,176,1668918614515953,1668918614,dNA5nfcF03qTkX5Nc8nr+g==,317009,0,0,0,big-subsmall-doms,91,78,86.0,75.0,"[{'no': 10469415, 'now': '12/09/22(Fri)22:06:23', 'name': 'Anonymous', 'com': '<a href=""#p10468308"" class=""quotelink"">&gt;&gt;10468308</a><br>I think it&#039;s more a difference of viewpoint between fetishists and non-fetishists.<br><br>For me size is more an appearance rather than a dynamics, the fundamental trait of hugeness is awe, not authority. And I feel like most non fetishist works have the same conception as they usually magnify size more to give importance rather than power to a character or an entity. It&#039;s something more symbolic than practical, like big mountains exist to be overcome.<br><br>Meanwhile most sizefags mostly use giantess as an embodiment of their fetish, which in most case is power and domination. Dom giantess are so popular because size is a very visual and instinctive mean to represents domination hierarchy.', 'filename': '60897270_p0', 'ext': '.jpg', 'w': 2000, 'h': 1571, 'tn_w': 125, 'tn_h': 98, 'tim': 1670641583272551, 'time': 1670641583, 'md5': 'UymHe9wgfY/emkJG4dyziQ==', 'fsize': 1929445, 'resto': 10446537}, {'no': 10469420, 'now': '12/09/22(Fri)22:12:58', 'name': 'Anonymous', 'com': '<a href=""#p10446537"" class=""quotelink"">&gt;&gt;10446537</a><br>This goes against everything the giantess fetish stands for and this is obviously some incel shitposting. Fuck you, OP.', 'time': 1670641978, 'resto': 10446537}, {'no': 10469550, 'now': '12/10/22(Sat)01:03:31', 'name': 'Anonymous', 'com': '<a href=""#p10469415"" class=""quotelink"">&gt;&gt;10469415</a><br><span class=""quote"">&gt;Meanwhile most sizefags mostly use giantess as an embodiment of their fetish, which in most case is power and domination.</span><br>Size-fetish is an umbrella for all sorts of different fetishes types. Fetishes vary between regions where I notice in the West, there&#039;s a lot of fiction on Giantessworld involving not only biological aunts and mothers in size-fetish play, but also grandmas. Over the last 20 years of reading stories on G-fork and GS-Uploader, there&#039;s more variety in the types of Giantess depicted in their fiction albeit thankfully next to nothing in the way of grandmas. The dom giantess thing mainly applies to the West, and I doubt they picked their dom giantess fetish due to any logical or cognisant reason. Rather it&#039;s the kind of media or environment they grew up in that led to them being that way.<br><br>Hyper breast fetishism has heavy ties to size-fetish, and most of the people I know into that like Agata Akira, Moralgear and Straight555 don&#039;t focus on the big girl exerting power and dominance. A main stream mangaka with a breast and size fetish is Kabao, who did a Queen&#039;s Blade manga adaptation where the slime girl (Melona?) grows big. In anime, there&#039;s the guy who did the animation for certain characters in the Valkyrie Drive anime (he had the staff add an episode for the giant girl Minimi Nimi cause of his giant breast fetish; another of his characters was Lady J). In games, there&#039;s the developer for Millennium War Aigis, Shiropro:RE, and Monster Musume TD (the latter two games include the developer&#039;s fetish for giant girls with the third having H-scenes with submissive giant girls).', 'filename': 'FLFk4VqacAM4-BF', 'ext': '.jpg', 'w': 4093, 'h': 2894, 'tn_w': 125, 'tn_h': 88, 'tim': 1670652211372912, 'time': 1670652211, 'md5': 'j8K6b1tRy7lcSMBYlf6lZg==', 'fsize': 1740302, 'resto': 10446537}, {'no': 10470594, 'now': '12/10/22(Sat)19:57:24', 'name': 'Anonymous', 'filename': 'his_her_world_by_sihagen_df73a6z-fullview', 'ext': '.jpg', 'w': 1280, 'h': 768, 'tn_w': 125, 'tn_h': 75, 'tim': 1670720244611724, 'time': 1670720244, 'md5': 'DY6IwCr3s6OKQA2T4uB18Q==', 'fsize': 95656, 'resto': 10446537}, {'no': 10470632, 'now': '12/10/22(Sat)20:37:08', 'name': 'Anonymous', 'com': '<a href=""#p10469420"" class=""quotelink"">&gt;&gt;10469420</a><br><span class=""quote"">&gt;What I like is the only valid version of my fetish</span><br><span class=""quote"">&gt;I can&#039;t conceive of anyone honestly enjoying any other version of it</span><br><span class=""quote"">&gt;Therefor anyone who claims to like anything else must be shitposting</span><br><span class=""quote"">&gt;Putting it in a separate clearly titled thread that I could easily hide and never look at again is just part of their insidious plot to troll me</span>', 'time': 1670722628, 'resto': 10446537}]",1670722628
