,no,now,name,com,filename,ext,w,h,tn_w,tn_h,tim,time,md5,fsize,resto,bumplimit,imagelimit,semantic_url,replies,images,last_modified,sub,last_replies,omitted_posts,omitted_images,trip
77,28682836,12/08/22(Thu)23:44:07,Anonymous,"this bullshit has gotten so many trans ppl (trans girls especially) kept in the closet for way longer than necessary, sometimes even forever. At this point in queer spaces its normalized for &quot;gnc&quot; &quot;crossdressers&quot; &quot;femboys&quot; or whatever new term they make up, to constantly say shit indicative of transness and we&#039;re expected to not point it out. I swear everytime I open coper subreddits like r/feminineboys i see people saying the same shit like&quot;idk why but i feel so happy wearing feminine clothes&quot; &quot;im a man but i really want to look like a girl&quot; &quot;im cis but i like it when people mistake me for a woman&quot; and when the few reasonable minds point out in the comments that this shit is a sign they&#039;re trans, they get downvoted. Even them say it too kindly and indirectly in my opinion, if we want to combat these peoples internalized transphobia it needs to be very bluntly stated towards them that they are trans girls that just haven&#039;t realized it yet.",c8827,.png,778,280,250,89,1670561047928216,1670561047,vwhXf1UDwMCYKMyJC02cJg==,33331,0,0,0,i-hate-the-egg-prime-directive-so-much,50,1,1670668050,I hate the &quot;egg prime directive&quot; so much,"[{'no': 28696707, 'now': '12/10/22(Sat)02:52:20', 'name': 'Anonymous', 'com': '<a href=""#p28690933"" class=""quotelink"">&gt;&gt;28690933</a><br>Fringe political options aren’t an issue if they don’t cause people to gather en mass and anti corporate isn’t an issue if people keep buying', 'time': 1670658740, 'resto': 28682836}, {'no': 28697755, 'now': '12/10/22(Sat)05:11:43', 'name': 'Anonymous', 'com': '<a href=""#p28685852"" class=""quotelink"">&gt;&gt;28685852</a><br>it&#039;s from Star Trek ok', 'time': 1670667103, 'resto': 28682836}, {'no': 28697780, 'now': '12/10/22(Sat)05:17:18', 'name': 'Anonymous', 'com': '<a href=""#p28690712"" class=""quotelink"">&gt;&gt;28690712</a><br>still not over her?', 'time': 1670667438, 'resto': 28682836}, {'no': 28697785, 'now': '12/10/22(Sat)05:18:42', 'name': 'Anonymous', 'com': '<a href=""#p28694686"" class=""quotelink"">&gt;&gt;28694686</a><br>you&#039;re trans', 'time': 1670667522, 'resto': 28682836}, {'no': 28697818, 'now': '12/10/22(Sat)05:27:30', 'name': 'Anonymous', 'com': '<a href=""#p28695470"" class=""quotelink"">&gt;&gt;28695470</a><br>and yet there are more ftms than mtfs<br>not arguing just interesting', 'time': 1670668050, 'resto': 28682836}]",45.0,1.0,
78,28632804,12/05/22(Mon)12:43:28,Anonymous,"&quot;Consider the cattle, grazing as they pass you by: they do not know what is meant by yesterday or today, they leap about, eat, rest, digest, leap about again, and so from morn till night and from day to day, fettered to the moment and its pleasure or displeasure, and thus neither melancholy nor bored. This is a hard sight for man to see; for, though he thinks himself better than the animals because he is human, he cannot help envying them their happiness – what they have, a life neither bored nor painful, is precisely what he wants, yet he cannot have it because he refuses to be like an animal...&quot;<br>-Friedrich Nietzsche",69b5b5702b0983f374c35e07b20e6a4852a4931f_hq,.jpg,388,604,160,250,1670262208846610,1670262208,vof+3AUAncuTEECMtK1xdA==,43028,0,0,0,cowmoder-moo-monday,182,23,1670667521,Cowmoder Moo Monday,"[{'no': 28695564, 'now': '12/10/22(Sat)00:29:28', 'name': 'Anonymous', 'com': '<a href=""#p28695295"" class=""quotelink"">&gt;&gt;28695295</a><br>Okay. I don&#039;t. In lack of evidence it just seems like you&#039;re jealous of their artistic talent.', 'time': 1670650168, 'resto': 28632804}, {'no': 28697384, 'now': '12/10/22(Sat)04:14:28', 'name': 'Anonymous', 'com': '<a href=""#p28670934"" class=""quotelink"">&gt;&gt;28670934</a><br>Have any more of these?', 'time': 1670663668, 'resto': 28632804}, {'no': 28697475, 'now': '12/10/22(Sat)04:26:17', 'name': 'Anonymous', 'com': '<a href=""#p28697384"" class=""quotelink"">&gt;&gt;28697384</a><br>sure<br>here&#039;s the same person<br>proper trans cowmoder this one<br>Twitter really can be a goldmine', 'filename': 'media_FhN7T5lWQAUS60s', 'ext': '.jpg', 'w': 1536, 'h': 2048, 'tn_w': 93, 'tn_h': 125, 'tim': 1670664377818169, 'time': 1670664377, 'md5': 'KzpaPhEYYRYD+JSVZZWvrA==', 'fsize': 382100, 'resto': 28632804}, {'no': 28697542, 'now': '12/10/22(Sat)04:36:45', 'name': 'Anonymous', 'com': 'need cowmodder gf so badly', 'time': 1670665005, 'resto': 28632804}, {'no': 28697783, 'now': '12/10/22(Sat)05:18:41', 'name': 'Anonymous', 'com': '<a href=""#p28695086"" class=""quotelink"">&gt;&gt;28695086</a><br>hrt regime, just wanna know how you got so much progress in such a short time, injections?', 'time': 1670667521, 'resto': 28632804}]",177.0,22.0,
79,28697308,12/10/22(Sat)04:01:56,Anonymous,What plugin do other trannys use to make their amen breaks?,771E5C23-31A4-4537-9C68-664386DAFA43,.jpg,225,225,225,225,1670662916691598,1670662916,fgeF91PE6snEe6cFe5lUdQ==,3413,0,0,0,what-plugin-do-other-trannys-use-to-make-their,2,0,1670667164,,"[{'no': 28697754, 'now': '12/10/22(Sat)05:11:43', 'name': 'Anonymous', 'com': 'slicex', 'time': 1670667103, 'resto': 28697308}, {'no': 28697762, 'now': '12/10/22(Sat)05:12:44', 'name': 'Anonymous', 'com': '<a href=""#p28697754"" class=""quotelink"">&gt;&gt;28697754</a><br>Thanks :3 I’ll try that.', 'time': 1670667164, 'resto': 28697308}]",,,
80,28697006,12/10/22(Sat)03:20:46,Anonymous,https://www.spectator.com.au/2021/0<wbr>7/why-should-women-tolerate-the-big<wbr>-swinging-dicks-of-the-transgender-<wbr>movement/<br>Well?,1663456177436,.png,696,727,239,250,1670660446252518,1670660446,RiKKZiNTlH4HMsIeRxjbuw==,503510,0,0,0,why-should-women-tolerate-the-big-swinging-dicks,8,2,1670667119,Why should women tolerate the big swinging dicks of the transgender movement?,"[{'no': 28697040, 'now': '12/10/22(Sat)03:24:34', 'name': 'Anonymous', 'com': 'unrelated but bro what is this facebook? posting random ass articles and shit lmao', 'time': 1670660674, 'resto': 28697006}, {'no': 28697057, 'now': '12/10/22(Sat)03:26:23', 'name': 'in all fields', 'com': '<a href=""#p28697006"" class=""quotelink"">&gt;&gt;28697006</a><br>i don’t listen to cis hons or their retarded concerns', 'filename': '2CA37CCA-7E51-44AD-A088-8F6745AAD55D', 'ext': '.jpg', 'w': 1284, 'h': 434, 'tn_w': 125, 'tn_h': 42, 'tim': 1670660783739367, 'time': 1670660783, 'md5': 'n1OOPilXMwFc2P5notajWg==', 'fsize': 195015, 'resto': 28697006}, {'no': 28697058, 'now': '12/10/22(Sat)03:26:30', 'name': 'Anonymous', 'com': '<a href=""#p28697006"" class=""quotelink"">&gt;&gt;28697006</a><br>lmao why word it that way??? BIG SWINGING DICKS?!', 'time': 1670660790, 'resto': 28697006}, {'no': 28697415, 'now': '12/10/22(Sat)04:18:51', 'name': 'lilac', 'com': '<a href=""#p28697021"" class=""quotelink"">&gt;&gt;28697021</a><br>kek', 'time': 1670663931, 'resto': 28697006}, {'no': 28697758, 'now': '12/10/22(Sat)05:11:59', 'name': 'Anonymous', 'com': 'BIG!<br>TRANNY!<br>COCKS!<br>I DON&#039;T WANNA SEE YOUR JUICY, VEINY, HARD DICK IN MY BATHROOM TRANNY. DON&#039;T CUM ON MY FACE TRANNY', 'time': 1670667119, 'resto': 28697006}]",3.0,1.0,
81,28696300,12/10/22(Sat)02:06:48,Anonymous,"<span class=""quote"">&gt;pic unrel</span>",double-standard,.jpg,1024,762,250,186,1670656008334652,1670656008,T4AiK/ltJX6jbDdkhypg4g==,108959,0,0,0,why-are-jewish-boys-so-cute,11,2,1670666886,Why are Jewish boys so cute?,"[{'no': 28697465, 'now': '12/10/22(Sat)04:25:27', 'name': 'Anonymous', 'com': '<a href=""#p28697330"" class=""quotelink"">&gt;&gt;28697330</a><br>https://guardian.ng/news/genetic-ma<wbr>keup-of-12-year-old-angolan-boy-in-<wbr>dispute/', 'filename': 'nig chimpski', 'ext': '.jpg', 'w': 860, 'h': 459, 'tn_w': 125, 'tn_h': 66, 'tim': 1670664327030890, 'time': 1670664327, 'md5': '9RA72NUZUflPgZsKePc8Tg==', 'fsize': 45368, 'resto': 28696300}, {'no': 28697510, 'now': '12/10/22(Sat)04:31:43', 'name': 'Anonymous', 'com': '<a href=""#p28697465"" class=""quotelink"">&gt;&gt;28697465</a><br>Of course it’s a Portuguese speaking part of Africa. Portuguese have to be the WORST colonial power in history', 'time': 1670664703, 'resto': 28696300}, {'no': 28697602, 'now': '12/10/22(Sat)04:45:29', 'name': 'Anonymous', 'com': '<a href=""#p28697510"" class=""quotelink"">&gt;&gt;28697510</a><br>You mean the best? <br>They Christianized things more than any others, they treated their colonized well, they introduced crocos to Goa etc.', 'time': 1670665529, 'resto': 28696300}, {'no': 28697722, 'now': '12/10/22(Sat)05:06:49', 'name': 'Anonymous', 'com': '<a href=""#p28697602"" class=""quotelink"">&gt;&gt;28697602</a><br>They created Brazil…..', 'time': 1670666809, 'resto': 28696300}, {'no': 28697733, 'now': '12/10/22(Sat)05:08:06', 'name': 'Anonymous', 'com': '<a href=""#p28697722"" class=""quotelink"">&gt;&gt;28697722</a><br>Brazil used to be a beautiful country', 'time': 1670666886, 'resto': 28696300}]",6.0,1.0,
82,28697453,12/10/22(Sat)04:23:32,Anonymous,built for chaser cock this built for chaser cock that but who ISNT built for chaser cock???,1669845787565253,.jpg,1520,1119,250,184,1670664212413649,1670664212,Mxs9D8kV5CrKOj5FpEPXPQ==,340193,0,0,0,built-for-chaser-cock-this-built-for-chaser-cock,5,1,1670666795,,"[{'no': 28697486, 'now': '12/10/22(Sat)04:27:54', 'name': 'Anonymous', 'com': '<a href=""#p28697453"" class=""quotelink"">&gt;&gt;28697453</a><br>As if they have standards, just slap a wig on and chasers will fuck you.', 'time': 1670664474, 'resto': 28697453}, {'no': 28697496, 'now': '12/10/22(Sat)04:29:48', 'name': 'Anonymous', 'com': '<a href=""#p28697453"" class=""quotelink"">&gt;&gt;28697453</a><br>BIG', 'filename': 'FDE1D6A9-89FE-46B7-83A1-DF304E49D5B7', 'ext': '.jpg', 'w': 314, 'h': 234, 'tn_w': 125, 'tn_h': 93, 'tim': 1670664588078757, 'time': 1670664588, 'md5': 'hGIR0yoa0IQeF+VWYdHQTw==', 'fsize': 17469, 'resto': 28697453}, {'no': 28697502, 'now': '12/10/22(Sat)04:30:14', 'name': 'Anonymous', 'com': '<a href=""#p28697453"" class=""quotelink"">&gt;&gt;28697453</a><br>programmers used a chaser cock mind as basis for developing anime girl AI generators, hence everything and anything transforming into chaser cock material', 'time': 1670664614, 'resto': 28697453}, {'no': 28697613, 'now': '12/10/22(Sat)04:47:02', 'name': ')*Kassandra of Ellaphae|PSO2', 'com': '<a href=""#p28697453"" class=""quotelink"">&gt;&gt;28697453</a><br>ahh the demon core<br><br>tragic and fascinating incident<br>https://en.m.wikipedia.org/wiki/Dem<wbr>on_core<br><br>shes gonna go critical!', 'time': 1670665622, 'resto': 28697453, 'trip': '!wetBJHdekA'}, {'no': 28697719, 'now': '12/10/22(Sat)05:06:35', 'name': 'Anonymous', 'com': '<a href=""#p28697486"" class=""quotelink"">&gt;&gt;28697486</a><br>this. except i won’t fuck fat chicks', 'time': 1670666795, 'resto': 28697453}]",,,
83,28695853,12/10/22(Sat)01:07:31,Anonymous,"<span class=""quote"">&gt;be me</span><br><span class=""quote"">&gt;car battery dies</span><br><span class=""quote"">&gt;go to autozone</span><br><span class=""quote"">&gt;manmoding</span><br><span class=""quote"">&gt;bring dead battery</span><br><span class=""quote"">&gt;guy at counter helps me</span><br><span class=""quote"">&gt;calls me &#039;hon&#039;</span><br>Did he just clock me as a tranny and call me a hon? Or did i just mailfail?",2MFUC2O_,.jpg,512,512,250,250,1670652451355171,1670652451,7oYmb7+ZVzzhADmcjzesgA==,61880,0,0,0,he-called-me-hon,12,1,1670666734,He called me &#039;hon&#039;,"[{'no': 28696095, 'now': '12/10/22(Sat)01:39:28', 'name': 'Anonymous', 'com': '<a href=""#p28696048"" class=""quotelink"">&gt;&gt;28696048</a><br><a href=""#p28696063"" class=""quotelink"">&gt;&gt;28696063</a><br>Tbh i know he didn&#039;t mean it like the board says. I guess I&#039;m not completely sure if I&#039;m getting clocked as trans, but i don&#039;t think so this time at least', 'time': 1670654368, 'resto': 28695853}, {'no': 28696119, 'now': '12/10/22(Sat)01:41:42', 'name': 'Rank 1 Boymoder', 'com': '<a href=""#p28696095"" class=""quotelink"">&gt;&gt;28696095</a><br><span class=""quote"">&gt;I&#039;m not completely sure if I&#039;m getting clocked as trans, but i don&#039;t think so this time at least</span><br>any use of hon outside this board probably means passing desu', 'time': 1670654502, 'resto': 28695853, 'trip': '!!f/khdHYHXFn'}, {'no': 28696133, 'now': '12/10/22(Sat)01:44:21', 'name': 'Anonymous', 'com': '<a href=""#p28695853"" class=""quotelink"">&gt;&gt;28695853</a><br>Normal people don&#039;t know what hon means in the tranny sense. So no, he wasn&#039;t calling you a hon. You probably malefailed unless he seemed kind of gay or something then it&#039;s up in the air', 'time': 1670654661, 'resto': 28695853}, {'no': 28696149, 'now': '12/10/22(Sat)01:46:43', 'name': 'Anonymous', 'com': '<a href=""#p28695853"" class=""quotelink"">&gt;&gt;28695853</a><br>anon a higher percent of the population is trans than knows what &quot;hon&quot; means in this context. He was just being nice.', 'time': 1670654803, 'resto': 28695853}, {'no': 28697713, 'now': '12/10/22(Sat)05:05:34', 'name': 'Anonymous', 'com': '<a href=""#p28695853"" class=""quotelink"">&gt;&gt;28695853</a><br>is hon coming back?', 'time': 1670666734, 'resto': 28695853}]",7.0,1.0,
84,28697696,12/10/22(Sat)05:02:30,Anonymous,How long does it take for testosterone levels to pick back up after stopping injections? I&#039;ve fucked up and won&#039;t have access to needles until next week or so.,1646949845643,.jpg,498,1026,121,250,1670666550351765,1670666550,bXOCFpp7tblzN8XM2afT1Q==,215636,0,0,0,how-long-does-it-take-for-testosterone-levels-to,2,1,1670666875,,"[{'no': 28697705, 'now': '12/10/22(Sat)05:04:48', 'name': 'Anonymous', 'com': '<a href=""#p28697696"" class=""quotelink"">&gt;&gt;28697696</a><br><span class=""quote"">&gt;doesn&#039;t tell dosage</span><br><span class=""quote"">&gt;doesn&#039;t tell which estrogen ester</span><br><span class=""quote"">&gt;doesn&#039;t tell when the last injection was</span><br><span class=""quote"">&gt;doesn&#039;t elaborate further</span><br><span class=""quote"">&gt;leaves</span>', 'time': 1670666688, 'resto': 28697696}, {'no': 28697732, 'now': '12/10/22(Sat)05:07:55', 'name': 'Anonymous', 'com': '<a href=""#p28697705"" class=""quotelink"">&gt;&gt;28697705</a><br><span class=""quote"">&gt;6 mg</span><br><span class=""quote"">&gt;EV</span><br><span class=""quote"">&gt;last Saturday</span>', 'filename': '1658727844008', 'ext': '.jpg', 'w': 1920, 'h': 1967, 'tn_w': 122, 'tn_h': 124, 'tim': 1670666875897773, 'time': 1670666875, 'md5': 'IK/SPw31Q6Aty5doqf1Xxg==', 'fsize': 253393, 'resto': 28697696}]",,,
85,28696069,12/10/22(Sat)01:36:19,Anonymous,I think I will have to have sex with men (and be discarded afterwards) to cope with the fact that I&#039;ll never have a gf or have any sort of intimacy with one because I&#039;m 25 yo khhv tranny.,1574309293836,.jpg,792,844,234,250,1670654179991197,1670654179,gI3WqViVgGXttmd9ZWsh/g==,140812,0,0,0,i-think-i-will-have-to-have-sex-with-men-and-be,26,5,1670666268,,"[{'no': 28697514, 'now': '12/10/22(Sat)04:32:21', 'name': 'Anonymous', 'com': '<a href=""#p28697429"" class=""quotelink"">&gt;&gt;28697429</a><br>I emulated the PS3 original lol, DILF Nier for life<br>first attempt I got filtered by the fishing minigame<br><br><span class=""quote"">&gt;specific moment</span><br>I know we don&#039;t have spoiler tags but which one? The only thing that comes to mind is the part where 2B gets infected and you do a lot of walking.', 'time': 1670664741, 'resto': 28696069}, {'no': 28697558, 'now': '12/10/22(Sat)04:39:10', 'name': 'Rank 1 Boymoder', 'com': '<a href=""#p28697514"" class=""quotelink"">&gt;&gt;28697514</a><br><span class=""quote"">&gt;I emulated the PS3 original lol, DILF Nier for life</span><br>DILF NIER?<br>WHAT DILF ARE WE TALKIN ABOUT HERE?!/!?!?<br><br><span class=""quote"">&gt;I know we don&#039;t have spoiler tags but which one? The only thing that comes to mind is the part where 2B gets infected and you do a lot of walking.</span><br>im talkin about the (spoilers) part where you have to delete your save, breaking the 4th wall but also impacting the player by confronting them with the cost of their own save', 'time': 1670665150, 'resto': 28696069, 'trip': '!!f/khdHYHXFn'}, {'no': 28697623, 'now': '12/10/22(Sat)04:49:19', 'name': 'Anonymous', 'com': '<a href=""#p28697558"" class=""quotelink"">&gt;&gt;28697558</a><br>he looks like this in Nier Gestalt and is a daddy instead of a brother. so disappointed they didn&#039;t do a double release for the remake and redo some of the awkward scenes. forever trapped in the scuffed PS360 version :&#039;(<br><br>oh so you meant the ending? didn&#039;t leave the biggest impact on me personally, I just really enjoyed discovering the truth and watching the characters figure out how to deal with it. so much raw emotion in some scenes, left an impact in my teenage heart.', 'filename': 'NieR_Replicant_ver.1.22474487139..._Papa_Nier', 'ext': '.png', 'w': 1974, 'h': 2560, 'tn_w': 96, 'tn_h': 125, 'tim': 1670665759750786, 'time': 1670665759, 'md5': 'tb7OjNOPtXFHJK8SY85wUQ==', 'fsize': 2948531, 'resto': 28696069}, {'no': 28697638, 'now': '12/10/22(Sat)04:51:00', 'name': 'Anonymous', 'com': '<a href=""#p28697623"" class=""quotelink"">&gt;&gt;28697623</a><br>NVM JUST FOUND OUT HE&#039;S UNLOCKABLE NOW I HAVE TO PLAY IT AGAIN AAAAAAAAAAA', 'time': 1670665860, 'resto': 28696069}, {'no': 28697676, 'now': '12/10/22(Sat)04:57:48', 'name': 'Rank 1 Boymoder', 'com': '<a href=""#p28697623"" class=""quotelink"">&gt;&gt;28697623</a><br><span class=""quote"">&gt;oh so you meant the ending? didn&#039;t leave the biggest impact on me personally,</span><br>idk the impact of struggling to survive in the credits, then realizing you&#039;ve &quot;deleted&quot; others saves<br>then being asked if you want to sacrifice your own save for that purpose <br>i love it', 'time': 1670666268, 'resto': 28696069, 'trip': '!!f/khdHYHXFn'}]",21.0,4.0,
86,28696405,12/10/22(Sat)02:19:30,Anonymous,"i figured out how to live as a tranny without having to openly state you&#039;re a tranny <br><span class=""quote"">&gt;DIY hrt (obviously), we don&#039;t trust therapists around here </span><br><span class=""quote"">&gt;don&#039;t tell anyone you&#039;re trans, just say some shit like &quot;i&#039;m just me, no labels :)&quot; if anyone is suspicious, cisoids eat that shit up</span><br><span class=""quote"">&gt;don&#039;t debate randoms on trans rights, they&#039;ll never change their opinion anyway and you&#039;re just wasting your time</span><br><span class=""quote"">&gt;if you transition medically you can say that. you can say that you&#039;re taking hormones and clear some things up. cisoids might debate you on your gender but they can&#039;t debate you on you taking hormones</span><br><span class=""quote"">&gt;if they get annoying just tell them it&#039;s because of a hormonal imbalance, they don&#039;t need to know shit.</span><br><span class=""quote"">&gt;dress how you want and don&#039;t correct anyone if they address you as the opposite gender</span><br><span class=""quote"">&gt;don&#039;t correct them if they misgender you either since it doesn&#039;t matter</span><br><span class=""quote"">&gt;get a nickname your friends can call you that affirms your identity and don&#039;t explain any of it</span><br>live a little",6DEBA3DA-872D-4910-9379-C5ED14EC5111,.jpg,648,974,166,249,1670656770940763,1670656770,e/a5TarjFNqi+seFB7/VGA==,176483,0,0,0,fuck-social-transition-all-my-homies-hate-social,2,1,1670665831,fuck social transition all my homies hate social transition,"[{'no': 28697532, 'now': '12/10/22(Sat)04:35:15', 'name': 'Anonymous', 'com': '<a href=""#p28696405"" class=""quotelink"">&gt;&gt;28696405</a><br>based wtfmoder', 'time': 1670664915, 'resto': 28696405}, {'no': 28697635, 'now': '12/10/22(Sat)04:50:31', 'name': 'Anonymous', 'com': '<a href=""#p28696405"" class=""quotelink"">&gt;&gt;28696405</a><br><span class=""quote"">&gt;don&#039;t tell</span><br><span class=""quote"">&gt;don&#039;t debate</span><br><span class=""quote"">&gt;don&#039;t explain</span><br><span class=""quote"">&gt;don&#039;t correct</span><br>Based. Fuck elaborating.', 'filename': '1668282795258321', 'ext': '.jpg', 'w': 1280, 'h': 720, 'tn_w': 125, 'tn_h': 70, 'tim': 1670665831469057, 'time': 1670665831, 'md5': 'HUSoUaz9H8icSlv6+pbeFg==', 'fsize': 101882, 'resto': 28696405}]",,,
87,28695614,12/10/22(Sat)00:35:13,Anonymous,Well I came out to my mom.,KZ7kWtnR_400x400,.jpg,400,400,250,250,1670650513489043,1670650513,BMlvcwtGbG4vWmMmyWrQtQ==,20221,0,0,0,well-i-came-out-to-my-mom,35,5,1670665793,,"[{'no': 28696459, 'now': '12/10/22(Sat)02:25:43', 'name': 'Anonymous', 'com': '<a href=""#p28696386"" class=""quotelink"">&gt;&gt;28696386</a><br>Its a really big thing. What iif it goes bad ya know. I&#039;m all nervous.', 'time': 1670657143, 'resto': 28695614}, {'no': 28696576, 'now': '12/10/22(Sat)02:38:23', 'name': 'Anonymous', 'com': '<a href=""#p28696459"" class=""quotelink"">&gt;&gt;28696459</a><br>to quote FLCL, nothing will happen if you don&#039;t swing the bat<br>you&#039;ll never succeed if you dont try. You&#039;ll never fail, but you&#039;ll never succeed<br>I won&#039;t say you should or shouldn&#039;t transition. But it sounds like you&#039;d benefit from trying hrt for a month and seeing how you feel. After that, transition is a choice you make on a day by day basis; you can always quit<br><br>and youve already taken the biggest step. Telling your family is terrifying and I&#039;m glad you have an accepting, if confused, mom', 'time': 1670657903, 'resto': 28695614}, {'no': 28696605, 'now': '12/10/22(Sat)02:41:09', 'name': 'Anonymous', 'com': '<a href=""#p28696576"" class=""quotelink"">&gt;&gt;28696576</a><br>I&#039;ve been on hrt for a little over a year... I just didn&#039;t tell anyone ngl...but you&#039;re right. Gotta at least try.', 'time': 1670658069, 'resto': 28695614}, {'no': 28697408, 'now': '12/10/22(Sat)04:18:07', 'name': 'Anonymous', 'com': '<a href=""#p28695732"" class=""quotelink"">&gt;&gt;28695732</a><br><span class=""quote"">&gt;but she was willing to accept it in a years time</span><br>Bitch', 'time': 1670663887, 'resto': 28695614}, {'no': 28697630, 'now': '12/10/22(Sat)04:49:53', 'name': ')*Kassandra of Ellaphae|PSO2', 'com': '<a href=""#p28695732"" class=""quotelink"">&gt;&gt;28695732</a><br>shes just coping<br><br>not that far off from my mom except she recognized signs and still wouldn&#039;t help me start hrt', 'time': 1670665793, 'resto': 28695614, 'trip': '!wetBJHdekA'}]",30.0,5.0,
88,28697316,12/10/22(Sat)04:03:17,hln,yet wanting to fuck with men while looking like a woman and getting covered with their semen from head to toe?,IMG_20221208_183932,.jpg,4000,2250,250,140,1670662997294082,1670662997,3ZSCCRUV8G8m/E20zZDNbw==,3092661,0,0,0,how-do-i-cope-with-being-a-manly-male,9,1,1670665787,how do i cope with being a manly male,"[{'no': 28697440, 'now': '12/10/22(Sat)04:22:38', 'name': 'Anonymous', 'com': 'Sex hurts for women. They don&#039;t like it. That should deter you', 'time': 1670664158, 'resto': 28697316}, {'no': 28697534, 'now': '12/10/22(Sat)04:35:24', 'name': 'Anonymous', 'com': '<a href=""#p28697316"" class=""quotelink"">&gt;&gt;28697316</a><br>i can&#039;t fully relate but i wish i was more feminine and got dicked hard by manly men (i dont wanna be a grill tho)', 'time': 1670664924, 'resto': 28697316}, {'no': 28697543, 'now': '12/10/22(Sat)04:36:50', 'name': 'Anonymous', 'com': '<a href=""#p28697431"" class=""quotelink"">&gt;&gt;28697431</a><br><span class=""quote"">&gt; just a man</span><br>I said what I said', 'time': 1670665010, 'resto': 28697316}, {'no': 28697568, 'now': '12/10/22(Sat)04:41:15', 'name': 'hln', 'com': '<a href=""#p28697543"" class=""quotelink"">&gt;&gt;28697543</a><br>prettiest picture i have of me but my body is fat and extremely hairy<br>also, i have a beard that isn&#039;t visible in this picture', 'filename': '10-15-12-IMG_20220819_201926', 'ext': '.jpg', 'w': 2448, 'h': 3264, 'tn_w': 93, 'tn_h': 125, 'tim': 1670665275426727, 'time': 1670665275, 'md5': '23XEX26NJn9fti66oRHtag==', 'fsize': 495175, 'resto': 28697316, 'trip': '!nJfreZxOKY'}, {'no': 28697628, 'now': '12/10/22(Sat)04:49:47', 'name': 'Anonymous', 'com': '<a href=""#p28697568"" class=""quotelink"">&gt;&gt;28697568</a><br>Cute', 'time': 1670665787, 'resto': 28697316}]",4.0,0.0,!nJfreZxOKY
89,28695987,12/10/22(Sat)01:24:03,Anonymous,,hon,.jpg,1280,750,250,146,1670653443610127,1670653443,eOIVGn6qpkOUBDUxTD9PEw==,434664,0,0,0,could-hrt-have-saved-her,2,0,1670665755,could HRT have saved her?,"[{'no': 28697380, 'now': '12/10/22(Sat)04:14:06', 'name': 'Anonymous', 'com': 'Elliotussy would have', 'time': 1670663646, 'resto': 28695987}, {'no': 28697622, 'now': '12/10/22(Sat)04:49:15', 'name': 'Anonymous', 'com': 'I still hate Elliot for destroying her machine and ruining her perfect world where we&#039;d all be born cis and live happily ever after. Then that shitty fucking useless faggot ruined everything just because his dad molested him when he was a kid or something, what a shitty finale.', 'time': 1670665755, 'resto': 28695987}]",,,
