,no,now,name,com,filename,ext,w,h,tn_w,tn_h,tim,time,md5,fsize,resto,bumplimit,imagelimit,semantic_url,replies,images,last_modified,sub,last_replies,omitted_posts,omitted_images,trip
114,28693530,12/09/22(Fri)20:54:39,Anonymous,,drakeandjosh,.png,564,554,249,245,1670637279304356,1670637279,1rQlBzyoZXuRn3IcPLVTyw==,279505,0,0,0,ywnbymca,12,0,1670659967,YWNBYMCA,"[{'no': 28695537, 'now': '12/10/22(Sat)00:26:03', 'name': 'Anonymous', 'com': '<a href=""#p28695466"" class=""quotelink"">&gt;&gt;28695466</a><br>he had vitelago and bleached his skin to accelerate the process<br>the plastic surgery i cant explain', 'time': 1670649963, 'resto': 28693530}, {'no': 28695697, 'now': '12/10/22(Sat)00:46:42', 'name': 'Anonymous', 'com': '<a href=""#p28693564"" class=""quotelink"">&gt;&gt;28693564</a><br>i dont understand why people think he was so talented<br><br>yeah sure he was good at dancing i guess?', 'time': 1670651202, 'resto': 28693530}, {'no': 28695716, 'now': '12/10/22(Sat)00:48:53', 'name': 'Anonymous', 'com': '<a href=""#p28695697"" class=""quotelink"">&gt;&gt;28695697</a><br>I dont particularly care about him as an artist but that&#039;s just ignorant', 'time': 1670651333, 'resto': 28693530}, {'no': 28696866, 'now': '12/10/22(Sat)03:06:08', 'name': 'Anonymous', 'com': '<a href=""#p28695537"" class=""quotelink"">&gt;&gt;28695537</a><br><span class=""quote"">&gt;the vitiligo cope</span>', 'time': 1670659568, 'resto': 28693530}, {'no': 28696934, 'now': '12/10/22(Sat)03:12:47', 'name': 'Anonymous', 'com': '<a href=""#p28696866"" class=""quotelink"">&gt;&gt;28696866</a><br>It&#039;s not cope.', 'time': 1670659967, 'resto': 28693530}]",7.0,0.0,
115,28693977,12/09/22(Fri)21:27:32,Anonymous,gonna give my first blowjob sometime soon. any tips?,e1793d5410ce4744bd0f8b14d880f108_313903521_1252713438922487_6008720269935201080_n,.jpg,320,235,250,183,1670639252820115,1670639252,nqg0y7cL5UPMVpJ8cqA6Mw==,10938,0,0,0,gonna-give-my-first-blowjob-sometime-soon-any,12,1,1670659598,,"[{'no': 28694283, 'now': '12/09/22(Fri)21:57:44', 'name': 'Anonymous', 'com': '<a href=""#p28694248"" class=""quotelink"">&gt;&gt;28694248</a><br>ah, forgot the teeth advice', 'time': 1670641064, 'resto': 28693977}, {'no': 28694319, 'now': '12/09/22(Fri)22:01:01', 'name': 'Anonymous', 'com': '<a href=""#p28694001"" class=""quotelink"">&gt;&gt;28694001</a><br>What happens if I get tired and give up?<br>t. this happens a lot when I masturbate too', 'time': 1670641261, 'resto': 28693977}, {'no': 28696030, 'now': '12/10/22(Sat)01:29:23', 'name': 'Anonymous', 'com': '<a href=""#p28694319"" class=""quotelink"">&gt;&gt;28694319</a><br>Just offer your ass if you get tired', 'time': 1670653763, 'resto': 28693977}, {'no': 28696812, 'now': '12/10/22(Sat)03:01:36', 'name': 'Anonymous', 'com': 'Just be yourself and have fun :)', 'time': 1670659296, 'resto': 28693977}, {'no': 28696876, 'now': '12/10/22(Sat)03:06:38', 'name': 'Anonymous', 'com': '<a href=""#p28694248"" class=""quotelink"">&gt;&gt;28694248</a><br>that sounds weird.', 'time': 1670659598, 'resto': 28693977}]",7.0,1.0,
116,28696716,12/10/22(Sat)02:52:50,Anonymous,Queer ideology has done irrevocable damage to the reputation of the LGBT community.,FjgZgrWUoAA_jeq,.jpg,1024,1024,250,250,1670658770723112,1670658770,g0LOQvR+E9fPp/2eA+1i/g==,245623,0,0,0,lgbt-vs-lgbtq,7,1,1670660995,LGBT vs LGBTQ+,"[{'no': 28696786, 'now': '12/10/22(Sat)02:59:29', 'name': 'Anonymous', 'com': '<a href=""#p28696716"" class=""quotelink"">&gt;&gt;28696716</a><br>Should be LGB and have both T and Q on the same side.', 'filename': 'two', 'ext': '.jpg', 'w': 480, 'h': 360, 'tn_w': 125, 'tn_h': 93, 'tim': 1670659169410863, 'time': 1670659169, 'md5': 'lmv2K7M4OZL7XvuTzRWudQ==', 'fsize': 19670, 'resto': 28696716}, {'no': 28696788, 'now': '12/10/22(Sat)02:59:40', 'name': 'kermit', 'com': '<a href=""#p28696716"" class=""quotelink"">&gt;&gt;28696716</a><br>Oh I thought they were censoring Qatar. LOL', 'time': 1670659180, 'resto': 28696716, 'trip': '!FAnfK8y0d2'}, {'no': 28696825, 'now': '12/10/22(Sat)03:02:55', 'name': 'Anonymous', 'com': '<a href=""#p28696716"" class=""quotelink"">&gt;&gt;28696716</a><br>I like queer, rather than &quot;lgbt+&quot; which feels very dismissive', 'time': 1670659375, 'resto': 28696716}, {'no': 28696870, 'now': '12/10/22(Sat)03:06:20', 'name': 'Anonymous', 'com': '<a href=""#p28696733"" class=""quotelink"">&gt;&gt;28696733</a><br>Encontré al ellx<br><a href=""#p28696786"" class=""quotelink"">&gt;&gt;28696786</a><br>Based', 'time': 1670659580, 'resto': 28696716}, {'no': 28697083, 'now': '12/10/22(Sat)03:29:55', 'name': 'Anonymous', 'com': '<a href=""#p28696716"" class=""quotelink"">&gt;&gt;28696716</a><br>cry about it some more, pedophobe', 'time': 1670660995, 'resto': 28696716}]",2.0,0.0,
117,28695558,12/10/22(Sat)00:28:51,Anonymous,"prev <a href=""/lgbt/thread/28692583#p28692583"" class=""quotelink"">&gt;&gt;28692583</a><br>bin: https://www.klgrth.io/paste/tz54f<br>qott: what&#039;s on your chrimmis list anon?",1669779890550,.jpg,796,2048,97,250,1670650131943537,1670650131,6rfn2UZzWNbZ73arNb/juA==,283123,0,1,0,mtfg-male-to-female-general,685,131,1670674232,/mtfg/ Male to Female General,"[{'no': 28698308, 'now': '12/10/22(Sat)07:03:50', 'name': 'Elfi', 'com': '<a href=""#p28698296"" class=""quotelink"">&gt;&gt;28698296</a><br>need this', 'time': 1670673830, 'resto': 28695558, 'trip': '!Jenna0qB/A'}, {'no': 28698309, 'now': '12/10/22(Sat)07:03:58', 'name': 'Anonymous', 'com': 'i want a 1967 cadillac Eldorado convertible. hot pink with whale skin hub caps driving around at 113 miles per hour getting one mile per gallon', 'time': 1670673838, 'resto': 28695558}, {'no': 28698320, 'now': '12/10/22(Sat)07:06:47', 'name': 'Anonymous', 'com': '<a href=""#p28698309"" class=""quotelink"">&gt;&gt;28698309</a><br>yee haw sister', 'time': 1670674007, 'resto': 28695558}, {'no': 28698327, 'now': '12/10/22(Sat)07:09:38', 'com': '<a href=""#p28698261"" class=""quotelink"">&gt;&gt;28698261</a><br>idk this place is fun sometimes and i like some of the people here', 'time': 1670674178, 'resto': 28695558, 'trip': '!PaSs.oi.D.'}, {'no': 28698333, 'now': '12/10/22(Sat)07:10:32', 'name': 'Anonymous', 'com': 'my cat has issues', 'time': 1670674232, 'resto': 28695558}]",680.0,131.0,
118,28692877,12/09/22(Fri)19:54:19,Anonymous,,1666818365532486,.jpg,750,859,218,250,1670633659450768,1670633659,E579S9Q0/ZglWsO+Aacmkw==,134369,0,0,0,tranners-were-made-for-cis-mommy-cuddles,42,3,1670659475,Tranners were MADE for cis mommy cuddles,"[{'no': 28695591, 'now': '12/10/22(Sat)00:32:11', 'name': 'Anonymous', 'com': '<a href=""#p28692877"" class=""quotelink"">&gt;&gt;28692877</a><br>as a trans lesbian i don&#039;t think i can agree with that but i sure as hell wish i had a cis mommy', 'time': 1670650331, 'resto': 28692877}, {'no': 28695613, 'now': '12/10/22(Sat)00:35:11', 'name': 'sanest poster', 'com': '<a href=""#p28695566"" class=""quotelink"">&gt;&gt;28695566</a><br>no im a 24 year old transbian bottom desu', 'time': 1670650511, 'resto': 28692877}, {'no': 28695633, 'now': '12/10/22(Sat)00:37:56', 'name': 'lagoloaf', 'com': '<a href=""#p28695483"" class=""quotelink"">&gt;&gt;28695483</a><br>Definitely, after I transfer my vaginal flora to hers.', 'time': 1670650676, 'resto': 28692877, 'trip': '!!EZ0q+pWBDlU'}, {'no': 28695650, 'now': '12/10/22(Sat)00:40:19', 'name': 'Anonymous', 'com': '<a href=""#p28695439"" class=""quotelink"">&gt;&gt;28695439</a><br>how is that lies<br>im just not good to begin with and just dont desrve them i havent done anything to say otherwise', 'time': 1670650819, 'resto': 28692877}, {'no': 28696847, 'now': '12/10/22(Sat)03:04:35', 'name': 'Anonymous', 'com': '<a href=""#p28695633"" class=""quotelink"">&gt;&gt;28695633</a><br>hot', 'time': 1670659475, 'resto': 28692877}]",37.0,3.0,
119,28695569,12/10/22(Sat)00:29:44,Anonymous,Already 23 and still won&#039;t be able to start hrt for a whike. I should just kill myself and cut the losses immediately because I will nfmi,1670446339222399,.jpg,1857,834,250,112,1670650184027472,1670650184,aBkzyd8e4NAnQug8fAgZVw==,1052322,0,0,0,already-23-and-still-wont-be-able-to-start-hrt,12,0,1670659429,,"[{'no': 28695785, 'now': '12/10/22(Sat)00:57:33', 'name': 'Anonymous', 'com': '<a href=""#p28695715"" class=""quotelink"">&gt;&gt;28695715</a><br>This<br><br><span class=""quote"">&gt;t. trooned at 18 and am a giganter hon the likes of which you&#039;ve never seen.</span>', 'time': 1670651853, 'resto': 28695569}, {'no': 28696137, 'now': '12/10/22(Sat)01:45:03', 'name': 'Anonymous', 'com': '<a href=""#p28695569"" class=""quotelink"">&gt;&gt;28695569</a><br>Then kys I guess', 'time': 1670654703, 'resto': 28695569}, {'no': 28696290, 'now': '12/10/22(Sat)02:04:51', 'name': 'Anonymous', 'com': '<a href=""#p28695569"" class=""quotelink"">&gt;&gt;28695569</a><br>im 24.5 and i want to kms i just started hrt', 'time': 1670655891, 'resto': 28695569}, {'no': 28696339, 'now': '12/10/22(Sat)02:12:31', 'name': 'Anonymous', 'com': '<a href=""#p28695715"" class=""quotelink"">&gt;&gt;28695715</a><br>well if we want to be honest, all trannies are fucked as soon as they&#039;re conceived. thinking you can just larp as the opposite sex is a delusional cope regardless of how old you are.', 'time': 1670656351, 'resto': 28695569}, {'no': 28696833, 'now': '12/10/22(Sat)03:03:49', 'name': 'Anonymous', 'com': 'if youre gonna be suicidal about it then you could at least just like, take hrt and do drugs for awhile and see what happens', 'time': 1670659429, 'resto': 28695569}]",7.0,0.0,
120,28696199,12/10/22(Sat)01:53:12,Anonymous,why do my friends like me?<br>i dont understand. im not an interesting person and when it comes down to it im really unempathetic and self-serving. i think i just know how to tell people what they want to hear. sometimes i just want to walk away from everything and be alone. <br>t. mtf so it&#039;s on topic<br><br>whats bothering you tonight anon?,1670574275657253,.png,480,360,250,187,1670655192143752,1670655192,tPlSZxypWpZCW4S3tqlH+g==,4630,0,0,0,misc-legbutt-vent-thrd,1,0,1670659349,misc legbutt vent thröd,"[{'no': 28696821, 'now': '12/10/22(Sat)03:02:29', 'name': 'Anonymous', 'com': '<a href=""#p28696199"" class=""quotelink"">&gt;&gt;28696199</a><br>whats bothering me? im trying to find an unemployed sex partner on the west coast. so, we can past time the time just fucking all day before i go back to school next year', 'time': 1670659349, 'resto': 28696199}]",,,
121,28694549,12/09/22(Fri)22:28:42,Anonymous,im starting to want a girlfriend and to be in a transbian/transbian or transbian/cisgf relationship<br><br>my 4 yrs long relationship may fall apart due to this<br><br>it is over,1654802594274,.jpg,760,1000,190,250,1670642922568431,1670642922,uw2QrLiT140QTfmukIoLEg==,33721,0,0,0,im-starting-to-want-a-girlfriend-and-to-be-in-a,17,0,1670659118,,"[{'no': 28695232, 'now': '12/09/22(Fri)23:51:40', 'name': 'Anonymous', 'com': '<a href=""#p28694549"" class=""quotelink"">&gt;&gt;28694549</a><br>Really evaluate your feelings before you decide on dumping your boyfriend.', 'time': 1670647900, 'resto': 28694549}, {'no': 28695294, 'now': '12/10/22(Sat)00:00:16', 'name': 'Anonymous', 'com': '<a href=""#p28694549"" class=""quotelink"">&gt;&gt;28694549</a><br>I hope anyone who wears picrel has a vagina', 'time': 1670648416, 'resto': 28694549}, {'no': 28696027, 'now': '12/10/22(Sat)01:28:57', 'name': 'Anonymous', 'com': '<a href=""#p28695028"" class=""quotelink"">&gt;&gt;28695028</a><br>wat?', 'time': 1670653737, 'resto': 28694549}, {'no': 28696032, 'now': '12/10/22(Sat)01:30:00', 'name': 'Anonymous', 'com': '<a href=""#p28695294"" class=""quotelink"">&gt;&gt;28695294</a><br>it&#039;s just some pic i saw on google randomly and i thought it was so retarded it was funny, it might be literally bot generated', 'time': 1670653800, 'resto': 28694549}, {'no': 28696775, 'now': '12/10/22(Sat)02:58:38', 'name': 'Anonymous', 'com': '<a href=""#p28695028"" class=""quotelink"">&gt;&gt;28695028</a><br>??', 'time': 1670659118, 'resto': 28694549}]",12.0,0.0,
122,28693784,12/09/22(Fri)21:13:24,Anonymous,"<span class=""quote"">&gt;one of bf’s roommates troons out</span><br><span class=""quote"">&gt;other roommate comes out as nonbinary they/them</span><br><span class=""quote"">&gt;good friend of bf troons out </span><br><span class=""quote"">&gt;now bf thinks he’s a tranny</span><br>Enough.",4297F5EF-3BFA-4049-AC95-82B20EE4CF54,.jpg,1106,1012,250,228,1670638404962086,1670638404,UOgqcjV4b5VhqfqkZFs3iQ==,82165,0,0,0,one-of-bfs-roommates-troons-out,37,4,1670658539,,"[{'no': 28696407, 'now': '12/10/22(Sat)02:19:51', 'name': 'Anonymous', 'com': '<a href=""#p28696274"" class=""quotelink"">&gt;&gt;28696274</a><br>Nah it’s pretty hard, but I’m not agp(so that might explain the difficulty)', 'time': 1670656791, 'resto': 28693784}, {'no': 28696443, 'now': '12/10/22(Sat)02:23:55', 'name': 'Anonymous', 'com': '<a href=""#p28696274"" class=""quotelink"">&gt;&gt;28696274</a><br>Lets not make leaps like that anon... Thats kind of a rare gimmick for any one of any &quot;social group&quot;, most trannies are not exactly well off, at least the homosexual ones aren&#039;t lol. <br><br>And even generally trannies are more likely to be below the line for poverty. <br><a href=""#p28694335"" class=""quotelink"">&gt;&gt;28694335</a><br>Trannies, those actually on hormones are like .1% of the population. It will never be as big as your project. That&#039;s delusional. <br><a href=""#p28693811"" class=""quotelink"">&gt;&gt;28693811</a><br>If someone transitions around you, you basically have just had an option in life explained to you, and those that have similar feelings will take advantage of that new option. It&#039;s really simple.', 'time': 1670657035, 'resto': 28693784}, {'no': 28696465, 'now': '12/10/22(Sat)02:26:18', 'name': 'Anonymous', 'com': '<a href=""#p28696407"" class=""quotelink"">&gt;&gt;28696407</a><br>iktf... agp&#039;s are just to much of normal men to not make bank doing something.', 'time': 1670657178, 'resto': 28693784}, {'no': 28696484, 'now': '12/10/22(Sat)02:27:53', 'name': 'Anonymous', 'com': '<a href=""#p28693784"" class=""quotelink"">&gt;&gt;28693784</a><br>it&#039;s social contagion because seeing other trannies made me intensely jealous and I couldn&#039;t contain it anymore', 'time': 1670657273, 'resto': 28693784}, {'no': 28696687, 'now': '12/10/22(Sat)02:48:59', 'name': 'Anonymous', 'com': '<a href=""#p28694335"" class=""quotelink"">&gt;&gt;28694335</a><br>I feel that for every not-actually-trans trans person, there’s a tranner very deep in the closet that may stay there for there whole life<br>speaking of which, does anyone has that middle aged(?) mangaka who write about how they wished they were a woman?', 'time': 1670658539, 'resto': 28693784}]",32.0,4.0,
123,28696602,12/10/22(Sat)02:40:52,Anonymous,"<span class=""quote"">&gt;is trans</span><br><span class=""quote"">&gt;gets the urge to be violently transphobic sometimes</span><br>how do i stop this?",48A5BE27-FE51-43A1-B3C9-5F83AACF8F5A,.png,200,131,200,131,1670658052030510,1670658052,C1E30T2bcnsoEbJdekT06Q==,58308,0,0,0,is-trans,3,0,1670658180,,"[{'no': 28696618, 'now': '12/10/22(Sat)02:42:06', 'name': 'Anonymous', 'com': '<a href=""#p28696602"" class=""quotelink"">&gt;&gt;28696602</a><br>mucho basado', 'time': 1670658126, 'resto': 28696602}, {'no': 28696624, 'now': '12/10/22(Sat)02:42:40', 'name': 'Anonymous', 'com': '<a href=""#p28696602"" class=""quotelink"">&gt;&gt;28696602</a><br>Being on this side of the aisle means that you have a better idea of who is bullshitting and who is fake than any transphobe does. A transphobe could never pick apart trenders and rapehons as accurately as a trans person can.', 'time': 1670658160, 'resto': 28696602}, {'no': 28696628, 'now': '12/10/22(Sat)02:43:00', 'name': 'Anonymous', 'com': '<a href=""#p28696602"" class=""quotelink"">&gt;&gt;28696602</a><br>stop being hsts', 'time': 1670658180, 'resto': 28696602}]",,,
124,28695573,12/10/22(Sat)00:30:03,Anonymous,This is all bullshit isn&#039;t it? Why do I go from being repulsed by men to wanting to serve them? Why do I go from wanting to be Rick Grimes to wanting to be some perky tittied scene bitch. Or some fucking blonde haired femboy who just does &quot;girly&quot; things or the god damned humanities from dark souls. Why am I so fucking retarded and why does this happen. How can this not be a social thing if I feel so conflicted and to you mfs who accept it as a social thing why do we continue living like this is some scientific fact I don&#039;t get it.<br><br>I&#039;m sorry that this might have come off as rude I&#039;m just frustrated and don&#039;t get why I&#039;m constantly swapping between what I want to be,2897153370_preview_annoying orange dies,.png,538,353,250,164,1670650203716508,1670650203,SLpXA2QqrJwzOUfxUuAC9Q==,220580,0,0,0,bullshit,6,0,1670658112,Bullshit.,"[{'no': 28695669, 'now': '12/10/22(Sat)00:42:38', 'name': 'Anonymous', 'com': 'erotic target location error<br><br>you are shocked by the realization as a young boy that your mother does not have a penis and your brain never learned to cope.', 'time': 1670650958, 'resto': 28695573}, {'no': 28696589, 'now': '12/10/22(Sat)02:39:46', 'name': 'Anonymous', 'com': 'yeah you&#039;re deffo hardcore AGP but honestly nobody cares if you pass and are semi-cute', 'time': 1670657986, 'resto': 28695573}, {'no': 28696603, 'now': '12/10/22(Sat)02:41:05', 'name': 'Anonymous', 'com': '<a href=""#p28695573"" class=""quotelink"">&gt;&gt;28695573</a><br>damn nigga you agp as hell lmaooo', 'time': 1670658065, 'resto': 28695573}, {'no': 28696615, 'now': '12/10/22(Sat)02:41:50', 'name': 'Anonymous', 'com': '<a href=""#p28695669"" class=""quotelink"">&gt;&gt;28695669</a><br>Stop believing in Freud.', 'time': 1670658110, 'resto': 28695573}, {'no': 28696616, 'now': '12/10/22(Sat)02:41:52', 'name': 'Anonymous', 'com': '<a href=""#p28695573"" class=""quotelink"">&gt;&gt;28695573</a><br>Look, I&#039;m the same way but I started to be able to distinguish what&#039;s just my brain memeing on me and what&#039;s my true desire. It all comes back to me wanting to be a woman, or at least, to be more like a woman than I was before. It feels better.', 'time': 1670658112, 'resto': 28695573}]",1.0,0.0,
125,28691731,12/09/22(Fri)17:55:34,Anonymous,old fags in grindr are so creepy but getting told they would pay to fuck my pre-hrt wannabe boymodder is a confident boost thanks weird old man from grindr,4D38E6C9-66E8-425D-9EB6-6C15AE66966C,.jpg,1284,1621,198,250,1670626534877574,1670626534,OWlJuMWH2bDV+d3rEk4GLg==,383997,0,0,0,old-fags-in-grindr-are-so-creepy-but-getting-told,45,7,1670658009,,"[{'no': 28696435, 'now': '12/10/22(Sat)02:22:48', 'name': 'lilac', 'com': '<a href=""#p28696394"" class=""quotelink"">&gt;&gt;28696394</a><br>well, 1k is so much money, but id do it for 300 because im really poor', 'time': 1670656968, 'resto': 28691731}, {'no': 28696491, 'now': '12/10/22(Sat)02:28:46', 'com': 'yo asking for a friend but how do you find people to pay for sex withiut getting arreested for prostitution. also i couldnt take less than 1000 i dont think', 'time': 1670657326, 'resto': 28691731, 'trip': '!PaSs.oi.D.'}, {'no': 28696493, 'now': '12/10/22(Sat)02:28:51', 'name': 'Anonymous', 'com': '<a href=""#p28696435"" class=""quotelink"">&gt;&gt;28696435</a><br>1k is good money. Lower end of high class prostitutes. You earn it though. Im too old now. <br><br>Make the most of your time, once its gone its gone forever', 'time': 1670657331, 'resto': 28691731}, {'no': 28696517, 'now': '12/10/22(Sat)02:31:29', 'name': 'Anonymous', 'com': '<a href=""#p28696491"" class=""quotelink"">&gt;&gt;28696491</a><br>Got to expensive bars at posh hotels, ghe men with that type of money will approach you. They get off on power, dont try to be something you&#039;re not, but also understand the rules of the game, even if you dont follow them. <br><br>Some men love that you are a visible whore and get off on seeing peoples reactions to you, others will want you to behave as though you are their wife or gf, and you&#039;re expected to observe social rules and cues.<br><br>You need to look top level though. I was once that pretty.', 'time': 1670657489, 'resto': 28691731}, {'no': 28696595, 'now': '12/10/22(Sat)02:40:09', 'name': 'Anonymous', 'com': '<a href=""#p28691731"" class=""quotelink"">&gt;&gt;28691731</a><br><span class=""quote"">&gt;replying</span><br><span class=""quote"">&gt;to old retards who think they are living in ancient greece</span><br>big mistake. they are always going to be the ending reply no matter what you say, always ignoring the contents of your response and restating whatever they want.', 'time': 1670658009, 'resto': 28691731}]",40.0,7.0,
126,28691582,12/09/22(Fri)17:41:24,Anonymous,"do NOT have sex with stray boymoders.<br>first of all they might have stds from living on the street<br>second of all if you have sex with them without adopting them you&#039;re teaching them to harass strangers for sex<br>third of all you&#039;re making the stray boymoder problem worse. i know it sounds cruel, but if you leave them to nature then eventually there will be no stray boymoders suffering",boymoder,.jpg,512,465,250,227,1670625684605040,1670625684,yWSivLvn5/1KDO36Oaakug==,32099,0,0,0,do-not-have-sex-with-stray-boymoders,24,5,1670657811,,"[{'no': 28693221, 'now': '12/09/22(Fri)20:29:30', 'name': 'Anonymous', 'com': '<a href=""#p28691582"" class=""quotelink"">&gt;&gt;28691582</a><br>Ive been homeless for two years now, and this post has actually helped me cope a bit, thank you annon.<br><br>t. Stray boymoder', 'time': 1670635770, 'resto': 28691582}, {'no': 28694195, 'now': '12/09/22(Fri)21:49:17', 'name': 'Anonymous', 'com': '<a href=""#p28691582"" class=""quotelink"">&gt;&gt;28691582</a><br>What if they&#039;d look good in a collar, though? Every boymoder needs a nametag.', 'time': 1670640557, 'resto': 28691582}, {'no': 28695841, 'now': '12/10/22(Sat)01:05:14', 'name': 'Anonymous', 'com': '<a href=""#p28694195"" class=""quotelink"">&gt;&gt;28694195</a><br>adopting a stray boymoder is not only fine, it&#039;s a good thing. you&#039;re taking her off the street<br>just make sure you can care for how ever many boymoders you have<br>boymoder neglect is real, and it&#039;s illegal', 'time': 1670652314, 'resto': 28691582}, {'no': 28696511, 'now': '12/10/22(Sat)02:30:41', 'name': 'Anonymous', 'com': '<a href=""#p28691736"" class=""quotelink"">&gt;&gt;28691736</a><br>Same.', 'filename': '1670530533363271', 'ext': '.jpg', 'w': 1080, 'h': 1034, 'tn_w': 125, 'tn_h': 119, 'tim': 1670657441560983, 'time': 1670657441, 'md5': 'IXtGn8GThkWnvHjFRbk2jw==', 'fsize': 490519, 'resto': 28691582}, {'no': 28696566, 'now': '12/10/22(Sat)02:36:51', 'name': 'Anonymous', 'com': '<a href=""#p28691828"" class=""quotelink"">&gt;&gt;28691828</a><br>*puts knife back into pocket* dw about that! ;D', 'time': 1670657811, 'resto': 28691582}]",19.0,4.0,
127,28694837,12/09/22(Fri)23:07:19,Anonymous,why is chaser not a sexual orientation?,1665622996133950,.png,451,619,182,249,1670645239268458,1670645239,66wGtK/X1GRoRWzZivCf5A==,438241,0,0,0,why-is-chaser-not-a-sexual-orientation,8,0,1670657644,,"[{'no': 28696073, 'now': '12/10/22(Sat)01:36:56', 'name': 'Anonymous', 'com': 'Bisexual, hun<br><br>or hon<br><br><span class=""quote"">&gt;oh, a female-ish form</span><br><span class=""quote"">&gt;AND A DICK</span><br><span class=""quote"">&gt;YEEEEHAWWWW TIME TO SUCK EM OFF</span>', 'time': 1670654216, 'resto': 28694837}, {'no': 28696128, 'now': '12/10/22(Sat)01:43:21', 'name': 'Anonymous', 'com': 'gynandromorphophilia is a thing', 'time': 1670654601, 'resto': 28694837}, {'no': 28696420, 'now': '12/10/22(Sat)02:21:17', 'name': 'Anonymous', 'com': '<a href=""#p28695055"" class=""quotelink"">&gt;&gt;28695055</a><br>Girl with a dick sounds pretty new to me', 'time': 1670656877, 'resto': 28694837}, {'no': 28696513, 'now': '12/10/22(Sat)02:30:47', 'name': 'Anonymous', 'com': '<a href=""#p28694837"" class=""quotelink"">&gt;&gt;28694837</a><br>its called being a transbian', 'time': 1670657447, 'resto': 28694837}, {'no': 28696543, 'now': '12/10/22(Sat)02:34:04', 'name': 'Anonymous', 'com': '<a href=""#p28694837"" class=""quotelink"">&gt;&gt;28694837</a><br>because trans people aren&#039;t a third sex', 'time': 1670657644, 'resto': 28694837}]",3.0,0.0,
