,no,now,name,com,filename,ext,w,h,tn_w,tn_h,tim,time,md5,fsize,resto,bumplimit,imagelimit,semantic_url,replies,images,last_modified,sub,last_replies,omitted_posts,omitted_images,trip
0,28698357,12/10/22(Sat)07:13:35,Anonymous,Post ideal bf&#039;s,a5d3f25e7d6514adb2caeaafb26c8b71,.jpg,563,708,198,250,1670674415728938,1670674415,E8DbgZ/+VPh6ACl/Nzu39A==,52060,0,0,0,post-ideal-bfs,0,0,1670674415,,,,,
1,28698325,12/10/22(Sat)07:09:27,Anonymous,"For the tranny, hrt femboy chasers out there, what&#039;s the plan when you get older? Do you plan on marrying a tranny or do you plan on having your fun when you&#039;re young and settling for a woman.<br><br>As for femboy chasers, what&#039;s the plan there? Assuming you&#039;re with a hrt femboy it&#039;ll be weird to come out and say, &quot;yeah I&#039;m married to a man but I&#039;m not gay&quot;. What&#039;s the plan there.<br><br>I never really think this far ahead. I&#039;m pretty young but I fear that once I get older, I&#039;ll be that married man who fucks trannies and femboys behind my wife&#039;s back.",Chaser_boymoder,.jpg,4000,2600,250,162,1670674167240908,1670674167,UYK/te9ZAPPc3Ff4WYnqeA==,1170238,0,0,0,whats-your-plan-chaser-bros,1,1,1670674365,What&#039;s your plan chaser bros?,"[{'no': 28698356, 'now': '12/10/22(Sat)07:12:45', 'name': 'Anonymous', 'com': '<a href=""#p28698325"" class=""quotelink"">&gt;&gt;28698325</a><br>Imagine being the man that marries Kayla<br><br>OH NO NO NO', 'filename': '955D362D-C3FA-49CE-AF42-36B06DB28E07', 'ext': '.jpg', 'w': 727, 'h': 1137, 'tn_w': 79, 'tn_h': 125, 'tim': 1670674365431098, 'time': 1670674365, 'md5': 'HuTsRxtSgbkN5q6rXR720g==', 'fsize': 199378, 'resto': 28698325}]",,,
2,28683782,12/09/22(Fri)01:25:26,Anonymous,,media_FjEv7orXkAA76VJ,.jpg,683,1024,166,250,1670567126160391,1670567126,wUDBr2Q5WEoHWliV8IiBoQ==,80721,0,0,0,hornygen,306,29,1670674357,/hornygen/,"[{'no': 28698270, 'now': '12/10/22(Sat)06:54:33', 'name': 'Anonymous', 'com': 'God damn kayla you&#039;re twisted', 'time': 1670673273, 'resto': 28683782}, {'no': 28698272, 'now': '12/10/22(Sat)06:55:04', 'name': 'Anonymous', 'com': '<a href=""#p28698253"" class=""quotelink"">&gt;&gt;28698253</a><br>Idk it scares the fuck out of me. I left a full hand mark on her face after I slapped and she still wanted me to go harder. Guess I gotta get ready for the prog demon', 'time': 1670673304, 'resto': 28683782}, {'no': 28698290, 'now': '12/10/22(Sat)06:59:06', 'name': 'Anonymous', 'com': '<a href=""#p28698253"" class=""quotelink"">&gt;&gt;28698253</a><br>Not who you’re replying to but imagining full hard swing to balls while cumming is unf', 'time': 1670673546, 'resto': 28683782}, {'no': 28698292, 'now': '12/10/22(Sat)06:59:57', 'name': 'Anonymous', 'com': '<a href=""#p28684851"" class=""quotelink"">&gt;&gt;28684851</a><br>fucking goals', 'time': 1670673597, 'resto': 28683782}, {'no': 28698355, 'now': '12/10/22(Sat)07:12:37', 'name': 'Anonymous', 'com': 'Just came from nipples only for the first time :3 incredible sensation desu', 'time': 1670674357, 'resto': 28683782}]",301.0,29.0,
3,28697202,12/10/22(Sat)03:45:29,Anonymous,"it&#039;s so uncanny when there are troons that are more masculine than me. in demeanor and stature. I cannot possibly understand how you people think you are able to &#039;transition&#039;. I am smaller for a man, i am visibily feminine with a small build, and even compared to women I look absolutely huge. If your chest is in the average range for men then you DEFINITELY shouldn&#039;t be trying to transition.<br><br>Don&#039;t do it. And definitely don&#039;t go on HRT if you can&#039;t already pass without it.<br><br>Oh and if you werent confused for as a girl while you were a kid then YOU DEFINITELY shouls not be transitioning.<br><br>Thank you.",1670661524852091,.jpg,809,1146,176,250,1670661929358323,1670661929,re2b8IBeMKZkSECuRS/C1g==,729789,0,0,0,its-so-uncanny-when-there-are-troons-that-are,105,7,1670674355,,"[{'no': 28698283, 'now': '12/10/22(Sat)06:57:47', 'name': 'Anonymous', 'com': '<a href=""#p28698247"" class=""quotelink"">&gt;&gt;28698247</a><br>I am sorry anon, it&#039;s just that I find a &#039;wo&#039;man who goes around &#039;fucking men&#039; to be quite suspect.<br><span class=""quote"">&gt;I literally said that I never elaborate on my transness</span><br>You would have to, eventually. Otherwise you are not trans if you don&#039;t tell anyone it. Transitioning is a social thing, and for you to be trans you would have to expect others to validate your transition.<br><br>Validation is not cheap or worthless. In fact it is a necessity. The objective of transitioning is for the acceptance of ones own identity, is it not?', 'time': 1670673467, 'resto': 28697202}, {'no': 28698313, 'now': '12/10/22(Sat)07:04:34', 'name': 'Anonymous', 'com': '<a href=""#p28698264"" class=""quotelink"">&gt;&gt;28698264</a><br>I am underweight, in fact I might have an eating disorder. Anyways I am meticulous with my grooming. I am not going to post my face because in these few posts I will invariably say something rude and I don&#039;t want my face attatched to my rude comments. If you are so interested I can post you my skincare shelf and my epilator and my tria. Of course, this doesn&#039;t make me &#039;good looking&#039;. In fact I can assure you I am quite self conscious in my appearance and consider myself tk be quite homely. But I try, I try a lot, because I care about how I look immensely.<br><a href=""#p28698282"" class=""quotelink"">&gt;&gt;28698282</a><br>Why am I retarded? Anon butted in and continued our reply chain. How was I to know they are a different person?', 'time': 1670673874, 'resto': 28697202}, {'no': 28698328, 'now': '12/10/22(Sat)07:09:46', 'name': 'Anonymous', 'com': '<a href=""#p28698313"" class=""quotelink"">&gt;&gt;28698313</a><br><span class=""quote"">&gt;butted in</span><br>This is a public discussion forum there is no such thing as butting in', 'time': 1670674186, 'resto': 28697202}, {'no': 28698339, 'now': '12/10/22(Sat)07:11:17', 'name': 'Anonymous', 'com': '<a href=""#p28698283"" class=""quotelink"">&gt;&gt;28698283</a><br>Damn, and you&#039;re talking big about echo chambers. You&#039;re soooo narrow-minded.<br>No, the purpose of me transitioning is to alleviate my dysphoria. I take HRT, it makes me feel alive, it makes me not want to blow my brains out, I feel awful on T. I&#039;ll get FFS in a couple of years, but I&#039;ll be fairly conservative. While I&#039;ll nuke that brow, I like my jaw, I like its heft. I don&#039;t want to ruin my face&#039;s proportions. I don&#039;t want to look like someone else. Social bs is a worthless spook. I completely destroyed my attachment to either gender when I did drag for nearly 8 years. I literally lived full-time for months a decade before I actually started HRT. I was done caring about this bs back then, I&#039;m not gonna start caring about it now.<br>I want to be comfortable in my own body.<br><span class=""quote"">&gt;it&#039;s just that I find a &#039;wo&#039;man who goes around &#039;fucking men&#039; to be quite suspect.</span><br>Who cares? Oh, god... I wouldn&#039;t be a top if I were such a little bitch and cared about this meaningless shit. Picrel is my last two exes.', 'filename': '20220922_080653', 'ext': '.jpg', 'w': 810, 'h': 1440, 'tn_w': 70, 'tn_h': 125, 'tim': 1670674277496252, 'time': 1670674277, 'md5': 'To8ahb8cs48rvkCiHkcgug==', 'fsize': 703735, 'resto': 28697202}, {'no': 28698354, 'now': '12/10/22(Sat)07:12:35', 'name': 'Rank 1 Boymoder', 'com': '<a href=""#p28697202"" class=""quotelink"">&gt;&gt;28697202</a><br><span class=""quote"">&gt;I cannot possibly understand how you people think you are able to &#039;transition&#039;</span><br>i dont know either<br>i did it because i&#039;d kms if i didnt transition, and life is preferable to death imo<br>it never had anything to fucking do with &quot;being a girl&quot;, i just want my body to make me want to not die. i already know i&#039;m probably the most masculine person to have started hrt at 21, but it doesn&#039;t change the fact i need it to survive<br><br>i wish these dumbass baits would fucking stop because theyre genuinely so stupid', 'time': 1670674355, 'resto': 28697202, 'trip': '!!f/khdHYHXFn'}]",100.0,6.0,
4,28698332,12/10/22(Sat)07:10:06,Anonymous,"transsexual males (that is to say a man who takes it upon himself to fulfil the feminine social role) are quite literally and without exaggeration obliged to provide, for myself, favours of an erotic and carnal quality.",images - 2022-12-10T230836.909,.jpg,501,612,204,250,1670674206786188,1670674206,vYD6Xfj+OjFXlEZvwhR6Hg==,22150,0,0,0,transsexual-males-that-is-to-say-a-man-who-takes,2,0,1670674341,,"[{'no': 28698347, 'now': '12/10/22(Sat)07:11:46', 'name': 'Anonymous', 'com': '<a href=""#p28698332"" class=""quotelink"">&gt;&gt;28698332</a><br><span class=""quote"">&gt;transsexual males (that is to say a man who takes it upon himself to fulfil the feminine social role)</span><br>I think the word you&#039;re looking for is hrt femboy. Transsexual male means FTM.', 'time': 1670674306, 'resto': 28698332}, {'no': 28698353, 'now': '12/10/22(Sat)07:12:21', 'name': 'Anonymous', 'com': '<a href=""#p28698332"" class=""quotelink"">&gt;&gt;28698332</a><br>Fuck off you aids ridden faggot', 'time': 1670674341, 'resto': 28698332}]",,,
5,28693953,12/09/22(Fri)21:25:57,bich ass,"old <a href=""/lgbt/thread/28690827#p28690827"" class=""quotelink"">&gt;&gt;28690827</a>",mackesons,.jpg,277,283,244,249,1670639157951901,1670639157,akM0tbd1tsKKw6VbadqenQ==,15054,0,0,0,gaygen-gay-general,183,30,1670674331,/gaygen/ gay general,"[{'no': 28698275, 'now': '12/10/22(Sat)06:55:37', 'name': 'Anonymous', 'com': '<span class=""quote"">&gt;pick up qt with a phat ass at the club</span><br><span class=""quote"">&gt;undress</span><br><span class=""quote"">&gt;he&#039;s wearing this little number</span><br><br>wdyd', 'filename': '6eb8d881bc8ce4966af7e9da50788d4a', 'ext': '.jpg', 'w': 1024, 'h': 1024, 'tn_w': 125, 'tn_h': 125, 'tim': 1670673337340727, 'time': 1670673337, 'md5': 'brjYgbyM5JZq9+naUHiNSg==', 'fsize': 171129, 'resto': 28693953}, {'no': 28698291, 'now': '12/10/22(Sat)06:59:51', 'name': 'Anonymous', 'com': '<a href=""#p28698275"" class=""quotelink"">&gt;&gt;28698275</a><br>Not go for white or Asian guys in the first place because they have no ass', 'time': 1670673591, 'resto': 28693953}, {'no': 28698329, 'now': '12/10/22(Sat)07:09:53', 'name': 'Anonymous', 'com': '<a href=""#p28698291"" class=""quotelink"">&gt;&gt;28698291</a><br>but when you saw him, clothed, in the club you thought he did have an ass. you were mesmerized by his ass.', 'time': 1670674193, 'resto': 28693953}, {'no': 28698346, 'now': '12/10/22(Sat)07:11:43', 'name': 'Anonymous', 'com': 'FTM porn is so hot if you pretend that it&#039;s a man that magically got his pp tranformed into a vagene. But when you realise that these are mutated women it gets so gross', 'time': 1670674303, 'resto': 28693953}, {'no': 28698352, 'now': '12/10/22(Sat)07:12:11', 'name': 'Anonymous', 'com': '<a href=""#p28693992"" class=""quotelink"">&gt;&gt;28693992</a><br><span class=""quote"">&gt;Work your way up the ladder</span><br>how would that even work with sex? do you get referrals?', 'time': 1670674331, 'resto': 28693953}]",178.0,29.0,!!76tb4JwDFLO
6,28696516,12/10/22(Sat)02:31:20,Anonymous,"I love it when I see a guy who is stereotypically masculine who is pro-trans.<br>Usually when I see these guys I am reserved, I get scared and wary thinking they are gonna be like some conservative frat boy who hates me. Then when they surprise me and are pro trans I get really happy and feel safe and protected and instantly start looking up to them like a brother figure, it&#039;s like a sign that there are good men out there who will protect us and love us and we need more of it",1667235045018187,.gif,319,500,159,250,1670657480152909,1670657480,IuhUTNhJTX5jdAMbFbOAMw==,925556,0,0,0,i-love-it-when-i-see-a-guy-who-is-stereotypically,12,2,1670674325,,"[{'no': 28697051, 'now': '12/10/22(Sat)03:25:48', 'name': 'Anonymous', 'com': 'I would literally nut in tranny ass how much more pro-trans could I get', 'time': 1670660748, 'resto': 28696516}, {'no': 28697197, 'now': '12/10/22(Sat)03:45:04', 'name': 'Anonymous', 'com': '<a href=""#p28696994"" class=""quotelink"">&gt;&gt;28696994</a><br>this actually, the really tall conventionally attractive guys tend to be really nice to me, way more than on average for some reason', 'time': 1670661904, 'resto': 28696516}, {'no': 28697282, 'now': '12/10/22(Sat)03:57:18', 'name': 'Anonymous', 'com': '<a href=""#p28697010"" class=""quotelink"">&gt;&gt;28697010</a><br>This. Don&#039;t get me wrong I am just a 6ft chubby nerd type but I was always affirmed in the fact that I was born to be a father and a caretaker by anyone that knew me well enough to tell. And honestly it is good enough for me in terms of masculine identity.', 'filename': '1652132596228', 'ext': '.png', 'w': 500, 'h': 500, 'tn_w': 125, 'tn_h': 125, 'tim': 1670662638517522, 'time': 1670662638, 'md5': '+1mCOtCInO0rP8AiYDWazw==', 'fsize': 399506, 'resto': 28696516}, {'no': 28697549, 'now': '12/10/22(Sat)04:37:48', 'name': 'Anonymous', 'com': '<a href=""#p28696516"" class=""quotelink"">&gt;&gt;28696516</a><br>it&#039;s nice to know the chaser grooming tactics are paying dividends', 'time': 1670665068, 'resto': 28696516}, {'no': 28698351, 'now': '12/10/22(Sat)07:12:05', 'name': 'Anonymous', 'com': '<a href=""#p28696516"" class=""quotelink"">&gt;&gt;28696516</a><br>anytime i meet someone like that i INSTANTLY want them to fuck me.', 'time': 1670674325, 'resto': 28696516}]",7.0,1.0,
7,28694063,12/09/22(Fri)21:34:47,Anonymous,Do you pass to AI?,1670622710363595,.png,758,1023,185,250,1670639687954101,1670639687,TZ2jOFFWBeRRdfTu13dvhg==,1022627,0,0,0,do-you-pass-to-ai,54,16,1670674322,,"[{'no': 28696633, 'now': '12/10/22(Sat)02:43:25', 'name': 'Anonymous', 'com': '<a href=""#p28695588"" class=""quotelink"">&gt;&gt;28695588</a><br><span class=""quote"">&gt;stacy to chad</span>', 'time': 1670658205, 'resto': 28694063}, {'no': 28696646, 'now': '12/10/22(Sat)02:44:35', 'name': 'Anonymous', 'com': '<a href=""#p28695584"" class=""quotelink"">&gt;&gt;28695584</a><br><span class=""quote"">&gt;supplied by my ISP</span><br>lmao maybe dont be a stupid goyim', 'time': 1670658275, 'resto': 28694063}, {'no': 28697625, 'now': '12/10/22(Sat)04:49:23', 'name': 'Anonymous', 'com': '<a href=""#p28695588"" class=""quotelink"">&gt;&gt;28695588</a><br>can we see what the second pic looked like originally :}', 'time': 1670665763, 'resto': 28694063}, {'no': 28697934, 'now': '12/10/22(Sat)05:47:18', 'name': 'Anonymous', 'com': '<a href=""#p28694773"" class=""quotelink"">&gt;&gt;28694773</a><br><a href=""#p28694143"" class=""quotelink"">&gt;&gt;28694143</a><br>lmao', 'time': 1670669238, 'resto': 28694063}, {'no': 28698350, 'now': '12/10/22(Sat)07:12:02', 'name': 'Anonymous', 'com': 'Meaningless validation from an ai', 'filename': '14db01c2-7376-11ed-853f-5254002b5c60', 'ext': '.jpg', 'w': 1000, 'h': 930, 'tn_w': 125, 'tn_h': 116, 'tim': 1670674322742935, 'time': 1670674322, 'md5': 'xhAe2n6VX40qGynHLnv3cA==', 'fsize': 224136, 'resto': 28694063}]",49.0,15.0,
8,28695105,12/09/22(Fri)23:36:49,Anonymous,Why does this board have the least amount of retarded antivaxxers on this site? It&#039;s nice to not have schizos screaming about muh clot shot. Why is nu-4chan like this anyway?,1667372046288289,.gif,610,640,238,250,1670647009418526,1670647009,hBRycHSYn7KcHjZx2UggeQ==,4043280,0,0,0,why-does-this-board-have-the-least-amount-of,62,8,1670674315,,"[{'no': 28698204, 'now': '12/10/22(Sat)06:42:01', 'name': 'Anonymous', 'com': '<a href=""#p28695143"" class=""quotelink"">&gt;&gt;28695143</a><br><a href=""#p28695300"" class=""quotelink"">&gt;&gt;28695300</a>', 'filename': 'left side pepe', 'ext': '.jpg', 'w': 1920, 'h': 1080, 'tn_w': 125, 'tn_h': 70, 'tim': 1670672521175716, 'time': 1670672521, 'md5': 'xL9yIY3g1k22lHDLxQHzfQ==', 'fsize': 93144, 'resto': 28695105}, {'no': 28698237, 'now': '12/10/22(Sat)06:47:36', 'name': 'Anonymous', 'com': '<a href=""#p28696709"" class=""quotelink"">&gt;&gt;28696709</a><br>Imagine being this confident and yet this wrong about the statistics.<br><br>Excess deaths are up, yes, but they are down dramatically almost everywhere in the world from the last two years. Right now, there&#039;s no real relationship to be drawn between the people who are facing excess mortality and those who are vaxed. I haven&#039;t seen statistics showing that vaccinated people are overrepresented here. Everyone says that they are, but then when asked for proof they quietly shut the fuck up because they don&#039;t have any and they&#039;re just braindead repeating talking points they don&#039;t know shit about.<br><br>Third, holy fuck, for people who were HYPER sceptical of every death during the pandemic and needed to have evidence of every single life beyond a single shred of doubt that the death was caused by covid, people sure are fucking quick to attribute literally every death post-covid to the vaccine. It is insane how quickly that scepticism faded just because you&#039;ve got biases to confirm now.<br><br>Basically, if you&#039;re not familiar with the statistics and all you&#039;re doing is repeating dipshit talking points from retards on the internet, just shut the fuck up and stop posting because you&#039;re embarrassing yourself.', 'time': 1670672856, 'resto': 28695105}, {'no': 28698293, 'now': '12/10/22(Sat)07:00:02', 'name': 'Anonymous', 'com': '<a href=""#p28695171"" class=""quotelink"">&gt;&gt;28695171</a>', 'filename': 'schizo med', 'ext': '.png', 'w': 534, 'h': 248, 'tn_w': 125, 'tn_h': 58, 'tim': 1670673602405923, 'time': 1670673602, 'md5': 'yKX+gD0VWhvj9SSppxL1jg==', 'fsize': 19066, 'resto': 28695105}, {'no': 28698306, 'now': '12/10/22(Sat)07:03:38', 'name': 'Anonymous', 'com': '<a href=""#p28696008"" class=""quotelink"">&gt;&gt;28696008</a><br>it&#039;s a textbook dunning kruger, too dumb to realize how dumb he is', 'time': 1670673818, 'resto': 28695105}, {'no': 28698349, 'now': '12/10/22(Sat)07:11:55', 'name': 'Anonymous', 'com': '<a href=""#p28696331"" class=""quotelink"">&gt;&gt;28696331</a><br><span class=""quote"">&gt;immunoglobulins</span><br>bold of you to assume the average 4chan tard knows what those are', 'time': 1670674315, 'resto': 28695105}]",57.0,6.0,
9,28698303,12/10/22(Sat)07:03:24,Anonymous,"trannies that are exclusively attracted to women, are you comfortable with calling yourself a lesbian?<br>personally i would rather kill myself than call my gigahon self a &#039;lesbian&#039; or anything like that, it seems so painfully unaware of what i am, which is essentially just a straight dude.",sadd,.jpg,512,512,250,250,1670673804503037,1670673804,jJ4x4jgCmj2p7gv17TTdvA==,57733,0,0,0,trannies-that-are-exclusively-attracted-to-women,2,0,1670674310,,"[{'no': 28698323, 'now': '12/10/22(Sat)07:07:16', 'name': 'Anonymous', 'com': '<a href=""#p28698303"" class=""quotelink"">&gt;&gt;28698303</a><br><span class=""quote"">&gt;it seems so painfully unaware of what i am, which is essentially just a straight dude.</span><br>Just drop the “essentially” and you’re 100% right', 'time': 1670674036, 'resto': 28698303}, {'no': 28698348, 'now': '12/10/22(Sat)07:11:50', 'name': 'Anonymous', 'com': 'i just call myself gynephilic or bi (which is a complete cope, i&#039;m barely meta attracted). i feel incredibly gross being attracted to women and i will never call myself a lesbian. i often post anti transbian hate here to make sure of that. there&#039;s just way too many dangerous or creepy transbians and i refuse to be part of the problem.', 'time': 1670674310, 'resto': 28698303}]",,,
10,28698076,12/10/22(Sat)06:14:39,Anonymous,Thoughts on f1nn5ster?,1635538424806,.jpg,1920,1080,250,140,1670670879026598,1670670879,J/47ikcRX/qMBYPjkWbJfw==,630954,0,0,0,thoughts-on-f1nn5ster,8,0,1670674300,,"[{'no': 28698260, 'now': '12/10/22(Sat)06:52:36', 'name': 'Anonymous', 'com': '<a href=""#p28698076"" class=""quotelink"">&gt;&gt;28698076</a><br>honestly he is not that attractive <br><br>This simping for money online is disgusting. Ewww. Just not attractive. Worse than a conventional whore.', 'time': 1670673156, 'resto': 28698076}, {'no': 28698269, 'now': '12/10/22(Sat)06:54:30', 'name': 'Anonymous', 'com': '<a href=""#p28698260"" class=""quotelink"">&gt;&gt;28698260</a><br><span class=""quote"">&gt;honestly he is not that attractive</span><br>I have to disagree. If he became a woman he would be 10/10.', 'time': 1670673270, 'resto': 28698076}, {'no': 28698281, 'now': '12/10/22(Sat)06:56:40', 'name': 'Anonymous', 'com': '<a href=""#p28698269"" class=""quotelink"">&gt;&gt;28698269</a><br>He is overall quite manly and the simping for money makes him undesirable <br><br>Also have you seen his porn?<br><br>Not very great<br><br>Best tranny porn is still from Brazil (shemale samba mania, Transsexual heartbreakers) and Finn is not even close.', 'time': 1670673400, 'resto': 28698076}, {'no': 28698286, 'now': '12/10/22(Sat)06:58:16', 'name': 'Anonymous', 'com': '<a href=""#p28698281"" class=""quotelink"">&gt;&gt;28698281</a><br><span class=""quote"">&gt;Also have you seen his porn?</span><br>Honestly no. I only found out who he was recently.', 'time': 1670673496, 'resto': 28698076}, {'no': 28698345, 'now': '12/10/22(Sat)07:11:40', 'name': 'Anonymous', 'com': '<a href=""#p28698281"" class=""quotelink"">&gt;&gt;28698281</a><br>I think the attractive may come from him being attainable. Like how fat girls get more tindr swipes. A sexy brazillian just wants a favela drug dealer', 'time': 1670674300, 'resto': 28698076}]",3.0,0.0,
11,28696820,12/10/22(Sat)03:02:23,Anonymous,"is watching sports malebrained, i unironically like footie...<br>should i keep it a secret to people",1669032341292766,.jpg,1125,977,250,217,1670659343023196,1670659343,6j9BSQKK/0zebu/z5rN9RA==,581715,0,0,0,is-watching-sports-malebrained-i-unironically,18,1,1670674296,,"[{'no': 28697127, 'now': '12/10/22(Sat)03:35:26', 'name': 'Anonymous', 'com': '<a href=""#p28696820"" class=""quotelink"">&gt;&gt;28696820</a><br>soccer is literally the gayest thing you could watch that doesn&#039;t graphically depict penises. the entire point of sports is to give agps examples of the type of men who they want to fantasize about fucking them, heteronormie cismen don&#039;t watch sports, only raging repressers do', 'filename': 'selfie', 'ext': '.jpg', 'w': 982, 'h': 655, 'tn_w': 125, 'tn_h': 83, 'tim': 1670661326955058, 'time': 1670661326, 'md5': 'we00GAzGqEetG670vvFQ/Q==', 'fsize': 114277, 'resto': 28696820}, {'no': 28697154, 'now': '12/10/22(Sat)03:39:23', 'name': 'Anonymous', 'com': '<a href=""#p28697094"" class=""quotelink"">&gt;&gt;28697094</a><br><span class=""quote"">&gt;That&#039;s very much not true.</span><br>Lmao thanks for making me laugh', 'time': 1670661563, 'resto': 28696820}, {'no': 28697251, 'now': '12/10/22(Sat)03:52:14', 'name': 'Anonymous', 'com': 'I want to joke about how it&#039;s malebrained but really it&#039;s fair for you to be insecure about this', 'time': 1670662334, 'resto': 28696820}, {'no': 28697293, 'now': '12/10/22(Sat)03:59:39', 'name': 'Anonymous', 'com': '<a href=""#p28697251"" class=""quotelink"">&gt;&gt;28697251</a><br>*not fair', 'time': 1670662779, 'resto': 28696820}, {'no': 28698344, 'now': '12/10/22(Sat)07:11:36', 'name': 'Anonymous', 'com': '<a href=""#p28696820"" class=""quotelink"">&gt;&gt;28696820</a><br>A lot of girls actually like football.<br>A lot of boys actually dislike football.', 'time': 1670674296, 'resto': 28696820}]",13.0,0.0,
12,28698343,12/10/22(Sat)07:11:35,Anonymous,,images - 2022-12-10T091026.074,.jpg,479,641,186,250,1670674295647585,1670674295,t70iLGcP7GuQoaAM3xgQGA==,40571,0,0,0,fellow-transbianshow-do-we-break-through-the,0,0,1670674295,"fellow transbians,how do we break through the cotton ceilling?",,,,
13,28698342,12/10/22(Sat)07:11:26,Anonymous,Laura Les is so beautiful,tumblr_07bffc889d0666250cf1aadc6c58e223_dcda029e_1280,.jpg,786,534,250,169,1670674286987293,1670674286,YIcIrU7WgwwPJWuEFu8B6w==,71922,0,0,0,laura-les-is-so-beautiful,0,0,1670674286,,,,,
14,28688215,12/09/22(Fri)12:02:54,Anonymous,ftms how would you have sex with a mtf ideally,interesting,.png,661,523,249,197,1670605374163831,1670605374,qPXiPBzB9O36yH2fbKs7cA==,95542,0,0,0,ftms-how-would-you-have-sex-with-a-mtf-ideally,60,3,1670674278,,"[{'no': 28697884, 'now': '12/10/22(Sat)05:38:42', 'name': 'Anonymous', 'com': '<a href=""#p28697823"" class=""quotelink"">&gt;&gt;28697823</a><br>Nah, the best sex I had with a trans dude was basically just him humping &amp; groping me while we made out. Not gonna go into detail but it was perfect', 'time': 1670668722, 'resto': 28688215}, {'no': 28697927, 'now': '12/10/22(Sat)05:46:24', 'name': 'Anonymous', 'com': '<a href=""#p28694265"" class=""quotelink"">&gt;&gt;28694265</a><br>I want both, to use the strap and piv', 'time': 1670669184, 'resto': 28688215}, {'no': 28698312, 'now': '12/10/22(Sat)07:04:33', 'name': 'Anonymous', 'com': '<a href=""#p28694265"" class=""quotelink"">&gt;&gt;28694265</a><br>Go cry about it incel', 'time': 1670673873, 'resto': 28688215}, {'no': 28698321, 'now': '12/10/22(Sat)07:06:53', 'name': 'Anonymous', 'com': '<a href=""#p28690388"" class=""quotelink"">&gt;&gt;28690388</a><br>why did you reply with this image lmao wtf', 'time': 1670674013, 'resto': 28688215}, {'no': 28698340, 'now': '12/10/22(Sat)07:11:18', 'name': 'Anonymous', 'com': '<a href=""#p28689974"" class=""quotelink"">&gt;&gt;28689974</a><br>holy based', 'time': 1670674278, 'resto': 28688215}]",55.0,3.0,
