,no,now,name,com,filename,ext,w,h,tn_w,tn_h,tim,time,md5,fsize,resto,bumplimit,imagelimit,semantic_url,replies,images,last_modified,sub,last_replies,omitted_posts,omitted_images,trip
36,28673003,12/08/22(Thu)10:21:24,Anonymous,"Previous thread:<br><a href=""/lgbt/thread/28603326#p28603326"" class=""quotelink"">&gt;&gt;28603326</a><br><br>Comics we know of, all of which are named Kaito Shuno<br><span class=""quote"">&gt;https://cryptpad.fr/code/#/2/code/<wbr>edit/u9WMp8xnWArb0-xZ7ljJAjaa/</span><br>Read-only link for sharing:<br><span class=""quote"">&gt;https://cryptpad.fr/code/#/2/code/<wbr>view/Mr+SCan-wtlJ2lJGQ4iKAXerD5iSgI<wbr>3MseRF0hUoR24/present/</span><br>I don&#039;t care about the story as long as she draws porn<br><span class=""quote"">&gt;https://cryptpad.fr/code/#/2/code/<wbr>edit/StsXhwzarK-GGDG3P2GvlP6a/</span><br>Read-only link for sharing:<br><span class=""quote"">&gt;https://cryptpad.fr/code/#/2/code/<wbr>view/iiU2+aw-U3ZC2OX+PyCBUckUdxO+qw<wbr>4thCGv2t5G5ro/present/</span><br>Feel free to recommend new webcomics not in the cryptpad, but don&#039;t be lazy, please include:<br><span class=""quote"">&gt;Name of comic</span><br><span class=""quote"">&gt;Link to it</span><br><span class=""quote"">&gt;Short description</span><br><span class=""quote"">&gt;Whether or not it&#039;s NSFW</span><br><span class=""quote"">&gt;Days it updates.</span><br>If you&#039;re not sure if a comic belongs here because maybe it&#039;s not LGBT enough, post updates anyway. We won&#039;t know about it if no one posts it!<br>If you see something wrong in the cryptad, just edit it! Hoorray",why did they even invite me to this party,.jpg,845,840,250,248,1670512884479778,1670512884,HtTfObHrrircrh+hp4ueDQ==,171693,0,0,0,wcg-webcomics-general,59,22,1670673178,/wcg/ - Webcomics General,"[{'no': 28693535, 'now': '12/09/22(Fri)20:55:05', 'name': 'Exorcism Academy', 'com': '<a href=""#p28693020"" class=""quotelink"">&gt;&gt;28693020</a><br>She had a baby.', 'time': 1670637305, 'resto': 28673003}, {'no': 28694885, 'now': '12/09/22(Fri)23:14:18', 'name': 'Exorcism Academy', 'com': '<a href=""#p28693020"" class=""quotelink"">&gt;&gt;28693020</a><br>Looks like she is posting on Deviant Art.<br>https://www.deviantart.com/the-obsi<wbr>dian-mirror/gallery/33400294/comic-<wbr>pages', 'filename': 'said the spider to ...', 'ext': '.jpg', 'w': 900, 'h': 1273, 'tn_w': 88, 'tn_h': 125, 'tim': 1670645658099601, 'time': 1670645658, 'md5': 'F/aZyyuvqkzq9IvbLaUabQ==', 'fsize': 202397, 'resto': 28673003}, {'no': 28695402, 'now': '12/10/22(Sat)00:10:12', 'name': 'Anonymous', 'com': '<a href=""#p28694885"" class=""quotelink"">&gt;&gt;28694885</a><br>the world needs more twinks in loincloths', 'time': 1670649012, 'resto': 28673003}, {'no': 28696621, 'now': '12/10/22(Sat)02:42:28', 'name': 'Anonymous', 'com': '<a href=""#p28695402"" class=""quotelink"">&gt;&gt;28695402</a><br>world needs more twinks', 'time': 1670658148, 'resto': 28673003}, {'no': 28698262, 'now': '12/10/22(Sat)06:52:58', 'name': 'Anonymous', 'com': '<a href=""#p28694885"" class=""quotelink"">&gt;&gt;28694885</a><br><span class=""quote"">&gt;mature content, log in to view</span><br>ree.', 'time': 1670673178, 'resto': 28673003}]",54.0,21.0,
37,28698113,12/10/22(Sat)06:22:19,Anonymous,What are the chances the attacks on drag shows and gender clinics are really the feds setting up the gross right wing nut jobs to go to jail? It just seems too ridiculous to be otherwise. what sort of loon would want to go nuts over kids going to a drag show.,2022-12-06,.jpg,1250,423,250,84,1670671339354742,1670671339,KCO3XSpX6DXRO50MEWRvrQ==,147363,0,0,0,what-are-the-chances-the-attacks-on-drag-shows,8,2,1670673081,,"[{'no': 28698153, 'now': '12/10/22(Sat)06:31:57', 'name': 'Anonymous', 'com': 'spend like 15 minutes browsing every board on this site and then let&#039;s apply occam&#039;s razor here', 'time': 1670671917, 'resto': 28698113}, {'no': 28698173, 'now': '12/10/22(Sat)06:35:40', 'name': 'Anonymous', 'com': 'why would feds want to put right wingers in jail? right wingers are who do all their muscle work', 'time': 1670672140, 'resto': 28698113}, {'no': 28698222, 'now': '12/10/22(Sat)06:45:08', 'name': 'Anonymous', 'com': '<a href=""#p28698113"" class=""quotelink"">&gt;&gt;28698113</a><br>Whatever makes pol look bad is a discord raid or a glowie psyop. They never take accountability.', 'filename': '1652239587416', 'ext': '.jpg', 'w': 1440, 'h': 1058, 'tn_w': 125, 'tn_h': 91, 'tim': 1670672708635881, 'time': 1670672708, 'md5': 'dZmRKq0BrA6kV7nP8cbJZw==', 'fsize': 257599, 'resto': 28698113}, {'no': 28698233, 'now': '12/10/22(Sat)06:46:59', 'name': 'beanie', 'com': '<a href=""#p28698222"" class=""quotelink"">&gt;&gt;28698222</a><br>Lmao coward chuds', 'time': 1670672819, 'resto': 28698113, 'trip': '!!tKh3CCKWQb5'}, {'no': 28698254, 'now': '12/10/22(Sat)06:51:21', 'name': 'Anonymous', 'com': '<a href=""#p28698233"" class=""quotelink"">&gt;&gt;28698233</a><br>It&#039;s also important to remember that pol is indeed not one person, so of course people who would actually have to answer any kind of accusation just choose to not reply to the thread while those who have a clear conscience respond for an easy win', 'time': 1670673081, 'resto': 28698113}]",3.0,1.0,
38,28689926,12/09/22(Fri)15:05:12,Anonymous,"It&#039;s Friday. Make friends! <br><br><span class=""quote"">&gt;A/S/L</span><br><span class=""quote"">&gt;Sexuality</span><br><span class=""quote"">&gt;About me</span><br><span class=""quote"">&gt;hobbies/interests</span><br><span class=""quote"">&gt;looking for</span><br><span class=""quote"">&gt;not looking for</span><br><span class=""quote"">&gt;tag</span>",636e0a6a49cf127bf92de1e2_icon_clyde_blurple_RGB,.png,619,470,249,189,1670616312983672,1670616312,10hl4QlPWsCg54KHVEn/Zg==,10386,0,0,0,frengen,48,19,1670673069,/frengen/,"[{'no': 28698108, 'now': '12/10/22(Sat)06:21:11', 'name': 'Anonymous', 'com': '<a href=""#p28696004"" class=""quotelink"">&gt;&gt;28696004</a><br><span class=""quote"">&gt;Wickr me:</span><br>wickr is shutting down in 2 1/2 weeks, also that app is super cringe. get disc and I&#039;ll give you some swedish bussy', 'time': 1670671271, 'resto': 28689926}, {'no': 28698124, 'now': '12/10/22(Sat)06:24:48', 'name': 'Anonymous', 'com': '<a href=""#p28698108"" class=""quotelink"">&gt;&gt;28698108</a><br>I&#039;m aware. I tried today to install discord. I did install it. Then my account was locked before I could even send a single message', 'filename': 'Screenshot from 2022-12-10 05-06-53', 'ext': '.png', 'w': 650, 'h': 203, 'tn_w': 125, 'tn_h': 39, 'tim': 1670671488499999, 'time': 1670671488, 'md5': '25RlCiERFX2BrmwYstNaXQ==', 'fsize': 17847, 'resto': 28689926}, {'no': 28698131, 'now': '12/10/22(Sat)06:25:51', 'name': 'Anonymous', 'com': '<a href=""#p28698108"" class=""quotelink"">&gt;&gt;28698108</a><br><span class=""quote"">&gt;swedish bussy</span><br>you will? Hot! Why dont you send me a message on Wickr and I will give you my personal phone number', 'time': 1670671551, 'resto': 28689926}, {'no': 28698159, 'now': '12/10/22(Sat)06:33:11', 'name': 'Anonymous', 'com': '<a href=""#p28698131"" class=""quotelink"">&gt;&gt;28698131</a><br>pass', 'time': 1670671991, 'resto': 28689926}, {'no': 28698252, 'now': '12/10/22(Sat)06:51:09', 'name': 'Anonymous', 'com': '<a href=""#p28698159"" class=""quotelink"">&gt;&gt;28698159</a><br>can&#039;t help you then. Have fun on discord though', 'time': 1670673069, 'resto': 28689926}]",43.0,18.0,
39,28696607,12/10/22(Sat)02:41:28,Anonymous,"For trannies that still have facial hair, what the hell do you do to your side burns so they look natural and not like there was clearly beard there?",image,.png,275,374,183,250,1670658088080081,1670658088,jlbfSJ+Y5BAszCvpn2pYEA==,159054,0,0,0,for-trannies-that-still-have-facial-hair-what-the,9,1,1670672849,,"[{'no': 28696875, 'now': '12/10/22(Sat)03:06:32', 'name': 'Anonymous', 'com': '<a href=""#p28696607"" class=""quotelink"">&gt;&gt;28696607</a><br>I had a really dark moustache and beard, but no side burns or anything. At least not enough to be visible. Still finishing laser, but the only thing you can do is pluck them, or apply make up. Plucking isn&#039;t good either.<br><br>At least if an against the grain shave wont do the trick &gt;.&gt;<br>Like what about the rest of your face... it must be worse than the side burns right? Dont manmode?', 'time': 1670659592, 'resto': 28696607}, {'no': 28697227, 'now': '12/10/22(Sat)03:48:57', 'name': 'Anonymous', 'com': 'nobody pays attention to this. seriously.', 'time': 1670662137, 'resto': 28696607}, {'no': 28697238, 'now': '12/10/22(Sat)03:50:25', 'name': 'Anonymous', 'com': '<a href=""#p28696857"" class=""quotelink"">&gt;&gt;28696857</a><br>same', 'time': 1670662225, 'resto': 28696607}, {'no': 28697357, 'now': '12/10/22(Sat)04:10:10', 'name': 'Anonymous', 'com': '<a href=""#p28696875"" class=""quotelink"">&gt;&gt;28696875</a><br>I&#039;m not talking about shadow, I&#039;m talking about how to shape them in a way that looks natural and has a fem shape.', 'time': 1670663410, 'resto': 28696607}, {'no': 28698236, 'now': '12/10/22(Sat)06:47:29', 'name': 'Anonymous', 'com': '<a href=""#p28696607"" class=""quotelink"">&gt;&gt;28696607</a><br>Shave them up to the hair line. It’s not uncommon for insecure cis women to do if they have burns', 'time': 1670672849, 'resto': 28696607}]",4.0,1.0,
40,28696163,12/10/22(Sat)01:48:23,Anonymous,Daily reminder that this is the average nu-4chan poster. The person calling you a mentally ill groomer is a neo-nazi loser living with his parents masturbating to 2D child pornography every day during breaks from posting about being a pureblooded unvaccinated white teutonic knight.,1648454170955,.png,2942,928,249,78,1670654903573505,1670654903,dFLHfdY20nQqlIH8qe6tow==,1380781,0,0,0,daily-reminder-that-this-is-the-average-nu4chan,13,0,1670672786,,"[{'no': 28696534, 'now': '12/10/22(Sat)02:33:08', 'name': 'Anonymous', 'com': '<a href=""#p28696504"" class=""quotelink"">&gt;&gt;28696504</a><br><span class=""quote"">&gt;In europe during the 70s and before you can purchase nudie mags with 12 year old girls in front of them</span><br>In Europe in the 1800s parents would sign their 9 year olds into indentured servitude to sweep chimneys and they would get stuck in there and die or get burned to death', 'time': 1670657588, 'resto': 28696163}, {'no': 28696550, 'now': '12/10/22(Sat)02:34:53', 'name': 'Anonymous', 'com': '<a href=""#p28696534"" class=""quotelink"">&gt;&gt;28696534</a><br><span class=""quote"">&gt;In Europe in the 1800s parents would sign their 9 year olds into indentured servitude to sweep chimneys and they would get stuck in there and die or get burned to death</span><br>Yeah child pornography is the lesser of two evils no doubt.', 'time': 1670657693, 'resto': 28696163}, {'no': 28696556, 'now': '12/10/22(Sat)02:36:04', 'name': 'Anonymous', 'com': '<a href=""#p28696550"" class=""quotelink"">&gt;&gt;28696550</a><br>how about we don&#039;t put children to work in any industry including pornography you fucktarded libertarian', 'time': 1670657764, 'resto': 28696163}, {'no': 28696580, 'now': '12/10/22(Sat)02:38:42', 'name': 'Anonymous', 'com': '<a href=""#p28696556"" class=""quotelink"">&gt;&gt;28696556</a><br><span class=""quote"">&gt;how about we</span><br>Then go and put in the effort instead of complaining about reality. Sitting here moping and complaining isn&#039;t going to get you anywhere.', 'time': 1670657922, 'resto': 28696163}, {'no': 28698228, 'now': '12/10/22(Sat)06:46:26', 'name': 'Anonymous', 'com': '<a href=""#p28696504"" class=""quotelink"">&gt;&gt;28696504</a><br><span class=""quote"">&gt;Anyway children are hot</span><br>As expected from someone that defends fapping to children', 'time': 1670672786, 'resto': 28696163}]",8.0,0.0,
41,28697656,12/10/22(Sat)04:53:57,Anonymous,"<span class=""quote"">&gt;cis guy, spent a year in California</span><br><span class=""quote"">&gt;Silicon Valley is basically a StoneToss away</span><br><span class=""quote"">&gt;haven&#039;t seen (clocked) a single tranny</span><br>and ttttranners think I am hugboxxing when I say they pass.",1651903869611,.png,759,477,250,157,1670666037726370,1670666037,wzJQAjQ2fB5dkzXBW+c1ew==,480712,0,0,0,where-were-all-the-silicon-trannies,4,0,1670672769,Where were all the Silicon Trannies?,"[{'no': 28697707, 'now': '12/10/22(Sat)05:04:50', 'name': 'Anonymous', 'com': '<a href=""#p28697656"" class=""quotelink"">&gt;&gt;28697656</a><br>they can smell chasers from a mile away. good luck lil bro', 'time': 1670666690, 'resto': 28697656}, {'no': 28697715, 'now': '12/10/22(Sat)05:06:02', 'name': 'Anonymous', 'com': '<a href=""#p28697707"" class=""quotelink"">&gt;&gt;28697707</a><br>I don&#039;t actually chase but I have never seen one IRL trannies are unicorns', 'time': 1670666762, 'resto': 28697656}, {'no': 28697942, 'now': '12/10/22(Sat)05:48:59', 'name': 'Anonymous', 'com': 'Even in places like that they&#039;re only a couple percent of the population, plus on that tech salary they can afford FFS so they actually get to pass too.', 'time': 1670669339, 'resto': 28697656}, {'no': 28698227, 'now': '12/10/22(Sat)06:46:09', 'name': 'Anonymous', 'com': '<a href=""#p28697942"" class=""quotelink"">&gt;&gt;28697942</a><br>yeah the wages here are something', 'time': 1670672769, 'resto': 28697656}]",,,
42,28696389,12/10/22(Sat)02:18:08,Anonymous,why am i the only one that thinks scars are hot? i feel like most guys would think i&#039;m insane,2B7956D9-4D9B-4E7B-88BA-2CC733D19EF3,.png,500,242,250,121,1670656688984010,1670656688,QQ08m+RFOD4vl+n8sCCtGA==,89901,0,0,0,why-am-i-the-only-one-that-thinks-scars-are-hot-i,20,1,1670672752,,"[{'no': 28697114, 'now': '12/10/22(Sat)03:33:47', 'name': 'Anonymous', 'com': '<a href=""#p28696389"" class=""quotelink"">&gt;&gt;28696389</a><br>Thoughts?', 'filename': 'IMG_20221210_023121', 'ext': '.jpg', 'w': 3000, 'h': 3422, 'tn_w': 109, 'tn_h': 125, 'tim': 1670661227906085, 'time': 1670661227, 'md5': '9NUoR2rM/tvUnsW6Tbs5tQ==', 'fsize': 3111474, 'resto': 28696389}, {'no': 28697134, 'now': '12/10/22(Sat)03:36:14', 'name': 'Anonymous', 'com': '<a href=""#p28697114"" class=""quotelink"">&gt;&gt;28697114</a><br>pretty cute', 'time': 1670661374, 'resto': 28696389}, {'no': 28698176, 'now': '12/10/22(Sat)06:36:53', 'name': 'Anonymous', 'com': '<a href=""#p28696460"" class=""quotelink"">&gt;&gt;28696460</a><br>scars are hot<br>self-harm is not', 'time': 1670672213, 'resto': 28696389}, {'no': 28698187, 'now': '12/10/22(Sat)06:38:42', 'name': 'Anonymous', 'com': '<a href=""#p28696389"" class=""quotelink"">&gt;&gt;28696389</a><br><span class=""quote"">&gt;extremely mentally ill as a kid</span><br><span class=""quote"">&gt;carved &quot;God hates me&quot; onto my dominant arm</span><br><span class=""quote"">&gt;have to wear long sleeves/arm warmers everyday because I hate them so much</span><br>If someone told me my scars were hot I&#039;d want to die instantly', 'time': 1670672322, 'resto': 28696389}, {'no': 28698225, 'now': '12/10/22(Sat)06:45:52', 'name': 'Anonymous', 'com': '<a href=""#p28698176"" class=""quotelink"">&gt;&gt;28698176</a><br>yeah i guess but scars usually come from sh<br><a href=""#p28698187"" class=""quotelink"">&gt;&gt;28698187</a><br>that sounds pretty attractive to me but i don&#039;t want to hurt your feelings so i&#039;ll just not comment any further', 'time': 1670672752, 'resto': 28696389}]",15.0,0.0,
43,28693308,12/09/22(Fri)20:37:17,Anonymous,Any gay men here who legit fell in love with a trans girl?,8a118a7ca6b4d03cef1564d9045f211c968861719,.png,650,975,166,249,1670636237534865,1670636237,pCchcjRWll38VMqMKuTDXg==,318880,0,0,0,any-gay-men-here-who-legit-fell-in-love-with-a,18,4,1670672634,,"[{'no': 28697935, 'now': '12/10/22(Sat)05:47:22', 'name': 'Anonymous', 'com': '<a href=""#p28693308"" class=""quotelink"">&gt;&gt;28693308</a><br>If they did it makes then bi, gay guys are into fem', 'time': 1670669242, 'resto': 28693308}, {'no': 28698046, 'now': '12/10/22(Sat)06:08:08', 'name': 'Anonymous', 'com': '<a href=""#p28693308"" class=""quotelink"">&gt;&gt;28693308</a><br>It&#039;s uncommon because most gays are mascfags, but it happens', 'time': 1670670488, 'resto': 28693308}, {'no': 28698080, 'now': '12/10/22(Sat)06:15:18', 'name': 'Bottomposter Archduke of Bottoms', 'com': '<a href=""#p28693308"" class=""quotelink"">&gt;&gt;28693308</a><br>I would be willing to convert to a top if a passing trans woman wanted to date me. She could be my girlfriend and we would have a normal family and shit. Tho she would have to be shorter than me.<br><br>*assuming I was single.', 'filename': 'bottom_boymoder', 'ext': '.png', 'w': 951, 'h': 506, 'tn_w': 124, 'tn_h': 66, 'tim': 1670670918934069, 'time': 1670670918, 'md5': 'nlqL/DnmhHKHenN6xjVVwA==', 'fsize': 347841, 'resto': 28693308, 'trip': '!!u7r4G6gA5SO'}, {'no': 28698160, 'now': '12/10/22(Sat)06:33:38', 'name': 'Anonymous', 'com': '<a href=""#p28698080"" class=""quotelink"">&gt;&gt;28698080</a><br>you&#039;re 31', 'time': 1670672018, 'resto': 28693308}, {'no': 28698212, 'now': '12/10/22(Sat)06:43:54', 'name': 'Bottomposter Archduke of Bottoms', 'com': '<a href=""#p28698160"" class=""quotelink"">&gt;&gt;28698160</a><br>Actually I am 31 in a few days.', 'time': 1670672634, 'resto': 28693308, 'trip': '!!u7r4G6gA5SO'}]",13.0,3.0,
44,28697493,12/10/22(Sat)04:29:03,Anonymous,What causes somebody to post shit like this?,FCDE3CEF-DF4E-4749-B960-808C79F3E55A,.jpg,1125,439,250,97,1670664543288995,1670664543,0clWYcKgfzPkk1z/6Puwmw==,183125,0,0,0,what-causes-somebody-to-post-shit-like-this,17,0,1670672537,,"[{'no': 28698134, 'now': '12/10/22(Sat)06:27:04', 'name': 'Rank 1 Boymoder', 'com': '<a href=""#p28698101"" class=""quotelink"">&gt;&gt;28698101</a><br><span class=""quote"">&gt;&gt;he tries to explain it... oh no, it&#039;s so complicated</span><br>pretty much this every time someone explains card games desu<br><br><span class=""quote"">&gt;&gt;now he wants to start to play</span><br><span class=""quote"">&gt;&gt;I didn&#039;t follow his explanation</span><br><span class=""quote"">&gt;&gt;fuck fuck fuck no no no</span><br>i usually start crying at this point actually lol', 'time': 1670671624, 'resto': 28697493, 'trip': '!!f/khdHYHXFn'}, {'no': 28698135, 'now': '12/10/22(Sat)06:27:07', 'name': 'Anonymous', 'com': '<a href=""#p28697493"" class=""quotelink"">&gt;&gt;28697493</a><br>every answer to<br><span class=""quote"">&gt;why are troons like this?</span><br>is autogynephilia', 'time': 1670671627, 'resto': 28697493}, {'no': 28698170, 'now': '12/10/22(Sat)06:35:01', 'name': 'Anonymous', 'com': '<a href=""#p28698135"" class=""quotelink"">&gt;&gt;28698135</a><br>Correct answer. Jesus Christ I wish I wasn’t attracted to women, cause these people embarrass tf out of me', 'time': 1670672101, 'resto': 28697493}, {'no': 28698177, 'now': '12/10/22(Sat)06:36:54', 'name': 'Anonymous', 'com': '<a href=""#p28697493"" class=""quotelink"">&gt;&gt;28697493</a><br><span class=""quote"">&gt;tranny </span><br><span class=""quote"">&gt;MTG</span><br>Clearly autism', 'time': 1670672214, 'resto': 28697493}, {'no': 28698206, 'now': '12/10/22(Sat)06:42:17', 'name': 'Anonymous', 'com': '<a href=""#p28698099"" class=""quotelink"">&gt;&gt;28698099</a><br>they may be confusing mtg and dominion xd', 'time': 1670672537, 'resto': 28697493}]",12.0,0.0,
45,28696427,12/10/22(Sat)02:22:00,Anonymous,"Will I finally develop a butt if I gain weight?<br>I have a hank hill ass and am almost underweight, though I think I look skinnier than my BMI because my friends jokingly called me malnourished",image,.png,500,374,250,187,1670656920035844,1670656920,UlZdHkEiyMHSr3cg3mCbPQ==,164166,0,0,0,will-i-finally-develop-a-butt-if-i-gain-weight,7,1,1670672459,,"[{'no': 28696462, 'now': '12/10/22(Sat)02:26:08', 'name': 'Anonymous', 'com': '<a href=""#p28696434"" class=""quotelink"">&gt;&gt;28696434</a><br><a href=""#p28696437"" class=""quotelink"">&gt;&gt;28696437</a><br>I can only do weighted squats because weightless squats require too many reps which is like torture for me because of how boring it is. I can&#039;t pay for a gym at the moment, and I can&#039;t afford a squat rack, so I can&#039;t really do squats.', 'filename': '1594910932630', 'ext': '.gif', 'w': 640, 'h': 360, 'tn_w': 125, 'tn_h': 70, 'tim': 1670657168415153, 'time': 1670657168, 'md5': 'KI9Dhg4zxudVYVfT/wSnGQ==', 'fsize': 1207025, 'resto': 28696427}, {'no': 28697376, 'now': '12/10/22(Sat)04:13:41', 'name': 'Anonymous', 'com': 'Bump.', 'time': 1670663621, 'resto': 28696427}, {'no': 28698186, 'now': '12/10/22(Sat)06:38:29', 'name': 'Anonymous', 'com': '<a href=""#p28696427"" class=""quotelink"">&gt;&gt;28696427</a><br>do squats and fire hydrants, no weight needed', 'time': 1670672309, 'resto': 28696427}, {'no': 28698196, 'now': '12/10/22(Sat)06:40:24', 'name': 'Anonymous', 'com': 'I mean, just do like 4x10 squats 2x2x10 fire hydrants or something, that takes 5 min, do it everyday<br>you&#039;re literally sitting on your ass rn', 'time': 1670672424, 'resto': 28696427}, {'no': 28698199, 'now': '12/10/22(Sat)06:40:59', 'name': 'Anonymous', 'com': '<a href=""#p28696462"" class=""quotelink"">&gt;&gt;28696462</a><br>Get a job then', 'time': 1670672459, 'resto': 28696427}]",2.0,0.0,
46,28698169,12/10/22(Sat)06:34:55,Anonymous,"<span class=""quote"">&gt;get drunk with male friends</span><br><span class=""quote"">&gt;walking around the city at 3am </span><br><span class=""quote"">&gt;they ask me &quot;is it gay to like tranners?&quot;</span><br><span class=""quote"">&gt;start ranting about GAMPs</span>",1664725879936870,.jpg,746,1054,176,250,1670672095028480,1670672095,FJxC4mNmVOGwq5U0mJO77g==,57746,0,0,0,get-drunk-with-male-friends,1,0,1670672427,,"[{'no': 28698197, 'now': '12/10/22(Sat)06:40:27', 'name': 'Anonymous', 'com': 'trans people only exist for sexual gratification.', 'time': 1670672427, 'resto': 28698169}]",,,
47,28693354,12/09/22(Fri)20:41:19,Anonymous,How is it pronounced? I think it&#039;s pronounced like: h(as in hot)-o(as in hot)-n(as in net).,pay captcha,.png,300,201,250,167,1670636479818753,1670636479,aPOtptcohf8eEjXH7HUFAw==,13227,0,0,0,hon,38,4,1670672418,hon,"[{'no': 28695225, 'now': '12/09/22(Fri)23:50:44', 'name': 'Anonymous', 'com': '<a href=""#p28693460"" class=""quotelink"">&gt;&gt;28693460</a><br>So you’re just proof the public school system is fucked. But okay so why does, the word the term originates from, “honey” is pronounced with a “uh” if ‘o’ can’t be pronounced that way.', 'time': 1670647844, 'resto': 28693354}, {'no': 28695312, 'now': '12/10/22(Sat)00:01:38', 'name': 'Anonymous', 'com': '<a href=""#p28694078"" class=""quotelink"">&gt;&gt;28694078</a><br>Makes sense speech impairments are common among autists and universal among Canadians', 'time': 1670648498, 'resto': 28693354}, {'no': 28695623, 'now': '12/10/22(Sat)00:36:02', 'name': 'Anonymous', 'com': '<a href=""#p28693377"" class=""quotelink"">&gt;&gt;28693377</a><br>The only women that do this are middle aged waitresses with cigarette smoke weathered skin in dingy dive diners', 'time': 1670650562, 'resto': 28693354}, {'no': 28698180, 'now': '12/10/22(Sat)06:37:07', 'name': 'Anonymous', 'com': '<a href=""#p28695623"" class=""quotelink"">&gt;&gt;28695623</a><br>and people that post on susans place, hence why the term hon caught on', 'time': 1670672227, 'resto': 28693354}, {'no': 28698195, 'now': '12/10/22(Sat)06:40:18', 'name': 'Anonymous', 'com': '<a href=""#p28693354"" class=""quotelink"">&gt;&gt;28693354</a><br>Hon-ney<br>First half of honney so like hun', 'time': 1670672418, 'resto': 28693354}]",33.0,4.0,
48,28655399,12/07/22(Wed)02:00:31,Anonymous,unending sadness and death,278613059_5715581945135427_942205097601404079_n,.jpg,552,508,250,230,1670396431389450,1670396431,BUrQ61dIjdclGzxPeRgovQ==,33608,0,0,0,mmg,147,13,1670672120,/mmg/,"[{'no': 28698082, 'now': '12/10/22(Sat)06:15:50', 'name': 'beanie', 'com': '<a href=""#p28697992"" class=""quotelink"">&gt;&gt;28697992</a><br>Wait really?', 'time': 1670670950, 'resto': 28655399, 'trip': '!!tKh3CCKWQb5'}, {'no': 28698144, 'now': '12/10/22(Sat)06:29:50', 'name': 'Anonymous', 'com': '<a href=""#p28698082"" class=""quotelink"">&gt;&gt;28698082</a><br>thats what i have been told', 'time': 1670671790, 'resto': 28655399}, {'no': 28698149, 'now': '12/10/22(Sat)06:31:09', 'name': 'beanie', 'com': '<a href=""#p28698144"" class=""quotelink"">&gt;&gt;28698144</a><br>I hope they just touched grass and left here, kinda sad desu', 'time': 1670671869, 'resto': 28655399, 'trip': '!!tKh3CCKWQb5'}, {'no': 28698164, 'now': '12/10/22(Sat)06:34:03', 'name': 'SpookyCheese', 'com': '<a href=""#p28698149"" class=""quotelink"">&gt;&gt;28698149</a><br>no<br><a href=""#p28697992"" class=""quotelink"">&gt;&gt;28697992</a><br>I like to think she just made the biggest joke ever but reality is most often disappointing', 'time': 1670672043, 'resto': 28655399}, {'no': 28698171, 'now': '12/10/22(Sat)06:35:20', 'name': 'Anonymous', 'com': '<a href=""#p28698149"" class=""quotelink"">&gt;&gt;28698149</a><br>You can be depressed and suicidal even while having an active romantic and social life. She clearly was not right in the head', 'time': 1670672120, 'resto': 28655399}]",142.0,13.0,
