,no,sticky,closed,now,name,sub,com,filename,ext,w,h,tn_w,tn_h,tim,time,md5,fsize,resto,capcode,semantic_url,replies,images,omitted_posts,omitted_images,last_replies,last_modified,bumplimit,imagelimit,trip,filedeleted
35,2494596,,,11/10/22(Thu)21:08:08,Anonymous,,The Appalachian Mountains are in fact superior to the Rocky Mountains.,4387675241218,.jpg,1440.0,808.0,250.0,140.0,1668132488223871.0,1668132488,DIZTj3UKAFxpz5ByKxSuzw==,1572629.0,0,,the-appalachian-mountains-are-in-fact-superior-to,241,62,236.0,59.0,"[{'no': 2507889, 'now': '12/10/22(Sat)12:18:28', 'name': 'Anonymous', 'com': '<a href=""#p2507888"" class=""quotelink"">&gt;&gt;2507888</a><br>Not him but it looks like an area I passed through between San Francisco and Sacramento. That would be my guess.', 'time': 1670692708, 'resto': 2494596}, {'no': 2508115, 'now': '12/10/22(Sat)20:38:20', 'name': 'Anonymous', 'com': '<a href=""#p2494596"" class=""quotelink"">&gt;&gt;2494596</a><br>obvious b8 but good try', 'filename': 'P7200309', 'ext': '.jpg', 'w': 4288, 'h': 3216, 'tn_w': 125, 'tn_h': 93, 'tim': 1670722700936595, 'time': 1670722700, 'md5': 'X78I1x5hM2Duf0yO8SRR2A==', 'fsize': 2924123, 'resto': 2494596}, {'no': 2508116, 'now': '12/10/22(Sat)20:39:58', 'name': 'Anonymous', 'filename': 'P7210316', 'ext': '.jpg', 'w': 4288, 'h': 3216, 'tn_w': 125, 'tn_h': 93, 'tim': 1670722798304770, 'time': 1670722798, 'md5': 'mFeRzzKfaaOD+j3GMbdvDA==', 'fsize': 2876520, 'resto': 2494596}, {'no': 2508117, 'now': '12/10/22(Sat)20:41:28', 'name': 'Anonymous', 'filename': 'P7230330', 'ext': '.jpg', 'w': 4288, 'h': 3216, 'tn_w': 125, 'tn_h': 93, 'tim': 1670722888463518, 'time': 1670722888, 'md5': 'V/L48In0baTtyVPEoxYqDg==', 'fsize': 3112531, 'resto': 2494596}, {'no': 2508128, 'now': '12/10/22(Sat)21:09:10', 'name': 'Anonymous', 'com': '<a href=""#p2497225"" class=""quotelink"">&gt;&gt;2497225</a><br><span class=""quote"">&gt;enjoying majestic vistas bad!</span><br><span class=""quote"">&gt;I want to stare at trees all day every day!</span><br>Suit yourself', 'time': 1670724550, 'resto': 2494596}]",1670724550,0.0,0.0,,
36,2506333,,,12/07/22(Wed)11:11:59,Anonymous,"I want to live in the woods, but also have a job and save money.","I want to live in the woods, and be homeless. But not on the streets homeless with dysgenic niggers in the big city. I want the in the woods version. What is a good city/town where i can make this happen? (hard mode: not alaska) I&#039;m thinking Redding CA. The woods should be as close to the town/city as possible. I do have a mtn bike. I want to work also to support myself. Most of all i don&#039;t want to be amongst homeless street urchins who would rob me, i want to be nestled in the woods, where no one can find me and i can change camp spots every few days. As for hygiene i can find a gym for showers/ water bottle shower and a laundromat. For entertainment i have a shitty laptop and tons of movies. I want to do this because i&#039;m addicted to vidya and being on the pc all day. If anyone has experience on this please let me know.",PCT,.png,800.0,1649.0,121.0,249.0,1670429519989797.0,1670429519,gnSUfGPa5SpkOL1eXMNeTw==,1045532.0,0,,i-want-to-live-in-the-woods-but-also-have-a-job,49,3,44.0,2.0,"[{'no': 2507840, 'now': '12/10/22(Sat)09:55:50', 'name': 'Anonymous', 'com': '<a href=""#p2506823"" class=""quotelink"">&gt;&gt;2506823</a><br>You aren&#039;t gonna have cell service up in the mountains', 'time': 1670684150, 'resto': 2506333}, {'no': 2507872, 'now': '12/10/22(Sat)11:33:24', 'name': 'Anonymous', 'com': '<a href=""#p2507840"" class=""quotelink"">&gt;&gt;2507840</a><br><span class=""quote"">&gt;You aren&#039;t gonna have cell service up in the mountains</span><br>That&#039;s a blanket statement that isn&#039;t always true. Caltopo also has cell coverage maps for AT&amp;T, Verizon and T-Mobile.', 'filename': 'CoverageMap', 'ext': '.png', 'w': 1012, 'h': 517, 'tn_w': 125, 'tn_h': 63, 'tim': 1670690004069204, 'time': 1670690004, 'md5': 'meJR5KfZ1R6EL14fyhccKg==', 'fsize': 687816, 'resto': 2506333}, {'no': 2508031, 'now': '12/10/22(Sat)17:45:56', 'name': 'Anonymous', 'com': '<a href=""#p2507809"" class=""quotelink"">&gt;&gt;2507809</a><br>fuck off hobo faggot.', 'time': 1670712356, 'resto': 2506333}, {'no': 2508032, 'now': '12/10/22(Sat)17:47:56', 'name': 'Anonymous', 'com': '<a href=""#p2507840"" class=""quotelink"">&gt;&gt;2507840</a><br>I&#039;ve got 3 tb of music and movies on a 2.5&quot; drive <br>not gona get bored too quick. <br>Also search diy 18650 battery pack on ali express. I&#039;ve got several of the 16 cell versions.', 'time': 1670712476, 'resto': 2506333}, {'no': 2508106, 'now': '12/10/22(Sat)20:22:55', 'name': 'Anonymous', 'com': '<a href=""#p2507872"" class=""quotelink"">&gt;&gt;2507872</a><br>In southern Oregon you can not rely on your phone in the mountains, I wouldn&#039;t imagine it&#039;s much different right over the border', 'time': 1670721775, 'resto': 2506333}]",1670721775,0.0,0.0,,
37,2506804,,,12/08/22(Thu)14:54:11,Anonymous,,Anyone in the Great Lakes region have next to no bugs this year? I went camping like 5 times and I never even had to use bug spray once.<br><br>Wax and wane or entire global ecological collapse?,Ontario-map,.jpg,368.0,347.0,250.0,235.0,1670529251478985.0,1670529251,J2Muml6rfnRetLUFT9kH2A==,24805.0,0,,anyone-in-the-great-lakes-region-have-next-to-no,15,3,10.0,0.0,"[{'no': 2508070, 'now': '12/10/22(Sat)19:12:53', 'name': 'Anonymous', 'com': '<a href=""#p2508068"" class=""quotelink"">&gt;&gt;2508068</a><br>Did I stutter?', 'filename': '1661415702937', 'ext': '.png', 'w': 292, 'h': 716, 'tn_w': 50, 'tn_h': 125, 'tim': 1670717573195394, 'time': 1670717573, 'md5': 'jvbrL15ZN6nPpOwkau+57g==', 'fsize': 72565, 'resto': 2506804}, {'no': 2508094, 'now': '12/10/22(Sat)19:55:29', 'name': 'Anonymous', 'com': '<a href=""#p2508070"" class=""quotelink"">&gt;&gt;2508070</a><br>Northern Ontario doesn&#039;t start until Sault imo<br>Kawartha is only like 2 hours from Toronto for fucks sake', 'time': 1670720129, 'resto': 2506804}, {'no': 2508097, 'now': '12/10/22(Sat)20:04:25', 'name': 'Anonymous', 'com': '<a href=""#p2508094"" class=""quotelink"">&gt;&gt;2508094</a><br>Personally I consider anything north of the southern border of the Canadian shield to be North Ontario. That&#039;s where the farmland, big cities, and and Asian/Indian hordes stop, and where real Canada begins.', 'filename': '1661305066782', 'ext': '.jpg', 'w': 653, 'h': 412, 'tn_w': 125, 'tn_h': 78, 'tim': 1670720665601534, 'time': 1670720665, 'md5': '52rb6bPEYRt+8s+iK8togA==', 'fsize': 89440, 'resto': 2506804}, {'no': 2508101, 'now': '12/10/22(Sat)20:10:22', 'name': 'Anonymous', 'com': '<a href=""#p2508094"" class=""quotelink"">&gt;&gt;2508094</a><br><a href=""#p2508097"" class=""quotelink"">&gt;&gt;2508097</a><br>I had to move back down to Barrie last year because of divorce and work after living rurally for quite some time. It feels like I moved to some foreign third world country. It&#039;s awful. Get north and stay north my friends.', 'filename': '1643677252850', 'ext': '.jpg', 'w': 600, 'h': 476, 'tn_w': 125, 'tn_h': 99, 'tim': 1670721022724286, 'time': 1670721022, 'md5': 'AzsEnbbrKGrIPRxKc16S6g==', 'fsize': 61624, 'resto': 2506804}, {'no': 2508105, 'now': '12/10/22(Sat)20:21:44', 'name': 'Anonymous', 'com': '<a href=""#p2508101"" class=""quotelink"">&gt;&gt;2508101</a><br>For all intents and purposes, you did. Ironically, I live in the GTA and get the same feeling when I go to cities a little further up there like Barrie and Peterborough. The North has really been calling me lately. It&#039;s only a matter of time before I escape this &quot;multicultural&quot; hellscape.', 'time': 1670721704, 'resto': 2506804}]",1670721704,0.0,0.0,,
38,2508085,,,12/10/22(Sat)19:41:33,Anonymous,,Have you ever got turnt around and lost your way? How did you get back?,feature-image-child-crying-alone-2,.jpg,1200.0,675.0,250.0,140.0,1670719293698376.0,1670719293,FuhcVfCGuA36OGMRB8IRbQ==,254563.0,0,,have-you-ever-got-turnt-around-and-lost-your-way,0,0,,,,1670719293,0.0,0.0,,
39,2506729,,,12/08/22(Thu)11:54:04,Anonymous,External frame chads?,Talk me out of buying a stupid second hand external frame rucksack from the distant past (1970s),karrimor,.jpg,620.0,820.0,189.0,250.0,1670518444126124.0,1670518444,biInQafsF25bYjgBjsW6Gw==,118528.0,0,,external-frame-chads,33,7,28.0,6.0,"[{'no': 2507019, 'now': '12/08/22(Thu)22:53:04', 'name': 'Anonymous', 'com': '<a href=""#p2507006"" class=""quotelink"">&gt;&gt;2507006</a><br>alaska and norway have extreme weather, yes.<br>most of europe is a total joke for /out/ and you know it.', 'time': 1670557984, 'resto': 2506729}, {'no': 2507030, 'now': '12/08/22(Thu)23:02:37', 'name': 'Anonymous', 'com': '<a href=""#p2507009"" class=""quotelink"">&gt;&gt;2507009</a><br><a href=""#p2507006"" class=""quotelink"">&gt;&gt;2507006</a><br>quick search on the ultralight forums shows most of the american ultralighters who&#039;ve done gröna bandet didn&#039;t really have any issues with the gear or difficulty. its a lot shorter and you&#039;re only preparing for a single set of conditions. pct has you going from deserts to cold rain to snowy mountains and back again all along the way. they seem pretty different and hard to compare to each other. the few people i&#039;ve found online who say they&#039;ve done both don&#039;t seem to act like gröna bandet is any harder.', 'time': 1670558557, 'resto': 2506729}, {'no': 2507034, 'now': '12/08/22(Thu)23:06:44', 'name': 'Anonymous', 'com': '<a href=""#p2506729"" class=""quotelink"">&gt;&gt;2506729</a><br>Why would I? You should definitely do it and have fun using it.', 'time': 1670558804, 'resto': 2506729}, {'no': 2508062, 'now': '12/10/22(Sat)18:52:24', 'name': 'Anonymous', 'com': 'For me, it&#039;s the Kelty 65.', 'filename': 'download', 'ext': '.jpg', 'w': 168, 'h': 299, 'tn_w': 70, 'tn_h': 125, 'tim': 1670716344640177, 'time': 1670716344, 'md5': 'TGBEhzxSSthgTwj4jWhhfQ==', 'fsize': 8838, 'resto': 2506729}, {'no': 2508078, 'now': '12/10/22(Sat)19:23:17', 'name': 'Anonymous', 'com': '<a href=""#p2507006"" class=""quotelink"">&gt;&gt;2507006</a><br>No one believes any of this.', 'time': 1670718197, 'resto': 2506729}]",1670718197,0.0,0.0,,
40,2504576,,,12/03/22(Sat)03:21:08,Anonymous,,Where do I make hiking and camping frens?,064B90F1-6509-4F92-B7C7-DD5A364B624F,.jpg,640.0,427.0,250.0,166.0,1670055668282939.0,1670055668,n6ghm7DNkSNO/0w/SQdrtg==,72888.0,0,,where-do-i-make-hiking-and-camping-frens,26,8,21.0,6.0,"[{'no': 2507922, 'now': '12/10/22(Sat)13:39:29', 'name': 'Anonymous', 'com': '<a href=""#p2507685"" class=""quotelink"">&gt;&gt;2507685</a><br><span class=""quote"">&gt;Tried to get a VA meet up going, three anons said they would go, no one showed up</span><br>you americans are all talk. good luck anon, finding the few america anons who will acctually do what they say.', 'time': 1670697569, 'resto': 2504576}, {'no': 2507926, 'now': '12/10/22(Sat)13:44:30', 'name': 'Anonymous', 'com': '<a href=""#p2507625"" class=""quotelink"">&gt;&gt;2507625</a><br><span class=""quote"">&gt;pussy deprived weirdos who lay on each other laps</span><br>what the fuck hahahahaha<br>you are taking the wrong kind of people camping anon, you need to bring people who already go out themselves. i like going out alone but i also like going out with my out friends- the only real friends i&#039;ve got.', 'filename': 'frens with tiger cub', 'ext': '.jpg', 'w': 1665, 'h': 2500, 'tn_w': 83, 'tn_h': 125, 'tim': 1670697870353497, 'time': 1670697870, 'md5': '2ryNeKXPzSt+9TOtpr/++A==', 'fsize': 1337514, 'resto': 2504576}, {'no': 2507974, 'now': '12/10/22(Sat)15:20:33', 'name': 'Not a Skinwalker', 'com': '<a href=""#p2504576"" class=""quotelink"">&gt;&gt;2504576</a><br>I&#039;ll be your fren.', 'time': 1670703633, 'resto': 2504576}, {'no': 2508048, 'now': '12/10/22(Sat)18:22:13', 'name': 'Anonymous', 'com': '<a href=""#p2504576"" class=""quotelink"">&gt;&gt;2504576</a><br><span class=""quote"">&gt;Where do I make hiking and camping frens?</span><br>I plan to meet them on the PCT this year', 'time': 1670714533, 'resto': 2504576}, {'no': 2508059, 'now': '12/10/22(Sat)18:45:49', 'name': 'Anonymous', 'com': '<a href=""#p2507926"" class=""quotelink"">&gt;&gt;2507926</a><br>I know, it weirded me out seeing it, like a bunch of closeted homosexuals. Thing is they claimed to do /out/ all the time, have a group and chat online to organize meet ups etc. they made references to past &quot;events&quot; but wouldn&#039;t go into detail. I came across them, looking for hiking groups online, very fucking strange but you can see why I don&#039;t bother anymore.<br>I remember someone online saying something similar but instead of faggots they were all trying to fuck each others wifes, including his. Reading that was the nail in the coffin, to many degenerates, weirdos and people not actually interested in /out/', 'filename': 'It&#039;s_All_So_Tiresome', 'ext': '.png', 'w': 1022, 'h': 731, 'tn_w': 125, 'tn_h': 89, 'tim': 1670715949429349, 'time': 1670715949, 'md5': 'JgorulRtTtv5cbijfHwCSA==', 'fsize': 658150, 'resto': 2504576}]",1670715949,0.0,0.0,,
41,2498930,,,11/20/22(Sun)16:47:53,Anonymous,Urgent: Beginner climbing harness for indoor gym?,Is the black diamond moment any good? Don’t want to spend an insane amount of money <br><br>Plz help I have to buy it immediately pretty much,156CAD56-AB7F-47BB-BDF3-2C1B352CA489,.jpg,828.0,1000.0,207.0,250.0,1668980873471760.0,1668980873,gSjAbTpkfBtoifBH7A/W9g==,464141.0,0,,urgent-beginner-climbing-harness-for-indoor-gym,18,3,13.0,1.0,"[{'no': 2503383, 'now': '11/29/22(Tue)22:11:25', 'name': 'Anonymous', 'com': '<a href=""#p2503199"" class=""quotelink"">&gt;&gt;2503199</a><br><span class=""quote"">&gt;4 chang old account</span><br>interdasting', 'filename': '1639005641178', 'ext': '.png', 'w': 400, 'h': 336, 'tn_w': 125, 'tn_h': 105, 'tim': 1669777885326189, 'time': 1669777885, 'md5': 'scWpMAK1UC5Pynfkf7NOww==', 'fsize': 160960, 'resto': 2498930}, {'no': 2505953, 'now': '12/06/22(Tue)00:52:25', 'name': 'Anonymous', 'com': '<a href=""#p2503199"" class=""quotelink"">&gt;&gt;2503199</a><br>Sunlight too. Keep it in a cool, dry place away from sunlight.', 'time': 1670305945, 'resto': 2498930}, {'no': 2505960, 'now': '12/06/22(Tue)01:16:33', 'name': 'Anonymous', 'com': '<a href=""#p2503364"" class=""quotelink"">&gt;&gt;2503364</a><br>You gonna make a thread about what chalk to buy next you little low self esteem crybaby? The generals exist for a reason', 'time': 1670307393, 'resto': 2498930}, {'no': 2505963, 'now': '12/06/22(Tue)01:44:14', 'name': 'Anonymous', 'com': '<a href=""#p2505960"" class=""quotelink"">&gt;&gt;2505960</a><br>no chalk. wear gloves.', 'filename': 'i-DFNs47d-L', 'ext': '.jpg', 'w': 445, 'h': 599, 'tn_w': 92, 'tn_h': 125, 'tim': 1670309054964027, 'time': 1670309054, 'md5': 'HdOZU/YTK1E2fpWWQ2VcFQ==', 'fsize': 65277, 'resto': 2498930}, {'no': 2508052, 'now': '12/10/22(Sat)18:30:35', 'name': 'Anonymous', 'com': '<a href=""#p2498930"" class=""quotelink"">&gt;&gt;2498930</a><br>The petzl corax is exponentially better and marginally more expensive.', 'time': 1670715035, 'resto': 2498930}]",1670715035,0.0,0.0,,
42,2474536,,,10/04/22(Tue)21:11:25,Anonymous,Milsurp /out/ gear,What are some good sites for milsurp outdoors gear? I&#039;ve had good experiences with army surplus world but they&#039;re selection is limited and half of it is cheap pakistani knockoff milsurp<br>Also feel free to post your milsurp gear and what you use it for<br>Signed - The king of the shortbus,1780788226,.jpg,750.0,1000.0,187.0,250.0,1664932285488345.0,1664932285,vPuqZ0yTA7zpUcmWRFOsGw==,182917.0,0,,milsurp-out-gear,262,29,257.0,28.0,"[{'no': 2506654, 'now': '12/08/22(Thu)08:21:44', 'name': 'Anonymous', 'com': '<a href=""#p2502974"" class=""quotelink"">&gt;&gt;2502974</a><br>yeah they are good, i have the long back version for tall chads and the shortback is designed to sit on a belt kit or you are a short arse, great bag and you can unzip both side pouches to take size and weight off,', 'time': 1670505704, 'resto': 2474536}, {'no': 2507036, 'now': '12/08/22(Thu)23:14:39', 'name': 'Anonymous', 'com': '<a href=""#p2488947"" class=""quotelink"">&gt;&gt;2488947</a><br>It doesnt because he&#039;s a retard. <br><br>Literally just tuck your pants into your boots', 'time': 1670559279, 'resto': 2474536}, {'no': 2507572, 'now': '12/09/22(Fri)18:07:06', 'name': 'Anonymous', 'com': 'Are there any good modern military uniforms that don&#039;t have loads of velcro on it? I&#039;m fine with those faggoty ID panels, but I despise velcro on pockets', 'time': 1670627226, 'resto': 2474536}, {'no': 2507789, 'now': '12/10/22(Sat)04:20:47', 'name': 'Anonymous', 'com': '<a href=""#p2507572"" class=""quotelink"">&gt;&gt;2507572</a><br>The current OCPs have only buttons on the crotch, thigh, and calf pocket. You can get summer weight ones that have buttons, but I wouldn&#039;t trust those fucking things in the woods. Feels like one single thorn and there&#039;s a hole in em', 'time': 1670664047, 'resto': 2474536}, {'no': 2508051, 'now': '12/10/22(Sat)18:27:14', 'name': 'Anonymous', 'com': 'Using a lot of surplus here. Czech watch cap, lots of Russian stuff, surplus german mountain troop boots (literally rebranded haix but for much less $) and of course the classic chicom rig which I used to carry mags and my radio because I wanted to shitpost with my frens on the way up and also have some tunes when we had lunch when we summited here on day 2 of our hike.<br><br>Gotta shill my own store, but I do know for small items it doesn&#039;t make sense because canada post hates canadian businesses and the cost is up there.<br><br>mistymountainsupply', 'filename': 'mistyatthemountaintop', 'ext': '.png', 'w': 1019, 'h': 763, 'tn_w': 125, 'tn_h': 93, 'tim': 1670714834947700, 'time': 1670714834, 'md5': 'COKvuLV4WJ4ecFsr5/nHuA==', 'fsize': 1578170, 'resto': 2474536}]",1670714834,0.0,0.0,,
43,2505224,,,12/04/22(Sun)12:06:36,Anonymous,Loadout and gear,"Hi guys. Ive decided on traveling the world starting in europe and ending in asia trough hitchiking and couch surfing mostly. Along the way i am planning on doing alot of hiking. I am quite a begginer in hiking/trekking, and I started to look into the gear i will need. I want quality items that will serve their purpouse in the long run. I wanted to see if you guys have any good lists with loadouts for long, few-month treks that show items needed for long trips, as well as recommendations for good internal frame backpacks with big capacity (50+ liters), ideally not too flashy and coloured (i like a military-type vibe to my gear, lots of black and green), as well as general tips and experiences from people who have done similar things",how-to-pack-a-backpack,.jpg,590.0,400.0,250.0,169.0,1670173596173641.0,1670173596,q/0/JKBPVdQZ6qLn/cRq3A==,118701.0,0,,loadout-and-gear,54,7,49.0,7.0,"[{'no': 2507767, 'now': '12/10/22(Sat)02:33:08', 'name': 'Anonymous', 'com': '<a href=""#p2505722"" class=""quotelink"">&gt;&gt;2505722</a><br>i&#039;ve got a standard army issue molly ruck. Things cavernous but weighs like 12 lbs. compare that to 5 or 6 lbs for a 70 liter osprey pack i have.........', 'time': 1670657588, 'resto': 2505224}, {'no': 2507828, 'now': '12/10/22(Sat)09:17:50', 'name': 'Anonymous', 'com': '<a href=""#p2507765"" class=""quotelink"">&gt;&gt;2507765</a><br><span class=""quote"">&gt;rains means 100% humidity</span><br>It doesn’t. It often means the relative humidity is over 90%, but not always, especially in places where rain is caused by high altitude frontal systems rather than localized evaporation. And we see the former in places that have low humidity most of the year (the western half of the US). <br><span class=""quote"">&gt;why have a tent if it’s not going to rain</span><br>Incase it does rain. And where are they more likely to get unexpected rain storms? At high elevations, mostly found in the western half of the US.', 'time': 1670681870, 'resto': 2505224}, {'no': 2508011, 'now': '12/10/22(Sat)17:02:02', 'name': 'Anonymous', 'com': '<a href=""#p2507828"" class=""quotelink"">&gt;&gt;2507828</a><br>it does actually. and definitely where it counts ie the tent wall. the raindrops saturate the air with water vapor. Especially during prolonged storms. another thing is the temperature difference from cold rain drops hitting your tent means your warm breath condenses on the tent wall. with a two layer tent the condensation drips and rolls off the inner tent. on a weight weeny tent it drips and hits you in the face. not only that they always leak during prolonged storms. weight weenies really are delusional, lmao.', 'time': 1670709722, 'resto': 2505224}, {'no': 2508037, 'now': '12/10/22(Sat)18:06:45', 'name': 'Anonymous', 'com': '<a href=""#p2507828"" class=""quotelink"">&gt;&gt;2507828</a><br>Also a larger tent helps to negate condensation in two ways. one there is more space, so the condensation is from water vapor in your breath has more space to breathe. compared to a single wall tent where you have alot less space, and theres less space for the water vapor to go. you take these inherantly leaky tents and pair them with people with down bags that wet out and become useless and inevetably failing blow up mats, basically a recipe for hypothermia, rip.', 'time': 1670713605, 'resto': 2505224}, {'no': 2508042, 'now': '12/10/22(Sat)18:10:03', 'name': 'Anonymous', 'com': '<a href=""#p2508037"" class=""quotelink"">&gt;&gt;2508037</a><br><span class=""quote"">&gt; I paid 300+ for this tent, how can it be so shit? Did we get too cocky weight weenie bros?</span><br><br>Yes, yes you did. my tent is two person black diamond, weighs 3 or 4 lbs. is huge, and not clostrophobic. I had a pos tarp tent style where its lower on one side and the entrence is on one side. The pos would sag with the condensation adn moisture, and you would end up soaked even if it didn&#039;t rain. The moisture would drip down onto the toe of my down bag soaking my lower half.', 'time': 1670713803, 'resto': 2505224}]",1670713803,0.0,0.0,,
44,2505828,,,12/05/22(Mon)20:59:17,Anonymous,How long would you last?,"How long could the average /out/doorsman survive in the sticks do you think? A week? A month? Limiting your supplies and gear to what you could carry out in the woods, obviously, how long would you last anon?",camp1c,.jpg,648.0,360.0,250.0,138.0,1670291957305998.0,1670291957,pkhb2re1aMsmjZdebqk8fQ==,44320.0,0,,how-long-would-you-last,26,5,21.0,4.0,"[{'no': 2507688, 'now': '12/09/22(Fri)22:30:32', 'name': 'Anonymous', 'com': '<a href=""#p2505828"" class=""quotelink"">&gt;&gt;2505828</a><br>I could survive indefinitely provided the area I was in actually has enough resources to support life. I already hunt/fish and forage nuts and berries and have a garden that provides ~70-80% of what I eat so it wouldn’t be a huge leap', 'filename': '708793F7-1557-4C0A-9FF2-E03EAFE1386F', 'ext': '.jpg', 'w': 736, 'h': 1185, 'tn_w': 77, 'tn_h': 125, 'tim': 1670643032889052, 'time': 1670643032, 'md5': 'v98YrWvkBYOS1N1fxFnb9w==', 'fsize': 247985, 'resto': 2505828}, {'no': 2507722, 'now': '12/10/22(Sat)00:15:44', 'name': 'Anonymous', 'com': '<a href=""#p2507688"" class=""quotelink"">&gt;&gt;2507688</a><br>That&#039;s pretty cool if true, anon!', 'time': 1670649344, 'resto': 2505828}, {'no': 2507743, 'now': '12/10/22(Sat)01:37:56', 'name': 'Anonymous', 'com': '<a href=""#p2507722"" class=""quotelink"">&gt;&gt;2507722</a><br>Its not really difficult, especially if your full time job is food procurement. The main issue you see on shows like alone is that there simply isn’t the calories available in that small of an area to sustain a person, especially when they drop them off in late autumn and miss most wild edible seasons', 'time': 1670654276, 'resto': 2505828}, {'no': 2507747, 'now': '12/10/22(Sat)01:41:00', 'name': 'Anonymous', 'com': '<a href=""#p2505828"" class=""quotelink"">&gt;&gt;2505828</a><br>If I was in my home territory (UP) I could last from early spring to late summer. I don&#039;t want to kid myself and say I could make it through the winter, it&#039;s hard even when I have a house to go back to.', 'time': 1670654460, 'resto': 2505828}, {'no': 2508030, 'now': '12/10/22(Sat)17:44:37', 'name': 'Anonymous', 'com': '<a href=""#p2507688"" class=""quotelink"">&gt;&gt;2507688</a><br>i&#039;m not worried either. i&#039;m fat enough i could learn to survive snairing squirels and what not before i&#039;d starve. but not too fat that i&#039;m a totall lardass.', 'time': 1670712277, 'resto': 2505828}]",1670712277,0.0,0.0,,
