,no,sticky,closed,now,name,sub,com,filename,ext,w,h,tn_w,tn_h,tim,time,md5,fsize,resto,capcode,semantic_url,replies,images,omitted_posts,omitted_images,last_replies,last_modified,bumplimit,imagelimit,trip,filedeleted
73,2506998,,,12/08/22(Thu)22:30:04,Anonymous,,"<span class=""quote"">&gt;be me</span><br><span class=""quote"">&gt;going for a walk on a beautiful day</span><br><span class=""quote"">&gt;decide to take a shortcut through the park</span><br><span class=""quote"">&gt;suddenly, see a group of dogs playing</span><br><span class=""quote"">&gt;one of them runs over and starts jumping on me</span><br><span class=""quote"">&gt;trying to pet it and be friendly</span><br><span class=""quote"">&gt;dog&#039;s owner comes over and says &quot;oh no, that&#039;s not a dog, it&#039;s a squirrel!&quot;</span><br><span class=""quote"">&gt;realize I&#039;ve been petting a squirrel the whole time</span><br><span class=""quote"">&gt;everyone around me is laughing their ass off</span><br><span class=""quote"">&gt;feeling like a complete idiot</span><br><span class=""quote"">&gt;quickly run away with my tail between my legs</span><br>never taking shortcuts through the park again",01221114522342,.png,512.0,512.0,250.0,250.0,1670556604933803.0,1670556604,Ne2eG1WfM2Ejf6IpPW/Rjg==,534740.0,0,,be-me,1,0,,,"[{'no': 2507720, 'now': '12/10/22(Sat)00:13:56', 'name': 'Anonymous', 'com': '<a href=""#p2506998"" class=""quotelink"">&gt;&gt;2506998</a><br>What the heck is that real?', 'time': 1670649236, 'resto': 2506998}]",1670649236,0.0,0.0,,
74,2488981,,,10/29/22(Sat)16:47:51,Anonymous,,"<span class=""quote"">&gt;he adjust his poles mid hike </span><br>Please tell me you guys don&#039;t actually do this",sizinghikingpoles,.jpg,554.0,554.0,249.0,249.0,1667076471879382.0,1667076471,FuL/KU/rdfQc9Mof9QxLUQ==,31487.0,0,,he-adjust-his-poles-mid-hike,85,8,80.0,8.0,"[{'no': 2502897, 'now': '11/28/22(Mon)17:25:27', 'name': 'Anonymous', 'com': '<a href=""#p2502626"" class=""quotelink"">&gt;&gt;2502626</a><br>Yes. You should see the stacks of paper with scratched-out ideas for how to respond. Afterwards I put them all in my pack so I could train for my walk to the mailbox today. I barely made it. Thanks for the assist.', 'time': 1669674327, 'resto': 2488981}, {'no': 2503168, 'now': '11/29/22(Tue)14:04:35', 'name': 'Anonymous', 'com': '<a href=""#p2501403"" class=""quotelink"">&gt;&gt;2501403</a><br>That&#039;s true if you are unfit. If you can get fit there is no reason not to get maximum knee ability, mobility, and strength. Learn how to walk 101:<br>https://www.youtube.com/watch?v=V3o<wbr>6YFQ9sjA<br><br><span class=""quote"">&gt;nooooo, I don&#039;t want to learn how to walk without injuring my knees. stooop.</span>', 'time': 1669748675, 'resto': 2488981}, {'no': 2505388, 'now': '12/04/22(Sun)18:15:16', 'name': 'Anonymous', 'com': 'bump', 'time': 1670195716, 'resto': 2488981}, {'no': 2506754, 'now': '12/08/22(Thu)12:37:55', 'name': 'Anonymous', 'com': '<a href=""#p2502897"" class=""quotelink"">&gt;&gt;2502897</a><br>That was a good save my nigga', 'time': 1670521075, 'resto': 2488981}, {'no': 2507682, 'now': '12/09/22(Fri)22:05:31', 'name': 'Anonymous', 'com': 'I use poles because using my arms objectively lets me go farther with a heavier pack. The grips are really nice and let me use my arms a lot. They save my knees going downhill so I&#039;ll be able to hike for more of my life. The baskets make going over uncompacted snow with sinking as much. Why would I not use a piece of gear that&#039;s very simple, effective, light, easy to stow, and inexpensive.', 'time': 1670641531, 'resto': 2488981}]",1670641531,0.0,0.0,,
75,2497812,,,11/18/22(Fri)12:08:06,Anonymous,Picture thread,"Just share /out/ pictures.<br>Here’s the view while I was packing a mule deer out last weekend. I saw a lone black wolf on this trip, but he was too quick for the camera.",5741620F-F9B7-4EE3-BF58-B0099817E454,.png,1334.0,750.0,249.0,140.0,1668791286808523.0,1668791286,SjTTzhUrcWXKkAIkqMAmbA==,4513599.0,0,,picture-thread,137,97,132.0,96.0,"[{'no': 2507454, 'now': '12/09/22(Fri)16:07:34', 'name': 'Anonymous', 'com': '<a href=""#p2507445"" class=""quotelink"">&gt;&gt;2507445</a><br>Everyone was a noob at one point! Best way to learn fast and make friends to go /out/ with is to take some classes, like at a community college if that&#039;s an option for you. There are all those organizations too like NOLS, AMGA, blah blah but they are usually crazy overpriced and lots of those professional establishment people are so high off their own egos I would stay clear from them honestly. If you can&#039;t do a class try to find a small local/public group and express you want to learn, I&#039;m sure with a little looking you&#039;ll be able to find a good mentor<br><span class=""quote"">&gt;Nobody likes going out in the rain</span><br>That&#039;s the whole point :) Learn to love the rain and you&#039;ll have the whole forest to yourself. Hotsprings in the rain are also one of the most blissful things one can possibly experience, I think.', 'time': 1670620054, 'resto': 2497812}, {'no': 2507471, 'now': '12/09/22(Fri)16:30:49', 'name': 'Anonymous', 'com': '<a href=""#p2507445"" class=""quotelink"">&gt;&gt;2507445</a><br><span class=""quote"">&gt;Nobody likes going out in the rain</span><br>I kinda do actually. I dont want to spend all day in the rain but getting out in the woods in the rain or snow for a bit is awesome.', 'time': 1670621449, 'resto': 2497812}, {'no': 2507518, 'now': '12/09/22(Fri)17:15:37', 'name': 'Anonymous', 'filename': '5F7E5FB4-46A3-4AA8-ADA6-673A13E9814E', 'ext': '.jpg', 'w': 1536, 'h': 2048, 'tn_w': 93, 'tn_h': 125, 'tim': 1670624137910502, 'time': 1670624137, 'md5': 'Hgi85RoQdbCFwGrC3/Yx2A==', 'fsize': 327611, 'resto': 2497812}, {'no': 2507638, 'now': '12/09/22(Fri)20:33:03', 'name': 'Anonymous', 'com': '<a href=""#p2507390"" class=""quotelink"">&gt;&gt;2507390</a><br>Pretty. Where at?', 'time': 1670635983, 'resto': 2497812}, {'no': 2507669, 'now': '12/09/22(Fri)21:17:39', 'name': 'Anonymous', 'com': '<a href=""#p2507638"" class=""quotelink"">&gt;&gt;2507638</a><br>Manuel Antonio, Costa Rica', 'time': 1670638659, 'resto': 2497812}]",1670638659,0.0,0.0,,
76,2499910,,,11/22/22(Tue)20:09:51,Anonymous,MISSING WHITE GIRL,"What do you think happened white mountain bros?<br><br>https://www.wmur.com/article/lost-h<wbr>iker-new-hampshire-franconia-notch-<wbr>1122/42040436<br><br><span class=""quote"">&gt;The search is continuing Tuesday in Franconia Notch for a missing hiker from Massachusetts.</span><br><br><span class=""quote"">&gt;Emily Sotelo, 19, from Westford, was dropped off for a hike Sunday morning at Lafayette Place campground by her mother and has not been seen since. She had intended to hike Mount Lafayette, Mount Haystack and Mount Flume.</span>",B65BC3B8-F867-42B1-8C54-04D9BE42112D,.jpg,660.0,880.0,187.0,250.0,1669165791275720.0,1669165791,iYcMI2lArSyHmrLdGvyA2Q==,69475.0,0,,missing-white-girl,214,29,209.0,29.0,"[{'no': 2507418, 'now': '12/09/22(Fri)14:58:44', 'name': 'Anonymous', 'com': '<a href=""#p2507273"" class=""quotelink"">&gt;&gt;2507273</a><br>What retard taught you how to lay protection in?', 'time': 1670615924, 'resto': 2499910}, {'no': 2507555, 'now': '12/09/22(Fri)17:50:18', 'name': 'Anonymous', 'com': '<span class=""quote"">&gt;green eyes</span><br><span class=""quote"">&gt;looks slightly germanic</span><br><span class=""quote"">&gt;point of separation with mom</span><br>squachbait', 'time': 1670626218, 'resto': 2499910}, {'no': 2507614, 'now': '12/09/22(Fri)19:48:18', 'name': 'Anonymous', 'com': '<a href=""#p2499910"" class=""quotelink"">&gt;&gt;2499910</a><br><br>OP update? is she still missing?', 'time': 1670633298, 'resto': 2499910}, {'no': 2507624, 'now': '12/09/22(Fri)20:04:05', 'name': 'Anonymous', 'com': '<a href=""#p2507408"" class=""quotelink"">&gt;&gt;2507408</a><br>is that kevin shields', 'time': 1670634245, 'resto': 2499910}, {'no': 2507634, 'now': '12/09/22(Fri)20:22:11', 'name': 'Anonymous', 'com': '<a href=""#p2507294"" class=""quotelink"">&gt;&gt;2507294</a><br><a href=""#p2507300"" class=""quotelink"">&gt;&gt;2507300</a><br>ngmi', 'time': 1670635331, 'resto': 2499910}]",1670635331,0.0,0.0,,
77,2500079,,,11/23/22(Wed)04:10:45,Anonymous,,"I think im gonna do it fellas, I finally have the money and resources to make it happen albeit on. shoestring budget<br>I&#039;m gonna buy 2-3 acres in the woods in oregon and build an offgrid cabin on it<br>any of you /out/ists taken the offgrid cabin pill yet? howd it go?",tiny-cabin-a-frame-montana,.jpg,1000.0,619.0,250.0,154.0,1669194645530162.0,1669194645,YX7BWDUvqM9auSv4SIkAOw==,274798.0,0,,i-think-im-gonna-do-it-fellas-i-finally-have-the,84,11,79.0,10.0,"[{'no': 2507064, 'now': '12/08/22(Thu)23:55:26', 'name': 'Anonymous', 'com': '<a href=""#p2500079"" class=""quotelink"">&gt;&gt;2500079</a><br><span class=""quote"">&gt;I&#039;m gonna buy 2-3 acres in the woods</span><br>Nice bro<br><span class=""quote"">&gt;in oregon</span><br>pffft have fun with all the laws and taxes and shit lmao', 'time': 1670561726, 'resto': 2500079}, {'no': 2507119, 'now': '12/09/22(Fri)01:13:55', 'name': 'Anonymous', 'com': '<a href=""#p2506629"" class=""quotelink"">&gt;&gt;2506629</a><br>yeah i thought pol was full of assholes. <br>alot of the people on this board are out and out <br>faggots.', 'time': 1670566435, 'resto': 2500079}, {'no': 2507120, 'now': '12/09/22(Fri)01:16:51', 'name': 'Anonymous', 'com': '<a href=""#p2507029"" class=""quotelink"">&gt;&gt;2507029</a><br>looks good bro. I hope the long way is facing south so you can throw some solar panels on the roof.', 'time': 1670566611, 'resto': 2500079}, {'no': 2507138, 'now': '12/09/22(Fri)01:48:42', 'name': 'Anonymous', 'com': '<a href=""#p2506738"" class=""quotelink"">&gt;&gt;2506738</a><br>You dont want to use that as fertilizer. They work just fine as toilets though. You can however use literally every other bit of natural/nonplastic waste you produce by using compost piles/honey holes etc. Obviously plant and food scraps but you can compost everything from dead animals to pocket lint (if natural fibers) to old clothes, livestock manure, etc. and that shit makes an amazing fertilizer if you do it right', 'time': 1670568522, 'resto': 2500079}, {'no': 2507622, 'now': '12/09/22(Fri)20:00:42', 'name': 'Anonymous', 'com': '<a href=""#p2505309"" class=""quotelink"">&gt;&gt;2505309</a><br>Sorry for the late reply. It&#039;s a 2006 single cab Toyota Hilux with the tray off an older Landcruiser. They have a 3 liter turbo diesel engine with a 5-speed manual and full high/low 4wd. The SR model like mine has no carpets so you can pull out the rubber plugs and hose out the interior. Not a kei truck, but a lot smaller than what you call trucks in america. They&#039;re everywhere in australia/nz/sa. No regrets because I need it for work. Being able to haul shit around and pitch a tent in the back is just a bonus', 'filename': 'hilux', 'ext': '.jpg', 'w': 1282, 'h': 851, 'tn_w': 125, 'tn_h': 82, 'tim': 1670634042370296, 'time': 1670634042, 'md5': '2vAW86XbWdz28g1zIHL4Qg==', 'fsize': 409506, 'resto': 2500079}]",1670634042,0.0,0.0,,
78,2501342,,,11/25/22(Fri)17:01:27,Anonymous,,Another one bites the dust. Do people not plan at all for their hikes?,DA8C96F8-1F7C-49AE-9AAB-7B5AD4865AAE,.jpg,1284.0,2062.0,155.0,250.0,1669413687268037.0,1669413687,aAwjl4AwJlUury8jRBUiLg==,1090423.0,0,,another-one-bites-the-dust-do-people-not-plan-at,77,6,72.0,6.0,"[{'no': 2506323, 'now': '12/07/22(Wed)10:16:46', 'name': 'Anonymous', 'com': '<a href=""#p2504599"" class=""quotelink"">&gt;&gt;2504599</a><br>Lol checked and agreed, it sadly would not surprise me that some people would literally die before they built a survival fire during a burn ban. I actually do feel bad that they died, but I wonder how stupid they have to be to not leave when it started getting cold, start a fire or somehow find some level of shelter.', 'time': 1670426206, 'resto': 2501342}, {'no': 2506343, 'now': '12/07/22(Wed)11:48:06', 'name': 'Anonymous', 'com': '<a href=""#p2502150"" class=""quotelink"">&gt;&gt;2502150</a><br>She wasn&#039;t sick, I don&#039;t think Nurgle is gettin this one either.', 'time': 1670431686, 'resto': 2501342}, {'no': 2506905, 'now': '12/08/22(Thu)19:31:01', 'name': 'Anonymous', 'com': '<a href=""#p2506223"" class=""quotelink"">&gt;&gt;2506223</a><br>I&#039;ve never needed one in 53 years of /out/. Do the warming packets last? I feel like I&#039;d throw one in my pack and it would be past date by the time I needed it.', 'time': 1670545861, 'resto': 2501342}, {'no': 2507604, 'now': '12/09/22(Fri)19:33:07', 'name': 'Anonymous', 'com': '<a href=""#p2502891"" class=""quotelink"">&gt;&gt;2502891</a><br>Kek. Thx anon.', 'time': 1670632387, 'resto': 2501342}, {'no': 2507610, 'now': '12/09/22(Fri)19:45:36', 'name': 'Anonymous', 'com': '<a href=""#p2506012"" class=""quotelink"">&gt;&gt;2506012</a><br>Neanderthal women had similar bone density to the men and have evidence on their skeletal remains that are similar to the injuries rodeo clowns have in their bones. <br>This indicates that Neanderthal women hunted almost as much or as much as the men. <br>They died out for a reason.', 'time': 1670633136, 'resto': 2501342}]",1670633136,0.0,0.0,,
79,2501443,,,11/25/22(Fri)20:14:54,Anonymous,/out/ christmas in 2016,"Hi /out/<br>It&#039;s been a couple of years since I&#039;ve been here.<br>But after all this time has passed I want to come back thank /out/ for your gift.<br>I don&#039;t know if we&#039;re still doing wishlists for christmas or if the board has gotten to big for that.<br><br>But back in the day we all posted our wishlists in the /out/ christmas thread. My wishlist consisted of just this Mora knife, which some anon bought for me.<br>That was six years ago. Since then this knife went everywhere with me, it&#039;s the only knive I use when I go /out/. I just want to say thank you anon. I appreciate your gift.It&#039;s still in use six years later and I will continue to use it for many, many years to come.<br>Thank you.<br><br>Also for the tards: There is not a speck of rust on the blade, it&#039;s a patina consisting of olive oil ans beeswax, that&#039;s why the blade is so dark.",Outs Christmas Gift,.jpg,4032.0,2268.0,250.0,140.0,1669425294333296.0,1669425294,zDcxyAlesSvlZuQEfqK06Q==,3270158.0,0,,out-christmas-in-2016,24,4,19.0,4.0,"[{'no': 2506327, 'now': '12/07/22(Wed)10:46:49', 'name': 'Anonymous', 'com': 'I&#039;d kill for a Pukko', 'time': 1670428009, 'resto': 2501443}, {'no': 2507571, 'now': '12/09/22(Fri)18:06:53', 'name': 'Anonymous', 'com': 'I cant belive this thread only got 20 reply <br>This board and 4chan in general has went to crap <br>I used to get such joy , now there are not even annual threads anymore <br>The culture is lost <br>Oh well , I guess all good things end', 'time': 1670627213, 'resto': 2501443}, {'no': 2507578, 'now': '12/09/22(Fri)18:19:58', 'name': 'Anonymous', 'com': '<a href=""#p2507571"" class=""quotelink"">&gt;&gt;2507571</a><br>Oh boo hoo, we&#039;re all still here faggot and the board is just fine so stop crying about it. The worst sort of poster is the one who is so busy complaining about the &#039;lost culture&#039; that they do nothing to contribute to the current culture. Fuck you, sincerely. -Anon', 'time': 1670627998, 'resto': 2501443}, {'no': 2507594, 'now': '12/09/22(Fri)19:04:56', 'name': 'Anonymous', 'com': '<a href=""#p2507571"" class=""quotelink"">&gt;&gt;2507571</a><br>I jumped back on here after a very extended break, sad to see everyone just throwing their shit around like monkeys rather than encouraging fellow enthusiasts of the same hobby to.. well actually enjoy it?', 'time': 1670630696, 'resto': 2501443}, {'no': 2507598, 'now': '12/09/22(Fri)19:14:34', 'name': 'Anonymous', 'com': '<a href=""#p2507594"" class=""quotelink"">&gt;&gt;2507594</a><br>Are we browsing the same board? Or do you just have your selective memory glasses on? Seems to be plenty of encouragement and good discussion to me. Certainly among the best of any board here. As for shit throwing, you do remember what site you&#039;re browsing, don&#039;t you anon?', 'time': 1670631274, 'resto': 2501443}]",1670631274,0.0,0.0,,
80,2476498,,,10/07/22(Fri)17:33:28,Anonymous,,"Thoughts on sailboats? Any tips for a novice sailor? <br><br>I&#039;m in the Puget Sound, Washington area &amp; I&#039;ve been contemplating getting a sailboat for years. <br>I seem to have a good opportunity since my uncle is selling one of his sailboats. I&#039;ll go sailing tomorrow morning for a couple hours for the first time. <br>The boat is a Catalina 27. <br><br>Anyone here has experience &amp; knowledge they&#039;d like to share?",Cat27,.jpg,1200.0,1564.0,191.0,250.0,1665178408478338.0,1665178408,JUrhe4Uy68jSys1uvexELA==,309291.0,0,,thoughts-on-sailboats-any-tips-for-a-novice,87,14,82.0,14.0,"[{'no': 2505912, 'now': '12/05/22(Mon)23:26:47', 'name': 'Anonymous', 'com': 'On the verge of buying one. Someone convince me not to.', 'time': 1670300807, 'resto': 2476498}, {'no': 2505928, 'now': '12/05/22(Mon)23:45:08', 'name': 'Anonymous', 'com': '<a href=""#p2505912"" class=""quotelink"">&gt;&gt;2505912</a><br>Have you sailed, like ever? Can you read a chart? Do you have the slightest clue what living on a boat is like?', 'time': 1670301908, 'resto': 2476498}, {'no': 2505929, 'now': '12/05/22(Mon)23:47:24', 'name': 'Anonymous', 'com': '<a href=""#p2499139"" class=""quotelink"">&gt;&gt;2499139</a><br>A boat race is when 2 sail boats meet.', 'time': 1670302044, 'resto': 2476498}, {'no': 2507501, 'now': '12/09/22(Fri)16:53:13', 'name': 'Anonymous', 'com': 'I&#039;m starting to be convinced owning a boat sucks. There goes one of my hopes and dreams.', 'time': 1670622793, 'resto': 2476498}, {'no': 2507591, 'now': '12/09/22(Fri)18:51:45', 'name': 'Anonymous', 'com': '<a href=""#p2494337"" class=""quotelink"">&gt;&gt;2494337</a><br>shitting at sea sucks man. pissing, on the other hand, can be lit', 'time': 1670629905, 'resto': 2476498}]",1670629905,0.0,0.0,,
81,2492125,,,11/05/22(Sat)14:59:13,Anonymous,/patch/ thread,"<span class=""quote"">&gt;Winter Edition</span><br>Post yer patches, discuss yer patches, design yer patches.",snow-embroidered-ptatch,.jpg,656.0,652.0,250.0,248.0,1667674753949808.0,1667674753,Gc5UMDRYrBLaHazLbyXXlA==,77613.0,0,,patch-thread,97,23,92.0,23.0,"[{'no': 2505732, 'now': '12/05/22(Mon)16:42:32', 'name': 'Anonymous', 'com': '<a href=""#p2505727"" class=""quotelink"">&gt;&gt;2505727</a><br>American with a forest brothers patch desu?', 'time': 1670276552, 'resto': 2492125}, {'no': 2505749, 'now': '12/05/22(Mon)17:29:42', 'name': 'Anonymous', 'com': '<a href=""#p2505732"" class=""quotelink"">&gt;&gt;2505732</a><br>Sometimes I forget how retarded Europeans are.', 'time': 1670279382, 'resto': 2492125}, {'no': 2505755, 'now': '12/05/22(Mon)18:00:07', 'name': 'Anonymous', 'com': '<a href=""#p2505749"" class=""quotelink"">&gt;&gt;2505749</a><br>Why would you assume I&#039;m an european desu?', 'time': 1670281207, 'resto': 2492125}, {'no': 2505945, 'now': '12/06/22(Tue)00:30:22', 'name': 'Anonymous', 'com': '<a href=""#p2505727"" class=""quotelink"">&gt;&gt;2505727</a><br>Thanks anon', 'time': 1670304622, 'resto': 2492125}, {'no': 2507587, 'now': '12/09/22(Fri)18:49:32', 'name': 'Anonymous', 'com': '<a href=""#p2505353"" class=""quotelink"">&gt;&gt;2505353</a><br><a href=""#p2505079"" class=""quotelink"">&gt;&gt;2505079</a><br>looks nice lads', 'time': 1670629772, 'resto': 2492125}]",1670629772,0.0,0.0,,
82,2499135,,,11/21/22(Mon)01:09:59,Anonymous,,"Ski season has started, yet I&#039;m not seeing any of you fags out here",PXL_20221120_201959748,.jpg,4032.0,3024.0,250.0,187.0,1669010999927520.0,1669010999,WQpo87/N8E6PCwxZHsj+Vg==,3295076.0,0,,ski-season-has-started-yet-im-not-seeing-any-of,58,7,53.0,7.0,"[{'no': 2507170, 'now': '12/09/22(Fri)04:47:31', 'name': 'Anonymous', 'com': '<a href=""#p2499959"" class=""quotelink"">&gt;&gt;2499959</a><br><span class=""quote"">&gt;But when it came to being on the ski slopes, yeah it&#039;s nice, but there&#039;s so many people, all the snow blowers and all that shit it doesn&#039;t feel like being innawoods it feels just like the same thing as going to play soccer or something.</span><br>This depends heavily on where and when you ski. At the resorts in my area (Mt Hood Oregon) so long as it&#039;s not a super busy day you can go off into the trees between runs and be almost completely alone. And if you become skilled enough you can get into true backwoods skiing.', 'time': 1670579251, 'resto': 2499135}, {'no': 2507251, 'now': '12/09/22(Fri)11:06:19', 'name': 'Anonymous', 'com': '<a href=""#p2507170"" class=""quotelink"">&gt;&gt;2507170</a><br>Tree skiing is so much fun.', 'time': 1670601979, 'resto': 2499135}, {'no': 2507399, 'now': '12/09/22(Fri)14:28:42', 'name': 'Anonymous', 'com': 'Oh boy I sure can&#039;t wait to drive 13 hours to slide down a hill', 'time': 1670614122, 'resto': 2499135}, {'no': 2507422, 'now': '12/09/22(Fri)15:07:58', 'name': 'Anonymous', 'com': '<a href=""#p2506816"" class=""quotelink"">&gt;&gt;2506816</a><br><span class=""quote"">&gt;vail.com</span><br><span class=""quote"">&gt;1 day ticket for tomorrow, purchased today.</span><br><span class=""quote"">&gt;$233</span><br><span class=""quote"">&gt;1 day ticket for a Wednesday in the end of January, purchased today.</span><br><span class=""quote"">&gt;$208</span>', 'time': 1670616478, 'resto': 2499135}, {'no': 2507580, 'now': '12/09/22(Fri)18:33:38', 'name': 'Anonymous', 'com': '<a href=""#p2507399"" class=""quotelink"">&gt;&gt;2507399</a><br>flyover mountainlet detected', 'time': 1670628818, 'resto': 2499135}]",1670628818,0.0,0.0,,
83,2506626,,,12/08/22(Thu)04:32:04,Anonymous,Building rainwater powered watermill,Would this work? What is this process called?,A9DA5572-E968-4326-A72B-33E119DD4386,.jpg,4032.0,3024.0,250.0,187.0,1670491924393143.0,1670491924,HI9uW4Iil/5M8oaAGYDDDQ==,3597575.0,0,,building-rainwater-powered-watermill,4,0,,,"[{'no': 2506628, 'now': '12/08/22(Thu)04:39:14', 'name': 'Anonymous', 'com': 'https://www.youtube.com/watch?v=S6o<wbr>NxckjEiE<br><br>Do you mean like this ?', 'time': 1670492354, 'resto': 2506626}, {'no': 2507456, 'now': '12/09/22(Fri)16:08:56', 'name': 'Anonymous', 'com': '<a href=""#p2506626"" class=""quotelink"">&gt;&gt;2506626</a><br>I can see it working OP but it wont be that efficient <br>Youll probably be able to charge your phone on it unless its a gigantic system.', 'time': 1670620136, 'resto': 2506626}, {'no': 2507559, 'now': '12/09/22(Fri)17:54:10', 'name': 'Anonymous', 'com': '<a href=""#p2506626"" class=""quotelink"">&gt;&gt;2506626</a><br>technically yes you can get power, but it will be minuscule:<br><br>Net Hydraulic Power Available to Turbine= Useful Head (meters) x Flow (lps) x 9.81 = Watts', 'time': 1670626450, 'resto': 2506626}, {'no': 2507563, 'now': '12/09/22(Fri)17:58:45', 'name': 'Anonymous', 'com': '<a href=""#p2507559"" class=""quotelink"">&gt;&gt;2507559</a><br>thank you math anon for tracking down that equation. otherwise the thread is on par with<br><span class=""quote"">&gt;i&#039;ll cover my tesla with solar panels and then i&#039;ll never have to stop to charge my batteries.</span>', 'time': 1670626725, 'resto': 2506626}]",1670626725,0.0,0.0,,
84,2470565,,,09/28/22(Wed)13:48:32,Anonymous,,How do you avoid the crowds Anon?,7DEDA746-0AC3-4CF7-B75D-54CBA7AC8A32,.jpg,1170.0,649.0,250.0,138.0,1664387312396229.0,1664387312,kizQyVxMZKpDX2Cyqcqecg==,828439.0,0,,how-do-you-avoid-the-crowds-anon,206,22,201.0,21.0,"[{'no': 2505709, 'now': '12/05/22(Mon)15:45:47', 'name': 'Anonymous', 'com': '<a href=""#p2470565"" class=""quotelink"">&gt;&gt;2470565</a><br>I laugh at them and shame them for being NPCs. Charade around like an ape with my cell phone taking pics of everything for antisocial media. Fuck them.', 'time': 1670273147, 'resto': 2470565}, {'no': 2505748, 'now': '12/05/22(Mon)17:21:12', 'name': 'Anonymous', 'com': '<a href=""#p2505709"" class=""quotelink"">&gt;&gt;2505709</a><br>But thats literally the premise of the board. If we had women here you&#039;d see pics like OPs everywhere', 'time': 1670278872, 'resto': 2470565}, {'no': 2506734, 'now': '12/08/22(Thu)12:04:23', 'name': 'Anonymous', 'com': '<a href=""#p2470583"" class=""quotelink"">&gt;&gt;2470583</a><br>hm', 'time': 1670519063, 'resto': 2470565}, {'no': 2507558, 'now': '12/09/22(Fri)17:52:00', 'name': 'Anonymous', 'com': '<a href=""#p2470583"" class=""quotelink"">&gt;&gt;2470583</a><br>frick', 'time': 1670626320, 'resto': 2470565}, {'no': 2508247, 'now': '12/11/22(Sun)05:13:43', 'name': 'Anonymous', 'com': '<a href=""#p2504175"" class=""quotelink"">&gt;&gt;2504175</a><br>Stay mad.', 'filename': '1655352586256m', 'ext': '.jpg', 'w': 1024, 'h': 1024, 'tn_w': 125, 'tn_h': 125, 'tim': 1670753623334708, 'time': 1670753623, 'md5': 'GBjr8EHvjLuiJ9yjW+m1yQ==', 'fsize': 132199, 'resto': 2470565}]",1670753623,0.0,0.0,,
