,no,sticky,closed,now,name,sub,com,filename,ext,w,h,tn_w,tn_h,tim,time,md5,fsize,resto,capcode,semantic_url,replies,images,omitted_posts,omitted_images,last_replies,last_modified,bumplimit,imagelimit,trip,filedeleted
0,38571,1.0,1.0,03/21/13(Thu)22:55,Anonymous,Welcome to /out/!,"We encourage you to have a look around the catalog first to see what we’re all about before posting your first thread. Topics typically posted here include:<br><span class=""quote"">&gt;Outdoor recreational activities (Hiking, trail running, bushwhacking, camping, spelunking, geocaching, orienteering, expeditions, urban exploration, backpacking, etc.)</span><br><span class=""quote"">&gt;Gardening, farming and related activities</span><br><span class=""quote"">&gt;Hunting and fishing, and other activities involving the stalking or taking of game (including bird-watching)</span><br><span class=""quote"">&gt;Outdoor survival, bushcraft, foraging, self-sustenance in nature, train-hopping, hoboism, etc.</span><br><span class=""quote"">&gt;Outdoor destinations and exploration (specific trails, parks, regions, etc.)</span><br><span class=""quote"">&gt;Water-related activities (boats, diving, etc.)</span><br><span class=""quote"">&gt;Outdoor philosophy (conservation, Leave No Trace, protectionism, etc.)</span><br><span class=""quote"">&gt;Outdoor building and living (cabins, huts, treehouses, etc.)</span><br><span class=""quote"">&gt;Outdoor social activities and organizations (meet-ups, Scouts, NOLS, etc.)</span><br><span class=""quote"">&gt;Gear related to any of the above topics</span><br><br>Most topics related to the outdoors are fine. Write properly, behave politely, encourage a respectful community, and most importantly, GO OUTSIDE!!",out1,.jpg,746.0,514.0,250.0,172.0,1363920914821.0,1363920914,/lDkVbj+h0ONGCPzPr1gtA==,75118.0,0,mod,welcome-to-out,2,1,1.0,1.0,"[{'no': 2400529, 'now': '06/23/22(Thu)15:36:09', 'name': 'Anonymous', 'com': 'Just a friendly reminder that threads about weapons which do not pertain to their use in outdoor activities should be posted on /k/ instead. Thanks.', 'time': 1656012969, 'resto': 38571, 'capcode': 'mod'}]",1656012969,,,,
1,2497662,,,11/18/22(Fri)00:50:18,Anonymous,,"Fucking with people innawoods<br><span class=""quote"">&gt;be me</span><br><span class=""quote"">&gt;night, in the mountains</span><br><span class=""quote"">&gt;trail runs parallel to road</span><br><span class=""quote"">&gt;some people hanging out along the trail</span><br><span class=""quote"">&gt;I make howling noises to spook them</span><br><span class=""quote"">&gt;one of them comes to investigate</span><br><span class=""quote"">&gt;so I start walking down the road away from them</span><br><span class=""quote"">&gt;seems he is gaining on me</span><br><span class=""quote"">&gt;I hurry up to get away from him</span><br><span class=""quote"">&gt;never got caught</span><br>your turn to post stories of fucking with people or being fucked with by people innawoods (or innadesert or innamountains or innaotherwilderness)",water,.jpg,960.0,960.0,250.0,250.0,1668750618297085.0,1668750618,oeYmPo0pYMM4M8tL0yu2VA==,140840.0,0,,fucking-with-people-innawoods,54,8,49.0,8.0,"[{'no': 2506281, 'now': '12/07/22(Wed)06:12:01', 'name': 'Anonymous', 'com': '<a href=""#p2497662"" class=""quotelink"">&gt;&gt;2497662</a><br>why are they walking through water?', 'time': 1670411521, 'resto': 2497662}, {'no': 2506557, 'now': '12/07/22(Wed)22:29:37', 'name': 'Anonymous', 'com': '<a href=""#p2502014"" class=""quotelink"">&gt;&gt;2502014</a><br>this is true anon. don&#039;t fuck with game wardens', 'time': 1670470177, 'resto': 2497662}, {'no': 2506580, 'now': '12/07/22(Wed)23:50:33', 'name': 'Anonymous', 'com': '<a href=""#p2498656"" class=""quotelink"">&gt;&gt;2498656</a><br>Crunch', 'time': 1670475033, 'resto': 2497662}, {'no': 2506625, 'now': '12/08/22(Thu)04:28:18', 'name': 'Anonymous', 'com': '<a href=""#p2506281"" class=""quotelink"">&gt;&gt;2506281</a><br>To get to the other side', 'time': 1670491698, 'resto': 2497662}, {'no': 2508265, 'now': '12/11/22(Sun)07:12:55', 'name': 'Anonymous', 'com': '<a href=""#p2506625"" class=""quotelink"">&gt;&gt;2506625</a><br>in their clothes?', 'time': 1670760775, 'resto': 2497662}]",1670760775,0.0,0.0,,
2,2508082,,,12/10/22(Sat)19:36:28,Anonymous,I am an anti vax outdoors person,"So for some reason the only outdoor club in my entire 500km vicinity has decided that they will require proof of vaccination for the one event I want to go to (for some reason they won’t require it for the other events).<br><br>Dear god. Help me. Do you think they will check? It’s literally an excursion with 10 spots, outdoors.",E70958B7-457F-4B09-9EC2-C6B8BAC03847,.jpg,460.0,346.0,250.0,188.0,1670718988466605.0,1670718988,zqY1ENo2fXWsWryEZtktFQ==,38317.0,0,,i-am-an-anti-vax-outdoors-person,40,3,35.0,3.0,"[{'no': 2508237, 'now': '12/11/22(Sun)03:57:36', 'name': 'Anonymous', 'com': 'This is the funniest thread<br><br>Most antivaxxers are just individualist LARPers, which honestly is fine, take the risk. Yet you&#039;re here relying on others and some instructors of a club to take you camping??<br><br><span class=""quote"">&gt;I am an anti vax outdoors person</span><br><span class=""quote"">&gt;I never left my house during the entire pandemic</span><br><span class=""quote"">&gt;Because I’m not experienced and this was supposed to teach me everything I need to know also I would be scared alone and it would be more fun with others I think.</span><br><br>Just buy the bare minimum (sleep gear, survival/medical essentials, clothes if necessary), take some books with you and go wild. You&#039;re not restricted to campgrounds, they&#039;ve progressively gotten worse thanks to retards &amp; overpopulation. <br><br>Get this shit too, it&#039;ll teach you 100x more useful info than some faggot instructor<br>https://www.amazon.com/SAS-Survival<wbr>-Handbook-Third-Surviving/dp/006237<wbr>8074', 'time': 1670749056, 'resto': 2508082}, {'no': 2508245, 'now': '12/11/22(Sun)04:58:31', 'name': 'Anonymous', 'com': 'Fuck off, OP. Go be stupid somewhere else.', 'time': 1670752711, 'resto': 2508082}, {'no': 2508248, 'now': '12/11/22(Sun)05:13:58', 'name': 'Anonymous', 'com': '<a href=""#p2508168"" class=""quotelink"">&gt;&gt;2508168</a><br>photoshop a digital copy and save the jpg to your phone, and when they ask for proof of vaxx show them your phone.', 'time': 1670753638, 'resto': 2508082}, {'no': 2508255, 'now': '12/11/22(Sun)06:03:46', 'name': 'Anonymous', 'com': '<a href=""#p2508114"" class=""quotelink"">&gt;&gt;2508114</a><br>How many shots and boosters do you need to be considered vaxxinated? 1? 2? 3? 4? 5?', 'time': 1670756626, 'resto': 2508082}, {'no': 2508264, 'now': '12/11/22(Sun)07:08:17', 'name': 'Anonymous', 'com': '<a href=""#p2508169"" class=""quotelink"">&gt;&gt;2508169</a><br>yes. why are you not leaving your house?', 'time': 1670760497, 'resto': 2508082}]",1670760497,0.0,0.0,,
3,2507479,,,12/09/22(Fri)16:35:18,Anonymous,Question for girls mostly and about peeing etc.,"All the trails in my area are somewhat populated and there is no portapotties even in the parking lot.<br><br>It is extremely rare that you can hide somewhere to pee because the woods aren’t dense enough. <br><br>The only solution I can think of is to pee in my car once I have arrived, but I don’t think those female peeing devices would be great for that. I was thinking maybe using a yogourt container??? Has anyone had luck with this? <br><br>On a related and somewhat separate note- how tf do most women pee in the winter??? Do you just risk getting hypothermia and a cold wet ass?",722315EA-6220-4C8C-B9F2-3D2C8C96055B,.jpg,1600.0,1013.0,250.0,158.0,1670621718219083.0,1670621718,spWvt/DsO7b6KFZ3/BWIaw==,256176.0,0,,question-for-girls-mostly-and-about-peeing-etc,60,9,55.0,8.0,"[{'no': 2508222, 'now': '12/11/22(Sun)01:53:15', 'name': 'Anonymous', 'com': '<a href=""#p2508193"" class=""quotelink"">&gt;&gt;2508193</a><br>that&#039;s really good!<br><br>haha what if they were pooping instead...?', 'time': 1670741595, 'resto': 2507479}, {'no': 2508231, 'now': '12/11/22(Sun)02:56:41', 'name': 'Anonymous', 'com': '<a href=""#p2508015"" class=""quotelink"">&gt;&gt;2508015</a><br>how so?', 'time': 1670745401, 'resto': 2507479}, {'no': 2508238, 'now': '12/11/22(Sun)04:13:32', 'name': 'Anonymous', 'com': '<a href=""#p2507479"" class=""quotelink"">&gt;&gt;2507479</a><br><span class=""quote"">&gt;The only solution I can think of is to pee in my car once I have arrived, but I don’t think those female peeing devices would be great for that. I was thinking maybe using a yogourt container??? Has anyone had luck with this? </span><br>i once peed in a gatorade bottle while driving because it was either there or pull to the side of the road and i was making good time. yogurt container should work although i&#039;d recommend something with a lid that you can seal afterwards.<br><br><span class=""quote"">&gt;how tf do most women pee in the winter??? Do you just risk getting hypothermia and a cold wet ass?</span><br>same as during other seasons, just faster. hypothermia isn&#039;t going to set in during a pee, there&#039;s not enough of you exposed for long enough. your ass only gets cold and wet if you slip and fall on it. just make sure your footing is solid before you squat down. the little individual foil-wrapped wet wipes are good for wiping. tear only the top bit off to open it and you can stuff it right back in there afterwards and fold the top over. closes it well enough to stick back in your pocket until you can dispose of it.', 'time': 1670750012, 'resto': 2507479}, {'no': 2508239, 'now': '12/11/22(Sun)04:20:00', 'name': 'Anonymous', 'com': '<a href=""#p2508053"" class=""quotelink"">&gt;&gt;2508053</a><br>fucking kek', 'filename': '1591688769803', 'ext': '.jpg', 'w': 466, 'h': 443, 'tn_w': 124, 'tn_h': 118, 'tim': 1670750400038654, 'time': 1670750400, 'md5': 'wRnb3lrclUCcm/5uyhqUoQ==', 'fsize': 80912, 'resto': 2507479}, {'no': 2508263, 'now': '12/11/22(Sun)06:55:31', 'name': 'Anonymous', 'com': '<a href=""#p2508222"" class=""quotelink"">&gt;&gt;2508222</a><br>Based trips of a haha poster', 'time': 1670759731, 'resto': 2507479}]",1670759731,0.0,0.0,,
4,2507151,,,12/09/22(Fri)03:05:13,Kevin Van Dam,Fishing &amp; Tackle Thread,"#462-“Advent” Edition<br><br>Previous Thread:<br><a href=""/out/thread/2501379#p2501379"" class=""quotelink"">&gt;&gt;2501379</a><br><br>janny pls…<br><br>Thinking about picking up a new hobby? Want to get a memecaster? Haven&#039;t mastered the Palomar knot? Click here! <br>http://www.pastebin.com/u/fishingan<wbr>dtackle<br>https://imgur.com/a/1Xw3N<br><br>New Bong Fishin Guide<br>https://pastebin.com/sDB5SQTq<br><br>First for best telescopic rod is the one you exchanged for a 3pc.<br><br>Talk about fishin",C8F9AE15-2B36-428A-A696-E4AA2EF7A347,.jpg,1080.0,1080.0,250.0,250.0,1670573113360046.0,1670573113,u1ywr79zDWkaQJbVTC+Tnw==,286254.0,0,,fishing-tackle-thread,64,28,59.0,26.0,"[{'no': 2508166, 'now': '12/10/22(Sat)22:40:42', 'name': 'Anonymous', 'com': '<a href=""#p2508163"" class=""quotelink"">&gt;&gt;2508163</a><br>No, but I honestly can&#039;t believe you&#039;re still here.<br>Also, don&#039;t drink every day for five years. It will ruin your brain.', 'filename': '1658969181796571', 'ext': '.png', 'w': 443, 'h': 725, 'tn_w': 76, 'tn_h': 125, 'tim': 1670730042184376, 'time': 1670730042, 'md5': 'T/vqItCQMDTvJ2IrjaLbpQ==', 'fsize': 349535, 'resto': 2507151}, {'no': 2508221, 'now': '12/11/22(Sun)01:28:11', 'name': 'Anonymous', 'com': '<a href=""#p2508166"" class=""quotelink"">&gt;&gt;2508166</a><br>I drank every day for 10 years and I used to post here.', 'time': 1670740091, 'resto': 2507151}, {'no': 2508227, 'now': '12/11/22(Sun)02:28:41', 'name': 'Anonymous', 'com': '<a href=""#p2507320"" class=""quotelink"">&gt;&gt;2507320</a><br>Headlamp microfishing in the wintertime is the most prestigious and dedicated form of sport fishing that I can imagine. My hat is truly off to you.', 'time': 1670743721, 'resto': 2507151}, {'no': 2508232, 'now': '12/11/22(Sun)03:17:19', 'name': 'Anonymous', 'com': 'Been a while fellows… Poorfag paddleboarding/kayak Frankenstein here. I tend to pop in and out because I end up being out adventuring quite a bit. As it cools down or if I have free time I pop on and it’s nice to see familiar folks still here. 2022 has been a good year.', 'filename': '8D7D355D-F97A-4EA8-8DC0-A719AA8D6FB8', 'ext': '.jpg', 'w': 1404, 'h': 790, 'tn_w': 125, 'tn_h': 70, 'tim': 1670746639788699, 'time': 1670746639, 'md5': 'PsRs4aRoByPOz9tV5iChLw==', 'fsize': 169707, 'resto': 2507151}, {'no': 2508262, 'now': '12/11/22(Sun)06:43:34', 'name': 'Anonymous', 'com': '<a href=""#p2508091"" class=""quotelink"">&gt;&gt;2508091</a><br><a href=""#p2508092"" class=""quotelink"">&gt;&gt;2508092</a><br>Lookin good anon, keep up the good work!', 'time': 1670759014, 'resto': 2507151}]",1670759014,0.0,0.0,!ZNBx60Gj/k,
5,2504895,,,12/03/22(Sat)19:04:41,Anonymous,,"Can &#039;Cowboy&#039; boots be good for hiking?<br><span class=""quote"">&gt;inb4 muh ankle support</span><br>Is that all?",boot,.png,876.0,865.0,250.0,246.0,1670112281060352.0,1670112281,1snG9y6u/W7YSh2v8EFFJQ==,886984.0,0,,can-cowboy-boots-be-good-for-hiking,48,5,43.0,4.0,"[{'no': 2507791, 'now': '12/10/22(Sat)04:38:52', 'name': 'Anonymous', 'com': '<a href=""#p2504996"" class=""quotelink"">&gt;&gt;2504996</a><br><a href=""#p2505692"" class=""quotelink"">&gt;&gt;2505692</a><br>Thats not reddit spacing newfag', 'time': 1670665132, 'resto': 2504895}, {'no': 2507923, 'now': '12/10/22(Sat)13:42:33', 'name': 'Anonymous', 'com': '<a href=""#p2507791"" class=""quotelink"">&gt;&gt;2507791</a><br><br>Newfag.<br><br>The LEADING space is Reddlt. Past that is a mixed bag. Stop trying to prove you aren&#039;t a newfag because...<br><br>you can&#039;t even.', 'time': 1670697753, 'resto': 2504895}, {'no': 2507931, 'now': '12/10/22(Sat)13:48:32', 'name': 'Anonymous', 'com': '<a href=""#p2504895"" class=""quotelink"">&gt;&gt;2504895</a><br>Wannabe cowboy here. <br>They are fine to walk in. But they aren&#039;t good for carrying a load. <br>Basically, if your horse dies while your out you can hike back, With a canteen and a possible bag. Nothing else or your feet will die next. <br>Hiking boots are for hiking.', 'filename': 'Taffy flats Nov 2022', 'ext': '.jpg', 'w': 1079, 'h': 806, 'tn_w': 125, 'tn_h': 93, 'tim': 1670698112793642, 'time': 1670698112, 'md5': 'MqJklks+n8YkdxERM/HdrQ==', 'fsize': 969792, 'resto': 2504895}, {'no': 2508183, 'now': '12/10/22(Sat)23:37:28', 'name': 'Anonymous', 'com': 'I&#039;ve spent a lot of time hiking in my Ariats out in the desert. I wouldn&#039;t recommend it for anything but the cool factor', 'time': 1670733448, 'resto': 2504895}, {'no': 2508261, 'now': '12/11/22(Sun)06:39:39', 'name': 'Anonymous', 'com': '<a href=""#p2507923"" class=""quotelink"">&gt;&gt;2507923</a><br>Guess what? You&#039;re wrong. Keep outing yourself as a total newfag unfamiliar with chan culture. <br>The only redeeming quality this board has anymore is the entertainment value of retards like you acting like an authority on subjects you know nothing about. And then seething and screeching when you get proven wrong over and over.', 'time': 1670758779, 'resto': 2504895}]",1670758779,0.0,0.0,,
6,2498596,,,11/19/22(Sat)22:27:30,Anonymous,Out on motorcycles,Anybody like to moto camp,2A236673-CC5C-4DEF-8C1B-CFC7D4630C6D,.jpg,4032.0,3024.0,250.0,187.0,1668914850369750.0,1668914850,rbyUsyNrmf37+COg9qcQCw==,5189430.0,0,,out-on-motorcycles,50,23,45.0,22.0,"[{'no': 2507155, 'now': '12/09/22(Fri)03:11:52', 'name': 'Anonymous', 'com': '<a href=""#p2506947"" class=""quotelink"">&gt;&gt;2506947</a><br>yeah I dunno, it’s only on the bike too. I’m a shorts in winter kind of gaybo, with zero issues.<br>on a related note though whenever my fight or flight kicks in my dong fully retracts into my body and goes numb. Got a weird dick I guess mang', 'time': 1670573512, 'resto': 2498596}, {'no': 2507240, 'now': '12/09/22(Fri)10:29:21', 'name': 'Anonymous', 'com': '<a href=""#p2506769"" class=""quotelink"">&gt;&gt;2506769</a><br>Thanks my dude. That&#039;s the plan I have with it too, unfortunately haven&#039;t got a lot of miles in it yet. Here she is with some old bags I found, not pretty but they work and you can&#039;t beat free.', 'filename': '20221209_082423', 'ext': '.jpg', 'w': 1450, 'h': 1088, 'tn_w': 125, 'tn_h': 93, 'tim': 1670599761192290, 'time': 1670599761, 'md5': 'TP55xfcP0lvaBQNpvrRejQ==', 'fsize': 737915, 'resto': 2498596}, {'no': 2508235, 'now': '12/11/22(Sun)03:39:17', 'name': 'Anonymous', 'com': 'bump', 'time': 1670747957, 'resto': 2498596}, {'no': 2508240, 'now': '12/11/22(Sun)04:27:22', 'name': 'Anonymous', 'com': '<a href=""#p2507240"" class=""quotelink"">&gt;&gt;2507240</a><br>what do the nigger runes on the helmet mean?', 'time': 1670750842, 'resto': 2498596}, {'no': 2508260, 'now': '12/11/22(Sun)06:34:35', 'name': 'Anonymous', 'com': 'I really want to get into this thing, but bikes are super expensive. I really like the look and feel of the small dualsports, but I&#039;m worried about taking them onto the open roads around here and being flattened by a zoomer in a tesla, or drugged out you know what, because I don&#039;t have enough power to pull away.<br><br>What do? Even the two lane roads are 55mph here.', 'time': 1670758475, 'resto': 2498596}]",1670758475,0.0,0.0,,
7,2506718,,,12/08/22(Thu)11:18:03,Anonymous,,How do I get into foraging without killing myself? The descriptions and pictures never match with reality.,s-l500,.jpg,500.0,500.0,250.0,250.0,1670516283058619.0,1670516283,hFLPSvVIKi9l24gsyMt7Ww==,47492.0,0,,how-do-i-get-into-foraging-without-killing-myself,112,18,107.0,18.0,"[{'no': 2508069, 'now': '12/10/22(Sat)19:11:33', 'name': 'Anonymous', 'com': '<a href=""#p2508043"" class=""quotelink"">&gt;&gt;2508043</a><br>It&#039;s not an argument <br>and you are involved <br>A lovely story <br>Foresters justify encroaching, they don&#039;t ever protect. You don&#039;t have the option of sitting on the sidelines.', 'time': 1670717493, 'resto': 2506718}, {'no': 2508075, 'now': '12/10/22(Sat)19:21:01', 'name': 'Anonymous', 'com': '<a href=""#p2506718"" class=""quotelink"">&gt;&gt;2506718</a><br>always use multiple sources that are known to be reliable. buy books the internet is trash for this', 'time': 1670718061, 'resto': 2506718}, {'no': 2508081, 'now': '12/10/22(Sat)19:34:05', 'name': 'Anonymous', 'com': '<a href=""#p2508075"" class=""quotelink"">&gt;&gt;2508075</a><br><span class=""quote"">&gt;internet is trash for this </span><br>the irony is palpable <br><span class=""quote"">&gt;didn&#039;t read the thread at all</span>', 'time': 1670718845, 'resto': 2506718}, {'no': 2508256, 'now': '12/11/22(Sun)06:05:21', 'name': 'Anonymous', 'com': '<a href=""#p2507577"" class=""quotelink"">&gt;&gt;2507577</a><br>You could learn a bit of humility holy fuck', 'time': 1670756721, 'resto': 2506718}, {'no': 2508259, 'now': '12/11/22(Sun)06:26:03', 'name': 'Anonymous', 'com': '<a href=""#p2507577"" class=""quotelink"">&gt;&gt;2507577</a><br><span class=""quote"">&gt;I&#039;m a dendrologist,</span><br>Imagine being such a pathetic loser that you brag about this. /out/ is akin to the high school nerd table during lunchtime.', 'time': 1670757963, 'resto': 2506718}]",1670757963,0.0,0.0,,
8,2501281,,,11/25/22(Fri)14:23:43,Anonymous,,"Old growth forest on Vancouver Island, Canada that was logged recently",U,.jpg,2160.0,1350.0,250.0,156.0,1669404223615576.0,1669404223,RZWUt4bBoyaWqyZtfolWTg==,1303183.0,0,,old-growth-forest-on-vancouver-island-canada-that,116,16,111.0,15.0,"[{'no': 2508143, 'now': '12/10/22(Sat)21:48:10', 'name': 'Anonymous', 'com': '<a href=""#p2507991"" class=""quotelink"">&gt;&gt;2507991</a><br>Wow, are you really so proud of this fell you had to take a picture with it? And post it? &#039;big wood&#039;? Holy lmao you must be green, things not even 4 ft across. I&#039;ve dropped twice that size within city limits haha. Loggers really are the most fragile of manlihoods.', 'filename': '1', 'ext': '.jpg', 'w': 548, 'h': 731, 'tn_w': 93, 'tn_h': 125, 'tim': 1670726890910754, 'time': 1670726890, 'md5': 'Wn+IY2Kr8tHb7tY/0hu0eQ==', 'fsize': 225469, 'resto': 2501281}, {'no': 2508175, 'now': '12/10/22(Sat)23:09:34', 'name': 'Anonymous', 'com': '<a href=""#p2508111"" class=""quotelink"">&gt;&gt;2508111</a><br><a href=""#p2508143"" class=""quotelink"">&gt;&gt;2508143</a><br>the amount of wrong information you people operate on is impressive, no wonder a photo of a faggot hippy can sway you so easily', 'time': 1670731774, 'resto': 2501281}, {'no': 2508191, 'now': '12/11/22(Sun)00:01:13', 'name': 'Anonymous', 'com': '<a href=""#p2508175"" class=""quotelink"">&gt;&gt;2508175</a><br>And I suppose you know the right information, then :^)', 'time': 1670734873, 'resto': 2501281}, {'no': 2508243, 'now': '12/11/22(Sun)04:43:16', 'name': 'Anonymous', 'com': '<span class=""quote"">&gt;almost all the threads on the front page of /out/ are troll threads</span><br>What the fuck is this where are the jannies', 'time': 1670751796, 'resto': 2501281}, {'no': 2508258, 'now': '12/11/22(Sun)06:16:30', 'name': 'Anonymous', 'com': '<a href=""#p2508127"" class=""quotelink"">&gt;&gt;2508127</a><br><span class=""quote"">&gt;holy based fuck trees</span><br>Trees are useless. They just stand there looking stupid, always obstructing my view.', 'time': 1670757390, 'resto': 2501281}]",1670757390,0.0,0.0,,
