,no,now,name,com,filename,ext,w,h,tn_w,tn_h,tim,time,md5,fsize,resto,country,bumplimit,imagelimit,semantic_url,country_name,replies,images,last_modified,omitted_posts,omitted_images,last_replies,sub,trip
0,126866551,12/09/22(Fri)20:48:11,Anonymous,"Dad, can you lend us a coach? Please?",images,.png,339,226,250,166,1670636891568234,1670636891,iWHJN0SzKne23Yp1yohUGg==,27213,0,BR,0,0,dad-can-you-lend-us-a-coach-please,Brazil,0,0,1670636891,,,,,
1,126860271,12/09/22(Fri)19:14:54,Anonymous,"Now the dust has settled, was it kino?",C86DFF5B-CD8F-40D4-8E81-35044CE5EF5F,.jpg,1242,1487,208,250,1670631294155736,1670631294,dl7xHUYr18zTiTjMcJCsmg==,1742180,0,CA,0,0,now-the-dust-has-settled-was-it-kino,Canada,147,22,1670636890,142.0,22.0,"[{'no': 126866506, 'now': '12/09/22(Fri)20:47:19', 'name': 'Anonymous', 'com': '<a href=""#p126866266"" class=""quotelink"">&gt;&gt;126866266</a><br>Noo the heckin good boy dutcherinos!! Youre all a bunch of faggots', 'time': 1670636839, 'resto': 126860271, 'country': 'AR', 'country_name': 'Argentina'}, {'no': 126866522, 'now': '12/09/22(Fri)20:47:39', 'name': 'Anonymous', 'com': '<a href=""#p126860596"" class=""quotelink"">&gt;&gt;126860596</a><br>Two ugly faults in a row and then kicks the ball at the bench and he gets away with it LMAO. Then Messi whine about the ref fucking them over. You can&#039;t make this shit up.', 'time': 1670636859, 'resto': 126860271, 'country': 'CL', 'country_name': 'Chile'}, {'no': 126866546, 'now': '12/09/22(Fri)20:48:08', 'name': 'Anonymous', 'com': '<a href=""#p126866266"" class=""quotelink"">&gt;&gt;126866266</a><br><span class=""quote"">&gt;&gt;argencucks get 9 cards and thats still 5 less than they deserved for casually chopping at our ankles every 0 minutes</span><br><br><br>did you even watch the match?<br><br>neverlands got 6 cards and did 30 fouls total<br>argentina got 8 cards and did 18 fouls total<br><br>there was no VAR used in the match yet the second half had 10 mins of added time<br><br>why would the ref add 10 fucking minutes instead of 3/5 if he was trying to help us?<br>why would he card us at double the rate they carded you guys?<br>why didnt the ref give a second yellow to your chimp def after Paredes shot the ball to your bench?<br><br><br>ref was just being an incompetent idiot, he wasnt trying to help either side but rather was trying to be the protagonist of the game cause thats probably going to be the peak of his career', 'time': 1670636888, 'resto': 126860271, 'country': 'AR', 'country_name': 'Argentina'}, {'no': 126866549, 'now': '12/09/22(Fri)20:48:09', 'name': 'Anonymous', 'com': '<a href=""#p126866479"" class=""quotelink"">&gt;&gt;126866479</a><br>10 minutes of extra time was correct because the game was dead half the time you seething sunbeaner', 'time': 1670636889, 'resto': 126860271, 'country': 'NL', 'country_name': 'Netherlands'}, {'no': 126866550, 'now': '12/09/22(Fri)20:48:10', 'name': 'Anonymous', 'com': '<a href=""#p126860271"" class=""quotelink"">&gt;&gt;126860271</a><br>I wish I could show yesterday&#039;s /sp/ that beautiful image. Pure kino.', 'time': 1670636890, 'resto': 126860271, 'country': 'AR', 'country_name': 'Argentina'}]",,
2,126865635,12/09/22(Fri)20:32:43,Anonymous,"everybody knows it&#039;s the most important. En criollo, se cagó",QLP7WPJ5BVNOMAZCUDD7HYMUW4,.jpg,900,600,250,166,1670635963648203,1670635963,6qnbXK/qSfY4fyOKV1uUSA==,62579,0,AR,0,0,he-shouldve-taken-the-4th-penalty,Argentina,5,1,1670636889,,,"[{'no': 126866257, 'now': '12/09/22(Fri)20:42:56', 'name': 'Anonymous', 'com': 'what about the manager, who let a 20 year old kid take the first penalty? total shitfest', 'time': 1670636576, 'resto': 126865635, 'country': 'BR', 'country_name': 'Brazil'}, {'no': 126866337, 'now': '12/09/22(Fri)20:44:16', 'name': 'Anonymous', 'com': '<a href=""#p126865635"" class=""quotelink"">&gt;&gt;126865635</a><br>I think the first one is the most important.<br>If the first one is miss it completely obliterates the team morale.', 'filename': 'spain 1', 'ext': '.webm', 'w': 1280, 'h': 720, 'tn_w': 125, 'tn_h': 70, 'tim': 1670636656767700, 'time': 1670636656, 'md5': 'ShzuhlabqAO2P2b7zYlUxg==', 'fsize': 2922199, 'resto': 126865635, 'country': 'DE', 'country_name': 'Germany'}, {'no': 126866461, 'now': '12/09/22(Fri)20:46:29', 'name': 'Anonymous', 'com': '<a href=""#p126866257"" class=""quotelink"">&gt;&gt;126866257</a><br>I thought about it too<br>tite was always an lucky idiot', 'time': 1670636789, 'resto': 126865635, 'country': 'AR', 'country_name': 'Argentina'}, {'no': 126866493, 'now': '12/09/22(Fri)20:47:04', 'name': 'Anonymous', 'com': 'He or Casemiro should have kicked first.', 'time': 1670636824, 'resto': 126865635, 'country': 'JP', 'country_name': 'Japan'}, {'no': 126866548, 'now': '12/09/22(Fri)20:48:09', 'name': 'Anonymous', 'com': '<a href=""#p126866337"" class=""quotelink"">&gt;&gt;126866337</a><br>not only it completely obliterates the team morale, but it also takes off the weight of the opposing team. <br>&quot;if we don&#039;t fuck up, we win. if we do fuck up, we&#039;re even so we can still win&quot;', 'time': 1670636889, 'resto': 126865635, 'country': 'BR', 'country_name': 'Brazil'}]",He should&#039;ve taken the 4th penalty,
3,126862811,12/09/22(Fri)19:50:45,Anonymous,At least Brazilians can hope this fraud is never called for their NT again,352253,.png,720,405,250,140,1670633445002575,1670633445,iP91Wf1sWg1yfR2ACSpbfQ==,297696,0,PE,0,0,at-least-brazilians-can-hope-this-fraud-is-never,Peru,35,4,1670636887,30.0,4.0,"[{'no': 126866061, 'now': '12/09/22(Fri)20:39:37', 'name': 'Anonymous', 'com': '<a href=""#p126862811"" class=""quotelink"">&gt;&gt;126862811</a><br>Most clear-cut case of a player that seems to have been there because some agent acted ($$) behind the scenes.', 'time': 1670636377, 'resto': 126862811, 'country': 'BR', 'country_name': 'Brazil'}, {'no': 126866123, 'now': '12/09/22(Fri)20:40:40', 'name': 'Anonymous', 'com': '<a href=""#p126863310"" class=""quotelink"">&gt;&gt;126863310</a><br>Neymar played a good game and gave you a beautiful goal', 'time': 1670636440, 'resto': 126862811, 'country': 'AR', 'country_name': 'Argentina'}, {'no': 126866176, 'now': '12/09/22(Fri)20:41:36', 'name': 'Anonymous', 'com': 'never<br><br>he was called injured in 2018 from shaktar just to be sold to united<br><br>let me tell you something: there&#039;s always going to be a taison, fred, bernard or whatever<br><br>CBF is a mafia, only money matters<br><br>they manage to be the biggest footy criminals in a continent where AFA resides', 'time': 1670636496, 'resto': 126862811, 'country': 'BR', 'country_name': 'Brazil'}, {'no': 126866360, 'now': '12/09/22(Fri)20:44:47', 'name': 'Anonymous', 'com': '<a href=""#p126862811"" class=""quotelink"">&gt;&gt;126862811</a><br>That is not nerman', 'time': 1670636687, 'resto': 126862811, 'country': 'AW', 'country_name': 'Aruba'}, {'no': 126866545, 'now': '12/09/22(Fri)20:48:07', 'name': 'Anonymous', 'com': '<a href=""#p126864281"" class=""quotelink"">&gt;&gt;126864281</a><br>Yeah, did nothing wrong. Of course a burger would say this, you guys are clinically retarded.<br><br>Let me tell you something: Neymar and his father, by themselves, fucked brazillian football for good. When he was 12-14, Barcelona, Chelsea and Real Madrid were all over his shota ass and his father sold him to the biggest bidder - surprisingly, Real Madrid - but that was on official books. Barcelona went through another more interesting route and offered money directly to his father/agent behind Santos back, and the rest is history.<br><br>This started a business model. If you pay attention, you will notice that every single recent BR &quot;star&quot; are from the same positions - boys are being reconditioned into being the new neymar, the new retarded mongrel that will be sold for millions, especially outside of official books, so they can make billions. Vini Jr, Rodrygo, Antony (Manure paid 100m for antony, FOR ANTONY). You will rarely see kids playing 9, much less 10 or 8. The tall kids who can score headers will be reconditioned to be defenders, the quick kids will be into the nerman model and the rest will play our national shitty league forever.<br><br>Neymar is a cancer. He was cancer for every team he played (yeah he carried Santos, but the brasileirão is a shit league, your mom and a very old Seedorf could carry), including Barcelona. He &quot;ruined&quot; his career by moving to PSG, but that made him eternally rich, which is what matters.<br><br>You are a fool. Sure, Neymar isn&#039;t the biggest problem, CBF and our local media are, but he is a huge, disgusting and putrid piece of cancer for brazillian football. The faster he retires, the better will be. And his father should be shot, same for every single youth agent and coaches.<br><br>Fuck you. Eat your burger and fuck off.', 'time': 1670636887, 'resto': 126862811, 'country': 'BR', 'country_name': 'Brazil'}]",,
4,126865357,12/09/22(Fri)20:28:54,Anonymous,https://www.youtube.com/watch?v=hZP<wbr>bd2SwdQI,78382430,.png,1920,1080,250,140,1670635734046789,1670635734,Jx6sI7W5rMkVVKlrAvoItw==,2000633,0,AR,0,0,what-the-fuck-is-his-problem,Argentina,23,2,1670636888,18.0,1.0,"[{'no': 126866100, 'now': '12/09/22(Fri)20:40:18', 'name': 'Anonymous', 'com': '<a href=""#p126865999"" class=""quotelink"">&gt;&gt;126865999</a><br>Asked my spic gf and she says &quot;bobo&quot; is the equivalent of a fool or idiot.', 'time': 1670636418, 'resto': 126865357, 'country': 'US', 'country_name': 'United States'}, {'no': 126866302, 'now': '12/09/22(Fri)20:43:37', 'name': 'Anonymous', 'com': '<a href=""#p126865999"" class=""quotelink"">&gt;&gt;126865999</a><br>Bobo means a fool, a silly person. Translation from Argentinian to American. Andá p&#039;asha = Anda para allá = Go over there = Get the fuck out of here nigga.', 'time': 1670636617, 'resto': 126865357, 'country': 'MX', 'country_name': 'Mexico'}, {'no': 126866310, 'now': '12/09/22(Fri)20:43:44', 'name': 'Anonymous', 'com': '<a href=""#p126865977"" class=""quotelink"">&gt;&gt;126865977</a><br><span class=""quote"">&gt;SHATAP SHATAP</span>', 'filename': '585453712_186759776_1024x576', 'ext': '.jpg', 'w': 1024, 'h': 576, 'tn_w': 125, 'tn_h': 70, 'tim': 1670636624612779, 'time': 1670636624, 'md5': 'c4yMOkMlcb5rEQUKmKpfng==', 'fsize': 26290, 'resto': 126865357, 'country': 'AR', 'country_name': 'Argentina'}, {'no': 126866487, 'now': '12/09/22(Fri)20:46:57', 'name': 'Anonymous', 'com': '<a href=""#p126865999"" class=""quotelink"">&gt;&gt;126865999</a><br><a href=""#p126866100"" class=""quotelink"">&gt;&gt;126866100</a><br>yes but it&#039;s more agressive than &quot;fool&quot;, it&#039;s more like &quot;retard&quot;', 'time': 1670636817, 'resto': 126865357, 'country': 'AR', 'country_name': 'Argentina'}, {'no': 126866547, 'now': '12/09/22(Fri)20:48:08', 'name': 'Anonymous', 'com': '<a href=""#p126865685"" class=""quotelink"">&gt;&gt;126865685</a><br>Wout Weghorst, who dared to score two goals against his side.', 'time': 1670636888, 'resto': 126865357, 'country': 'NL', 'country_name': 'Netherlands'}]",What the fuck is his problem?,
5,126865748,12/09/22(Fri)20:34:40,Anonymous,"<span class=""quote"">&gt;Fields a team with 7 nigs</span><br><span class=""quote"">&gt;The attack consist of completely manlet nigs</span><br><span class=""quote"">&gt;they do fuck all for 80 minutes</span><br><span class=""quote"">&gt;removes 4 nigs and adds 4 white tall dutch guys</span><br><span class=""quote"">&gt;equalizes in 15 minutes and almost wins it all only failing in penalties</span><br><br>I understand fielding nigs if theyre really good but I dont understand whats the point of fielding completely shit niggers that are way worse than the white dutch guys. Same shit with Germany and fielding completely useless nigs like Gnabry, Musiala or Sane. At least fucking France got it right and their nigs can actually play.",57876052_605,.jpg,1199,674,250,140,1670636080912756,1670636080,b8HNAxQ5hUpBGhxhYFlIyQ==,111175,0,RS,0,0,why-do-eu-coaches-keep-fielding-shit-black,Serbia,3,0,1670636886,,,"[{'no': 126866362, 'now': '12/09/22(Fri)20:44:51', 'name': 'Anonymous', 'com': 'unironically, soros bribed their federations to field non-whites.', 'time': 1670636691, 'resto': 126865748, 'country': 'US', 'country_name': 'United States'}, {'no': 126866489, 'now': '12/09/22(Fri)20:46:58', 'name': 'Anonymous', 'com': '<span class=""quote"">&gt;Be Dutch</span><br><span class=""quote"">&gt;Be the tallest people on planet earth</span><br><span class=""quote"">&gt;Fall for the Cruyff total football meme</span><br><span class=""quote"">&gt;Win ZERO trophies</span><br>The Dutch need to embrace route 1 longball football and they may finally win something', 'time': 1670636818, 'resto': 126865748, 'country': 'XE', 'country_name': 'England'}, {'no': 126866543, 'now': '12/09/22(Fri)20:48:06', 'name': 'Anonymous', 'com': '<a href=""#p126865748"" class=""quotelink"">&gt;&gt;126865748</a><br>french can field blacks because their blacks are MALIAN, SENEGALESE, CONGOLESE, AND CAMEROONIAN. very distinct from the nigerian, ghanian fufu eating types that prevail in england, germany, netherlands etc. the latter are more passive and shitty whereas the former are chads.<br><br>t. phd in niggerology', 'time': 1670636886, 'resto': 126865748, 'country': 'US', 'country_name': 'United States'}]",WHY DO EU COACHES KEEP FIELDING SHIT BLACK PLAYERS?,
6,126861988,12/09/22(Fri)19:38:49,Anonymous,Still zero (0) appreciation threads about him.,205927-1669205618,.jpg,300,390,192,250,1670632729220614,1670632729,MKDV8zKh3SnpLkWB6EaUEQ==,17733,0,TZ,0,0,still-zero-0-appreciation-threads-about-him,Tanzania,42,6,1670636886,37.0,6.0,"[{'no': 126865987, 'now': '12/09/22(Fri)20:38:24', 'name': 'Anonymous', 'com': '<a href=""#p126865279"" class=""quotelink"">&gt;&gt;126865279</a><br>Jesus is the Word of God.<br><span class=""quote"">&gt;In the beginning was the Word, and the Word was with God for the Word was God</span><br><span class=""quote"">&gt;The Word took on flesh and became man</span><br>Notice how you ignore the gospel of John?<br><br>Jesus was put to death because He said <br><span class=""quote"">&gt;I AM</span><br><span class=""quote"">&gt;You will see the Son of Man coming in the clouds</span><br><span class=""quote"">&gt;Jesus said to him, &quot;I am the way, the truth, and the life. No one comes to the Father except through Me</span><br><span class=""quote"">&gt;&quot;I am the door. If anyone enters by Me, he will be saved, and will go in and out and find pasture.&quot;</span><br><span class=""quote"">&gt;Then Jesus spoke to them again, saying, &quot;I am the light of the world. He who follows Me shall not walk in darkness, but have the light of life.</span><br><span class=""quote"">&gt;And Jesus said to them, &quot;I am the bread of life. He who comes to Me shall never hunger, and he who believes in Me shall never thirst</span><br><br><br>You seem to believe that God could not become man. You need to understand that God&#039;s intellect is PERFECT. Since God is God then His intellect is also God. The Word of God is God.', 'time': 1670636304, 'resto': 126861988, 'country': 'AU', 'country_name': 'Australia'}, {'no': 126866212, 'now': '12/09/22(Fri)20:42:18', 'name': 'Anonymous', 'com': '<a href=""#p126865987"" class=""quotelink"">&gt;&gt;126865987</a><br>This. Jesus was God himself in a human form. We humans rejected him, that goes to show how we Humans can&#039;t see the good things God want for Us because we are blinded and heavily guided by evil shit.', 'time': 1670636538, 'resto': 126861988, 'country': 'TZ', 'country_name': 'Tanzania'}, {'no': 126866393, 'now': '12/09/22(Fri)20:45:22', 'name': 'Anonymous', 'com': '<a href=""#p126866212"" class=""quotelink"">&gt;&gt;126866212</a><br><span class=""quote"">&gt;human form</span><br>Yes more specifically the 2nd person of the Holy Trinity. The Word of God. The Son of Man. <br><br>Jesus shows perfect human nature. Humility, meekness, love, charity, resignation to God (the Father) will etc.', 'time': 1670636722, 'resto': 126861988, 'country': 'AU', 'country_name': 'Australia'}, {'no': 126866464, 'now': '12/09/22(Fri)20:46:31', 'name': 'Anonymous', 'com': '<a href=""#p126866393"" class=""quotelink"">&gt;&gt;126866393</a><br><span class=""quote"">&gt;The Son of Man.</span><br>The Son of God*, the Son of Man shows His humility and Him being the 2nd Adam.', 'time': 1670636791, 'resto': 126861988, 'country': 'AU', 'country_name': 'Australia'}, {'no': 126866542, 'now': '12/09/22(Fri)20:48:06', 'name': 'Anonymous', 'com': '<a href=""#p126862250"" class=""quotelink"">&gt;&gt;126862250</a><br>I agree, Bono was a proper headache for us. I thought he was better than Livaković in the group stage but Liva is getting better as time goes on. Bono will get his chance to shine tomorrow.', 'time': 1670636886, 'resto': 126861988, 'country': 'HR', 'country_name': 'Croatia'}]",,
7,126864326,12/09/22(Fri)20:13:22,Anonymous,KWAB. he will never dance again,Fjk11XwX0AEE5t7,.jpg,850,582,250,171,1670634802631547,1670634802,7q1gu+aEbw/fnuqTv6vikQ==,62944,0,GB,0,0,kwab-he-will-never-dance-again,United Kingdom,19,4,1670636883,14.0,3.0,"[{'no': 126865425, 'now': '12/09/22(Fri)20:29:56', 'name': 'Anonymous', 'com': '<a href=""#p126865011"" class=""quotelink"">&gt;&gt;126865011</a><br>tite fucked up. how do you lose with a squad that stacked? this shouldve been the run', 'time': 1670635796, 'resto': 126864326, 'country': 'GB', 'country_name': 'United Kingdom'}, {'no': 126865471, 'now': '12/09/22(Fri)20:30:33', 'name': 'Anonymous', 'com': '<a href=""#p126865011"" class=""quotelink"">&gt;&gt;126865011</a><br>We feared him but Juranovic pocketed him hard', 'time': 1670635833, 'resto': 126864326, 'country': 'HR', 'country_name': 'Croatia'}, {'no': 126865510, 'now': '12/09/22(Fri)20:31:03', 'name': 'Anonymous', 'com': '<a href=""#p126864753"" class=""quotelink"">&gt;&gt;126864753</a><br>Look at those little golliwogs!', 'time': 1670635863, 'resto': 126864326, 'country': 'NZ', 'country_name': 'New Zealand'}, {'no': 126865540, 'now': '12/09/22(Fri)20:31:27', 'name': 'Anonymous', 'com': '<a href=""#p126865237"" class=""quotelink"">&gt;&gt;126865237</a><br>Big fat S', 'filename': '1670613364698315', 'ext': '.jpg', 'w': 671, 'h': 379, 'tn_w': 125, 'tn_h': 70, 'tim': 1670635887430307, 'time': 1670635887, 'md5': '/dM8l6pTojzW5q7Cj1m77g==', 'fsize': 97956, 'resto': 126864326, 'country': 'US', 'country_name': 'United States'}, {'no': 126866541, 'now': '12/09/22(Fri)20:48:03', 'name': 'Anonymous', 'com': '<a href=""#p126864753"" class=""quotelink"">&gt;&gt;126864753</a><br>Kind of soul.', 'time': 1670636883, 'resto': 126864326, 'country': 'BR', 'country_name': 'Brazil'}]",,
8,126847811,12/09/22(Fri)17:20:43,Anonymous,How self aware can you be??,78226248-69AF-45E7-BDC9-BFBE3160A042,.jpg,1284,1327,241,250,1670624443693469,1670624443,hPhMPsElSXICpT9Li9C+ZQ==,425775,0,US,0,0,how-self-aware-can-you-be,United States,283,36,1670636883,278.0,33.0,"[{'no': 126864601, 'now': '12/09/22(Fri)20:17:27', 'name': 'Anonymous', 'com': '<a href=""#p126857023"" class=""quotelink"">&gt;&gt;126857023</a><br>It wasn’t, because the reffed still acknowledged it and gave a foul', 'time': 1670635047, 'resto': 126847811, 'country': 'US', 'country_name': 'United States'}, {'no': 126864911, 'now': '12/09/22(Fri)20:22:01', 'name': 'Anonymous', 'com': '<a href=""#p126850982"" class=""quotelink"">&gt;&gt;126850982</a><br><span class=""quote"">&gt;That Chad heem from van Dijk</span>', 'filename': 'approving flanders', 'ext': '.png', 'w': 567, 'h': 642, 'tn_w': 110, 'tn_h': 125, 'tim': 1670635321327125, 'time': 1670635321, 'md5': 'A6BHVLC4GIh/1lcoDf84+A==', 'fsize': 288247, 'resto': 126847811, 'country': 'XE', 'country_name': 'England'}, {'no': 126865029, 'now': '12/09/22(Fri)20:23:45', 'name': 'Anonymous', 'com': '<a href=""#p126855335"" class=""quotelink"">&gt;&gt;126855335</a><br><span class=""quote"">&gt;no Americans</span>', 'filename': '65045030-F929-4D0A-A176-89592C655931', 'ext': '.png', 'w': 600, 'h': 600, 'tn_w': 125, 'tn_h': 125, 'tim': 1670635425272483, 'time': 1670635425, 'md5': 'mQ0t/1fYg/HYxDj8aekmgw==', 'fsize': 146490, 'resto': 126847811, 'country': 'US', 'country_name': 'United States'}, {'no': 126865207, 'now': '12/09/22(Fri)20:26:37', 'name': 'Anonymous', 'com': '<a href=""#p126860158"" class=""quotelink"">&gt;&gt;126860158</a><br>Are NFL matches even allowed to end in relegation? You could have fooled me', 'filename': '1653069255126', 'ext': '.gif', 'w': 322, 'h': 175, 'tn_w': 125, 'tn_h': 67, 'tim': 1670635597028255, 'time': 1670635597, 'md5': 'B8Fy7+1dB+J+/ikBdETS5Q==', 'fsize': 1846778, 'resto': 126847811, 'country': 'DK', 'country_name': 'Denmark'}, {'no': 126866540, 'now': '12/09/22(Fri)20:48:03', 'name': 'Anonymous', 'com': '<a href=""#p126849229"" class=""quotelink"">&gt;&gt;126849229</a><br><span class=""quote"">&gt;manlet</span><br><span class=""quote"">&gt;autistic</span><br>HE&#039;S LITERALLY ME!', 'time': 1670636883, 'resto': 126847811, 'country': 'ID', 'country_name': 'Indonesia'}]",,
9,126861913,12/09/22(Fri)19:37:40,Anonymous,"<span class=""quote"">&gt;these games today have made me realize how far the US is from being good in this sport</span><br><br>FUCK",1669438319549687,.png,634,620,250,244,1670632660909748,1670632660,YfQos4XS9Cuj+YFlJy7Whg==,683792,0,US,0,0,these-games-today-have-made-me-realize-how-far,United States,97,8,1670636883,92.0,7.0,"[{'no': 126866520, 'now': '12/09/22(Fri)20:47:36', 'name': 'Anonymous', 'com': '<a href=""#p126866036"" class=""quotelink"">&gt;&gt;126866036</a><br>I don&#039;t think you are as good as you think at basketball these days. First of all, it&#039;s not even true that you win every international basketball tournament. And it&#039;s certainly not an automatic win against the top 5 teams at any given moment. Also, saying you send the B team is kind of a cope. You are sending all-stars across the board and the players that elect not to go are usually past their prime (LeBron, Durant, etc.).<br><br>In regards to the Olympics thing: it&#039;s just raw numbers. You have a huge population and the most resources invested. You look at the results and the trand is quite obvious. All the top performing countries either have huge populations and/or tons of investment. Olympics are kind of a meme anyway and very much not a &quot;cross section of sports people around the world care about&quot;. How many people have you ever met who give a shit about any random Olympic sport outside of the couple weeks it&#039;s relevant every 4 years?', 'time': 1670636856, 'resto': 126861913, 'country': 'PT', 'country_name': 'Portugal'}, {'no': 126866532, 'now': '12/09/22(Fri)20:47:54', 'name': 'Anonymous', 'com': '<a href=""#p126866443"" class=""quotelink"">&gt;&gt;126866443</a><br>All your teams are slowly becoming Ngubufied, besides Croatia I guess.', 'time': 1670636874, 'resto': 126861913, 'country': 'US', 'country_name': 'United States'}, {'no': 126866535, 'now': '12/09/22(Fri)20:47:57', 'name': 'Anonymous', 'com': '<a href=""#p126866214"" class=""quotelink"">&gt;&gt;126866214</a><br><span class=""quote"">&gt;Poorfag copes</span><br>Ahahahaha', 'time': 1670636877, 'resto': 126861913, 'country': 'MX', 'country_name': 'Mexico'}, {'no': 126866537, 'now': '12/09/22(Fri)20:47:59', 'name': 'Anonymous', 'com': '<a href=""#p126862421"" class=""quotelink"">&gt;&gt;126862421</a><br>Divegrass bros...', 'filename': 'Screenshot_20221209-204727-829', 'ext': '.png', 'w': 1080, 'h': 1286, 'tn_w': 104, 'tn_h': 125, 'tim': 1670636879482464, 'time': 1670636879, 'md5': 'AiX6CaBXo2bcV0jK29i0xw==', 'fsize': 972641, 'resto': 126861913, 'country': 'US', 'country_name': 'United States'}, {'no': 126866539, 'now': '12/09/22(Fri)20:48:03', 'name': 'Anonymous', 'com': '<a href=""#p126865821"" class=""quotelink"">&gt;&gt;126865821</a><br>We call them foot fairies lol', 'time': 1670636883, 'resto': 126861913, 'country': 'US', 'country_name': 'United States'}]",,
10,126866239,12/09/22(Fri)20:42:43,Anonymous,YES I AM CHICANO<br>YES I HATE “”””WHITE”””” ARGENTINIANS <br>YES I ONLY SUPPORT BROWNGENTINIANS,A27CFD9B-3A98-44BA-AD06-5152F8F443D9,.jpg,819,934,219,250,1670636563208318,1670636563,Q8ByyT6NDmPhfzWxRpyfyw==,326810,0,US,0,0,yes-i-am-chicano,United States,1,0,1670636882,,,"[{'no': 126866538, 'now': '12/09/22(Fri)20:48:02', 'name': 'Anonymous', 'com': '<a href=""#p126866239"" class=""quotelink"">&gt;&gt;126866239</a><br>Most based thread on /sp/', 'time': 1670636882, 'resto': 126866239, 'country': 'AU', 'country_name': 'Australia'}]",,
