,no,now,name,com,filename,ext,w,h,tn_w,tn_h,tim,time,md5,fsize,resto,bumplimit,imagelimit,semantic_url,custom_spoiler,replies,images,omitted_posts,omitted_images,last_replies,last_modified,sub,trip
0,134465579,12/10/22(Sat)06:03:36,Anonymous,"<span class=""quote"">&gt;Sees cool ass graffiti on the bathrooms</span><br><span class=""quote"">&gt;Has his workers paint over it</span><br>Do Park managers really?",graf,.png,832,419,250,125,1670670216610701,1670670216,ApK6tU1dInhCGmMdeJtM7g==,751735,0,0,0,sees-cool-ass-graffiti-on-the-bathrooms,5,31,3,26.0,3.0,"[{'no': 134465904, 'now': '12/10/22(Sat)07:09:02', 'name': 'Anonymous', 'com': '<a href=""#p134465866"" class=""quotelink"">&gt;&gt;134465866</a><br>Holy shit<br>Mad and filtered', 'time': 1670674142, 'resto': 134465579}, {'no': 134465922, 'now': '12/10/22(Sat)07:12:05', 'name': 'Anonymous', 'com': '<a href=""#p134465904"" class=""quotelink"">&gt;&gt;134465904</a><br><span class=""quote"">&gt;more stock phrases</span><br>If you&#039;re only going to continue to prove my point, at least try not being so smug.', 'time': 1670674325, 'resto': 134465579}, {'no': 134465925, 'now': '12/10/22(Sat)07:12:21', 'name': 'Anonymous', 'com': '<a href=""#p134465579"" class=""quotelink"">&gt;&gt;134465579</a><br>Because when people go to the park they don’t want to be reminded of the ghetto', 'time': 1670674341, 'resto': 134465579}, {'no': 134465926, 'now': '12/10/22(Sat)07:12:26', 'name': 'Anonymous', 'com': '<a href=""#p134465836"" class=""quotelink"">&gt;&gt;134465836</a><br><a href=""#p134465846"" class=""quotelink"">&gt;&gt;134465846</a><br><a href=""#p134465850"" class=""quotelink"">&gt;&gt;134465850</a><br><a href=""#p134465866"" class=""quotelink"">&gt;&gt;134465866</a><br>hmmmm', 'time': 1670674346, 'resto': 134465579}, {'no': 134465932, 'now': '12/10/22(Sat)07:13:29', 'name': 'Anonymous', 'com': '<a href=""#p134465926"" class=""quotelink"">&gt;&gt;134465926</a><br><span class=""quote"">&gt;<a href=""#p134465836"" class=""quotelink"">&gt;&gt;134465836</a></span><br><span class=""quote"">&gt;<a href=""#p134465846"" class=""quotelink"">&gt;&gt;134465846</a> (You)</span><br><span class=""quote"">&gt;<a href=""#p134465850"" class=""quotelink"">&gt;&gt;134465850</a></span><br><span class=""quote"">&gt;<a href=""#p134465866"" class=""quotelink"">&gt;&gt;134465866</a> (You)</span><br><span class=""quote"">&gt;hmmmm</span>', 'time': 1670674409, 'resto': 134465579}]",1670674409,,
1,134465931,12/10/22(Sat)07:13:22,Anonymous,"90s and 2000s are ugly and have no lore, nor are their waifus hot. No on on /co/ likes them. I bet Pink Diamond would watch that God awful shit considering she’s an abuser and rapist like most of the people who made them. Don’t be a Pink Diamond, be a Spinel, Steven, White, Yellow, or Blue and enjoy the modern flow!",B649E19F-5E01-4167-AE5A-5A0BBA6A91ED,.jpg,1170,1138,250,243,1670674402738007,1670674402,l2nL3CqgHeFl2qvW7IpAjw==,854025,0,0,0,90s-and-2000s-are-ugly-and-have-no-lore-nor-are,5,0,0,,,,1670674402,,
2,134463734,12/10/22(Sat)01:28:58,Anonymous,Why doesn&#039;t Dreamworks get more credit? They have made some great shows and movies especially in recent years.,dreamworks,.jpg,835,735,249,220,1670653738286631,1670653738,zI/dQjx6qpju+fnbfp/x7A==,290835,0,0,0,why-doesnt-dreamworks-get-more-credit-they-have,5,15,5,10.0,1.0,"[{'no': 134465101, 'now': '12/10/22(Sat)04:41:32', 'name': 'Anonymous', 'com': '<span class=""quote"">&gt;I like em big</span><br><span class=""quote"">&gt;I like em plumpy</span>', 'filename': '1031', 'ext': '.png', 'w': 1920, 'h': 1080, 'tn_w': 125, 'tn_h': 70, 'tim': 1670665292249904, 'time': 1670665292, 'md5': 'f5xVrxhZ17SLoB9R5gmvuw==', 'fsize': 3307985, 'resto': 134463734}, {'no': 134465815, 'now': '12/10/22(Sat)06:51:20', 'name': 'Anonymous', 'com': 'They made one of the most boring and devoid of laughs animation films to ever hit the big screen. Uninspired, unnecessary and rushed in every way, story wise.', 'filename': '51rxednbZ-L._AC_', 'ext': '.jpg', 'w': 320, 'h': 500, 'tn_w': 80, 'tn_h': 125, 'tim': 1670673080200558, 'time': 1670673080, 'md5': 'HGAW0yXaGIMz76nuly1AEQ==', 'fsize': 25668, 'resto': 134463734}, {'no': 134465831, 'now': '12/10/22(Sat)06:55:15', 'name': 'Anonymous', 'com': '<span class=""quote"">&gt;I like em round with something something</span>', 'filename': '6223', 'ext': '.png', 'w': 1920, 'h': 1080, 'tn_w': 125, 'tn_h': 70, 'tim': 1670673315860685, 'time': 1670673315, 'md5': 'iSsLel6OXzLxrasw+lmI0Q==', 'fsize': 1622986, 'resto': 134463734}, {'no': 134465909, 'now': '12/10/22(Sat)07:09:49', 'name': 'Anonymous', 'com': '<span class=""quote"">&gt;Antz, Shrek, Shrek 4-D, Shrek 2, Madagascar, Shrek the Third, Madagascar Escape 2 Africa, Megamind, Madagascar 3 Europe&#039;s Most Wanted, Mr. Peabody &amp; Sherman, Penguins of Madagascar film</span><br>They should definitely be credited separately from Dreamworks despite being owned by them, since it was a different building with different people. Also, back when they made Antz in 1996-1998, Dreamworks only owned a 40% stake on them. They didn&#039;t fully buy them until april of 2000 (Shrek was over halfway finished by that point)', 'filename': 'maxresdefault (1)', 'ext': '.jpg', 'w': 1280, 'h': 720, 'tn_w': 125, 'tn_h': 70, 'tim': 1670674189843037, 'time': 1670674189, 'md5': 'pRSyN7ddmo4ASc9/bmVKKw==', 'fsize': 43976, 'resto': 134463734}, {'no': 134465930, 'now': '12/10/22(Sat)07:13:17', 'name': 'Anonymous', 'com': '<a href=""#p134465909"" class=""quotelink"">&gt;&gt;134465909</a><br>I didn&#039;t forget about Shrek Forever After. Only Shrek movie not made by PDI.', 'time': 1670674397, 'resto': 134463734}]",1670674397,,
3,134464451,12/10/22(Sat)02:56:32,Anonymous,"Blackest Night continues with Prime Time!<br><br>Previous threads:<br><span class=""deadlink"">&gt;&gt;133101282</span> <span class=""deadlink"">&gt;&gt;133108111</span> <span class=""deadlink"">&gt;&gt;133179522</span> <span class=""deadlink"">&gt;&gt;133187790</span> <span class=""deadlink"">&gt;&gt;133210140</span> <span class=""deadlink"">&gt;&gt;133226134</span> <span class=""deadlink"">&gt;&gt;133252605</span> <span class=""deadlink"">&gt;&gt;133268028</span> <span class=""deadlink"">&gt;&gt;133293519</span> <span class=""deadlink"">&gt;&gt;133300526</span> <span class=""deadlink"">&gt;&gt;133311945</span> <span class=""deadlink"">&gt;&gt;133325881</span> <span class=""deadlink"">&gt;&gt;133360633</span> <span class=""deadlink"">&gt;&gt;133389461</span> <span class=""deadlink"">&gt;&gt;133371762</span> <span class=""deadlink"">&gt;&gt;133388480</span> <span class=""deadlink"">&gt;&gt;133400361</span> <span class=""deadlink"">&gt;&gt;133426709</span> <span class=""deadlink"">&gt;&gt;133449973</span> <span class=""deadlink"">&gt;&gt;133470721</span> <span class=""deadlink"">&gt;&gt;133490791</span> <span class=""deadlink"">&gt;&gt;133512409</span> <span class=""deadlink"">&gt;&gt;133526935</span> <span class=""deadlink"">&gt;&gt;133551815</span> <span class=""deadlink"">&gt;&gt;133578738</span> <span class=""deadlink"">&gt;&gt;133598777</span> <span class=""deadlink"">&gt;&gt;133620506</span> <span class=""deadlink"">&gt;&gt;133633444</span> <span class=""deadlink"">&gt;&gt;133657165</span> <span class=""deadlink"">&gt;&gt;133683496</span> <span class=""deadlink"">&gt;&gt;133692728</span> <span class=""deadlink"">&gt;&gt;133724880</span> <span class=""deadlink"">&gt;&gt;133740740</span> <span class=""deadlink"">&gt;&gt;133750712</span> <span class=""deadlink"">&gt;&gt;133760580</span> <span class=""deadlink"">&gt;&gt;133778994</span> <span class=""deadlink"">&gt;&gt;133794918</span> <span class=""deadlink"">&gt;&gt;133812371</span> <span class=""deadlink"">&gt;&gt;133832959</span> <span class=""deadlink"">&gt;&gt;133847631</span> <span class=""deadlink"">&gt;&gt;133862390</span> <span class=""deadlink"">&gt;&gt;133877183</span> <span class=""deadlink"">&gt;&gt;133891984</span> <span class=""deadlink"">&gt;&gt;133907218</span> <span class=""deadlink"">&gt;&gt;133921689</span> <span class=""deadlink"">&gt;&gt;133941086</span> <span class=""deadlink"">&gt;&gt;133956929</span> <span class=""deadlink"">&gt;&gt;133972755</span> <span class=""deadlink"">&gt;&gt;133988031</span> <span class=""deadlink"">&gt;&gt;134002084</span> <span class=""deadlink"">&gt;&gt;134027294</span> <span class=""deadlink"">&gt;&gt;134032426</span> <span class=""deadlink"">&gt;&gt;134056883</span> <span class=""deadlink"">&gt;&gt;134065032</span> <span class=""deadlink"">&gt;&gt;134080550</span> <span class=""deadlink"">&gt;&gt;134096133</span> <span class=""deadlink"">&gt;&gt;134111165</span> <span class=""deadlink"">&gt;&gt;134125602</span> <span class=""deadlink"">&gt;&gt;134137026</span> <span class=""deadlink"">&gt;&gt;134153069</span> <span class=""deadlink"">&gt;&gt;134176049</span> <span class=""deadlink"">&gt;&gt;134186939</span> <span class=""deadlink"">&gt;&gt;134206523</span> <span class=""deadlink"">&gt;&gt;134215616</span> <span class=""deadlink"">&gt;&gt;134235368</span> <span class=""deadlink"">&gt;&gt;134248860</span> <span class=""deadlink"">&gt;&gt;134264048</span> <span class=""deadlink"">&gt;&gt;134284229</span> <a href=""/co/thread/134299417#p134299417"" class=""quotelink"">&gt;&gt;134299417</a> <a href=""/co/thread/134314549#p134314549"" class=""quotelink"">&gt;&gt;134314549</a> <a href=""/co/thread/134328917#p134328917"" class=""quotelink"">&gt;&gt;134328917</a> <a href=""/co/thread/134338291#p134338291"" class=""quotelink"">&gt;&gt;134338291</a> <a href=""/co/thread/134356369#p134356369"" class=""quotelink"">&gt;&gt;134356369</a> <a href=""/co/thread/134370610#p134370610"" class=""quotelink"">&gt;&gt;134370610</a> <a href=""/co/thread/134386572#p134386572"" class=""quotelink"">&gt;&gt;134386572</a> <a href=""/co/thread/134405255#p134405255"" class=""quotelink"">&gt;&gt;134405255</a> <a href=""/co/thread/134421452#p134421452"" class=""quotelink"">&gt;&gt;134421452</a> <a href=""/co/thread/134438492#p134438492"" class=""quotelink"">&gt;&gt;134438492</a> <a href=""/co/thread/134447380#p134447380"" class=""quotelink"">&gt;&gt;134447380</a>",ps42-0001 copy,.jpg,1280,1991,160,250,1670658992579153,1670658992,4Oq407c6l1khREHCkJTrmA==,556648,0,0,0,geoff-johns-storytime,5,232,230,227.0,225.0,"[{'no': 134465903, 'now': '12/10/22(Sat)07:08:55', 'name': 'Anonymous', 'filename': 'Blackest Night - Titans 002 (2009) (Digital-HD) (Monafekk-Empire) 021', 'ext': '.jpg', 'w': 1920, 'h': 2951, 'tn_w': 81, 'tn_h': 125, 'tim': 1670674135658086, 'time': 1670674135, 'md5': 'LvkpdQ6a+208P5hC/N0Aow==', 'fsize': 868934, 'resto': 134464451}, {'no': 134465910, 'now': '12/10/22(Sat)07:09:55', 'name': 'Anonymous', 'filename': 'Blackest Night - Titans 002 (2009) (Digital-HD) (Monafekk-Empire) 022', 'ext': '.jpg', 'w': 1920, 'h': 2951, 'tn_w': 81, 'tn_h': 125, 'tim': 1670674195751174, 'time': 1670674195, 'md5': 'JNskZKBUpqfOcDJLS2zemQ==', 'fsize': 1059202, 'resto': 134464451}, {'no': 134465916, 'now': '12/10/22(Sat)07:10:55', 'name': 'Anonymous', 'filename': 'Blackest Night - Titans 003 (2009) (Digital-HD) (Monafekk-Empire) 001', 'ext': '.jpg', 'w': 1920, 'h': 2944, 'tn_w': 81, 'tn_h': 125, 'tim': 1670674255731663, 'time': 1670674255, 'md5': 'wXts1+02bBHEbLutuf0qQA==', 'fsize': 878214, 'resto': 134464451}, {'no': 134465921, 'now': '12/10/22(Sat)07:11:55', 'name': 'Anonymous', 'filename': 'Blackest Night - Titans 003 (2009) (Digital-HD) (Monafekk-Empire) 003', 'ext': '.jpg', 'w': 1920, 'h': 2951, 'tn_w': 81, 'tn_h': 125, 'tim': 1670674315772254, 'time': 1670674315, 'md5': '6uh8q2g0s6z1tXj2PpwzoA==', 'fsize': 1129300, 'resto': 134464451}, {'no': 134465929, 'now': '12/10/22(Sat)07:12:55', 'name': 'Anonymous', 'filename': 'Blackest Night - Titans 003 (2009) (Digital-HD) (Monafekk-Empire) 004', 'ext': '.jpg', 'w': 1920, 'h': 2951, 'tn_w': 81, 'tn_h': 125, 'tim': 1670674375720016, 'time': 1670674375, 'md5': 'uuR8Vs0ifzOQliLoui8QIg==', 'fsize': 979290, 'resto': 134464451}]",1670674375,Geoff Johns Storytime,
4,134461035,12/09/22(Fri)21:06:24,Anonymous,"I&#039;ve bitched about IDW Sonic villains being underwhelming in previous threads, so let&#039;s do something constructive.<br><br>Imagine SEGA unclenches a bit and lets you create some villains for future Sonic arcs, free of mandates and shit.<br><br>What sort of villains do you come up with? How would you improve current IDW baddies, like Surge or Clutch?",surge_spacecolonie2021,.jpg,1240,1754,176,250,1670637984118408,1670637984,9HoC3ssx5BqGzyx2F3GlRQ==,578043,0,0,0,future-sonic-villains,5,74,12,69.0,12.0,"[{'no': 134465501, 'now': '12/10/22(Sat)05:50:39', 'name': 'Anonymous', 'com': '<a href=""#p134465304"" class=""quotelink"">&gt;&gt;134465304</a><br><span class=""quote"">&gt;They don&#039;t actually have romantic interaction in the comics, despite how much its being raved.</span><br>Nobody has any romantic interaction in this comic. That said Whisper cares for Tangle WAY more than anyone else. She broke out into tears and rage when Tangle just got turned into a zombie. She didn’t react that way when her squad actually fucking died. <br>I have no idea why people are still in denial about them being a couple after Ian’s and Evan’s comments. Sega did not create these characters, Ian did, if he says they’re gay then they’re gay. Anyone denying it looks like a massive fucking retard.', 'time': 1670669439, 'resto': 134461035}, {'no': 134465618, 'now': '12/10/22(Sat)06:11:18', 'name': 'Anonymous', 'com': 'Remove the mandate where Sonic’s never allowed to lose. That rule instantly turns all the villains in the comic into complete jokes.', 'time': 1670670678, 'resto': 134461035}, {'no': 134465640, 'now': '12/10/22(Sat)06:14:31', 'name': 'Anonymous', 'com': '<a href=""#p134465618"" class=""quotelink"">&gt;&gt;134465618</a><br>but surge is the best joke so far, she fun to see getting destroyed. Also they invertedly make sonic look eviler and eviler.', 'time': 1670670871, 'resto': 134461035}, {'no': 134465732, 'now': '12/10/22(Sat)06:33:28', 'name': 'Anonymous', 'com': '<a href=""#p134465618"" class=""quotelink"">&gt;&gt;134465618</a><br>That rule is about Sonic losing for good, he isn&#039;t allowed to be in a state of permanent failure.<br>Sonic can lose an official Extreme Gear race, but he&#039;s not allowed to be forbidden from racing with Extreme Gear ever again.', 'time': 1670672008, 'resto': 134461035}, {'no': 134465928, 'now': '12/10/22(Sat)07:12:54', 'name': 'Anonymous', 'com': '<a href=""#p134465732"" class=""quotelink"">&gt;&gt;134465732</a><br>I don’t know what the rule exactly says because it’s not public information but in both scapnik island and the mainline series Sonic injured his leg and still manages to never lose, even in the short term. If two different writers have this problem it’s a mandate issue.', 'time': 1670674374, 'resto': 134461035}]",1670674374,Future Sonic villains,
5,134438353,12/08/22(Thu)09:47:42,Anonymous,"No, seriously, what the FUCK is her appeal? I feel like you guys are less attracted to her and more attracted to lewding her because she’s from a cartoon you guys hate. Like goddamn, I’ve seen WAY better MILFs, but they don’t even get a quarter of the attention here compared to her.",5A8C3E6F-E675-4005-A36F-B387C05BB740,.jpg,616,616,250,250,1670510862467727,1670510862,B94x8t3/srp+lgNvAK1YGw==,40100,0,0,0,what-the-fucks-her-appeal,5,479,206,474.0,204.0,"[{'no': 134465192, 'now': '12/10/22(Sat)04:58:08', 'name': 'Anonymous', 'com': '<a href=""#p134465176"" class=""quotelink"">&gt;&gt;134465176</a>', 'filename': 'Marcy has needs', 'ext': '.png', 'w': 851, 'h': 1000, 'tn_w': 106, 'tn_h': 125, 'tim': 1670666288811874, 'time': 1670666288, 'md5': 'V+z1P5ARGS/qMtqfEK2MIg==', 'fsize': 377459, 'resto': 134438353}, {'no': 134465402, 'now': '12/10/22(Sat)05:29:44', 'name': 'Anonymous', 'com': '<a href=""#p134465192"" class=""quotelink"">&gt;&gt;134465192</a><br><span class=""quote"">&gt;people jerking it to drawings.</span>', 'time': 1670668184, 'resto': 134438353}, {'no': 134465793, 'now': '12/10/22(Sat)06:47:26', 'name': 'Anonymous', 'com': '<a href=""#p134465402"" class=""quotelink"">&gt;&gt;134465402</a><br><span class=""quote"">&gt;People jerking it</span>', 'filename': '1669193465670001', 'ext': '.jpg', 'w': 2160, 'h': 2700, 'tn_w': 100, 'tn_h': 125, 'tim': 1670672846271442, 'time': 1670672846, 'md5': 'nuhmX9z9yiHoYnGVrUTnmg==', 'fsize': 837655, 'resto': 134438353}, {'no': 134465832, 'now': '12/10/22(Sat)06:55:25', 'name': 'Anonymous', 'com': '<a href=""#p134465402"" class=""quotelink"">&gt;&gt;134465402</a><br><span class=""quote"">&gt;people drawing people jerking it to drawings</span>', 'time': 1670673325, 'resto': 134438353}, {'no': 134465927, 'now': '12/10/22(Sat)07:12:44', 'name': 'Anonymous', 'com': '<a href=""#p134457187"" class=""quotelink"">&gt;&gt;134457187</a><br>You&#039;re thinking of Fluttershy meeting Discord', 'time': 1670674364, 'resto': 134438353}]",1670674364,What the fuck’s her appeal?,
6,134465908,12/10/22(Sat)07:09:48,Anonymous,What other comics are popular with women? The only women I’ve met irl who like comics were SAGA fans and they didn’t read any other comics except it,01D77E41-7777-45A2-AE9D-7805C96E3ED6,.jpg,1491,2292,162,250,1670674188855923,1670674188,palCmkWvAfgQT0IrMs0HqQ==,350446,0,0,0,why-do-women-like-saga-so-much,5,1,0,,,"[{'no': 134465923, 'now': '12/10/22(Sat)07:12:10', 'name': 'Anonymous', 'com': 'Does it include trans women?', 'time': 1670674330, 'resto': 134465908}]",1670674330,Why do women like SAGA so much?,
7,134447671,12/08/22(Thu)22:50:16,LokianonMx,"The days grow colder, the nights grow longer. That means /co/ Christmas cheer is coming to town. Grab some cocoa, turn on the Christmas music, get comfy, and hang out with some /co/mrades as we share stories and get into the holiday spirit.<br><br>As previous years, share your Amazon wishlist and some random Anon may purchase a holiday gift for you. Be sure to gift another Anon in return so we can spread the cheer far and wide.<br><br>Please check the Pastebin to learn how to get your wishlist code, add a shipping address, the benefits of using AmazonSmile, and all other information.<br><br>Last year we had 132 gifted anons, some more than once.<br><br>Ungifted lists: pastebin.com/SmVHgMRE<br>All lists: pastebin.com/ZCXuvfE5<br><br>To get your wishlist code, open your wishlist on Amazon, then copy the 11 digit number from the link. It will look like this: amazon.com/hz/wishlist/ls/#########<wbr>##<br>We just need the ###########<br><br>Missing Address: When viewing your list, click the &quot;…&quot; in the upper right hand corner. From there click &quot;Manage List&quot; which will give you a few options including “Shipping Address”. While you’re here please check “Third party shipping agreement”. That will allow anons to buy you stuff that isn’t sold by amazon.<br><br>Previous thread: <a href=""/co/thread/134410839#p134410839"" class=""quotelink"">&gt;&gt;134410839</a>",1670540374866933,.jpg,1227,1920,159,250,1670557816973692,1670557816,/QRRzmtNAsUxGrqEPt9g9Q==,678494,0,0,0,co-christmas-cheer-thread-7,5,347,218,342.0,216.0,"[{'no': 134464949, 'now': '12/10/22(Sat)04:16:48', 'name': 'Anonymous', 'com': '<a href=""#p134461916"" class=""quotelink"">&gt;&gt;134461916</a><br><span class=""quote"">&gt;My little guy&#039;s got himself a crush at school into all the same things he is and today was her birthday.</span><br><span class=""quote"">&gt;into all the same things he is</span><br><span class=""quote"">&gt;into all the same things he is</span><br>I am trying to process this sentence.', 'time': 1670663808, 'resto': 134447671}, {'no': 134465587, 'now': '12/10/22(Sat)06:05:13', 'name': 'Anonymous', 'com': '<a href=""#p134464949"" class=""quotelink"">&gt;&gt;134464949</a><br>His little guy&#039;s got a crush that is into all the same things he is', 'time': 1670670313, 'resto': 134447671}, {'no': 134465721, 'now': '12/10/22(Sat)06:30:10', 'name': 'Anonymous', 'com': 'Loving all these storytimes, sadly not able to join in too much with posting stuff at the minute but hopefully soon. Reading along is good fun though.<br><br><s>3QBXCBG3MMNMG .ca</s>', 'filename': '1640511213521', 'ext': '.jpg', 'w': 960, 'h': 642, 'tn_w': 125, 'tn_h': 83, 'tim': 1670671810829327, 'time': 1670671810, 'md5': 'GY1MeZQvAd4+Fz/aRY0mLw==', 'fsize': 441318, 'resto': 134447671}, {'no': 134465790, 'now': '12/10/22(Sat)06:46:33', 'name': 'Anonymous', 'com': 'Does anyone in the cheer like snowboarding, skiing or other winter sports? The city I am snowboarding in for two weeks is hosting this years alpine snowboard worldcup and I am planning to see it today. I will be back tomorrow and more active here so I can now post my list GE21WBGVTO6V .de', 'time': 1670672793, 'resto': 134447671}, {'no': 134465924, 'now': '12/10/22(Sat)07:12:10', 'name': 'SHEOL', 'com': 'Streaming now: Tom and Jerry <br><br>https://w2g.tv/kt2ijwabbjmgxtgg1c<br><br>I&#039;m getting bogged down with family commitments at the moment but I do intend to stream a couple of movies tomorrow from 5pm UK time.', 'filename': 'MV5BNzNhZGVkMjktYmM0Yy00MGViLTgxZWEtYjAyYzBmODZmZDFiXkEyXkFqcGdeQXVyMjkxMzExMDQ@._V1_FMjpg_UX1000_', 'ext': '.jpg', 'w': 1000, 'h': 1464, 'tn_w': 85, 'tn_h': 125, 'tim': 1670674330508090, 'time': 1670674330, 'md5': 'xOlNG2b78gML0/0HVSNTKQ==', 'fsize': 177010, 'resto': 134447671}]",1670674330,/co/ Christmas Cheer thread #7,
8,134465470,12/10/22(Sat)05:44:53,Anonymous,A thread to discuss Death Battle. Try to keep it civil.,smokey_bear_vs__mcgruff_the_crime_dog_by_omnicidalclown1992_dbmkp75-pre,.jpg,1192,670,250,140,1670669093354400,1670669093,yH0SjGQTGJKMCR16UIUdAg==,107887,0,0,0,death-battle-thread,5,13,6,8.0,3.0,"[{'no': 134465743, 'now': '12/10/22(Sat)06:36:31', 'name': 'Anonymous', 'com': 'Soo many great moments this season. Without a doubt the best moment of all had to have been from Scarlet Witch vs Zatanna. When we got a special cameo from <s> Superman! Superman has no limits! </s>', 'filename': 'superman', 'ext': '.jpg', 'w': 474, 'h': 670, 'tn_w': 88, 'tn_h': 125, 'tim': 1670672191439596, 'time': 1670672191, 'md5': 'AWDY/yalmoYQQQEsS06RvQ==', 'fsize': 67214, 'resto': 134465470, 'spoiler': 1}, {'no': 134465761, 'now': '12/10/22(Sat)06:41:26', 'name': 'Anonymous', 'com': '<a href=""#p134465743"" class=""quotelink"">&gt;&gt;134465743</a>', 'filename': 'tffcc_tw_001_png', 'ext': '.png', 'w': 256, 'h': 256, 'tn_w': 125, 'tn_h': 125, 'tim': 1670672486419982, 'time': 1670672486, 'md5': '16zfSYNTAkR6JBeX35+tjg==', 'fsize': 130496, 'resto': 134465470}, {'no': 134465775, 'now': '12/10/22(Sat)06:43:44', 'name': 'Anonymous', 'com': '<a href=""#p134465761"" class=""quotelink"">&gt;&gt;134465761</a><br>I can’t explain it but this artstyle makes me think of those cookies shaped like characters and now I’m gonna bake some cookies. Normally I’d say your matchup is trash but today I will thank you for giving me a reason to make some cookies.', 'time': 1670672624, 'resto': 134465470}, {'no': 134465785, 'now': '12/10/22(Sat)06:45:35', 'name': 'Anonymous', 'com': '<a href=""#p134465583"" class=""quotelink"">&gt;&gt;134465583</a><br>what could they count as a Steve feat? That he can carry an entire inventory of full stack diamonds and steel blocks around and still hop like Mario? That feels like a stretch to me but I really don’t know what else you could count.', 'time': 1670672735, 'resto': 134465470}, {'no': 134465920, 'now': '12/10/22(Sat)07:11:46', 'name': 'Anonymous', 'com': '<a href=""#p134465775"" class=""quotelink"">&gt;&gt;134465775</a><br>You&#039;re welcome', 'filename': 'supwaol', 'ext': '.png', 'w': 1916, 'h': 1080, 'tn_w': 125, 'tn_h': 70, 'tim': 1670674306579301, 'time': 1670674306, 'md5': '5TdRBEzn43ryxRzGjYVAxA==', 'fsize': 2723512, 'resto': 134465470}]",1670674306,Death Battle Thread,
