,no,now,name,com,filename,ext,w,h,tn_w,tn_h,tim,time,md5,fsize,resto,bumplimit,imagelimit,semantic_url,custom_spoiler,replies,images,omitted_posts,omitted_images,last_replies,last_modified,sub,trip
70,134463623,12/10/22(Sat)01:16:48,Anonymous,Mortal Kombat deserves a good series,mortalkdotr,.jpg,796,1016,195,250,1670653008246637,1670653008,EKbImly4xrTGZD3oDkqApw==,176902,0,0,0,mortal-kombat-deserves-a-good-series,5,4,0,,,"[{'no': 134464921, 'now': '12/10/22(Sat)04:13:18', 'name': 'Anonymous', 'com': '<a href=""#p134463623"" class=""quotelink"">&gt;&gt;134463623</a>', 'time': 1670663598, 'resto': 134463623}, {'no': 134465490, 'now': '12/10/22(Sat)05:48:29', 'name': 'Anonymous', 'com': '<a href=""#p134463623"" class=""quotelink"">&gt;&gt;134463623</a><br><s>KOMBAT TIME</s>', 'time': 1670669309, 'resto': 134463623}, {'no': 134465595, 'now': '12/10/22(Sat)06:06:26', 'name': 'Anonymous', 'com': '<a href=""#p134463623"" class=""quotelink"">&gt;&gt;134463623</a><br>MK&#039;s history in comics and cartoons is surprising not as expansive as you&#039;d expect<br>It&#039;s only recently animated movies are being made and the MKX comic apparently sold poorly even for licenseshit standards', 'time': 1670670386, 'resto': 134463623}, {'no': 134465642, 'now': '12/10/22(Sat)06:14:38', 'name': 'Anonymous', 'com': 'Why do the cartoons always want subzero to do the Iceman ice bridge thing? It works in spiderman and his amazing friends with the child target audience but it&#039;s weird seeing a cold merciless assassin do such a silly technique', 'time': 1670670878, 'resto': 134463623}]",1670670878,,
71,134461362,12/09/22(Fri)21:35:43,Anonymous,Good night /co/,1559971990142,.png,1280,1707,187,250,1670639743171627,1670639743,6QggHIxzZ0lkQbrGsO3Avw==,3196006,0,0,0,good-night-co,5,13,3,8.0,3.0,"[{'no': 134464597, 'now': '12/10/22(Sat)03:21:37', 'name': 'Anonymous', 'com': '<a href=""#p134461362"" class=""quotelink"">&gt;&gt;134461362</a><br>very comfy', 'time': 1670660497, 'resto': 134461362}, {'no': 134465062, 'now': '12/10/22(Sat)04:34:50', 'name': 'Anonymous', 'com': '<a href=""#p134463443"" class=""quotelink"">&gt;&gt;134463443</a><br>I think they do, they’re just not notable enough to make the news.', 'time': 1670664890, 'resto': 134461362}, {'no': 134465065, 'now': '12/10/22(Sat)04:35:51', 'name': 'Anonymous', 'com': '<a href=""#p134461362"" class=""quotelink"">&gt;&gt;134461362</a><br>This is why carpeted apartments are fucking gross. You never know who lived there before you.', 'time': 1670664951, 'resto': 134461362}, {'no': 134465545, 'now': '12/10/22(Sat)05:58:14', 'name': 'Anonymous', 'com': 'Book on lucid dreaming lmfao', 'time': 1670669894, 'resto': 134461362}, {'no': 134465641, 'now': '12/10/22(Sat)06:14:38', 'name': 'Anonymous', 'com': '<a href=""#p134461362"" class=""quotelink"">&gt;&gt;134461362</a><br>I want OP to share his yellow special edition Coke with us', 'time': 1670670878, 'resto': 134461362}]",1670670878,,
72,134465325,12/10/22(Sat)05:16:38,Anonymous,Does /co/ like Spider-Ham?,09hpg020rl4a1,.png,720,1465,122,250,1670667398052417,1670667398,OWPuPzC4mdgKwRp6Z1h6XA==,1140023,0,0,0,does-co-like-spiderham,5,3,1,,,"[{'no': 134465493, 'now': '12/10/22(Sat)05:49:32', 'name': 'Anonymous', 'com': '<a href=""#p134465325"" class=""quotelink"">&gt;&gt;134465325</a><br>There are a lot of Spanish pork dishes, couldn&#039;t the writer come up with something more clever?<br><br>Miles Morcillas?', 'time': 1670669372, 'resto': 134465325}, {'no': 134465630, 'now': '12/10/22(Sat)06:13:04', 'name': 'Anonymous', 'com': 'Why is Spider-Ham wearing Spider-Cat&#039;s costume?', 'filename': 'IMG_1958', 'ext': '.jpg', 'w': 1338, 'h': 1480, 'tn_w': 113, 'tn_h': 125, 'tim': 1670670784460440, 'time': 1670670784, 'md5': 'UAZF+eauakeXKc757Fw0DA==', 'fsize': 298778, 'resto': 134465325}, {'no': 134465639, 'now': '12/10/22(Sat)06:14:08', 'name': 'Anonymous', 'com': 'This is fucking stupid, Miles is already an alternate universe Spider-Man and in the same class as Porker, making alternate universe Mileses or Porkers that branch off from them imply they&#039;re their own characters and not just what ifs', 'time': 1670670848, 'resto': 134465325}]",1670670848,,
73,134465385,12/10/22(Sat)05:26:45,Anonymous,Has this artist ever actually seen a wheelchair?,s7kvo7b0yk3a1,.jpg,1280,1541,207,249,1670668005616220,1670668005,Ddlk/rLst3oiK0IA8MOkrQ==,189311,0,0,0,has-this-artist-ever-actually-seen-a-wheelchair,5,11,1,6.0,1.0,"[{'no': 134465475, 'now': '12/10/22(Sat)05:45:44', 'name': 'Anonymous', 'com': 'Imagine what Babs feet smell like', 'time': 1670669144, 'resto': 134465385}, {'no': 134465567, 'now': '12/10/22(Sat)06:01:30', 'name': 'Anonymous', 'com': '<a href=""#p134465385"" class=""quotelink"">&gt;&gt;134465385</a><br>Looks like a purposeful artistic choice. A real wheelchair wouldn&#039;t show off her body nearly as well. <br><br>The chair is rendered enough so that you understand what&#039;s going on, but minimally enough that the target audience can still sexualize her. Otherwise it would obscure her shapely legs, butt, and torso. When&#039;s the last time you saw a wheelchair bound person with legs that nice?<br><br>Cheating things is the name of the game in illustration. The goal is not to draw things as they are, it&#039;s to draw them as you want/need to see them. Depicting things exactly as they are kind of seems to defeat the purpose of stuff like illustration and animation. Might as well just photobash scenes together if realism is what you want.', 'time': 1670670090, 'resto': 134465385}, {'no': 134465614, 'now': '12/10/22(Sat)06:10:09', 'name': 'Anonymous', 'com': '<a href=""#p134465385"" class=""quotelink"">&gt;&gt;134465385</a><br>Looks kind of cool desu, if it&#039;s consistent across the issue it&#039;s a cool design. Better than some jobber pulling out a medical journal to trace it or reference or whatever.<br>This does kind of look like he drew her sitting down and then tried to add wheels that made sense', 'time': 1670670609, 'resto': 134465385}, {'no': 134465619, 'now': '12/10/22(Sat)06:11:32', 'name': 'Anonymous', 'com': '<a href=""#p134465385"" class=""quotelink"">&gt;&gt;134465385</a><br>If the wheelchair is sleek enough they can pretend they didn&#039;t see it', 'time': 1670670692, 'resto': 134465385}, {'no': 134465638, 'now': '12/10/22(Sat)06:14:02', 'name': 'Anonymous', 'com': '<a href=""#p134465454"" class=""quotelink"">&gt;&gt;134465454</a><br>Dayum those trans niggas be mad like what kind of gender is this shiet', 'time': 1670670842, 'resto': 134465385}]",1670670842,,
74,134464255,12/10/22(Sat)02:27:46,Anonymous,who?,was he,.jpg,535,573,233,250,1670657266400327,1670657266,ItAq8RMZrg2oTPpaQoeDEQ==,30803,0,0,0,who,5,14,0,9.0,0.0,"[{'no': 134464917, 'now': '12/10/22(Sat)04:12:46', 'name': 'Anonymous', 'com': '<a href=""#p134464417"" class=""quotelink"">&gt;&gt;134464417</a><br>He&#039;s cool as shit, yes', 'time': 1670663566, 'resto': 134464255}, {'no': 134464999, 'now': '12/10/22(Sat)04:25:23', 'name': 'Anonymous', 'com': '<a href=""#p134464255"" class=""quotelink"">&gt;&gt;134464255</a><br>It&#039;s like asking who is Slade.<br>It&#039;s a fun mystery until you realize the Teen Titans don&#039;t have a life outside of being Teen Titans nor a relationship to Jump City in any meaningful capacity. Who the fuck COULD it be that actually matters? There&#039;s no significant cast of others that they could raw from.', 'time': 1670664323, 'resto': 134464255}, {'no': 134465396, 'now': '12/10/22(Sat)05:28:56', 'name': 'Anonymous', 'com': '<a href=""#p134464255"" class=""quotelink"">&gt;&gt;134464255</a><br>One of Slade&#039;s kids', 'time': 1670668136, 'resto': 134464255}, {'no': 134465529, 'now': '12/10/22(Sat)05:55:17', 'name': 'Anonymous', 'com': '<a href=""#p134464324"" class=""quotelink"">&gt;&gt;134464324</a><br>but how big is his Schwartz?', 'time': 1670669717, 'resto': 134464255}, {'no': 134465637, 'now': '12/10/22(Sat)06:14:01', 'name': 'Anonymous', 'com': '<a href=""#p134464255"" class=""quotelink"">&gt;&gt;134464255</a><br>An AI Robin had created that went out of control and took over his old suit.', 'time': 1670670841, 'resto': 134464255}]",1670670841,,
75,134464360,12/10/22(Sat)02:42:48,Anonymous,"OH MY GOD, THE VEGGIE FABLES! I love your Christian propaganda clumsily disguised as children&#039;s entertainment!",veggiefables,.jpg,1438,1080,250,187,1670658168988739,1670658168,rJbK+XFSBPNXDD9kNdGUyA==,240874,0,0,0,oh-my-god-the-veggie-fables-i-love-your-christian,5,16,1,11.0,0.0,"[{'no': 134465514, 'now': '12/10/22(Sat)05:52:15', 'name': 'Anonymous', 'com': '<a href=""#p134464749"" class=""quotelink"">&gt;&gt;134464749</a><br>It’s also Israel, they are a state after all with a massive NGO, official Jews-first policy in their founding documents, open and active desires to maximize their Jewish demographic, and offer free citizenship to all Jews across the world. I mean they don’t have no stake in their own country you know?', 'time': 1670669535, 'resto': 134464360}, {'no': 134465522, 'now': '12/10/22(Sat)05:54:14', 'name': 'Anonymous', 'com': '<a href=""#p134464492"" class=""quotelink"">&gt;&gt;134464492</a><br>Shut up goy', 'time': 1670669654, 'resto': 134464360}, {'no': 134465548, 'now': '12/10/22(Sat)05:58:53', 'name': 'Anonymous', 'com': '<a href=""#p134464425"" class=""quotelink"">&gt;&gt;134464425</a><br>You haven&#039;t had to put up with generations of self-inflated Evangelicals and hypocritical Catholics is why.<br>I imagine Euro public schools aren&#039;t forced to bow to &quot;what would make Jesus cry&quot; and the resultant force of minister-led soccer Moms.<br>Plus you guys are probably more comfortable with the inevitable organized kiddy-diddling.<br><br>It gets very, very tiresome.', 'filename': 'joel-osteen-the-power-of-i-am', 'ext': '.jpg', 'w': 415, 'h': 465, 'tn_w': 111, 'tn_h': 124, 'tim': 1670669933378092, 'time': 1670669933, 'md5': 'iHyfRLhG3k3/0rtbMx5FrQ==', 'fsize': 55155, 'resto': 134464360}, {'no': 134465560, 'now': '12/10/22(Sat)06:00:55', 'name': 'Anonymous', 'com': '<a href=""#p134465548"" class=""quotelink"">&gt;&gt;134465548</a><br>Of course they&#039;re comfortable with the kiddy diddling, actors and teachers do it all the time.', 'time': 1670670055, 'resto': 134464360}, {'no': 134465624, 'now': '12/10/22(Sat)06:11:59', 'name': 'Anonymous', 'com': '<a href=""#p134465514"" class=""quotelink"">&gt;&gt;134465514</a><br>That is a fair point.', 'time': 1670670719, 'resto': 134464360}]",1670670719,,
76,134465606,12/10/22(Sat)06:08:28,Anonymous,"<span class=""quote"">&gt;cartoon gets videos games years after it ended</span><br>Any other examples of this?",B2087979-5814-4031-89D1-E96D726051E4,.png,1448,701,250,121,1670670508021493,1670670508,J56o68YdltxnpcIdfVJZ1w==,1396254,0,0,0,cartoon-gets-videos-games-years-after-it-ended,5,0,0,,,,1670670508,,
77,134458648,12/09/22(Fri)17:46:58,Anonymous,Asian bf,1624479896726,.jpg,1920,1080,250,140,1670626018299788,1670626018,FV1KVkYJkbZSFU3AIoMlow==,1210673,0,0,0,asian-bf,5,22,11,17.0,7.0,"[{'no': 134463772, 'now': '12/10/22(Sat)01:32:37', 'name': 'Anonymous', 'com': '<a href=""#p134461495"" class=""quotelink"">&gt;&gt;134461495</a><br>You guys wouldn&#039;t actually FUCK a CAT, would you?', 'filename': '219572345234', 'ext': '.jpg', 'w': 540, 'h': 577, 'tn_w': 116, 'tn_h': 125, 'tim': 1670653957858151, 'time': 1670653957, 'md5': 'moz2QH4oPzFumlAajdDN2g==', 'fsize': 58934, 'resto': 134458648}, {'no': 134464150, 'now': '12/10/22(Sat)02:14:10', 'name': 'Anonymous', 'com': '<a href=""#p134463772"" class=""quotelink"">&gt;&gt;134463772</a><br>sapient cats don&#039;t count as bestiality, so it&#039;s not actually illegal to messily make out with a sexy cat, hearing thier low purring, awkwardly trying to avoid thier sharp teeth and rubbing your tounge raw on their rough one.', 'time': 1670656450, 'resto': 134458648}, {'no': 134465170, 'now': '12/10/22(Sat)04:53:43', 'name': 'Anonymous', 'com': 'autistic bf', 'filename': 'CCDC45D5-ECF0-4C35-BC45-36A60A489C66', 'ext': '.png', 'w': 265, 'h': 225, 'tn_w': 125, 'tn_h': 106, 'tim': 1670666023315920, 'time': 1670666023, 'md5': 'yLdN7gBPVO/DRzEMKBFEiw==', 'fsize': 116076, 'resto': 134458648}, {'no': 134465277, 'now': '12/10/22(Sat)05:09:49', 'name': 'Anonymous', 'com': '<a href=""#p134458773"" class=""quotelink"">&gt;&gt;134458773</a><br><span class=""quote"">&gt;tfwywn have a teenage life with a non-human girl like in your South Korean comics</span>', 'filename': '1669953840981991', 'ext': '.gif', 'w': 220, 'h': 220, 'tn_w': 125, 'tn_h': 125, 'tim': 1670666989017070, 'time': 1670666989, 'md5': 'xh1V1ogDKSdi8L4YS1y2qw==', 'fsize': 334891, 'resto': 134458648}, {'no': 134465596, 'now': '12/10/22(Sat)06:06:34', 'name': 'Anonymous', 'com': 'Iron GILF gf', 'filename': '118288624_702542090603298_953904547421004775_n', 'ext': '.jpg', 'w': 1024, 'h': 1024, 'tn_w': 125, 'tn_h': 125, 'tim': 1670670394944191, 'time': 1670670394, 'md5': 'Sr2wN10KJRO3CZzm/AMhnQ==', 'fsize': 144756, 'resto': 134458648}]",1670670394,,
78,134451751,12/09/22(Fri)07:54:29,Anonymous,Whatever happened to the TV series?<br>https://www.youtube.com/watch?v=ZCy<wbr>blMYxrXk,1559067941353,.jpg,630,933,168,250,1670590469708428,1670590469,9cyoskxMOOauHukO5wCqQw==,211867,0,0,0,wonder-park,5,33,3,28.0,3.0,"[{'no': 134462749, 'now': '12/09/22(Fri)23:32:07', 'name': 'Anonymous', 'com': '<a href=""#p134451751"" class=""quotelink"">&gt;&gt;134451751</a><br>The girl was cute af.', 'time': 1670646727, 'resto': 134451751}, {'no': 134462913, 'now': '12/09/22(Fri)23:52:51', 'name': 'Anonymous', 'com': '<a href=""#p134453869"" class=""quotelink"">&gt;&gt;134453869</a><br>Do you got any more of this you could share? At least post the first episode animated', 'time': 1670647971, 'resto': 134451751}, {'no': 134463551, 'now': '12/10/22(Sat)01:09:32', 'name': 'Anonymous', 'com': '<a href=""#p134451751"" class=""quotelink"">&gt;&gt;134451751</a><br>For some reason I keep thinking that this was supposed to be a Rollercoaster Tycoon movie adaption, but had to be reworked into Wonder Park when the rights fell through.', 'time': 1670652572, 'resto': 134451751}, {'no': 134465166, 'now': '12/10/22(Sat)04:52:44', 'name': 'Anonymous', 'com': 'I&#039;ve never heard of this.', 'time': 1670665964, 'resto': 134451751}, {'no': 134465594, 'now': '12/10/22(Sat)06:06:24', 'name': 'Anonymous', 'com': '<a href=""#p134453869"" class=""quotelink"">&gt;&gt;134453869</a><br>Submit this to Lost Media wiki', 'time': 1670670384, 'resto': 134451751}]",1670670384,Wonder Park,
79,134455487,12/09/22(Fri)13:54:54,Anonymous,https://www.youtube.com/watch?v=UTI<wbr>ZpZC8v5w,maxresdefault,.jpg,1280,720,250,140,1670612094688775,1670612094,fYhRYpXfWd6V+7j4QS/gFA==,158633,0,0,0,cartoon-network-christmas-stream,5,47,6,42.0,6.0,"[{'no': 134464671, 'now': '12/10/22(Sat)03:30:39', 'name': 'Anonymous', 'com': '<a href=""#p134461711"" class=""quotelink"">&gt;&gt;134461711</a><br>this list is inaccurate, its not what they are showing on the stream or at least not all of it', 'time': 1670661039, 'resto': 134455487}, {'no': 134464769, 'now': '12/10/22(Sat)03:46:05', 'name': 'Anonymous', 'com': '<span class=""quote"">&gt;Have you been relieving yourself on me this who time?</span>', 'time': 1670661965, 'resto': 134455487}, {'no': 134464797, 'now': '12/10/22(Sat)03:51:59', 'name': 'Anonymous', 'com': '<a href=""#p134461835"" class=""quotelink"">&gt;&gt;134461835</a><br><span class=""quote"">&gt;Tranime</span><br><span class=""quote"">&gt;Good</span><br>Fuck off back to your discord server faggot.', 'time': 1670662319, 'resto': 134455487}, {'no': 134465216, 'now': '12/10/22(Sat)05:01:35', 'name': 'Anonymous', 'com': 'Yay! N.A.U.G.H.T.Y!', 'time': 1670666495, 'resto': 134455487}, {'no': 134465586, 'now': '12/10/22(Sat)06:05:12', 'name': 'Anonymous', 'com': '<a href=""#p134455487"" class=""quotelink"">&gt;&gt;134455487</a><br>Die', 'time': 1670670312, 'resto': 134455487}]",1670670312,Cartoon Network Christmas Stream,
80,134463824,12/10/22(Sat)01:37:36,Anonymous,Team Avatar but actual good characters,MV5BMjFmYjEwMDMtOWI2Yi00NzcyLThhZGQtNTQ2M2QyNDEyODg4XkEyXkFqcGdeQXVyNDgyODgxNjE@._V1_FMjpg_UX1000_,.jpg,1000,1425,175,250,1670654256681078,1670654256,7DnTNsCb/IIBBGgf0cveWQ==,355404,0,0,0,team-avatar-but-actual-good-characters,5,8,0,3.0,0.0,"[{'no': 134465297, 'now': '12/10/22(Sat)05:12:21', 'name': 'Anonymous', 'com': '<a href=""#p134463824"" class=""quotelink"">&gt;&gt;134463824</a><br>Holy contrarian. They were all tropes voiced by generic voice-actors.', 'time': 1670667141, 'resto': 134463824}, {'no': 134465323, 'now': '12/10/22(Sat)05:16:30', 'name': 'Anonymous', 'com': '<a href=""#p134463824"" class=""quotelink"">&gt;&gt;134463824</a><br>How? Omi was annoying and Clay was the most one note generic cowboy character ever.', 'time': 1670667390, 'resto': 134463824}, {'no': 134465544, 'now': '12/10/22(Sat)05:58:12', 'name': 'Anonymous', 'com': '<a href=""#p134463824"" class=""quotelink"">&gt;&gt;134463824</a><br>Raymundo and sometimes Omi were the only complex characters, emphasis on only sometimes with Omi. Clay was based but one-note and Kimiko felt like they couldn&#039;t figure out what to do with her. Jack Spicer deservedly stole the show and his interactions with Wuya were a way more fun dynamic overall.', 'time': 1670669892, 'resto': 134463824}, {'no': 134465572, 'now': '12/10/22(Sat)06:02:37', 'name': 'Anonymous', 'com': '<a href=""#p134463824"" class=""quotelink"">&gt;&gt;134463824</a><br>The one time Nickelodeon was the ripoff.', 'time': 1670670157, 'resto': 134463824}, {'no': 134465580, 'now': '12/10/22(Sat)06:03:43', 'name': 'Anonymous', 'com': '<a href=""#p134465544"" class=""quotelink"">&gt;&gt;134465544</a><br><span class=""quote"">&gt;&gt;Raymundo and sometimes Omi were the only complex characters, emphasis on only sometimes with Omi. Clay was based but one-note and Kimiko felt like they couldn&#039;t figure out what to do with her. Jack</span><br>In hindsight, it kinda looks like the other three were just a background to Raimundo&#039;s development.<br><span class=""quote"">&gt;Jack Spicer deservedly stole the show and his interactions with Wuya were a way more fun dynamic overall.</span><br>True, but them going back to status quo in season 2 sucked ass. Keeping his fanboy obsession with Chase as his main relationship would work better.', 'time': 1670670223, 'resto': 134463824}]",1670670223,,
81,134464495,12/10/22(Sat)03:05:23,Anonymous,"<span class=""quote"">&gt;That&#039;s Mama Luigi to you, Mario!</span>",34190ED7-9AC5-4E7A-ADAD-11D9BA893B2B,.jpg,1000,742,250,185,1670659523257798,1670659523,nUHRSA91nvhiPa8dgdgm8A==,38806,0,0,0,thats-mama-luigi-to-you-mario,5,8,0,3.0,0.0,"[{'no': 134465284, 'now': '12/10/22(Sat)05:10:39', 'name': 'Anonymous', 'com': '<a href=""#p134465220"" class=""quotelink"">&gt;&gt;134465220</a><br>I was more of a fan of Hotel Mario', 'time': 1670667039, 'resto': 134464495}, {'no': 134465303, 'now': '12/10/22(Sat)05:13:20', 'name': 'Anonymous', 'com': '<a href=""#p134465284"" class=""quotelink"">&gt;&gt;134465284</a><br>There&#039;s more mileage to get out of Hotel Mario stuff than just Luigi saying &quot;That&#039;s Mama Luigi to you Mario! -wheeze-&quot;<br><br>The &quot;you spin me round&quot; thing was never funny either, never got why people did that one all the time.', 'time': 1670667200, 'resto': 134464495}, {'no': 134465469, 'now': '12/10/22(Sat)05:44:37', 'name': 'Anonymous', 'com': '<a href=""#p134465303"" class=""quotelink"">&gt;&gt;134465303</a><br>The cutscenes of Hotel Mario are only 6 minutes in total. Mama Luigi had more memes like Luigi saying &quot;bagel&quot; or yelling &quot;HELP&quot;.', 'time': 1670669077, 'resto': 134464495}, {'no': 134465518, 'now': '12/10/22(Sat)05:53:42', 'name': 'Anonymous', 'com': '<a href=""#p134465215"" class=""quotelink"">&gt;&gt;134465215</a><br>Unironically would have been a great choice, especially since the movie seems at least partially inspired by the Super Show.', 'time': 1670669622, 'resto': 134464495}, {'no': 134465577, 'now': '12/10/22(Sat)06:03:36', 'name': 'Anonymous', 'com': 'Wish I could find the early YTPs that I loved back in 2006.<br><a href=""#p134465518"" class=""quotelink"">&gt;&gt;134465518</a><br>It definitely does seem like they used Super Show for reference, which is a good thing. Yeah, the cartoon had obvious issues with animation errors, but it was a fun show and definitely kept the Mario feel.', 'time': 1670670216, 'resto': 134464495}]",1670670216,,
82,134451291,12/09/22(Fri)06:40:35,Anonymous,Night At The Museum: Kahmunrah Rises Again is out on Disney+ as the first 2D Walt Disney Pictures film in over a decade. How we feeling about it?,FjhYes0aYAAsoDT,.jpg,399,618,161,250,1670586035131381,1670586035,IrVumBP4Z3sYwg+V7Z0lOw==,67832,0,0,0,night-at-the-museum-kahmunrah-rises-again-is-out,5,37,6,32.0,4.0,"[{'no': 134463138, 'now': '12/10/22(Sat)00:21:16', 'name': 'Anonymous', 'com': 'Feels like a very long pilot for an animated series. Which is plenty possible that they&#039;re doing one.', 'time': 1670649676, 'resto': 134451291}, {'no': 134463469, 'now': '12/10/22(Sat)01:00:00', 'name': 'Anonymous', 'com': 'Attila the Hunk', 'filename': 'CD139AE9-AAD3-42AB-B962-8927E37317EC', 'ext': '.jpg', 'w': 1169, 'h': 1242, 'tn_w': 117, 'tn_h': 125, 'tim': 1670652000489746, 'time': 1670652000, 'md5': 'KVEa7cq4wmZY2QbLbDLceA==', 'fsize': 198597, 'resto': 134451291}, {'no': 134463640, 'now': '12/10/22(Sat)01:18:22', 'name': 'Anonymous', 'com': 'Final review is that I thought it was okay. the script is tight and everything seems to happen for a reason but the supporting cast overshadows the main character and I almost wish the movie somehow was about them and not the kid. They are fun and competent at what they do but you need to stop and give the MC something to do and feels forced, every bit of drama and conflict that he is involved feels somewhat forced and he just &quot;being there&quot; and having little to contribute with very little outside knowing music and in the end all he needs to play is 3 fucking notes? Weak sauce.<br><br>The movie drags a lot towards the beginning and middle, but the third act is actually really good and brought me back to it proving how tight the script. The animation also picks up and we do have a few cool action scenes towards the end but I can&#039;t help but picture this movie in a 90&#039;s classic style of animation like iron giant or Titan and you can see how much better it would have been. The jokes feel like classic disney somehow, like the Seth joke and the sort of villain he is and the pairing with the wannabe pharaoh, really felt like I was watching an mid 2000&#039;s Disney movie and you can tell. Lot&#039;s of darker jokes on this one too and most were pretty great. Overall is a 6;5, had potential to be better but is not really terrible. Really doesn&#039;t feel like an movie but more an episode from a series that somehow got stretched to be a entire movie but is not really bad. I can see people basically nitpicking and saying is terrible because it has the Disney brand associated and really is on the cheap side visually even if not deserving but is serviceable, I would show to my kids if I had any and wasn&#039;t a loser reviewing a children&#039;s movie at 3 AM in the middle of the week.<br><br>Best girl is definitely Joan but since I study occult stuff she would probably try to kill me, second best choice is the cat.', 'filename': '96027296', 'ext': '.jpg', 'w': 1280, 'h': 720, 'tn_w': 125, 'tn_h': 70, 'tim': 1670653102964864, 'time': 1670653102, 'md5': '2tEbcXOj29djhcP+JQ3/0A==', 'fsize': 75454, 'resto': 134451291}, {'no': 134464636, 'now': '12/10/22(Sat)03:26:49', 'name': 'Anonymous', 'com': '<a href=""#p134463640"" class=""quotelink"">&gt;&gt;134463640</a><br>I didn&#039;t watch the movie, is she a crusader berserker in this because she seems pretty chummy with several Pagans and is y&#039;know a falsely animated mannequin who just believes she&#039;s Joan of Arc', 'time': 1670660809, 'resto': 134451291}, {'no': 134465578, 'now': '12/10/22(Sat)06:03:36', 'name': 'Anonymous', 'com': '<a href=""#p134463027"" class=""quotelink"">&gt;&gt;134463027</a><br>Yes it’s the same director and lots of people who worked on that<br>Don’t think it matches up as good though, maybe because the depth of the characters in T3C is far better?', 'time': 1670670216, 'resto': 134451291}]",1670670216,,
