,no,now,name,com,filename,ext,w,h,tn_w,tn_h,tim,time,md5,fsize,resto,bumplimit,imagelimit,semantic_url,custom_spoiler,replies,images,omitted_posts,omitted_images,last_replies,last_modified,sub,trip
33,134463964,12/10/22(Sat)01:52:05,Anonymous,"<span class=""quote"">&gt;Hasbro brings back Beast Wars after years of nothing</span><br><span class=""quote"">&gt;Transformers gains popularity again</span><br>Based",4B8AA297-D00B-4D76-B9D3-1A79FB4C969A,.jpg,960,1167,205,250,1670655125562693,1670655125,0L36Q4nCQlmAeciLU6HPCA==,648405,0,0,0,hasbro-brings-back-beast-wars-after-years-of,5,36,3,31.0,2.0,"[{'no': 134465349, 'now': '12/10/22(Sat)05:20:23', 'name': 'Anonymous', 'com': '<a href=""#p134465118"" class=""quotelink"">&gt;&gt;134465118</a><br>The point being unnecessarrily angry because some out of dozens of versions of a character are different?', 'time': 1670667623, 'resto': 134463964}, {'no': 134465752, 'now': '12/10/22(Sat)06:39:18', 'name': 'Anonymous', 'com': '<a href=""#p134465263"" class=""quotelink"">&gt;&gt;134465263</a><br>It&#039;s mainly only a dig because it separates people who actually grew up loving Transformers as kids vs. Nu-&quot;fans&quot; who jumped on the bandwagon in recent years, likely because of all the SJW/LGBT crap in certain fiction. I don&#039;t actually begrudge people just for not having toys, it&#039;s just a certain kind of &quot;fan&quot;.<br><span class=""quote"">&gt;What about someone more interested in the toys than the cartoons/comics?</span><br>They&#039;re pure desu, interest rooted in just thinking transforming bots are cool, not gay shipping and other tumblr tier crap. <br><br><a href=""#p134465314"" class=""quotelink"">&gt;&gt;134465314</a><br><span class=""quote"">&gt;You are not representing everyone or even the majority.</span><br>Lol, yeah...IDW comic fans are the majority kek. Guess that&#039;s why IDW is going strong! All that money from fans paid off and that&#039;s why it&#039;s not cancelled. Unfortunate they cancelled the Generations and Studio Series toylines, the collector crowd just couldn&#039;t keep it going...sad. Toys are over.<br><span class=""quote"">&gt;My kids do and they inherited my 80&#039;s G1 collection I had brought them from the attic as well.</span><br>You don&#039;t have kids or a G1 collection. First if all no 80&#039;s boomer is having a conniption fit defending gay rights for Transformers, the jig was up the moment you posted. <br><span class=""quote"">&gt;I&#039;m not an autist who bases his life on plastic figures</span><br>Just apparently an autist who is &quot;dreaming of lesbian robots&quot; &quot;hoo rah, manly men...striaght men, thats what we do right guys? listen here queers we straight mentally stable men dream of HOT LESBIAN TRANSFORMERS, so STOP COMPLAINING ABOUT THE GAY SHIT&quot;. <br><br>First you want me to believe you dream of lesbo robots then you want me to believe a woman actually had your kids. Your little LARP was funny I&#039;ll give you that, but you&#039;re a gay retard.', 'time': 1670672358, 'resto': 134463964}, {'no': 134465823, 'now': '12/10/22(Sat)06:54:06', 'name': 'Anonymous', 'com': '<a href=""#p134465752"" class=""quotelink"">&gt;&gt;134465752</a><br>The only thing you&#039;ve proven with that vomit of buzzwords, projections and fallacies is that you aren&#039;t a mentally stable person. Next time just write &quot;I&#039;m an angry bigot&quot; and &quot;you&#039;re not a true Scotsman!&quot; and save everyone the displeasure of reading the mental diarrhea which fills your damaged brain.', 'time': 1670673246, 'resto': 134463964}, {'no': 134465845, 'now': '12/10/22(Sat)06:57:20', 'name': 'Anonymous', 'filename': '__optimus_primal_lio_convoy_and_big_convoy_transformers_and_3_more_drawn_by_matt_frank__558f89ce971b964cf29ea2a952469f3b', 'ext': '.jpg', 'w': 792, 'h': 1224, 'tn_w': 80, 'tn_h': 125, 'tim': 1670673440909855, 'time': 1670673440, 'md5': 'L0dLjcIZsB7zIq9muKkx0Q==', 'fsize': 1196961, 'resto': 134463964}, {'no': 134465848, 'now': '12/10/22(Sat)06:57:38', 'name': 'Anonymous', 'com': '<a href=""#p134464424"" class=""quotelink"">&gt;&gt;134464424</a><br>Do we have to get a robot director before they&#039;ll put a Transformer in the leading role in a Transformers movie?', 'time': 1670673458, 'resto': 134463964}]",1670673458,,
34,134465837,12/10/22(Sat)06:56:00,Anonymous,Appears that Universal stealth released a third season of the YouTube Woody Woodpecker shorts <br>https://www.youtube.com/playlist?li<wbr>st=PL0liVgDTrcuST04SFHjMVlpHQbTxiCJ<wbr>Gy,fwty,.jpg,1280,720,250,140,1670673360418172,1670673360,8Rj0dFdm/k2SHQElbLVvgQ==,124324,0,0,0,appears-that-universal-stealth-released-a-third,5,1,1,,,"[{'no': 134465843, 'now': '12/10/22(Sat)06:57:14', 'name': 'Anonymous', 'com': '<a href=""#p134465837"" class=""quotelink"">&gt;&gt;134465837</a><br>What a great thing to wake up to.', 'filename': '1650028840445', 'ext': '.png', 'w': 1672, 'h': 940, 'tn_w': 125, 'tn_h': 70, 'tim': 1670673434553332, 'time': 1670673434, 'md5': '8mcUz/a43nbl7g0ibrXALg==', 'fsize': 562722, 'resto': 134465837}]",1670673434,,
35,134460796,12/09/22(Fri)20:46:03,Anonymous,Recast them.,JL,.png,1640,1241,250,189,1670636763475918,1670636763,6IU1EdcvdhfcU0xOdnH+ug==,3202460,0,0,0,presume-gunn-safran-do-decide-to-reboot-the,5,18,5,13.0,5.0,"[{'no': 134462787, 'now': '12/09/22(Fri)23:35:40', 'name': 'Anonymous', 'com': '<a href=""#p134461867"" class=""quotelink"">&gt;&gt;134461867</a><br>For much of post-Crisis Superman, Luthor was older than Clark and they were definitely not childhood friends. That plot from the pre-crisis period only returned because of Smallville.', 'time': 1670646940, 'resto': 134460796}, {'no': 134464116, 'now': '12/10/22(Sat)02:11:15', 'name': 'Anonymous', 'com': '<a href=""#p134460796"" class=""quotelink"">&gt;&gt;134460796</a><br>all i know is i want daddario for wonder woman<br>if not her then antje traue', 'time': 1670656275, 'resto': 134460796}, {'no': 134464848, 'now': '12/10/22(Sat)04:00:28', 'name': 'Anonymous', 'com': '<a href=""#p134462726"" class=""quotelink"">&gt;&gt;134462726</a><br>Ben Affleck is gay, dude, that&#039;s why he ended up marrying his old fag hag', 'time': 1670662828, 'resto': 134460796}, {'no': 134465616, 'now': '12/10/22(Sat)06:11:04', 'name': 'Anonymous', 'com': '<a href=""#p134462737"" class=""quotelink"">&gt;&gt;134462737</a><br>nah he should be Tawky Tawny', 'time': 1670670664, 'resto': 134460796}, {'no': 134465838, 'now': '12/10/22(Sat)06:56:33', 'name': 'Anonymous', 'com': '<a href=""#p134460796"" class=""quotelink"">&gt;&gt;134460796</a><br>Rebooting the DCEU doesn’t mean they will recast beyond the flash. Why do people think this?', 'time': 1670673393, 'resto': 134460796}]",1670673393,Presume Gunn &amp; Safran do decide to reboot the entire DCU,
36,134465748,12/10/22(Sat)06:37:39,Anonymous,,0818216e623f65a81c393da2d23c3147 (2),.jpg,1814,2296,197,249,1670672259205530,1670672259,+qm2JfQhUyWGBcQQquHk0Q==,276670,0,0,0,steven-universe,5,4,1,,,"[{'no': 134465753, 'now': '12/10/22(Sat)06:39:52', 'name': 'Anonymous', 'com': '<a href=""#p134465748"" class=""quotelink"">&gt;&gt;134465748</a><br>FATTER', 'time': 1670672392, 'resto': 134465748}, {'no': 134465774, 'now': '12/10/22(Sat)06:43:43', 'name': 'Anonymous', 'com': '<a href=""#p134465748"" class=""quotelink"">&gt;&gt;134465748</a><br>Remind that Peridot is best gem than Spincel and Lapishitter', 'filename': 'il_570xN.3572929616_nt2l', 'ext': '.jpg', 'w': 570, 'h': 798, 'tn_w': 89, 'tn_h': 125, 'tim': 1670672623987213, 'time': 1670672623, 'md5': 'dbkBkWAIMu5ae+p9mHeiYg==', 'fsize': 62288, 'resto': 134465748}, {'no': 134465817, 'now': '12/10/22(Sat)06:52:14', 'name': 'Anonymous', 'com': '<a href=""#p134465753"" class=""quotelink"">&gt;&gt;134465753</a><br>How much fatter anon? <br><br>Peridot already big enough', 'time': 1670673134, 'resto': 134465748}, {'no': 134465830, 'now': '12/10/22(Sat)06:55:02', 'name': 'Anonymous', 'com': 'What do gem braps smell like?', 'time': 1670673302, 'resto': 134465748}]",1670673302,Steven Universe,
37,134462700,12/09/22(Fri)23:27:42,Anonymous,Scarred edition <br>or Frita-y<br>ha,6184338f331b82b778bb1fc2c992c9e90b59239f,.jpg,1179,1600,184,250,1670646462320715,1670646462,7NBpsXnQUt4d+WpQWiKDQQ==,349854,0,0,0,funbag-friday,5,41,32,36.0,30.0,"[{'no': 134465259, 'now': '12/10/22(Sat)05:06:56', 'name': 'Anonymous', 'com': '<a href=""#p134464315"" class=""quotelink"">&gt;&gt;134464315</a><br><a href=""#p134464500"" class=""quotelink"">&gt;&gt;134464500</a><br><a href=""#p134464547"" class=""quotelink"">&gt;&gt;134464547</a><br>More', 'time': 1670666816, 'resto': 134462700}, {'no': 134465305, 'now': '12/10/22(Sat)05:13:26', 'name': 'Anonymous', 'com': '<a href=""#p134465259"" class=""quotelink"">&gt;&gt;134465259</a>', 'filename': 'creative advertising', 'ext': '.jpg', 'w': 3216, 'h': 2560, 'tn_w': 124, 'tn_h': 99, 'tim': 1670667206446454, 'time': 1670667206, 'md5': 'qiuj7N7j2gDNSlMWB8m0gg==', 'fsize': 2826716, 'resto': 134462700}, {'no': 134465310, 'now': '12/10/22(Sat)05:14:17', 'name': 'Anonymous', 'com': '<a href=""#p134465305"" class=""quotelink"">&gt;&gt;134465305</a><br>Sex bomb indeed', 'time': 1670667257, 'resto': 134462700}, {'no': 134465324, 'now': '12/10/22(Sat)05:16:35', 'name': 'Anonymous', 'com': '<a href=""#p134465305"" class=""quotelink"">&gt;&gt;134465305</a><br>So close', 'time': 1670667395, 'resto': 134462700}, {'no': 134465826, 'now': '12/10/22(Sat)06:54:36', 'name': 'Anonymous', 'filename': 'all i want for christmas', 'ext': '.jpg', 'w': 602, 'h': 1024, 'tn_w': 73, 'tn_h': 125, 'tim': 1670673276551211, 'time': 1670673276, 'md5': 'tlX/svU4IAchvKDBjGTI4Q==', 'fsize': 164766, 'resto': 134462700}]",1670673276,Funbag Friday,
38,134452945,12/09/22(Fri)10:19:50,Anonymous,"The second book of The Life and Times of Scrooge McDuck by the brilliant Don Rosa. These stories were written and drawn in the period from 1987 to 2004. So this is a continuation of the first part, that is, it contains untold stories as far as The Life and Times of Scrooge McDuck is concerned. So enjoy. This covers from the time Scrooge was ten years old to the time he met his nephew Donald and Donald&#039;s nephews Huey, Dewey and Louie and his reunion with his sister Matilda. Enjoy! Music for it: https://www.youtube.com/watch?v=vTy<wbr>kcFxIESs<br><br>For those who haven&#039;t seen the first part, check out the previous thread here:<br><a href=""/co/thread/134405856#p134405856"" class=""quotelink"">&gt;&gt;134405856</a>",RCO001_1572578874,.jpg,1244,1600,194,250,1670599190090654,1670599190,FTAJzJuQnL3stOMBuJ82Lg==,720352,0,0,0,duck-comic-threadthe-life-and-times-of-scrooge,5,320,254,315.0,254.0,"[{'no': 134465114, 'now': '12/10/22(Sat)04:43:17', 'name': 'Anonymous', 'com': 'This is better than both versions of Ducktales.', 'time': 1670665397, 'resto': 134452945}, {'no': 134465421, 'now': '12/10/22(Sat)05:33:35', 'name': 'Anonymous', 'com': '<a href=""#p134463459"" class=""quotelink"">&gt;&gt;134463459</a><br>Goldie would classify as memories!', 'time': 1670668415, 'resto': 134452945}, {'no': 134465556, 'now': '12/10/22(Sat)06:00:01', 'name': 'Anonymous', 'com': '<a href=""#p134460668"" class=""quotelink"">&gt;&gt;134460668</a><br>I&#039;m late to the party but also want to express my gratitude. Solid storytime', 'time': 1670670001, 'resto': 134452945}, {'no': 134465803, 'now': '12/10/22(Sat)06:49:01', 'name': 'Anonymous', 'com': '<a href=""#p134463459"" class=""quotelink"">&gt;&gt;134463459</a><br>Brigitta.', 'time': 1670672941, 'resto': 134452945}, {'no': 134465824, 'now': '12/10/22(Sat)06:54:22', 'name': 'Anonymous', 'com': '<a href=""#p134465803"" class=""quotelink"">&gt;&gt;134465803</a><br>Sorry, accidentally used her swedish name.', 'time': 1670673262, 'resto': 134452945}]",1670673262,Duck Comic Thread-The Life and Times of Scrooge McDuck-Part 2-Storytime,
39,134461058,12/09/22(Fri)21:09:32,Anonymous,,1563188182000[1],.png,960,892,250,232,1670638172802411,1670638172,X/awdcbbBZoMB888JnwwGA==,1653482,0,0,0,who-should-spiderman-sister-wives-be,5,36,6,31.0,4.0,"[{'no': 134465654, 'now': '12/10/22(Sat)06:16:28', 'name': 'Anonymous', 'com': '<a href=""#p134465113"" class=""quotelink"">&gt;&gt;134465113</a>', 'filename': 'RCO020_1462607766', 'ext': '.jpg', 'w': 988, 'h': 1500, 'tn_w': 82, 'tn_h': 125, 'tim': 1670670988954363, 'time': 1670670988, 'md5': 'kepnnNq3Ro1/l/hmjwvgRQ==', 'fsize': 1259764, 'resto': 134461058}, {'no': 134465768, 'now': '12/10/22(Sat)06:42:35', 'name': 'Anonymous', 'com': 'When&#039;s Marvel going to acknowledge how popular this pairing is', 'filename': '1655995111183', 'ext': '.jpg', 'w': 2560, 'h': 1400, 'tn_w': 125, 'tn_h': 68, 'tim': 1670672555517865, 'time': 1670672555, 'md5': 'U9ov0lDmxAiC5yfp4fwT4w==', 'fsize': 1576188, 'resto': 134461058}, {'no': 134465780, 'now': '12/10/22(Sat)06:44:24', 'name': 'Anonymous', 'com': '<a href=""#p134465768"" class=""quotelink"">&gt;&gt;134465768</a><br>Once she graduates college, anything sooner risks upsetting the Twitter lards who don’t buy comics', 'time': 1670672664, 'resto': 134461058}, {'no': 134465788, 'now': '12/10/22(Sat)06:46:16', 'name': 'Anonymous', 'com': '<a href=""#p134465768"" class=""quotelink"">&gt;&gt;134465768</a><br>Literally the same pairing as Batman x Batgirl, which means never', 'time': 1670672776, 'resto': 134461058}, {'no': 134465819, 'now': '12/10/22(Sat)06:52:40', 'name': 'Anonymous', 'com': '<a href=""#p134465788"" class=""quotelink"">&gt;&gt;134465788</a><br>LMAO what', 'time': 1670673160, 'resto': 134461058}]",1670673160,Who should Spider-Man Sister Wives be?,
40,134462563,12/09/22(Fri)23:15:08,Anonymous,Why does everyone on /co/ hate 2000s and 90s cartoons and shows without lore and gay brown girls so much?,98E7C4F8-0C6B-4F9F-9A0E-67BEDDB3B64A,.jpg,1170,1353,216,250,1670645708161966,1670645708,ov+qI6gJrssLwClug+sSdA==,1742321,0,0,0,why-does-everyone-on-co-hate-2000s-and-90s,5,14,1,9.0,1.0,"[{'no': 134465704, 'now': '12/10/22(Sat)06:27:13', 'name': 'Anonymous', 'com': '<a href=""#p134462563"" class=""quotelink"">&gt;&gt;134462563</a><br>Because like me they grew up on Rugrats and Dexter&#039;s lab and they genuinely are not as good as some of the best modern shows. There&#039;s a lot of garbage now, but the good shows are better than the good shows were in the past. I have nothing but maxed out nostalgia stats for things like Ed, Edd and Eddy, but you can&#039;t watch The Owl House and not be jealous that people get to grow up now with much, much better shows.', 'time': 1670671633, 'resto': 134462563}, {'no': 134465718, 'now': '12/10/22(Sat)06:29:34', 'name': 'Anonymous', 'com': '<a href=""#p134465704"" class=""quotelink"">&gt;&gt;134465704</a><br><span class=""quote"">&gt;Owl House</span><br><span class=""quote"">&gt;Amazing</span>', 'time': 1670671774, 'resto': 134462563}, {'no': 134465784, 'now': '12/10/22(Sat)06:45:30', 'name': 'Anonymous', 'com': '<a href=""#p134462563"" class=""quotelink"">&gt;&gt;134462563</a><br><a href=""/co/thread/134465773#p134465773"" class=""quotelink"">&gt;&gt;134465773</a> <br><br>Made a thread for you OP!', 'time': 1670672730, 'resto': 134462563}, {'no': 134465809, 'now': '12/10/22(Sat)06:50:33', 'name': 'Anonymous', 'com': '<a href=""#p134462563"" class=""quotelink"">&gt;&gt;134462563</a><br>Look at how ugly everything in that picture is. Jesus, man. The style being ugly really is a valid argument', 'time': 1670673033, 'resto': 134462563}, {'no': 134465818, 'now': '12/10/22(Sat)06:52:21', 'name': 'Anonymous', 'com': '<a href=""#p134465809"" class=""quotelink"">&gt;&gt;134465809</a><br>Everyone on /co/ agrees! Fuck 90s and 2000s. Fuck them all, they wish they could come close to the amazing modern times.', 'time': 1670673141, 'resto': 134462563}]",1670673141,,
41,134459822,12/09/22(Fri)19:23:03,Anonymous,look what just showed up in the mail bros,20221209_192219,.jpg,1960,3158,155,250,1670631783667129,1670631783,ujcC3btfiT4XJWr/86J0pA==,2995923,0,0,0,look-what-just-showed-up-in-the-mail-bros,5,22,0,17.0,0.0,"[{'no': 134464570, 'now': '12/10/22(Sat)03:16:48', 'name': 'Anonymous', 'com': 'based', 'time': 1670660208, 'resto': 134459822}, {'no': 134464854, 'now': '12/10/22(Sat)04:01:44', 'name': 'Anonymous', 'com': '<a href=""#p134459910"" class=""quotelink"">&gt;&gt;134459910</a><br>amazons attack', 'time': 1670662904, 'resto': 134459822}, {'no': 134465613, 'now': '12/10/22(Sat)06:10:00', 'name': 'Anonymous', 'com': '<a href=""#p134459910"" class=""quotelink"">&gt;&gt;134459910</a><br>it&#039;s not good but we&#039;e literally living the era of worst dc events ever right now', 'time': 1670670600, 'resto': 134459822}, {'no': 134465807, 'now': '12/10/22(Sat)06:50:00', 'name': 'Anonymous', 'com': '<a href=""#p134459822"" class=""quotelink"">&gt;&gt;134459822</a><br>Damn dude, hope you enjoy the free mini-posters inside!', 'time': 1670673000, 'resto': 134459822}, {'no': 134465814, 'now': '12/10/22(Sat)06:51:07', 'name': 'Anonymous', 'com': '<a href=""#p134465807"" class=""quotelink"">&gt;&gt;134465807</a><br>Nah special &quot;printing error&quot; edition that happened to be printed without the posted pages, super rare according to the seller so I paid an extra $100 for it', 'time': 1670673067, 'resto': 134459822}]",1670673067,,
42,134459230,12/09/22(Fri)18:32:56,Anonymous,"<span class=""quote"">&gt;After the vampiric Batman had been put to rest in peace after draining and killing the Joker, crime steadily rises in Gotham City, and without the caped crusader to protect the innocent and the police powerless to fight against the Scarecrow, Poison Ivy, the Riddler and the Penguin. Alfred decide to remove the stake from Batman’s chest, awakening as maddened undead because he was in a death-like state where he was conscient but not really dead because they forgot to behead him. Desperate to feast after tasting blood for the first time on the Joker, the Batman starts a killing spree over Gothan City’ criminals, first with the Penguin and his gang, but in order to not create further vampires, he beheads all his victims and send their heads to GCPD.</span>",Batman-Crimson_Mist_pg000_GCPDGuy,.jpg,1029,1553,165,250,1670628776531594,1670628776,2jykPl8OVSQP3OnC/QQzmg==,158823,0,0,0,batman-dracula-crimson-mist-storytime,5,136,105,131.0,103.0,"[{'no': 134465197, 'now': '12/10/22(Sat)04:58:38', 'name': 'Anonymous', 'filename': '0C3E055C-6F86-47DE-B46D-430F3E5C4FD7', 'ext': '.jpg', 'w': 1080, 'h': 1350, 'tn_w': 100, 'tn_h': 125, 'tim': 1670666318865508, 'time': 1670666318, 'md5': 'TiZ0sUpcsn0uDW12l259ag==', 'fsize': 510874, 'resto': 134459230}, {'no': 134465610, 'now': '12/10/22(Sat)06:08:59', 'name': 'Anonymous', 'com': 'Kino', 'time': 1670670539, 'resto': 134459230}, {'no': 134465715, 'now': '12/10/22(Sat)06:29:13', 'name': 'Anonymous', 'com': 'Is there a storytime for the other two? I remember the second one being the best. Also horny as fuck.', 'time': 1670671753, 'resto': 134459230}, {'no': 134465765, 'now': '12/10/22(Sat)06:41:58', 'name': 'Anonymous', 'com': 'Need more vampire Batman in my life', 'time': 1670672518, 'resto': 134459230}, {'no': 134465801, 'now': '12/10/22(Sat)06:48:52', 'name': 'Anonymous', 'com': '<a href=""#p134465715"" class=""quotelink"">&gt;&gt;134465715</a><br><span class=""quote"">&gt;that werecat selina</span>', 'filename': 'the-cat-woman-batman-selina-kyle-bloodstorm', 'ext': '.jpg', 'w': 987, 'h': 612, 'tn_w': 125, 'tn_h': 77, 'tim': 1670672932954092, 'time': 1670672932, 'md5': '3a9aHOl6GTG/2Mm/iRmnYg==', 'fsize': 301329, 'resto': 134459230}]",1670672932,Batman &amp; Dracula: Crimson Mist Storytime,
43,134463120,12/10/22(Sat)00:19:19,Anonymous,"Rogue, my hot wife.",1670649537833,.jpg,1375,1500,229,250,1670649559248262,1670649559,0aa2c//ZZwd99mtrpB4Thw==,500258,0,0,0,rogue-my-hot-wife,5,21,6,16.0,6.0,"[{'no': 134465362, 'now': '12/10/22(Sat)05:22:10', 'name': 'Anonymous', 'com': '<a href=""#p134463719"" class=""quotelink"">&gt;&gt;134463719</a><br>What?', 'time': 1670667730, 'resto': 134463120}, {'no': 134465601, 'now': '12/10/22(Sat)06:07:41', 'name': 'Anonymous', 'com': '<a href=""#p134465362"" class=""quotelink"">&gt;&gt;134465362</a><br><span class=""quote"">&gt;he doesnt know</span>', 'time': 1670670461, 'resto': 134463120}, {'no': 134465723, 'now': '12/10/22(Sat)06:30:55', 'name': 'Anonymous', 'com': 'this woman is only carried by the trainer game', 'time': 1670671855, 'resto': 134463120}, {'no': 134465795, 'now': '12/10/22(Sat)06:47:34', 'name': 'Anonymous', 'com': '<a href=""#p134463120"" class=""quotelink"">&gt;&gt;134463120</a><br><a href=""#p134465278"" class=""quotelink"">&gt;&gt;134465278</a><br>you should request her in bikini on the drawthread', 'time': 1670672854, 'resto': 134463120}, {'no': 134465797, 'now': '12/10/22(Sat)06:47:44', 'name': 'Anonymous', 'com': '<a href=""#p134465723"" class=""quotelink"">&gt;&gt;134465723</a><br>She&#039;s not even the best girl in it, Evo Rogue is great on her own.', 'time': 1670672864, 'resto': 134463120}]",1670672864,,
44,134463430,12/10/22(Sat)00:56:18,Anonymous,How did old creators pull being political without insulting its audience?,Batman-The-Dark-Knight-Returns-Psychologist[1],.png,1803,687,249,95,1670651778051024,1670651778,xIGH1mlqxXoMpy5EdFrONw==,1564942,0,0,0,how-did-old-creators-pull-being-political-without,5,80,7,75.0,6.0,"[{'no': 134465709, 'now': '12/10/22(Sat)06:28:06', 'name': 'Anonymous', 'com': '<a href=""#p134464307"" class=""quotelink"">&gt;&gt;134464307</a><br><span class=""quote"">&gt;Natural disasters made worse by government ineptitude are the result of the free market and we need more government involvement in the economy!</span>', 'time': 1670671686, 'resto': 134463430}, {'no': 134465770, 'now': '12/10/22(Sat)06:42:58', 'name': 'Anonymous', 'com': '<a href=""#p134463441"" class=""quotelink"">&gt;&gt;134463441</a><br>Thank u fer yer input now let me rkommand you<br><br><a href=""//boards.4channel.org/lgbt/"" class=""quotelink"">&gt;&gt;&gt;/lgbt/</a>', 'time': 1670672578, 'resto': 134463430}, {'no': 134465778, 'now': '12/10/22(Sat)06:44:03', 'name': 'Anonymous', 'com': '<a href=""#p134464241"" class=""quotelink"">&gt;&gt;134464241</a><br>Except they do, dummy', 'time': 1670672643, 'resto': 134463430}, {'no': 134465794, 'now': '12/10/22(Sat)06:47:32', 'name': 'Anonymous', 'com': '<a href=""#p134463725"" class=""quotelink"">&gt;&gt;134463725</a><br><span class=""quote"">&gt;cities like New York were trying to clean up their crime problems under Republican mayors</span><br>And admittedly succeeded, New York in the 90s and New York in the 80s were like night and day.<br>We&#039;re now going back to 80s New York at breakneck speed. If you&#039;re serious about crime you need guys like Giuliani - cause let&#039;s be honest, Democrats are not serious about crime.', 'time': 1670672852, 'resto': 134463430}, {'no': 134465811, 'now': '12/10/22(Sat)06:50:36', 'name': 'Anonymous', 'com': '<a href=""#p134463430"" class=""quotelink"">&gt;&gt;134463430</a><br><span class=""quote"">&gt;How did old creators pull being political without insulting its audience?</span><br>They didn&#039;t. You&#039;re just fortunate enough to not be aware of the various hamfisted political stories or pages from the 1930 to the 1990s.<br>Or you&#039;re just feigning ignorance in order to make a crappy politics thread.', 'filename': '10.ADAMS-GL-GA-168-169-ASR-2', 'ext': '.jpg', 'w': 1297, 'h': 936, 'tn_w': 124, 'tn_h': 90, 'tim': 1670673036437438, 'time': 1670673036, 'md5': 'RS3ve1PwaDse80JU+Y0rqQ==', 'fsize': 2140095, 'resto': 134463430}]",1670673036,,
45,134465773,12/10/22(Sat)06:43:27,Anonymous,"I hate 90s cartoons<br>Yes I do<br>I hate 90s cartoons<br>And so do you!<br>Loreless shit<br>Ugly styles<br>They don’t match the new stuff by miles<br>Non episodic<br>Humor reliant<br>Ugh, I just don’t want it<br>Waifu and husbando free<br>No POC<br>Absolute garbage <br>Totally shitty<br>No diverse gay rep<br>Too afraid to take a big step<br>Anyone who likes them is totally inept<br>Garbage plots<br>No char development to be sought<br>I watch 90s and my brain rots<br>I hate 90s cartoons yes I do<br>I hate 90s cartoons<br>And so do you<br><br>Sing it with me /co/! All together!",4C100D19-FE2F-475E-9AE8-9AB677D33FA5,.gif,498,280,250,140,1670672607228506,1670672607,vgf+cFCgSEQD5/DWn94VIQ==,1015613,0,0,0,co-anthem,5,7,1,2.0,1.0,"[{'no': 134465792, 'now': '12/10/22(Sat)06:46:59', 'name': 'Anonymous', 'com': '<a href=""#p134465773"" class=""quotelink"">&gt;&gt;134465773</a><br>There just wasn&#039;t any decent waifus tier cartoon girls in the 90&#039;s.', 'time': 1670672819, 'resto': 134465773}, {'no': 134465798, 'now': '12/10/22(Sat)06:47:55', 'name': 'Anonymous', 'com': '<a href=""#p134465773"" class=""quotelink"">&gt;&gt;134465773</a><br>Nigger kill yourself', 'time': 1670672875, 'resto': 134465773}, {'no': 134465800, 'now': '12/10/22(Sat)06:48:48', 'name': 'Anonymous', 'com': '<a href=""#p134465792"" class=""quotelink"">&gt;&gt;134465792</a><br>This this this! Sing with me /co/! This is our anthem!', 'time': 1670672928, 'resto': 134465773}, {'no': 134465805, 'now': '12/10/22(Sat)06:49:49', 'name': 'Anonymous', 'com': '<a href=""#p134465798"" class=""quotelink"">&gt;&gt;134465798</a><br>Sorry that everyone on /co/ agrees', 'time': 1670672989, 'resto': 134465773}, {'no': 134465827, 'now': '12/10/22(Sat)06:54:48', 'name': 'Anonymous', 'com': '<a href=""#p134465783"" class=""quotelink"">&gt;&gt;134465783</a><br>Nah, it’s not. It’s just modern cartoons are beautifully made, have lore and have thought into them. Everyone on /co/ hates 90s and 2000s bullshit. It’s ugly and relys on humor and episodic shit. Don’t be schizo, dude. Everyone here hates boomer cartoons.', 'time': 1670673288, 'resto': 134465773}]",1670673288,/co/ anthem,
